segmentnr	original	analyzed
MBSritattvacintamani_1-5_HK-1075	prathame ākāram, tṛtīyacatuṣkasya prathame ikāram, caturthacatuṣkasya prathame īkāram |	prathame ākāram tṛtīya catuṣkasya prathame ikāram caturtha catuṣkasya prathame īkāram 
MBSritattvacintamani_1-5_HK-1076	evamādyacatuṣkasya dvitīye ukāram, dvitīyacatuṣkasya dvitīye ūkāram, tṛtīyacatuṣkasya dvitīye	evamādya catuṣkasya dvitīye ukāram dvitīya catuṣkasya dvitīye ūkāram tṛtīya catuṣkasya dvitīye 
MBSritattvacintamani_1-5_HK-1077	ṛkāram, caturthacatuṣkasya dvitīye ṛkāram | evamādyacatuṣkasya tṛtīye ḷkāram, dvitīya-catuṣkasya	ṛkāram caturtha catuṣkasya dvitīye ṛkāram evamādya catuṣkasya tṛtīye ḷkāram dvitīya catuṣkasya 
MBSritattvacintamani_1-5_HK-1078	tṛtīye ḹkāram, tṛtīyacatuṣkasya tṛtīye ekāram, caturthacatuṣkasya tṛtīye aikāram | evaṃ	tṛtīye ḹkāram tṛtīya catuṣkasya tṛtīye ekāram caturtha catuṣkasya tṛtīye aikāram evam 
MBSritattvacintamani_1-5_HK-1079	prathamacatuṣkasya caturthe okāram, dvitīyacatuṣkasya caturthe aukāram, tṛtīyaścatuṣkasya caturthe	prathama catuṣkasya caturthe okāram dvitīya catuṣkasya caturthe aukāram tṛtīya ścatuṣkasya caturthe 
MBSritattvacintamani_1-5_HK-1080	aṃkāram, caturthacatuṣkasya caturthe aḥkāraṃ likhet | iti svaravarṇanyāsakramaḥ | evamanenaiva	aṃkāram caturtha catuṣkasya caturthe aḥkāram likhet iti svara varṇa nyāsa kramaḥ evam anena eva 
MBSritattvacintamani_1-5_HK-1081	krameṇa kakārādikṣakārāntān varṇān likhet | tathāca prathamacatuṣkasya prathame koṣṭhe	krameṇa kakāra ādi kṣakāra antān varṇān likhet tathā ca prathama catuṣkasya prathame koṣṭhe 
MBSritattvacintamani_1-5_HK-1082	kakāram, dvitīyacatuṣkasya prathame khakāram, tṛtīyacatuṣkasya prathame gakāram, caturthacatuṣkasya	kakāram dvitīya catuṣkasya prathame khakāram tṛtīya catuṣkasya prathame gakāram caturtha catuṣkasya 
MBSritattvacintamani_1-5_HK-1083	prathame ghakāraṃ likhet, evamanayā rītyā ṅakārādīnāṃ kṣakārāntānāmapareṣāmapi	prathame ghakāram likhet evam anayā rītyā ṅakāra ādīnām kṣakāra antānām apareṣām api 
MBSritattvacintamani_1-5_HK-1084	varṇānāṃ prādakṣiṇyena punaḥ punarāvṛttyā nyāsaḥ kartavya iti | atra 	varṇānām prādakṣiṇyena punar punarāvṛttyā nyāsaḥ kartavyaḥ iti atra 
MBSritattvacintamani_1-5_HK-1085	akārādihakārāntaṃ mūlakoṣṭhāditaḥ sudhīḥ |	akāra ādi hakāra antam mūlakoṣṭha āditaḥ sudhīḥ 
MBSritattvacintamani_1-5_HK-1086	dakṣiṇāvartayogena koṣṭhe varṇāllikhet sudhīḥ ||	dakṣiṇa āvarta yogena koṣṭhe varṇān likhet sudhīḥ 
MBSritattvacintamani_1-5_HK-1087	iti tantrasāradhṛtaviśvasāravacanena akārādihakārāntānāṃ varṇānāṃ cakre sanniveśa upadiśyate,	iti tantrasāra dhṛta viśvasāra vacanena akāra ādi hakāra antānām varṇānām cakre sanniveśaḥ upadiśyate 
MBSritattvacintamani_1-5_HK-1088	tataśca halakṣāṃśca likhettataḥ iti śrītattvacintāmaṇivacanena saha tantrasāravacanavirodhaḥ syāt |	tatas ca ha lakṣān ca likhet tatas iti śrī tattvacintāmaṇi vacanena saha tantrasāra vacana virodhaḥ syāt 
MBSritattvacintamani_1-5_HK-1089	rudrajāmalīyapañcamapaṭale akathahacakraprakaraṇe 	rudrajāmalīya pañcama paṭale a katha ha cakra prakaraṇe 
MBSritattvacintamani_1-5_HK-1090	akārādikṣakārāntaṃ likhitvā gaṇayettataḥ | iti |	akāra ādi kṣakāra antam likhitvā gaṇayet tatas iti 
MBSritattvacintamani_1-5_HK-1091	tantrarājatantraprathamapaṭale ca 	tantrarāja tantra prathama paṭale ca 
MBSritattvacintamani_1-5_HK-1092	evaṃ caturṣu koṣṭheṣu kṣāntāvadhi samālikhet |	evam caturṣu koṣṭheṣu kṣānta avadhi samālikhet 
MBSritattvacintamani_1-5_HK-1093	ityuktam, etadapi vacanadvayam akārādikṣakārāntavarṇa-sanniveśanasyaiva samarthakam | prakṛte	iti uktam etat api vacana dvayam akāra ādi kṣakāra anta varṇa sanniveśanasya eva samarthakam prakṛte 
MBSritattvacintamani_1-5_HK-1094	tathānaṅgīkāre lādikṣādināmnāṃ dīkṣārthināṃ mantravicārāsambhavaḥ |	tathā anaṅgīkāre lādi kṣa ādi nāmnām dīkṣā arthinām mantra vicāra asambhavaḥ 
MBSritattvacintamani_1-5_HK-1095	ato'kārādikṣakārānta-	a ta ukāra ādi kṣakāra anta 
MBSritattvacintamani_1-5_HK-1096	mityākārakaṃ viśvasāravacanaṃ vikṛtaṃ sadakārādihakārāntamityākāreṇādhunātaneṣu	miti ākārakam viśvasāra vacanam vikṛtam sat akāra ādi hakāra antam iti ākāreṇa adhunātaneṣu 
MBSritattvacintamani_1-5_HK-1097	tantrasāreṣu vartata iti pratīmaḥ | na ca 	tantrasāreṣu vartate iti pratīmaḥ na ca 
MBSritattvacintamani_1-5_HK-1098	apabhraṃśākṣaraṃ la-kṣau hitvā ṣaṇḍacatuṣṭayam |	apabhraṃśa akṣaram lakṣau hitvā ṣaṇḍa catuṣṭayam 
MBSritattvacintamani_1-5_HK-1099	mantrākṣaraiḥ sahaikaikaṃ nāmavarṇān viśodhayet ||	mantra akṣaraiḥ saha ekaikam nāma varṇān viśodhayet 
MBSritattvacintamani_1-5_HK-1100	ityāgamatattvavilāsa-rāghavabhaṭṭadhṛtapiṅgalāmatavacane lakṣayorvarjanadarśanāt	iti āgama tattvavilāsa rāghavabhaṭṭa dhṛta piṅgalā mata vacane lakṣayoḥ varjana darśanāt 
MBSritattvacintamani_1-5_HK-1101	prāguktatantrasāravacanamaviruddhamiti vācyam, prāguktapiṅgalāmatavacanasya svaravyañjanabhedabhinna-	prāk ukta tantrasāra vacanam aviruddham iti vācyam prāk ukta piṅgalā mata vacanasya svara vyañjana bheda bhinna 
MBSritattvacintamani_1-5_HK-1102	nāmamantraghaṭakapratyakṣaraśodhanaviṣayatvāt | ata eva rāghavabhaṭṭena  piṅgalāmate	                                                                          
MBSritattvacintamani_1-5_HK-1103	pratyakṣaraṃ siddhādigaṇanoktā |	pratyakṣaram siddha ādi gaṇanā uktā 
MBSritattvacintamani_1-5_HK-1104	mātāpitṛkṛtaṃ nāma yaccāpyabhijanaiḥ kṛtam |	mātā pitṛ kṛtam nāma yat ca api abhijanaiḥ kṛtam 
MBSritattvacintamani_1-5_HK-1105	viśliṣya tatra vai varṇān svaravyañjanabhedataḥ ||	viśliṣya tatra vai varṇān svara vyañjana bhedataḥ 
MBSritattvacintamani_1-5_HK-1106	tathaiva mantrabījāni tataḥ śodhanamārabhet |	tathā eva mantra bījāni tatas śodhanam ārabhet 
MBSritattvacintamani_1-5_HK-1107	bindudvibindukopadhmānīyajihvānghrisambhavān |	                
MBSritattvacintamani_1-5_HK-1108	saṃhatoccāraṇaprāptamadhikākṣarameva ca ||	saṃhata uccāraṇa prāptam adhika akṣaram eva ca 
MBSritattvacintamani_1-5_HK-1109	ityupakramya apabhraṃśākṣaramityādyuktvā	iti upakramya apabhraṃśa akṣaram ityādi uktvā 
MBSritattvacintamani_1-5_HK-1110	vyañjanairvyañjanānyeva svaraiḥ sākaṃ svarāṃstathā |	vyañjanaiḥ vyañjanāni eva svaraiḥ sākam svarān tathā 
MBSritattvacintamani_1-5_HK-1111	ādyamādyena saṃśodhya dvitīyena dvitīyakam ||	ādyam ādyena saṃśodhya dvitīyena dvitīyakam 
MBSritattvacintamani_1-5_HK-1112	ityādinā tasya pratyakṣaraśodhanarūpakalpāntaratvamuktam | api ca apabhraṃśetyādipiṅgalāmatavacane	ityādinā tasya pratyakṣara śodhana rūpa kalpa antara tvam uktam api ca apabhraṃśa ityādi piṅgalā mata vacane 
MBSritattvacintamani_1-5_HK-1113	ṣaṇḍacatuṣṭayamityanena ṛ ṝ ḷ ḹ saṃjñakānāṃ napuṃsakārṇānāmapi varjanaṃ tasya	ṣaṇḍa catuṣṭayam iti anena ṛ ṝ ḷ ḹ saṃjñakānām napuṃsaka arṇānām api varjanam tasya 
MBSritattvacintamani_1-5_HK-1114	kalpāntaratvaṃ pramāṇayati | tataśca nāmamantrādyakṣaraśodhana-vidhāyake kalpe'smin	kalpa antara tvam pramāṇayati tatas ca nāma mantra ādi akṣara śodhana vidhāyake kalpe asmin 
MBSritattvacintamani_1-5_HK-1115	lakṣayorādānaṃ yuktameveti sarvamavadātam |	lakṣayoḥ ādānam yuktam eva iti sarvam avadātam 
MBSritattvacintamani_1-5_HK-1116	tantrarājantre prathamapaṭale 	tantrarājantre prathama paṭale 
MBSritattvacintamani_1-5_HK-1117	catuścaturvibhāgena kalpayettāni vai kramāt |	catur catur vibhāgena kalpayet tāni vai kramāt 
MBSritattvacintamani_1-5_HK-1118	prathamaprathame tvādyaṃ dvitīyaprathame tathā ||	prathama prathame tu ādyam dvitīya prathame tathā 
MBSritattvacintamani_1-5_HK-1119	dvitīyamanyataścānyattathānyadapi kalpayet |	dvitīyam anyatas ca anyat tathā anyat api kalpayet 
MBSritattvacintamani_1-5_HK-1120	tattatkoṣṭheṣu vilikhettattatpañcamamakṣaram |	tad tad koṣṭheṣu vilikhet tat tat pañcamam akṣaram 
MBSritattvacintamani_1-5_HK-1121	evaṃ caturṣu koṣṭheṣu kṣāntāvadhi samālikhet ||	evam caturṣu koṣṭheṣu kṣānta avadhi samālikhet 
MBSritattvacintamani_1-5_HK-1122	ityādi-vacanairapīyameva varṇasthāpanāparipāṭī nirūpitā | viśadīkṛtametat	ityādi vacanaiḥ api iyam eva varṇa sthāpanā paripāṭī nirūpitā viśadīkṛtam etat 
MBSritattvacintamani_1-5_HK-1123	tantrarājaprathamapaṭalaṭīkāyāṃ subhagānandanāthena 	tantrarāja prathama paṭala ṭīkāyām subhagānandanāthena 
MBSritattvacintamani_1-5_HK-1124	evaṃ likhite sati prathamacatuṣkaprathamakoṣṭhe a ka tha ha iti catvāryakṣarāṇi |	evam likhite sati prathama catuṣka prathama koṣṭhe a ka tha ha iti catvāri akṣarāṇi 
MBSritattvacintamani_1-5_HK-1125	(tatra mantragaṇanākramaḥ)	tatra mantra gaṇanā kramaḥ 
MBSritattvacintamani_1-5_HK-1126	nijanāmādivarṇantu yasmin koṣṭhe pradṛśyate |	nija nāma ādi varṇam tu yasmin koṣṭhe pradṛśyate 
MBSritattvacintamani_1-5_HK-1127	tatkoṣṭhād gaṇayenmantrī mantrasyādyakṣarāvadhi || 60 ||	tad koṣṭhāt gaṇayet mantrī mantrasya ādi akṣara avadhi 
MBSritattvacintamani_1-5_HK-1128	siddhasiddhaṃ siddhasādhyaṃ siddhasusiddhameva ca |	siddhasiddham siddhasādhyam siddhasusiddham eva ca 
MBSritattvacintamani_1-5_HK-1129	siddhāriñca krameṇaiva sādhyakoṣṭhe likhettataḥ || 61 ||	siddhārin ca krameṇa eva sādhya koṣṭhe likhet tatas 
MBSritattvacintamani_1-5_HK-1130	sādhyasiddhaṃ sādhyasādhyaṃ sādhyasusiddhameva ca |	sādhya siddham sādhya sādhyam sādhya susiddham eva ca 
MBSritattvacintamani_1-5_HK-1131	sādhyāriñca krameṇaiva susiddhe gaṇayed budhaḥ || 62 ||	krameṇa eva susiddhe gaṇayet budhaḥ  /
MBSritattvacintamani_1-5_HK-1132	susiddhasiddhamādau ca susiddhasādhyameva ca |	susiddha siddham ādau ca susiddha sādhyam eva ca 
MBSritattvacintamani_1-5_HK-1133	tataḥ susiddhasusiddhaṃ susidhārimatho tataḥ || 63 ||	tatas susiddha susiddham susidhārim atho tatas 
MBSritattvacintamani_1-5_HK-1134	arisiddhamarisādhyamarisusiddhameva ca |	ari siddham ari sādhyam ari su siddham eva ca 
MBSritattvacintamani_1-5_HK-1135	aryariñcaiva mantrajño varjayecca catuṣṭayam || 64 ||	mantra jñaḥ varjayet ca catuṣṭayam 
MBSritattvacintamani_1-5_HK-1136	taddvitīyakoṣṭhe u ṅa pa iti trīṇi | tattṛtīyakoṣṭhe ḷ jha ma iti trīṇi | taccaturthakoṣṭhe o ḍa va iti	tad dvitīya koṣṭhe u ṅa pa iti trīṇi tad tṛtīya koṣṭhe ḷ jha ma iti trīṇi tad caturtha koṣṭhe o ḍa va iti 
MBSritattvacintamani_1-5_HK-1137	trīṇi |	trīṇi 
MBSritattvacintamani_1-5_HK-1138	dvitīyacatuṣkaprathamakoṣṭhe  ā kha da la iti catvāryakṣarāṇi | taddvitīyakoṣṭhe  ū ca	dvitīya catuṣka prathama koṣṭhe ā kha da la iti catvāri akṣarāṇi tad dvitīya koṣṭhe  ū ca 
MBSritattvacintamani_1-5_HK-1139	pha iti trīṇi | tattṛtīyakoṣṭhe ḹ ña ya iti trīṇi | taccaturthakoṣṭhe au ḍha śa iti trīṇi |	iti trīṇi tad tṛtīya koṣṭhe ḥ ña yaḥ iti trīṇi tad caturtha koṣṭhe au ḍha śaḥ iti trīṇi 
MBSritattvacintamani_1-5_HK-1140	tṛtīyacatuṣkaprathamakoṣṭhe i ga dha kṣa iti catvāri | taddvitīyakoṣṭhe ṛ cha va iti trīṇi |	tṛtīya catuṣka prathama koṣṭhe i ga dha kṣa iti catvāri tad dvitīya koṣṭhe ṛ cha va iti trīṇi 
MBSritattvacintamani_1-5_HK-1141	tattṛtīyakoṣṭhe e ṭa ra iti trīṇi | taccaturthakoṣṭhe aṃ ṇa ṣa iti trīṇi |	tad tṛtīya koṣṭhe e ṭa ra iti trīṇi tad caturtha koṣṭhe aṃ ṇa ṣa iti trīṇi 
MBSritattvacintamani_1-5_HK-1142	caturthacatuṣkaprathamakoṣṭhe i gha na iti trīṇi | taddvitīyakoṣṭhe ṛ ja bha iti trīṇi |	caturtha catuṣka prathama koṣṭhe i gha na iti trīṇi tad dvitīya koṣṭhe ṛ ja bha iti trīṇi 
MBSritattvacintamani_1-5_HK-1143	tattṛtīyakoṣṭhe ai ṭha la iti trīṇi | taccaturthakoṣṭhe aḥ ta sa iti trīṇi | evaṃ likhite	tad tṛtīya koṣṭhe ai ṭha la iti trīṇi tad caturtha koṣṭhe aḥ ta sa iti trīṇi evam likhite 
MBSritattvacintamani_1-5_HK-1144	prathamacatuṣkakoṣṭhākṣarāṇām-uparitanākṣarāṇi dvitīyacatuṣkakoṣṭheṣu yathākramaṃ dṛśyante	prathama catuṣka koṣṭha akṣarāṇām uparitana akṣarāṇi dvitīya catuṣka koṣṭheṣu yathākramam dṛśyante 
MBSritattvacintamani_1-5_HK-1145	ityantena granthena |	iti antena granthena 
MBSritattvacintamani_1-5_HK-1146	60-64 | evaṃ varṇanyāsakramamuktvā gaṇanākramamāha  nijeti | pūrvoktānāṃ	evam varṇa nyāsa kramam uktvā gaṇanā kramam āha nija iti pūrva uktānām 
MBSritattvacintamani_1-5_HK-1147	ṣoḍaśakoṣṭhānāṃ madhye yasmin koṣṭhe nijanāmadivarṇaṃ sādhakasya nāmnaḥ	ṣoḍaśa koṣṭhānām madhye yasmin koṣṭhe nija nāma divarṇam sādhakasya nāmnaḥ 
MBSritattvacintamani_1-5_HK-1148	prathamamakṣaraṃ dṛśyate, tatkoṣṭhāt mantrasyādyakṣarāvadhi, yasmin koṣṭhe	prathamam akṣaram dṛśyate tad koṣṭhāt mantrasya ādi akṣara avadhi yasmin koṣṭhe 
MBSritattvacintamani_1-5_HK-1149	mantraghaṭakākṣarāṇāṃ prathamamakṣaraṃ dṛśyate tatkoṣṭhaṃ yāvad yenaiva likhanaṃ	mantra ghaṭaka akṣarāṇām prathamam akṣaram dṛśyate tat koṣṭham yāvat yena eva likhanam 
MBSritattvacintamani_1-5_HK-1150	kuryāttenaiva gaṇanaṃ smṛtamiti tantrasāradhṛtaviśvasāroktarītyā gaṇayet vakṣyamāṇa-siddhasiddha-	kuryāt tena eva gaṇanam smṛtam iti tantrasāra dhṛta viśvasāra ukta rītyā gaṇayet vakṣyamāṇa siddha siddha 
MBSritattvacintamani_1-5_HK-1151	siddhasādhyādīnīti śeṣaḥ |	siddha sādhya ādīni iti śeṣaḥ 
MBSritattvacintamani_1-5_HK-1152	arisiddhaḥ suraṃ hanyādarisādhyastu kanyakām |	ari siddhaḥ suram hanyāt ari sādhyaḥ tu kanyakām 
MBSritattvacintamani_1-5_HK-1153	patnīmarisusiddhastu aryarirmala (?) nāśayet || 65 ||	patnīm ari su siddhaḥ tu nāśayet   
MBSritattvacintamani_1-5_HK-1154	siddhasiddho yathoktena siddhasādhyo guṇadvayāt |	siddha siddhaḥ yathā uktena siddha sādhyaḥ guṇa dvayāt 
MBSritattvacintamani_1-5_HK-1155	siddhasusiddho'rddhajapāt siddhārirhanti bāndhavān || 66 ||	            
MBSritattvacintamani_1-5_HK-1156	dviguṇāt sādhyasiddhastu sādhyasādhyo nirarthakaḥ |	dviguṇāt sādhya siddhaḥ tu sādhya sādhyaḥ nirarthakaḥ 
MBSritattvacintamani_1-5_HK-1157	dviguṇāt sādhyasusiddhaḥ sādhyārirhanti gotrajān || 67 ||	dviguṇāt sādhya su siddhaḥ sādhya ariḥ hanti gotra jān 
MBSritattvacintamani_1-5_HK-1158	tadeva gaṇanākramamupadiśati siddhetyādinā aryariñcaivetyantena | etaduktaṃ bhavati  yatra	tat eva gaṇanā kramam upadiśati siddha ityādinā etat uktam bhavati yatra 
MBSritattvacintamani_1-5_HK-1159	catuṣke svanāmādyakṣaraṃ tat siddhasiddhakoṣṭhaṃ tatastasminneva catuṣke prādakṣiṇyena	catuṣke sva nāma ādi akṣaram tat siddha siddha koṣṭham tatas tasmin eva catuṣke prādakṣiṇyena 
MBSritattvacintamani_1-5_HK-1160	koṣṭhatraye siddhasādhya-siddhasusiddha-siddhārīn gaṇayet | asminneva catuṣke yadi mantrādyakṣaramapi	koṣṭha traye siddha sādhya siddha susiddha siddha arīn gaṇayet asmin eva catuṣke yadi mantra ādi akṣaram api 
MBSritattvacintamani_1-5_HK-1161	syāt tadā anayaiva gaṇanayā siddham | yadyanyasmin svanāmādyakṣaram, prādakṣiṇyena	syāt tadā anayā eva gaṇanayā siddham yadi anyasmin sva nāma ādi akṣaram prādakṣiṇyena 
MBSritattvacintamani_1-5_HK-1162	dvitīyacatuṣke mantrādyakṣaram, tadā pūrvacatuṣke yasmin koṣṭhe nāmādyakṣaram, atra	dvitīya catuṣke mantra ādi akṣaram tadā pūrva catuṣke yasmin koṣṭhe nāma ādi akṣaram atra 
MBSritattvacintamani_1-5_HK-1163	dvitīyacatuṣke'pi tadeva koṣṭhamārabhya sādhyasiddhādigaṇanakramaḥ iti rāghavabhaṭṭāḥ | evaṃ	dvitīya catuṣke api tat eva koṣṭham ārabhya sādhya siddha ādi gaṇana kramaḥ iti rāghava bhaṭṭāḥ evam 
MBSritattvacintamani_1-5_HK-1164	tṛtīyacatuṣkādiṣvapi |	tṛtīya catuṣka ādiṣu api 
MBSritattvacintamani_1-5_HK-1165	evañca svanāmādyakṣarayuktaṃ siddhasiddhaṃ tadapekṣayā dvitīyaṃ siddhasādhyam,	evam ca sva nāma ādi akṣara yuktam siddha siddham tad apekṣayā dvitīyam siddha sādhyam 
MBSritattvacintamani_1-5_HK-1166	tṛtīyaṃ siddhasusiddham, caturthaṃ siddhāri | krameṇaivetyanenāyamevārthaḥ sūcitaḥ |	tṛtīyam siddhasusiddham caturtham siddhāri krameṇa eva iti anena ayam eva arthaḥ sūcitaḥ 
MBSritattvacintamani_1-5_HK-1167	sādhyakoṣṭha ityādi | prāguktakrameṇa sādhyākhyasya prathamaṃ koṣṭhaṃ sādhyasiddham,	sādhya koṣṭhaḥ ityādi prāc ukta krameṇa sādhya ākhyasya prathamam koṣṭham sādhya siddham 
MBSritattvacintamani_1-5_HK-1168	dvitīyaṃ sādhyasādhyam, tṛtīyaṃ sādhasusiddham, caturthañca sādhyāri iti | krameṇaiveti iyamapi	dvitīyam sādhya sādhyam tṛtīyam sādha susiddham caturtham ca sādhya ari iti krameṇa eva iti iyam api 
MBSritattvacintamani_1-5_HK-1169	gaṇanā prāguktagaṇanakrameṇaivetyarthaḥ |	gaṇanā prāc ukta gaṇana krameṇa eva iti arthaḥ 
MBSritattvacintamani_1-5_HK-1170	tṛtīyamāha  susiddha iti | prāguktarītyā susiddhākhyasya prathamaṃ susiddhasiddham,	tṛtīyam āha susiddhaḥ iti prāc ukta rītyā susiddha ākhyasya prathamam susiddha siddham 
MBSritattvacintamani_1-5_HK-1171	dvitīyaṃ susiddhasādhyam, tṛtīyaṃ susiddhasiddham, caturthañca susiddhāri |	dvitīyam susiddhasādhyam tṛtīyam susiddhasiddham caturtham ca susiddhāri 
MBSritattvacintamani_1-5_HK-1172	caturthamāha  atho iti | tadapekṣayā caturthacatuṣkasya prathamaṃ koṣṭham arisiddhākhyam,	caturtham āha atho iti tad apekṣayā caturtha catuṣkasya prathamam koṣṭham arisiddha ākhyam 
MBSritattvacintamani_1-5_HK-1173	dvitīyamarisādhyākhyam, tṛtīyamarisusiddhākhyam, caturthañcāryaryākhyamiti ṣoḍaśakoṣṭhānāṃ	dvitīyam arisādhya ākhyam tṛtīyam arisusiddha ākhyam caturtham ca āryarya ākhyam iti ṣoḍaśa koṣṭhānām 
MBSritattvacintamani_1-5_HK-1174	saṃjñābhedā unneyāḥ |	saṃjñā bhedāḥ unneyāḥ 
MBSritattvacintamani_1-5_HK-1175	gaṇanāprāptasyārikoṣṭhacatuṣkasya varjanīyatvamāha  mantrajño varjayeca catuṣṭayamiti |	gaṇanā prāptasya ari koṣṭha catuṣkasya varjanīya tvam āha mantra jñaḥ varjayet ca catuṣṭayam iti 
MBSritattvacintamani_1-5_HK-1176	65 | varjane hetumāha  arisiddha ityādi | etādṛganiṣṭaphalajanakatvameva varjanīyatve	varjane hetum āha ari siddhaḥ ityādi etādṛś aniṣṭa phala janaka tvam eva varjanīya tve 
MBSritattvacintamani_1-5_HK-1177	heturityarthaḥ |	hetuḥ iti arthaḥ 
MBSritattvacintamani_1-5_HK-1178	susiddhasiddho'rddhajapāt tatsādhyo dviguṇādhikāt |	                    
MBSritattvacintamani_1-5_HK-1179	tatsusiddhaḥ kṣaṇādeva susiddhāristu jātihā |	tad su siddhaḥ kṣaṇāt eva susiddhāriḥ tu jāti hā 
MBSritattvacintamani_1-5_HK-1180	akathahamahācakraṃ kathitaṃ tantravartmanā || 68 ||	kathitam tantra vartmanā 
MBSritattvacintamani_1-5_HK-1181	a-ka-tha-ha-cakram	akatha ha cakram 
MBSritattvacintamani_1-5_HK-1182	catuṣkam	catuṣkam 
MBSritattvacintamani_1-5_HK-1183	aiśānakoṣṭha	aiśāna koṣṭha 
MBSritattvacintamani_1-5_HK-1184	a ka tha ha	a ka tha ha 
MBSritattvacintamani_1-5_HK-1185	siddha-siddha	siddha siddha 
MBSritattvacintamani_1-5_HK-1186	u ṅa pa	u ṅa pa 
MBSritattvacintamani_1-5_HK-1187	siddha-sādhya	siddha sādhya 
MBSritattvacintamani_1-5_HK-1188	ā kha da la	ā kha da la 
MBSritattvacintamani_1-5_HK-1189	sādhya-siddha	sādhya siddha 
MBSritattvacintamani_1-5_HK-1190	ū ca pha	ū ca pha 
MBSritattvacintamani_1-5_HK-1191	sādhya-sādhya	sādhya sādhya 
MBSritattvacintamani_1-5_HK-1192	āgneyakoṣṭha	āgneya koṣṭha 
MBSritattvacintamani_1-5_HK-1193	catuṣkam	catuṣkam 
MBSritattvacintamani_1-5_HK-1194	o ḍa va	o ḍa va 
MBSritattvacintamani_1-5_HK-1195	siddhāri	siddhāri 
MBSritattvacintamani_1-5_HK-1196	ḷ jha ma	ḷ jha ma 
MBSritattvacintamani_1-5_HK-1197	siddha-susiddha	siddha susiddha 
MBSritattvacintamani_1-5_HK-1198	au ḍha śa	au ḍha śa 
MBSritattvacintamani_1-5_HK-1199	sādhyāri	sādhyāri 
MBSritattvacintamani_1-5_HK-1200	ḷ ña ya	ḷ ña ya 
MBSritattvacintamani_1-5_HK-1201	sādhya-	sādhya 
MBSritattvacintamani_1-5_HK-1202	susiddha	su siddha 
MBSritattvacintamani_1-5_HK-1203	ī gha na	ī gha na 
MBSritattvacintamani_1-5_HK-1204	arisiddha	ari siddha 
MBSritattvacintamani_1-5_HK-1205	ṛ ja bha	ṛ ja bha 
MBSritattvacintamani_1-5_HK-1206	arisādhya	ari sādhya 
MBSritattvacintamani_1-5_HK-1207	i ga dha kṣa	i ga dha kṣa 
MBSritattvacintamani_1-5_HK-1208	susiddha-siddha	su siddha siddha 
MBSritattvacintamani_1-5_HK-1209	ṛ cha va	ṛ cha va 
MBSritattvacintamani_1-5_HK-1210	susiddha-	su siddha 
MBSritattvacintamani_1-5_HK-1211	sādhya	sādhya 
MBSritattvacintamani_1-5_HK-1212	tadvāmasthavā	tad vāma sthavā 
MBSritattvacintamani_1-5_HK-1213	yavyakoṣṭha-	yavya koṣṭha 
MBSritattvacintamani_1-5_HK-1214	catuṣakam	catuṣakam 
MBSritattvacintamani_1-5_HK-1215	aḥ ta sa	aḥ ta sa 
MBSritattvacintamani_1-5_HK-1216	aryari	ari ari 
MBSritattvacintamani_1-5_HK-1217	ai ṭha la	ai ṭha la 
MBSritattvacintamani_1-5_HK-1218	arisusiddha	ari su siddha 
MBSritattvacintamani_1-5_HK-1219	aṃ ṇa pa	aṃ ṇa pa 
MBSritattvacintamani_1-5_HK-1220	susiddhāri	su siddha ari 
MBSritattvacintamani_1-5_HK-1221	e ṭa ra	e ṭa ra 
MBSritattvacintamani_1-5_HK-1222	susiddha-	su siddha 
MBSritattvacintamani_1-5_HK-1223	susiddha	su siddha 
MBSritattvacintamani_1-5_HK-1224	tadadho nairṛta-	tad adhas nairṛta 
MBSritattvacintamani_1-5_HK-1225	koṣṭha-	koṣṭha 
MBSritattvacintamani_1-5_HK-1226	catuṣkam	catuṣkam 
MBSritattvacintamani_1-5_HK-1227	(ṛṇadhanacakram)	ṛṇa dhana cakram 
MBSritattvacintamani_1-5_HK-1228	pūrvajanmārādhitānāṃ mantrāṇāṃ jñānamucyate || 69 ||	pūrva janma ārādhitānām mantrāṇām jñānam ucyate 
MBSritattvacintamani_1-5_HK-1229	69 | akathahacakramuktā ṛṇadhanacakramāha-pūrvajanmeti |	                  
MBSritattvacintamani_1-5_HK-1230	(tatra rekhāpātaḥ sādhyasādhakāṅkānāṃ nyāsaparipāṭī ca)	tatra rekhā pātaḥ sādhya sādhaka aṅkānām nyāsa paripāṭī ca 
MBSritattvacintamani_1-5_HK-1231	pūrvāparaṃ dvādaśasaṃkhyasūtraṃ	pūrva aparam dvādaśa saṃkhya sūtram 
MBSritattvacintamani_1-5_HK-1232	yāmyottarasthañca tathāca pañcakam |	yāmya uttara stham ca tathā ca pañcakam 
MBSritattvacintamani_1-5_HK-1233	sādhyāṅkamūrddhve khalu madhyato'rṇā-	sādhya aṅkam ūrddhve khalu madhyatas ūrṇā 
MBSritattvacintamani_1-5_HK-1234	nadho likhet sādhakamaṅkamīśāt || 70 ||	likhet sādhakam aṅkam īśāt 
MBSritattvacintamani_1-5_HK-1235	(varṇanyāsaparipāṭī)	        
MBSritattvacintamani_1-5_HK-1236	dvau dvau svarau pañcasu koṣṭhakeṣu	dvau dvau svarau pañcasu koṣṭhakeṣu 
MBSritattvacintamani_1-5_HK-1237	śeṣān svarān ṣaṭsu ṣaḍekamekam |	śeṣān svarān ṣaṭsu ṣaṭ ekam ekam 
MBSritattvacintamani_1-5_HK-1238	kādīn haśeṣān vilikhettato'rṇā-	ka ādīn ha śeṣān vilikhet tatas ūrṇā 
MBSritattvacintamani_1-5_HK-1239	nekaikamekādaśasu sthaleṣu || 71 ||	na ekaikam ekādaśasu sthaleṣu 
MBSritattvacintamani_1-5_HK-1240	(tatra sādhyasādhakāṅkanyāsapūrvako guṇanakramaḥ)	tatra sādhya sādhaka aṅka nyāsa pūrvakaḥ guṇana kramaḥ 
MBSritattvacintamani_1-5_HK-1241	indrarkṣa-netra-ravi-pañcadaśartuveda-	indra ṛkṣa netra ravi pañcadaśa ṛtu veda 
MBSritattvacintamani_1-5_HK-1242	vahnyāyudhāṣṭanavabhirgaṇitāṃstu sādhyān |	vahnyāyudha aṣṭa navabhiḥ gaṇitān tu sādhyān 
MBSritattvacintamani_1-5_HK-1243	70 | ṛṇadhanacakraṃ trividhaṃ bhavati, tatra prathame rekhāpātanakramamāha  pūrveti |	ṛṇa dhana cakram trividham bhavati tatra prathame rekhāpātana kramam āha pūrva iti 
MBSritattvacintamani_1-5_HK-1244	pūrvataḥ paścimāntā dvādaśa rekhāḥ tathā dakṣiṇata uttarāntāḥ pañca rekhāḥ kartavyāḥ |	pūrvatas paścima antāḥ dvādaśa rekhāḥ tathā dakṣiṇatas uttara antāḥ pañca rekhāḥ kartavyāḥ 
MBSritattvacintamani_1-5_HK-1245	sādhyāṅkamiti | ūrddhve dakṣottararekhāpañcakānāmūrddhve bahirūrddhvapradeśe	sādhya aṅkam iti ūrddhve dakṣa uttara rekhā pañcakānām ūrddhve bahis ūrddhva pradeśe 
MBSritattvacintamani_1-5_HK-1246	pūrvapaścimāyatadvādaśa-rekhāsampāditaikādaśakoṣṭhānāmupari krameṇa ekaikaśo vakṣyamāṇān	pūrva paścima āyata dvādaśa rekhā sampādita ekādaśa koṣṭhānām upari krameṇa ekaikaśas vakṣyamāṇān 
