segmentnr	original	analyzed
MBSritattvacintamani_1-5_HK-2308	āṇavyaṃ taddvayaṃ proktaṃ niṣiddhaṃ tanmalatrayam || ityāha |	āṇavyam tat dvayam proktam niṣiddham tat mala trayam iti āha 
MBSritattvacintamani_1-5_HK-2309	mantrītyanena mūlādhārāt kuṇḍalinīmutthāpya taddvārā doṣadāha iti rāghavabhaṭṭaḥ | ata eva	mantrī iti anena mūlādhārāt kuṇḍalinīm utthāpya tad dvārā doṣa dāhaḥ iti rāghavabhaṭṭaḥ atas eva 
MBSritattvacintamani_1-5_HK-2310	tantrasārakṛtāpi suṣumṇāmūlamadhyata ityuktam |	tantrasāra kṛtā api suṣumṇā mūla madhyataḥ iti uktam 
MBSritattvacintamani_1-5_HK-2311	jyotirmantreṇa nirddahedityuktam, taṃ jyotirmantramāha  tāramiti | tāraṃ praṇavaḥ, śivo	jyotirmantreṇa nirddahet iti uktam tam jyotirmantram āha tāram iti tāram praṇavaḥ śivaḥ 
MBSritattvacintamani_1-5_HK-2312	hakāraḥ, agnī rephaḥ, tārānta aukāraḥ binduranusvāraḥ tena hrauṃ iti jyotirmantraṃ |	hakāraḥ agniḥ rephaḥ tāra antaḥ aukāraḥ binduḥ anusvāraḥ tena hrauṃ iti jyotiḥ mantram 
MBSritattvacintamani_1-5_HK-2313	śāradāyāmapi  tāraṃ vyomāgnimanuyuga daṇḍī jyotirmanurmata iti | āgamatatvavilāsakṛtā tu	śāradāyām api tāram vyoma agni manu yuga daṇḍī jyotiḥ manuḥ mataḥ iti āgama tatvavilāsa kṛtā tu 
MBSritattvacintamani_1-5_HK-2314	jyotirmantrotpannavahniśikhayā pañcaviṃśatikṛtvo nirdahanam, amukamantrasyāmukaṃ malaṃ nirdahāmīti	jyotiḥ mantra utpanna vahni śikhayā pañcaviṃśati kṛtvas nirdahanam amuka mantrasya amukam malam nirdahāmi iti 
MBSritattvacintamani_1-5_HK-2315	tadvākyañcābhihitam |	tad vākyam ca abhihitam 
MBSritattvacintamani_1-5_HK-2316	168-169 | kuśeti | idaṃ mantraṃ bhūrjapatrake likhitvā japtenāṣṭottaraśatajaptena kuśodakena	  iti       likhitvā               
MBSritattvacintamani_1-5_HK-2317	manordeyamantrasya pratyarṇaṃ prativarṇaṃ tena deyamantreṇa aṣṭottaraśataṃ prokṣaṇam	manoḥ deya mantrasya pratyarṇam prativarṇam tena deya mantreṇa aṣṭottaraśatam prokṣaṇam 
MBSritattvacintamani_1-5_HK-2318	etadāpyāyanamiti sambandhaḥ | kecittu pūrvaṃ jyotirmantrābhidhānāt tena jyotirmantreṇetyarthaṃ	etat āpyāyanam iti sambandhaḥ kecid tu pūrvam jyotiḥ mantra abhidhānāt tena jyotiḥ mantreṇa iti artham 
MBSritattvacintamani_1-5_HK-2319	(tarpaṇākhyo'ṣṭamaḥ)	tarpaṇa ākhyā uṣṭamaḥ 
MBSritattvacintamani_1-5_HK-2320	mantreṇa vāriṇā mantre tarpaṇaṃ tarpaṇaṃ matam || 170 ||	mantreṇa vāriṇā mantre tarpaṇam tarpaṇam matam 
MBSritattvacintamani_1-5_HK-2321	(dīpanākhyo navamaḥ)	dīpana ākhyaḥ navamaḥ 
MBSritattvacintamani_1-5_HK-2322	tāramāyāramābījaṃ mantrasyādau niyojya ca |	tāra māyā ramā bījam mantrasya ādau niyojya ca 
MBSritattvacintamani_1-5_HK-2323	saptadhā prajapenmantramiti dīpanamīritam || 171 ||	saptadhā prajapet mantram iti dīpanam īritam  /
MBSritattvacintamani_1-5_HK-2324	kalpayanti | atra mīmāṃsitaṃ rāghavabhaṭṭena  kecana tena tanmantreṇeti jyotirmantreṇeti vyācakṣate,	kalpayanti atra mīmāṃsitam rāghavabhaṭṭena kecana tena tad mantreṇa iti jyotiḥ mantreṇa iti vyācakṣate 
MBSritattvacintamani_1-5_HK-2325	tadasad granthāntaravirodhāt, taduktam  āpyāyanaṃ svajaptaiḥ pratyarṇaṃ kuśapayobhiḥ syāt | iti |	tat asat grantha antara virodhāt tat uktam āpyāyanam sva japtaiḥ pratyarṇam kuśa payobhiḥ syāt iti 
MBSritattvacintamani_1-5_HK-2326	tathāca svajaptairityasya svaṃ mantraṃ tena japtaiḥ, kuśapayobhirityarthaḥ | prakṛte tu tena japtena	tathā ca sva japtaiḥ iti asya svam mantram tena japtaiḥ kuśa payobhiḥ iti arthaḥ prakṛte tu tena japtena 
MBSritattvacintamani_1-5_HK-2327	tenaivābhyukṣaṇamiti dhyeyam | ata eva rāghavabhaṭṭena tenetyubhayatra sambadhyate ityuktyā	tena eva abhyukṣaṇam iti dhyeyam atas eva rāghavabhaṭṭena tena iti ubhayatra sambadhyate iti uktyā 
MBSritattvacintamani_1-5_HK-2328	svamatasamarthanānukūlaṃ piṅgalāmatapramāṇamupadarśitam | yathā 	sva mata samarthana anukūlam piṅgalā mata pramāṇam upadarśitam yathā 
MBSritattvacintamani_1-5_HK-2329	aṣṭottaraśatālabdhaṃ viśuddhaṃ kuśavāriṇā |	aṣṭottaraśata ālabdham viśuddham kuśa vāriṇā 
MBSritattvacintamani_1-5_HK-2330	āpyāyito bhavenmantraḥ pratyarṇaṃ prokṣito yadi || iti |	āpyāyitaḥ bhavet mantraḥ pratyarṇam prokṣitaḥ yadi iti 
MBSritattvacintamani_1-5_HK-2331	atra proksaṇaṃ saptadhetyuktaṃ rāghavabhaṭṭena | āpyāyanasya vākyantu	atra proksaṇam saptadhā iti uktam rāghavabhaṭṭena āpyāyanasya 
MBSritattvacintamani_1-5_HK-2332	amukamantrasyāmukavarṇamāpyāyāmi ityuktamāgamatattvavilāse |	amuka mantrasya amuka varṇam āpyāyāmi iti uktam āgamatattvavilāse 
MBSritattvacintamani_1-5_HK-2333	170 | mantreṇeti | mantre likhitamantropari mantreṇa deyamantreṇa vāriṇā yat tarpaṇaṃ tadeva	  iti                 eva 
MBSritattvacintamani_1-5_HK-2334	tarpaṇaṃ tarpaṇākhyaḥ saṃskāra ityarthaḥ | idamapyaṣṭottaraṃ śatamiti rāghavabhaṭṭaḥ |	tarpaṇam tarpaṇa ākhyaḥ saṃskāraḥ iti arthaḥ idam api aṣṭa uttaram śatam iti rāghavabhaṭṭaḥ 
MBSritattvacintamani_1-5_HK-2335	tantrasāre 	tantrasāre 
MBSritattvacintamani_1-5_HK-2336	madhunā śaktimantre tu vaiṣṇave cendumajjalaiḥ |	madhunā śakti mantre tu vaiṣṇave ca indumat jalaiḥ 
MBSritattvacintamani_1-5_HK-2337	śaive ghṛtena dugdhena tarpaṇaṃ samyagīritam ||	śaive ghṛtena dugdhena tarpaṇam samyak īritam 
MBSritattvacintamani_1-5_HK-2338	indumajjalaiḥ karpūrajalairiti |	indumat jalaiḥ karpūra jalaiḥ iti 
MBSritattvacintamani_1-5_HK-2339	171 | tāreti | tāraḥ praṇavaḥ, māyā hrīṃ, ramābījaṃ śrīṃ | bījamityasya	tāra iti tāraḥ praṇavaḥ māyā   ramā bījam śrīṃ bījam iti asya 
MBSritattvacintamani_1-5_HK-2340	pratyekamabhisambandhaḥ | mantrasyeti deyamantrasyetyarthaḥ | atra tantrasāre śāradāyāñca	pratyekam abhisambandhaḥ mantrasya iti deya mantrasya iti arthaḥ atra tantrasāre śāradāyām ca 
MBSritattvacintamani_1-5_HK-2341	tāramāyāramāyoge manordīpanamucyate iti sāmānyato'bhihitam | tantrasāradhṛtaviśvasāre ca 	tāra māyā ramā yoge manoḥ dīpanam ucyate iti sāmānyatas bhihitam tantrasāra dhṛta viśvasāre ca 
MBSritattvacintamani_1-5_HK-2342	tāramāyāramābījapuṭitena japenmanum |	                
MBSritattvacintamani_1-5_HK-2343	śatamaṣṭottarancaiva dīpayet sādhakottamaḥ ||	śatam aṣṭa uttaran ca eva dīpayet sādhaka uttamaḥ 
MBSritattvacintamani_1-5_HK-2344	ityanena tāramāyābījapuṭitasya deyamantasyāṣṭottaraśatajapo dīpanamityāha | prakṛte tu	iti anena tāramāyā bīja puṭitasya deyam antasya aṣṭottaraśata japaḥ dīpanam iti āha prakṛte tu 
MBSritattvacintamani_1-5_HK-2345	(gopanākhyo daśamaḥ)	gopana ākhyaḥ daśamaḥ 
MBSritattvacintamani_1-5_HK-2346	japyamānasya mantrasya gopanaṃ tvaprakāśanam || 172 ||	japyamānasya mantrasya gopanam tu aprakāśanam 
MBSritattvacintamani_1-5_HK-2347	(daśasaṃskāropasaṃhāraḥ)	daśa saṃskāra upasaṃhāraḥ 
MBSritattvacintamani_1-5_HK-2348	saṃskārā daśa saṃproktāḥ sarvatantreṣu gopitāḥ |	saṃskārāḥ daśa saṃproktāḥ sarva tantreṣu gopitāḥ 
MBSritattvacintamani_1-5_HK-2349	yān kṛtvā mantradānena mantrī vāñchitamāpnuyāt || 173 ||	yān kṛtvā mantra dānena mantrī vāñchitam āpnuyāt 
MBSritattvacintamani_1-5_HK-2350	iti śrīpūrṇānandaparamahaṃsaviracite śrītattvacintāmaṇau dvitīyaḥ prakāśaḥ || 2 ||	iti śrī pūrṇānanda paramahaṃsa viracite śrī tattvacintāmaṇau dvitīyaḥ prakāśaḥ 
MBSritattvacintamani_1-5_HK-2351	mantrasyādāveva tāramāyāramābījaniyogaḥ saptadhā japaśceti prāguktaviśvasāra-	mantrasya ādau eva tāra māyā ramā bīja niyogaḥ saptadhā japaḥ ca iti prāc ukta viśvasāra 
MBSritattvacintamani_1-5_HK-2352	śāradāvacanavirodhaḥ | tadevaṃ mīmāṃsyate-tāramāyetyādimūlavacane niyojya ceti cakārasya	śāradā vacana virodhaḥ tat evam mīmāṃsyate tāramāya ityādi mūlavacane niyojya ca iti cakārasya 
MBSritattvacintamani_1-5_HK-2353	ādāvityanenābhisambandhānmantrasyādau ca niyojyetyarthe ante ca tārādibījānāṃ niyogo'vagamyate,	ādau iti anena abhisambandhāt mantrasya ādau ca niyojya iti arthe ante ca tārā ādi bījānām niyogaḥ uvagamyate 
MBSritattvacintamani_1-5_HK-2354	tataśca mantrasyādāvante ca tāramāyāramābījānāṃ niyogo granthakṛto'pyabhimata iti na	tatas ca mantrasya ādau ante ca tāra māyā ramā bījānām niyogaḥ granthakṛtā api abhimataḥ iti na 
MBSritattvacintamani_1-5_HK-2355	viśvasārādivacanavirodhaḥ | aṣṭottaraśatajapasaptadhājapayorvyavasthā tu śaktāśaktabhedeneti	                                                                                                     
MBSritattvacintamani_1-5_HK-2356	niṣkarṣaḥ |	niṣkarṣaḥ 
MBSritattvacintamani_1-5_HK-2357	tṛtīyaḥ prakāśaḥ	tṛtīyaḥ prakāśaḥ 
MBSritattvacintamani_1-5_HK-2358	(dīkṣāprakaraṇam)	dīkṣā prakaraṇam 
MBSritattvacintamani_1-5_HK-2359	(tatra vihitasthānāni, dīpasthānanirūpaṇaprayojanam, kūrmacakram,	tatra vihita sthānāni dīpa sthāna nirūpaṇa prayojanam kūrma cakram 
MBSritattvacintamani_1-5_HK-2360	vāstuyāgastadaṅgacatuḥṣaṣṭipadavāstumaṇḍalaṃ valimantrāśca)	vāstuyāgaḥ tad aṅga catuḥṣaṣṭi pada vāstu maṇḍalam vali mantrāḥ ca 
MBSritattvacintamani_1-5_HK-2361	(dīkṣāyāṃ praśastasthānāni)	dīkṣāyām praśasta sthānāni 
MBSritattvacintamani_1-5_HK-2362	atha vakṣyāmi dīkṣāyāḥ sthānaṃ tantrānusārataḥ || 1 ||	atha vakṣyāmi dīkṣāyāḥ sthānam tantra anusārataḥ 
MBSritattvacintamani_1-5_HK-2363	gośālāyāṃ gurorgehe devāgāre ca kānane |	go śālāyām guroḥ gehe devāgāre ca kānane 
MBSritattvacintamani_1-5_HK-2364	puṇyakṣetre tathodyāne nadītīre ca mantravit || 2 ||	puṇya kṣetre tathā udyāne nadī tīre ca mantra vid 
MBSritattvacintamani_1-5_HK-2365	dhātrīvilvasamīpe ca parvatāgre guhāsu ca |	dhātrī vilva samīpe ca parvata agre guhāsu ca 
MBSritattvacintamani_1-5_HK-2366	gaṅgāyāṃ tattaṭe vā'pi koṭikoṭiguṇaṃ bhavet || 3 ||	gaṅgāyām tad taṭe vā api koṭi koṭi guṇam bhavet 
MBSritattvacintamani_1-5_HK-2367	(dīpasthāne japādividhiḥ)	            
MBSritattvacintamani_1-5_HK-2368	dīpasthānaṃ samāśritya japayāgādikaṃ caret |	dīpa sthānam samāśritya japa yāga ādikam caret 
MBSritattvacintamani_1-5_HK-2369	(kūrmacakranirūpaṇapratijñā)	kūrma cakra nirūpaṇa pratijñā 
MBSritattvacintamani_1-5_HK-2370	ata eva kūrmacakraṃ vakṣyāmi siddhikāraṇam || 4 ||	atas eva kūrma cakram vakṣyāmi siddhi kāraṇam 
MBSritattvacintamani_1-5_HK-2371	4 | gośālāyāmityādinā dīkṣāyāṃ yāni praśastasthānāni nirūpitāni teṣvapi	go śālāyām ityādinā dīkṣāyām yāni praśasta sthānāni nirūpitāni teṣu api 
MBSritattvacintamani_1-5_HK-2372	dīpasthānamevāśritya japayāgādikaṃ vidheyamityarthasya jñāpanāya dīkṣāsthānanirūpaṇāt	dīpa sthānam eva āśritya japa yāga ādikam vidheyam iti arthasya jñāpanāya dīkṣā sthāna nirūpaṇāt 
MBSritattvacintamani_1-5_HK-2373	parameva dīpasthānaṃ nirūpayati  dīpasthānamityādinā | vakṣyamāṇakūrmasya mukhasthānameva	param eva dīpa sthānam nirūpayati dīpa sthānam ityādinā vakṣyamāṇa kūrmasya mukha sthānam eva 
MBSritattvacintamani_1-5_HK-2374	dīpasthānamityagre vakṣyate | taddīpasthānaṃ kūrmacakrajñānādhīnamiti kūrmacakraṃ vaktuṃ	dīpa sthānam iti agre vakṣyate tat dīpa sthānam kūrma cakra jñāna adhīnam iti kūrma cakram vaktum 
MBSritattvacintamani_1-5_HK-2375	pratijānīte  ata iti |	pratijānīte atas iti 
MBSritattvacintamani_1-5_HK-2376	(tatra rekhāpātakramo varṇanyāsaśca)	tatra rekhāpāta kramaḥ varṇa nyāsaḥ ca 
MBSritattvacintamani_1-5_HK-2377	ādau ca vartulaṃ kṛtvā nava koṣṭhāni kārayet |	ādau ca vartulam kṛtvā nava koṣṭhāni kārayet 
MBSritattvacintamani_1-5_HK-2378	navabhāgaṃ madhyakoṣṭhaṃ tathaiva pūrvato likhet || 5 ||	nava bhāgam madhya koṣṭham tathā eva pūrvatas likhet 
MBSritattvacintamani_1-5_HK-2379	kavargādisaptavargaṃ la-kṣāvīśe tadantaram |	kavarga ādi saptavargam lakṣau īśe tad antaram 
MBSritattvacintamani_1-5_HK-2380	madhyeṣu vasukoṣṭheṣu svarāṃśca yugmaśo likhet || 6 ||	madhyeṣu vasu koṣṭheṣu svarān ca yugmaśas likhet 
MBSritattvacintamani_1-5_HK-2381	5 | tatrāyaṃ kūrmacakranirmāṇakramaḥ  prathamaṃ kūrmākṛti vartulaṃ tanmadhye	tatra ayam kūrma cakra nirmāṇa kramaḥ prathamam kūrma ākṛti vartulam tad madhye 
MBSritattvacintamani_1-5_HK-2382	caturasram, tanmadhye dve pūrvāyate, dve cottarāyate, evaṃ vartulamadhye nava koṣṭhāni sampadyante	catur asram tad madhye dve pūrvāyate dve ca uttarāyate evam vartula madhye nava koṣṭhāni sampadyante 
MBSritattvacintamani_1-5_HK-2383	| eteṣāṃ navakoṣṭhānaṃ madhyakoṣṭhasaṃjñā tadvahiḥsthānāntu bahiḥkoṣṭhatvama iti	eteṣām madhya koṣṭha saṃjñā tad vahis sthānām tu iti 
MBSritattvacintamani_1-5_HK-2384	pratipādayitumāha  navabhāgamiti | tatra cakre varṇanyāsamāha  tathaiveti | antarnavakoṣṭavad	pratipādayitum āha nava bhāgam iti tatra cakre varṇa nyāsam āha tathā eva iti antar nava koṣṭa vat 
MBSritattvacintamani_1-5_HK-2385	bahiḥkoṣṭheṣu vyañjanānāṃ sthāpanaṃ vidheyamiti sūcanāyaitat |	bahis koṣṭheṣu vyañjanānām sthāpanam vidheyam iti sūcanāya etat 
MBSritattvacintamani_1-5_HK-2386	6 | kavargādīti | tathāca bahiḥ pūrvakoṣṭhe-kavargam, āgyneyakoṣṭhe-cavargam,	kavarga ādi iti tathā ca bahis pūrva koṣṭha ikavargam āgyneya koṣṭha icavargam 
MBSritattvacintamani_1-5_HK-2387	dakṣiṇakoṣṭhe-ṭavargam, nair-ṛtakoṣṭhe-tavargam, paścimakoṣṭhe-pavargam, vāyavyakoṣṭhe yādicatuṣka,	dakṣiṇa koṣṭha iṭa vargam nairṛta koṣṭha ita vargam paścima koṣṭha ipa vargam vāyavya koṣṭhe ya ādi catuṣka 
MBSritattvacintamani_1-5_HK-2388	uttarakoṣṭhe- śādicatuṣkam, iśānakoṣṭhe-la-kṣavarṇadvayamiti bahiḥkoṣṭhepūraṇakramaḥ | etadeva	uttara koṣṭhe śa ādi catuṣkam iśāna koṣṭhe lakṣa varṇa dvayam iti bahis koṣṭhe pūraṇa kramaḥ etat eva 
MBSritattvacintamani_1-5_HK-2389	sphuṭamāha rāghavabhaṭṭadhṛtavacanam 	sphuṭam āha rāghava bhaṭṭa dhṛta vacanam 
MBSritattvacintamani_1-5_HK-2390	pūrvakoṣṭhe kavargasya pañcakaṃ madhyataḥ kramāt |	pūrva koṣṭhe kavargasya pañcakam madhyatas kramāt 
MBSritattvacintamani_1-5_HK-2391	madhyato'nyatra cānneye cavargaṃ caivameva hi || iti |	madhyatas nyatra ca anneye cavargam ca evam eva hi iti 
MBSritattvacintamani_1-5_HK-2392	antaḥkoṣṭhaprakriyāmāh-madhyeṣviti | tathāca pūrvadiṅmadhyakoṣṭhataḥ prādakṣiṇyena pratikoṣṭhaṃ	antar koṣṭha prakriyām āha madhyeṣu iti tathā ca pūrva diś madhya koṣṭhataḥ prādakṣiṇyena pratikoṣṭham 
MBSritattvacintamani_1-5_HK-2393	dvau dvāviti krameṇa ṣoḍaśa svarān likhedityarthaḥ | tadāha rāghavabhaṭṭaḥ 	dvau dvau iti krameṇa ṣoḍaśa svarān likhet iti arthaḥ tat āha rāghavabhaṭṭaḥ 
MBSritattvacintamani_1-5_HK-2394	madhyakoṣṭhapurobhāge akāradvayamālikhet |	madhya koṣṭha puras bhāge akāra dvayam ālikhet 
MBSritattvacintamani_1-5_HK-2395	āgneyyāmidvayaṃ vidyād yāmye tūdvayamālikhet || ityādinā |	āgneyyām idvayam vidyāt yāmye tu u dvayam ālikhet ityādinā 
MBSritattvacintamani_1-5_HK-2396	tantrasāre'pi 	tantrasāre pi 
MBSritattvacintamani_1-5_HK-2397	caturasrāṃ bhuvaṃ bhittvā koṣṭhānāṃ navakaṃ likhet |	catur asrām bhuvam bhittvā koṣṭhānām navakam likhet 
MBSritattvacintamani_1-5_HK-2398	pūrvakoṣṭhādi vilikhet saptavargānanukramāt |	pūrva koṣṭha ādi vilikhet sapta vargān anukramāt 
MBSritattvacintamani_1-5_HK-2399	la-kṣamīśe madhyakoṣṭhe svarān yugmakramāllikhet ||	lakṣam īśe madhya koṣṭhe svarān yugma kramān likhet 
MBSritattvacintamani_1-5_HK-2400	madhyakoṣṭhe kṣetranāma cakraṃ kūrmākhyamuttamam |	madhya koṣṭhe kṣetra nāma cakram kūrma ākhyam uttamam 
MBSritattvacintamani_1-5_HK-2401	(mukhādinirṇayaḥ)	        
MBSritattvacintamani_1-5_HK-2402	yasmin koṣṭhe kṣetranāmapūrvavarṇaṃ mukhaṃ smṛtam || 7 ||	yasmin koṣṭhe kṣetra nāma pūrva varṇam mukham smṛtam 
MBSritattvacintamani_1-5_HK-2403	ityaneneyameva varṇasthāpanāparipāṭī nirūpitā | rudrajāmalottarakhaṇḍatṛtīyapaṭale tu	iti anena iyam eva varṇa sthāpanā paripāṭī nirūpitā rudrajāmala uttara khaṇḍa tṛtīya paṭale tu 
MBSritattvacintamani_1-5_HK-2404	muṇḍe svarā dakṣpāde kavargaṃ vāmapādake |	muṇḍe svarāḥ dakṣ pāde kavargam vāma pādake 
MBSritattvacintamani_1-5_HK-2405	cavargaṃ kīrtitaṃ paścādadhaḥpāde ṭavargakam || 73 ||	cavargam kīrtitam paścāt adhas pāde ṭavargakam 
MBSritattvacintamani_1-5_HK-2406	ityādinā  |	ityādinā 
MBSritattvacintamani_1-5_HK-2407	lāṅgule śakrabījañca kṣakāraṃ liṅgamadhyake |	lāṅgule śakrabījam ca kṣakāram liṅga madhyake 
MBSritattvacintamani_1-5_HK-2408	likhitvā gaṇayenmantrī cakraṃ kalimalāpaham || 74 ||	likhitvā gaṇayet mantrī cakram kali mala apaham 
MBSritattvacintamani_1-5_HK-2409	ityantena kūrmacakre varṇānāṃ nyāso'nyathā nirūpitaḥ |	ityantena kūrma cakre varṇānām nyāsaḥ anyathā nirūpitaḥ 
MBSritattvacintamani_1-5_HK-2410	7 | madhyakoṣṭha iti | prāguktāṣṭakoṣṭhāntarvarti yannavamaṃ koṣṭhaṃ tatra kṣetranāma	    iti                                 
MBSritattvacintamani_1-5_HK-2411	likhedityarthaḥ | kṣetrantu yatopaviśya sādhako japati tadeva | tatra praśastakṣetrāṇi gośālāyāṃ	likhet iti arthaḥ kṣetram tu yatas upaviśya sādhakaḥ japati tat eva tatra praśasta kṣetrāṇi go śālāyām 
MBSritattvacintamani_1-5_HK-2412	gurorgehe ityādinā prakāśaprārambha evābhihitāni |	guroḥ gehe ityādinā prakāśa prārambhe eva abhihitāni 
MBSritattvacintamani_1-5_HK-2413	śāradāyāṃ dvitīyapaṭale'pi 	śāradāyām dvitīya paṭale pi 
MBSritattvacintamani_1-5_HK-2414	puṇyakṣetraṃ nadītīraṃ guhā parvatamastakam |	puṇya kṣetram nadī tīram guhā parvata mastakam 
MBSritattvacintamani_1-5_HK-2415	tīrthapradeśāḥ sindhūnāṃ saṅgamāḥ pāvanaṃ mahat ||	tīrtha pradeśāḥ sindhūnām saṅgamāḥ pāvanam mahat 
MBSritattvacintamani_1-5_HK-2416	udyānāni viviktāni vilvamūlaṃ taṭaṃ gireḥ |	udyānāni viviktāni vilva mūlam taṭam gireḥ 
MBSritattvacintamani_1-5_HK-2417	sādhaneṣu praśastāni sthānānyetāni mantriṇām || iti |	sādhaneṣu praśastāni sthānāni etāni mantriṇām iti 
MBSritattvacintamani_1-5_HK-2418	evamanyatrāpi |	evam anyatra api 
MBSritattvacintamani_1-5_HK-2419	atha mukhasyaiva dīpasthānatvāt kūrmasya kiṃ mukhaṃ yajjñānādhīnaṃ	atha mukhasya eva dīpa sthāna tvāt kūrmasya kim mukham yat jñāna adhīnam 
MBSritattvacintamani_1-5_HK-2420	dīpasthānajñānamityāśaṅkya mukhaṃ nirūpayati  yasminniti | prāguktānāṃ	dīpa sthāna jñānam iti āśaṅkya mukham nirūpayati yasmin iti prāguktānām 
MBSritattvacintamani_1-5_HK-2421	kūrmāntaḥkoṣṭhānāṃ madhye yasmin koṣṭhe kṣetranāmapūrvavarṇaṃ	kūrma antar koṣṭhānām madhye yasmin koṣṭhe kṣetra nāma pūrva varṇam 
MBSritattvacintamani_1-5_HK-2422	sādhanayogyasthānanāmaprathamākṣaraṃ tanmukhaṃ smṛtamityarthaḥ | taduktaṃ śāradāyāṃ	sādhana yogya sthāna nāma prathama akṣaram tat mukham smṛtam iti arthaḥ tat uktam śāradāyām 
MBSritattvacintamani_1-5_HK-2423	dvitīyapaṭale 	dvitīya paṭale 
MBSritattvacintamani_1-5_HK-2424	dikṣu pūrvādito yatra kṣetrākhyādyakṣaraṃ sthitam |	dikṣu pūrva āditaḥ yatra kṣetra ākhyā ādi akṣaram sthitam 
MBSritattvacintamani_1-5_HK-2425	mukhaṃ tattasya jānīyāt * * * iti ||	mukham tat tasya jānīyāt       
MBSritattvacintamani_1-5_HK-2426	evañca kūrmasya mukhaṃ sādhanakṣetraprathamākṣarānusāreṇa nirdeśyamiti sthitam |	evam ca kūrmasya mukham sādhana kṣetra prathama akṣara anusāreṇa nirdeśyam iti sthitam 
MBSritattvacintamani_1-5_HK-2427	mukhasya pārśvayoḥ pāṇiyugaṃ pārśvadvayaṃ bhavet |	mukhasya pārśvayoḥ pāṇi yugam pārśva dvayam bhavet 
MBSritattvacintamani_1-5_HK-2428	kukṣisthānaṃ pādayugaṃ tadante pucchamīritam || 8 ||	kukṣi sthānam pāda yugam tat ante puccham īritam 
MBSritattvacintamani_1-5_HK-2429	(kūrmasya tattadaṅgamāśritya japādau phalabhedāḥ)	kūrmasya tat tat aṅgam āśritya japa ādau phala bhedāḥ 
MBSritattvacintamani_1-5_HK-2430	mukhe kāryāṇi sidhyanti kare kleśamavāpnuyāt |	mukhe kāryāṇi sidhyanti kare kleśam avāpnuyāt 
MBSritattvacintamani_1-5_HK-2431	udare duḥkhamadhikaṃ pādayorhānirucyate |	udare duḥkham adhikam pādayoḥ hāniḥ ucyate 
MBSritattvacintamani_1-5_HK-2432	pucche tu dhanahāniḥ syāddīpasthānaṃ mukhaṃ smṛtam || 9 ||	pucche tu dhana hāniḥ syāt dīpasthānam mukham smṛtam 
MBSritattvacintamani_1-5_HK-2433	(dīpasthānetaratra dīkṣādau doṣaḥ)	dīpa sthāna itaratra dīkṣā ādau doṣaḥ 
MBSritattvacintamani_1-5_HK-2434	dīpasthānaṃ vinā yo hi dīkṣāhomādikañcaret |	dīpa sthānam vinā yaḥ hi dīkṣā homa ādikan caret 
MBSritattvacintamani_1-5_HK-2435	tadeva niṣphalaṃ vidyādabhicārāya kalpate || 10 ||	tat eva niṣphalam vidyāt abhicārāya kalpate 
MBSritattvacintamani_1-5_HK-2436	8-9 | evaṃ mukhaṃ nirdiśya kūrmasya hastādikaṃ nirūpayati  mukhasyetyādinā |	evam mukham nirdiśya kūrmasya hasta ādikam nirūpayati mukhasya ityādinā 
MBSritattvacintamani_1-5_HK-2437	mukhobhayapārśvasthaṃ koṣṭhadvayaṃ hastayugalam, ubhayapārśvasthaṃ koṣṭhadvayaṃ kukṣisthānam,	mukha ubhaya pārśva stham koṣṭha dvayam hasta yugalam ubhaya pārśva stham koṣṭha dvayam kukṣi sthānam 
MBSritattvacintamani_1-5_HK-2438	tadadha ubhayataḥ koṣṭhadvayaṃ pādayugalam, tadadhaḥ koṣṭhaṃ pucchamityarthaḥ | mukhādibhedena	tad adhas ubhayatas koṣṭha dvayam pāda yugalam tad adhas koṣṭham puccham iti arthaḥ mukha ādi bhedena 
MBSritattvacintamani_1-5_HK-2439	japayāgādīnāmiṣṭāniṣṭaphalajanakatvamāha-mukha ityādinā |	japa yāga ādīnām iṣṭa aniṣṭa phala janaka tvam āha mukhe ityādinā 
MBSritattvacintamani_1-5_HK-2440	10 | dīpasthānamiti | atra rāghavabhaṭṭena dīpaśabdārtho'nyatrokta ityabhidhāya 	dīpa sthānam iti atra rāghavabhaṭṭena dīpa śabda arthaḥ nyatra uktaḥ iti abhidhāya 
MBSritattvacintamani_1-5_HK-2441	dīpo'dya (?) saṃpravakṣyāmi yaduktaṃ brahmajāmale |	saṃpravakṣyāmi yat uktam brahmajāmale 
MBSritattvacintamani_1-5_HK-2442	prāsādagrāmagehādyā jñeyā yena śubhāśubhāḥ ||	prāsāda grāma geha ādyāḥ jñeyāḥ yena śubha aśubhāḥ 
MBSritattvacintamani_1-5_HK-2443	kakārādikṣakārāntā varṇāḥ syurdīpasaṃjñakāḥ |	kakāra ādi kṣakāra antāḥ varṇāḥ syuḥ dīpa saṃjñakāḥ 
MBSritattvacintamani_1-5_HK-2444	svarāḥ ṣoḍaśa pīṭhākhyā jñātavyā mattriṇāṃ varaiḥ || iti |	svarāḥ ṣoḍaśa pīṭha ākhyāḥ jñātavyāḥ mattriṇām varaiḥ iti 
MBSritattvacintamani_1-5_HK-2445	tathā  pīṭhasaṃjñā svarāṇāñca dīpāḥ syurvyañjanāni hi |	tathā pīṭha saṃjñā svarāṇām ca dīpāḥ syuḥ vyañjanāni hi 
MBSritattvacintamani_1-5_HK-2446	sthānaṃ dīpākṣaraṃ yasmin koṣṭhe tiṣṭhati tad bhavet |	sthānam dīpa akṣaram yasmin koṣṭhe tiṣṭhati tat bhavet 
MBSritattvacintamani_1-5_HK-2447	dīpasthānaṃ tadetat syāt kūrmacakre na saṃśayaḥ ||	dīpa sthānam tat etat syāt kūrma cakre na saṃśayaḥ 
MBSritattvacintamani_1-5_HK-2448	iti coktam | etena dikakoṣṭhāni vyañjanavarṇamayāni dīpasthānāni | antaḥsthāni	iti ca uktam etena dika koṣṭhāni vyañjana varṇa mayāni dīpa sthānāni antaḥsthāni 
MBSritattvacintamani_1-5_HK-2449	svaramayāṇyaṣṭakoṣṭhāni tu pīṭhasaṃjñakānītyavagamyate | evañcānena svarāṇāṃ	svara mayāṇi aṣṭa koṣṭhāni tu pīṭha saṃjñakāni iti avagamyate evam ca anena svarāṇām 
MBSritattvacintamani_1-5_HK-2450	pīṭharūpatayā teṣāṃ varjanamuktam, prakṛte'pi śrīmatpūrṇānandena udare duḥkhamadhikam iti	pīṭha rūpa tayā teṣām varjanam uktam prakṛte api śrīmat pūrṇānandena udare duḥkham adhikam iti 
MBSritattvacintamani_1-5_HK-2451	vadatā udarasthānāṃ svaravarṇānāṃ varjanīyatvamabhihitamiti na kaścidu virodhaḥ |	vadatā udara sthānām svara varṇānām varjanīya tvam abhihitam iti na kaścid u virodhaḥ 
MBSritattvacintamani_1-5_HK-2452	(dīkṣāyāṃ vāstuyāgasya kartavyatā)	dīkṣāyām vāstuyāgasya kartavya tā 
MBSritattvacintamani_1-5_HK-2453	atha vakṣyāmi dīkṣāngaṃ vāstuyāgapuraḥsaram |	atha vakṣyāmi dīkṣā angam vāstuyāga puraḥsaram 
MBSritattvacintamani_1-5_HK-2454	kṛtena yena vidhivaddīkṣāyāḥ phalamāpnuyāt || 11 ||	kṛtena yena vidhivat dīkṣāyāḥ phalam āpnuyāt 
