segmentnr	original	analyzed
MBSritattvacintamani_1-5_HK-3389	dīkṣādinapūrvadinato navame vā saptame vetyevaṃkrameṇāṅkurārpaṇadivasā nirūpaṇīyāḥ |	dīkṣā dina pūrva dinataḥ navame vā saptame vā iti evaṃkrameṇa aṅkura arpaṇa divasāḥ nirūpaṇīyāḥ 
MBSritattvacintamani_1-5_HK-3390	ityuktam |	iti uktam 
MBSritattvacintamani_1-5_HK-3391	(aṅkurārpaṇe śālānirmāṇam)	aṅkura arpaṇe śālā nirmāṇam 
MBSritattvacintamani_1-5_HK-3392	maṇḍapasyottare bhāge śālāṃ pūrvāparāyatām |	maṇḍapasya uttare bhāge śālām pūrva apara āyatām 
MBSritattvacintamani_1-5_HK-3393	daśahastasuvistārāṃ pañcahastasuvistṛtām |	daśa hasta su vistārām pañca hasta su vistṛtām 
MBSritattvacintamani_1-5_HK-3394	gūḍhāṃ kuryāttatastasyāṃ maṇḍalaṃ racayet sudhīḥ || 33 ||	gūḍhām kuryāt tatas tasyām maṇḍalam racayet sudhīḥ 
MBSritattvacintamani_1-5_HK-3395	(maṇḍalanirmāṇakramaḥ)	         
MBSritattvacintamani_1-5_HK-3396	pañcahastapramāṇāni pañca sūtrāṇi pātayet |	pañca hasta pramāṇāni pañca sūtrāṇi pātayet 
MBSritattvacintamani_1-5_HK-3397	pūrvāparāyatānyeṣāmantaraṃ dvādaśāṅgulam || 34 ||	pūrva apara āyatāni eṣām antaram dvādaśa aṅgulam 
MBSritattvacintamani_1-5_HK-3398	dakṣiṇottarasūtrāṇi tadvadekādaśā'rpayet |	dakṣiṇa uttara sūtrāṇi tadvat ekādaśa arpayet 
MBSritattvacintamani_1-5_HK-3399	padāni tatra jāyante catvāriṃśat pramārjayet || 35 ||	padāni tatra jāyante catvāriṃśat pramārjayet 
MBSritattvacintamani_1-5_HK-3400	33 | aṅkurārpaṇakarmāṅgabhūtaśālānirmāṇamāha-maṇḍapasyeti | maṇḍapasya	aṅkura arpaṇa karma aṅga bhūta śālā nirmāṇam āha maṇḍapasya iti maṇḍapasya 
MBSritattvacintamani_1-5_HK-3401	pūrvamamihitasya uttare bhāge pūrvāparāyatāṃ dāgahastasuvistārāṃ dairghyeṇa daśahastām,	pūrvam amihitasya uttare bhāge pūrva apara āyatām dāga hasta su vistārām dairghyeṇa daśa hastām 
MBSritattvacintamani_1-5_HK-3402	pañcahastasuvistṛtām āyāmena pañcahasaparimitām, mūḍhāṃ kaṭādibhirāvṛtāṃ	pañca hasta su vistṛtām āyāmena pañca hasa parimitām mūḍhām kaṭa ādibhiḥ āvṛtām 
MBSritattvacintamani_1-5_HK-3403	vātapraveśāyogyāmityathaḥ, śālāṃ kuryāt | rāghavabhaṭṭena śāradātilakatṛtīyapaṭalaṭīkāyām 	vāta praveśa ayogyām iti athar śālām kuryāt rāghavabhaṭṭena śāradātilaka tṛtīya paṭala ṭīkāyām 
MBSritattvacintamani_1-5_HK-3404	maṇḍapasyottare bhāge śālāṃ pūrvāparāyatām |	maṇḍapasya uttare bhāge śālām pūrva apara āyatām 
MBSritattvacintamani_1-5_HK-3405	gūḍhāṃ kuryāttatastasyāṃ maṇḍapaṃ racayet sudhīḥ ||	gūḍhām kuryāt tatas tasyām maṇḍapam racayet sudhīḥ 
MBSritattvacintamani_1-5_HK-3406	iti vacanamullikhya tadvyākhyānāvasare  dīrghacaturasrarūpāṃ gūḍhāṃ paritaḥ kaṭādiparivṛtāṃ	iti vacanam ullikhya tad vyākhyāna avasare dīrgha catur asra rūpām gūḍhām paritas kaṭa ādi parivṛtām 
MBSritattvacintamani_1-5_HK-3407	dakṣiṇaikadvāravatīṃ nivātāñca kuryādityuktam | tatra maṇḍalanirmāṇamāha  tata iti |	dakṣiṇa eka dvāravatīm nivātām ca kuryāt iti uktam tatra maṇḍala nirmāṇam āha tatas iti 
MBSritattvacintamani_1-5_HK-3408	34-35 | aṅkuramaṇḍalanirmāṇaparipāṭīmāha  pañcahastetyādinā sampradāyavidhānata	     āha                
MBSritattvacintamani_1-5_HK-3409	ityantena | pūrvāparāyatāni pañcahastapramāṇāni dvādaśāṅgulāntaritāni pañca sūtrāṇi	ityantena pūrva apara āyatāni pañca hasta pramāṇāni dvādaśa aṅgula antaritāni pañca sūtrāṇi 
MBSritattvacintamani_1-5_HK-3410	pātayet | evaṃ pūrvāparāyatasūtrapātanāntaraṃ dakṣiṇottarāyatānyekādaśa sūtrāṇi pātayet |	pātayet evam pūrva apara āyata sūtra pātana antaram dakṣiṇa uttara āyatāni ekādaśa sūtrāṇi pātayet 
MBSritattvacintamani_1-5_HK-3411	tadvaditi dvādaśāṅgulāntaritānītyarthaḥ | evaṃ dvādaśāṅgulāntaritaikādaśasūtrapātena	tadvat iti dvādaśa aṅgula antaritāni iti arthaḥ evam dvādaśa aṅgula antarita ekādaśa sūtra pātena 
MBSritattvacintamani_1-5_HK-3412	pūrvāparāyatāḥ pañca hastāḥ saṃgṛhītāḥ syuḥ | padānīti | evaṃ	pūrva apara āyatāḥ pañca hastāḥ saṃgṛhītāḥ syuḥ padāni iti evam 
MBSritattvacintamani_1-5_HK-3413	pūrvāparāyatadakṣiṇottarāyatasūtrapātena tatra maṇḍale catvāriṃśat padāni bhavanti |	pūrva apara āyata dakṣiṇa uttara āyata sūtra pātena tatra maṇḍale catvāriṃśat padāni bhavanti 
MBSritattvacintamani_1-5_HK-3414	pramārjayedityuttaratrābhisambhadhyate | evañcāyaṃ kramaḥ paryavasyati 	pramārjayet iti uttaratra abhisambhadhyate evam ca ayam kramaḥ paryavasyati 
MBSritattvacintamani_1-5_HK-3415	prāguktaśālāistāramadhyabhāge pañcahastapramāṇaṃ pūrvapaścimāyatamekaṃ (?) sūtraṃ dattvā	prāc ukta śālā istāra madhya bhāge pañca hasta pramāṇam pūrva paścima āyatam ekam sūtram dattvā 
MBSritattvacintamani_1-5_HK-3416	taddakṣiṇottarabhāgayordvādaśāṅgulāntarite	tad dakṣiṇa uttara bhāgayoḥ dvādaśa aṅgula antarite 
MBSritattvacintamani_1-5_HK-3417	(tatra padavibhāgaḥ)	tatra pada vibhāgaḥ 
MBSritattvacintamani_1-5_HK-3418	paṅktyā vīthīścatasrontaścatuṣkobhayapārśvayoḥ |	paṅktyāḥ vīthīḥ catasraḥ antar catuṣka ubhaya pārśvayoḥ 
MBSritattvacintamani_1-5_HK-3419	vīthyau dve ca catuḥkoṣṭhatrayamevāvaśiṣyate || 36 ||	vīthyau dve ca catur koṣṭha trayam eva avaśiṣyate 
MBSritattvacintamani_1-5_HK-3420	(rajasāṃ nyāsaḥ)	rajasām nyāsaḥ 
MBSritattvacintamani_1-5_HK-3421	padāni rañjayet tāni śvetapītāruṇāsitaiḥ || 37 ||	padāni rañjayet tāni śveta pīta aruṇa asitaiḥ 
MBSritattvacintamani_1-5_HK-3422	īśānādikrameṇaiva rajobhiḥ śyāmalena ca |	īśāna ādi krameṇa eva rajobhiḥ śyāmalena ca 
MBSritattvacintamani_1-5_HK-3423	vīthīrāpūrayenmantrī sampradāyavidhānataḥ || 38 ||	vīthīḥ āpūrayet mantrī sampradāya vidhānataḥ 
MBSritattvacintamani_1-5_HK-3424	dve dve sūtre pātayet tatastatsūtravyatibhedīni dakṣiṇottarāyatānyekādaśa sūtrāṇi pātayediti |	dve dve sūtre pātayet tatas tad sūtra vyatibhedīni dakṣiṇa uttara āyatāni ekādaśa sūtrāṇi pātayet iti 
MBSritattvacintamani_1-5_HK-3425	rāghavabhaṭṭadhṛtaprayogasāre tu 	rāghavabhaṭṭa dhṛta prayogasāre tu 
MBSritattvacintamani_1-5_HK-3426	prasāryāsphoṭayet sūtraṃ yathā yāmyottarāyatam |	prasārya āsphoṭayet sūtram yathā yāmya uttara āyatam 
MBSritattvacintamani_1-5_HK-3427	pañcahastapramāṇena dve dve pārśve ca pātayet ||	pañca hasta pramāṇena dve dve pārśve ca pātayet 
MBSritattvacintamani_1-5_HK-3428	tadvat pūrvoktamānena dvādaśadvādaśāṅgule |	tadvat pūrva ukta mānena dvādaśa dvādaśa aṅgule 
MBSritattvacintamani_1-5_HK-3429	prāk prayak ca samaṃ paścāt sūtrāṇyekādaśa krmāt |	prāk prayak ca samam paścāt sūtrāṇi ekādaśa krmāt 
MBSritattvacintamani_1-5_HK-3430	pātayettāsu rekhāsu pūrvasūtrāntarāntaram || iti |	pātayet tāsu rekhāsu pūrva sūtra antara antaram iti 
MBSritattvacintamani_1-5_HK-3431	atra yāmyottarāyatāḥ pañca rekhāḥ pūrvapaścimāyatāścaikādaśeti	atra yāmya uttara āyatāḥ pañca rekhāḥ pūrva paścima āyatāḥ ca ekādaśa iti 
MBSritattvacintamani_1-5_HK-3432	mūloktakramādrekhāpāte viśeṣo dṛśyate | tadevamatra rekhāpāte viśeṣadarśanāt	mūla ukta kramāt rekhāpāte viśeṣaḥ dṛśyate tat evam atra rekhāpāte viśeṣa darśanāt 
MBSritattvacintamani_1-5_HK-3433	svasvasampradāyānusāreṇaikataraṃ matamāśrayaṇīyamiti siddhantaḥ | ata eva sampradāyavidhānata	sva sva sampradāya anusāreṇa ekataram matam āśrayaṇīyam iti siddhantaḥ atas eva sampradāya vidhānata 
MBSritattvacintamani_1-5_HK-3434	iti vakṣyati |	iti vakṣyati 
MBSritattvacintamani_1-5_HK-3435	36 | teṣu padeṣu vīthyādinirmāṇamāha  paṅktyeti | paṅktyā catasro vīthīḥ pramārjayet iti	teṣu padeṣu vīthi ādi nirmāṇam āha paṅktyā iti paṅktyā catasraḥ vīthīḥ pramārjayet iti 
MBSritattvacintamani_1-5_HK-3436	pūrveṇānvayaḥ | antariti vakṣyamāṇatvādetā vahirvīthya ityavadheyam | tathāca pūrve	pūrveṇa anvayaḥ antar iti vakṣyamāṇa tvāt etāḥ vahis vīthyaḥ iti avadheyam tathā ca pūrve 
MBSritattvacintamani_1-5_HK-3437	catuḥkoṣṭhāmekāṃ vīthīm, dakṣiṇe'ṣṭakoṣṭhāmaparām, paścime catuḥkoṣṭhāmanyām, uttare	catur koṣṭhām ekām vīthīm dakṣiṇeṣṭa koṣṭhām aparām paścime catur koṣṭhām anyām uttare 
MBSritattvacintamani_1-5_HK-3438	cāṣṭakoṣthāmitarāṃ kūrvītetyuktaṃ bhavati | athāntarvīthidvayamāha  antariti | antaścatuṣkāṇāṃ	ca aṣṭa koṣthām itarām kūrvīta iti uktam bhavati atha antar vīthi dvayam āha antar iti antar catuṣkāṇām 
MBSritattvacintamani_1-5_HK-3439	catuṣkatrayasyetyarthaḥ, ubhayapārśvayordve vīthyau dvidvikoṣṭharūpe mārjayedityarthaḥ | evaṃ krte	catuṣka trayasya iti arthaḥ ubhaya pārśvayoḥ dve vīthyau dvi dvi koṣṭha rūpe mārjayet iti arthaḥ 
MBSritattvacintamani_1-5_HK-3440	phalitamāha  catuḥkoṣṭhatrayamevāvaśiṣyata iti |	phalitam āha catur koṣṭha trayam eva avaśiṣyate iti 
MBSritattvacintamani_1-5_HK-3441	37-38 | athāntaścatuṣkatrayasya rajasā'pūraṇamāha-padānīti | īśānādikrameṇaiva tāni	                            
MBSritattvacintamani_1-5_HK-3442	padāni antaḥpraticatuṣkasthacatuścatuḥpadāni krameṇa śvetapītāruṇāsitai rajobhiḥ	padāni antar prati catuṣka stha catur catur padāni krameṇa śveta pīta aruṇa asitaiḥ rajobhiḥ 
MBSritattvacintamani_1-5_HK-3443	āpūrayedityarthaḥ | evañca praticatuṣkam īśānakoṣṭhaṃ śvetam, āgneyaṃ pītam, nair-ṛtaṃ raktam,	āpūrayet iti arthaḥ evam ca prati catuṣkam īśāna koṣṭham śvetam āgneyam pītam nairṛtam raktam 
MBSritattvacintamani_1-5_HK-3444	vāyavyañca kṛṣṇam ityuktaṃ bhavati |	vāyavyam ca kṛṣṇam iti uktam bhavati 
MBSritattvacintamani_1-5_HK-3445	śāradāyāṃ tṛtīyapaṭale 	śāradāyām tṛtīya paṭale 
MBSritattvacintamani_1-5_HK-3446	padāni rañjayettāni śvetapītāruṇāsitaiḥ |	padāni rañjayet tāni śveta pīta aruṇa asitaiḥ 
MBSritattvacintamani_1-5_HK-3447	rajobhiḥ śyāmalenātha vīthīrāpūrayettataḥ ||	rajobhiḥ śyāmalena atha vīthīḥ āpūrayet tatas 
MBSritattvacintamani_1-5_HK-3448	iti vacanena padānāṃ rajobhiḥ pūraṇamātramabhihitam na tu rajonyāsasya kramo'bhihita iti |	iti vacanena padānām rajobhiḥ pūraṇa mātram abhihitam na tu rajaḥ nyāsasya kramaḥ abhihitaḥ iti 
MBSritattvacintamani_1-5_HK-3449	etadvyākhyāne rāghavabhaṭṭena 	         
MBSritattvacintamani_1-5_HK-3450	pītāraktasitāsitaṃ pratipadaṃ vahnyādiśarvāntakam |	pīta ārakta sita asitam pratipadam vahni ādi śarva antakam 
MBSritattvacintamani_1-5_HK-3451	iti prapañcasāravacanaikadeśamulikhya vahnyādikrameṇa pītādirajasāṃ nyāsaḥ pramāṇīkṛtaḥ |	iti prapañca sāra vacana eka deśam ulikhya vahni ādi krameṇa pīta ādi rajasām nyāsaḥ pramāṇīkṛtaḥ 
MBSritattvacintamani_1-5_HK-3452	etanmate āgneyapadaṃ pītam, nai-ṛtapadaṃ raktam, vāyavyapadaṃ śvetam, aiśānapadañca	etad mate āgneya padam pītam naiṛta padam raktam vāyavya padam śvetam aiśāna padam ca 
MBSritattvacintamani_1-5_HK-3453	kṛṣṇamityavagamyate |	kṛṣṇam iti avagamyate 
MBSritattvacintamani_1-5_HK-3454	na ca, prasāryāsphālayet sūtramityādiprāguktaprayogasāravacanaprāpta-	na ca prasārya āsphālayet sūtram ityādi prāgukta prayoga sāra vacana prāpta 
MBSritattvacintamani_1-5_HK-3455	yābhyottarāyatapañcarekhāpātakalpe vahnyādikrameṇa pītādivarṇānāṃ nyāsaḥ kalpyatāṃ,	vahni ādi krameṇa pīta ādi varṇānām nyāsaḥ kalpyatām 
MBSritattvacintamani_1-5_HK-3456	śrītattvacintāmaṇau pūrvāparāyatapañcarekhāpātakalpe īśānādikrameṇa pītādirajasāṃ nyāsasya	śrī tattvacintāmaṇau pūrva apara āyata pañca rekhā pāta kalpe īśāna ādi krameṇa pīta ādi rajasām nyāsasya 
MBSritattvacintamani_1-5_HK-3457	viśiṣyābhidhānāsatraiva īśānādikramo'stviti vācyam,	viśiṣya abhidhānāt atra eva īśāna ādi kramaḥ ustu iti vācyam 
MBSritattvacintamani_1-5_HK-3458	pītāraktasitāsitamityādiprāguktaprapañcasāravacanaikadeśasya yāmyodīcyasamāyataṃ	pīta ārakta sita asitam ityādi prāgukta prapañca sāra vacana eka deśasya yāmya udīcya samāyatam 
MBSritattvacintamani_1-5_HK-3459	praṇigadantyanye'pi tanmantriṇaḥ | iti parapādaparyālocanayā rekhāpatasya dvividhe'pi kalpe	praṇigadanti anye api tad mantriṇaḥ iti para pāda paryālocanayā rekhāpatasya dvividhe api kalpe 
MBSritattvacintamani_1-5_HK-3460	śrīmadācāryapādairvahnyādikrameṇaiva rajonyāsabhidhānāt | tasmāt prāguktaśrītattvacntāmaṇi-	                                                                                          
MBSritattvacintamani_1-5_HK-3461	prapancasāravacanaparyālocanayā sampradāyānusāreṇībhayavidhe'pi maṇḍale īśānādikramatā vā	prapancasāra vacana paryālocanayā sampradāya anusāreṇa ibhayavidhe api maṇḍale īśāna ādi kramatā vā 
MBSritattvacintamani_1-5_HK-3462	vahnyādikramato vā pītādirajasāṃ nyāsaḥ kartavya ityubhayasampradāyajñāpanārthameva mūle	vahni ādi kramataḥ vā pīta ādi rajasām nyāsaḥ kartavyaḥ iti ubhaya sampradāya jñāpana artham eva mūle 
MBSritattvacintamani_1-5_HK-3463	sampradāyavidhānata ityuktamiti sarvamavadātam |	sampradāya vidhānataḥ iti uktam iti sarvam avadātam 
MBSritattvacintamani_1-5_HK-3464	śyāmalena ceti | śyāmalavarṇena vīthīḥ bahiścaturdiksaṃsthā antaśca pūrvāparasaṃsthā	śyāmalena ca iti śyāmala varṇena vīthīḥ bahis catur diś saṃsthā antar ca pūrva apara saṃsthā 
MBSritattvacintamani_1-5_HK-3465	dvidvipadā appurayedityarthaḥ |	dvi dvi padāḥ 
MBSritattvacintamani_1-5_HK-3466	hayaśīrṣapañcarātre tu-	hayaśīrṣapañcarātre tu 
MBSritattvacintamani_1-5_HK-3467	pañcahastapramāṇāni daśa sūtrāṇi pātayet |	pañca hasta pramāṇāni daśa sūtrāṇi pātayet 
MBSritattvacintamani_1-5_HK-3468	navadhā bhedite kṣetra ekāśītipadaṃ bhavet ||	navadhā bhedite kṣetre ekāśīti padam bhavet 
MBSritattvacintamani_1-5_HK-3469	vīthyau madhye dve ca ṣaṭkaṃ mārjayet koṇapārśvayoḥ |	vīthyau madhye dve ca ṣaṭkam mārjayet koṇa pārśvayoḥ 
MBSritattvacintamani_1-5_HK-3470	śobhārthaṃ racayenmadhye padmaṃ navabhireva ca ||	śobhā artham racayet madhye padmam navabhiḥ eva ca 
MBSritattvacintamani_1-5_HK-3471	(tatrāṅkarārpaṇapātrāṇi)	tatra aṅkara arpaṇa pātrāṇi 
MBSritattvacintamani_1-5_HK-3472	pātrāṇi trividhānyāhuraṅkurārpaṇakarmaṇi |	pātrāṇi trividhāni āhuḥ aṅkura arpaṇa karmaṇi 
MBSritattvacintamani_1-5_HK-3473	pālikāḥ pañcamukhyaśca śarāvāśca catuḥkramāt |	pālikāḥ pañcamukhyaḥ ca śarāvāḥ ca catur kramāt 
MBSritattvacintamani_1-5_HK-3474	proktāḥ syuḥ sarvatantrajñairharibrahmaśivātmakāḥ || 39 ||	proktāḥ syuḥ sarva tantra jñaiḥ hari brahma śiva ātmakāḥ 
MBSritattvacintamani_1-5_HK-3475	(tatra pālikā)	tatra pālikā 
MBSritattvacintamani_1-5_HK-3476	pālikāvaktravistāraḥ ṣoḍaśāṅgula ucyate |	pālikā vaktra vistāraḥ ṣoḍaśa aṅgulaḥ ucyate 
MBSritattvacintamani_1-5_HK-3477	bhavet kaṇṭhavilañcāsyāstadaṣṭāṅgulavistṛtam || 40 ||	bhavet 
MBSritattvacintamani_1-5_HK-3478	padāni rañjayet paścāc śvetapītāruṇāsitaiḥ |	padāni rañjayet paścāt śveta pīta aruṇa asitaiḥ 
MBSritattvacintamani_1-5_HK-3479	rajobhiḥ śyāmalenātha vīthīrāpūrayettataḥ ||	rajobhiḥ śyāmalena atha vīthīḥ āpūrayet tatas 
MBSritattvacintamani_1-5_HK-3480	ityanenaikāśītipadātmakamaṇḍalamabhihitam | evañcāyamapyaparaḥ sampradāya ityavadheyam |	iti anena ekāśīti pada ātmaka maṇḍalam abhihitam evam ca ayam api aparaḥ sampradāyaḥ iti avadheyam 
MBSritattvacintamani_1-5_HK-3481	39 | athāṅkurapātrāṇyupadiśati  pātrāṇīti | pālikāḥ pañcamukhyaḥ śarāvāśceti	atha aṅkura pātrāṇi upadiśati pātrāṇi iti pālikāḥ pañcamukhyaḥ śarāvāḥ ca iti 
MBSritattvacintamani_1-5_HK-3482	trividhāni pātrāṇi aṅkurārpaṇakarmaṇi vihitānyāhuriti sambandhaḥ | tatra pālikādīnāmarthāḥ	trividhāni pātrāṇi aṅkura arpaṇa karmaṇi vihitāni āhuḥ iti sambandhaḥ tatra pālikā ādīnām arthāḥ 
MBSritattvacintamani_1-5_HK-3483	pradarśitā rāghavabhaṭṭena  sthūlānyuccāni śarāvāṇyena pālikāśabdenocyante | pālikā eva	pradarśitāḥ rāghavabhaṭṭena sthūlāni uccāni śarāvāṇi ena pālikā śabdena ucyante pālikāḥ eva 
MBSritattvacintamani_1-5_HK-3484	kiñcinnicāḥ pañcamukhayuktāḥ pañcamukhya ucyante | śarāvāḥ prasiddhaḥ iti |	kiñcid nicāḥ pañcamukha yuktāḥ pañcamukhyaḥ ucyante śarāvāḥ prasiddhaḥ iti 
MBSritattvacintamani_1-5_HK-3485	etatsamānānupūrvīkaśāradātilakavacanavyākhyāne  sarvatantrajñairityanena	etad samāna ānupūrvīka śāradātilaka vacana vyākhyāne sarva tantra jñaiḥ iti anena 
MBSritattvacintamani_1-5_HK-3486	pañcadevatādīkṣādikarmasu pātrabhedo nāstīti rāghavabhaṭṭāḥ | catuḥkramādityanena	pañca devatā dīkṣā ādi karmasu pātra bhedaḥ na asti iti rāghava bhaṭṭāḥ catur kramāt iti anena 
MBSritattvacintamani_1-5_HK-3487	madhacatuṣkatraye praticatuṣkaṃ catvāri catvāri pālikādīni sthāpanīyānityuktam | sthāpanañcedaṃ	madha catuṣka traye praticatuṣkam catvāri catvāri pālikā ādīni sthāpanīyāni iti uktam sthāpanam ca idam 
MBSritattvacintamani_1-5_HK-3488	paścimādikrameṇeti svayameva vakṣyati | haribrahmaśivātmakā iti pālikā harirūpāḥ, pañcamukhyo	paścima ādi krameṇa iti svayam eva vakṣyati hari brahma śiva ātmakāḥ iti pālikāḥ hari rūpāḥ 
MBSritattvacintamani_1-5_HK-3489	brahmarūpāḥ, śarāvāśca śivarūpā ityarthaḥ, etenaiteṣu pātreṣu krameṇa haribrahmaśivāḥ	brahma rūpāḥ śarāvāḥ ca śiva rūpāḥ iti arthaḥ etena eteṣu pātreṣu krameṇa hari brahma śivāḥ 
MBSritattvacintamani_1-5_HK-3490	pūjanīyā ityuktam |	pūjanīyāḥ iti uktam 
MBSritattvacintamani_1-5_HK-3491	taduktaṃ vaidikasarvasvadhṛtakāpile 	tat uktam vaidika sarvasva dhṛta kāpile 
MBSritattvacintamani_1-5_HK-3492	vaiṣṇavī pālikā jñeyā brāhmī tu ghaṭikocyate |	vaiṣṇavī pālikā jñeyā brāhmī tu ghaṭikā ucyate 
MBSritattvacintamani_1-5_HK-3493	śāṅkarantu śarāvaṃ syāt trayametat tridaivatam || iti	śāṅkaram tu śarāvam syāt trayam etat tri daivatam iti 
MBSritattvacintamani_1-5_HK-3494	40-41 | idānīṃ kramaprāptaṃ pālikālakṣaṇamāha-pāliketi | pālikā śarāva-	idānīm krama prāptam pālikā lakṣaṇam āha pālikā iti pālikā śarāva 
MBSritattvacintamani_1-5_HK-3495	pādapīṭhasya vistāraḥ ṣaḍaṅgula udīritaḥ |	pāda pīṭhasya vistāraḥ ṣaṣ aṅgulaḥ udīritaḥ 
MBSritattvacintamani_1-5_HK-3496	caturaṅgula utsedhastatsandhiścāṅgulaṃ bhavet |	catur aṅgulaḥ utsedhaḥ tad sandhiḥ ca aṅgulam bhavet 
MBSritattvacintamani_1-5_HK-3497	tatsandhiśca bhaved dvau vā pādapīṭhārddhameva ca || 41 ||	tad sandhiḥ ca bhavet dvau vā pāda pīṭha arddham eva ca 
MBSritattvacintamani_1-5_HK-3498	(pañcamukhī)	pañca mukhī 
MBSritattvacintamani_1-5_HK-3499	bhavet pañcamukhī caiva ghaṭikā sarvakāmadā |	bhavet pañcamukhī ca eva ghaṭikā sarva kāma dā 
MBSritattvacintamani_1-5_HK-3500	caturaṅgulavistārāṇyāhurvaktrāṇi pañca vai || 42 ||	catur aṅgula vistārāṇi āhuḥ vaktrāṇi pañca vai 
MBSritattvacintamani_1-5_HK-3501	catvāri ca caturdikṣu ūrddhvamekaṃ yathāvidhi |	catvāri ca catur dikṣu ūrddhvam ekam yathāvidhi 
MBSritattvacintamani_1-5_HK-3502	ghaṭikā'yāmavistāro dvādaśāṅgula ucyate || 43 ||	ghaṭikā āyāma vistāraḥ dvādaśa aṅgulaḥ ucyate 
MBSritattvacintamani_1-5_HK-3503	ācāryāḥ kathayantyeke ṣoḍaśāṅgulameva vā || 44 ||	ācāryāḥ kathayanti eke ṣoḍaśa aṅgulam eva vā 
MBSritattvacintamani_1-5_HK-3504	viśeṣaḥ, tasya mukhasya vistāraṇ ṣoḍaśāṅgulaḥ | kaṇṭhasthavilasya vistāro'ṣṭāṅgulaḥ |	viśeṣaḥ tasya mukhasya ṣoḍaśa aṅgulaḥ kaṇṭha sthavilasya vistāraḥ uṣṭa aṅgulaḥ 
MBSritattvacintamani_1-5_HK-3505	pādapīṭhasya adhaḥpradeśasya vistāraḥ ṣaḍaṅgula iti | utsedhaścaturaṅgulaḥ | tatsandhiriti | tasya	pāda pīṭhasya adhas pradeśasya vistāraḥ ṣaṣ aṅgulaḥ iti utsedhaḥ catur aṅgulaḥ tad sandhiḥ iti tasya 
MBSritattvacintamani_1-5_HK-3506	pādapīṭhasya sandhiḥ śarāvapādapīṭhayoḥ saṃyogasthalamityartthaḥ | idaṃ sandhiparimāṇaṃ	pāda pīṭhasya sandhiḥ śarāva pāda pīṭhayoḥ saṃyoga sthalam iti artthaḥ idam sandhi parimāṇam 
MBSritattvacintamani_1-5_HK-3507	dvyaṅgulaṃ vā tryaṅguaṃ vāpi bhavitumarhati ityevāha  tatsandhiścetyādinā | atra	dvi aṅgulam vā tri aṅguam vā api bhavitum arhati iti eva āha tad sandhiḥ ca ityādinā atra 
MBSritattvacintamani_1-5_HK-3508	pādapīṭhasyātsedhārddhena dvyaṅgulam, vistārārddhena tryaṅgulaṃ vetyavadheyam |	dvi aṅgulam vistāra arddhena tri aṅgulam vā iti avadheyam 
MBSritattvacintamani_1-5_HK-3509	42-44 | pañcamukhīlakṣaṇamāha  bhavediti | asyāḥ pañcamukhyāḥ pañca mukhāni tāni	                
MBSritattvacintamani_1-5_HK-3510	ca sarvāṇyeva catuścaturaṅgulavistārāṇi + teṣāñca mukhānāṃ sthānamāha  catvārīti |	ca sarvāṇi eva catur catur aṅgula vistārāṇi teṣām ca mukhānām sthānam āha catvāri iti 
MBSritattvacintamani_1-5_HK-3511	caturdikṣu catvāri madhye caikamiti pañca | asyā ghaṭiketi nāmāntaram | ghaṭikaiva	catur dikṣu catvāri madhye ca ekam iti pañca asyāḥ ghaṭikā iti nāma antaram ghaṭikā eva 
MBSritattvacintamani_1-5_HK-3512	pañcamukhayuktā pañcamukhītyarthaḥ | ata eva ghaṭikāyāmavistāra ityādinā pañcamukhyā	pañca mukha yuktā pañca mukhā iti arthaḥ atas eva ghaṭikā āyāma vistāraḥ ityādinā pañca mukhyā 
MBSritattvacintamani_1-5_HK-3513	evāyāmavistārau pratipāditau | ghaṭikāyā āyāmo dairghyam aunnatyamityarthaḥ, vistāro vyāsaśca	eva āyāma vistārau pratipāditau ghaṭikāyāḥ āyāmaḥ dairghyam aunnatyam iti arthaḥ vistāraḥ vyāsaḥ ca 
MBSritattvacintamani_1-5_HK-3514	dvādaśāṅgulaparimāṇaḥ | na ca vistāra ityekavacanād āyāmasya vistāra iti ṣaṣṭhīsamāsa iti	dvādaśa aṅgula parimāṇaḥ na ca vistāraḥ iti ekavacanāt āyāmasya vistāraḥ iti ṣaṣṭhī samāsaḥ iti 
MBSritattvacintamani_1-5_HK-3515	vācyaṃ vacanāntareṇaunnatyasyāpratipādanāt,	vācyam vacana antareṇa aunnatyasya apratipādanāt 
MBSritattvacintamani_1-5_HK-3516	āyāmavistarābhyāntu ghaṭikā dvādaśāṅgulā |	āyāma vistarābhyān tu ghaṭikā dvādaśa aṅgulā 
MBSritattvacintamani_1-5_HK-3517	iti hayaśīrṣapañcarātrīyasaṅkarṣakāṇḍavacanasaṃvādācca āyāmavistārayorubhayoreva	iti hayaśīrṣa pañcarātrīya saṅkarṣa kāṇḍa vacana saṃvādāt ca āyāma vistārayoḥ ubhayoḥ eva 
MBSritattvacintamani_1-5_HK-3518	dvādaśāṅgulaparimāṇatvapratipādanāt | tasmādāyāmena sahito vistāra ityevārthaḥ	dvādaśa aṅgula parimāṇa tva pratipādanāt tasmāt āyāmena sahitaḥ vistāraḥ iti eva arthaḥ 
MBSritattvacintamani_1-5_HK-3519	(śarāvaḥ)	śarāvaḥ 
MBSritattvacintamani_1-5_HK-3520	dvādaśāṅgulavistāraṃ śarāvasya mukhaṃ smṛtam |	dvādaśa aṅgula vistāram śarāvasya mukham smṛtam 
MBSritattvacintamani_1-5_HK-3521	caturaṅgulavistāramadhastā * nmūlamucyate || 45 ||	catur aṅgula vistāram adhastāt mūlam ucyate   
MBSritattvacintamani_1-5_HK-3522	(pālikādīnāṃ parimāṇe viśeṣaḥ)	pālikā ādīnām parimāṇe viśeṣaḥ 
MBSritattvacintamani_1-5_HK-3523	yathāsambhavamānaṃ vā kenāpītyabhidhīyate || 46 ||	yathā sambhavamānam vā kena api iti abhidhīyate 
MBSritattvacintamani_1-5_HK-3524	samyak | ācāryā iti kecidācāryā ghaṭikāyā vistārā'yāmau ṣoḍaśāṅgulāviti vadantītyarthaḥ |	samyak ācāryāḥ iti kecid ācāryāḥ ghaṭikāyāḥ vistāra āyāmau ṣoḍaśa aṅgulau iti vadanti iti arthaḥ 
MBSritattvacintamani_1-5_HK-3525	45 | kramaprāptaṃ śarāvasvarūpamāha  dvādaśeti | śarāvasya mukhaṃ	krama prāptam śarāva svarūpam āha dvādaśa iti śarāvasya mukham 
MBSritattvacintamani_1-5_HK-3526	dvādaśāṅgulaparimāṇaṃ mūlaṃ caturaṅgulamiti |	dvādaśa aṅgula parimāṇam mūlam catur aṅgulam iti 
MBSritattvacintamani_1-5_HK-3527	eṣāmucchrāya upadiṣṭhaḥ śāradāyāṃ tṛtīyapaṭale 	eṣām ucchrāyaḥ upadiṣṭhaḥ śāradāyām tṛtīya paṭale 
MBSritattvacintamani_1-5_HK-3528	pātrāṇi trividhānyāhuraṅkurārpaṇakarmaṇi |	pātrāṇi trividhāni āhuḥ aṅkura arpaṇa karmaṇi 
MBSritattvacintamani_1-5_HK-3529	pālikāḥ pañcamukhyaśca śarāvāśca catuḥkramāt ||	pālikāḥ pañcamukhyaḥ ca śarāvāḥ ca catur kramāt 
