segmentnr	original	analyzed
SA_GSP33_brahmsuu-465	maunavad itareṣām apy upadeśāt / BBs_3,4.48 /	mauna vat itareṣām api upadeśāt 
SA_GSP33_brahmsuu-466	anāviṣkurvann anvayāt / BBs_3,4.49 /	an āviṣkurvan anvayāt 
SA_GSP33_brahmsuu-467	aihikam aprastutapratibandhe taddarśanāt / BBs_3,4.50 /	aihikam aprastuta pratibandhe tad darśanāt 
SA_GSP33_brahmsuu-468	evaṃ muktiphalāniyamas tadavasthāvadhṛtes tadavasthāvadhṛteḥ / BBs_3,4.51 /	evam mukti phala aniyamaḥ tad avasthā avadhṛteḥ tad avasthā avadhṛteḥ 
SA_GSP33_brahmsuu-469	āvṛttir asakṛdupadeśāt / BBs_4,1.1 /	āvṛttiḥ asakṛt upadeśāt 
SA_GSP33_brahmsuu-470	liṅgāc ca / BBs_4,1.2 /	liṅgāt ca 
SA_GSP33_brahmsuu-471	ātmeti tūpagacchanti grāhayanti ca / BBs_4,1.3 /	ātmā iti tu upagacchanti grāhayanti ca 
SA_GSP33_brahmsuu-472	na pratīke na hi saḥ / BBs_4,1.4 /	na pratīke na hi saḥ 
SA_GSP33_brahmsuu-473	brahmadṛṣṭir utkarṣāt / BBs_4,1.5 /	brahma dṛṣṭiḥ utkarṣāt 
SA_GSP33_brahmsuu-474	ādityādimatayaś cāṅga upapatteḥ / BBs_4,1.6 /	āditya ādi matayaḥ ca aṅge upapatteḥ  /
SA_GSP33_brahmsuu-475	āsīnaḥ saṃbhavāt / BBs_4,1.7 /	āsīnaḥ saṃbhavāt 
SA_GSP33_brahmsuu-476	dhyānāc ca / BBs_4,1.8 /	dhyānāt ca 
SA_GSP33_brahmsuu-477	acalatvaṃ cāpekṣya / BBs_4,1.9 /	acala tvam ca apekṣya 
SA_GSP33_brahmsuu-478	smaranti ca / BBs_4,1.10 /	smaranti ca 
SA_GSP33_brahmsuu-479	yatraikāgratā tatrāviśeṣāt / BBs_4,1.11 /	yatra ekāgra tā tatra aviśeṣāt 
SA_GSP33_brahmsuu-480	āprayāṇāt tatrāpi hi dṛṣṭam / BBs_4,1.12 /	āprayāṇāt tatra api hi dṛṣṭam  /
SA_GSP33_brahmsuu-481	tadadhigama uttarapūrvāghayor aśleṣavināśau tadvyapadeśāt / BBs_4,1.13 /	tad adhigame uttara pūrva aghayoḥ aśleṣa vināśau tad vyapadeśāt 
SA_GSP33_brahmsuu-482	itarasyāpy evam asaṃśleṣaḥ pāte tu / BBs_4,1.14 /	itarasya api evam asaṃśleṣaḥ pāte tu 
SA_GSP33_brahmsuu-483	anārabdhakārye eva tu pūrve tadavadheḥ / BBs_4,1.15 /	anārabdha kārye eva tu pūrve tad avadheḥ 
SA_GSP33_brahmsuu-484	agnihotrādi tu tatkāryāyaiva taddarśanāt / BBs_4,1.16 /	agnihotra ādi tu tad kāryāya eva tad darśanāt 
SA_GSP33_brahmsuu-485	ato 'nyāpi hy ekeṣām ubhayoḥ / BBs_4,1.17 /	atas nya api hi ekeṣām ubhayoḥ  /
SA_GSP33_brahmsuu-486	yad eva vidyayeti hi / BBs_4,1.18 /	yat eva vidyayā iti hi 
SA_GSP33_brahmsuu-487	bhogena tv itare kṣapayitvātha saṃpadyate / BBs_4,1.19 /	bhogena tu itare kṣapayitvā atha saṃpadyate  /
SA_GSP33_brahmsuu-488	vāṅmanasi darśanāc chabdāc ca / BBs_4,2.1 /	vāc manasi darśanāt śabdāt ca 
SA_GSP33_brahmsuu-489	ata eva sarvāṇyanu / BBs_4,2.2 /	atas eva sarvāṇi anu 
SA_GSP33_brahmsuu-490	tanmanaḥ prāṇa uttarāt / BBs_4,2.3 /	tat manaḥ prāṇaḥ uttarāt 
SA_GSP33_brahmsuu-491	so 'dhyakṣe tadupagamādibhyaḥ / BBs_4,2.4 /	saḥ dhī akṣe tad upagama ādibhyaḥ 
SA_GSP33_brahmsuu-492	bhūteṣu tacchruteḥ / BBs_4,2.5 /	bhūteṣu tad śruteḥ 
SA_GSP33_brahmsuu-493	naikasmin darśayato hi / BBs_4,2.6 /	na ekasmin darśayataḥ hi 
SA_GSP33_brahmsuu-494	samānā cāsṛtyupakramād amṛtatvaṃ cānupoṣya / BBs_4,2.7 /	samānā ca asṛti upakramāt amṛta tvam ca an upoṣya 
SA_GSP33_brahmsuu-495	tadāpīteḥ saṃsāravyapadeśāt / BBs_4,2.8 /	tadā apīteḥ saṃsāra vyapadeśāt 
SA_GSP33_brahmsuu-496	sūkṣmaṃ pramāṇataś ca tathopalabdheḥ / BBs_4,2.9 /	sūkṣmam pramāṇataḥ ca tathā upalabdheḥ 
SA_GSP33_brahmsuu-497	nopamardenātaḥ / BBs_4,2.10 /	na upamardena atas 
SA_GSP33_brahmsuu-498	asyaiva copapatter ūṣmā / BBs_4,2.11 /	asya eva ca upapatteḥ ūṣmā 
SA_GSP33_brahmsuu-499	pratiṣedhād iti cen na śārīrāt spaṣṭo hyekeṣām / BBs_4,2.12 /	pratiṣedhāt iti ced na śārīrāt spaṣṭaḥ hi ekeṣām 
SA_GSP33_brahmsuu-500	smaryate ca / BBs_4,2.13 /	smaryate ca 
SA_GSP33_brahmsuu-501	tāni pare tathā hy āha / BBs_4,2.14 /	tāni pare tathā hi āha  /
SA_GSP33_brahmsuu-502	avibhāgo vacanāt / BBs_4,2.15 /	avibhāgaḥ vacanāt 
SA_GSP33_brahmsuu-503	tadokograjvalanaṃ tatprakāśitadvāro vidyāsāmarthyāt taccheṣagatyanusmṛtiyogāc / BBs_4,2.16 /	tad oka ugra jvalanam tad prakāśita dvāraḥ vidyā sāmarthyāt tad śeṣa gati anusmṛti yogāt 
SA_GSP33_brahmsuu-504	raśmyanusārī / BBs_4,2.17 /	raśmi anusārī 
SA_GSP33_brahmsuu-505	niśi neti cen na sambandhasya yāvaddehabhāvitvād darśayati ca / BBs_4,2.18 /	niśi nā iti ced na sambandhasya yāvaddehabhāvi tvāt darśayati ca 
SA_GSP33_brahmsuu-506	ataś cāyane 'pi dakṣiṇe / BBs_4,2.19 /	atas ca ayane pi dakṣiṇe  /
SA_GSP33_brahmsuu-507	yoginaḥ prati smaryete smārte caite / BBs_4,2.20 /	yoginaḥ prati smaryete smārte ca ete 
SA_GSP33_brahmsuu-508	arcirādinā tatprathiteḥ / BBs_4,3.1 /	arciḥ ādinā tad prathiteḥ 
SA_GSP33_brahmsuu-509	vāyumabdādaviśeṣaviśeṣābhyām / BBs_4,3.2 /	vāyum abdāt aviśeṣa viśeṣābhyām 
SA_GSP33_brahmsuu-510	taṭito 'dhi varuṇaḥ saṃbandhāt / BBs_4,3.3 /	taṭitaḥ dhi varuṇaḥ saṃbandhāt  /
SA_GSP33_brahmsuu-511	ātivāhikās talliṅgāt / BBs_4,3.4 /	ātivāhikāḥ tad liṅgāt  /
SA_GSP33_brahmsuu-512	vaidyutenaiva tatas tacchruteḥ / BBs_4,3.5 /	vaidyutena eva tatas tad śruteḥ  /
SA_GSP33_brahmsuu-513	kāryaṃ bādarirasya gatyupapatteḥ / BBs_4,3.6 /	kāryam bādariḥ asya gati upapatteḥ 
SA_GSP33_brahmsuu-514	viśeṣitatvāc ca / BBs_4,3.7 /	viśeṣita tvāt ca 
SA_GSP33_brahmsuu-515	sāmīpyāt tu tadvyapadeśaḥ / BBs_4,3.8 /	sāmīpyāt tu tad vyapadeśaḥ 
SA_GSP33_brahmsuu-516	kāryātyaye tadadhyakṣeṇa sahātaḥ param abhidhānāt / BBs_4,3.9 /	kārya atyaye tad adhyakṣeṇa saha atas param abhidhānāt 
SA_GSP33_brahmsuu-517	smṛteś ca / BBs_4,3.10 /	smṛteḥ ca 
SA_GSP33_brahmsuu-518	paraṃ jaiminir mukhyatvāt / BBs_4,3.11 /	param jaiminiḥ mukhya tvāt 
SA_GSP33_brahmsuu-519	darśanāc ca / BBs_4,3.12 /	darśanāt ca 
SA_GSP33_brahmsuu-520	na ca kārye pratyabhisandhiḥ / BBs_4,3.13 /	na ca kārye pratyabhisandhiḥ 
SA_GSP33_brahmsuu-521	apratīkālambanān nayatīti bādarāyaṇa ubhayathā ca doṣāt tatkratuś ca / BBs_4,3.14 /	a pratīka ālambanāt nayati iti bādarāyaṇaḥ ubhayathā ca doṣāt tad kratuḥ ca 
SA_GSP33_brahmsuu-522	viśeṣaṃ ca darśayati / BBs_4,3.15 /	viśeṣam ca darśayati 
SA_GSP33_brahmsuu-523	saṃpadyāvirbhāvaḥ svena śabdāt / BBs_4,4.1 /	saṃpadya āvirbhāvaḥ svena śabdāt 
SA_GSP33_brahmsuu-524	muktaḥ pratijñānāt / BBs_4,4.2 /	muktaḥ pratijñānāt 
SA_GSP33_brahmsuu-525	ātmā prakaraṇāt / BBs_4,4.3 /	ātmā prakaraṇāt 
SA_GSP33_brahmsuu-526	avibhāgena dṛṣṭatvāt / BBs_4,4.4 /	avibhāgena dṛṣṭa tvāt 
SA_GSP33_brahmsuu-527	brāhmeṇa jaiminir upanyāsādibhyaḥ / BBs_4,4.5 /	brāhmeṇa jaiminiḥ upanyāsa ādibhyaḥ  /
SA_GSP33_brahmsuu-528	cititanmātreṇa tadātmakatvād ity auḍulomiḥ / BBs_4,4.6 /	citi tanmātreṇa tad ātmaka tvāt iti auḍulomiḥ 
SA_GSP33_brahmsuu-529	evam apy upanyāsāt pūrvabhāvād avirodhaṃ bādarāyaṇaḥ / BBs_4,4.7 /	evam api upanyāsāt pūrva bhāvāt avirodham bādarāyaṇaḥ  /
SA_GSP33_brahmsuu-530	saṃkalpād eva tacchruteḥ / BBs_4,4.8 /	saṃkalpāt eva tat śruteḥ 
SA_GSP33_brahmsuu-531	ata eva cānanyādhipatiḥ / BBs_4,4.9 /	atas eva ca an anya adhipatiḥ 
SA_GSP33_brahmsuu-532	abhāvaṃ bādarir āha hy evam / BBs_4,4.10 /	abhāvam bādariḥ āha hi evam 
SA_GSP33_brahmsuu-533	bhāvaṃ jaiminir vikalpāmananāt / BBs_4,4.11 /	bhāvam jaiminiḥ vikalpa āmananāt 
SA_GSP33_brahmsuu-534	dvādaśāhavad ubhayavidhaṃ bādarāyaṇo 'taḥ / BBs_4,4.12 /	dvādaśa aha vat ubhayavidham   /
SA_GSP33_brahmsuu-535	tanvabhāve sandhyavad upapatteḥ / BBs_4,4.13 /	tanu abhāve sandhyā vat upapatteḥ 
SA_GSP33_brahmsuu-536	bhāve jāgradvat / BBs_4,4.14 /	bhāve jāgrat vat 
SA_GSP33_brahmsuu-537	pradīpavadāveśas tathā hi darśayati / BBs_4,4.15 /	pradīpa vat āveśaḥ tathā hi darśayati 
SA_GSP33_brahmsuu-538	svāpyayasaṃpatyor anyatarāpekṣam āviṣkṛtaṃ hi / BBs_4,4.16 /	sva apyaya saṃpatyoḥ anyatara apekṣam āviṣkṛtam hi 
SA_GSP33_brahmsuu-539	jagadvyāpāravarjaṃ prakaraṇād asaṃnihitatvāc ca / BBs_4,4.17 /	jagat vyāpāra varjam prakaraṇāt asaṃnihita tvāt ca 
SA_GSP33_brahmsuu-540	pratyakṣopadeśād iti cen nādhikārikamaṇḍalasthokteḥ / BBs_4,4.18 /	pratyakṣa upadeśāt iti ced na ādhikārika maṇḍala stha ukteḥ 
SA_GSP33_brahmsuu-541	vikārāvarti ca tathā hi sthitim āha / BBs_4,4.19 /	vikāra āvarti ca tathā hi sthitim āha 
SA_GSP33_brahmsuu-542	darśayataś caivaṃ pratyakṣānumāne / BBs_4,4.20 /	darśayataḥ ca evam pratyakṣa anumāne  /
SA_GSP33_brahmsuu-543	bhogamātrasāmyaliṅgāc ca / BBs_4,4.21 /	bhoga mātra sāmya liṅgāt ca 
SA_GSP33_brahmsuu-544	anāvṛttiḥ śabdād anāvṛttiḥ śabdāt / BBs_4,4.22 /	anāvṛttiḥ śabdāt anāvṛttiḥ śabdāt 
