segmentnr	original	analyzed
SA_GSP29_vnyps31u-352	nyā. pa. śa. 14 evaṃ tāsāṃ viśeṣaṇatve pakṣāntaravadviśiṣṭabhedādidoṣastvadukta āpatet,	evam tāsām viśeṣaṇa tve pakṣa antara vat viśiṣṭa bheda ādi doṣaḥ tvad uktaḥ āpatet 
SA_GSP29_vnyps31u-353	na cennānyatrāpi /	na ced na anyatra api 
SA_GSP29_vnyps31u-354	tyaktapravṛttinimittasya tadvirodhivyāvṛttyabhilāṣastvālokamapahāya timiranirākaraṇavāñchā /	tyakta pravṛtti nimittasya tad virodhi vyāvṛtti abhilāṣaḥ tu ālokam apahāya timira nirākaraṇa vāñchā 
SA_GSP29_vnyps31u-355	vipratipannaṃ vākyamakhaṇḍaparam,	vipratipannam vākyam akhaṇḍa param 
SA_GSP29_vnyps31u-356	samānādhikaraṇavākyatvāt,	samāna adhikaraṇa vākya tvāt 
SA_GSP29_vnyps31u-357	soyaṃ devadattaḥ iti vākyavat,	saḥ uyam devadattaḥ iti vākya vat 
SA_GSP29_vnyps31u-358	yadvā lakṣaṇavākyatvāt,	yat vā lakṣaṇa vākya tvāt 
SA_GSP29_vnyps31u-359	prakṛṣṭaprakāśaścandraḥ ityādivat iti cenna,	prakṛṣṭa prakāśaḥ candraḥ ityādi vat iti ced na 
SA_GSP29_vnyps31u-360	dṛṣṭāntāsiddheḥ,	dṛṣṭānta asiddheḥ 
SA_GSP29_vnyps31u-361	tattedantāviśiṣṭasyaiva devadattasya soyamiti pratīteḥ /	tad te idanta a viśiṣṭasya eva devadattasya saḥ uyam iti pratīteḥ 
SA_GSP29_vnyps31u-362	yugapat tayorvyāghāta iti cenna,	yugapad tayoḥ vyāghātaḥ iti ced na 
SA_GSP29_vnyps31u-363	yaugapadyasyānabhidhānāt,	yaugapadyasya anabhidhānāt 
SA_GSP29_vnyps31u-364	anākṣepācca /	an ākṣepāt ca 
SA_GSP29_vnyps31u-365	yugapat pratipattistu na doṣaḥ,	yugapad pratipattiḥ tu na doṣaḥ 
SA_GSP29_vnyps31u-366	anyathā pratyabhijñābhaṅge kṣaṇabhaṅganairātmyāpalāpādivādā vijayeran /	anyathā pratyabhijñā bhaṅge kṣaṇa bhaṅga nairātmya apalāpa ādi vādāḥ vijayeran 
SA_GSP29_vnyps31u-367	tathāpyatītatvavartamānatve kathamekasya ?	tathā api atīta tva vartamāna tve katham ekasya 
SA_GSP29_vnyps31u-368	iti cet, svapradhvaṃsakāle hi svayamatītaḥ syāt,	iti ced sva pradhvaṃsa kāle hi svayam atītaḥ syāt 
SA_GSP29_vnyps31u-369	na cāsau pradhvastaḥ,	na ca asau pradhvastaḥ 
SA_GSP29_vnyps31u-370	vartamānatvopalaṃbhāt;	vartamāna tva upalaṃbhāt 
SA_GSP29_vnyps31u-371	atītopādhiviśeṣasaṃbandhitayā hi tattvam,	atīta upādhi viśeṣa saṃbandhi tayā hi tattvam 
SA_GSP29_vnyps31u-372	na tvatītatayā /	na tu atīta tayā 
SA_GSP29_vnyps31u-373	kathamekaṃ pūrvamaparaṃ ca ?	katham ekam pūrvam aparam ca 
SA_GSP29_vnyps31u-374	iti cenna, pratibandhyupādhibhedenobhayopapatteḥ,	iti ced na pratibandhi upādhi bhedena ubhaya upapatteḥ 
SA_GSP29_vnyps31u-375	anyathā kṣaṇasyāpi pūrvāparamadhyavartinaḥ kṣodaprasaṅgāt;	anyathā kṣaṇasya api pūrva apara madhya vartinaḥ kṣoda prasaṅgāt 
SA_GSP29_vnyps31u-376	na hi tasya pūrvasmādapi pūrvatvameva,	na hi tasya pūrvasmāt api pūrva tvam eva 
SA_GSP29_vnyps31u-377	uttarasmādapyuttaratvameva vā /	uttarasmāt api uttara tvam eva vā 
SA_GSP29_vnyps31u-378	kṣudyatāṃ kṣaṇopīti cenna,	kṣudyatām ced na 
SA_GSP29_vnyps31u-379	sarvāpahnavaprasaṅgāt, iti /	sarva apahnava prasaṅgāt iti 
SA_GSP29_vnyps31u-380	tiṣṭhattvetat;	tiṣṭhat tu etat 
SA_GSP29_vnyps31u-381	dvitīyopi dṛṣṭānto viśiṣṭapara eva,	dvitīyaḥ api dṛṣṭāntaḥ viśiṣṭa paraḥ eva 
SA_GSP29_vnyps31u-382	anyathā vyāvṛttapratītyanudayaprasaṅgāt,	anyathā vyāvṛtta pratīti anudaya prasaṅgāt 
SA_GSP29_vnyps31u-383	prakṛṣṭatvādiviśeṣaṇavaiyarthyācca /	prakṛṣṭa tva ādi viśeṣaṇa vaiyarthyāt ca 
SA_GSP29_vnyps31u-384	evaṃ śrutibādhopyanumānayorvaktavyaḥ,	evam śruti bādhaḥ api anumānayoḥ vaktavyaḥ 
SA_GSP29_vnyps31u-385	paryāyatulyatvādiprasaṅgalakṣaṇapratikūlatarkaśca /	paryāya tulya tva ādi prasaṅga lakṣaṇa pratikūla tarkaḥ ca 
SA_GSP29_vnyps31u-386	tathā vipratipannaṃ vākyaṃ viśiṣṭaparam,	tathā vipratipannam vākyam viśiṣṭa param 
SA_GSP29_vnyps31u-387	ākāṅkṣāyuktavākyatvāt,	ākāṅkṣā yukta vākya tvāt 
SA_GSP29_vnyps31u-388	vyadhikaraṇavākyavat,	vyadhikaraṇa vākya vat 
SA_GSP29_vnyps31u-389	iti bādhakamanumānamapi,	iti bādhakam anumānam api 
SA_GSP29_vnyps31u-390	pratipattyanurodhāt dṛṣṭāntasiddheścāsya balīyastvam /	pratipatti anurodhāt dṛṣṭānta siddheḥ ca asya balīyaḥ tvam 
SA_GSP29_vnyps31u-391	bhinnapravṛttinimittānāṃ śabdānāmekasminnarthe vṛttiḥ sāmānādhikaraṇyamiti śābdairevoktam /	bhinna pravṛtti nimittānām śabdānām ekasmin arthe vṛttiḥ sāmānādhikaraṇyam iti śābdaiḥ eva uktam 
SA_GSP29_vnyps31u-392	tatra bhinnapravṛttinimittānāmiti paryāyavyāvṛttiḥ /	tatra bhinna pravṛtti nimittānām iti paryāya vyāvṛttiḥ 
SA_GSP29_vnyps31u-393	ekasminniti vyadhikaraṇānāṃ ghaṭaḥ paṭaityādyananvitānāṃ ca vyavacchedārtham /	ekasmin iti vyadhikaraṇānām ghaṭaḥ paṭa etya ādi ananvitānām ca vyavaccheda artham 
SA_GSP29_vnyps31u-394	śabdānām arthe iti ca vyaktyarthameva,	śabdānām arthe iti ca vyakti artham eva 
SA_GSP29_vnyps31u-395	arthe iti viśeṣyasya pradhānatayā vācyatvasūcanārthaṃ vā /	arthe iti viśeṣyasya pradhāna tayā vācya tva sūcana artham vā 
SA_GSP29_vnyps31u-396	tena vyadhikaraṇavākyeṣvekapradhānārthe vṛttisaṃbhavepiva tasya viśeṣyatavabhāvād vyavacchedyatā /	tena vyadhikaraṇa vākyeṣu eka pradhāna arthe vṛtti saṃbhave iva tasya viśeṣya tava bhāvāt vyavacchedya tā 
SA_GSP29_vnyps31u-397	viśeṣyabodhanavyāpāro vṛttiḥ pravṛttiriti ca sāmānyato viśeṣataścātrocyate /	viśeṣya bodhana vyāpāraḥ vṛttiḥ pravṛttiḥ iti ca sāmānyatas viśeṣataḥ ca atra ucyate 
SA_GSP29_vnyps31u-398	prakṛṣṭā hi vṛttiḥ pravṛttiḥ /	prakṛṣṭā hi vṛttiḥ pravṛttiḥ 
SA_GSP29_vnyps31u-399	prakarṣaścātra viśeṣyaviṣayatayā /	prakarṣaḥ ca atra viśeṣya viṣaya tayā 
SA_GSP29_vnyps31u-400	tatra yadupādhikā viśeṣye śabdavṛttiḥ,	tatra yad upādhikā viśeṣye śabda vṛttiḥ 
SA_GSP29_vnyps31u-401	tat pravṛttinimittam /	tat pravṛtti nimittam 
SA_GSP29_vnyps31u-402	bhinnaviśeṣaṇadvāreṇaikaviśeṣyābhidhānaṃ sāmānādhikaraṇyamityuktaṃ bhavati //	bhinna viśeṣaṇa dvāreṇa eka viśeṣya abhidhānam sāmānādhikaraṇyam iti uktam bhavati 
SA_GSP29_vnyps31u-403	nyā. pa. śa. 15 nanu pauruṣeyaṃ sarvamanvitārthamiti pratipāditam,	nanu pauruṣeyam sarvam anvita artham iti pratipāditam 
SA_GSP29_vnyps31u-404	tannopapadyate,	tat na upapadyate 
SA_GSP29_vnyps31u-405	guṇavadvaktṛpraṇītasyaiva vākyasya tathātvadarśanāt,	guṇavat vaktṛ praṇītasya eva vākyasya tathātva darśanāt 
SA_GSP29_vnyps31u-406	iti cenna,	iti ced na 
SA_GSP29_vnyps31u-407	svataḥ prāmāṇyāt,	svatas prāmāṇyāt 
SA_GSP29_vnyps31u-408	svarasato hi sarvaṃ jñānasabādhitavyavahārajanakaṃ dṛśyate /	svarasataḥ hi sarvam jñāna sa bādhita vyavahāra janakam dṛśyate 
SA_GSP29_vnyps31u-409	bhedāgrahādiviśeṣopādhikaṃ hi kvacid bādhyavyavahārahetutvam /	bheda agraha ādi viśeṣa upādhikam hi kvacid bādhya vyavahāra hetu tvam 
SA_GSP29_vnyps31u-410	tataḥ svābhāvikamapi prāmāṇyaṃ pratibandhakena doṣeṇa kvacidapahnutam;	tatas svābhāvikam api prāmāṇyam pratibandhakena doṣeṇa kvacid apahnutam 
SA_GSP29_vnyps31u-411	yathāgnerauṣṇyam /	yathā agneḥ auṣṇyam 
SA_GSP29_vnyps31u-412	tatra tadaṃśāpekṣayā prāmāṇyameva /	tatra tad aṃśa apekṣayā prāmāṇyam eva 
SA_GSP29_vnyps31u-413	guṇāstu saṃbhāvitadoṣasthale doṣanirākaraṇaupayikāḥ,	guṇāḥ tu saṃbhāvita doṣa sthale doṣa nirākaraṇa aupayikāḥ 
SA_GSP29_vnyps31u-414	pramāṇyasya tairvyāptyabhāvāt,	pramāṇyasya taiḥ vyāpti abhāvāt 
SA_GSP29_vnyps31u-415	nityasarvajñavādināṃ pramāṇabhūte tajjñāne vyabhicārāt /	nitya sarvajña vādinām pramāṇa bhūte tad jñāne vyabhicārāt 
SA_GSP29_vnyps31u-416	aprāmāṇyasya tu doṣādhīnatvamavyabhicaritānvayavyatirekasiddham /	aprāmāṇyasya tu doṣa adhīna tvam avyabhicarita anvaya vyatireka siddham 
SA_GSP29_vnyps31u-417	avastunoprāmāṇyasya kathaṃ hetusādhyatvamiti cenna,	avastunā uprāmāṇyasya katham hetu sādhya tvam iti ced na 
SA_GSP29_vnyps31u-418	saṃśayatvaviparyayatvādirūpasya tasyāvastutvābhāvāt,	saṃśaya tva viparyaya tva ādi rūpasya tasya avastu tva abhāvāt 
SA_GSP29_vnyps31u-419	bhāvāntarātiriktasya cābhāvasyāsmābhiranabhyupagamāt,	bhāva antara atiriktasya ca abhāvasya asmābhiḥ anabhyupagamāt 
SA_GSP29_vnyps31u-420	abhyupagamepi pradhvaṃsasya mudgarādisādhyatvadṛṣṭeḥ /	abhyupagame api pradhvaṃsasya mudgara ādi sādhya tva dṛṣṭeḥ 
SA_GSP29_vnyps31u-421	tadvat pramāpi samyaṅmithyābodhasādhāraṇādatiriktasahitā jāyate,	tadvat pramā api samyak mithyā bodha sādhāraṇāt atirikta sahitā jāyate 
SA_GSP29_vnyps31u-422	kāryatve sati tadviśeṣatvāt,	kārya tve sati tad viśeṣa tvāt 
SA_GSP29_vnyps31u-423	apramāvat; prāmāṇyaṃ parato jñāyate,	apramā vat prāmāṇyam paratas jñāyate 
SA_GSP29_vnyps31u-424	anabhyāsadaśāyāṃ sāṃśayikatvāt,	anabhyāsa daśāyām sāṃśayika tvāt 
SA_GSP29_vnyps31u-425	aprāmāṇyavat,	aprāmāṇya vat 
SA_GSP29_vnyps31u-426	iti cet,	iti ced 
SA_GSP29_vnyps31u-427	tatra prathame kṛtsnapramāpakṣīkāre hetoḥ svamate bhāgāsiddhirḥ,	tatra prathame kṛtsna pramā pakṣīkāre hetoḥ sva mate bhāga asiddhiḥ 
SA_GSP29_vnyps31u-428	iśvarapramāyā nityatvābhyupagamāt /	          
SA_GSP29_vnyps31u-429	anīśvarapramāpakṣīkāre yāvadīśvarasiddhi vyarthaṃ viśeṣaṇam /	anīśvara pramā pakṣīkāre yāvadīśvara siddhi vyartham viśeṣaṇam 
SA_GSP29_vnyps31u-430	riśvarānumānasamanantaraṃ prayogaḥ iti cenna,	riśvara anumāna samanantaram prayogaḥ iti ced na 
SA_GSP29_vnyps31u-431	tasya śāstrayonyadhikaraṇanyāyenānumātumaśakyatvāt /	tasya śāstrayoni adhikaraṇa nyāyena anumātum aśakya tvāt 
SA_GSP29_vnyps31u-432	tarhi viśeṣaṇaṃ na prayokṣyāmahe iti cenna,	tarhi viśeṣaṇam na prayokṣyāmahe iti ced na 
SA_GSP29_vnyps31u-433	svābhimateśvarapramayānaikāntyāt /	sva abhimata īśvara pramayā anaikāntyāt 
SA_GSP29_vnyps31u-434	anabhyupagateśvaraiḥ saugatādibhirevaṃ prayoge kaḥ parihāraḥ iti cenna,	anabhyupagata īśvaraiḥ saugata ādibhiḥ evam prayoge kaḥ parihāraḥ iti ced na 
SA_GSP29_vnyps31u-435	śrutisiddhanityapramāsamarthanena bādhasyānaikāntikasya vā vaktuṃ śakyatvāt /	śruti siddha nitya pramā samarthanena bādhasya anaikāntikasya vā vaktum śakya tvāt 
SA_GSP29_vnyps31u-436	śrutisiddhanityapramāvyavacchedena kāryatvaviśeṣaṇaṃ saphalaṃ syāt hi cet,	śruti siddha nitya pramā vyavacchedena kāryatva viśeṣaṇam saphalam syāt hi ced 
SA_GSP29_vnyps31u-437	tarhi śrutyā tatsiddhiḥ śrutiprāmāṇyanirṇayamantareṇa kathaṃ syāt ? /	tarhi śrutyā tad siddhiḥ śruti prāmāṇya nirṇayam antareṇa katham syāt 
SA_GSP29_vnyps31u-438	tatprāmāṇyaṃ ca nityanirdeṣatayābhyupagamyate cet,	tad prāmāṇyam ca nityanirdeṣatayā abhyupagamyate ced 
SA_GSP29_vnyps31u-439	kathaṃ tatra parataḥ prāmāṇyetpattiḥ ?	katham tatra paratas prāmāṇya itpattiḥ 
SA_GSP29_vnyps31u-440	vaktṛguṇādhīnaṃ vākyānāṃ prāmāṇyamiti hi vaḥ siddhāntaḥ /	vaktṛ guṇa adhīnam vākyānām prāmāṇyam iti hi vaḥ siddhāntaḥ 
SA_GSP29_vnyps31u-441	nirdeṣataiva guṇaḥ,	guṇaḥ 
SA_GSP29_vnyps31u-442	iti tadadhīnatayā tatra parataḥ prāmāṇyamiti cenna,	iti tad adhīna tayā tatra paratas prāmāṇyam iti ced na 
SA_GSP29_vnyps31u-443	pratibandhakābhāvasya paraiḥ kāraṇatvānabhyupagamāt /	pratibandhaka abhāvasya paraiḥ kāraṇa tva anabhyupagamāt 
SA_GSP29_vnyps31u-444	abhyupagame ca tāvanmātradhīnatvepi vedāpauruṣeyatvanityatvāderavirodhāt;	abhyupagame ca tāvat mātra dhīna tve pi veda apauruṣeya tva nitya tva ādeḥ avirodhāt 
SA_GSP29_vnyps31u-445	vedapauruṣeyatvādisiddhyarthaṃ hi vaḥ parataḥ prāmāṇyasamarthanārambhaḥ /	veda pauruṣeya tva ādi siddhi artham hi vaḥ paratas prāmāṇya samarthana ārambhaḥ 
SA_GSP29_vnyps31u-446	tadapauruṣeyatvādisiddhyarthameva cāsmābhiḥ svataḥ prāmāṇyaṃ pratipādyate /	tad apauruṣeya tva ādi siddhi artham eva ca asmābhiḥ svatas prāmāṇyam pratipādyate 
SA_GSP29_vnyps31u-447	athāptoktatayā vedaprāmāṇyādīśvarasiddhau tatpramāvyavacchedāya viśeṣaṇamitīṣyate,	atha āpta ukta tayā veda prāmāṇyāt īśvara siddhau tad pramā vyavacchedāya viśeṣaṇam iti iṣyate 
SA_GSP29_vnyps31u-448	tadapi na,	tat api na 
SA_GSP29_vnyps31u-449	parataḥ prāmāṇye nirṇīte vadesyāptamūlaprāmāṇyasiddhiḥ,	paratas prāmāṇye nirṇīte vadeḥ iti āpta mūla prāmāṇya siddhiḥ 
SA_GSP29_vnyps31u-450	tatsiddhau ceśvarasiddhiḥ,	tad siddhau ca īśvara siddhiḥ 
SA_GSP29_vnyps31u-451	tatpramāvyavacchedāya viśeṣaṇam,	           
SA_GSP29_vnyps31u-452	saviśeṣaṇaśvāsau hetuḥ parataḥ prāmāṇyaṃ sādhayet,	sa viśeṣaṇaḥ śva asau hetuḥ paratas prāmāṇyam sādhayet 
SA_GSP29_vnyps31u-453	iti cakrakāśrayaprasaṅgārt /	iti cakraka āśraya prasaṅga ārt 
SA_GSP29_vnyps31u-454	iśvarānumānānyathāsiddhiparihārāya parataḥ prāmāṇyaṃ nyāyakusumāñjalau samarthyate /	                         
SA_GSP29_vnyps31u-455	tatraiva ca kāryatvaviśeṣaṇaṃ prayujyate /	tatra eva ca kārya tva viśeṣaṇam prayujyate 
SA_GSP29_vnyps31u-456	na cāsiddhivyavacchedāya viśeṣaṇaṃ yuktam;	na ca asiddhi vyavacchedāya viśeṣaṇam yuktam 
SA_GSP29_vnyps31u-457	siddhatve tu parataḥ prāmāṇyasamarthanasya na tadarthateti dustaratā /	siddha tve tu paratas prāmāṇya samarthanasya na tad artha tā iti dustara tā 
SA_GSP29_vnyps31u-458	tathāpi śabdaprāmāṇyaṃ vaktṛguṇādhīnamiti cenna,	tathā api śabda prāmāṇyam vaktṛ guṇa adhīnam iti ced na 
SA_GSP29_vnyps31u-459	viśeṣakābhāvāt,	viśeṣaka abhāvāt 
SA_GSP29_vnyps31u-460	doṣasaṃbhāvanāsthale ca tadapekṣaṇāt,	doṣa saṃbhāvanā sthale ca tad apekṣaṇāt 
SA_GSP29_vnyps31u-461	vedasya canirdeṣatvāt /	vedasya ca nirdeṣa tvāt 
SA_GSP29_vnyps31u-462	doṣābhāvādhīnatve parataḥ prāmāṇyaṃ siddhamiti cenna,	doṣa abhāva adhīna tve paratas prāmāṇyam siddham iti ced na 
SA_GSP29_vnyps31u-463	tadadhīnatvābhāvāt,	tad adhīna tva abhāvāt 
SA_GSP29_vnyps31u-464	tasya virodhanivṛttimātrarūpatvāt /	tasya virodha nivṛtti mātra rūpa tvāt 
SA_GSP29_vnyps31u-465	astu vā tadadhīnatvam,	astu vā tad adhīna tvam 
SA_GSP29_vnyps31u-466	tathāpi vede tu na doṣaḥ /	tathā api vede tu na doṣaḥ 
SA_GSP29_vnyps31u-467	guṇamantareṇa doṣābhāvo na ghaṭata iti cet,	guṇam antareṇa doṣa abhāvaḥ na ghaṭate iti ced 
SA_GSP29_vnyps31u-468	anuṣṇāśītasparśavadubhayanivṛtterapi darśanāt,	anuṣṇa aśīta sparśavat ubhaya nivṛtteḥ api darśanāt 
SA_GSP29_vnyps31u-469	upapatteśca /	upapatteḥ ca 
SA_GSP29_vnyps31u-470	bhāvāntarābhāvavādino doṣābhāvopi guṇa eveti cenna,	bhāva antara abhāva vādinaḥ doṣa abhāvaḥ api guṇaḥ evā iti ced na 
SA_GSP29_vnyps31u-471	svābhāvāntareṇa tannirvāhāt /	sva abhāva antareṇa tad nirvāhāt 
SA_GSP29_vnyps31u-472	na hi tasyāpi śītābhāva uṣṇa eva,	na hi tasya api śīta abhāvaḥ uṣṇaḥ eva 
SA_GSP29_vnyps31u-473	anuṣṇāśīte tadasiddheḥ /	an uṣṇa aśīte tad asiddheḥ 
SA_GSP29_vnyps31u-474	ubhayasaṃgrahaṇena hi śītābhāvatvam /	ubhaya saṃgrahaṇena hi śīta abhāva tvam 
SA_GSP29_vnyps31u-475	tadvadatrāpi saguṇeṣvāptavākyeṣu vaktṛguṇarahiteṣu vedavākyeṣu ca doṣābhāvaḥ samānaḥ //	tadvat atra api saguṇeṣu āpta vākyeṣu vaktṛ guṇa rahiteṣu veda vākyeṣu ca doṣa abhāvaḥ samānaḥ 
SA_GSP29_vnyps31u-476	nyā. pa. śa. 16 nanu śabdānāṃ svataḥ prāmāṇye buddhādivākyamapi svataḥ pramāṇaṃ syāt /	nanu śabdānām svatas prāmāṇye buddha ādi vākyam api svatas pramāṇam syāt 
SA_GSP29_vnyps31u-477	na syāt, svatastvasyotsargarūpatvāt,	na syāt svatas tvasya utsarga rūpa tvāt 
SA_GSP29_vnyps31u-478	virodhiviśeṣe ca tasyānanupraveśāt /	virodhi viśeṣe ca tasya an anupraveśāt 
SA_GSP29_vnyps31u-479	uktaṃ cāgamaprāmāṇye--- “naiva śabde svato doṣāḥ prāmāṇyaparipanthinaḥ /	uktam ca āgama prāmāṇye nā eva śabde svatas doṣāḥ prāmāṇya paripanthinaḥ 
SA_GSP29_vnyps31u-480	santi kintu svatastasya pramāṇatvamiti sthitiḥ //	santi kintu svatas tasya pramāṇa tvam iti sthitiḥ 
SA_GSP29_vnyps31u-481	vakturāśayadoṣeṇa keṣu cittadapodyate /	vaktuḥ āśaya doṣeṇa keṣu cit tat apodyate 
SA_GSP29_vnyps31u-482	aṅgulyagre hi mātaṅgayūthamityevamādiṣu” //	aṅguli agre hi mātaṅga yūtham iti evamādiṣu 
SA_GSP29_vnyps31u-483	iti /	iti 
SA_GSP29_vnyps31u-484	kiñca, nitye hetuguṇāpekṣā vede nāstīśabuddhivat /	kiñca nitye hetu guṇa apekṣā vede nā asti īśa buddhi vat 
SA_GSP29_vnyps31u-485	hetvabhāvānna doṣaścedūvaktrabhāvādihāpi naḥ //	hetu abhāvāt na doṣaḥ ced ūvaktra bhāvāt iha api naḥ 
SA_GSP29_vnyps31u-486	akāraṇaṃ yathā jñānaṃ pramātvamadhigacchati /	akāraṇam yathā jñānam pramā tvam adhigacchati 
SA_GSP29_vnyps31u-487	akāraṇaṃ tathā vākyaṃ svataḥ pramitikāraṇam //	akāraṇam tathā vākyam svatas pramiti kāraṇam 
SA_GSP29_vnyps31u-488	yadi hetuguṇābhāvādaprāmāṇyaṃ prasajyate /	yadi hetu guṇa abhāvāt aprāmāṇyam prasajyate 
SA_GSP29_vnyps31u-489	tadeśvarapramāyāmapyanivāryamidaṃ tava //	tadā īśvara pramāyām api anivāryam idam tava 
SA_GSP29_vnyps31u-490	nyā. pa. śa. 17 athaiva brūṣe---kāraṇaguṇadoṣayorabhāve tatprayojyayoḥ prāmāṇyāprāmāṇyayordvayorapyasaṃbhavādraśyantarāyogācca niḥsvabhāvatvaṃ  #	atha eva brūṣe kāraṇa guṇa doṣayoḥ abhāve tad prayojyayoḥ prāmāṇya aprāmāṇyayoḥ dvayoḥ api asaṃbhavāt raśi antara ayogāt ca niḥsvabhāva tvam 
SA_GSP29_vnyps31u-491	vedaśabdajanyajñānānāṃ syāditi;	veda śabda janya jñānānām syāt iti 
SA_GSP29_vnyps31u-492	idamapi tulyamīśvarajñāne /	idam api tulyam īśvara jñāne 
SA_GSP29_vnyps31u-493	hetunivṛttistatkāryaṃ prāmāṇyaṃ nivartayet,	hetu nivṛttiḥ tat kāryam prāmāṇyam nivartayet 
SA_GSP29_vnyps31u-494	na tu nityamiti cet,	na tu nityam iti ced 
SA_GSP29_vnyps31u-495	aprāmāṇyahetunivṛttirapi tathaiva /	aprāmāṇya hetu nivṛttiḥ api tathā eva 
SA_GSP29_vnyps31u-496	ato viruddhasvabhāvayogaḥ ubhayaparityāgānniḥsvabhāvaitava vā syāt /	atas viruddha svabhāva yogaḥ ubhaya parityāgāt vā syāt 
SA_GSP29_vnyps31u-497	evamanīśvaravādināṃ saugatādīnāṃ śuddhasaṃvitsantānādiṣvadhipatisahakāryādikāraṇatadguṇāderasaṃbhavāt svārasikasvātmagocaraprāmāṇyasya cābhyupagamāt  #	evam anīśvara vādinām saugata ādīnām śuddha saṃvid santāna ādiṣu adhipati sahakāri ādi kāraṇa tad guṇa ādeḥ asaṃbhavāt svārasika sva ātma gocara prāmāṇyasya ca abhyupagamāt 
SA_GSP29_vnyps31u-498	samāścarcāḥ /	samāḥ ca ṛcāḥ 
SA_GSP29_vnyps31u-499	yadyapi pūrvapratyayasyakāraṇatvamiṣṭam,	yadi api pūrva pratyayasya akāraṇa tvam iṣṭam 
SA_GSP29_vnyps31u-500	tathāpi tasyāpavargadaśāsthasya guṇadoṣādirūpasamastasaṃskārapratyarthitayā na tajjanyasya guṇahetuteti /	tathā api tasya apavarga daśā sthasya guṇa doṣa ādi rūpa samasta saṃskāra pratyarthi tayā na tad janyasya guṇa hetu tā iti 
SA_GSP29_vnyps31u-501	yacca, prāmāṇyaṃ parato jñāyate,	yat ca prāmāṇyam paratas jñāyate 
SA_GSP29_vnyps31u-502	iti prayuktam,	iti prayuktam 
SA_GSP29_vnyps31u-503	tatra jñānāntareṇa jñānāntarasvabhāvavedanābhyupagamāt siddhasādhanatā /	tatra jñāna antareṇa jñāna antara svabhāva vedanā abhyupagamāt siddha sādhana tā 
SA_GSP29_vnyps31u-504	parata eveti vivakṣāyāmīdṛśaṃ jñānaṃ prameti lakṣaṇataḥ sarvapramāsaṅgrāhiṇi jñāne pārameśvare ca vijñāne tadasaṃbhavaḥ;	paratas eva iti vivakṣāyām īdṛśam jñānam pramā iti lakṣaṇataḥ sarva pramā saṅgrāhiṇi jñāne pārameśvare ca vijñāne tad asaṃbhavaḥ 
SA_GSP29_vnyps31u-505	na hi tābhyāṃ svapramātvaṃ na gṛhītam,	na hi tābhyām sva pramā tvam na gṛhītam 
SA_GSP29_vnyps31u-506	lakṣaṇāvyāptikiñcijjñatvādiprasaṅgāt /	          
SA_GSP29_vnyps31u-507	atonyatra parata eveti niyama iti cet,	atas nyatra paratas eva iti niyamaḥ iti ced 
SA_GSP29_vnyps31u-508	tadapi na,	tat api na 
SA_GSP29_vnyps31u-509	taddṛṣṭāntenaiva pratiprayoktuṃ śakyatvāt-vigītaṃ prāmāṇyaṃ svādhāreṇa jñāyate,	tad dṛṣṭāntena eva pratiprayoktum śakya tvāt vigītam prāmāṇyam sva ādhāreṇa jñāyate 
SA_GSP29_vnyps31u-510	prāmāṇyarūpatvāt,	prāmāṇya rūpa tvāt 
SA_GSP29_vnyps31u-511	riśvarajñānādiprāmāṇyavat iti /	            
SA_GSP29_vnyps31u-512	kathaṃ tarhi idaṃ pramāṇamapramāṇaṃ veti saṃśayāvakāśaḥ ?	katham tarhi idam pramāṇam apramāṇam vā iti saṃśaya avakāśaḥ 
SA_GSP29_vnyps31u-513	iti cenna, viśeṣato gṛhyamāṇeṣvapi saṃśayotpattidarśanāt /	iti ced na viśeṣataḥ gṛhyamāṇeṣu api saṃśaya utpatti darśanāt 
SA_GSP29_vnyps31u-514	bhavati muhuḥ śuktikārajatamohādandhīkṛtadhiyaḥ kaladhautepi tathopalabhyamāne yathopalambhamidaṃ rajatameva vā pūrvavacchuktirajataṃ veti	bhavati muhur śuktikā rajata mohāt andhīkṛta dhiyaḥ kaladhaute api tathā upalabhyamāne yathā upalambham idam rajatam eva vā pūrvavat śukti rajatam vā iti 
SA_GSP29_vnyps31u-515	tathātrāpi gṛhyamāṇepi prāmāṇye kimidaṃ pramāṇameva sat pramāṇatayopalambhate ?	tathā atra api gṛhyamāṇe ipi prāmāṇye kim idam pramāṇam eva sat pramāṇa tayā upalambhate 
SA_GSP29_vnyps31u-516	uta, bādhāt pūrvabhramavadapramāṇaṃ sat ?	uta bādhāt pūrva bhrama vat apramāṇam sat 
SA_GSP29_vnyps31u-517	iti saṃśayo yuktaḥ /	iti saṃśayaḥ yuktaḥ 
SA_GSP29_vnyps31u-518	tathāpi sandehasahena kiṃ svatograhaṇena ?	tathā api sandeha sahena kim svatas grahaṇena 
SA_GSP29_vnyps31u-519	niścayastu parādhīna eveti cet,	niścayaḥ tu para adhīnaḥ evā iti ced 
SA_GSP29_vnyps31u-520	kimasmadapekṣayā grahaṇamagrahaṇaṃ vā niyantuṃ śakyam ?	kim asmad apekṣayā grahaṇam agrahaṇam vā niyantum śakyam 
SA_GSP29_vnyps31u-521	siddho hi grahaṇaprakāraḥ parīkṣakairanusaraṇīyaḥ /	siddhaḥ hi grahaṇa prakāraḥ parīkṣakaiḥ anusaraṇīyaḥ 
SA_GSP29_vnyps31u-522	siddhireva svataḥ kathamiti cet,	siddhiḥ eva svatas katham iti ced 
SA_GSP29_vnyps31u-523	ittham---jñānaṃ svālambanaṃ prakāśayat svayamapi jñānāntaranirapekṣaṃ prakāśate,	ittham jñānam sva ālambanam prakāśayat svayam api jñāna antara nirapekṣam prakāśate 
SA_GSP29_vnyps31u-524	iti tāvat sarvavedāntisaṃmatam /	iti tāvat sarva vedānti saṃmatam 
SA_GSP29_vnyps31u-525	asvayaṃprakāśavādepi svagrāhiṇānuvyavasāyena prakāśamāno vyavasāyastāvadasaṃśayātmaiva dṛśyate //	a svayam prakāśa vādaḥ api sva grāhiṇā anuvyavasāyena prakāśamānaḥ vyavasāyaḥ tāvat asaṃśaya ātmā eva dṛśyate 
SA_GSP29_vnyps31u-526	nyā. pa. śa. 18 smṛtyaprāmāṇyavādepyapūrvārthagocaratayā smṛtivilakṣaṇaścāviparyayātmā cābādhātmā ca,	smṛti aprāmāṇya vāda īpya pūrva artha gocara tayā smṛti vilakṣaṇaḥ ca aviparyaya ātmā ca ābādha ātmā ca 
SA_GSP29_vnyps31u-527	vādhādeḥ pūrvaṃ tatprasaṅgābhāvāt /	vādha ādeḥ pūrvam tad prasaṅga abhāvāt 
SA_GSP29_vnyps31u-528	tataśca yadviṣayatayāyaṃ vyavasāyaḥ prathamaṃ pratibhātaḥ,	tatas ca yad viṣaya tayā ayam vyavasāyaḥ prathamam pratibhātaḥ 
SA_GSP29_vnyps31u-529	tadviṣayatayaiva parasparaparikṣodāt paścādapi /	tad viṣaya tayā eva paraspara parikṣodāt paścāt api 
SA_GSP29_vnyps31u-530	ato yat tadviṣayatvalakṣaṇaṃ prāmāṇyaṃ paścāt tenaiva vyavasthāpyate,	atas yat tad viṣaya tva lakṣaṇam prāmāṇyam paścāt tena eva vyavasthāpyate 
SA_GSP29_vnyps31u-531	tadādāveva gṛhītamiti svataḥ prāmāṇyagrahaḥ //	tad ādau eva gṛhītam iti svatas prāmāṇya grahaḥ 
SA_GSP29_vnyps31u-532	nyā. pa. śa. 19 nanvevaṃ saṃśayatvādilakṣaṇamaprāmāṇyamapi svayaṃprakāśenānuvyavasāyena vā prathamamave grahītuṃ śakyam;	nanu evam saṃśaya tva ādi lakṣaṇam aprāmāṇyam api svayam prakāśeṇa anuvyavasāyena vā grahītum śakyam 
SA_GSP29_vnyps31u-533	tathāpi viparyayatvalakṣaṇaṃ na tathā,	tathā api viparyaya tva lakṣaṇam na tathā 
SA_GSP29_vnyps31u-534	gṛhyamāṇavaiparītyasya svena svagrāhiṇā vā prathamamagrahaṇāt,	gṛhyamāṇa vaiparītyasya svena sva grāhiṇā vā prathamam agrahaṇāt 
SA_GSP29_vnyps31u-535	tasminnaṃśe ca vaidikānāmavivādāt,	tasmin aṃśe ca vaidikānām avivādāt 
SA_GSP29_vnyps31u-536	tatremamaṃśamādāyaiva cāntataḥ pasvataḥ prāmāṇyasamarthanapravṛtteḥ,	tatra imam aṃśam ādāya eva ca antataḥ pasvataḥ prāmāṇya samarthana pravṛtteḥ 
SA_GSP29_vnyps31u-537	tatra doṣābhāvādevādāvaprāmāṇyānutpatteḥ /	tatra doṣa abhāvāt eva ādau aprāmāṇya anutpatteḥ 
