segmentnr	original	analyzed
SA_GV01_rv_10_u-877	RV_10.042.11.1{23} bṛhaspatirnaḥ pari pātu paścādutottarasmādadharādaghāyoḥ	bṛhaspatiḥ naḥ pari pātu paścāt uta uttarasmāt adharāt aghāyoḥ 
SA_GV01_rv_10_u-878	RV_10.042.11.2{23} idraḥ purastāduta madhyato naḥ sakhā sakhibhyovarivaḥ kṛṇotu	idraḥ purastāt uta madhyatas naḥ sakhā sakhibhyaḥ varivaḥ kṛṇotu 
SA_GV01_rv_10_u-879	RV_10.043.01.1{24} achā ma indraṃ matayaḥ svarvidaḥ sadhrīcīrviśvāuśatīranūṣata	achā me indram matayaḥ svar vidaḥ sadhrīcīḥ viśvāḥ auśatīḥ anūṣata 
SA_GV01_rv_10_u-880	RV_10.043.01.2{24} pari ṣvajante janayo yathā patiṃ maryaṃna śundhyuṃ maghavānamūtaye	pari svajante janayaḥ yathā patim maryaṃna śundhyum maghavānam ūtaye 
SA_GV01_rv_10_u-881	RV_10.043.02.1{24} na ghā tvadrigapa veti me manastve it kāmaṃ puruhūtaśiśraya	na ghā tvadrigapa veti me manaḥ tve id kāmam puruhūta śiśraya 
SA_GV01_rv_10_u-882	RV_10.043.02.2{24} rājeva dasma ni ṣado 'dhi barhiṣyasmin su some'vapānamastu te	rājā iva dasma ni sadaḥ dhi barhiṣi asmin su soma iva pānam astu te 
SA_GV01_rv_10_u-883	RV_10.043.03.1{24} viṣūvṛdindro amateruta kṣudhaḥ sa id rāyo maghavāvasva īśate	viṣūvṛt indraḥ amateḥ uta kṣudhaḥ saḥ id rāyaḥ maghavā avasvaḥ īśate 
SA_GV01_rv_10_u-884	RV_10.043.03.2{24} tasyedime pravaṇe sapta sindhavo vayovardhanti vṛṣabhasya śuṣmiṇaḥ	tasya id ime pravaṇe sapta sindhavaḥ vayaḥ vardhanti vṛṣabhasya śuṣmiṇaḥ 
SA_GV01_rv_10_u-885	RV_10.043.04.1{24} vayo na vṛkṣaṃ supalāśamāsadan somāsa indraṃ mandinaścamūṣadaḥ	vayaḥ na vṛkṣam su palāśam āsadan somāsaḥ indram mandinaḥ camūṣadaḥ 
SA_GV01_rv_10_u-886	RV_10.043.04.2{24} praiṣāmanīkaṃ śavasā davidyutad vidatsvarmanave jyotirāryam	pra eṣām anīkam śavasā davidyutat vidat svar manave jyotiḥ āryam 
SA_GV01_rv_10_u-887	RV_10.043.05.1{24} kṛtaṃ na śvaghnī vi cinoti devane saṃvargaṃ yan maghavāsūryaṃ jayat	kṛtam na śvaghnī vi cinoti devane saṃvargam yat maghavā asūryam jayat 
SA_GV01_rv_10_u-888	RV_10.043.05.2{24} na tat te anyo anu vīryaṃ śakan napurāṇo maghavan nota nūtanaḥ	na tat te anyaḥ anu vīryam śakat na purāṇaḥ maghavan na uta nūtanaḥ 
SA_GV01_rv_10_u-889	RV_10.043.06.1{25} viśaṃ-viśaṃ maghavā paryaśāyata janānāṃ dhenāavacākaśad vṛṣā	viśam viśam maghavā paryaśāyata janānām dhenā avacākaśat vṛṣā 
SA_GV01_rv_10_u-890	RV_10.043.06.2{25} yasyāha śakraḥ savaneṣu raṇyati satīvraiḥ somaiḥ sahate pṛtanyataḥ	yasya āha śakraḥ savaneṣu raṇyati satīvraiḥ somaiḥ sahate pṛtanyataḥ 
SA_GV01_rv_10_u-891	RV_10.043.07.1{25} āpo na sindhumabhi yat samakṣaran somāsa indraṃ kulyāiva hradam	āpaḥ na sindhum abhi yat samakṣaran somāsaḥ indram kulyāḥ iva hradam 
SA_GV01_rv_10_u-892	RV_10.043.07.2{25} vardhanti viprā maho asya sādane yavaṃ navṛṣṭirdivyena dānunā	vardhanti viprāḥ mahaḥ asya sādane yavam navṛṣṭiḥ divyena dānunā 
SA_GV01_rv_10_u-893	RV_10.043.08.1{25} vṛṣā na kruddhaḥ patayad rajassvā yo aryapatnīrakṛṇodimā apaḥ	vṛṣā na kruddhaḥ patayat rajassvā yaḥ arya patnīḥ akṛṇot imāḥ apaḥ 
SA_GV01_rv_10_u-894	RV_10.043.08.2{25} sa sunvate maghavā jīradānave 'vindajjyotirmanave haviṣmate	sa sunvate maghavā jīra dānave vindat jyotiḥ manave haviṣmate 
SA_GV01_rv_10_u-895	RV_10.043.09.1{25} ujjāyatāṃ paraśurjyotiṣā saha bhūyā ṛtasya sudughāpurāṇavat	ujjāyatām paraśuḥ jyotiṣā saha bhūyāḥ ṛtasya sudughā purāṇa vat 
SA_GV01_rv_10_u-896	RV_10.043.09.2{25} vi rocatāmaruṣo bhānunā śuciḥ svarṇaśukraṃ śuśucīta satpatiḥ	vi rocatām aruṣaḥ bhānunā śuciḥ svarṇa śukram śuśucīta sat patiḥ 
SA_GV01_rv_10_u-897	RV_10.043.10.1{25} gobhiṣ ṭaremāmatiṃ ...	gobhiḥ tarema amatim 
SA_GV01_rv_10_u-898	RV_10.043.11.1{25} bṛhaspatirnaḥ pari ...	bṛhaspatiḥ naḥ pari 
SA_GV01_rv_10_u-899	RV_10.044.01.1{26} ā yātvindraḥ svapatirmadāya yo dharmaṇā tūtujānastuviṣmān	ā yātu indraḥ sva patiḥ madāya yaḥ dharmaṇā tūtujānaḥ tuviṣmān 
SA_GV01_rv_10_u-900	RV_10.044.01.2{26} pratvakṣāṇo ati viśvā sahāṃsyapāreṇamahatā vṛṣṇyena	pratvakṣāṇaḥ ati viśvā sahāṃsi apāreṇa mahatā vṛṣṇyena 
SA_GV01_rv_10_u-901	RV_10.044.02.1{26} suṣṭhāmā rathaḥ suyamā harī te mimyakṣa vajro nṛpategabhastau	suṣṭhāmā rathaḥ su yamā harī te mimyakṣa vajraḥ nṛpate gabhastau 
SA_GV01_rv_10_u-902	RV_10.044.02.2{26} śībhaṃ rājan supathā yāhyarvāṃ vardhāmate papuṣo vṛṣṇyāni	śībham rājan su pathā yāhi arvām vardhāmate papuṣaḥ vṛṣṇyāni 
SA_GV01_rv_10_u-903	RV_10.044.03.1{26} endravāho nṛpatiṃ vajrabāhumugramugrāsastaviṣāsa enam	ā indravāhaḥ nṛpatim vajra bāhum ugram ugrāsaḥ taviṣāsaḥ enam 
SA_GV01_rv_10_u-904	RV_10.044.03.2{26} pratvakṣasaṃ vṛṣabhaṃ satyaśuṣmamemasmatrā sadhamādovahantu	pratvakṣasam vṛṣabham satya śuṣmam ā imasmatrā sadhamādaḥ vahantu 
SA_GV01_rv_10_u-905	RV_10.044.04.1{26} evā patiṃ droṇasācaṃ sacetasamūrja skambhaṃ dharuṇaā vṛṣāyase	eva patim droṇasācam sacetasam ūrjaḥ skambham dharuṇaā vṛṣāyase 
SA_GV01_rv_10_u-906	RV_10.044.04.2{26} ojaḥ kṛṣva saṃ gṛbhāya tve apyaso yathākenipānāmino vṛdhe	ojaḥ kṛṣva sam gṛbhāya tve apyasaḥ yathā kenipānāminaḥ vṛdhe 
SA_GV01_rv_10_u-907	RV_10.044.05.1{26} gamannasme vasūnyā hi śaṃsiṣaṃ svāśiṣaṃ bharamāyāhi sominaḥ	gaman asme vasūni ā hi śaṃsiṣam su āśiṣam bharam āyāhi sominaḥ 
SA_GV01_rv_10_u-908	RV_10.044.05.2{26} tvamīśiṣe sāsminnā satsi barhiṣyanādhṛṣyā tava pātrāṇi dharmaṇā	tvam īśiṣe sā asmin ā satsi barhiṣi anādhṛṣyā tava pātrāṇi dharmaṇā 
SA_GV01_rv_10_u-909	RV_10.044.06.1{27} pṛthak prāyan prathamā devahūtayo 'kṛṇvata śravasyāniduṣṭarā	pṛthak prāyan prathamāḥ deva hūtayaḥ kṛṇvata śravasyā aniduṣṭarā 
SA_GV01_rv_10_u-910	RV_10.044.06.2{27} na ye śekuryajñiyāṃ nāvamāruhamīrmaivate nyaviśanta kepayaḥ	na ye śekuḥ yajñiyām nāvam āruhamīḥ maivate nyaviśanta kepayaḥ 
SA_GV01_rv_10_u-911	RV_10.044.07.1{27} evaivāpāgapare santu dūḍhyo 'śvā yeṣāṃ duryujaāyuyujre	eva eva apāk apare santu śvā yeṣām duryujaḥ āyuyujre 
SA_GV01_rv_10_u-912	RV_10.044.07.2{27} itthā ye prāgupare santi dāvane purūṇiyatra vayunāni bhojanā	itthā ye prāk upare santi dāvane purūṇiyatra vayunāni bhojanā 
SA_GV01_rv_10_u-913	RV_10.044.08.1{27} girīnrajrān rejamānānadhārayad dyauḥ krandadantarikṣāṇi kopayat	girīn rajrān rejamānān adhārayat dyauḥ krandat antarikṣāṇi kopayat 
SA_GV01_rv_10_u-914	RV_10.044.08.2{27} samīcīne dhiṣaṇe vi ṣkabhāyativṛṣṇaḥ pītvā mada ukthāni śaṃsati	samīcīne dhiṣaṇe vi skabhāyati vṛṣṇaḥ pītvā made ukthāni śaṃsati 
SA_GV01_rv_10_u-915	RV_10.044.09.1{27} imaṃ bibharmi sukṛtaṃ te aṅkuśaṃ yenārujāsi maghavañchaphārujaḥ	imam bibharmi su kṛtam te aṅkuśam yena ārujāsi maghavan śaphārujaḥ 
SA_GV01_rv_10_u-916	RV_10.044.09.2{27} asmin su te savane astvokyaṃ suta iṣṭaumaghavan bodhyābhagaḥ	asmin su te savane astu okyam sute iṣṭau maghavan bodhyā bhagaḥ 
SA_GV01_rv_10_u-917	RV_10.044.10.1{27} gobhiṣ ṭaremāmatiṃ ...	gobhiḥ tarema amatim 
SA_GV01_rv_10_u-918	RV_10.044.11.1{27} bṛhaspatirnaḥ pari ...	bṛhaspatiḥ naḥ pari 
SA_GV01_rv_10_u-919	RV_10.045.01.1{28} divas pari prathamaṃ jajñe agnirasmad dvitīyaṃ parijātavedāḥ	divaḥ pari prathamam jajñe agniḥ asmat dvitīyam parijātavedāḥ 
SA_GV01_rv_10_u-920	RV_10.045.01.2{28} tṛtīyamapsu nṛmaṇā ajasramindhāna enaṃjarate svādhīḥ	tṛtīyam apsu nṛmaṇāḥ ajasram indhānaḥ enam jarate svādhīḥ 
SA_GV01_rv_10_u-921	RV_10.045.02.1{28} vidmā te agne tredhā trayāṇi vidmā te dhāma vibhṛtāpurutrā	vidma te agne tredhā trayāṇi vidma te dhāma vibhṛtā purutrā 
SA_GV01_rv_10_u-922	RV_10.045.02.2{28} vidmā te nāma paramaṃ guhā yad vidmā tamutsaṃ yata ājagantha	vidma te nāma paramam guhā yat vidma tam utsam yatas ājagantha 
SA_GV01_rv_10_u-923	RV_10.045.03.1{28} samudre tvā nṛmaṇā apsvantarnṛcakṣā īdhe divo agnaūdhan	samudre tvā nṛmaṇāḥ apsu antar nṛ cakṣāḥ īdhe divaḥ agni ūdhan 
SA_GV01_rv_10_u-924	RV_10.045.03.2{28} tṛtīye tvā rajasi tasthivāṃsamapāmupasthemahiṣā avardhan	tṛtīye tvā rajasi tasthivāṃsam apām upasthe mahiṣāḥ avardhan 
SA_GV01_rv_10_u-925	RV_10.045.04.1{28} akrandadagni stanayanniva dyauḥ kṣāmā rerihad vīrudhaḥsamañjan	akrandat agniḥ stanayan iva dyauḥ kṣāmā rerihat vīrudhaḥ samañjan 
SA_GV01_rv_10_u-926	RV_10.045.04.2{28} sadyo jajñāno vi hīmiddho akhyadā rodasībhānunā bhātyantaḥ	sadyas jajñānaḥ vi hi īm iddhaḥ akhyadāḥ rodasī bhānunā bhāti antar 
SA_GV01_rv_10_u-927	RV_10.045.05.1{28} śrīṇāmudāro dharuṇo rayīṇāṃ manīṣāṇāmprārpaṇaḥ somagopāḥ	śrīṇām udāraḥ dharuṇaḥ rayīṇām manīṣāṇām prārpaṇaḥ soma gopāḥ 
SA_GV01_rv_10_u-928	RV_10.045.05.2{28} vasuḥ sūnuḥ sahaso apsu rājāvi bhātyagra uṣasāmidhānaḥ	vasuḥ sūnuḥ sahasaḥ apsu rājā avi bhāti agre uṣasā amidhānaḥ 
SA_GV01_rv_10_u-929	RV_10.045.06.1{28} viśvasya keturbhuvanasya garbha ā rodasī apṛṇājjāyamānaḥ	viśvasya ketuḥ bhuvanasya garbhaḥ ā rodasī apṛṇāt jāyamānaḥ 
SA_GV01_rv_10_u-930	RV_10.045.06.2{28} vīḷuṃ cidadrimabhinat parāyañ janā yadagnimayajanta pañca	vīḷum cit adrim abhinat parāyam janāḥ yat agnim ayajanta pañca 
SA_GV01_rv_10_u-931	RV_10.045.07.1{29} uśik pāvako aratiḥ sumedhā marteṣvagniramṛto ni dhāyi	uśij pāvakaḥ aratiḥ sumedhāḥ marteṣu agniḥ amṛtaḥ ni dhāyi 
SA_GV01_rv_10_u-932	RV_10.045.07.2{29} iyarti dhūmamaruṣaṃ bharibhraducchukreṇa śociṣādyā inakṣan	iyarti dhūmam aruṣam bharibhrat ucchukreṇa śociṣā adyāḥ inakṣan 
SA_GV01_rv_10_u-933	RV_10.045.08.1{29} dṛśāno rukma urviyā vyadyaud durmarṣamāyuḥ śriyerucānaḥ	dṛśānaḥ rukmaḥ urviyā vyadyaut durmarṣam āyuḥ śriyerucānaḥ 
SA_GV01_rv_10_u-934	RV_10.045.08.2{29} agniramṛto abhavad vayobhiryadenaṃ dyaurjanayat suretāḥ	agniḥ amṛtaḥ abhavat vayobhiḥ yat enam dyauḥ janayat su retāḥ 
SA_GV01_rv_10_u-935	RV_10.045.09.1{29} yaste adya kṛṇavad bhadraśoce 'pūpaṃ deva ghṛtavantamagne	yaḥ te adya kṛṇavat bhadra śoce pūpam deva ghṛtavantam agne 
SA_GV01_rv_10_u-936	RV_10.045.09.2{29} pra taṃ naya prataraṃ vasyo achābhi sumnaṃ devabhaktaṃyaviṣṭha	pra tam naya prataram vasyaḥ acha abhi sumnam deva bhaktaṃyaviṣṭha 
SA_GV01_rv_10_u-937	RV_10.045.10.1{29} ā taṃ bhaja sauśravaseṣvagna ukthauktha ā bhaja śasyamāne	ā tam bhaja sauśravaseṣu agne ukthaukthe ā bhaja śasyamāne 
SA_GV01_rv_10_u-938	RV_10.045.10.2{29} priyaḥ sūrye priyo agnā bhavātyujjātena bhinadadujjanitvaiḥ	priyaḥ sūrye priyaḥ agnā bhavāti ujjātena bhinadat ujjanitvaiḥ 
SA_GV01_rv_10_u-939	RV_10.045.11.1{29} tvāmagne yajamānā anu dyūn viśvā vasu dadhire vāryāṇi	tvām agne yajamānāḥ anu dyūn viśvā vasu dadhire vāryāṇi 
SA_GV01_rv_10_u-940	RV_10.045.11.2{29} tvayā saha draviṇamichamānā vrajaṃ gomantamuśijo vivavruḥ	tvayā saha draviṇam icchamānāḥ vrajam gomantam uśijaḥ vivavruḥ 
SA_GV01_rv_10_u-941	RV_10.045.12.1{29} astāvyagnirnarāṃ suśevo vaiśvānara ṛṣibhiḥsomagopāḥ	astāvi agniḥ narām su śevaḥ vaiśvānaraḥ ṛṣibhiḥ soma gopāḥ 
SA_GV01_rv_10_u-942	RV_10.045.12.2{29} adveṣe dyāvāpṛthivī huvema devā dhatta rayimasme suvīram	a dveṣe dyāvāpṛthivī huvema devāḥ dhatta rayim asme su vīram 
SA_GV01_rv_10_u-943	RV_10.046.01.1{01} pra hotā jāto mahān nabhovin nṛṣadvā sīdadapāmupasthe	pra hotā jātaḥ mahān nabhaḥ vid nṛṣadvā sīdat apām upasthe 
SA_GV01_rv_10_u-944	RV_10.046.01.2{01} dadhiryo dhāyi sa te vayāṃsi yantā vasūni vidhatetanūpāḥ	dadhiḥ yaḥ dhāyi sa te vayāṃsi yantā vasūni 
SA_GV01_rv_10_u-945	RV_10.046.02.1{01} imaṃ vidhanto apāṃ sadhasthe paśuṃ na naṣṭaṃ padairanu gman	imam vidhantaḥ apām sadhasthe paśum na naṣṭam padaiḥ anu gman 
SA_GV01_rv_10_u-946	RV_10.046.02.2{01} guhā catantamuśijo namobhirichanto dhīrābhṛgavo 'vindan	guhā catantam uśijaḥ namobhiḥ ichantaḥ dhīrābhṛgavaḥ vindan 
SA_GV01_rv_10_u-947	RV_10.046.03.1{01} imaṃ trito bhūryavindadichan vaibhūvaso mūrdhanyaghnyāyāḥ	imam tritaḥ bhūri avindat icchan vaibhūvasaḥ mūrdhani aghnyāyāḥ 
SA_GV01_rv_10_u-948	RV_10.046.03.2{01} sa śevṛdho jāta ā harmyeṣu nābhiryuvābhavati rocanasya	sa śevṛdhaḥ jātaḥ ā harmyeṣu nābhiḥ yuvā bhavati rocanasya 
SA_GV01_rv_10_u-949	RV_10.046.04.1{01} mandraṃ hotāramuśijo namobhiḥ prāñcaṃ yajñaṃ netāramadhvarāṇām	mandram hotāram uśijaḥ namobhiḥ prāñcam yajñam netāram adhvarāṇām 
SA_GV01_rv_10_u-950	RV_10.046.04.2{01} viśāmakṛṇvannaratiṃ pāvakaṃ havyavāhandadhato mānuṣeṣu	viśām akṛṇvan aratim pāvakam havyavāhan dadhataḥ mānuṣeṣu 
SA_GV01_rv_10_u-951	RV_10.046.05.1{01} pra bhūrjayantaṃ mahāṃ vipodhāṃ mūrā amūraṃ purāndarmāṇam	pra bhūrjayantam mahām vipodhām mūrāḥ amūram purāndarmāṇam 
SA_GV01_rv_10_u-952	RV_10.046.05.2{01} nayanto garbhaṃ vanāṃ dhiyaṃ dhurhiriśmaśruṃ nārvāṇaṃ dhanarcam	nayantaḥ garbham vanām dhiyam dhurhiri śmaśrum na arvāṇam dhana ṛcam 
SA_GV01_rv_10_u-953	RV_10.046.06.1{02} ni pastyāsu trita stabhūyan parivīto yonau sīdadantaḥ	ni pastyāsu trita stabhūyan parivītaḥ yonau sīdat antaḥ 
SA_GV01_rv_10_u-954	RV_10.046.06.2{02} ataḥ saṃgṛbhyā viśāṃ damūnā vidharmaṇāyantrairīyatenṝn	atas saṃgṛbhyā viśām damūnāḥ vidharmaṇā ayantraiḥ īyatenṝn 
SA_GV01_rv_10_u-955	RV_10.046.07.1{02} asyājarāso damāmaritrā arcaddhūmāso agnayaḥ pāvakāḥ	asya ajarāsaḥ dama a maritrāḥ arcat dhūmāsaḥ agnayaḥ pāvakāḥ 
SA_GV01_rv_10_u-956	RV_10.046.07.2{02} śvitīcayaḥ śvātrāso bhuraṇyavo vanarṣado vāyavo nasomāḥ	śvitīcayaḥ śvātrāsaḥ bhuraṇyavaḥ vanarṣadaḥ vāyavaḥ na somāḥ 
SA_GV01_rv_10_u-957	RV_10.046.08.1{02} pra jihvayā bharate vepo agniḥ pra vayunāni cetasāpṛthivyāḥ	pra jihvayā bharate vepaḥ agniḥ pra vayunāni cetasā pṛthivyāḥ 
SA_GV01_rv_10_u-958	RV_10.046.08.2{02} tamāyavaḥ śucayantaṃ pāvakaṃ mandraṃhotāraṃ dadhire yajiṣṭham	tam āyavaḥ śucayantam pāvakam mandraṃhotāram dadhire yajiṣṭham 
SA_GV01_rv_10_u-959	RV_10.046.09.1{02} dyāvā yamagniṃ pṛthivī janiṣṭāmāpastvaṣṭā bhṛgavoyaṃ sahobhiḥ	dyāvā yam agnim pṛthivī janiṣṭa āma apaḥ tvaṣṭā bhṛgavaḥ yam sahobhiḥ 
SA_GV01_rv_10_u-960	RV_10.046.09.2{02} īḷenyaṃ prathamaṃ mātariśvā devāstatakṣurmanave yajatram	īḍenyam prathamam mātariśvā devāḥ tatakṣuḥ manave yajatram 
SA_GV01_rv_10_u-961	RV_10.046.10.1{02} yaṃ tvā devā dadhire havyavāhaṃ puruspṛho mānuṣāsoyajatram	yam tvā devāḥ dadhire havya vāham puruspṛhaḥ mānuṣāsaḥ yajatram 
SA_GV01_rv_10_u-962	RV_10.046.10.2{02} sa yāmannagne stuvate vayo dhāḥ pra devayanyaśasaḥ saṃ hi pūrvīḥ	sa yāman agne stuvate vayaḥ dhāḥ pra devayan yaśasaḥ sam hi pūrvīḥ 
SA_GV01_rv_10_u-963	RV_10.047.01.1{03} jagṛbhmā te dakṣiṇamindra hastaṃ vasūyavo vasupatevasūnām	jagṛbhma te dakṣiṇam indra hastam vasūyavaḥ vasu pate vasūnām 
SA_GV01_rv_10_u-964	RV_10.047.01.2{03} vidmā hi tvā gopatiṃ śūra gonāmasmabhyaṃcitraṃ vṛṣaṇaṃ rayiṃ dāḥ	vidma hi tvā go patim śūra gonām asmabhyam citram vṛṣaṇam rayim dāḥ 
SA_GV01_rv_10_u-965	RV_10.047.02.1{03} svāyudhaṃ svavasaṃ sunīthaṃ catuḥsamudraṃ dharunaṃrayīṇām	su āyudham su avasam su nītham catur samudram dharunam rayīṇām 
SA_GV01_rv_10_u-966	RV_10.047.02.2{03} carkṛtyaṃ śaṃsyaṃ bhūrivāramasmabhyaṃcitraṃ vṛṣaṇaṃ rayiṃ dāḥ	carkṛtyam śaṃsyam bhūri vāram asmabhyam citram vṛṣaṇam rayim dāḥ 
SA_GV01_rv_10_u-967	RV_10.047.03.1{03} subrahmāṇaṃ devavantaṃ bṛhantamuruṃ gabhīraṃ pṛthubudhnamindra	su brahmāṇam devavantam bṛhantam urum gabhīram pṛthu budhnam indra 
SA_GV01_rv_10_u-968	RV_10.047.03.2{03} śrutaṛṣimugramabhimātiṣāhamasmabhyaṃ citraṃvṛṣaṇaṃ rayiṃ dāḥ	śruta ṛṣim ugram abhimātiṣāham asmabhyam citram vṛṣaṇam rayim dāḥ 
SA_GV01_rv_10_u-969	RV_10.047.04.1{03} sanadvājaṃ vipravīraṃ tarutraṃ dhanaspṛtaṃ śūśuvāṃsaṃsudakṣam	sanat vājam vipra vīram tarutram dhana spṛtam śūśuvāṃsam su dakṣam 
SA_GV01_rv_10_u-970	RV_10.047.04.2{03} dasyuhanaṃ pūrbhidamindra satyamasmabhyaṃcitraṃ vṛṣaṇaṃ rayiṃ dāḥ	dasyu hanam pūrbhidam indra satyam asmabhyam citram vṛṣaṇam rayim dāḥ 
SA_GV01_rv_10_u-971	RV_10.047.05.1{03} aśvāvantaṃ rathinaṃ vīravantaṃ sahasriṇaṃ śatinaṃvājamindra	aśvāvantam rathinam vīravantam sahasriṇam śatinam vājam indra 
SA_GV01_rv_10_u-972	RV_10.047.05.2{03} bhadravrātaṃ vipravīraṃ svarṣāmasmabhyaṃcitraṃ vṛṣaṇaṃ rayiṃ dāḥ	bhadra vrātam vipra vīram svarṣām asmabhyam citram vṛṣaṇam rayim dāḥ 
SA_GV01_rv_10_u-973	RV_10.047.06.1{04} pra saptagum ṛtadhītiṃ sumedhāṃ bṛhaspatiṃ matirachājigāti	pra saptagum ṛta dhītim su medhām bṛhaspatim matiḥ achā ājigāti 
SA_GV01_rv_10_u-974	RV_10.047.06.2{04} ya āṅgiraso namasopasadyo 'smabhyaṃ citraṃvṛṣaṇaṃ rayiṃ dāḥ	yaḥ āṅgirasaḥ namasā upasadyaḥ smabhyam citraṃvṛṣaṇam rayim dāḥ 
SA_GV01_rv_10_u-975	RV_10.047.07.1{04} vanīvāno mama dūtāsa indraṃ stomāścaranti sumatīriyānāḥ	vanīvānaḥ mama dūtāsaḥ indram stomāḥ caranti sumatīḥ iyānāḥ 
SA_GV01_rv_10_u-976	RV_10.047.07.2{04} hṛdispṛśo manasā vacyamānā asmabhyaṃ citraṃvṛṣaṇaṃ rayiṃ dāḥ	hṛdispṛśaḥ manasā vacyamānāḥ asmabhyam citraṃvṛṣaṇam rayim dāḥ 
SA_GV01_rv_10_u-977	RV_10.047.08.1{04} yat tvā yāmi daddhi tan na indra bṛhantaṃ kṣayamasamaṃjanānām	yat tvā yāmi daddhi tat naḥ indra bṛhantam kṣayamasamaṃjanānām 
SA_GV01_rv_10_u-978	RV_10.047.08.2{04} abhi tad dyāvāpṛthivī gṛṇītāmasmabhyaṃcitraṃ vṛṣaṇaṃ rayiṃ dāḥ	abhi tat dyāvāpṛthivī gṛṇītām asmabhyam citram vṛṣaṇam rayim dāḥ 
SA_GV01_rv_10_u-979	RV_10.048.01.1{05} ahaṃ bhuvaṃ vasunaḥ pūrvyas patirahaṃ dhanāni saṃjayāmi śaśvataḥ	aham bhuvam vasunaḥ pūrvyaḥ patiḥ aham dhanāni saṃjayāmi śaśvataḥ 
SA_GV01_rv_10_u-980	RV_10.048.01.2{05} māṃ havante pitaraṃ na jantavo 'handāśuṣe vi bhajāmi bhojanam	mām havante pitaram na jantavaḥ handa aśuṣe vi bhajāmi bhojanam 
SA_GV01_rv_10_u-981	RV_10.048.02.1{05} ahamindro rodho vakṣo atharvaṇastritāya gā ajanayamaheradhi	aham indraḥ rodhaḥ vakṣaḥ atharvaṇaḥ tritāya gāḥ ajanayam aheḥ adhi 
SA_GV01_rv_10_u-982	RV_10.048.02.2{05} ahaṃ dasyubhyaḥ pari nṛmṇamā dade gotrā śikṣandadhīce mātariśvane	aham dasyubhyaḥ pari nṛmṇamā dade gotrā śikṣan dadhīce mātariśvane 
SA_GV01_rv_10_u-983	RV_10.048.03.1{05} mahyaṃ tvaṣṭā vajramatakṣadāyasaṃ mayi devāso 'vṛjannapi kratum	mahyam tvaṣṭā vajram atakṣat āyasam mayi devāsaḥ vṛjan api kratum 
SA_GV01_rv_10_u-984	RV_10.048.03.2{05} mamānīkaṃ sūryasyeva duṣṭaraṃ māmāryantikṛtena kartvena ca	mama anīkam sūryasya iva duṣṭaram mām āryanti kṛtena kartvena ca 
SA_GV01_rv_10_u-985	RV_10.048.04.1{05} ahametaṃ gavyayamaśvyaṃ paśuṃ purīṣiṇaṃ sāyakenāhiraṇyayam	aham etam gavyayam aśvyam paśum purīṣiṇam sāyakena a hiraṇyayam 
SA_GV01_rv_10_u-986	RV_10.048.04.2{05} purū sahasrā ni śiśāmi dāśuṣe yan māsomāsa ukthino amandiṣuḥ	purū sahasrā ni śiśāmi dāśuṣe yat mā asomāsaḥ ukthinaḥ amandiṣuḥ 
SA_GV01_rv_10_u-987	RV_10.048.05.1{05} ahamindro na parā jigya id dhanaṃ na mṛtyave 'va tasthekadā cana	aham indraḥ na parā jigye id dhanam na mṛtyave tastha ikadā cana 
SA_GV01_rv_10_u-988	RV_10.048.05.2{05} somamin mā sunvanto yācatā vasu na mepūravaḥ sakhye riṣāthana	somam id mā sunvantaḥ yācata vasu na mepūravaḥ sakhye riṣāthana 
SA_GV01_rv_10_u-989	RV_10.048.06.1{06} ahametāñchāśvasato dvā-dvendraṃ ye vajraṃ yudhaye'kṛṇvata	aham etān śāśvasataḥ dvādvā indram ye vajram yudhayekṛṇvata 
SA_GV01_rv_10_u-990	RV_10.048.06.2{06} āhvayamānānava hanmanāhanaṃ dṛḷā vadannanamasyurnamasvinaḥ	āhvayamānān ava hanmanā ahanam dṛḍā vadan anamasyuḥ namasvinaḥ 
SA_GV01_rv_10_u-991	RV_10.048.07.1{06} abhīdamekameko asmi niṣṣāḷ abhī dvā kimu trayaḥkaranti	abhi idam ekam ekaḥ asmi niṣṣāh abhī dvā kimu trayaḥ karanti 
SA_GV01_rv_10_u-992	RV_10.048.07.2{06} khale na parṣān prati hanmi bhūri kiṃ mā nindantiśatravo 'nindrāḥ	khale na parṣān prati hanmi bhūri kim mā nindanti śatravaḥ n indrāḥ 
SA_GV01_rv_10_u-993	RV_10.048.08.1{06} ahaṃ guṅgubhyo atithigvamiṣkaramiṣaṃ na vṛtraturaṃvikṣu dhārayam	aham guṅgubhyaḥ na vṛtra turaṃvikṣu 
SA_GV01_rv_10_u-994	RV_10.048.08.2{06} yat parṇayaghna uta vā karañjahe prāhammahe vṛtrahatye aśuśravi	yat parṇaya ghne uta vā karañja he prāhammahe vṛtra hatye aśuśravi 
SA_GV01_rv_10_u-995	RV_10.048.09.1{06} pra me namī sāpya iṣe bhuje bhūd gavāmeṣe sakhyākṛṇuta dvitā	pra me namī sāpyaḥ iṣe bhuje bhūt gavām iṣe sakhyā akṛṇuta dvitā 
SA_GV01_rv_10_u-996	RV_10.048.09.2{06} didyuṃ yadasya samitheṣu maṃhayamādidenaṃ śaṃsyamukthyaṃ karam	didyum yat asya samitheṣu maṃhayam ādidenam śaṃsyam ukthyam karam 
SA_GV01_rv_10_u-997	RV_10.048.10.1{06} pra nemasmin dadṛśe somo antargopā nemamāvirasthākṛṇoti	pra nemasmin dadṛśe somaḥ antargopāḥ 
SA_GV01_rv_10_u-998	RV_10.048.10.2{06} sa tigmaśṛṅgaṃ vṛṣabhaṃ yuyutsan druhastasthaubahule baddho antaḥ	sa tigma śṛṅgam vṛṣabham yuyutsan druhaḥ tasthau bahule baddhaḥ antar 
SA_GV01_rv_10_u-999	RV_10.048.11.1{06} ādityānāṃ vasūnāṃ rudriyāṇāṃ devo devānāṃ namināmi dhāma	ādityānām vasūnām rudriyāṇām devaḥ devānām namināmi dhāma 
SA_GV01_rv_10_u-1000	RV_10.048.11.2{06} te mā bhadrāya śavase tatakṣuraparājitamastṛtamaṣāḷam	te mā bhadrāya śavase tatakṣuḥ aparājitam astṛtam aṣāḍam 
SA_GV01_rv_10_u-1001	RV_10.049.01.1{07} ahaṃ dāṃ gṛṇate pūrvyaṃ vasvahaṃ brahma kṛṇavaṃ mahyaṃvardhanam	aham dām gṛṇate pūrvyam vasu aham brahma kṛṇavam mahyam vardhanam 
SA_GV01_rv_10_u-1002	RV_10.049.01.2{07} ahaṃ bhuvaṃ yajamānasya coditāyajvanaḥ sākṣiviśvasmin bhare	aham bhuvam yajamānasya codita ayajvanaḥ sākṣi viśvasmin bhare 
SA_GV01_rv_10_u-1003	RV_10.049.02.1{07} māṃ dhurindraṃ nāma devatā divaśca gmaścāpāṃ cajantavaḥ	mām dhuḥ indram nāma devatāḥ divaḥ ca gmaḥ ca apām ca jantavaḥ 
SA_GV01_rv_10_u-1004	RV_10.049.02.2{07} ahaṃ harī vṛṣaṇā vivratā raghū ahaṃvajraṃ śavase dhṛṣṇvā dade	aham harī vṛṣaṇā vivratā raghū aham vajram śavase dhṛṣṇvā dade 
SA_GV01_rv_10_u-1005	RV_10.049.03.1{07} ahamatkaṃ kavaye śiśnathaṃ hathairahaṃ kutsamāvamābhirūtibhiḥ	kavaye śiśnatham hathaiḥ aham 
SA_GV01_rv_10_u-1006	RV_10.049.03.2{07} ahaṃ śuṣṇasya śnathitā vadharyamaṃna yo rara āryaṃ nāma dasyave	aham śuṣṇasya śnathitā vadharyamaṃna yaḥ rare āryam nāma dasyave 
SA_GV01_rv_10_u-1007	RV_10.049.04.1{07} ahaṃ piteva vetasūnrabhiṣṭaye tugraṃ kutsāya smadibhaṃca randhayam	aham pitā iva vetasūn rabhiṣṭaye tugram kutsāya smadibham ca randhayam 
SA_GV01_rv_10_u-1008	RV_10.049.04.2{07} ahaṃ bhuvaṃ yajamānasya rājani pra yad bharetujaye na priyādhṛṣe	aham bhuvam yajamānasya rājani pra yat bharetujaye na priyādhṛṣe 
SA_GV01_rv_10_u-1009	RV_10.049.05.1{07} ahaṃ randhayaṃ mṛgayaṃ śrutarvaṇe yan mājihīta vayunācanānuṣak	aham randhayam mṛgayam śrutarvaṇe yat mā ājihīta vayunā cana anuṣak 
SA_GV01_rv_10_u-1010	RV_10.049.05.2{07} ahaṃ veśaṃ namramāyave 'karamahaṃsavyāya paḍgṛbhimarandhayam	aham veśam namra māyave karama haṃsavyāya paḍgṛbhim arandhayam 
SA_GV01_rv_10_u-1011	RV_10.049.06.1{08} ahaṃ sa yo navavāstvaṃ bṛhadrathaṃ saṃ vṛtreva dāsaṃvṛtrahārujam	aham sa yaḥ navavāstvam bṛhat ratham sam vṛtrā iva dāsam vṛtra hā arujam 
SA_GV01_rv_10_u-1012	RV_10.049.06.2{08} yad vardhayantaṃ prathayantamānuṣag dūrepāre rajaso rocanākaram	yat vardhayantam prathayantam ānuṣak dūrepāre rajasaḥ rocana ākaram 
SA_GV01_rv_10_u-1013	RV_10.049.07.1{08} ahaṃ sūryasya pari yāmyāśubhiḥ praitaśebhirvahamānaojasā	aham sūryasya pari yāmi āśubhiḥ pra etaśebhiḥ vahamānaḥ ojasā 
SA_GV01_rv_10_u-1014	RV_10.049.07.2{08} yan mā sāvo manuṣa āha nirṇija ṛdhak kṛṣedāsaṃ kṛtvyaṃ hathaiḥ	yat mā sāvaḥ manuṣe āha nirṇijaḥ ṛdhak kṛṣedāsam kṛtvyam hathaiḥ 
