segmentnr	original	analyzed
SA_GR14_astavgpu-383	kutaḥ praśama-pīyūṣa-dhārāsāram ṛte sukham // Avg_18.3 //	kutas praśama pīyūṣa dhārā sāram ṛte sukham 
SA_GR14_astavgpu-384	bhavo 'yaṃ bhāvanā-mātro na kiṃcit param-arthataḥ /	bhavaḥ yam bhāvanā mātraḥ na kiṃcid paramarthataḥ 
SA_GR14_astavgpu-385	nāsty abhāvaḥ sva-bhāvanāṃ bhāvābhāva-vibhāvinām // Avg_18.4 //	na asti abhāvaḥ svabhāvanām bhāva abhāva vibhāvinām 
SA_GR14_astavgpu-386	na dūraṃ na ca saṅkocāl labdham evātmanaḥ padam /	na dūram na ca saṅkocāt labdham eva ātmanaḥ padam 
SA_GR14_astavgpu-387	nirvikalpaṃ nirāyāsaṃ nirvikāraṃ nirañjanam // Avg_18.5 //	nirvikalpam nirāyāsam nirvikāram nirañjanam 
SA_GR14_astavgpu-388	vyāmoha-mātra-viratau svarūpādāna-mātrataḥ /	vyāmoha mātra viratau sva rūpa ādāna mātrataḥ 
SA_GR14_astavgpu-389	vītaśokā virājante nirāvaraṇa-dṛṣṭayaḥ // Avg_18.6 //	vīta śokāḥ virājante nirāvaraṇa dṛṣṭayaḥ 
SA_GR14_astavgpu-390	samastaṃ kalpanā-mātram ātmā muktaḥ sanātanaḥ /	samastam kalpanā mātram ātmā muktaḥ sanātanaḥ 
SA_GR14_astavgpu-391	iti vijñāya dhīro hi kim abhyasyati bālavat // Avg_18.7 //	iti vijñāya dhīraḥ hi kim abhyasyati bāla vat 
SA_GR14_astavgpu-392	ātmā brahmeti niścitya bhāvābhāvau ca kalpitau /	ātmā brahma iti niścitya bhāva abhāvau ca kalpitau 
SA_GR14_astavgpu-393	niṣkāmaḥ kiṃ vijānāti kiṃ brūte ca karoti kiṃ // Avg_18.8 //	niṣkāmaḥ kim vijānāti kim brūte ca karoti kim 
SA_GR14_astavgpu-394	ayaṃ so 'ham ayaṃ nāham iti kṣīṇā vikalpanāḥ /	ayam saḥ ham ayam na aham iti kṣīṇāḥ vikalpanāḥ 
SA_GR14_astavgpu-395	sarvam ātmeti niścitya tūṣṇī-bhūtasya yoginaḥ // Avg_18.9 //	sarvam ātmā iti niścitya tūṣṇībhūtasya yoginaḥ 
SA_GR14_astavgpu-396	na vikṣepo na caikāgryaṃ nātibodho na mūḍhatā /	na vikṣepaḥ na ca aikāgryam na ati bodhaḥ na mūḍha tā 
SA_GR14_astavgpu-397	na sukhaṃ na ca vā duḥkham upaśāntasya yoginaḥ // Avg_18.10 //	na sukham na ca vā duḥkham upaśāntasya yoginaḥ 
SA_GR14_astavgpu-398	svārājye bhaikṣa-vṛttau ca lābhālābhe jane vane /	svārājye bhaikṣa vṛttau ca lābha alābhe jane vane 
SA_GR14_astavgpu-399	nirvikalpa-svabhāvasya na viṣeso 'sti yoginaḥ // Avg_18.11 //	nirvikalpa svabhāvasya na sti yoginaḥ 
SA_GR14_astavgpu-400	kva dharmaḥ kva ca vā kāmaḥ kva cārthaḥ kva vivekitā /	kva dharmaḥ kva ca vā kāmaḥ kva ca arthaḥ kva viveki tā 
SA_GR14_astavgpu-401	idaṃ kṛtam idaṃ neti dvandvair muktasya yoginaḥ // Avg_18.12 //	idam kṛtam idam na iti dvandvaiḥ muktasya yoginaḥ 
SA_GR14_astavgpu-402	kṛtyaṃ kim api naivāsti na kāpi hṛdi rañjanā /	kṛtyam kim api nā evā asti na kā api hṛdi rañjanā 
SA_GR14_astavgpu-403	yathā-jīvanam eveha jīvan-muktasya yoginaḥ // Avg_18.13 //	yathā ājīvanam evā iha jīvanmuktasya yoginaḥ 
SA_GR14_astavgpu-404	kva mohaḥ kva ca vā viśvaṃ kva tad dhyānaṃ kva muktatā /	kva mohaḥ kva ca vā viśvam kva tat dhyānam kva mukta tā 
SA_GR14_astavgpu-405	sarva-saṅkalpa-sīmāyāṃ viśrāntasya mahātmanaḥ // Avg_18.14 //	sarva saṅkalpa sīmāyām viśrāntasya mahātmanaḥ 
SA_GR14_astavgpu-406	yena viśvam idaṃ dṛṣṭaṃ sa nāstīti karotu vai /	yena viśvam idam dṛṣṭam sa na asti iti karotu vai 
SA_GR14_astavgpu-407	nirvāsanaḥ kiṃ kurute paśyann api na paśyati // Avg_18.15 //	nirvāsanaḥ kim kurute paśyan api na paśyati 
SA_GR14_astavgpu-408	yena dṛṣṭaṃ paraṃ brahma so 'haṃ brahmeti cintayet /	yena dṛṣṭam param brahma saḥ ham brahma iti cintayet 
SA_GR14_astavgpu-409	kiṃ cintayati niścinto dvitīyaṃ yo na paśyati // Avg_18.16 //	kim cintayati niścintaḥ dvitīyam yaḥ na paśyati 
SA_GR14_astavgpu-410	dṛṣṭo yenātma-vikṣepo nirodhaṃ kurute tv asau /	dṛṣṭaḥ yena ātma vikṣepaḥ nirodham kurute tu asau 
SA_GR14_astavgpu-411	udāras tu na vikṣiptaḥ sādhyābhāvāt karoti kim // Avg_18.17 //	udāraḥ tu na vikṣiptaḥ sādhya abhāvāt karoti kim 
SA_GR14_astavgpu-412	dhīro loka-viparyasto varttamāno 'pi lokavat /	dhīraḥ loka viparyastaḥ varttamānaḥ pi loka vat 
SA_GR14_astavgpu-413	na samādhiṃ na vikṣepaṃ na lepaṃ svasya paśyati // Avg_18.18 //	na samādhim na vikṣepam na lepam svasya paśyati 
SA_GR14_astavgpu-414	bhāvābhāva-vihīno yas tṛpto nirvāsano budhaḥ /	bhāva abhāva vihīnaḥ yaḥ tṛptaḥ nirvāsanaḥ budhaḥ 
SA_GR14_astavgpu-415	naiva kiṃcit kṛtaṃ tena loka-dṛṣṭyā vikurvatā // Avg_18.19 //	na eva kiṃcid kṛtam tena loka dṛṣṭyā vikurvatā 
SA_GR14_astavgpu-416	pravṛttau vā nirvṛttau vā naiva dhīrasya durgrahaḥ /	pravṛttau vā nirvṛttau vā nā eva dhīrasya durgrahaḥ 
SA_GR14_astavgpu-417	yadā yat kartum āyāti tatkṛtvā tiṣṭhataḥ sukham // Avg_18.20 //	yadā yat kartum āyāti tat kṛtvā tiṣṭhataḥ sukham 
SA_GR14_astavgpu-418	nirvāsano nirālambaḥ svacchando mukta-bandhanaḥ /	               
SA_GR14_astavgpu-419	kṣiptaḥ saṃskāra-vātena ceṣṭate śuṣka-parṇavat // Avg_18.21 //	kṣiptaḥ saṃskāra vātena ceṣṭate śuṣka parṇa vat 
SA_GR14_astavgpu-420	asaṃsārasya tu kvāpi na harṣo na viṣāditā /	asaṃsārasya tu kvāpi na harṣaḥ na viṣādi tā 
SA_GR14_astavgpu-421	sa śītala-manā nityaṃ videha iva rājate // Avg_18.22 //	sa śītala manāḥ nityam videhaḥ iva rājate 
SA_GR14_astavgpu-422	kutrāpi na jihāsāsti nāśo vāpi na kutracit /	kutra api na jihāsā asti nāśaḥ vā api na kutracid 
SA_GR14_astavgpu-423	ātmārāmasya dhīrasya śītalācchatarātmanaḥ // Avg_18.23 //	ātma ārāmasya dhīrasya śītala acchatara ātmanaḥ 
SA_GR14_astavgpu-424	prakṛtyā śūnya-cittasya kurvato 'sya yad-ṛcchayā /	prakṛtyā śūnya cittasya kurvataḥ sya yadṛcchayā 
SA_GR14_astavgpu-425	prākṛtasyeva dhīrasya na māno nāvamānatā // Avg_18.24 //	prākṛtasya iva dhīrasya na mānaḥ na avamāna tā 
SA_GR14_astavgpu-426	kṛtaṃ dehena karmedaṃ na mayā śuddha-rūpiṇā /	kṛtam dehena karma idam na mayā śuddha rūpiṇā 
SA_GR14_astavgpu-427	iti cintānurodhī yaḥ kurvann api karoti na // Avg_18.25 //	iti cintā anurodhī yaḥ kurvan api karoti na 
SA_GR14_astavgpu-428	atad-vādīva kurute na bhaved api bāliśaḥ /	a tad vādī iva kurute na bhavet api bāliśaḥ 
SA_GR14_astavgpu-429	jīvan-muktaḥ sukhī śrīmān saṃsarann api śobhate // Avg_18.26 //	jīvanmuktaḥ sukhī śrīmān saṃsaran api śobhate 
SA_GR14_astavgpu-430	nānā-vicāra-suśrānto dhīro viśrāntim āgataḥ /	nānā vicāra su śrāntaḥ dhīraḥ viśrāntim āgataḥ 
SA_GR14_astavgpu-431	na kalpate na jānāti na śṛṇoti na paśyati // Avg_18.27 //	na kalpate na jānāti na śṛṇoti na paśyati 
SA_GR14_astavgpu-432	asamādher avikṣepān na mumukṣur na cetaraḥ /	asamādheḥ avikṣepāt na mumukṣuḥ na ca itaraḥ 
SA_GR14_astavgpu-433	niścitya kalpitaṃ paśyan brahmaivāste mahāśayaḥ // Avg_18.28 //	niścitya kalpitam paśyan brahma eva āste mahā āśayaḥ 
SA_GR14_astavgpu-434	yasyāntaḥ syād ahaṅkāro na karoti karoti saḥ /	yasya antaḥ syāt ahaṅkāraḥ na karoti karoti saḥ 
SA_GR14_astavgpu-435	nirahaṅkāra-dhīreṇa na kiṃcid akṛtaṃ kṛtam // Avg_18.29 //	nirahaṅkāra dhīreṇa na kiṃcid akṛtam kṛtam 
SA_GR14_astavgpu-436	nodvignaṃ na ca santuṣṭam akartṛ spanda-varjitam /	na udvignam na ca santuṣṭam akartṛ spanda varjitam 
SA_GR14_astavgpu-437	nirāśaṃ gata-sandehaṃ cittaṃ muktasya rājate // Avg_18.30 //	nirāśam gata sandeham cittam muktasya rājate 
SA_GR14_astavgpu-438	nirdhyātuṃ ceṣṭituṃ vāpi yac cittaṃ na pravarttate /	nirdhyātum ceṣṭitum vā api yat cittam na pravarttate 
SA_GR14_astavgpu-439	nirnimittam idaṃ kin tu nirdhyāyati viceṣṭate // Avg_18.31 //	nirnimittam idam kin tu nirdhyāyati viceṣṭate 
SA_GR14_astavgpu-440	tattvaṃ yathārtham ākarṇya mandaḥ prāpnoti mūḍhatām /	tattvam yathārtham ākarṇya mandaḥ prāpnoti mūḍha tām 
SA_GR14_astavgpu-441	atha vāyāti saṅkocam amūḍhaḥ ko 'pi mūḍhavat // Avg_18.32 //	atha vā āyāti saṅkocam amūḍhaḥ kaḥ pi mūḍha vat 
SA_GR14_astavgpu-442	ekāgratā nirodho vā mūḍhair abhyasyate bhṛśam /	ekāgra tā nirodhaḥ vā mūḍhaiḥ abhyasyate bhṛśam 
SA_GR14_astavgpu-443	dhīrāḥ kṛtyaṃ na paśyanti suptavat sva-pade sthitāḥ // Avg_18.33 //	dhīrāḥ kṛtyam na paśyanti supta vat sva pade sthitāḥ 
SA_GR14_astavgpu-444	aprayatnāt prayatnād vā mūḍho nāpnoti nirvṛtim /	aprayatnāt prayatnāt vā mūḍhaḥ nā āpnoti nirvṛtim 
SA_GR14_astavgpu-445	tattva-niścaya-mātreṇa prājño bhavati nirvṛtaḥ // Avg_18.34 //	tattva niścaya mātreṇa prājñaḥ bhavati nirvṛtaḥ 
SA_GR14_astavgpu-446	śuddhaṃ buddhaṃ priyaṃ pūrṇaṃ niṣprapañcaṃ nirāmayam /	śuddham buddham priyam pūrṇam niṣprapañcam nirāmayam 
SA_GR14_astavgpu-447	ātmānaṃ taṃ na jānanti tatrābhyāsa-parā janāḥ // Avg_18.35 //	ātmānam tam na jānanti tatra abhyāsa parāḥ janāḥ 
SA_GR14_astavgpu-448	nāpnoti karmaṇā mokṣaṃ vimūḍho 'bhyāsa-rūpiṇā /	na āpnoti karmaṇā mokṣam vimūḍhaḥ bhyāsa rūpiṇā 
SA_GR14_astavgpu-449	dhanyo vijñāna-mātreṇa muktas tiṣṭhaty avikriyaḥ // Avg_18.36 //	dhanyaḥ vijñāna mātreṇa muktaḥ tiṣṭhati avikriyaḥ 
SA_GR14_astavgpu-450	mūḍho nāpnoti tad brahma yato bhavitum icchati /	mūḍhaḥ na āpnoti tat brahma yatas bhavitum icchati 
SA_GR14_astavgpu-451	anicchann api dhīro hi para-brahma-svarūpa-bhāk // Avg_18.37 //	an icchan api dhīraḥ hi para brahma sva rūpa bhāj 
SA_GR14_astavgpu-452	nirādhārā grahavya-grā mūḍhāḥ saṃsāra-poṣakāḥ /	nirādhārāḥ graha vyagrāḥ mūḍhāḥ saṃsāra poṣakāḥ 
SA_GR14_astavgpu-453	etasyānartha-mūlasya mūla-cchedaḥ kṛto budhaiḥ // Avg_18.38 //	etasya anartha mūlasya mūla chedaḥ kṛtaḥ budhaiḥ 
SA_GR14_astavgpu-454	na śāntiṃ labhate mūḍho yataḥ śamitum icchati /	na śāntim labhate mūḍhaḥ yatas śamitum icchati 
SA_GR14_astavgpu-455	dhīras tattvaṃ viniścitya sarvadā śānta-mānasaḥ // Avg_18.39 //	dhīraḥ tattvam viniścitya sarvadā śānta mānasaḥ 
SA_GR14_astavgpu-456	kvātmano darśanaṃ tasya yad dṛṣṭam avalambate /	kva ātmanaḥ darśanam tasya yat dṛṣṭam avalambate 
SA_GR14_astavgpu-457	dhīrās taṃ taṃ na paśyanti paśyanty ātmānam avyayam // Avg_18.40 //	dhīrāḥ tam tam na paśyanti paśyanti ātmānam avyayam 
SA_GR14_astavgpu-458	kva nirodho vimūḍhasya yo nirbandhaṃ karoti vai /	kva nirodhaḥ vimūḍhasya yaḥ nirbandham karoti vai 
SA_GR14_astavgpu-459	svārāmasyaiva dhīrasya sarvadāsāv akṛtrimaḥ // Avg_18.41 //	sva ārāmasya eva dhīrasya sarvadā asau akṛtrimaḥ 
SA_GR14_astavgpu-460	bhāvasya bhāvakaḥ kaścin na kiṃcid bhāvako 'paraḥ /	bhāvasya bhāvakaḥ kaścid na kiṃcid paraḥ 
SA_GR14_astavgpu-461	ubhayābhāvakaḥ kaścid evam eva nirākulaḥ // Avg_18.42 //	ubhaya abhāvakaḥ kaścid evam eva nirākulaḥ 
SA_GR14_astavgpu-462	śuddham advayam ātmānaṃ bhāvayanti ku-buddhayaḥ /	śuddham advayam ātmānam bhāvayanti ku buddhayaḥ 
SA_GR14_astavgpu-463	na tu jānanti saṃmohād yāvaj-jīvam anirvṛtāḥ // Avg_18.43 //	na tu jānanti saṃmohāt yāvajjīvam anirvṛtāḥ 
SA_GR14_astavgpu-464	mumukṣor buddhir ālambam antareṇa na vidyate /	mumukṣoḥ buddhiḥ ālambam antareṇa na vidyate 
SA_GR14_astavgpu-465	nirālambaiva niṣkāmā buddhir muktasya sarvadā // Avg_18.44 //	nirālambā eva niṣkāmā buddhiḥ muktasya sarvadā 
SA_GR14_astavgpu-466	viṣaya-dvīpino vīkṣya cakitāḥ śaraṇārthinaḥ /	viṣaya dvīpinaḥ vīkṣya cakitāḥ śaraṇa arthinaḥ 
SA_GR14_astavgpu-467	viśanti jhaṭiti kroḍaṃ nirodhaikāgrya-siddhaye // Avg_18.45 //	viśanti jhaṭiti kroḍam nirodha aikāgrya siddhaye 
SA_GR14_astavgpu-468	nirvāsanaṃ hariṃ dṛṣṭvā tūṣṇīṃ viṣaya-dantinaḥ /	nirvāsanam harim dṛṣṭvā tūṣṇīm viṣaya dantinaḥ 
SA_GR14_astavgpu-469	palāyante na śaktās te sevante kṛta-cāṭavaḥ // Avg_18.46 //	palāyante na śaktāḥ te sevante kṛta cāṭavaḥ 
SA_GR14_astavgpu-470	na mukti-kārikāṃ dhatte niḥśaṅko yukta-mānasaḥ /	na mukti kārikām dhatte niḥśaṅkaḥ yukta mānasaḥ 
SA_GR14_astavgpu-471	paśyañ chṛṇvan spṛśañ jighrann aśnann āste yathā-sukham // Avg_18.47 //	paśyam chṛṇvan spṛśam jighran aśnan āste yathāsukham 
SA_GR14_astavgpu-472	vastu-śravaṇa-mātreṇa śuddha-buddhir nirākulaḥ /	vastu śravaṇa mātreṇa śuddha buddhiḥ nirākulaḥ 
SA_GR14_astavgpu-473	naivācāram-anācāram audāsyaṃ vā prapaśyati // Avg_18.48 //	na eva ācāram anācāram audāsyam vā prapaśyati 
SA_GR14_astavgpu-474	yadā yat kartum āyāti tadā tat-kurute ṛjuḥ /	yadā yat kartum āyāti tadā tat kurute ṛjuḥ 
SA_GR14_astavgpu-475	śubhaṃ vāpy aśubhaṃ vāpi tasya ceṣṭā hi bālavat // Avg_18.49 //	śubham vā api aśubham vā api tasya ceṣṭā hi bāla vat 
SA_GR14_astavgpu-476	svā-tantryāt sukham āpnoti svā-tantryāl labhate param /	svātantryāt sukham āpnoti svātantryāt labhate param 
SA_GR14_astavgpu-477	svā-tantryān nirvṛtiṃ gacchet svā-tantryāt paramaṃ padam // Avg_18.50 //	svātantryāt nirvṛtim gacchet svātantryāt paramam padam 
SA_GR14_astavgpu-478	akartṛtvam abhoktṛtvaṃ svātmano manyate yadā /	akartṛ tvam abhoktṛ tvam sva ātmanaḥ manyate yadā 
SA_GR14_astavgpu-479	tadā kṣīṇā bhavanty eva samastāś citta-vṛttayaḥ // Avg_18.51 //	tadā kṣīṇāḥ bhavanti eva samastāḥ citta vṛttayaḥ 
SA_GR14_astavgpu-480	ucchṛṅkhalāpy akṛtikā sthitir dhīrasya rājate /	ucchṛṅkhalā api akṛtikā sthitiḥ dhīrasya rājate 
SA_GR14_astavgpu-481	na tu saspṛha-cittasya śāntir mūḍhasya kṛtrimā // Avg_18.52 //	na tu sa spṛhā cittasya śāntiḥ mūḍhasya kṛtrimā 
SA_GR14_astavgpu-482	vilasanti mahābhogair viśanti giri-gahvarān /	vilasanti mahā bhogaiḥ viśanti giri gahvarān 
SA_GR14_astavgpu-483	nirasta-kalpanā dhīrā abaddhā mukta-buddhayaḥ // Avg_18.53 //	nirasta kalpanāḥ dhīrāḥ abaddhāḥ mukta buddhayaḥ 
SA_GR14_astavgpu-484	śrotriyaṃ devatāṃ tīrtham aṅganāṃ bhūpatiṃ priyam /	śrotriyam devatām tīrtham aṅganām bhūpatim priyam 
SA_GR14_astavgpu-485	dṛṣṭvā sampūjya dhīrasya na kāpi hṛdi vāsanā // Avg_18.54 //	dṛṣṭvā sampūjya dhīrasya na kā api hṛdi vāsanā 
SA_GR14_astavgpu-486	bhṛtyaiḥ putraiḥ kalatraiś ca dauhitraiś cāpi gotrajaiḥ /	bhṛtyaiḥ putraiḥ kalatraiḥ ca dauhitraiḥ ca api gotra jaiḥ 
SA_GR14_astavgpu-487	vihasya dhik-kṛto yogī na yāti vikṛtiṃ manāk // Avg_18.55 //	vihasya dhikkṛtaḥ yogī na yāti vikṛtim manāk 
SA_GR14_astavgpu-488	santuṣṭo 'pi na santuṣṭaḥ khinno 'pi na ca khidyate /	santuṣṭaḥ pi na santuṣṭaḥ khinnaḥ pi na ca khidyate 
SA_GR14_astavgpu-489	tasyāścarya-daśāṃ tāṃ tāṃ tādṛśā eva jānate // Avg_18.56 //	tasya āścarya daśām tām tām tādṛśāḥ eva jānate 
SA_GR14_astavgpu-490	kartavyataiva saṃsāro na tāṃ paśyanti sūrayaḥ /	kartavya tā eva saṃsāraḥ na tām paśyanti sūrayaḥ 
SA_GR14_astavgpu-491	śūnyākārā nirākārā nirvikārā nirāmayāḥ // Avg_18.57 //	śūnya ākārāḥ nirākārāḥ nirvikārāḥ nirāmayāḥ 
SA_GR14_astavgpu-492	akurvann api saṃkṣobhād vyagraḥ sarvatra mūḍhadhīḥ /	akurvan api saṃkṣobhāt vyagraḥ sarvatra mūḍha dhīḥ 
SA_GR14_astavgpu-493	kurvann api tu kṛtyāni kuśalo hi nirākulaḥ // Avg_18.58 //	kurvan api tu kṛtyāni kuśalaḥ hi nirākulaḥ 
SA_GR14_astavgpu-494	sukham āste sukhaṃ śete sukham āyāti yāti ca /	sukham āste sukham śete sukham āyāti yāti ca 
SA_GR14_astavgpu-495	sukhaṃ vakti sukhaṃ bhuṅkte vyavahāre 'pi śāntadhīḥ // Avg_18.59 //	sukham vakti sukham bhuṅkte vyavahāre śānta dhīḥ 
SA_GR14_astavgpu-496	svabhāvād yasya naivārtir lokavad vyavahāriṇaḥ /	svabhāvāt yasya nā evā ārtiḥ loka vat vyavahāriṇaḥ 
SA_GR14_astavgpu-497	mahā-hrada ivākṣobhyo gata-kleśaḥ suśobhate // Avg_18.60 //	mahā hradaḥ iva akṣobhyaḥ gata kleśaḥ su śobhate 
SA_GR14_astavgpu-498	nivṛttir api mūḍhasya pravṛttir upajāyate /	nivṛttiḥ api mūḍhasya pravṛttiḥ upajāyate 
SA_GR14_astavgpu-499	pravṛttir api dhīrasya nivṛtti-phalabhāginī // Avg_18.61 //	pravṛttiḥ api dhīrasya nivṛtti phala bhāginī 
SA_GR14_astavgpu-500	parigraheṣu vairāgyaṃ prāyo mūḍhasya dṛśyate /	parigraheṣu vairāgyam prāyas mūḍhasya dṛśyate 
SA_GR14_astavgpu-501	dehe vigalitāśasya kva rāgaḥ kva virāgatā // Avg_18.62 //	dehe vigalita āśasya kva rāgaḥ kva virāga tā 
SA_GR14_astavgpu-502	bhāvanābhāvanā-saktā dṛṣṭir mūḍhasya sarvadā /	bhāvanā a bhāvanā saktā dṛṣṭiḥ mūḍhasya sarvadā 
SA_GR14_astavgpu-503	bhāvya-bhāvanayā sā tu svasthasyādṛṣṭi-rūpiṇī // Avg_18.63 //	bhāvya bhāvanayā sā tu svasthasya adṛṣṭi rūpiṇī 
SA_GR14_astavgpu-504	sarvārambheṣu niṣkāmo yaś cared bālavan muniḥ /	sarva ārambheṣu niṣkāmaḥ yaḥ caret bāla vat muniḥ 
SA_GR14_astavgpu-505	na lepas tasya śuddhasya kriyamāṇe 'pi karmaṇi // Avg_18.64 //	na lepaḥ tasya śuddhasya kriyamāṇe pi karmaṇi 
SA_GR14_astavgpu-506	sa eva dhanya ātma-jñaḥ sarva-bhāveṣu yaḥ samaḥ /	saḥ eva dhanyaḥ ātma jñaḥ sarva bhāveṣu yaḥ samaḥ 
SA_GR14_astavgpu-507	paśyan śṛṇvan spṛśan jighrann aśnan nistarṣa-mānasaḥ // Avg_18.65 //	paśyan śṛṇvan spṛśan jighran aśnan nistarṣa mānasaḥ 
SA_GR14_astavgpu-508	kva saṃsāraḥ kva cābhāsaḥ kva sādhyaṃ kva ca sādhanam /	kva saṃsāraḥ kva ca ābhāsaḥ kva sādhyam kva ca sādhanam 
SA_GR14_astavgpu-509	ākāśasyeva dhīrasya nirvikalpasya sarvadā // Avg_18.66 //	ākāśasya iva dhīrasya nirvikalpasya sarvadā 
SA_GR14_astavgpu-510	sa jayaty artha-saṃnyāsī pūrṇa-svarasa-vigrahaḥ /	sa jayati artha saṃnyāsī pūrṇa sva rasa vigrahaḥ 
SA_GR14_astavgpu-511	akṛtrimo 'navacchinne samādhir yasya vartate // Avg_18.67 //	akṛtrimaḥ nava chinne samādhiḥ yasya vartate 
SA_GR14_astavgpu-512	bahunātra kim uktena jñāta-tattvo mahāśayaḥ /	bahunā atra kim uktena jñāta tattvaḥ mahā āśayaḥ 
SA_GR14_astavgpu-513	bhoga-mokṣa-nirākāṅkṣī sadā sarvatra nīrasaḥ // Avg_18.68 //	bhoga mokṣa nirākāṅkṣī sadā sarvatra nīrasaḥ 
SA_GR14_astavgpu-514	mahad-ādi jagad-dvaitaṃ nāma-mātra-vijṛmbhitam /	mahat ādi jagat dvaitam nāma mātra vijṛmbhitam 
SA_GR14_astavgpu-515	vihāya śuddha-bodhasya kiṃ kṛtyam avaśiṣyate // Avg_18.69 //	vihāya śuddha bodhasya kim kṛtyam avaśiṣyate 
SA_GR14_astavgpu-516	bhrama-bhūtam idaṃ sarvaṃ kiṃcin nāstīti niścayī /	bhrama bhūtam idam sarvam kiṃcid nā asti iti niścayī 
SA_GR14_astavgpu-517	alakṣya-sphuraṇaḥ śuddhaḥ svabhāvenaiva śāmyati // Avg_18.70 //	alakṣya sphuraṇaḥ śuddhaḥ svabhāvena eva śāmyati 
SA_GR14_astavgpu-518	śuddha-sphuraṇa-rūpasya dṛśya-bhāvam apaśyataḥ /	śuddha sphuraṇa rūpasya dṛśya bhāvam a paśyataḥ 
SA_GR14_astavgpu-519	kva vidhiḥ kva ca vairāgyaṃ kva tyāgaḥ kva śamo 'pi vā // Avg_18.71 //	kva vidhiḥ kva ca vairāgyam kva tyāgaḥ kva vā 
SA_GR14_astavgpu-520	sphurato 'nanta-rūpeṇa prakṛtiṃ ca na paśyataḥ /	sphurataḥ nanta rūpeṇa prakṛtim ca na paśyataḥ 
SA_GR14_astavgpu-521	kva bandhaḥ kva ca vā mokṣaḥ kva harṣaḥ kva viṣāditā // Avg_18.72 //	kva bandhaḥ kva ca vā mokṣaḥ kva harṣaḥ kva viṣādi tā 
SA_GR14_astavgpu-522	buddhi-paryanta-saṃsāre māyā-mātraṃ vivartate /	buddhi paryanta saṃsāre māyā mātram vivartate 
SA_GR14_astavgpu-523	nirmamo nirahaṅkāro niṣkāmaḥ śobhate budhaḥ // Avg_18.73 //	nirmamaḥ nirahaṅkāraḥ niṣkāmaḥ śobhate budhaḥ 
SA_GR14_astavgpu-524	akṣayaṃ gata-santāpam ātmānaṃ paśyato muneḥ /	akṣayam gata santāpam ātmānam paśyataḥ muneḥ 
SA_GR14_astavgpu-525	kva vidyā ca kva vā viśvaṃ kva deho 'haṃ mameti vā // Avg_18.74 //	kva vidyā ca kva vā viśvam kva dehaḥ ham mama iti vā 
SA_GR14_astavgpu-526	nirodhādīni karmāṇi jahāti jaḍadhīr yadi /	nirodha ādīni karmāṇi jahāti jaḍa dhīḥ yadi 
SA_GR14_astavgpu-527	mano-rathān pralāpāṃś ca kartum āpnoty atatkṣaṇāt // Avg_18.75 //	manorathān pralāpān ca kartum āpnoti a tad kṣaṇāt 
SA_GR14_astavgpu-528	mandaḥ śrutvāpi tad-vastu na jahāti vimūḍhatām /	mandaḥ śrutvā api tat vastu na jahāti vimūḍha tām 
SA_GR14_astavgpu-529	nirvikalpo bahir-yatnād antar-viṣaya-lālasaḥ // Avg_18.76 //	nirvikalpaḥ bahis yatnāt antar viṣaya lālasaḥ 
SA_GR14_astavgpu-530	jñānād galita-karmā yo loka-dṛṣṭyāpi karma-kṛt /	jñānāt galita karmā yaḥ loka dṛṣṭyā api karma kṛt 
SA_GR14_astavgpu-531	nāpnoty avasaraṃ kartuṃ vaktum eva na kiṃcana // Avg_18.77 //	na āpnoti avasaram kartum vaktum eva na kiṃcana 
SA_GR14_astavgpu-532	kva tamaḥ kva prakāśo vā hānaṃ kva ca na kiṃcana /	kva tamaḥ kva prakāśaḥ vā hānam kva ca na kiṃcana 
SA_GR14_astavgpu-533	nirvikārasya dhīrasya nirātaṅkasya sarvadā // Avg_18.78 //	nirvikārasya dhīrasya nirātaṅkasya sarvadā 
SA_GR14_astavgpu-534	kva dhairyaṃ kva vivekitvaṃ kva nirātaṅkatāpi vā /	kva dhairyam kva viveki tvam kva nirātaṅka tā api vā 
SA_GR14_astavgpu-535	anirvācya-svabhāvasya niḥsvabhāvasya yoginaḥ // Avg_18.79 //	anirvācya svabhāvasya niḥsvabhāvasya yoginaḥ 
SA_GR14_astavgpu-536	na svargo naiva narako jīvan-muktir na caiva hi /	na svargaḥ nā eva narakaḥ jīvanmuktiḥ na ca eva hi 
SA_GR14_astavgpu-537	bahunātra kim uktena yoga-dṛṣṭyā na kiṃcana // Avg_18.80 //	bahunā atra kim uktena yoga dṛṣṭyāḥ na kiṃcana 
SA_GR14_astavgpu-538	naiva prārthayate lābhaṃ nālābhenānuśocati /	na eva prārthayate lābham na alābhena anuśocati 
SA_GR14_astavgpu-539	dhīrasya śītalaṃ cittam amṛtenaiva pūritam // Avg_18.81 //	dhīrasya śītalam cittam amṛtena eva pūritam 
SA_GR14_astavgpu-540	na śāntaṃ stauti niṣkāmo na duṣṭam api nindati /	na śāntam stauti niṣkāmaḥ na duṣṭam api nindati 
SA_GR14_astavgpu-541	sama-duḥkha-sukhas tṛptaḥ kiṃcit kṛtyaṃ na paśyati // Avg_18.82 //	sama duḥkha sukhaḥ tṛptaḥ kiṃcid kṛtyam na paśyati 
SA_GR14_astavgpu-542	dhīro na dveṣṭi saṃsāram ātmānaṃ na didṛkṣati /	dhīraḥ na dveṣṭi saṃsāram ātmānam na didṛkṣati 
SA_GR14_astavgpu-543	harṣāmarṣa-vinirmukto na mṛto na ca jīvati // Avg_18.83 //	harṣa āmarṣa vinirmuktaḥ na mṛtaḥ na ca jīvati 
SA_GR14_astavgpu-544	niḥsnehaḥ putra-dārādau niṣkāmo viṣayeṣu ca /	niḥsnehaḥ putra dāra ādau niṣkāmaḥ viṣayeṣu ca 
SA_GR14_astavgpu-545	niścintaḥ svaśarīre 'pi nirāśaḥ śobhate budhaḥ // Avg_18.84 //	niścintaḥ sva śarīre pi nirāśaḥ śobhate budhaḥ 
SA_GR14_astavgpu-546	tuṣṭiḥ sarvatra dhīrasya yathā-patita-vartinaḥ /	tuṣṭiḥ sarvatra dhīrasya yathā patita vartinaḥ 
SA_GR14_astavgpu-547	svacchandaṃ carato deśān yatrāstamita-śāyinaḥ // Avg_18.85 //	svacchandam carataḥ deśān yatrāstamitaśāyinaḥ 
SA_GR14_astavgpu-548	patatūdetu vā deho nāsya cintā mahātmanaḥ /	patatu udetu vā dehaḥ na asya cintā mahātmanaḥ 
SA_GR14_astavgpu-549	svabhāva-bhūmi-viśrānti-vismṛtāśeṣa-saṃsṛteḥ // Avg_18.86 //	                    
SA_GR14_astavgpu-550	akiṃcanaḥ kāma-cāro nirdvandvaś chinna-saṃśayaḥ /	akiṃcanaḥ kāmacāraḥ nirdvandvaḥ chinna saṃśayaḥ 
SA_GR14_astavgpu-551	asaktaḥ sarva-bhāveṣu kevalo ramate budhaḥ // Avg_18.87 //	asaktaḥ sarva bhāveṣu kevalaḥ ramate budhaḥ 
SA_GR14_astavgpu-552	nirmamaḥ śobhate dhīraḥ sama-loṣṭāśma-kāñcanaḥ /	nirmamaḥ śobhate dhīraḥ sama loṣṭa aśma kāñcanaḥ 
SA_GR14_astavgpu-553	subhinna-hṛdaya-granthir vinirdhūta-rajas-tamaḥ // Avg_18.88 //	su bhinna hṛdaya granthiḥ vinirdhūta rajaḥ tamaḥ 
SA_GR14_astavgpu-554	sarvatrānavadhānasya na kiṃcid vāsanā hṛdi /	sarvatra anavadhānasya na kiṃcid vāsanāḥ hṛdi 
SA_GR14_astavgpu-555	muktātmano vitṛptasya tulanā kena jāyate // Avg_18.89 //	mukta ātmanaḥ vitṛptasya tulanā kena jāyate 
SA_GR14_astavgpu-556	jānann api na jānāti paśyann api na paśyati /	jānan api na jānāti paśyan api na paśyati 
SA_GR14_astavgpu-557	bruvann api na ca brūte ko 'nyo nirvāsanād ṛte // Avg_18.90 //	bruvan api na ca brūte kaḥ nyaḥ nirvāsanāt ṛte 
SA_GR14_astavgpu-558	bhikṣur vā bhūpatir vāpi yo niṣkāmaḥ sa śobhate /	bhikṣuḥ vā bhūpatiḥ vā api yaḥ niṣkāmaḥ sa śobhate 
SA_GR14_astavgpu-559	bhāveṣu galitā yasya śobhanāśobhanā matiḥ // Avg_18.91 //	bhāveṣu galitā yasya śobhana aśobhanā matiḥ 
SA_GR14_astavgpu-560	kva svācchandyaṃ kva saṅkocaḥ kva vā tattva-viniścayaḥ /	kva svācchandyam kva saṅkocaḥ kva vā tattva viniścayaḥ 
SA_GR14_astavgpu-561	nirvyājārjava-bhūtasya caritārthasya yoginaḥ // Avg_18.92 //	nirvyāja ārjava bhūtasya caritārthasya yoginaḥ 
