segmentnr	original	analyzed
SA_GSP31_bhgank_u-284	* sāpi dvividhā kāryākhyā karaṇākhyā ceti // GkT_1.6ab:39	sā api dvividhā kārya ākhyā karaṇa ākhyā ca iti 
SA_GSP31_bhgank_u-285	* tatra kāryākhyā daśavidhā pṛthivyaptejovāvyākāśagandharasarūpasparśaśabdalakṣaṇā	tatra kāryākhyā daśavidhā pṛthivī ap tejaḥ vāvī ākāśa gandha rasa rūpa sparśa śabda lakṣaṇā 
SA_GSP31_bhgank_u-286	karaṇākhyā tu trayodaśavidhā pañca karmendriyāṇi pañca buddhīndriyāṇy antaḥkaraṇatrayaṃ	karaṇa ākhyā tu trayodaśavidhā pañca karmendriyāṇi pañca buddhīndriyāṇi antaḥkaraṇa trayam 
SA_GSP31_bhgank_u-287	ceti // GkT_1.6ab:40	ca iti 
SA_GSP31_bhgank_u-288	* paśutvasambandhī paśuḥ // GkT_1.6ab:41	       
SA_GSP31_bhgank_u-289	* so 'pi dvividhaḥ sāñjano nirañjanaś ceti // GkT_1.6ab:42	saḥ pi dvividhaḥ sāñjanaḥ nirañjanaḥ ca iti 
SA_GSP31_bhgank_u-290	* tatra sāñjanaḥ śarīrendriyasambandhī caturdaśavidhaḥ // GkT_1.6ab:43	tatra sāñjanaḥ śarīra indriya sambandhī caturdaśavidhaḥ 
SA_GSP31_bhgank_u-291	* uktaṃ hi daivam aṣṭavidhaṃ jñeyaṃ tairyagyonaṃ ca pañcadhā /	uktam hi daivam aṣṭavidham jñeyam tairyagyonam ca pañcadhā 
SA_GSP31_bhgank_u-292	* parvam ekaṃ tu mānuṣyam etat saṃsāramaṇḍalam // GkT_1.6ab:44	parvam ekam tu mānuṣyam etat saṃsāra maṇḍalam 
SA_GSP31_bhgank_u-293	* iti nirañjanas tu trividhaḥ saṃhṛtaḥ kaivalyagato niṣṭhāyogayuktaś ceti // GkT_1.6ab:45	iti nirañjanaḥ tu trividhaḥ saṃhṛtaḥ kaivalya gataḥ niṣṭhā yoga yuktaḥ ca iti 
SA_GSP31_bhgank_u-294	* samastasṛṣṭisaṃhārānugrahakāri kāraṇaṃ tasyaikasyāpi guṇadharmabhedād vibhāga ukto 'nyatpatitvam ityādinā // GkT_1.6ab:46	                             
SA_GSP31_bhgank_u-295	* niratiśayadṛkkriyāśaktiḥ patitvaṃ tenaiśvaryeṇa nityasambandhitvaṃ sattvam anāgantukaiśvaryatvam	                       
SA_GSP31_bhgank_u-296	ādyatvaṃ samastajanmarahitatvam ajātatvaṃ mahāsṛṣṭisaṃhārakartṛtvaṃ bhavodbhavatvaṃ	                                                                                     
SA_GSP31_bhgank_u-297	paramotkṛṣṭaṃ guṇadharmanimittanāmābhidheyatvaṃ vāmatvaṃ duḥkhāntanimittadharmotpādakanāmābhidheyatvaṃ	                                                          
SA_GSP31_bhgank_u-298	vā svecchayaivāśeṣakāryotpattyādikāraṇasvabhāvaḥ krīḍā taddharmitvaṃ devatvaṃ siddhasādhakapaśubhyaḥ	vā sva icchayā eva aśeṣa kārya utpatti ādi kāraṇa svabhāvaḥ krīḍā tad dharmi tvam deva tvam siddha sādhaka paśubhyaḥ 
SA_GSP31_bhgank_u-299	paratvaṃ jyeṣṭhatvaṃ sargādāv api rutabhayasaṃyojakatvaṃ rudratvam karmādinirapekṣasya	                                                           
SA_GSP31_bhgank_u-300	svecchayaivāśeṣakāryakartṛtvaṃ kāmitvaṃ śamasukhanirvāṇakaratvaṃ śaṃkaratvam antarasṛṣṭyām	sva icchayā eva aśeṣa kārya kartṛ tvam kāmi tvam śama sukha nirvāṇa kara tvam śaṃkara tvam antara sṛṣṭyām 
SA_GSP31_bhgank_u-301	api saṃhārakartṛtvaṃ kālatvaṃ kāryakāraṇākhyānāṃ kalānāṃ sthānaśarīrādibhāvena saṃyojakatvaṃ	api saṃhāra kartṛ tvam kāla tvam kārya kāraṇa ākhyānām kalānām sthāna śarīra ādi bhāvena saṃyojaka tvam 
SA_GSP31_bhgank_u-302	kalavikaraṇatvaṃ dharmādibalānāṃ yatheṣṭaṃ vṛttilābhalopākṣepakartṛtvaṃ balapramathanatvaṃ	                                     
SA_GSP31_bhgank_u-303	sarvadevamānuṣatiraścāṃ ratirañjanādhivāsanākartṛtvaṃ sarvabhūtadamanatvaṃ sakalaniṣkalāvasthāyās	sarva deva mānuṣa tiraścām rati rañjana adhivāsana kartṛ tvam sarva bhūta damana tvam sakala niṣkala avasthāyāḥ 
SA_GSP31_bhgank_u-304	tulyaśaktitvaṃ manomanastvaṃ sukhakarānantaśarīrādhiṣṭātṛtvam aghoratvaṃ duḥkhakarānantaśarīrādhiṣṭātṛtvaṃ	tulya śakti tvam manaḥ manaḥ tvam sukha kara ananta śarīra adhiṣṭātṛ tvam aghora tvam duḥkha kara ananta śarīra adhiṣṭātṛ tvam 
SA_GSP31_bhgank_u-305	ghorataratvaṃ sarvavidyādikāryāṇāṃ vyāptādhiṣṭhātṛtvaṃ pūraṇaṃ yathepsitānantaśarīrādikaraṇaśaktiḥ	ghoratara tvam sarva vidyā ādi kāryāṇām vyāpta adhiṣṭhātṛ tvam pūraṇam yathā īpsita ananta śarīra ādi karaṇa śaktiḥ 
SA_GSP31_bhgank_u-306	pauruṣyam // GkT_1.6ab:47	pauruṣyam 
SA_GSP31_bhgank_u-307	* tad ubhayaṃ bhagavataḥ puruṣatvam ucyate // GkT_1.6ab:48	tat ubhayam bhagavataḥ puruṣa tvam ucyate 
SA_GSP31_bhgank_u-308	* sarvapaśvādibhyo 'bhyadhikotkṛṣṭavyatiriktatvaṃ mahattvaṃ devatvaṃ pūrvoktam // GkT_1.6ab:49	                
SA_GSP31_bhgank_u-309	* duḥkhāntanimittaṃ dhyānaikaviṣayatvam oṃkāratvam // GkT_1.6ab:50	          
SA_GSP31_bhgank_u-310	* ṛṣitvaṃ kriyāśaktir jñānaśaktis tu vipratvam // GkT_1.6ab:51	         
SA_GSP31_bhgank_u-311	* anayor āśrayavyāpitvānantaviṣayatvaniratiśayatvajñāpanārthaṃ tadāśrayo bhagavān mahān ity uktaḥ // GkT_1.6ab:52	                                 
SA_GSP31_bhgank_u-312	* sarvadā sarvatrāvicalitasvabhāvena vartamāno bhagavān eṣa ity ucyate // GkT_1.6ab:53	sarvadā sarvatra avicalita svabhāvena vartamānaḥ bhagavān eṣaḥ iti ucyate 
SA_GSP31_bhgank_u-313	* guṇadharmadvāreṇa vācaḥ pravartante yasmād atas tadvyatiriktas tadaviśeṣitaś ca bhagavān viśuddha ity ucyate // GkT_1.6ab:54	guṇa dharma dvāreṇa vācaḥ pravartante yasmāt atas tad vyatiriktaḥ tad aviśeṣitaḥ ca bhagavān viśuddhaḥ iti ucyate 
SA_GSP31_bhgank_u-314	* nityānāgantukaiśvaryayukte paramakāraṇe /	                             
SA_GSP31_bhgank_u-315	* yatra vāco nivartante vāgviśuddhaḥ sa kīrtitaḥ // GkT_1.6ab:55	yatra vācaḥ nivartante vāc viśuddhaḥ sa kīrtitaḥ 
SA_GSP31_bhgank_u-316	* kṣaṇaikam api yas tatra prāpnoty ekāgratāṃ yatiḥ /	           
SA_GSP31_bhgank_u-317	* sa dagdhvā sarvakarmāṇi śivasāyujyam āpnuyāt // GkT_1.6ab:56	sa dagdhvā sarva karmāṇi śiva sāyujyam āpnuyāt 
SA_GSP31_bhgank_u-318	* sarvaiśvaryapradātṛtvaṃ maheśvaratvaṃ samastakāryaviṣayaṃ prabhutvam īśatvaṃ sarvavidyāviṣayaṃ prabhutvam īśānatvaṃ sarvabhūtaviṣayaṃ prabhutvam  #	sarva aiśvarya pradātṛ tvam maheśvara tvam samasta kārya viṣayam prabhu tvam īśa tvam sarva vidyā viṣayam prabhu tvam īśāna tvam sarva bhūta viṣayam prabhu tvam 
SA_GSP31_bhgank_u-319	īśvaratvam // GkT_1.6ab:57	īśvara tvam 
SA_GSP31_bhgank_u-320	* prakramāpekṣaḥ khalv evam īśādiśabdānām arthaḥ pradarśito 'nyathā punar ekārthatvam eveti // GkT_1.6ab:58	prakrama apekṣaḥ khalu evam īśa ādi śabdānām arthaḥ pradarśitaḥ nyathā punar eka artha tvam eva iti 
SA_GSP31_bhgank_u-321	* brahmagrahaṇasyodāharaṇārthatvād aśeṣapativiṣayaprabhutvam adhipatitvaṃ bṛṃhaṇabṛhattvaṃ brahmatvaṃ paripūrṇaparitṛptatvaṃ śivatvam iti //	brahma grahaṇasya udāharaṇa artha tvāt aśeṣa pati viṣaya prabhu tvam adhipati tvam bṛṃhaṇa bṛhat tvam brahmatvam paripūrṇa paritṛpta tvam śiva tvam iti 
SA_GSP31_bhgank_u-322	* evaṃ suniścitāḥ khalv ime guṇadharmāḥ parameśvarasyopahārakāle gāyatā bhāvayitavyāḥ	evam su niścitāḥ khalu ime guṇa dharmāḥ parameśvarasya upahāra kāle gāyatā bhāvayitavyāḥ 
SA_GSP31_bhgank_u-323	satataṃ vā japaṃ ca kurvatā vibhaktyupasarganipātakriyāpadānām arthaiḥ saha cintanīyās	satatam vā japam ca kurvatā vibhakti upasarga nipāta kriyā padānām arthaiḥ saha cintanīyāḥ 
SA_GSP31_bhgank_u-324	tato 'cireṇaiva kālena śuddhivṛddhī bhavataḥ // GkT_1.6ab:60	cireṇa eva kālena śuddhi vṛddhī bhavataḥ 
SA_GSP31_bhgank_u-325	* te ca svātmasaṃvedye iti // GkT_1.6ab:61	te ca sva ātma saṃvedye iti 
SA_GSP31_bhgank_u-326	* dharmārthaḥ sādhakavyāpāro vidhiḥ // GkT_1.6ab:62	         
SA_GSP31_bhgank_u-327	* sa dvividhaḥ pradhānabhūto guṇabhūtaś ceti // GkT_1.6ab:63	sa dvividhaḥ pradhāna bhūtaḥ guṇa bhūtaḥ ca iti 
SA_GSP31_bhgank_u-328	* tatrāvyavadhānena dharmahetur yo vidhiḥ sa pradhānabhūtaś caryeti vakṣyate // GkT_1.6ab:64	tatra avyavadhānena dharma hetuḥ yaḥ vidhiḥ sa pradhāna bhūtaḥ caryā iti vakṣyate 
SA_GSP31_bhgank_u-329	* yas tu caryānugrāhakaḥ sa guṇabhūto 'nusnānādiḥ // GkT_1.6ab:65	yaḥ tu caryā anugrāhakaḥ sa guṇa bhūtaḥ nusnāna ādiḥ 
SA_GSP31_bhgank_u-330	* tatra bhuktocchiṣṭādinimittāyogyatāpratyayanivṛttyarthaṃ liṅgābhivyaktyarthaṃ ca yat snānaṃ yat kaluṣanivṛttyarthaṃ tad upasparśanam // GkT_1.6ab:66	tatra bhukta ucchiṣṭa ādi nimitta ayogya tā pratyaya nivṛtti artham liṅga abhivyakti artham ca yat snānam yat kaluṣa nivṛtti artham tat upasparśanam 
SA_GSP31_bhgank_u-331	* etad ubhayam apy ajapataiveśvaraniyogam anusaṃdhāya saṃsāradoṣaṃ bhāvayatā gurulaghubhāvaṃ ca paryālocya bhasmanaiva kartavyam // GkT_1.6ab:67	etat ubhayam api ajapatā eva īśvara niyogam anusaṃdhāya saṃsāra doṣam bhāvayatā guru laghu bhāvam ca paryālocya bhasmanā eva kartavyam 
SA_GSP31_bhgank_u-332	* nirmālyadhāraṇam api liṅgābhivyaktibhaktivṛddhidvāreṇa caryānugrāhakam // GkT_1.6ab:68	nirmālya dhāraṇam api liṅga abhivyakti bhakti vṛddhi dvāreṇa caryā anugrāhakam 
SA_GSP31_bhgank_u-333	* vicārya kāraṇanirmālyaṃ niṣparigrahaṃ paraṃ kṛtaṃ gṛhītvā saṃyatātmanā kāraṇaṃ	vicārya kāraṇa nirmālyam niṣparigraham param kṛtam gṛhītvā saṃyata ātmanā kāraṇam 
SA_GSP31_bhgank_u-334	praṇamyānujñāṃ prārthayet tataḥ prasannamukhaṃ bhagavantaṃ svanirmālyaṃ nirmalīkaraṇāya	praṇamya anujñām prārthayet tatas prasanna mukham bhagavantam sva nirmālyam nirmalīkaraṇāya 
SA_GSP31_bhgank_u-335	prayacchantaṃ dhyātvā mahāprasāda ity abhisaṃdhāya bhaktyaiva śirasi dhārayet // GkT_1.6ab:69	prayacchantam dhyātvā mahāprasādaḥ iti abhisaṃdhāya bhaktyā eva śirasi dhārayet 
SA_GSP31_bhgank_u-336	* tathāyatanavāsitvam api caryānugrāhakam // GkT_1.6ab:70	         
SA_GSP31_bhgank_u-337	* tathā coktam /	tathā ca uktam 
SA_GSP31_bhgank_u-338	* dharmakṣetraṃ paraṃ hy etac chivāyatanaṃ bhuvi /	dharmakṣetram param hi etat śivāyatanam bhuvi 
SA_GSP31_bhgank_u-339	* vidhibījasya sā bhūmis tatra vaptam mahāphalam // GkT_1.6ab:71	vidhi bījasya sā bhūmiḥ tatra vaptam mahā phalam 
SA_GSP31_bhgank_u-340	* liṅgāddhastaśataṃ sāgraṃ śivakṣetraṃ samantataḥ /	             
SA_GSP31_bhgank_u-341	* jantūnāṃ tatra pañcatvaṃ śivasāyujyakāraṇam // GkT_1.6ab:72	jantūnām tatra pañcatvam śiva sāyujya kāraṇam 
SA_GSP31_bhgank_u-342	* grāme vā yadi vetyādi // GkT_1.6ab:73	grāme vā yadi vā ityādi 
SA_GSP31_bhgank_u-343	* upasparśanenākṣapitakaluṣakṣāpaṇārthaṃ prāṇāyāmaḥ // GkT_1.6ab:74	            
SA_GSP31_bhgank_u-344	* koṣṭhasya vāyor gatinirodhaḥ prāṇāyāmaḥ // GkT_1.6ab:75	         
SA_GSP31_bhgank_u-345	* tatropaspṛśya kāraṇatīrthakaragurūn anupraṇamya prāṅmukha udaṅmukho vā padmakasvastikādīnām	tatra upaspṛśya kāraṇa tīrthakara gurūn anupraṇamya prāc mukhaḥ udak mukhaḥ vā padmaka svastika ādīnām 
SA_GSP31_bhgank_u-346	anyatamaṃ yathāsukham āsanaṃ baddhvā kṛtam unnataṃ ca kṛtvā śanaiḥ saṃyatāntaḥkaraṇena	anyatamam yathāsukham āsanam baddhvā kṛtam unnatam ca kṛtvā śanais saṃyata antaḥkaraṇena 
SA_GSP31_bhgank_u-347	recakādīn kuryāt // GkT_1.6ab:76	recaka ādīn kuryāt 
SA_GSP31_bhgank_u-348	* kaluṣābhāve 'pi cittasyātinirmalatvāpādanārtham abhyāsārthaṃ nityaṃ kuryāt // GkT_1.6ab:77	kaluṣa abhāve pi cittasya ati nirmala tva āpādana artham abhyāsa artham nityam kuryāt 
SA_GSP31_bhgank_u-349	* uktaṃ hi /	uktam hi 
SA_GSP31_bhgank_u-350	* prāṇāyāmair dahed doṣān dhāraṇābhiś ca kilbiṣam /	  dahet          
SA_GSP31_bhgank_u-351	* pratyāhāreṇa viṣayān dhyānenānīśvarān guṇān // GkT_1.6ab:78	pratyāhāreṇa viṣayān dhyānena anīśvarān guṇān 
SA_GSP31_bhgank_u-352	* prāṇāyāmena yuktasya viprasya niyatātmanaḥ /	prāṇāyāmena yuktasya viprasya niyata ātmanaḥ 
SA_GSP31_bhgank_u-353	* sarve doṣāḥ praṇaśyanti sattvasthaś caiva jāyate // GkT_1.6ab:79	sarve doṣāḥ praṇaśyanti sattvasthaḥ ca eva jāyate 
SA_GSP31_bhgank_u-354	* jalabindukuśāgreṇa māse māse ca yaḥ pibet /	jala bindu kuśa agreṇa māse māse ca yaḥ pibet 
SA_GSP31_bhgank_u-355	* saṃvatsaraśataṃ sāgraṃ prāṇāyāmaikatatsamam // GkT_1.6ab:80	            
SA_GSP31_bhgank_u-356	* prāṇāyāmaviśuddhātmā yasmāt paśyati tatparam /	prāṇāyāma viśuddha ātmā yasmāt paśyati tat param 
SA_GSP31_bhgank_u-357	* tasmāt kiṃcit paraṃ nāsti prāṇāyāmād iti śrutiḥ // GkT_1.6ab:81	tasmāt kiṃcid param na asti prāṇāyāmāt iti śrutiḥ 
SA_GSP31_bhgank_u-358	* tadakṣapitakaluṣakṣapaṇārthaṃ japaḥ kartavyaḥ // GkT_1.6ab:82	              
SA_GSP31_bhgank_u-359	* tṛtīyacaturthayor anyatarasmin brahmaṇi prayatnaniruddhaṃ cittaṃ sampūrṇākṣarānubodhena tadarthānubodhena vā punaḥ punaḥ saṃcārayed iti //	tṛtīya caturthayoḥ anyatarasmin brahmaṇi prayatna niruddham cittam sampūrṇa akṣara anubodhena tad artha anubodhena vā punar punar saṃcārayet iti 
SA_GSP31_bhgank_u-360	* evaṃ ca prāyaścittāntaram utsūtratvān na kartavyam iti // GkT_1.6ab:84	evam ca prāyaścitta antaram utsūtra tvāt na kartavyam iti 
SA_GSP31_bhgank_u-361	* nanu ca trikasya kaluṣanivṛttyartham evābhidhānaṃ vyabhicārāntareṣu punaḥ kiṃ prāyaścittam // GkT_1.6ab:85	nanu ca trikasya kaluṣa nivṛtti artham eva abhidhānam vyabhicāra antareṣu punar kim prāyaścittam 
SA_GSP31_bhgank_u-362	* na caitad vācyaṃ yater apramattasya sarvadaiva saṃyatatvād asambhavī vyabhicāra iti kāmādivyabhicāreṇa samānatvāt trikasyāpy anārambhaprasaṅgo  #	na ca etat vācyam yateḥ apramattasya sarvadā eva saṃyata tvāt asambhavī vyabhicāraḥ iti kāma ādi vyabhicāreṇa samāna tvāt trikasya api anārambha prasaṅgaḥ 
SA_GSP31_bhgank_u-363	vā // GkT_1.6ab:86	vā 
SA_GSP31_bhgank_u-364	* kiṃ cādharmasāmarthyād viduṣo 'pi vyabhicārasambhavāt // GkT_1.6ab:87	kim ca adharma sāmarthyāt vyabhicāra sambhavāt 
SA_GSP31_bhgank_u-365	* uktaṃ ca hriyate budhyamāno 'pi ityādi // GkT_1.6ab:88	uktam ca hriyate budhyamānaḥ pi ityādi 
SA_GSP31_bhgank_u-366	* hiṃsāyāś cāvaśyaṃbhāvitvāt // GkT_1.6ab:89	hiṃsāyāḥ ca avaśyaṃbhāvi tvāt 
SA_GSP31_bhgank_u-367	* uktaṃ hi /	uktam hi 
SA_GSP31_bhgank_u-368	* ahṇā rātryā ca yāñ jantūn nihanty ajñānato yatiḥ /	rātryā ca yām jantūn nihanti ajñānataḥ yatiḥ 
SA_GSP31_bhgank_u-369	* teṣāṃ snātvā viśuddhyarthaṃ prāṇāyāmān ṣaḍ ācaret // GkT_1.6ab:90	teṣām snātvā viśuddhi artham prāṇāyāmān ṣaṭ ācaret 
SA_GSP31_bhgank_u-370	* pratidinam ity arthaḥ // GkT_1.6ab:91	pratidinam iti arthaḥ 
SA_GSP31_bhgank_u-371	* atraike sarvavyabhicāreṣu trikam eva kartavyam iti manyante // GkT_1.6ab:92	atra eke sarva vyabhicāreṣu trikam eva kartavyam iti manyante 
SA_GSP31_bhgank_u-372	* vayaṃ tu paśyāmaḥ kaluṣanivṛttyartham eva trikaṃ kartavyam // GkT_1.6ab:93	vayam tu paśyāmaḥ kaluṣa nivṛtti artham eva trikam kartavyam 
SA_GSP31_bhgank_u-373	* bhāṣyasyāpi tathaiva śrutatvān nādṛṣṭārtham adṛṣṭaśuddheś cāniścayāt trikānuparamaprasaṅgaḥ	bhāṣyasya api tathā eva śruta tvāt na adṛṣṭa artham adṛṣṭa śuddheḥ ca aniścayāt trika anuparama prasaṅgaḥ 
SA_GSP31_bhgank_u-374	syāt tasmāt kaluṣanivṛttau pūrvakṛtādharmakṣapaṇavad vyabhicārakṛtādharmakṣapaṇārtham	syāt tasmāt kaluṣa nivṛttau pūrva kṛta adharma kṣapaṇa vat vyabhicāra kṛta adharma kṣapaṇa artham 
SA_GSP31_bhgank_u-375	api vidhyācaraṇam eva kartavyam // GkT_1.6ab:94	api vidhi ācaraṇam eva kartavyam 
SA_GSP31_bhgank_u-376	* tathā ca sūtraṃ bhūyas tapaś caret iti // GkT_1.6ab:95	tathā ca sūtram bhūyas tapaḥ caret iti 
SA_GSP31_bhgank_u-377	* manur apy āha /	manuḥ api āha 
SA_GSP31_bhgank_u-378	* yat kiṃcid enaḥ kurvanti vāṅmanomūrtibhir janāḥ /	yat kiṃcid enaḥ kurvanti vāc manaḥ mūrtibhiḥ janāḥ 
SA_GSP31_bhgank_u-379	* tat sarvaṃ nirṇudanty āśu tapasaiva tapodhanāḥ // GkT_1.6ab:96	tat sarvam nirṇudanti āśu tapasā eva tapodhanāḥ 
SA_GSP31_bhgank_u-380	* mahāpātakinaś caiva śeṣāś cākāryakāriṇaḥ /	mahāpātakinaḥ ca eva śeṣāḥ ca akārya kāriṇaḥ 
SA_GSP31_bhgank_u-381	* tapasaiva sutaptena mucyante kilbiṣāt tataḥ // GkT_1.6ab:97	tapasā eva su taptena mucyante kilbiṣāt tatas 
SA_GSP31_bhgank_u-382	* tathā śrīmadbhāṣyakṛtāpi jñāpakam uktam /	tathā śrīmat bhāṣyakṛtā api jñāpakam uktam 
SA_GSP31_bhgank_u-383	* tapobhir āryā nirṇudanti pāpaṃ dhyānopayogāt kṣapayanti puṇyam /	tapobhiḥ āryāḥ nirṇudanti pāpam dhyāna upayogāt kṣapayanti puṇyam 
SA_GSP31_bhgank_u-384	* te nirmalās tattvavido viśuddhā gacchanti mokṣaṃ hy ubhayor abhāvāt // GkT_1.6ab:98	te nirmalāḥ tattva vidaḥ viśuddhāḥ gacchanti mokṣam hi ubhayoḥ abhāvāt 
SA_GSP31_bhgank_u-385	* na cāyaṃ niyamaḥ puṇyakṣaya eva dhyānāt kiṃtu pāpakṣayo 'pi // GkT_1.6ab:99	na ca ayam niyamaḥ puṇya kṣayaḥ eva dhyānāt kiṃtu pāpa kṣayaḥ 
SA_GSP31_bhgank_u-386	* yataḥ tatraiva jñāpakāntaram uktam // GkT_1.6ab:100	yatas tatra eva jñāpaka antaram uktam 
SA_GSP31_bhgank_u-387	* sarvaṃ dahati dhyānena puṇyapāpakriyāśrayam /	sarvam dahati dhyānena puṇya pāpa kriyā āśrayam 
SA_GSP31_bhgank_u-388	* puṇyapāpaphale dagdhe svāmī tasya na vidyate // GkT_1.6ab:101	puṇya pāpa phale dagdhe svāmī tasya na vidyate 
SA_GSP31_bhgank_u-389	* iti // GkT_1.6ab:102	iti 
SA_GSP31_bhgank_u-390	* evaṃ tarhy anarthakaṃ vidhyanuṣṭhānam iti cen nānena vidhinā rudrasamīpaṃ gatveti pravacanād vidhyanuṣṭhānavikalasya yogānuṣṭhānasāmarthyābhāvāt	evam tarhi anarthakam vidhi anuṣṭhānam iti ced na anena vidhinā rudra samīpam gatvā iti pravacanāt vidhi anuṣṭhāna vikalasya yoga anuṣṭhāna sāmarthya abhāvāt 
SA_GSP31_bhgank_u-391	* tathā cānyatrāpy uktam /	tathā ca anyatra api uktam 
SA_GSP31_bhgank_u-392	* dharmaḥ prayatnataḥ kāryo yoginā tu viśeṣataḥ /	dharmaḥ prayatnataḥ kāryaḥ yoginā tu viśeṣataḥ 
SA_GSP31_bhgank_u-393	* nāsti dharmād ṛte yoga iti yogavido viduḥ iti // GkT_1.6ab:104	na asti dharmāt ṛte yogaḥ iti yoga vidaḥ viduḥ iti 
SA_GSP31_bhgank_u-394	* tasmād upasparśanādibhiḥ prasannaṃ cittaṃ kṛtvā sarvasyādharmasya kṣapaṇārthaṃ vidhiyogānuṣṭhānam evātyantādyabhiyogena kartavyaṃ na prāyaścittāntaram  #	tasmāt upasparśana ādibhiḥ prasannam cittam kṛtvā sarvasya adharmasya kṣapaṇa artham vidhi yoga anuṣṭhānam eva atyanta ādi abhiyogena kartavyam na prāyaścitta antaram 
SA_GSP31_bhgank_u-395	iti // GkT_1.6ab:105	iti 
SA_GSP31_bhgank_u-396	* tathā daśāhiṃsādayo yamāś caryānugrāhakā yadā tadā vidhyantarbhūtā yadā tu yogakriyānugrāhakās tadā yogāntarbhūtā iti // GkT_1.6ab:106	tathā daśa ahiṃsā ādayaḥ yamāḥ caryā anugrāhakāḥ yadā tadā vidhi antarbhūtāḥ yadā tu yoga kriyā anugrāhakāḥ tadā yoga antarbhūtāḥ iti 
SA_GSP31_bhgank_u-397	* tatra vākkāyamanobhiḥ paraduḥkhānutpādanam ahiṃsā indriyasaṃyamo brahmacaryaṃ dharmasādhanānaṅgavacanapratiṣedhaḥ	tatra vāc kāya manobhiḥ para duḥkha anutpādanam ahiṃsā indriya saṃyamaḥ brahmacaryam dharma sādhana anaṅga vacana pratiṣedhaḥ 
SA_GSP31_bhgank_u-398	satyaṃ varṇāśramibhiḥ saha dṛṣṭārthasaṃgatipratiṣedho 'saṃvyavahāraḥ dharmasādhanāṅgād	satyam varṇa āśramibhiḥ saha dṛṣṭa artha saṃgati pratiṣedhaḥ saṃvyavahāraḥ dharma sādhana aṅgāt 
SA_GSP31_bhgank_u-399	abhyadhikasya nyāyato 'py asvīkaraṇam anyāyatas tu dharmasādhanāṅgasyāpy asvīkaraṇaṃ	abhyadhikasya anyāyataḥ api asvīkaraṇam anyāyataḥ tu dharma sādhana aṅgasya api asvīkaraṇam 
SA_GSP31_bhgank_u-400	cāsteyaṃ parair apakṛtasyāpy amlānacittatvam akrodhaḥ vākkāyamanobhir gurau hitabhāvenaiva	ca asteyam paraiḥ apakṛtasya api amlāna citta tvam akrodhaḥ vāc kāya manobhiḥ gurau hita bhāvena eva 
SA_GSP31_bhgank_u-401	vartanaṃ guruśuśrūṣā kāyāntaḥkaraṇātmaśuddhiḥ śaucaṃ svavṛttyaivopārjitānnasya vidhiyogānuṣṭhānāvirodhenābhyavaharaṇam	vartanam guru śuśrūṣā kāya antaḥkaraṇa ātma śuddhiḥ śaucam sva vṛttyā eva upārjita annasya vidhi yoga anuṣṭhāna avirodhena abhyavaharaṇam 
SA_GSP31_bhgank_u-402	āhāralāghavam // GkT_1.6ab:107	āhāra lāghavam 
SA_GSP31_bhgank_u-403	* aṣṭau grāsā muner iti kecit tan neṣṭaṃ vidhiyogānuṣṭhānavirodhaprasaṅgāt // GkT_1.6ab:108	aṣṭau grāsāḥ muneḥ iti kecid tat na iṣṭam vidhi yoga anuṣṭhāna virodha prasaṅgāt 
SA_GSP31_bhgank_u-404	* savyañjanāśanodakābhyāṃ koṣṭhasya bhāgatrayaṃ pūrayitvā caturthaṃ bhāgaṃ vāyoḥ saṃcaraṇārtham avaśeṣayed ity anye // GkT_1.6ab:109	sa vyañjana aśana udakābhyām koṣṭhasya bhāga trayam pūrayitvā caturtham bhāgam vāyoḥ saṃcaraṇa artham avaśeṣayet iti anye 
SA_GSP31_bhgank_u-405	* tad iṣṭam evāvirodhāt // GkT_1.6ab:110	tat iṣṭam eva avirodhāt 
SA_GSP31_bhgank_u-406	* atra ca pañcavidhabhaikṣābhidhāyakaṃ vākyaṃ caren mādhukarīm ityādy avirodhena vyākhyeyam // GkT_1.6ab:111	atra ca pañcavidha bhaikṣa abhidhāyakam vākyam caret mādhukarīm ityādi avirodhena vyākhyeyam 
SA_GSP31_bhgank_u-407	* yathāvihitavidhiyogānuṣṭhāne satatam evodyamo 'pramādaḥ // GkT_1.6ab:112	yathā vihita vidhi yoga anuṣṭhāne satatam pramādaḥ 
SA_GSP31_bhgank_u-408	* ayaṃ ca pradhānabhūto yamaḥ // GkT_1.6ab:113	ayam ca pradhāna bhūtaḥ yamaḥ 
SA_GSP31_bhgank_u-409	* tathā coktam /	tathā ca uktam 
SA_GSP31_bhgank_u-410	* yatidharmasya sadbhāvaḥ śrūyatāṃ guṇadoṣataḥ /	yati dharmasya sadbhāvaḥ śrūyatām guṇa doṣataḥ 
SA_GSP31_bhgank_u-411	* apramādāt parā siddhiḥ pramādān narakaṃ dhruvam // GkT_1.6ab:114	apramādāt parā siddhiḥ pramādāt narakam dhruvam 
SA_GSP31_bhgank_u-412	* iti /	iti 
SA_GSP31_bhgank_u-413	* vāso 'pi jñānotpādanadvāreṇa caryānugrāhakatvād guṇavidhir eveti // GkT_1.6ab:115	              
SA_GSP31_bhgank_u-414	* cittadvāreṇeśvarasambandhaḥ puruṣasya yogaḥ // GkT_1.6ab:116	          
SA_GSP31_bhgank_u-415	* sa dvividhaḥ kriyālakṣaṇaḥ kriyoparamalakṣaṇaś ceti // GkT_1.6ab:117	sa dvividhaḥ kriyā lakṣaṇaḥ kriyā uparama lakṣaṇaḥ ca iti 
SA_GSP31_bhgank_u-416	* tatra kriyālakṣaṇo japayantraṇadhāraṇadhyānasmaraṇātmaka iti // GkT_1.6ab:118	tatra kriyā lakṣaṇaḥ japa yantraṇa dhāraṇa dhyāna smaraṇa ātmakaḥ iti 
SA_GSP31_bhgank_u-417	* vakṣyāmaḥ // GkT_1.6ab:119	vakṣyāmaḥ 
SA_GSP31_bhgank_u-418	* kriyoparamalakṣaṇo 'py atigatyādiśabdavācya iti // GkT_1.6ab:120	kriyā uparama lakṣaṇaḥ api atigatya ādi śabda vācyaḥ iti 
SA_GSP31_bhgank_u-419	* śāstrāntaroktapadārthebhyo 'mīṣām atiśayābhidhānaṃ viśeṣaḥ // GkT_1.6ab:121	            
SA_GSP31_bhgank_u-420	* tathāhi śāstrāntare duḥkhanivṛttir eva duḥkhāntaḥ iha tu paramaiśvaryaprāptiś ca // GkT_1.6ab:122	tathā hi śāstra antare duḥkha nivṛttiḥ eva duḥkhāntaḥ iha tu parama aiśvarya prāptiḥ ca 
SA_GSP31_bhgank_u-421	* tathānyatrābhūtvā bhāvi kāryam iha tu nityaṃ paśvādi // GkT_1.6ab:123	tathā anyatra a bhūtvā bhāvi kāryam iha tu nityam paśu ādi 
SA_GSP31_bhgank_u-422	* tathānyatrāsvatantraṃ pradhānādi kāraṇam iha tu svatantro bhagavān eva // GkT_1.6ab:124	tathā anyatra asvatantram pradhāna ādi kāraṇam iha tu svatantraḥ bhagavān eva 
SA_GSP31_bhgank_u-423	* tathānyatra kaivalyābhyudayaphalo yogaḥ iha tu paramaduḥkhāntaphalaḥ // GkT_1.6ab:125	tathā anyatra kaivalya abhyudaya phalaḥ yogaḥ iha tu parama duḥkhānta phalaḥ 
SA_GSP31_bhgank_u-424	* tathānyatrāvartakaḥ svargādiphalo vidhir iha tv anāvartako rudrasamīpādiphala iti // GkT_1.6ab:126	tathā anyatra āvartakaḥ svarga ādi phalaḥ vidhiḥ iha tu anāvartakaḥ rudra samīpa ādi phalaḥ iti 
SA_GSP31_bhgank_u-425	* padārthānāṃ samāptisaṃhāras tatra duḥkhakāryakāraṇavidhīnām iti śabdena samāptir uktā // GkT_1.6ab:127	                      
SA_GSP31_bhgank_u-426	* yogasya tu tvāśabdeneti // GkT_1.6ab:128	yogasya tu tvāśabdena iti 
SA_GSP31_bhgank_u-427	* samāptānāṃ niḥśeṣīkaraṇārthaṃ prāsaṅgikasaṃśayanivṛttyarthaṃ ca dharmāntarābhidhānaṃ nigamanam // GkT_1.6ab:129	samāptānām niḥśeṣīkaraṇa artham prāsaṅgika saṃśaya nivṛtti artham ca dharma antara abhidhānam nigamanam 
SA_GSP31_bhgank_u-428	* pratijñātārthena sahaikavākyatvakhyāpanārtham ity anye // GkT_1.6ab:130	               
