segmentnr	original	analyzed
SA_GSP28_prakp01u-329	śāstramukhaṃ nāma gurorāviṣkartuṃ gabhīramapi bhāvam /	śāstra mukham nāma guroḥ āviṣkartum gabhīram api bhāvam 
SA_GSP28_prakp01u-330	śālikanāthena kṛtaṃ prakaraṇametatprasannataram // 2 //	śālikanāthena kṛtam prakaraṇam etat prasannataram 
SA_GSP28_prakp01u-331	iti mahāmahopādhyāya śrīśālikanāthamiśrapraṇītāyāṃ	iti mahā mahā upādhyāya śrī śālikanāthamiśra praṇītāyām 
SA_GSP28_prakp01u-332	prakaraṇapañcikāyāṃ śāstramukhaṃ nāma prathamaṃ	prakaraṇa pañcikāyām śāstramukham nāma prathamam 
SA_GSP28_prakp01u-333	prakaraṇaṃ samāptam //	prakaraṇam samāptam 
