segmentnr	original	analyzed
SA_GSP28_prakp01u-0	________________________________________ oṃ	om 
SA_GSP28_prakp01u-1	śrīmatprabhākaragurutantradhurandhareṇa	śrīmat prabhākara guru tantra dhurandhareṇa 
SA_GSP28_prakp01u-2	mahāmahopādhyāya-śālikanāthamiśreṇa praṇītā prakaraṇapañcikā	mahā mahā upādhyāya śālikanāthamiśreṇa praṇītā prakaraṇa pañcikā 
SA_GSP28_prakp01u-3	nyāyasiddhyākhyayā vyākhyayā viṣamasthalaṭipparāyā	nyāyasiddhi ākhyayā vyākhyayā viṣama sthala ṭipparāyā 
SA_GSP28_prakp01u-4	ca samalaṅkṛtā	ca samalaṅkṛtā 
SA_GSP28_prakp01u-5	śāstramukhaṃ nāma	śāstra mukham nāma 
SA_GSP28_prakp01u-6	prathamaṃ prakaraṇam	prathamam prakaraṇam 
SA_GSP28_prakp01u-7	prakaraṇārthapratijñā	prakaraṇa artha pratijñā 
SA_GSP28_prakp01u-8	svādhyāyavidhivākyārthavicāre prayatāmahe /	svādhyāya vidhi vākya artha vicāre prayatāmahe 
SA_GSP28_prakp01u-9	prabhākaragurordṛṣṭyā mīmāṃsārambhasiddhaye // 1 //	prabhākara guroḥ dṛṣṭyā mīmāṃsā ārambha siddhaye 
SA_GSP28_prakp01u-10	bhāṭṭamatena mīmāṃsāśāstrānārambhapūrvapakṣaḥ atra kecidācakṣate---	bhāṭṭa matena mīmāṃsā śāstra anārambha pūrvapakṣaḥ atra kecid ācakṣate 
SA_GSP28_prakp01u-11	na mīmāṃsāśāstramārambhaṇīyamiti /	na mīmāṃsā śāstram ārambhaṇīyam iti 
SA_GSP28_prakp01u-12	taddhi vedavākyārthavicāropāyabhūtanyāyanibandhanam /	tat hi veda vākya artha vicāra upāya bhūta nyāya nibandhanam 
SA_GSP28_prakp01u-13	na ca vedavākyārtho vicāryo 'sti,	na ca veda vākya arthaḥ vicāryaḥ sti 
SA_GSP28_prakp01u-14	yo vicārasya viṣayabhūtaḥ /	yaḥ vicārasya viṣaya bhūtaḥ 
SA_GSP28_prakp01u-15	nāpyasau vicārya nirṇītaḥ prayojanamavakalpate,	na api asau vicārya nirṇītaḥ prayojanam avakalpate 
SA_GSP28_prakp01u-16	apuruṣārthatvāt /	a puruṣa artha tvāt 
SA_GSP28_prakp01u-17	puruṣārthatve hi tasya codanaiva pramāṇaṃ syāt /	puruṣa artha tve hi tasya codanā eva pramāṇam syāt 
SA_GSP28_prakp01u-18	na cāvivakṣitārthā sā pramāṇaṃ bhavitumarhati /	na ca avivakṣita arthā sā pramāṇam bhavitum arhati 
SA_GSP28_prakp01u-19	nanu śabdānāmautpattikatvādarthaparatvasya nāvivakṣitārthatā yuktā /	nanu śabdānām autpattika tvāt artha paratvasya na avivakṣita arthatā yuktā 
SA_GSP28_prakp01u-20	satyamevam /	satyam evam 
SA_GSP28_prakp01u-21	vedenaiva tvanyaparatāmavagamayatāvivakṣitārthatā'padyamānā na śakyā vārayitum /	vedena eva tu anya para tām avagamayatā a vivakṣita artha tā āpadyamānā na śakyā vārayitum 
SA_GSP28_prakp01u-22	tathāhi---	tathā hi 
SA_GSP28_prakp01u-23	svādhyāyo 'dhyetavya ityatra parapreraṇātmakavidhyavaruddhābhāvanā tavyapratyayavācyā pratīyate /	svādhyāyaḥ dhyetavyaḥ iti atra para preraṇa ātmaka vidhi avaruddha abhāvanā tavya pratyaya vācyā pratīyate 
SA_GSP28_prakp01u-24	sā ca svabhāvato bhāvyaṃ karaṇamitikartavyatāñcāpekṣate /	sā ca svabhāvataḥ bhāvyam karaṇam itikartavya tām ca apekṣate 
SA_GSP28_prakp01u-25	tatra1 na tāvadadhyayanameva samānapadopāttaṃ bhāvyatayā sambandhamarhati,	tatra na tāvat adhyayanam eva samāna pada upāttam bhāvyatayā sambandham arhati 
SA_GSP28_prakp01u-26	apuruṣārthatvāt /	a puruṣa artha tvāt 
SA_GSP28_prakp01u-27	tasmin hi bhāvyatayā svīkriyamāṇe puruṣapravṛttyanupapatteḥ parapreraṇātmakavidhivyāpārabhaṅgaprasaṅgāt /	tasmin hi bhāvya tayā svīkriyamāṇe puruṣa pravṛtti anupapatteḥ para preraṇa ātmaka vidhi vyāpāra bhaṅga prasaṅgāt 
SA_GSP28_prakp01u-28	nāpyekavākyatayā samabhivyāhviyamāṇasya svādhyāyasya bhāvyatayā sambandho 'vakalpate,	na api eka vākya tayā samabhivyāhviyamāṇasya svādhyāyasya bhāvya tayā sambandhaḥ 
SA_GSP28_prakp01u-29	vidhyānarthakyaprasaṅgāt /	vidhi ānarthakya prasaṅgāt 
SA_GSP28_prakp01u-30	antareṇāpi hi vidhiṃ pratīyata evādhyayanena svādhyāyo 'vāpyata iti /	antareṇa api hi vidhim pratīyate eva adhyayanena svādhyāyaḥ vā āpyate iti 
SA_GSP28_prakp01u-31	na ca vrīhīnavahantītivanniyamārtho vidhiriti śakyate vaktum,	na ca vrīhīn avahanti iti vat niyama arthaḥ vidhiḥ iti śakyate vaktum 
SA_GSP28_prakp01u-32	akratvarthatvādadhyayanasya /	a kratu artha tvāt adhyayanasya 
SA_GSP28_prakp01u-33	na khalvadhyayanasya hi kratāveva niyamyante,	na khalu adhyayanasya hi kratau eva niyamyante 
SA_GSP28_prakp01u-34	na taṇḍulādisvarūpe /	na taṇḍula ādi svarūpe 
SA_GSP28_prakp01u-35	avadhātenaiva sampāditaistaṇḍulaiḥ kratuphalasiddhiriti pramāṇāntarasyāviṣayatvāttenaiva siddhiriti na kiñcidviruddham /	avadhātena eva sampāditaiḥ taṇḍulaiḥ kratu phala siddhiḥ iti pramāṇa antarasya aviṣaya tvāt tena eva siddhiḥ iti na kiñcid viruddham 
SA_GSP28_prakp01u-36	svādhyāyasvarūpagrahaṇaṃ tvadhyayanenaiva sidhyatīti niyamyamānaṃ mānāntaraviruddham,	svādhyāya svarūpa grahaṇam tu adhyayanena eva sidhyati iti niyamyamānam māna antara viruddham 
SA_GSP28_prakp01u-37	svayamanadhīyānasyāpi parapuruṣādhīyamānasvādhyāyagrahaṇadarśanāt /	svayam an adhīyānasya api para puruṣa adhīyamāna svādhyāya grahaṇa darśanāt 
SA_GSP28_prakp01u-38	na cādhyayanasvīkṛtenaiva svādhyāyena kratuphalabhāvanāsiddhiriti akratvarthatayā kratusaṃsparśābhāvena niyamānupapatteriti /	na ca adhyayana svīkṛtena eva svādhyāyena kratu phala bhāvanā siddhiḥ iti a kratu artha tayā kratu saṃsparśa abhāvena niyama anupapatteḥ iti 
SA_GSP28_prakp01u-39	etenaivārthāvabodhasyāpi bhāvyatayā sambandho nirasto veditavyaḥ /	etena eva artha avabodhasya api bhāvya tayā sambandhaḥ nirastaḥ veditavyaḥ 
SA_GSP28_prakp01u-40	tathā hi---	tathā hi 
SA_GSP28_prakp01u-41	yadyapyadhītātsvādhyāyātphalavatkarmāvabodho dṛśyata iti tasyaiva bhāvyatāvasīyate,	yadi api adhītāt svādhyāyāt phalavat karma avabodhaḥ dṛśyate iti tasya eva bhāvya tā avasīyate 
SA_GSP28_prakp01u-42	tathāpi vināpi vidhinānvayavyatirekābhyāmadhyayanasyārthāvabodhasādhanatvāvamādvidhiranarthaka eva /	tathā api vinā api vidhinā anvaya vyatirekābhyām adhyayanasya artha avabodha sādhana tvāt amāt vidhiḥ anarthakaḥ eva 
SA_GSP28_prakp01u-43	na cādhyayanenaivārthāvabodho bhāvayitavya iti niyamavidherarthavattā,	na ca adhyayanena eva artha avabodhaḥ bhāvayitavyaḥ iti niyama vidheḥ arthavat tā 
SA_GSP28_prakp01u-44	prakārāntareṇāpi tatsaṃbhavānniyamānupapatteḥ /	prakāra antareṇa api tad saṃbhavāt niyama anupapatteḥ 
SA_GSP28_prakp01u-45	na cādhyayanenaivārthamavabudhyānutiṣṭhatāṃ kratuphalabhāvanāsiddhiriti niyamaḥ saṃbhavati,	na ca adhyayanena eva artham avabudhya anutiṣṭhatām kratu phala bhāvanā siddhiḥ iti niyamaḥ saṃbhavati 
SA_GSP28_prakp01u-46	akratvarthatvādadhyayanasya /	a kratu artha tvāt adhyayanasya 
SA_GSP28_prakp01u-47	2tasmādviśvajinnyāyena svarge eva bhāvyatayā kalpayitavye prāpte phalamātreyo3 nirddeśādityarthavādikamadhughṛtakulyāditṛptapitrādiprasādalabhyasavrakāmaphapalāvāptireva	tasmāt viśvajit nyāyena svarge eva bhāvya tayā kalpayitavye prāpte phalam ātreyaḥ nirddeśāt iti arthavādika madhu ghṛta kulyā ādi tṛpta pitṛ ādi prasāda labhya savra kāma pha pala avāptiḥ eva 
SA_GSP28_prakp01u-48	bhāvyatayāvasīyate /	bhāvya tayā avasīyate 
SA_GSP28_prakp01u-49	nanvādyādhyayane na kiñcidārthavādikaṃ phalaṃ śrūyate,	nanu ādya adhyayane na kiñcid ārthavādikam phalam śrūyate 
SA_GSP28_prakp01u-50	tatraiṣāmarthavādānāmaśravaṇāt /	tatra eṣām arthavādānām aśravaṇāt 
SA_GSP28_prakp01u-51	dhāraṇajapayajñavidhyarthavādā hyete /	dhāraṇa japa yajña vidhi arthavādāḥ hi ete 
SA_GSP28_prakp01u-52	tadāhurvārtikakāramiśrāḥ---	tat āhuḥ vārtikakāra miśrāḥ 
SA_GSP28_prakp01u-53	“4ādye tvadhyayane naiva kācidasti phalaśrutiḥ /	tu adhyayane nā eva kācid asti phala śrutiḥ 
SA_GSP28_prakp01u-54	dhāraṇe japayajñe ca yā sāpyevaṃ nivāritā” //	dhāraṇe japa yajñe ca yā sā api evam nivāritā 
SA_GSP28_prakp01u-55	iti //	iti 
SA_GSP28_prakp01u-56	satyamevam,	satyam evam 
SA_GSP28_prakp01u-57	tathāpi teṣāmatideśato 'pi labdheryuktaiva tadīyaphalasya bhāvyatā /	tathā api teṣām atideśataḥ labdheḥ yuktā eva tadīya phalasya bhāvya tā 
SA_GSP28_prakp01u-58	tathā hi5 ---	tathā hi 
SA_GSP28_prakp01u-59	6liṅādiyukteṣu vākyeṣu dve bhāvane 'vagamyete,	liṅ ādi yukteṣu vākyeṣu dve bhāvane va gamyete 
SA_GSP28_prakp01u-60	śabdabhāvanārthabhāvanā ceti /	śabda bhāvanā artha bhāvanā ca iti 
SA_GSP28_prakp01u-61	tatra śabdabhāvanā parapreraṇātmikā /	tatra śabda bhāvanā para preraṇa ātmikā 
SA_GSP28_prakp01u-62	tasyāḥ puruṣapravṛttirbhāvyam7 /	tasyāḥ puruṣa pravṛttiḥ bhāvyam 
SA_GSP28_prakp01u-63	tayā ca preraṇayā saha yo liṅādīnāṃ vācyavācakabhāvaḥ sambandhaḥ,	tayā ca preraṇayā saha yaḥ liṅ ādīnām vācya vācaka bhāvaḥ sambandhaḥ 
SA_GSP28_prakp01u-64	sa tatra yogyatayā karaṇam /	sa tatra yogya tayā karaṇam 
SA_GSP28_prakp01u-65	tadāhurvārtikakāramiśrāḥ---	tat āhuḥ vārtikakāra miśrāḥ 
SA_GSP28_prakp01u-66	“liṅādayo hi preraṇāṃ kurvantyabhidadhati ceti” tantravā- 1. 2. 1.ṭa /	liṅ ādayaḥ hi preraṇām kurvanti abhidadhati ca iti 
SA_GSP28_prakp01u-67	pravartyarucyutpādanayogyatayā cārthavādikī stutiritikartavyatā /	pravartya ruci utpādana yogya tayā ca ārthavādikī stutiḥ itikartavya tā 
SA_GSP28_prakp01u-68	tadevamadhyayanavidhau sākṣādaśrutārthavādake śabdabhāvanāyāmitikartavyatābhūtārthavādākāṅkṣiṇyāṃ japayajñādhyayanādatideśenārthavādāḥ svīkriyante	tat evam adhyayana vidhau sākṣāt aśruta arthavādake śabda bhāvanāyām itikartavya tā bhūta arthavāda ākāṅkṣiṇyām japa yajña adhyayanāt atideśena arthavādāḥ svīkriyante 
SA_GSP28_prakp01u-69	tadāhurvārtikakāramiśrāḥ---	tat āhuḥ vārtikakāra miśrāḥ 
SA_GSP28_prakp01u-70	“anuṣaṅgānumānādyairlabhyante 'nye 'tideśataḥ” iti /	anuṣaṅga anumāna ādyaiḥ labhyante nye tideśataḥ iti 
SA_GSP28_prakp01u-71	te cātidiṣṭā arthavādā arthabhāvanāyāṃ phalaṃ samarpayanti rātrisatravat /	te ca atidiṣṭāḥ arthavādāḥ artha bhāvanāyām phalam samarpayanti rātri satra vat 
SA_GSP28_prakp01u-72	evamārthavādike phale bhāvyatayāvasite 'dhyayanaṃ samānapadopāttaṃ karaṇākāṅkṣāparipūrakatvena saṃbadhyate /	evam ārthavādike phale bhāvya tayā avasite dhyayanam samāna pada upāttam karaṇa ākāṅkṣā paripūraka tvena saṃbadhyate 
SA_GSP28_prakp01u-73	evañca 8yadaikasmādapūrvaṃ tadetarattadarthamiti nyāyena svādhyāyaśabdavācyo 'kṣararāśirapyadhyayananirvṛttyartha evāvasīyate /	evam ca yadā ekasmāt apūrvam tadā itarat tad artham iti nyāyena svādhyāya śabda vācya u kṣara rāśiḥ api adhyayana nirvṛtti arthaḥ eva avasīyate 
SA_GSP28_prakp01u-74	evañcānyaparatvādakṣarāṇāṃ tebhyo 'rthapratipattirevānupapannā,	evam ca anya para tvāt akṣarāṇām tebhyaḥ rtha pratipattiḥ eva anupapannā 
SA_GSP28_prakp01u-75	vyutpattivirahāt /	vyutpatti virahāt 
SA_GSP28_prakp01u-76	vṛddhavyavahāre hyananyaparāṇyevākṣarāṇyarthāvabodhakatayā vyutpannāni /	vṛddha vyavahāre hi ananya parāṇi eva akṣarāṇi artha avabodhaka tayā vyutpannāni 
SA_GSP28_prakp01u-77	vyutpattyapekṣaśca śabdo 'rthāvabodhakaḥ /	vyutpatti apekṣaḥ ca śabdaḥ rtha avabodhakaḥ 
SA_GSP28_prakp01u-78	yaḥ punaranyaparebhyo 'pyakṣarebhyo 'rthāvagamaḥ,	yaḥ punar anya parebhyaḥ pi akṣarebhyaḥ rtha avagamaḥ 
SA_GSP28_prakp01u-79	sa sāmānyatodṛṣṭanibandhanānanyaparatvabhrāntyā bhrāntireveti mantavyam /	sa sāmānyatodṛṣṭa nibandhana ananya paratva bhrāntyā bhrāntiḥ eva iti mantavyam 
SA_GSP28_prakp01u-80	apratīyamānaścārtho na vicārasya viṣayaḥ,	apratīyamānaḥ ca arthaḥ na vicārasya viṣayaḥ 
SA_GSP28_prakp01u-81	nāpi prayojanamiti vicārastāvannārabdhavyaḥ,	nā api prayojanam iti vicāraḥ tāvat na ārabdhavyaḥ 
SA_GSP28_prakp01u-82	tadanārambhe ca tadapāyabhūtanyāyaparijñānamapyanupayogi /	tad anārambhe ca tad apāya bhūta nyāya parijñānam api anupayogi 
SA_GSP28_prakp01u-83	tadanupayoge ca tannibandhanaṃ mīmāṃsāśātramanārambhaṇīyamiti pūrvaḥ pakṣaḥ //	tad anupayoge ca tat nibandhanam mīmāṃsā śātram anārambhaṇīyam iti pūrvaḥ pakṣaḥ 
SA_GSP28_prakp01u-84	bhāṭṭamatena mīmāṃsārambhasamarthanam---	          
SA_GSP28_prakp01u-85	rāddhāntastu svādhyāyo 'dhyetavya iti svādhyāyasya 9karmatvāvagamātsa eva bhāvyatayāvasīyate /	rāddhāntaḥ tu svādhyāyaḥ dhyetavyaḥ iti svādhyāyasya karma tva avagamāt saḥ eva bhāvya tayā avasīyate 
SA_GSP28_prakp01u-86	yadyapi nityatvānnirvarttyakarmatā nāsti svādhyāyasya,	yadi api nitya tvāt nirvarttya karma tā na asti svādhyāyasya 
SA_GSP28_prakp01u-87	vikāryakarmatā vā,	vikārya karma tā vā 
SA_GSP28_prakp01u-88	adhyayanena tasya vikārānupapatteḥ,	adhyayanena tasya vikāra anupapatteḥ 
SA_GSP28_prakp01u-89	tathāpi prāpyatayā tasya karmatā nānupapannā /	tathā api prāpya tayā tasya karma tā na anupapannā 
SA_GSP28_prakp01u-90	ata eva prāpyakarmodāharaṇaṃ vṛttikārasya vedādhyayanam /	atas eva prāpya karma udāharaṇam vṛtti kārasya veda adhyayanam 
SA_GSP28_prakp01u-91	yacca karma,	yat ca karma 
SA_GSP28_prakp01u-92	tadarthaiva kriyā yuktā /	tad arthā eva kriyā yuktā 
SA_GSP28_prakp01u-93	so 'yaṃ śrauto vinayogaḥ /	saḥ yam śrautaḥ vina yogaḥ 
SA_GSP28_prakp01u-94	na ca svādhyāyasya saktuvaccheṣitvamanupapannam,	na ca svādhyāyasya saktu vat śeṣi tvam anupapannam 
SA_GSP28_prakp01u-95	phalavadarthāvabodhopayogitvāt /	phalavat artha avabodha upayogi tvāt 
SA_GSP28_prakp01u-96	yadyapi cārthāvabodhopayogitvamadhyayanātprāṅnāvagamyate,	yadi api ca artha avabodha upayogi tvam adhyayanāt prāk nā avagamyate 
SA_GSP28_prakp01u-97	tathāpi paścādbhāvyapi bhavatyeva prayojanam /	tathā api paścāt bhāvi api bhavati eva prayojanam 
SA_GSP28_prakp01u-98	bhāvināpi copayogena śeṣitvaṃ nānupapannam, agnivat /	bhāvinā api ca upayogena śeṣi tvam na anupapannam agni vat 
SA_GSP28_prakp01u-99	utpannānāṃ hyagnīnāṃ viniyogāvagamaḥ,	utpannānām hi agnīnām viniyoga avagamaḥ 
SA_GSP28_prakp01u-100	nāvagataviniyogānāmutpattiḥ /	na avagata viniyogānām utpattiḥ 
SA_GSP28_prakp01u-101	āhavanīyādiśabdānāmalaukikārthatayā prāgvyutpattyavagamādarthānavagateḥ homādiṣu viniyogāsaṃbhavāt /	āhavanīya ādi śabdānām alaukika artha tayā prāk vyutpatti avagamāt artha anavagateḥ homa ādiṣu viniyoga asaṃbhavāt 
SA_GSP28_prakp01u-102	tathā coktam---	tathā ca uktam 
SA_GSP28_prakp01u-103	“bhūtabhāvyupayogaṃ hi dravyaṃ saṃskāramarhati /	bhūta bhāvi upayogam hi dravyam saṃskāram arhati 
SA_GSP28_prakp01u-104	” [tantrāvā- 2. 1. 4.] nanu cārthāvabodhopayogitayā saṃskāravidhiranarthaka evetyuktam iti /	                                    
SA_GSP28_prakp01u-105	nānarthakaḥ,	na anarthakaḥ 
SA_GSP28_prakp01u-106	niyamārthatayārthavattvāt /	niyama artha tayā arthavat tvāt 
SA_GSP28_prakp01u-107	nanu ca niyamo na sambhavati,	nanu ca niyamaḥ na sambhavati 
SA_GSP28_prakp01u-108	apratusaṃsparśitvāditktam /	a pratusaṃsparśi tvāt it ktam 
SA_GSP28_prakp01u-109	tanna sambhavati svābhāvikārthaparatvānusāreṇa kratvanupraveśe kratusaṃsparśitāyā evocitatvāt /	tat na sambhavati svābhāvika artha paratva anusāreṇa kratu anupraveśe kratu saṃsparśi tāyāḥ eva ucita tvāt 
SA_GSP28_prakp01u-110	yadi khalvadhyayanavidheḥ kratvanupraveśitā nāśrīyate,	yadi khalu adhyayana vidheḥ kratu anupraveśi tā na āśrīyate 
SA_GSP28_prakp01u-111	tadā śabdānāṃ vṛddhavyavahāravyutpannānāṃ svābhāvikārthaparatā hīyeta /	tadā śabdānām vṛddha vyavahāra vyutpannānām svābhāvika artha para tā hīyeta 
SA_GSP28_prakp01u-112	jahatsvārthatvaṃ ca na nyāyyamiti kratuphalabhāvanānupraveśyevādhyayanasaṃskāro yuktaḥ /	jahat sva artha tvam ca na nyāyyam iti kratu phala bhāvanā anupraveśyā iva adhyayana saṃskāraḥ yuktaḥ 
SA_GSP28_prakp01u-113	tatra karmavidhiṣvevaṃ niyamavarṇanā adhyayanāvirbhāvitaireva karmavidhibhirarthamavabudhyānutiṣṭhatāṃ kratuphalabhāvanāsiddhiriti /	tatra karma vidhiṣu evam niyama varṇanā adhyayana āvis bhāvitaiḥ eva karma vidhibhiḥ artham avabudhya anutiṣṭhatām kratu phala bhāvanā siddhiḥ iti 
SA_GSP28_prakp01u-114	arthavādeṣu tvadhyayanāvirbhāvitārthavādaprarocitāḥ kriyamāṇāḥ kratavaḥ phalabhāvanāya alamiti /	arthavādeṣu tu adhyayana āvirbhāvita arthavāda prarocitāḥ kriyamāṇāḥ kratavaḥ phala bhāvanāya alam iti 
SA_GSP28_prakp01u-115	mantreṣu punaradhyayanaparigṛhītaireva mantraiḥ kratuṣu padārthasmaraṇaṃ phalabhāvanāṅgamiti /	mantreṣu punar adhyayana parigṛhītaiḥ eva mantraiḥ kratuṣu padārtha smaraṇam phala bhāvanā aṅgam iti 
SA_GSP28_prakp01u-116	adhyayananiyamāśritaśca kālaniyamo vratādiniyamaśca /	adhyayana niyama āśritaḥ ca kāla niyamaḥ vrata ādi niyamaḥ ca 
SA_GSP28_prakp01u-117	“śrāvaṇyāṃ prauṣṭhapadyāṃ vā upākṛtya yathāvidhi /	śrāvaṇyām prauṣṭhapadyām vā upākṛtya yathāvidhi 
SA_GSP28_prakp01u-118	yuktaśchandāṃsyadhīyīta māsānvipro 'rdhapañcamān //	yuktaḥ chandāṃsi adhīyīta māsān vipraḥ ṛdhapañcamān 
SA_GSP28_prakp01u-119	[manu. a. 2, ślo. 2,49,11]	manu a ślo 
SA_GSP28_prakp01u-120	“bhavatpūrva caredbhaikṣamupanīto dvijottamaḥ /	bhavat pūrva caret bhaikṣam upanītaḥ dvijottamaḥ 
SA_GSP28_prakp01u-121	bhavanmadhyaṃ tu rājanyo vaiśyastu bhavaduttaram” //	bhavat madhyam tu rājanyaḥ vaiśyaḥ tu bhavat uttaram 
SA_GSP28_prakp01u-122	[manu. a. 2, ślo. 2,49,11] iti /	iti 
SA_GSP28_prakp01u-123	evañcānanyaparatvādakṣarāṇāṃ phalavatkarmāvabodhotpattervicārasya viṣayaprayojanalābhācchāstrasyārambhaṇīyatvam,	evam ca ananya paratvāt akṣarāṇām phalavat karma avabodha utpatteḥ vicārasya viṣaya prayojana lābhāt śāstrasya ārambhaṇīya tvam 
SA_GSP28_prakp01u-124	viṣayaprayojanalābhe ca vicārasyādhyayanānantaramupanipatitatvād gurukulasthiterarthavattvāttannivṛttimadhyayanānantaraprāptāṃ	viṣaya prayojana lābhe ca vicārasya adhyayana anantaram upanipatita tvāt guru kula sthiteḥ arthavat tvāt tad nivṛttim adhyayana anantara prāptām 
SA_GSP28_prakp01u-125	smarad 'vedamadhītya snāyād'iti smṛtivacanamapanyāyamūlaṃ darśayannarthāvabodhaparatayā	smarat vedam adhītya snāyāt iti smṛti vacanam apanyāya mūlam darśayan artha avabodha para tayā 
SA_GSP28_prakp01u-126	svādhyāyasya vivakṣitārthatāṃ manyamānaḥ sūtrakāro vicārasya viṣayaṃ prayojanaṃ cāha“athāto	svādhyāyasya vivakṣita artha tām manyamānaḥ sūtrakāraḥ vicārasya viṣayam prayojanam ca āha atha atas 
SA_GSP28_prakp01u-127	dharmajijñāsā” pū-mī- 1.1.1 iti /	dharma jijñāsā pūmī iti 
SA_GSP28_prakp01u-128	etacca vyākhyātam---	etat ca vyākhyātam 
SA_GSP28_prakp01u-129	“athāto dharmajijñāsāsūtramādyamidaṃ kṛtam /	atha atas dharma jijñāsā sūtram ādyam idam kṛtam 
SA_GSP28_prakp01u-130	dharmākhyaṃ viṣayaṃ vaktuṃ mīmāṃsāyāḥ prayojanam” //	dharma ākhyam viṣayam vaktum mīmāṃsāyāḥ prayojanam 
SA_GSP28_prakp01u-131	mīmāṃsāślokavārtikam 1. 1. 11. iti bahuropi 10tadayuktam /	mīmāṃsāślokavārtikam iti bahu ropi 
SA_GSP28_prakp01u-132	na hi liṅādiyuktavākyeṣu bhāvanā bhāvyāntaramapekṣate,	na hi liṅ ādi yukta vākyeṣu bhāvanā bhāvya antaram apekṣate 
SA_GSP28_prakp01u-133	apūrvasya bhāvyasya svaśabdenābhihitatvāt /	apūrvasya bhāvyasya sva śabdena abhihita tvāt 
SA_GSP28_prakp01u-134	liṅādayo hi bhāvyakoṭiniviṣṭapradhānabhūtāpūrvopasarjanatāpannāmeva bhāvanāmabhidadhatīti 11viṣayakaraṇīye nipuṇataramupapāditam /	liṅ ādayaḥ hi bhāvya koṭi niviṣṭa pradhāna bhūta apūrva upasarjana tā āpannām eva bhāvanām abhidadhati iti nipuṇataram upapāditam 
SA_GSP28_prakp01u-135	ato na pūrvapakṣe bhāvyākāṅkṣāyāmārthavādikaphalasambandhaḥ /	atas na pūrvapakṣe bhāvya ākāṅkṣāyām ārthavādika phala sambandhaḥ 
SA_GSP28_prakp01u-136	nāpi siddhānte svādhyāyasya sādhyatayānvayaḥ /	nā api siddhānte svādhyāyasya sādhya tayā anvayaḥ 
SA_GSP28_prakp01u-137	kathaṃ tarhi viśvajidādiṣu svargādiphalakalpanam?	katham tarhi viśvajit ādiṣu svarga ādi phala kalpanam 
SA_GSP28_prakp01u-138	yathā tattathā niśamyatām---	yathā tat tathā niśamyatām 
SA_GSP28_prakp01u-139	yadapūrva kāryabhūtaṃ pratīyate tad viṣayatvena sambaddhakaraṇībhūtayāgādyanuṣṭhānādhīnātmalābham /	yat apūrva kārya bhūtam pratīyate tat viṣaya tvena sambaddha karaṇībhūta yāga ādi anuṣṭhāna adhīna ātmalābham 
SA_GSP28_prakp01u-140	12na ca vinā kartrā tadanuṣṭhānopapattiḥ /	ca vinā kartrā tad anuṣṭhāna upapattiḥ 
SA_GSP28_prakp01u-141	nacādhikāraṃ vinā kartṛtvalābhaḥ /	na ca adhikāram vinā kartṛ tva lābhaḥ 
SA_GSP28_prakp01u-142	naca niyojyamantareṇādhikārasiddhiḥ /	na ca niyojyam antareṇa adhikāra siddhiḥ 
SA_GSP28_prakp01u-143	na vāviśiṣṭo niyojyo 'vakalpata iti viśeṣaṇabhāvena svargakāmanā parikalpyate /	na vā a viśiṣṭaḥ niyojyaḥ iti viśeṣaṇa bhāvena svarga kāmanā parikalpyate 
SA_GSP28_prakp01u-144	svargakāmanā cenniyojyaviśeṣaṇaṃ tato 'gnihotrādivat svargasyāpi niyogataḥ siddhiriti /	svarga kāmanā ced niyojya viśeṣaṇam tatas gnihotra ādi vat svargasya api niyogataḥ siddhiḥ iti 
SA_GSP28_prakp01u-145	bhavatvevam,	bhavatu evam 
SA_GSP28_prakp01u-146	atrāpi tarhi niyojyaviśeṣaṇatayaivārthavādikaṃ phalaṃ rātrisatravatsambadhyatām / na /	atra api tarhi niyojya viśeṣaṇa tayā eva ārthavādikam phalam rātri satra vat sambadhyatām na 
SA_GSP28_prakp01u-147	anyato 'nuṣṭhānasiddheḥ /	anyatas nuṣṭhāna siddheḥ 
SA_GSP28_prakp01u-148	kuto 'nyataḥ?	kutas ni atas 
SA_GSP28_prakp01u-149	ācāryakaraṇavidhiprayukteḥ /	ācārya karaṇa vidhi prayukteḥ 
SA_GSP28_prakp01u-150	kaḥ punarācāryakaraṇavidhiḥ?	kaḥ punar ācārya karaṇa vidhiḥ 
SA_GSP28_prakp01u-151	“upanīya tu yaḥ śiṣyaṃ vedamadhyāpayet dvijaḥ /	upanīya tu yaḥ śiṣyam vedam adhyāpayet dvijaḥ 
SA_GSP28_prakp01u-152	sakalpaṃ sarahasya ca tamācāryaṃ pracakṣate” //	sa kalpam sa rahasya ca tam ācāryam pracakṣate 
SA_GSP28_prakp01u-153	[manuḥ 2. 140] iti smaraṇānumitaḥ śiṣyamupanīya vedādhyāpanenācāryakaṃ bhāveyadityevaṃrūpaḥ alaukikañcāhavanīyādivadācāryakamiti tanniṣpattyupāyavidhānaṃ  #	manuḥ iti smaraṇa anumitaḥ śiṣyam upanīya veda adhyāpanena ācāryakam bhāveyat iti evaṃrūpaḥ alaukikaḥ ca āhavanīya ādi vat ācāryakam iti tad niṣpatti upāya vidhānam 
SA_GSP28_prakp01u-154	yuktameva /	yuktam eva 
SA_GSP28_prakp01u-155	tatrārthādācāryībubhūṣata evādhikāro dhanārjananiyamavat /	tatra arthāt ācāryī bubhūṣataḥ eva adhikāraḥ dhana arjana niyama vat 
SA_GSP28_prakp01u-156	tatra śiṣyaṃ prati vihitataddhitācaraṇadakṣiṇādānadarśanāttallipsorevācāryabhavanecchā /	tatra śiṣyam prati vihita tad hita ācaraṇa dakṣiṇā dāna darśanāt tad lipsoḥ eva ācārya bhavana icchā 
SA_GSP28_prakp01u-157	yathā dīkṣaṇīyayā dīkṣitatvasiddhiḥ,	yathā dīkṣaṇīyayā dīkṣita tva siddhiḥ 
SA_GSP28_prakp01u-158	tathā vedādhyāpanenācāryatvasiddhiḥ /	tathā veda adhyāpanena ācārya tva siddhiḥ 
SA_GSP28_prakp01u-159	upanayanaṃ ca ktvāpratyayenādhyāpanasamānakartṛkamavagamyamānamekaprayogatayā vinā	upanayanam ca ktvāpratyayena adhyāpana samāna kartṛkam avagamyamānam eka prayogatayā vinā 
SA_GSP28_prakp01u-160	samānakartṛkatvāsambhavādaṅgāṅgibhāvena ca vinā ekaprayogatvānupapatterācāryakabhāvanākaraṇībhūtamadhyāpanaṃ	samāna kartṛka tva asambhavāt aṅga aṅgi bhāvena ca vinā eka prayoga tva anupapatteḥ ācāryaka bhāvanā karaṇībhūtam adhyāpanam 
SA_GSP28_prakp01u-161	pratyaṅgatvenāvatiṣṭhate /	prati aṅga tvena avatiṣṭhate 
SA_GSP28_prakp01u-162	tadāśrita 'ścāṣṭavarṣabrāhmaṇamupanayīte'tyādiniyamaḥ /	tad āśritaḥ ca aṣṭa varṣa brāhmaṇam upanayīta ityādi niyamaḥ 
SA_GSP28_prakp01u-163	upanayanaṃ na svabhāvata upaneyāsattiprayojanakamiti taddvāreṇaiva tasyāṅgam /	upanayanam na svabhāvataḥ upaneya āsatti prayojanakam iti tad dvāreṇa eva tasya aṅgam 
SA_GSP28_prakp01u-164	na cādhyāpanaṃ pratyanupayogina upaneyasyāsattiradhyāpanopayoginītyupaneyasya karmāpekṣāyāmupanayanaṃ	na ca adhyāpanam prati anupayoginaḥ upaneyasya āsattiḥ adhyāpana upayoginī iti upaneyasya karma apekṣāyām upanayanam 
SA_GSP28_prakp01u-165	prakramya 'svādhyāyo 'dhyetavya' ityadhyayanaṃ vidhīyamānamupaneyasya karmetyavagamyate /	prakramya svādhyāyaḥ dhyetavyaḥ iti adhyayanam vidhīyamānam upaneyasya karma iti avagamyate 
SA_GSP28_prakp01u-166	adhyayanaṃ cādhyāpanopayogīti /	adhyayanam ca adhyāpana upayogi iti 
SA_GSP28_prakp01u-167	saddhimetat /	sat him etat 
