segmentnr	original	analyzed
SA_GV01_rv_10_u-1730	RV_10.084.07.1{19} saṃsṛṣṭaṃ dhanamubhayaṃ samākṛtamasmabhyaṃ dattāṃvaruṇaśca manyuḥ	saṃsṛṣṭam dhanam ubhayam samākṛtam asmabhyam dattām varuṇaḥ ca manyuḥ 
SA_GV01_rv_10_u-1731	RV_10.084.07.2{19} bhiyaṃ dadhānā hṛdayeṣu śatravaḥparājitāso apa ni layantām	bhiyam dadhānāḥ hṛdayeṣu śatravaḥ parājitāsaḥ apa ni layantām 
SA_GV01_rv_10_u-1732	RV_10.085.01.1{20} satyenottabhitā bhūmiḥ sūryeṇottabhitā dyauḥ	satyena uttabhitā bhūmiḥ sūryeṇa uttabhitā dyauḥ 
SA_GV01_rv_10_u-1733	RV_10.085.01.2{20} ṛtenādityāstiṣṭhanti divi somo adhi śritaḥ	ṛtena ādityāḥ tiṣṭhanti divi somaḥ adhi śritaḥ 
SA_GV01_rv_10_u-1734	RV_10.085.02.1{20} somenādityā balinaḥ somena pṛthivī mahī	somena ādityāḥ balinaḥ somena pṛthivī mahī 
SA_GV01_rv_10_u-1735	RV_10.085.02.2{20} athonakṣatrāṇāmeṣāmupasthe soma āhitaḥ	atha ūnakṣatrāṇām eṣām upasthe somaḥ āhitaḥ 
SA_GV01_rv_10_u-1736	RV_10.085.03.1{20} somaṃ manyate papivan yat sampiṃṣantyoṣadhim	somam manyate papivan yat sampiṃṣanti oṣadhim 
SA_GV01_rv_10_u-1737	RV_10.085.03.2{20} somaṃ yambrahmāṇo vidurna tasyāśnāti kaścana	somam yam brahmāṇaḥ viduḥ na tasya aśnāti kaścana 
SA_GV01_rv_10_u-1738	RV_10.085.04.1{20} āchadvidhānairgupito bārhataiḥ soma rakṣitaḥ	āchad vidhānaiḥ gupitaḥ bārhataiḥ soma rakṣitaḥ 
SA_GV01_rv_10_u-1739	RV_10.085.04.2{20} gravṇāmicchṛṇvan tiṣṭhasi na te aśnāti pārthivaḥ	gravṇām id śṛṇvan tiṣṭhasi na te aśnāti pārthivaḥ 
SA_GV01_rv_10_u-1740	RV_10.085.05.1{20} yat tvā deva prapibanti tata ā pyāyase punaḥ	yat tvā deva prapibanti tatas ā pyāyase punar 
SA_GV01_rv_10_u-1741	RV_10.085.05.2{20} vāyuḥsomasya rakṣitā samānāṃ māsa ākṛtiḥ	vāyuḥsomasya rakṣitā samānām māsaḥ ākṛtiḥ 
SA_GV01_rv_10_u-1742	RV_10.085.06.1{21} raibhyāsīdanudeyī nārāśaṃsi nyocanī	raibhī āsīt anudeyī nārāśaṃsi nyocanī 
SA_GV01_rv_10_u-1743	RV_10.085.06.2{21} sūryāyābhadramid vāso gāthayaiti pariṣkṛtam	sūryāya abhadram id vāsaḥ gāthayā eti pariṣkṛtam 
SA_GV01_rv_10_u-1744	RV_10.085.07.1{21} cittirā upabarhaṇaṃ cakṣurā abhyañjanam	cittirāḥ upabarhaṇam cakṣurāḥ abhyañjanam 
SA_GV01_rv_10_u-1745	RV_10.085.07.2{21} dyaurbhūmiḥkośa āsīd yadayāt sūryā patim	dyauḥ bhūmiḥ kośaḥ āsīt yat ayāt sūryā patim 
SA_GV01_rv_10_u-1746	RV_10.085.08.1{21} stomā āsan pratidhayaḥ kuriraṃ chanda opaśaḥ	stomāḥ āsan pratidhayaḥ kuriram chandaḥ opaśaḥ 
SA_GV01_rv_10_u-1747	RV_10.085.08.2{21} sūryāyāaśvinā varāgnirāsīt purogavaḥ	varā agniḥ āsīt purogavaḥ 
SA_GV01_rv_10_u-1748	RV_10.085.09.1{21} somo vadhūyurabhavadaśvināstāmubhā varā	somaḥ vadhūyuḥ abhavat aśvinā āstām ubhā varā 
SA_GV01_rv_10_u-1749	RV_10.085.09.2{21} sūryāṃyat patye śaṃsantīṃ manasā savitādadāt	sūryāṃyat patye śaṃsantīm manasā savitā adadāt 
SA_GV01_rv_10_u-1750	RV_10.085.10.1{21} mano asyā ana āsīd dyaurāsīduta chadiḥ	manaḥ asyāḥ anaḥ āsīt dyauḥ āsīt uta chadiḥ 
SA_GV01_rv_10_u-1751	RV_10.085.10.2{21} śukrāvanaḍvāhavāstāṃ yadayāt sūryā bṛham	śukrau anaḍvāhau āstām yat ayāt sūryā bṛham 
SA_GV01_rv_10_u-1752	RV_10.085.11.1{22} ṛksāmābhyāmabhihitau gāvau te sāmanāvitaḥ	ṛk sāmābhyām abhihitau gāvau te sāma nāvitaḥ 
SA_GV01_rv_10_u-1753	RV_10.085.11.2{22} śrotraṃ tecakre āstāṃ divi panthāścarācāraḥ	śrotram te cakre āstām divi panthāḥ cara ācāraḥ 
SA_GV01_rv_10_u-1754	RV_10.085.12.1{22} śucī te cakre yātyā vyāno akṣa āhataḥ	śucī te cakre yātyāḥ vyānaḥ akṣaḥ āhataḥ 
SA_GV01_rv_10_u-1755	RV_10.085.12.2{22} anomanasmayaṃ sūryārohat prayati patim	anaḥ manasmayam sūryā ārohat prayati patim 
SA_GV01_rv_10_u-1756	RV_10.085.13.1{22} sūryāyā vahatuḥ prāgāt savitā yamavāsṛjat	sūryāyāḥ vahatuḥ prāgāt savitā yam avāsṛjat 
SA_GV01_rv_10_u-1757	RV_10.085.13.2{22} aghāsuhanyante gāvo 'rjunyoḥ paryuhyate	gāvaḥ rjunyoḥ paryuhyate 
SA_GV01_rv_10_u-1758	RV_10.085.14.1{22} yadaśvinā pṛchamānāvayātaṃ tricakreṇa vahatuṃsūryāyāḥ	yat aśvinā pṛcchamānau ayātam tri cakreṇa 
SA_GV01_rv_10_u-1759	RV_10.085.14.2{22} viśve devā anu tad vāmajānan putraḥpitarāvavṛṇīta pūṣā	viśve devāḥ anu tat vām ajānan putraḥ pitarau avṛṇīta pūṣā 
SA_GV01_rv_10_u-1760	RV_10.085.15.1{22} yadayātaṃ śubhas patī vareyaṃ sūryāmupa	yat ayātam śubhaḥ patī vareyam sūryām upa 
SA_GV01_rv_10_u-1761	RV_10.085.15.2{22} kvaikaṃcakraṃ vāmāsīt kva deṣṭrāya tasthathuḥ	kva ekaṃcakram vām āsīt kva deṣṭrāya tasthathuḥ 
SA_GV01_rv_10_u-1762	RV_10.085.16.1{23} dve te cakre sūrye brahmāṇa ṛtutha viduḥ	dve te cakre sūrye brahmāṇaḥ viduḥ 
SA_GV01_rv_10_u-1763	RV_10.085.16.2{23} athaikaṃcakraṃ yad guhā tadaddhātaya id viduḥ	atha ekaṃcakram yat guhā tat addhātayaḥ id viduḥ 
SA_GV01_rv_10_u-1764	RV_10.085.17.1{23} sūryāyai devebhyo mitrāya varuṇāya ca	sūryāyai devebhyaḥ mitrāya varuṇāya ca 
SA_GV01_rv_10_u-1765	RV_10.085.17.2{23} ye bhūtasyapracetasa idaṃ tebhyo 'karaṃ namaḥ	ye bhūtasya pracetasaḥ idam tebhyaḥ karam namaḥ 
SA_GV01_rv_10_u-1766	RV_10.085.18.1{23} pūrvāparaṃ carato māyayaitau śiśū kriḷantau pari yatoadhvaram	pūrva aparam carataḥ māyayā etau śiśū kriḍantau pari yatas adhvaram 
SA_GV01_rv_10_u-1767	RV_10.085.18.2{23} viśvānyanyo bhuvanābhicaṣṭa ṛtunranyovidadhajjāyate punaḥ	viśvāni anyaḥ bhuvanā abhicaṣṭe ṛtun anyaḥ vidadhat jāyate punar 
SA_GV01_rv_10_u-1768	RV_10.085.19.1{23} navo-navo bhavati jāyamāno 'hnāṃ keturuṣasāmetyagram	navaḥ navaḥ bhavati jāyamānaḥ hnām ketuḥ uṣasām eti agram 
SA_GV01_rv_10_u-1769	RV_10.085.19.2{23} bhāgaṃ devebhyo vi dadhātyāyan pra candramāstiratedīrghamayuḥ	bhāgam devebhyaḥ vi dadhāti āyan pra candramāḥ tirate dīrgham ayuḥ 
SA_GV01_rv_10_u-1770	RV_10.085.20.1{23} sukiṃśukaṃ śalmaliṃ viśvarūpaṃ hiraṇyavarṇaṃ suvṛtaṃsucakram	su kiṃśukam śalmalim viśva rūpam hiraṇya varṇam suvṛtam su cakram 
SA_GV01_rv_10_u-1771	RV_10.085.20.2{23} ā roha sūrye amṛtasya lokaṃ syonaṃ patye vahatuṃkṛṇuṣva	ā roha sūrye amṛtasya lokam syonam patye vahatuṃkṛṇuṣva 
SA_GV01_rv_10_u-1772	RV_10.085.21.1{24} udīrṣvātaḥ pativatī hyeṣā viśvāvasuṃ namasāgīrbhirīḷe	ud īrṣva atas pativatī hi eṣā viśvāvasum namasā a gīrbhiḥ īḍe 
SA_GV01_rv_10_u-1773	RV_10.085.21.2{24} anyāmicha pitṛṣadaṃ vyaktāṃ sa te bhāgojanuṣā tasya viddhi	anyām icha pitṛṣadam vyaktām sa te bhāgaḥ januṣā tasya viddhi 
SA_GV01_rv_10_u-1774	RV_10.085.22.1{24} udīrṣvāto viśvāvaso namaseḷā mahe tvā	udīrṣva atas viśvāvaso namasā iḍā mahe tvā 
SA_GV01_rv_10_u-1775	RV_10.085.22.2{24} anyāmichaprapharvyaṃ saṃ jāyāṃ patyā sṛja	anyām ichaprapharvyam sam jāyām patyā sṛja 
SA_GV01_rv_10_u-1776	RV_10.085.23.1{24} anṛkṣarā ṛjavaḥ santu panthā yebhiḥ sakhāyo yanti novareyam	anṛkṣarāḥ ṛjavaḥ santu panthāḥ yebhiḥ sakhāyaḥ yanti novareyam 
SA_GV01_rv_10_u-1777	RV_10.085.23.2{24} samaryamā saṃ bhago no ninīyāt saṃ jaspatyaṃsuyamamastu devāḥ	sam aryamā sam bhagaḥ naḥ ninīyāt sam jaspati aṃsuyamam astu devāḥ 
SA_GV01_rv_10_u-1778	RV_10.085.24.1{24} pra tvā muñcāmi varuṇasya pāśād yena tvābadhnāt savitāsuśevaḥ	pra tvā muñcāmi varuṇasya pāśāt yena tvā abadhnāt savitā asu śevaḥ 
SA_GV01_rv_10_u-1779	RV_10.085.24.2{24} ṛtasya yonau sukṛtasya loke 'riṣṭāṃ tvā sahapatyā dadhāmi	ṛtasya yonau sukṛtasya loke riṣṭām tvā sahapatyā dadhāmi 
SA_GV01_rv_10_u-1780	RV_10.085.25.1{24} preto muñcāmi nāmutaḥ subaddhāmamutas karam	pretaḥ muñcāmi na amutas su baddhām amutas karam 
SA_GV01_rv_10_u-1781	RV_10.085.25.2{24} yatheyamindra mīḍhvaḥ suputrā subhagāsati	yathā iyam indra mīḍhvaḥ su putrā subhagā asati 
SA_GV01_rv_10_u-1782	RV_10.085.26.1{25} pūṣā tveto nayatu hastagṛhyāśvinā tvā pra vahatāṃrathena	pūṣā tvā itas nayatu hasta gṛhya aśvinā tvā pra vahatāṃrathena 
SA_GV01_rv_10_u-1783	RV_10.085.26.2{25} gṛhān gacha gṛhapatnī yathāso vaśinī tvaṃvidathamā vadāsi	gṛhān gacha gṛha patnī yathā asaḥ vaśinī tvaṃvidathamā vadāsi 
SA_GV01_rv_10_u-1784	RV_10.085.27.1{25} iha priyaṃ prajayā te sam ṛdhyatāmasmin gṛhe gārhapatyāyajāgṛhi	iha priyam prajayā te sam ṛdhyatām asmin gṛhe gārhapatyāya jāgṛhi 
SA_GV01_rv_10_u-1785	RV_10.085.27.2{25} enā patyā tanvaṃ saṃ sṛjasvādhā jivrī vidathamā vadāthaḥ	enā patyā tanvam sam sṛjasva adhā jivrī vidathamā vadāthaḥ 
SA_GV01_rv_10_u-1786	RV_10.085.28.1{25} nīlalohitaṃ bhavati kṛtyāsaktirvyajyate	nīla lohitam bhavati kṛtyā āsaktiḥ vyajyate 
SA_GV01_rv_10_u-1787	RV_10.085.28.2{25} edhante asyājñātayaḥ patirbandheṣu badhyate	edhante asya ajñātayaḥ patiḥ bandheṣu badhyate 
SA_GV01_rv_10_u-1788	RV_10.085.29.1{25} parā dehi śāmulyaṃ brahmabhyo vi bhajā vasu	parā dehi śāmulyam brahmabhyaḥ vi bhajā vasu 
SA_GV01_rv_10_u-1789	RV_10.085.29.2{25} kṛtyaiṣāpadvatī bhūtvyā jāyā viśate patim	kṛtyā eṣā āpadvatī bhūtvā ā jāyā viśate patim 
SA_GV01_rv_10_u-1790	RV_10.085.30.1{25} aśrīrā tanūrbhavati ruśatī pāpayāmuyā	aśrīrā tanūḥ bhavati ruśatī pāpayā amuyā 
SA_GV01_rv_10_u-1791	RV_10.085.30.2{25} patiryadvadhvo vāsasā svamaṅgamabhidhitsate	patiḥ yat vadhvaḥ vāsasā svam aṅgam abhidhitsate 
SA_GV01_rv_10_u-1792	RV_10.085.31.1{26} ye vadhvaścandraṃ vahatuṃ yakṣmā yanti janādanu	ye vadhvaḥ candram vahatum yakṣmāḥ yanti janāt anu 
SA_GV01_rv_10_u-1793	RV_10.085.31.2{26} punastān yajñiyā devā nayantu yata āgatāḥ	punar tān yajñiyāḥ devāḥ nayantu yatas āgatāḥ 
SA_GV01_rv_10_u-1794	RV_10.085.32.1{26} mā vidan paripanthino ya āsīdanti dampatī	mā vidan paripanthinaḥ ye āsīdanti dampatī 
SA_GV01_rv_10_u-1795	RV_10.085.32.2{26} sugebhirdurgamatītāmapa drāntvarātayaḥ	sugebhiḥ durgam atītām apa drāntu arātayaḥ 
SA_GV01_rv_10_u-1796	RV_10.085.33.1{26} sumaṅgalīriyaṃ vadhūrimāṃ sameta paśyata	su maṅgalīḥ iyam vadhūḥ imām sameta paśyata 
SA_GV01_rv_10_u-1797	RV_10.085.33.2{26} saubhāgyamasyai dattvāyāthāstaṃ vi paretana	saubhāgyam asyai dattvāya atha astam vi parā itana 
SA_GV01_rv_10_u-1798	RV_10.085.34.1{26} tṛṣṭametat kaṭukametadapāṣṭhavad viṣavan naitadattave	tṛṣṭam etat kaṭukam etat apāṣṭhavat viṣavat na etat attave 
SA_GV01_rv_10_u-1799	RV_10.085.34.2{26} sūryāṃ yo brahmā vidyāt sa id vādhūyamarhati	sūryām yaḥ brahmā vidyāt saḥ id vādhūyam arhati 
SA_GV01_rv_10_u-1800	RV_10.085.35.1{26} āśasanaṃ viśasanamatho adhivikartanam	āśasanam viśasanam atho adhivikartanam 
SA_GV01_rv_10_u-1801	RV_10.085.35.2{26} sūryāyaḥ paśyarūpāṇi tāni brahmā tu śundhati	sūrya ayaḥ paśya rūpāṇi tāni brahmā tu śundhati 
SA_GV01_rv_10_u-1802	RV_10.085.36.1{27} gṛbhṇāmi te saubhagatvāya hastaṃ mayā patyā jaradaṣṭiryathāsaḥ	gṛbhṇāmi te saubhaga tvāya hastam mayā patyā jaradaṣṭiḥ yathā asaḥ 
SA_GV01_rv_10_u-1803	RV_10.085.36.2{27} bhago aryamā savitā purandhirmahyaṃ tvādurgārhapatyāya devāḥ	bhagaḥ aryamā savitā purandhiḥ mahyam tvā a dus gārhapatyāya devāḥ 
SA_GV01_rv_10_u-1804	RV_10.085.37.1{27} tāṃ pūṣañchivatamāmerayasva yasyāṃ bījaṃ manuṣyāvapanti	tām pūṣan śivatamām erayasva yasyām bījam manuṣya āvapanti 
SA_GV01_rv_10_u-1805	RV_10.085.37.2{27} yā na ūrū uśatī viśrayāte yasyāmuśantaḥpraharāma śepam	yā naḥ ūrū uśatī viśrayāte yasyām uśantaḥ praharāma śepam 
SA_GV01_rv_10_u-1806	RV_10.085.38.1{27} tubhyamagre paryavahan sūryāṃ vahatunā saha	tubhyam agre paryavahan sūryām vahatunā saha 
SA_GV01_rv_10_u-1807	RV_10.085.38.2{27} punaḥpatibhyo jāyāṃ dā agne prajayā saha	punaḥpatibhyaḥ jāyām dāḥ agne prajayā saha 
SA_GV01_rv_10_u-1808	RV_10.085.39.1{27} punaḥ patnīmagniradādāyuṣā saha varcasā	punar patnīm agniḥ adāt āyuṣā saha varcasā 
SA_GV01_rv_10_u-1809	RV_10.085.39.2{27} dīrghāyurasyā yaḥ patirjīvāti śaradaḥ śatam	dīrgha āyuḥ asyāḥ yaḥ patiḥ jīvāti śaradaḥ śatam 
SA_GV01_rv_10_u-1810	RV_10.085.40.1{27} somaḥ prathamo vivide gandharvo vivida uttaraḥ	somaḥ prathamaḥ vivide gandharvaḥ vivide uttaraḥ 
SA_GV01_rv_10_u-1811	RV_10.085.40.2{27} tṛtīyoagniṣ ṭe patisturīyaste manuṣyajāḥ	tṛtīyaḥ agniḥ te patiḥ turīyaḥ te manuṣya jāḥ 
SA_GV01_rv_10_u-1812	RV_10.085.41.1{28} somo dadad gandharvāya gandharvo dadadagnaye	somaḥ dadat gandharvāya gandharvaḥ dadat agnaye 
SA_GV01_rv_10_u-1813	RV_10.085.41.2{28} rayiṃ caputrāṃścādādagnirmahyamatho imām	rayim ca putrān ca adāt agniḥ mahyam atha u imām 
SA_GV01_rv_10_u-1814	RV_10.085.42.1{28} ihaiva staṃ mā vi yauṣṭaṃ viśvamāyurvyaśnutam	iha eva stam mā vi viśvam āyuḥ vyaśnutam 
SA_GV01_rv_10_u-1815	RV_10.085.42.2{28} kṝḷantau putrairnaptṛbhirmodamānau sve gṛhe	kṝḷantau putraiḥ naptṛbhiḥ modamānau sve gṛhe 
SA_GV01_rv_10_u-1816	RV_10.085.43.1{28} ā naḥ prajāṃ hanayatu prajāpatirājarasāya samanaktvaryamā	ā naḥ prajām hanayatu prajāpatiḥ āja rasāya samanaktu aryamā 
SA_GV01_rv_10_u-1817	RV_10.085.43.2{28} adurmaṅgalīḥ patilokamā viśa śaṃ no bhavadvipade śaṃ catuṣpade	adurmaṅgalīḥ pati lokam ā viśa śam naḥ bhava dvipade śam catuṣpade 
SA_GV01_rv_10_u-1818	RV_10.085.44.1{28} aghoracakṣurapatighnyedhi śivā paśubhyaḥ sumanāḥsuvarcāḥ	aghora cakṣuḥ a pati ghnī edhi śivā paśubhyaḥ sumanāḥ suvarcāḥ 
SA_GV01_rv_10_u-1819	RV_10.085.44.2{28} vīrasūrdevakāmā syonā śaṃ no bhava dvipadeśaṃ catuṣpade	vīra sūḥ deva kāmā syonā śam naḥ bhava dvipade śam catuṣpade 
SA_GV01_rv_10_u-1820	RV_10.085.45.1{28} imāṃ tvamindra mīḍhvaḥ suputrāṃ subhagāṃ kṛṇu	imām tvam indra mīḍhvaḥ su putrām subhagām kṛṇu 
SA_GV01_rv_10_u-1821	RV_10.085.45.2{28} daśāsyāṃ putrānā dhehi patimekādaśaṃ kṛdhi	daśa asyām putrān ā dhehi patim ekādaśam kṛdhi 
SA_GV01_rv_10_u-1822	RV_10.085.46.1{28} samrājñī śvaśure bhava samrājñī śvaśrvāṃ bhava	samrājñī śvaśure bhava samrājñī śvaśrvām bhava 
SA_GV01_rv_10_u-1823	RV_10.085.46.2{28} nanāndari samrājñī bhava samrājñī adhi devṛṣu	nanāndari samrājñī bhava samrājñī adhi devṛṣu 
SA_GV01_rv_10_u-1824	RV_10.085.47.1{28} samañjantu viśve devāḥ samāpo hṛdayāni nau	samañjantu viśve devāḥ sama apaḥ hṛdayāni nau 
SA_GV01_rv_10_u-1825	RV_10.085.47.2{28} sammātariśvā saṃ dhātā samu deṣṭrī dadhātu nau	sam mātariśvā sam dhātā samu deṣṭrī dadhātu nau 
SA_GV01_rv_10_u-1826	RV_10.086.01.1{01} vi hi sotorasṛkṣata nendraṃ devamamaṃsata	vi hi sotoḥ asṛkṣata na indram devam amaṃsata 
SA_GV01_rv_10_u-1827	RV_10.086.01.2{01} yatrāmadadvṛṣākapiraryaḥ puṣṭeṣu matsakhā viśvasmādindrauttaraḥ	yatra amadat vṛṣākapiḥ aryaḥ puṣṭeṣu mad sakhā viśvasmāt indrauttaraḥ 
SA_GV01_rv_10_u-1828	RV_10.086.02.1{01} parā hīndra dhāvasi vṛṣākaperati vyathiḥ	parā hi indra dhāvasi vṛṣākapeḥ ati vyathiḥ 
SA_GV01_rv_10_u-1829	RV_10.086.02.2{01} no aha pravindasyanyatra somapītaye viśvasmādindra uttaraḥ	na u aha pravindasi anyatra soma pītaye viśvasmāt indraḥ uttaraḥ 
SA_GV01_rv_10_u-1830	RV_10.086.03.1{01} kimayaṃ tvāṃ vṛṣākapiścakāra harito mṛgaḥ	kim ayam tvām vṛṣākapiḥ cakāra haritaḥ mṛgaḥ 
SA_GV01_rv_10_u-1831	RV_10.086.03.2{01} yasmāirasyasīdu nvaryo vā puṣṭimad vasu viśvasmādindrauttaraḥ	nu aryaḥ vā puṣṭimat vasu viśvasmāt indra auttaraḥ 
SA_GV01_rv_10_u-1832	RV_10.086.04.1{01} yamimaṃ tvaṃ vṛṣākapiṃ priyamindrābhirakṣasi	yam imam tvam vṛṣākapim priyam indra abhirakṣasi 
SA_GV01_rv_10_u-1833	RV_10.086.04.2{01} śvā nvasya jambhis“adapi karṇe varahayurviśvasmadindra uttaraḥ	śvā nu asya jambhisad api karṇe vara hayuḥ viśvasmat indraḥ uttaraḥ 
SA_GV01_rv_10_u-1834	RV_10.086.05.1{01} priyā taṣṭāni me kapirvyaktā vyadūduṣat	priyā taṣṭāni me kapiḥ vyaktā vyadūduṣat 
SA_GV01_rv_10_u-1835	RV_10.086.05.2{01} śiro nvasya rāviṣaṃ na sugaṃ duṣkṛte bhuvaṃ viśvasmādindrauttaraḥ	śiraḥ nu asya rāviṣam na sugam duṣkṛte bhuvam viśvasmāt indrauttaraḥ 
SA_GV01_rv_10_u-1836	RV_10.086.06.1{02} na mat strī subhasattarā na suyāśutarā bhuvat	na mat strī subhasattarā na suyāśutarā bhuvat 
SA_GV01_rv_10_u-1837	RV_10.086.06.2{02} na matpraticyavīyasī na sakthyudyamīyasī viśvasmādindrauttaraḥ	na mat praticyavīyasī na sakthi udyamīyasī viśvasmāt indra auttaraḥ 
SA_GV01_rv_10_u-1838	RV_10.086.07.1{02} uve amba sulābhike yathevāṅga bhaviṣyati	amba su lābhike yathā iva aṅga bhaviṣyati 
SA_GV01_rv_10_u-1839	RV_10.086.07.2{02} bhasan me ambasakthi me śiro me vīva hṛṣyati viśvasmādindra uttaraḥ	bhasad me amba sakthi me śiraḥ me vi iva hṛṣyati viśvasmāt indraḥ uttaraḥ 
SA_GV01_rv_10_u-1840	RV_10.086.08.1{02} kiṃ subāho svaṅgure pṛthuṣṭo pṛthujāghane	kim su bāho su aṅgure 
SA_GV01_rv_10_u-1841	RV_10.086.08.2{02} kiṃ śūrapatninastvamabhyamīṣi vṛṣākapiṃ viśvasmādindra uttaraḥ	kim śūra patninaḥ tvam abhyamīṣi vṛṣākapim viśvasmāt indraḥ uttaraḥ 
SA_GV01_rv_10_u-1842	RV_10.086.09.1{02} avīrāmiva māmayaṃ śarārurabhi manyate	avīrām iva mām ayam śarāruḥ abhi manyate 
SA_GV01_rv_10_u-1843	RV_10.086.09.2{02} utāhamasmivīriṇīndrapatnī marutsakhā viśvasmādindra uttaraḥ	uta aham asmi vīriṇī indra patnī marut sakhā viśvasmāt indraḥ uttaraḥ 
SA_GV01_rv_10_u-1844	RV_10.086.10.1{02} saṃhotraṃ sma purā nārī samanaṃ vāva gachati	saṃhotram sma purā nārī samanam vāva gacchati 
SA_GV01_rv_10_u-1845	RV_10.086.10.2{02} vedhāṛtasya vīriṇīndrapatnī mahīyate viśvasmādindra uttaraḥ	vedhā aṛtasya vīriṇī indra patnī mahīyate viśvasmāt indraḥ uttaraḥ 
SA_GV01_rv_10_u-1846	RV_10.086.11.1{03} indrāṇīmāsu nāriṣu subhagāmahamaśravam	indrāṇi imāsu nāriṣu subhagām aham aśravam 
SA_GV01_rv_10_u-1847	RV_10.086.11.2{03} nahyasyāaparaṃ cana jarasā marate patirviśvasmādindra uttaraḥ	na hi asyāḥ aparam cana jarasā marate patiḥ viśvasmāt indraḥ uttaraḥ 
SA_GV01_rv_10_u-1848	RV_10.086.12.1{03} nāhamindrāṇi rāraṇa sakhyurvṛṣākaper{ṛ}te	na aham indrāṇi rāraṇa sakhyuḥ vṛṣākapeḥ ṛte 
SA_GV01_rv_10_u-1849	RV_10.086.12.2{03} yasyedamapyaṃ haviḥ priyaṃ deveṣu gachati viśvasmādindrauttaraḥ	yasya idam apyam haviḥ priyam deveṣu gacchati viśvasmāt indra auttaraḥ 
SA_GV01_rv_10_u-1850	RV_10.086.13.1{03} vṛṣākapāyi revati sūputra ādu susnuṣe	vṛṣākapāyi revati su putre ādu su snuṣe 
SA_GV01_rv_10_u-1851	RV_10.086.13.2{03} ghasat ta indraukṣaṇaḥ priyaṃ kācitkaraṃ havirviśvasmādindrauttaraḥ	ghasat te indraukṣaṇaḥ priyam kācitkaram haviḥ viśvasmāt indrauttaraḥ 
SA_GV01_rv_10_u-1852	RV_10.086.14.1{03} ukṣṇo hi me pañcadaśa sākaṃ pacanti viṃśatim	ukṣṇaḥ hi me pañcadaśa sākam pacanti viṃśatim 
SA_GV01_rv_10_u-1853	RV_10.086.14.2{03} utāhamadmi pīva idubhā kukṣī pṛṇanti me viśvasmādindrauttaraḥ	uta aham admi pīvaḥ id ubhā kukṣī pṛṇanti me viśvasmāt indra auttaraḥ 
SA_GV01_rv_10_u-1854	RV_10.086.15.1{03} vṛṣabho na tigmaśṛṅgo 'ntaryūtheṣu roruvat	vṛṣabhaḥ na tigma śṛṅgaḥ ntar yūtheṣu roruvat 
SA_GV01_rv_10_u-1855	RV_10.086.15.2{03} manthastaindra śaṃ hṛde yaṃ te sunoti bhāvayurviśvasmādindrauttaraḥ	manthaḥ taindra śam hṛde yam te sunoti bhāvayuḥ viśvasmāt indrauttaraḥ 
SA_GV01_rv_10_u-1856	RV_10.086.16.1{04} na seśe yasya rambate 'ntarā sakthyā kapṛt	na sa īśe yasya rambate ntarā kapṛth 
SA_GV01_rv_10_u-1857	RV_10.086.16.2{04} sedīśeyasya romaśaṃ niṣeduṣo vijṛmbhate viśvasmādindrauttaraḥ	romaśam niṣeduṣaḥ vijṛmbhate viśvasmāt indrauttaraḥ 
SA_GV01_rv_10_u-1858	RV_10.086.17.1{04} na seśe yasya romaśaṃ niṣeduṣo vijṛmbhate	na sa īśe yasya romaśam niṣeduṣaḥ vijṛmbhate 
SA_GV01_rv_10_u-1859	RV_10.086.17.2{04} sedīśeyasya rambate 'ntarā sakthyā kapṛd viśvasmādindrauttaraḥ	rambate ntarā kapṛth viśvasmāt indra auttaraḥ 
SA_GV01_rv_10_u-1860	RV_10.086.18.1{04} ayamindra vṛṣākapiḥ parasvantaṃ hataṃ vidat	ayam indra vṛṣākapiḥ parasvantam hatam vidat 
SA_GV01_rv_10_u-1861	RV_10.086.18.2{04} asiṃsūnāṃ navaṃ carumādedhasyāna ācitaṃ viśvasmādindra uttaraḥ	asiṃsūnām navam carum ā dedhasya anaḥ ācitam viśvasmāt indraḥ uttaraḥ 
SA_GV01_rv_10_u-1862	RV_10.086.19.1{04} ayamemi vicākaśad vicinvan dāsamāryam	ayam emi vicākaśat vicinvan dāsam āryam 
SA_GV01_rv_10_u-1863	RV_10.086.19.2{04} pibāmipākasutvano 'bhi dhīramacākaśaṃ viśvasmādindra uttaraḥ	pibāmipākasutvanaḥ bhi dhīram acākaśam viśvasmāt indraḥ uttaraḥ 
SA_GV01_rv_10_u-1864	RV_10.086.20.1{04} dhanva ca yat kṛntatraṃ ca kati svit tā vi yojanā	dhanva ca yat kṛntatram ca kati svid tā vi yojanā 
SA_GV01_rv_10_u-1865	RV_10.086.20.2{04} nedīyāso vṛṣākape 'stamehi gṛhānupa viśvasmādindrauttarah	nedīyāsaḥ vṛṣākape stam ehi gṛhān upa viśvasmāt indra auttaraḥ 
SA_GV01_rv_10_u-1866	RV_10.086.21.1{04} punarehi vṛṣākape suvitā kalpayāvahai	punar ehi vṛṣākape suvitā kalpayāvahai 
SA_GV01_rv_10_u-1867	RV_10.086.21.2{04} ya eṣasvapnanaṃśano 'stameṣi patha punarviśvasmādindrauttaraḥ	yaḥ stam eṣi patha punar viśvasmāt indra auttaraḥ 
SA_GV01_rv_10_u-1868	RV_10.086.22.1{04} yadudañco vṛṣākape gṛhamindrājagantana	yat udañcaḥ vṛṣākape gṛham indra ajagantana 
SA_GV01_rv_10_u-1869	RV_10.086.22.2{04} kva sya pulvaghomṛgaḥ kamagañ janayopano viśvasmādindra uttaraḥ	kva sya pulu aghaḥ mṛgaḥ kam agam jana yopanaḥ viśvasmāt indraḥ uttaraḥ 
SA_GV01_rv_10_u-1870	RV_10.086.23.1{04} parśurha nāma mānavi sākaṃ sasūva viṃśa tim	parśuḥ ha nāma mānavi sākam sasūva viṃśa tim 
SA_GV01_rv_10_u-1871	RV_10.086.23.2{04} bhadrambhala tyasyā abhūd yasyā udaramamayad viśvasmādindrauttaraḥ	bhadrambhala viśvasmāt indra auttaraḥ 
SA_GV01_rv_10_u-1872	RV_10.087.01.1{05} rakṣohaṇaṃ vājinamā jigharmi mitraṃ prathiṣṭhamupayāmi śarma	rakṣaḥ haṇam vājinam ā jigharmi mitram prathiṣṭham upayāmi śarma 
SA_GV01_rv_10_u-1873	RV_10.087.01.2{05} śiśāno agniḥ kratubhiḥ samiddhaḥ sa nodivā sa riṣaḥ pātu naktam	śiśānaḥ agniḥ kratubhiḥ samiddhaḥ sa naḥ divā sa riṣaḥ pātu naktam 
SA_GV01_rv_10_u-1874	RV_10.087.02.1{05} ayodaṃṣṭro arciṣā yātudhānānupa spṛśa jātavedaḥsamiddhaḥ	ayaḥ daṃṣṭraḥ arciṣā yātudhānān upa spṛśa jātavedaḥ samiddhaḥ 
SA_GV01_rv_10_u-1875	RV_10.087.02.2{05} ā jihvayā muradevān rabhasva kravyādo vṛktvyapi dhatsvāsan	ā jihvayā muradevān rabhasva kravyādaḥ vṛktvī api dhatsva āsan 
SA_GV01_rv_10_u-1876	RV_10.087.03.1{05} ubhobhayāvinnupa dhehi daṃṣṭrā hiṃsraḥ śiśāno 'varamparaṃ ca	ubhā ubhayāvin upa dhehi daṃṣṭrā hiṃsraḥ śiśānaḥ varamparam ca 
SA_GV01_rv_10_u-1877	RV_10.087.03.2{05} utāntarikṣe pari yāhi rājañ jambhaiḥ sandhehyabhi yātudhānān	uta antarikṣe pari yāhi rājam jambhaiḥ sandhehi abhi yātudhānān 
SA_GV01_rv_10_u-1878	RV_10.087.04.1{05} yajñairiṣūḥ saṃnamamāno agne vācā śalyānaśanibhirdihānaḥ	yajñaiḥ iṣūḥ saṃnamamānaḥ agne vācā śalyān aśanibhiḥ dihānaḥ 
SA_GV01_rv_10_u-1879	RV_10.087.04.2{05} tābhirvidhya hṛdaye yātudhānān pratīco bāhūnprati bhaṃdhyeṣām	tābhiḥ vidhya hṛdaye yātudhānān pratīcaḥ bāhūn prati bhaṃdhi eṣām 
SA_GV01_rv_10_u-1880	RV_10.087.05.1{05} agne tvacaṃ yātudhānasya bhindhi hiṃsrāśanirharasāhantvenam	agne tvacam yātudhānasya bhindhi hiṃsra aśaniḥ harasā ahantu enam 
SA_GV01_rv_10_u-1881	RV_10.087.05.2{05} pra parvāṇi jātavedaḥ śṛṇīhi kravyātkraviṣṇurvi cinotu vṛkṇam	pra parvāṇi jātavedaḥ śṛṇīhi kravyād kraviṣṇuḥ vi cinotu vṛkṇam 
SA_GV01_rv_10_u-1882	RV_10.087.06.1{06} yatredānīṃ paśyasi jātavedastiṣṭhantamagna uta vācarantam	yatra idānīm paśyasi jātavedaḥ tiṣṭhantam agne uta vā ācarantam 
SA_GV01_rv_10_u-1883	RV_10.087.06.2{06} yad vāntarikṣe pathibhiḥ patantaṃ tamastāvidhya śarvā śiśānaḥ	yat vā antarikṣe pathibhiḥ patantam śarvā śiśānaḥ 
SA_GV01_rv_10_u-1884	RV_10.087.07.1{06} utālabdhaṃ spṛṇuhi jātaveda ālebhānād ṛṣṭibhiryātudhānāt	uta ālabdham spṛṇuhi jātavedaḥ ālebhānāt ṛṣṭibhiḥ yātudhānāt 
SA_GV01_rv_10_u-1885	RV_10.087.07.2{06} agne pūrvo ni jahi śośucāna āmādaḥkṣviṅkāstamadantvenīḥ	agne pūrvaḥ ni jahi śośucānaḥ 
SA_GV01_rv_10_u-1886	RV_10.087.08.1{06} iha pra brūhi yatamaḥ so agne yo yātudhāno ya idaṃkṛṇoti	iha pra brūhi yatamaḥ saḥ agne yaḥ yātudhānaḥ yaḥ idaṃkṛṇoti 
