segmentnr	original	analyzed
SA_GK19_ragh1-6u-633	gaṅgāśīkariṇo mārge marutastaṃ siṣevire // Ragh(K)_4.76 //	gaṅgā śīkariṇaḥ mārge marutaḥ tam siṣevire 
SA_GK19_ragh1-6u-634	viśaśramurnamerūṇāṃ chāyāsvadhyāsya sainikāḥ /	viśaśramuḥ namerūṇām chāyāsu adhyāsya sainikāḥ 
SA_GK19_ragh1-6u-635	dṛṣado vāsitotsaṅgā niṣaṇṇamṛganābhibhiḥ // Ragh(K)_4.77 //	dṛṣadaḥ vāsita utsaṅgāḥ niṣaṇṇa mṛga nābhibhiḥ 
SA_GK19_ragh1-6u-636	saralāsaktamātaṅgagraiveyopacitatviṣaḥ /	sarala āsakta mātaṅga graiveya upacita tviṣaḥ 
SA_GK19_ragh1-6u-637	āsannoṣadhayo neturnaktamasnehadīpikāḥ // Ragh(K)_4.78 //	āsanna oṣadhayaḥ netuḥ naktam a sneha dīpikāḥ 
SA_GK19_ragh1-6u-638	tasyāvāseṣu dānārdrairgaṇḍabhittivighaṭṭanaiḥ /	tasya āvāseṣu dāna ārdraiḥ gaṇḍa bhitti vighaṭṭanaiḥ 
SA_GK19_ragh1-6u-639	gajavarṣma kirātebhyaḥ śaśaṃsurdevadāravaḥ // Ragh(K)_4.79 //	gaja varṣma kirātebhyaḥ śaśaṃsuḥ devadāravaḥ 
SA_GK19_ragh1-6u-640	vimardaḥ saha taistatra pārvatīyairabhūdraghoḥ /	vimardaḥ saha taiḥ tatra pārvatīyaiḥ abhūt raghoḥ 
SA_GK19_ragh1-6u-641	nārācakṣepaṇīyāśmaniṣpeṣotpatitānalaḥ // Ragh(K)_4.80 //	             
SA_GK19_ragh1-6u-642	śarairutsavasaṅketānsa kṛtvā karadānkṛtī /	śaraiḥ utsava saṅketān sa kṛtvā kara dān kṛtī 
SA_GK19_ragh1-6u-643	jayodāharaṇaṃ bāhvorgāpayāmāsa kinnarān // Ragh(K)_4.81 //	jaya udāharaṇam bāhvoḥ gāpayāmāsa kinnarān 
SA_GK19_ragh1-6u-644	parasparasya vijñātasteṣūpāyanapāṇiṣu /	parasparasya vijñātaḥ teṣu upāyana pāṇiṣu 
SA_GK19_ragh1-6u-645	rājñā himavataḥ sāro rājñaḥ sāro himādriṇā // Ragh(K)_4.82 //	rājñā himavataḥ sāraḥ rājñaḥ sāraḥ himādriṇā 
SA_GK19_ragh1-6u-646	tatrākṣobhyaṃ yaśorāśiṃ niveśyāvaruroha saḥ /	tatra akṣobhyam yaśaḥ rāśim niveśya avaruroha saḥ 
SA_GK19_ragh1-6u-647	paulastyatulitasyādrerādadāna iva hriyam // Ragh(K)_4.83 //	paulastya tulitasya adreḥ ādadānaḥ iva hriyam 
SA_GK19_ragh1-6u-648	cakampe tīrṇalauhitye tasminprāgjyotiṣeśvaraḥ /	cakampe tīrṇa lauhitye tasmin prāgjyotiṣa īśvaraḥ 
SA_GK19_ragh1-6u-649	tadgajālānatāṃ prāptaiḥ saha kālāgurudrumaiḥ // Ragh(K)_4.84 //	tad gajāla ānatām prāptaiḥ saha kālāguru drumaiḥ 
SA_GK19_ragh1-6u-650	na prasehe sa ruddhārkamanabhramayadurdinam /	na prasehe sa ruddha arkam anabhra maya durdinam 
SA_GK19_ragh1-6u-651	rathavaṃśarajo 'pyasya kuta eva patākinīm // Ragh(K)_4.85 //	ratha vaṃśa rajaḥ pi asya kutas eva patākinīm 
SA_GK19_ragh1-6u-652	tamīśaḥ kāmarūpāṇāmatyākhaṇḍalavikramam /	tam īśaḥ kāmarūpāṇām ati ākhaṇḍala vikramam 
SA_GK19_ragh1-6u-653	bheje bhinnakaṭairnāgairanyānuparurodha yaiḥ // Ragh(K)_4.86 //	bheje bhinna kaṭaiḥ nāgaiḥ anyān uparurodha yaiḥ 
SA_GK19_ragh1-6u-654	kāmarūpeśvarastasya hemapīṭhādhidevatām /	kāmarūpa īśvaraḥ tasya hema pīṭha adhidevatām 
SA_GK19_ragh1-6u-655	ratnapuṣpopahāreṇa cchāyāmānarca pādayoḥ // Ragh(K)_4.87 //	ratna puṣpa upahāreṇa chāyām ānarca pādayoḥ 
SA_GK19_ragh1-6u-656	iti jitvā diśo jiṣṇurnyavartata rathoddhatam /	iti jitvā diśaḥ jiṣṇuḥ nyavartata ratha uddhatam 
SA_GK19_ragh1-6u-657	rajo viśramayanrājñāṃ chattraśūnyeṣu mauliṣu // Ragh(K)_4.88 //	rajaḥ viśramayan rājñām chattra śūnyeṣu mauliṣu 
SA_GK19_ragh1-6u-658	sa viśvajitamājahre kratuṃ sarvasvadakṣiṇam /	sa viśvajitam ājahre kratum sarva sva dakṣiṇam 
SA_GK19_ragh1-6u-659	ādānaṃ hi visargāya satāṃ vārimucāmiva // Ragh(K)_4.89 //	ādānam hi visargāya satām vāri mucām iva 
SA_GK19_ragh1-6u-660	sattrānte sacivasakhaḥ puraskriyābhirgurvībhiḥ śamitaparājayavyalīkān /	sattra ante saciva sakhaḥ puraskriyābhiḥ gurvībhiḥ śamita parājaya vyalīkān 
SA_GK19_ragh1-6u-661	kākutsthaściravirahotsukāvarodhān rājanyānsvapuranivṛttaye 'numene // Ragh(K)_4.90 //	kākutsthaḥ cira viraha utsuka avarodhān rājanyān sva pura nivṛttaye numene 
SA_GK19_ragh1-6u-662	te rekhādhvajakalaśātapatracihnaṃ samrājaścaraṇayugaṃ prasādalabhyam /	te rekhā dhvaja kalaśa atapatra cihnam samrājaḥ caraṇa yugam prasāda labhyam 
SA_GK19_ragh1-6u-663	prasthānapraṇatibhiraṅgulīṣu cakrurmaulisrakcyutamakarandareṇugauram // Ragh(K)_4.91 //	prasthāna praṇatibhiḥ aṅgulīṣu cakruḥ mauli sraj cyuta makaranda reṇu gauram 
SA_GK19_ragh1-6u-664	// iti raghuvaṃśe mahākāvye caturthaḥ sargaḥ //	iti raghuvaṃśe mahākāvye caturthaḥ sargaḥ 
SA_GK19_ragh1-6u-665	tamadhvare viśvajiti kṣitīśaṃ niḥśeṣaviśrāṇitakośajātam /	tam adhvare viśvajiti kṣitīśam niḥśeṣa viśrāṇita kośa jātam 
SA_GK19_ragh1-6u-666	upāttavidyo gurudakṣiṇārthī kautsaḥ prapede varatantuśiṣyaḥ // Ragh(K)_5.1 //	upātta vidyaḥ guru dakṣiṇā arthī kautsaḥ prapede vara tantu śiṣyaḥ 
SA_GK19_ragh1-6u-667	sa mṛṇmaye vītahiraṇmayatvātpātre nidhāyārghyamanarghaśīlaḥ /	sa mṛṇmaye vīta hiraṇmaya tvāt pātre nidhāya arghyam anargha śīlaḥ 
SA_GK19_ragh1-6u-668	śrutaprakāśaṃ yaśasā prakāśaḥ pratyujjagāmātithimātitheyaḥ // Ragh(K)_5.2 //	śruta prakāśam yaśasā prakāśaḥ pratyujjagāma atithim ātitheyaḥ 
SA_GK19_ragh1-6u-669	tamarcayitvā vidhivadvidhijñastapodhanaṃ mānadhanāgrayāyī /	tam arcayitvā vidhivat vidhi jñaḥ tapodhanam māna dhana agra yāyī 
SA_GK19_ragh1-6u-670	kṛtāñjaliḥ kṛtyavicāradakṣo viśāmpatirviṣṭarabhājamāha // Ragh(K)_5.3 //	kṛtāñjaliḥ kṛtya vicāra dakṣaḥ viśām patiḥ viṣṭara bhājam āha 
SA_GK19_ragh1-6u-671	apyagraṇīrmantrakṛtāmṛṣīṇāṃ kuśāgrabuddhe kuśalī guruste /	api agraṇīḥ mantra kṛtām ṛṣīṇām kuśa agra buddhe kuśalī guruḥ te 
SA_GK19_ragh1-6u-672	yatastvayā jñānamaśeṣamāptaṃ caitanyamugrādiva dīkṣitena // Ragh(K)_5.4 //	yatas tvayā jñānam aśeṣam āptam caitanyam ugrāt iva dīkṣitena 
SA_GK19_ragh1-6u-673	kāyena vācā manasā ca taptaṃ yadvajriṇo dhairyaviparyayāya /	kāyena vācā manasā ca taptam yat vajriṇaḥ dhairya viparyayāya 
SA_GK19_ragh1-6u-674	āpādyate na vyayamantarāyaiḥ kaccinmaharṣestrividhaṃ tapastat // Ragh(K)_5.5 //	āpādyate na vyayam antarāyaiḥ kaccit mahā ṛṣeḥ trividham tapaḥ tat 
SA_GK19_ragh1-6u-675	ādhārabandhapramukhaiḥ prayatnaiḥ saṃvardhitānāṃ sutanirviśeṣam /	ādhāra bandha pramukhaiḥ prayatnaiḥ saṃvardhitānām suta nirviśeṣam 
SA_GK19_ragh1-6u-676	kaccinna vāyvādirupaplavo vaḥ śramacchidāmāśramapādapānām // Ragh(K)_5.6 //	kaccit na vāyu ādiḥ upaplavaḥ vaḥ śrama chidām āśrama pādapānām 
SA_GK19_ragh1-6u-677	kriyānimitteṣvapi vatsalatvādabhagnakāmā munibhiḥ kuśeṣu /	kriyā nimitteṣu api vatsala tvāt abhagna kāmā munibhiḥ kuśeṣu 
SA_GK19_ragh1-6u-678	tadaṅkaśayyācyutanābhinālā kaccinmṛgīṇāmanaghā prasūtiḥ // Ragh(K)_5.7 //	tad aṅka śayyā acyuta nābhi nālā kaccit mṛgīṇām anaghā prasūtiḥ 
SA_GK19_ragh1-6u-679	nirvartyate yairniyamābhiṣeko yato nivāpāñjalayaḥ pitṚṇām /	nirvartyate yaiḥ niyama abhiṣekaḥ yatas nivāpa añjalayaḥ pitṛṇām 
SA_GK19_ragh1-6u-680	tānyuñchaṣaṣṭhāṅkitasaikatāni śivāni vastīrthajalāni kaccit // Ragh(K)_5.8 //	tāni uñcha ṣaṣṭha aṅkita saikatāni śivāni vaḥ tīrtha jalāni kaccit 
SA_GK19_ragh1-6u-681	nīvārapākādi kaḍaṅgarīyairāmṛṣyate jānapadairna kaccit /	nīvāra pāka ādi kaḍaṅgarīyaiḥ āmṛṣyate jānapadaiḥ na kaccit 
SA_GK19_ragh1-6u-682	kālopapannātithibhāgadheyaṃ vanyaṃ śarīrasthitisādhanaṃ vaḥ // Ragh(K)_5.9 //	kāla upapanna atithi bhāgadheyam vanyam śarīra sthiti sādhanam vaḥ 
SA_GK19_ragh1-6u-683	api prasannena maharṣiṇā tvaṃ samyagvinīyānumato gṛhāya /	api prasannena mahā ṛṣiṇā tvam samyak vinīya anumataḥ gṛhāya 
SA_GK19_ragh1-6u-684	kālo hyayaṃ saṅkramituṃ dvitīyaṃ sarvopakārakṣamamāśramaṃ te // Ragh(K)_5.10 //	kālaḥ hi ayam saṅkramitum dvitīyam sarva upakāra kṣamam āśramam te 
SA_GK19_ragh1-6u-685	tavārhato nābhigamena tṛptaṃ mano niyogakriyayotsukaṃ me /	tava arhataḥ na abhigamena tṛptam manaḥ niyoga kriyayā utsukam me 
SA_GK19_ragh1-6u-686	apyājñayā śāsiturātmanā vā prāpto 'si sambhāvayituṃ vanānmām // Ragh(K)_5.11 //	api ājñayā śāsituḥ ātmanā vā prāptaḥ si sambhāvayitum vanāt mām 
SA_GK19_ragh1-6u-687	ityarghyapātrānumitavyayasya raghorudārāmapi gāṃ niśamya /	iti arghya pātra anumita vyayasya raghoḥ udārām api gām niśamya 
SA_GK19_ragh1-6u-688	svārthopapattiṃ prati durbalāśaḥ pratyāha kautsastamapetakutsam // Ragh(K)_5.12 //	sva artha upapattim prati durbala āśaḥ pratyāha kautsaḥ tam apeta kutsam 
SA_GK19_ragh1-6u-689	sarvatra no vārttamavaihi rājannāthe kutastvayyaśubhaṃ prajānām /	sarvatra naḥ vārttam avaihi rājan nāthe kutas tvayi aśubham prajānām 
SA_GK19_ragh1-6u-690	sūrye tapatyāvaraṇāya dṛṣṭeḥ kalpeta lokasya kathaṃ tamisrā // Ragh(K)_5.13 //	sūrye tapati āvaraṇāya dṛṣṭeḥ kalpeta lokasya katham tamisrā 
SA_GK19_ragh1-6u-691	bhaktiḥ pratīkṣyeṣu kulocitā te pūrvānmahābhāgatayātiśeṣe /	bhaktiḥ pratīkṣyeṣu kula ucitā te pūrvān mahābhāga tayā atiśeṣe 
SA_GK19_ragh1-6u-692	vyapetakālastvahamabhyupetastvāmarthibhāvāditi me viṣādaḥ // Ragh(K)_5.14 //	vyapeta kālaḥ tu aham abhyupetaḥ tvām arthi bhāvāt iti me viṣādaḥ 
SA_GK19_ragh1-6u-693	śarīramātreṇa narendra tiṣṭhannābhāsi tīrthapratipāditarddhiḥ /	śarīra mātreṇa narendra tiṣṭhan ābhāsi tīrtha pratipādita ṛddhiḥ 
SA_GK19_ragh1-6u-694	āraṇyakopāttaphalaprasūtiḥ stambena nīvāra ivāvaśiṣṭaḥ // Ragh(K)_5.15 //	āraṇyaka upātta phala prasūtiḥ stambena nīvāraḥ iva avaśiṣṭaḥ 
SA_GK19_ragh1-6u-695	sthāne bhavānekanarādhipaḥ san akiñcanatvaṃ makhajaṃ vyanakti /	sthāne bhavān eka narādhipaḥ san akiñcana tvam makha jam vyanakti 
SA_GK19_ragh1-6u-696	paryāyapītasya surairhimāṃśoḥ kalākṣayaḥ ślāghyataro hi vṛddheḥ // Ragh(K)_5.16 //	paryāya pītasya suraiḥ himāṃśoḥ kalā kṣayaḥ ślāghyataraḥ hi vṛddheḥ 
SA_GK19_ragh1-6u-697	tadanyatastāvadananyakāryo gurvarthamāhartumahaṃ yatiṣye /	tat anyatas tāvat ananya kāryaḥ guru artham āhartum aham yatiṣye 
SA_GK19_ragh1-6u-698	svastyastu te nirgalitāmbugarbhaṃ śaradghanaṃ nārdati cātako 'pi // Ragh(K)_5.17 //	svasti astu te nirgalita ambu garbham śarad ghanam na ardati 
SA_GK19_ragh1-6u-699	etāvaduktvā pratiyātukāmaṃ śiṣyaṃ maharṣernṛpatirniṣidhya /	etāvat uktvā pratiyātu kāmam śiṣyam mahā ṛṣeḥ nṛpatiḥ niṣidhya 
SA_GK19_ragh1-6u-700	kiṃ vastu vidvangurave pradeyaṃ tvayā kiyadveti tamanvayuṅkta // Ragh(K)_5.18 //	kim vastu vidvan gurave pradeyam tvayā kiyat vā iti tam anvayuṅkta 
SA_GK19_ragh1-6u-701	tato yathāvadvihitādhvarāya tasmai smayāveśavivarjitāya /	tatas yathāvat vihita adhvarāya tasmai smaya āveśa vivarjitāya 
SA_GK19_ragh1-6u-702	varṇāśramāṇāṃ gurave sa varṇī vicakṣaṇaḥ prastutamācacakṣe // Ragh(K)_5.19 //	varṇa āśramāṇām gurave sa varṇī vicakṣaṇaḥ prastutam ācacakṣe 
SA_GK19_ragh1-6u-703	avāptavidyena mayā maharṣirvijñāpito 'bhūdgurudakṣiṇāyai /	avāpta vidyena mayā mahā ṛṣiḥ vijñāpitaḥ bhūt guru dakṣiṇāyai 
SA_GK19_ragh1-6u-704	sa me cirādaskhalitopacārāṃ tāṃ bhaktimevāgaṇayatpurastāt // Ragh(K)_5.20 //	sa me cirāt askhalita upacārām tām bhaktim evā agaṇayat purastāt 
SA_GK19_ragh1-6u-705	nirbandhasañjātaruṣātha kārśyamacintayitvā guruṇāhamuktaḥ /	nirbandha sañjāta ruṣā atha kārśyam a cintayitvā guruṇā aham uktaḥ 
SA_GK19_ragh1-6u-706	vittasya vidyāparisaṅkhyayā me koṭīścatasro daśa cāhareti // Ragh(K)_5.21 //	vittasya vidyā parisaṅkhyayā me koṭīḥ catasraḥ daśa ca āhara iti 
SA_GK19_ragh1-6u-707	so 'haṃ saparyāvidhibhājanena matvā bhavantaṃ prabhuśabdaśeṣam /	saḥ ham saparyā vidhi bhājanena matvā bhavantam prabhu śabda śeṣam 
SA_GK19_ragh1-6u-708	abhyutsahe samprati noparoddhumalpetaratvācchrutaniṣkrayasya // Ragh(K)_5.22 //	abhyutsahe samprati nā uparoddhum alpa itara tvāt śruta niṣkrayasya 
SA_GK19_ragh1-6u-709	itthaṃ dvijena dvijarājakāntirāvedito vedavidāṃ vareṇa /	ittham dvijena dvijarāja kāntiḥ āveditaḥ veda vidām vareṇa 
SA_GK19_ragh1-6u-710	enonivṛttendriyavṛttirenaṃ jagāda bhūyo jagadekanāthaḥ // Ragh(K)_5.23 //	enaḥ nivṛtta indriya vṛttiḥ enam jagāda bhūyas jagadekanāthaḥ 
SA_GK19_ragh1-6u-711	gurvarthamarthī śrutapāradṛśvā raghoḥ sakāśādanavāptakāmaḥ /	guru artham arthī śruta pāra dṛśvā raghoḥ sakāśāt anavāpta kāmaḥ 
SA_GK19_ragh1-6u-712	gato vadanyāntaramityayaṃ me mā bhūtparīvādanavāvatāraḥ // Ragh(K)_5.24 //	gataḥ vadanya antaram iti ayam me mā 
SA_GK19_ragh1-6u-713	sa tvaṃ prayaste mahito madīye vasaṃścaturtho 'gnirivāgnyagāre /	sa tvam prayas te mahitaḥ madīye vasan caturthaḥ gniḥ iva agnyagāre 
SA_GK19_ragh1-6u-714	dvitrāṇyahānyarhasi soḍhumarhanyāvadyate sādhayituṃ tvadartham // Ragh(K)_5.25 //	dvitrāṇi ahāni arhasi soḍhum arhan yāvadyate sādhayitum tvad artham 
SA_GK19_ragh1-6u-715	tatheti tasyāvitathaṃ pratītaḥ pratyagrahītsaṅgaramagryajanmā /	tathā iti tasya avitatham pratītaḥ pratyagrahīt saṅgaram agrya janmā 
SA_GK19_ragh1-6u-716	gāmāttasārāṃ raghurapyavekṣya niṣkraṣṭumarthaṃ cakame kuverāt // Ragh(K)_5.26 //	gām ātta sārām raghuḥ api avekṣya niṣkraṣṭum artham cakame kuverāt 
SA_GK19_ragh1-6u-717	vasiṣṭhamantrokṣaṇajātprabhāvādudanvadākāśamahīdhareṣu /	vasiṣṭha mantra ukṣaṇa jāt prabhāvāt udanvat ākāśa mahīdhareṣu 
SA_GK19_ragh1-6u-718	marutsakhasyeva balāhakasya gatirvijaghne na hi tadrathasya // Ragh(K)_5.27 //	marut sakhasya iva balāhakasya gatiḥ vijaghne na hi tat rathasya 
SA_GK19_ragh1-6u-719	athādhiśiśye prayataḥ pradoṣe rathaṃ raghuḥ kalpitamastragarbham /	athā adhiśiśye prayataḥ pradoṣe ratham raghuḥ kalpitam astra garbham 
SA_GK19_ragh1-6u-720	sāmantasambhāvanayaiva dhīraḥ kailāsanāthaṃ tarasā jigīṣuḥ // Ragh(K)_5.28 //	sāmanta sambhāvanayā eva dhīraḥ kailāsa nātham tarasā jigīṣuḥ 
SA_GK19_ragh1-6u-721	prātaḥ prayāṇābhimukhāya tasmai savismayāgantumudo niyuktāḥ /	prātar prayāṇa abhimukhāya tasmai sa vismaya āgantu mudaḥ niyuktāḥ 
SA_GK19_ragh1-6u-722	hiraṇmayīṃ kośagṛhasya madhye vṛṣṭiṃ śaśaṃsuḥ patitāṃ nabhastaḥ // Ragh(K)_5.29 //	hiraṇmayīm kośagṛhasya madhye vṛṣṭim śaśaṃsuḥ patitām nabhastaḥ 
SA_GK19_ragh1-6u-723	taṃ bhūpatirbhāsvarahemarāśiṃ labdhaṃ kuverādabhiyāsyamānāt /	tam bhūpatiḥ bhāsvara hema rāśim labdham kuverāt abhiyāsyamānāt 
SA_GK19_ragh1-6u-724	dideśa kautsāya samagrameva pādaṃ sumeroriva vajrabhinnam // Ragh(K)_5.30 //	dideśa kautsāya samagram eva pādam sumeroḥ iva vajra bhinnam 
SA_GK19_ragh1-6u-725	janasya sāketanivāsinastau dvāvapyabhūtāmabhinandyasattvau /	janasya sāketa nivāsinaḥ tau dvau api abhūtām abhinandya sattvau 
SA_GK19_ragh1-6u-726	gurupradeyādhikaniḥspṛho 'rthī nṛpo 'rthikāmādadhikapradaśca // Ragh(K)_5.31 //	guru pradeya adhika niḥspṛhaḥ rthī nṛpaḥ rthi kāmāt adhika pradaḥ ca 
SA_GK19_ragh1-6u-727	athoṣṭravāmīśatahāritārthaṃ prajeśvaraṃ prītamanā manīṣī /	atha uṣṭra vāmī śata hārita artham prajā īśvaram prīta manāḥ manīṣī 
SA_GK19_ragh1-6u-728	spṛśankareṇānatapūrvakāyaṃ samprasthito vākyamuvāca kautsaḥ // Ragh(K)_5.32 //	spṛśan kareṇa ānata pūrva kāyam samprasthitaḥ vākyam uvāca kautsaḥ 
SA_GK19_ragh1-6u-729	kimatra citraṃ yadi kāmasūrbhūrvṛttasthitasyādhipateḥ prajānām /	kim atra citram yadi kāma sūḥ bhūḥ vṛtta sthitasya adhipateḥ prajānām 
SA_GK19_ragh1-6u-730	acintanīyastava tu prabhāvo manīṣitaṃ dyaurapi yena dugdhā // Ragh(K)_5.33 //	a cintanīyaḥ tava tu prabhāvaḥ manīṣitam dyauḥ api yena dugdhā 
SA_GK19_ragh1-6u-731	āśāsyamanyatpunaruktabhūtaṃ śreyāṃsi sarvāṇyadhijagmuṣaste /	āśāsyam anyat punar ukta bhūtam śreyāṃsi sarvāṇi adhijagmuṣaḥ te 
SA_GK19_ragh1-6u-732	putraṃ labhasvātmaguṇānurūpaṃ bhavantamīḍyo bhavataḥ piteva // Ragh(K)_5.34 //	putram labhasva ātma guṇa anurūpam bhavantam īḍyaḥ bhavataḥ pitā iva 
SA_GK19_ragh1-6u-733	itthaṃ prayujyāśiṣamagryajanmā rājñe pratīyāya guroḥ sakāśam /	ittham prayujya āśiṣam agrya janmā rājñe pratīyāya guroḥ sakāśam 
SA_GK19_ragh1-6u-734	rājāpi lebhe sutamāśu tasmād ālokamarkādiva jīvalokaḥ // Ragh(K)_5.35 //	rājā api lebhe sutam āśu tasmāt ālokam arkāt iva jīvalokaḥ 
SA_GK19_ragh1-6u-735	brāhme muhūrte kila tasya devī kumārakalpaṃ suṣuve kumāram /	brāhme muhūrte kila tasya devī kumāra kalpam suṣuve kumāram 
SA_GK19_ragh1-6u-736	ataḥ pitā brahmaṇa eva nāmnā tamagryajanmānamajaṃ cakāra // Ragh(K)_5.36 //	atas pitā brahmaṇaḥ eva nāmnā tam agrya janmānam ajam cakāra 
SA_GK19_ragh1-6u-737	rūpaṃ tadojasvi tadeva vīryaṃ tadeva naisargikamunnatatvam /	rūpam tat ojasvi tat eva vīryam tat eva naisargikam unnata tvam 
SA_GK19_ragh1-6u-738	na kāraṇātsvādbibhide kumāraḥ pravartito dīpa iva pradīpāt // Ragh(K)_5.37 //	na kāraṇāt svāt bibhide kumāraḥ pravartitaḥ dīpaḥ iva pradīpāt 
SA_GK19_ragh1-6u-739	upāttavidyaṃ vidhivadgurubhyastaṃ yauvanodbhedaviśeṣakāntam /	upātta vidyam vidhivat gurubhyaḥ tam yauvana udbheda viśeṣa kāntam 
SA_GK19_ragh1-6u-740	śrīḥ kāmayānāpi guroranujñāṃ dhīreva kanyā piturācakāṅkṣa // Ragh(K)_5.38 //	śrīḥ kāmayānā api guroḥ anujñām dhīrā iva kanyā pituḥ ācakāṅkṣa 
SA_GK19_ragh1-6u-741	atheśvareṇa krathakaiśikānāṃ svayaṃvarārthaṃ svasurindumatyāḥ /	atha īśvareṇa kratha kaiśikānām svayaṃvara artham svasuḥ indumatyāḥ 
SA_GK19_ragh1-6u-742	āptaḥ kumārānayanotsukena bhojena dūto raghave visṛṣṭaḥ // Ragh(K)_5.39 //	āptaḥ kumāra ānayana utsukena bhojena dūtaḥ raghave visṛṣṭaḥ 
SA_GK19_ragh1-6u-743	taṃ ślāghyasambandhamasau vicintya dārakriyāyogyadaśaṃ ca putram /	tam ślāghya sambandham asau vicintya dārakriyā yogya daśam ca putram 
SA_GK19_ragh1-6u-744	prasthāpayāmāsa sasainyamenamṛddhāṃ vidarbhādhiparājadhānīm // Ragh(K)_5.40 //	prasthāpayāmāsa sa sainyam enam ṛddhām vidarbha adhipa rājadhānīm 
SA_GK19_ragh1-6u-745	tasyopakāryāracitopakārā vandhyetarā jānapadopadhābhiḥ /	tasya upakāryā a racita upakārāḥ vandhyā itarāḥ jānapada upadhābhiḥ 
SA_GK19_ragh1-6u-746	mārge nivāsā manujendrasūnorbabhūvurudyānavihārakalpāḥ // Ragh(K)_5.41 //	mārge nivāsāḥ manuja indra sūnoḥ babhūvuḥ udyāna vihāra kalpāḥ 
SA_GK19_ragh1-6u-747	sa narmadārodhasi śīkarārdrairmarudbhirānartitaketumāle /	sa narmadā rodhasi śīkara ārdraiḥ marudbhiḥ ānartita ketumāle 
SA_GK19_ragh1-6u-748	niveśayāmāsa vilaṅghitādhvā senāṃ śramotphenavanāyujāśvām // Ragh(K)_5.42 //	niveśayāmāsa vilaṅghita adhvā senām śrama utphena vanāyu ja aśvām 
SA_GK19_ragh1-6u-749	athopariṣṭādbhramarairbhramadbhiḥ prāksūcitāntaḥsalilapraveśaḥ /	atha upariṣṭāt bhramaraiḥ bhramadbhiḥ prāc sūcita antar salila praveśaḥ 
SA_GK19_ragh1-6u-750	nirdhautadānāmalagaṇḍabhittirvanyaḥ saritto gaja unmamajja // Ragh(K)_5.43 //	nirdhauta dāna amalagaṇḍa bhittiḥ vanyaḥ sarittaḥ gajaḥ unmamajja 
SA_GK19_ragh1-6u-751	apyaughavikṣālitagairikeṇa vaprakriyāmṛkṣavatastaṭeṣu /	api augha vikṣālita gairikeṇa vapra kriyām ṛkṣavataḥ taṭeṣu 
SA_GK19_ragh1-6u-752	nīlordhvalekhāśavalena śaṃsandantadvayenāśmavikuṇṭhitena // Ragh(K)_5.44 //	nīla ūrdhva lekhā śavalena śaṃsan danta dvayena aśma vikuṇṭhitena 
SA_GK19_ragh1-6u-753	saṃhāravikṣepalaghukriyeṇa hastena tīrābhimukhaḥ saśabdam /	saṃhāra vikṣepa laghu kriyeṇa hastena tīra abhimukhaḥ sa śabdam 
SA_GK19_ragh1-6u-754	babhau sa bhindansahasā taraṅgānvāryargalābhaṅga iva pravṛttaḥ // Ragh(K)_5.45 //	babhau sa bhindan sahasā taraṅgān vāri argala ābhaṅgaḥ iva pravṛttaḥ 
SA_GK19_ragh1-6u-755	kāraṇḍavocchiṣṭamṛdupratānāḥ pulindayoṣāmbuvihārakāñcīḥ /	kāraṇḍava ucchiṣṭa mṛdu pratānāḥ pulinda yoṣā ambu vihāra kāñcīḥ 
SA_GK19_ragh1-6u-756	karṣansa śevālalatā nadīṣṇaḥ prohāvalagnāstaṭamutsasarpa // Ragh(K)_5.46 //	karṣan sa śevāla latāḥ nadīṣṇaḥ proha avalagnāḥ taṭam utsasarpa 
SA_GK19_ragh1-6u-757	tasyaikanāgasya kapolabhittyorhradāvagāhakṣaṇamātraśāntā /	tasya eka nāgasya kapola bhittyoḥ hrada avagāha kṣaṇa mātra śāntā 
SA_GK19_ragh1-6u-758	vanyetarānekapadarśanena punardidīpe madadurdinaśrīḥ // Ragh(K)_5.47 //	vanya itara an eka pada rśanena punar didīpe mada durdina śrīḥ 
SA_GK19_ragh1-6u-759	saptacchadakṣīrakaṭupravāhamasahyamāghrāya madaṃ tadīyam /	saptacchada kṣīra kaṭu pravāham asahyam āghrāya madam tadīyam 
SA_GK19_ragh1-6u-760	vilaṅghitādhoraṇatīvrayatnāḥ senāgajendrā vimukhā babhūvuḥ // Ragh(K)_5.48 //	vilaṅghita ādhoraṇa tīvra yatnāḥ senā gaja indrāḥ vimukhāḥ babhūvuḥ 
SA_GK19_ragh1-6u-761	sa cchinnabandhadrutayugyaśūnyaṃ bhagnākṣaparyastarathaṃ kṣaṇena /	sa chinna bandha druta yugya śūnyam bhagna akṣa paryasta ratham kṣaṇena 
SA_GK19_ragh1-6u-762	rāmāparitrāṇavihastayodhaṃ senāniveśaṃ tumulaṃ cakāra // Ragh(K)_5.49 //	rāmā paritrāṇa vihasta yodham senā niveśam tumulam cakāra 
SA_GK19_ragh1-6u-763	tamāpatantaṃ nṛpateravadhyo vanyaḥ karīti śrutavānkumāraḥ /	tam āpatantam nṛpateḥ avadhyaḥ vanyaḥ karī iti śrutavān kumāraḥ 
SA_GK19_ragh1-6u-764	nivartayiṣyanviśikhena kumbhe jaghāna nātyāyatakṛṣṭaśārṅgaḥ // Ragh(K)_5.50 //	nivartayiṣyan viśikhena kumbhe jaghāna na ati āyata kṛṣṭa śārṅgaḥ 
SA_GK19_ragh1-6u-765	sa viddhamātraḥ kila nāgarūpamutsṛjya tadvismitasainyadṛṣṭaḥ /	sa viddha mātraḥ kila nāga rūpam utsṛjya tad vismita sainya dṛṣṭaḥ 
SA_GK19_ragh1-6u-766	sphuratprabhāmaṇḍalamadhyavarti kāntaṃ vapurvyomacaraṃ prapede // Ragh(K)_5.51 //	sphurat prabhā maṇḍala madhya varti kāntam vapuḥ vyoma caram prapede 
SA_GK19_ragh1-6u-767	atha prabhāvopanataiḥ kumāraṃ kalpadrumotthairavakīrya puṣpaiḥ /	atha prabhāva upanataiḥ kumāram kalpadruma utthaiḥ avakīrya puṣpaiḥ 
SA_GK19_ragh1-6u-768	uvāca vāgmī daśanaprabhābhiḥ saṃvardhitoraḥsthalatārahāraḥ // Ragh(K)_5.52 //	uvāca vāgmī daśana prabhābhiḥ saṃvardhita uraḥsthala tāra hāraḥ 
SA_GK19_ragh1-6u-769	mataṅgaśāpādavalepamūlādavāptavānasmi mataṅgajatvam /	mataṅga śāpāt avalepa mūlāt avāptavān asmi mataṅga ja tvam 
SA_GK19_ragh1-6u-770	avaihi gandharvapatestanūjaṃ priyaṃvadaṃ māṃ priyadarśanasya // Ragh(K)_5.53 //	avaihi gandharva pateḥ tanūjam priyaṃvadam mām priya darśanasya 
SA_GK19_ragh1-6u-771	sa cānunītaḥ praṇatena paścānmayā maharṣirmṛdutāmagacchat /	sa ca anunītaḥ praṇatena paścāt mayā mahā ṛṣiḥ mṛdu tām agacchat 
SA_GK19_ragh1-6u-772	uṣṇatvamagnyātapasamprayogācchaityaṃ hi yatsā prakṛtirjalasya // Ragh(K)_5.54 //	uṣṇa tvam agni ātapa samprayogāt śaityam hi yat sā prakṛtiḥ jalasya 
SA_GK19_ragh1-6u-773	ikṣvākuvaṃśaprabhavo yadā te bhetsyatyajaḥ kumbhamayomukhena /	ikṣvāku vaṃśa prabhavaḥ yadā te bhetsyati ajaḥ kumbham ayomukhena 
SA_GK19_ragh1-6u-774	saṃyokṣyase svena punarmahimnā tadetyavocatsa taponidhirmām // Ragh(K)_5.55 //	saṃyokṣyase svena punar mahimnā tadā iti avocat sa taponidhiḥ mām 
SA_GK19_ragh1-6u-775	sa mocitaḥ śāpakalestvayāhaṃ gatiṃ prapanno vihitāṃ vidhātrā /	sa mocitaḥ śāpa kaleḥ tvayā aham gatim prapannaḥ vihitām vidhātrā 
SA_GK19_ragh1-6u-776	pratikriyāṃ cedbhavato na kuryāṃ vyarthā hi me syātsvapadopalabdhiḥ // Ragh(K)_5.56 //	pratikriyām ced bhavataḥ na kuryām vyarthā hi me syāt sva pada upalabdhiḥ 
SA_GK19_ragh1-6u-777	gāndharvamastraṃ taditaḥ pratīccha prayogasaṃhāravibhaktamantram /	gāndharvam astram tat itas pratīccha prayoga saṃhāra vibhakta mantram 
SA_GK19_ragh1-6u-778	prasvāpanaṃ nāma yataḥ praharturna cārihiṃsā vijayaśca haste // Ragh(K)_5.57 //	prasvāpanam nāma yatas prahartuḥ na ca ari hiṃsā vijayaḥ ca haste 
SA_GK19_ragh1-6u-779	alaṃ hriyā māṃ prati yanmuhūrtaṃ dayāparo 'bhūḥ praharannapi tvam /	alam hriyāḥ mām prati yat muhūrtam dayā paraḥ bhūḥ praharan api tvam 
SA_GK19_ragh1-6u-780	tasmādupacchandayati prayojyaṃ mayi tvayā na pratiṣedharaukṣyam // Ragh(K)_5.58 //	tasmāt upacchandayati prayojyam mayi tvayā na pratiṣedha raukṣyam 
SA_GK19_ragh1-6u-781	tathetyupaspṛśya payaḥ pavitraṃ somodbhavāyāḥ sarito nṛsomaḥ /	tathā iti upaspṛśya payaḥ pavitram soma udbhavāyāḥ saritaḥ nṛsomaḥ 
