segmentnr	original	analyzed
SA_GR14_astavgpu-562	ātma-viśrānti-tṛptena nirāśena gatārtinā /	ātma viśrānti tṛptena nirāśena gata ārtinā 
SA_GR14_astavgpu-563	antar yad anubhūyeta tat kathaṃ kasya kathyate // Avg_18.93 //	antar yat anubhūyeta tat katham kasya kathyate 
SA_GR14_astavgpu-564	supto 'pi na suṣuptau ca svapne 'pi śayito na ca /	na suṣuptau ca svapne pi śayitaḥ na ca 
SA_GR14_astavgpu-565	jāgare 'pi na jāgarti dhīras tṛptaḥ pade pade // Avg_18.94 //	jāgare pi na jāgarti dhīraḥ tṛptaḥ pade pade 
SA_GR14_astavgpu-566	jñaḥ sacinto 'pi niścintaḥ sendriyo 'pi nirindriyaḥ /	jñaḥ sa cintaḥ u pi niścintaḥ sa indriyaḥ u pi nirindriyaḥ 
SA_GR14_astavgpu-567	sabuddhir api nirbuddhiḥ sāhaṅkāro 'nahaṃkṛtiḥ // Avg_18.95 //	sa buddhiḥ api nirbuddhiḥ sa ahaṅkāraḥ na ahaṃkṛtiḥ 
SA_GR14_astavgpu-568	na sukhī na ca vā duḥkhī na virakto na saṅgavān /	na sukhī na ca vā duḥkhī na viraktaḥ na saṅgavān 
SA_GR14_astavgpu-569	na mumukṣur na vā mukto na kiṃcin na ca kiṃcana // Avg_18.96 //	na mumukṣuḥ na vā muktaḥ na kiṃcid na ca kiṃcana 
SA_GR14_astavgpu-570	vikṣepe 'pi na vikṣiptaḥ samādhau na samādhimān /	vikṣepe na vikṣiptaḥ samādhau na samādhimān 
SA_GR14_astavgpu-571	jāḍye 'pi na jaḍo dhanyaḥ pāṇḍitye 'pi na paṇḍitaḥ // Avg_18.97 //	jāḍye pi na jaḍaḥ dhanyaḥ pāṇḍitye pi na paṇḍitaḥ 
SA_GR14_astavgpu-572	mukto yathā-sthiti-svasthaḥ kṛta-kartavya-nirvṛtaḥ /	muktaḥ yathā sthiti svasthaḥ kṛta kartavya nirvṛtaḥ 
SA_GR14_astavgpu-573	samaḥ sarvatra vaitṛṣṇyān na smaraty akṛtaṃ kṛtam // Avg_18.98 //	samaḥ sarvatra vaitṛṣṇyāt na smarati a kṛtam kṛtam 
SA_GR14_astavgpu-574	na prīyate vandyamāno nindyamāno na kupyati /	na prīyate vandyamānaḥ nindyamānaḥ na kupyati 
SA_GR14_astavgpu-575	naivodvijati maraṇe jīvane nābhinandati // Avg_18.99 //	na eva udvijati maraṇe jīvane na abhinandati 
SA_GR14_astavgpu-576	na dhāvati janākīrṇaṃ nāraṇyam upaśānta-dhīḥ /	na dhāvati jana ākīrṇam na araṇyam upaśānta dhīḥ 
SA_GR14_astavgpu-577	yathā-tathā yatra-tatra sama evāvatiṣṭhate // Avg_18.100 //	yathā tathā yatra tatra samaḥ eva avatiṣṭhate 
SA_GR14_astavgpu-578	janaka uvāca	janakaḥ uvāca 
SA_GR14_astavgpu-579	tattva-vijñāna-sandaṃśam ādāya hṛdayodarāt /	tattva vijñāna sandaṃśam ādāya hṛdaya udarāt 
SA_GR14_astavgpu-580	nānā-vidha-parāmarśa-śalyoddhāraḥ kṛto mayā // Avg_19.1 //	nānāvidha parāmarśa śalya uddhāraḥ kṛtaḥ mayā 
SA_GR14_astavgpu-581	kva dharmaḥ kva ca vā kāmaḥ kva cārthaḥ kva vivekitā /	kva dharmaḥ kva ca vā kāmaḥ kva ca arthaḥ kva viveki tā 
SA_GR14_astavgpu-582	kva dvaitaṃ kva ca vādvaitaṃ svamahimni sthitasya me // Avg_19.2 //	kva dvaitam kva ca vā advaitam sva mahimni sthitasya me 
SA_GR14_astavgpu-583	kva bhūtaṃ kva bhaviṣyad vā vartamānam api kva vā /	kva bhūtam kva bhaviṣyat vā vartamānam api kva vā 
SA_GR14_astavgpu-584	kva deśaḥ kva ca vā nityaṃ svamahimni sthitasya me // Avg_19.3 //	kva deśaḥ kva ca vā nityam sva mahimni sthitasya me 
SA_GR14_astavgpu-585	kva cātmā kva ca vānātmā kva śubhaṃ kvāsubhaṃ yathā /	kva ca ātmā kva ca vā anātmā kva śubham kva asubham yathā 
SA_GR14_astavgpu-586	kva cintā kva ca vācintā svamahimni sthitasya me // Avg_19.4 //	kva cintā kva ca vā acintā sva mahimni sthitasya me 
SA_GR14_astavgpu-587	kva svapnaḥ kva suṣuptir vā kva ca jāgaraṇaṃ tathā /	kva svapnaḥ kva suṣuptiḥ vā kva ca jāgaraṇam tathā 
SA_GR14_astavgpu-588	kva turiyaṃ bhayaṃ vāpi svamahimni sthitasya me // Avg_19.5 //	kva bhayam vā api sva mahimni sthitasya me 
SA_GR14_astavgpu-589	kva dūraṃ kva samīpaṃ vā bahyaṃ kvābhyantaraṃ kva vā /	kva dūram kva samīpam vā bahyam kva abhyantaram kva vā 
SA_GR14_astavgpu-590	kva sthūlaṃ kva ca vā sūkṣmaṃ svamahimni sthitasya me // Avg_19.6 //	kva sthūlam kva ca vā sūkṣmam sva mahimni sthitasya me 
SA_GR14_astavgpu-591	kva mṛtyur-jīvitaṃ vā kva lokāḥ kvāsya kva laukikam /	kva mṛtyuḥ jīvitam vā kva lokāḥ kva asya kva laukikam 
SA_GR14_astavgpu-592	kva layaḥ kva samādhir vā svamahimni sthitasya me // Avg_19.7 //	kva layaḥ kva samādhiḥ vā sva mahimni sthitasya me 
SA_GR14_astavgpu-593	alaṃ tri-varga-kathayā yogasya kathayāpy alam /	alam trivarga kathayā yogasya kathayā api alam 
SA_GR14_astavgpu-594	alaṃ vijñāna-kathayā viśrāntasya mamātmani // Avg_19.8 //	alam vijñāna kathayā viśrāntasya mama ātmani 
SA_GR14_astavgpu-595	janaka uvāca	janakaḥ uvāca 
SA_GR14_astavgpu-596	kva bhūtāni kva deho vā kvendriyāṇi kva vā manaḥ /	kva bhūtāni kva dehaḥ vā kva indriyāṇi kva vā manaḥ 
SA_GR14_astavgpu-597	kva śūnyaṃ kva ca nairāśyaṃ mat-svarūpe nirañjane // Avg_20.1 //	kva śūnyam kva ca nairāśyam mad sva rūpe nirañjane 
SA_GR14_astavgpu-598	kva śāstraṃ kvātma-vijñānaṃ kva vā nirviṣayaṃ manaḥ /	kva śāstram kva ātma vijñānam kva vā nirviṣayam manaḥ 
SA_GR14_astavgpu-599	kva tṛptiḥ kva vitṛṣṇatvaṃ gata-dvandvasya me sadā // Avg_20.2 //	kva tṛptiḥ kva vitṛṣṇa tvam gata dvandvasya me sadā 
SA_GR14_astavgpu-600	kva vidyā kva ca vāvidyā kvāhaṃ kvedaṃ mama kva vā /	kva vidyā kva ca vā avidyā kva aham kva idam mama kva vā 
SA_GR14_astavgpu-601	kva bandhaḥ kva ca vā mokṣaḥ svarūpasya kva rūpitā // Avg_20.3 //	kva bandhaḥ kva ca vā mokṣaḥ sva rūpasya kva rūpi tā 
SA_GR14_astavgpu-602	kva prārabdhāni karmāṇi jīvan-muktir api kva vā /	kva prārabdhāni karmāṇi jīvanmuktiḥ api kva vā 
SA_GR14_astavgpu-603	kva tad videha-kaivalyaṃ nirviśeṣasya sarvadā // Avg_20.4 //	kva tat videha kaivalyam nirviśeṣasya sarvadā 
SA_GR14_astavgpu-604	kva kartā kva ca vā bhoktā niṣkriyaṃ sphuraṇaṃ kva vā /	kva kartā kva ca vā bhoktā niṣkriyam sphuraṇam kva vā 
SA_GR14_astavgpu-605	kvāparokṣaṃ phalaṃ vā kva niḥsvabhāvasya me sadā // Avg_20.5 //	kva aparokṣam phalam vā kva niḥsvabhāvasya me sadā 
SA_GR14_astavgpu-606	kva lokaḥ kva mumukṣur vā kva yogī jñānavān kva vā /	kva lokaḥ kva mumukṣuḥ vā kva yogī jñānavān kva vā 
SA_GR14_astavgpu-607	kva baddhaḥ kva ca vā muktaḥ sva-svarūpe 'ham advaye // Avg_20.6 //	kva baddhaḥ kva ca vā muktaḥ sva svarūpe ham advaye 
SA_GR14_astavgpu-608	kva sṛṣṭiḥ kva ca saṃhāraḥ kva sādhyaṃ kva ca sādhanam /	kva sṛṣṭiḥ kva ca saṃhāraḥ kva sādhyam kva ca sādhanam 
SA_GR14_astavgpu-609	kva sādhakaḥ kva siddhir vā svasvarūpe 'ham advaye // Avg_20.7 //	kva sādhakaḥ kva siddhiḥ vā sva svarūpe ham advaye 
SA_GR14_astavgpu-610	kva pramātā pramāṇaṃ vā kva prameyaṃ kva ca pramā /	kva pramātā pramāṇam vā kva prameyam kva ca pramā 
SA_GR14_astavgpu-611	kva kiṃcit kva na kiṃcid vā sarvadā vimalasya me // Avg_20.8 //	kva kiṃcid kva na kiṃcid vā sarvadā vimalasya me 
SA_GR14_astavgpu-612	kva vikṣepaḥ kva caikagryaṃ kva nirbodhaḥ kva mūḍhatā /	kva vikṣepaḥ kva ca aikagryam kva nirbodhaḥ kva mūḍha tā 
SA_GR14_astavgpu-613	kva harṣaḥ kva viṣādo vā sarvadā niṣkriyasya me // Avg_20.9 //	kva harṣaḥ kva viṣādaḥ vā sarvadā niṣkriyasya me 
SA_GR14_astavgpu-614	kva caiṣa vyavahāro vā kva ca sā paramārthatā /	kva ca eṣa vyavahāraḥ vā kva ca sā parama artha tā 
SA_GR14_astavgpu-615	kva sukhaṃ kva ca vā dukhaṃ nirvimarśasya me sadā // Avg_20.10 //	kva sukham kva ca vā dukham nirvimarśasya me sadā 
SA_GR14_astavgpu-616	kva māyā kva ca saṃsāraḥ kva prītir viratiḥ kva vā /	kva māyā kva ca saṃsāraḥ kva prītiḥ viratiḥ kva vā 
SA_GR14_astavgpu-617	kva jīvaḥ kva ca tad-brahma sarvadā vimalasya me // Avg_20.11 //	kva jīvaḥ kva ca tat brahma sarvadā vimalasya me 
SA_GR14_astavgpu-618	kva pravṛttir nirvṛttir vā kva muktiḥ kva ca bandhanam /	kva pravṛttiḥ nirvṛttiḥ vā kva muktiḥ kva ca bandhanam 
SA_GR14_astavgpu-619	kūṭastha-nirvibhāgasya svasthasya mama sarvadā // Avg_20.12 //	kūṭastha nirvibhāgasya svasthasya mama sarvadā 
SA_GR14_astavgpu-620	kvopadeśaḥ kva vā śāstraṃ kva śiṣyaḥ kva ca vā guruḥ /	kva upadeśaḥ kva vā śāstram kva śiṣyaḥ kva ca vā guruḥ 
SA_GR14_astavgpu-621	kva cāsti puruṣārtho vā nirupādheḥ śivasya me // Avg_20.13 //	kva ca asti puruṣa arthaḥ vā nirupādheḥ śivasya me 
SA_GR14_astavgpu-622	kva cāsti kva ca vā nāsti kvāsti caikaṃ kva ca dvayam /	kva ca asti kva ca vā na asti kva asti ca ekam kva ca dvayam 
SA_GR14_astavgpu-623	bahunātra kim uktena kiṃcin nottiṣṭhate mama // Avg_20.14 //	bahunā atra kim uktena kiṃcid nā uttiṣṭhate mama 
