segmentnr	original	analyzed
SA_GR14_ss4_krsu-5667	adhyakṣaś ca san yaś carati krīḍati sa eva prakaṭa-līlā-gato'pi bhūtvā	adhyakṣaḥ ca san yaḥ carati krīḍati saḥ eva prakaṭa līlā gataḥ api bhūtvā 
SA_GR14_ss4_krsu-5668	sarveṣāṃ viśva-vartināṃ dehinām api krīḍana-deha-bhāk san teṣāṃ	sarveṣām viśva vartinām dehinām api krīḍana deha bhāj san teṣām 
SA_GR14_ss4_krsu-5669	pālakatvenādhyakṣo'pi san carati /	pālaka tvena adhyakṣaḥ api san carati 
SA_GR14_ss4_krsu-5670	tasmād anādita eva tābhiḥ krīḍā-śālitvena	tasmāt anāditas eva tābhiḥ krīḍā śāli tvena 
SA_GR14_ss4_krsu-5671	svīkṛtatvāt tac-chakti-rūpāṇāṃ tāsāṃ saṅgame vastuta eva para-dāratā-	svīkṛta tvāt tad śakti rūpāṇām tāsām saṅgame vastutas eva para dāra tā 
SA_GR14_ss4_krsu-5672	doṣo'pi nāsti /	doṣaḥ api na asti 
SA_GR14_ss4_krsu-5673	tatas teṣāṃ tat-patitvaṃ ca /	tatas teṣām tad pati tvam ca 
SA_GR14_ss4_krsu-5674	nāsūyan khalu kṛṣṇāya [BhP 10.33.37] ityādi-	na asūyan khalu kṛṣṇāya ityādi 
SA_GR14_ss4_krsu-5675	vakṣyamāṇa-diśā,	vakṣyamāṇa diśā 
SA_GR14_ss4_krsu-5676	teṣāṃ tāsāṃ ca prātītika-mātraṃ na tu daihikam / tādṛśa-	teṣām tāsām ca prātītika mātram na tu daihikam 
SA_GR14_ss4_krsu-5677	pratīti-sampādanaṃ ca tāsām utkaṇṭhāpoṣārtham iti tat-prakaraṇa-	pratīti sampādanam ca tāsām utkaṇṭhā poṣa artham iti tad prakaraṇa 
SA_GR14_ss4_krsu-5678	siddhāntasya parākāṣṭhā darśitā //	siddhāntasya parākāṣṭhā darśitā 
SA_GR14_ss4_krsu-5679	// 10.33 // śrī-śukaḥ // 171 //	ro-0 śrī śukaḥ 
SA_GR14_ss4_krsu-5680	(page 88) [172]	page 
SA_GR14_ss4_krsu-5681	evaṃ tat-tal-līlā-bhedenaikasyāpi tat-tat-sthānasya prakāśa-bhedaḥ śrī-	evam tad tad līlā bhedena ekasya api tad tad sthānasya prakāśa bhedaḥ śrī 
SA_GR14_ss4_krsu-5682	vigrahavat /	vigrahavat 
SA_GR14_ss4_krsu-5683	tad uktam - vṛṣṇaḥ paramaṃ padam avabhāti bhūri iti śrutyā /	tat uktam vṛṣṇaḥ paramam padam avabhāti bhūri iti śrutyā 
SA_GR14_ss4_krsu-5684	tatra tv itara-līlāntaḥ-pātibhiḥ prāyaśa itara-līlāvakāśa-viśeṣo nopalabhyate /	tatra tu itara līlā antaḥpātibhiḥ prāyaśas itara līlā avakāśa viśeṣaḥ na upalabhyate 
SA_GR14_ss4_krsu-5685	dṛśyate ca prakaṭa-līlāyām apy asaṅkarībhāvenaiva vicitrāvakāśatvam /	dṛśyate ca prakaṭa līlāyām api asaṅkarībhāvena eva vicitra avakāśa tvam 
SA_GR14_ss4_krsu-5686	yathā dvādaśa-yojana-mātra-pramitāyām eva dvārakāntaḥ-puryāṃ krośa-	yathā dvādaśa yojana mātra pramitāyām eva dvārakā antaḥpuryām krośa 
SA_GR14_ss4_krsu-5687	dvaya-pramita-gṛha-koṭi-prabhṛti-vastūni /	dvaya pramita gṛha koṭi prabhṛti vastūni 
SA_GR14_ss4_krsu-5688	yathā svalpe govardhana-garte tad-	yathā su alpe govardhana garte tat 
SA_GR14_ss4_krsu-5689	asaṅkhya-gokula-praveśaḥ /	asaṅkhya gokula praveśaḥ 
SA_GR14_ss4_krsu-5690	yathā brahmaṇā dṛṣṭyā vṛndāvanasya sa-vṛkṣa-	yathā brahmaṇā dṛṣṭyā vṛndāvanasya 
SA_GR14_ss4_krsu-5691	tṛṇa-pakṣyādy-avakāśatā brahmāṇḍādy-ananta-vastv-avakāśatā ca / yathā	tṛṇa pakṣi ādi avakāśa tā brahmāṇḍa ādi ananta vastu avakāśa tā ca yathā 
SA_GR14_ss4_krsu-5692	ca śrī-nārada-dṛṣṭa-yoga-māyā-vaibhave sama-kālam eva dvārakāyāṃ	ca śrī nārada dṛṣṭa yoga māyā vaibhave sama kālam eva dvārakāyām 
SA_GR14_ss4_krsu-5693	prātastya-mādhyāhnika-sāyantana-līlā ity ādi /	prātastya mādhyāhnika sāyantana līlāḥ iti ādi 
SA_GR14_ss4_krsu-5694	tad evaṃ vṛndāvanasya tāvat	tat evam vṛndāvanasya tāvat 
SA_GR14_ss4_krsu-5695	prakāśa-bhedā udāhriyante /	prakāśa bhedāḥ udāhriyante 
SA_GR14_ss4_krsu-5696	tatrāprakaṭa-līlānugato yathā yāmale rudra-	tatra aprakaṭa līlā anugataḥ yathā yāmale rudra 
SA_GR14_ss4_krsu-5697	gaurī-saṃvāde -	gaurī saṃvāde 
SA_GR14_ss4_krsu-5698	vīthyāṃ vīthyāṃ nivāso'dhara-madhu-suvacas tatra santānakānām	vīthyām vīthyām nivāsa udhara madhu suvacaḥ tatra santānakānām 
SA_GR14_ss4_krsu-5699	eke rākendu-koṭy-ātapa-viśada-karās teṣu caike kamante /	eke rākā indu koṭyā ātapa viśada karāḥ teṣu ca eke kamante 
SA_GR14_ss4_krsu-5700	rāme rātrer virāme samudita-tapana-dyoti-sindhūpameyā	rāme rātreḥ virāme samudita tapana dyoti sindhu upameyā 
SA_GR14_ss4_krsu-5701	ratnāṅgānāṃ suvarṇācita-mukura-rucas tebhya eke drumendrāḥ //	ratna aṅgānām suvarṇa ācita mukura rucaḥ tebhyaḥ eke druma indrāḥ 
SA_GR14_ss4_krsu-5702	yat kusumaṃ yadā mṛgyaṃ yat phalaṃ ca varānane /	yat kusumam yadā mṛgyam yat phalam ca varānane 
SA_GR14_ss4_krsu-5703	tat tadaiva prasūyante vṛndāvana-sura-drumāḥ //	tat tadā eva prasūyante vṛndāvana suradrumāḥ 
SA_GR14_ss4_krsu-5704	arthaś ca - he adhara-madhu-suvacaḥ adhara-madhu-tulyāni suvacāṃsi yasyāḥ	arthaḥ ca he adhara madhu suvacaḥ adhara madhu tulyāni su vacāṃsi yasyāḥ 
SA_GR14_ss4_krsu-5705	tathābhūte he gauri /	tathābhūte he gauri 
SA_GR14_ss4_krsu-5706	tatra śrī-vṛndāvane rathāṅgānāṃ santānakānāṃ	tatra śrī vṛndāvane rathāṅgānām santānakānām 
SA_GR14_ss4_krsu-5707	madhye eke drumendrā rākendu-koṭy-ātapa-viśada-karāḥ /	madhye eke drumendrāḥ rākā indu koṭi ātapa viśada karāḥ 
SA_GR14_ss4_krsu-5708	he rāme, teṣu	he rāme teṣu 
SA_GR14_ss4_krsu-5709	santānakeṣu ca eke rātrer virāme samudita-tapana-dyoti-sindhūpameyāḥ	santānakeṣu ca eke rātreḥ virāme samudita tapana dyoti sindhu upameyāḥ 
SA_GR14_ss4_krsu-5710	kamante virājante /	kamante virājante 
SA_GR14_ss4_krsu-5711	tebhyas tān atikramya eke kamante /	tebhyaḥ tān atikramya eke kamante 
SA_GR14_ss4_krsu-5712	kathambhūtāḥ	kathambhūtāḥ 
SA_GR14_ss4_krsu-5713	suvarṇācita-mukura-ruca iti /	suvarṇa ācita mukura rucaḥ iti 
SA_GR14_ss4_krsu-5714	tatra ca yadā yat kusumaṃ mṛgyaṃ bhavati yadā	tatra ca yadā yat kusumam mṛgyam bhavati yadā 
SA_GR14_ss4_krsu-5715	ca yat phalaṃ mṛgyaṃ bhavati tadaiva tad vṛndāvana-sura-drumāḥ prasūyanta	ca yat phalam mṛgyam bhavati tadā eva tat vṛndāvana suradrumāḥ prasūyanta 
SA_GR14_ss4_krsu-5716	iti /	iti 
SA_GR14_ss4_krsu-5717	evaṃ brahma-saṃhitāyām api ādi-puruṣa-govinda-stotra eva --	evam brahmasaṃhitāyām api ādipuruṣa govinda stotre eva 
SA_GR14_ss4_krsu-5718	śriyaḥ kāntāḥ kāntaḥ parama-puruṣaḥ kalpa-taravo	śriyaḥ kāntāḥ kāntaḥ paramapuruṣaḥ kalpataravaḥ 
SA_GR14_ss4_krsu-5719	drumā bhūmiś cintāmaṇi-gaṇa-mayi toyam amṛtam /	drumāḥ bhūmiḥ cintāmaṇi gaṇa mayi toyam amṛtam 
SA_GR14_ss4_krsu-5720	kathā gānaṃ nāṭyaṃ gamanam api vaṃśī priya-sakhi	kathā gānam nāṭyam gamanam api vaṃśī priya sakhi 
SA_GR14_ss4_krsu-5721	cid-ānandaṃ jyotiḥ param api tad āsvādyam api ca //	cit ānandam jyotiḥ param api tat āsvādyam api ca 
SA_GR14_ss4_krsu-5722	sa yatra kṣīrābdhiḥ sravati surabhībhyaś ca su-mahān	sa yatra kṣīrābdhiḥ sravati surabhībhyaḥ ca su mahān 
SA_GR14_ss4_krsu-5723	nimeṣārdhākhyo vā vrajati na hi yatrāpi samayaḥ /	nimeṣa ardha ākhyaḥ vā vrajati na hi yatra api samayaḥ 
SA_GR14_ss4_krsu-5724	bhaje śvetadvīpaṃ tam aham iha golokam iti yaṃ	bhaje śvetadvīpam tam aham iha golokam iti yam 
SA_GR14_ss4_krsu-5725	vidantas te santaḥ kṣiti-virala-cārāḥ katipaye // [BrahmaS 5.56] iti /	vidantaḥ te santaḥ kṣiti virala cārāḥ katipaye iti 
SA_GR14_ss4_krsu-5726	jyotir laukika-līlā-mādhuryāya mahā-pralaye'py anaśvara-sūryādi-rūpaṃ yat	jyotiḥ laukika līlā mādhuryāya mahāpralaye pi anaśvara sūrya ādi rūpam yat 
SA_GR14_ss4_krsu-5727	tatra vartate tathā teṣām āsādyam api yat kiñcit tat cidānanda-rūpaṃ param	tatra vartate tathā teṣām āsādyam api yat kiñcid tat cit ānanda rūpam param 
SA_GR14_ss4_krsu-5728	api parama-tattvam eva na tu prākṛtam /	api parama tattvam eva na tu prākṛtam 
SA_GR14_ss4_krsu-5729	candrārkayoḥ sthitiś ca tatra	candra arkayoḥ sthitiḥ ca tatra 
SA_GR14_ss4_krsu-5730	vilakṣaṇatvenaiva gautamīya-tantre kathitā samānodita-candrārkam iti hi	vilakṣaṇa tvena eva gautamīyatantre kathitā samāna udita candra arkam iti hi 
SA_GR14_ss4_krsu-5731	vṛndāvana-viśeṣaṇam /	vṛndāvana viśeṣaṇam 
SA_GR14_ss4_krsu-5732	samānatvaṃ ca rātro rātrau rākā-candra-mayatvād	samāna tvam ca rātraḥ rātrau rākā candra maya tvāt 
SA_GR14_ss4_krsu-5733	iti / api ceti pareṇānvayaḥ /	iti api ca iti pareṇa anvayaḥ 
SA_GR14_ss4_krsu-5734	(page 89) rasāveśena tad-ajñānād eva samayo na	rasa āveśena tad ajñānāt eva samayaḥ na 
SA_GR14_ss4_krsu-5735	vrajatīty uktam /	vrajati iti uktam 
SA_GR14_ss4_krsu-5736	anyathā paurvāparyābhāve sati ceṣṭātmikāyā līlāyāḥ	anyathā paurvāparya abhāve sati ceṣṭā ātmikāyāḥ līlāyāḥ 
SA_GR14_ss4_krsu-5737	svarūpa-hāniḥ syāt /	svarūpa hāniḥ syāt 
SA_GR14_ss4_krsu-5738	śvetaṃ śubhraṃ doṣa-rahitam ity arthaḥ / dvīpaṃ tad	śvetam śubhram doṣa rahitam iti arthaḥ dvīpam tat 
SA_GR14_ss4_krsu-5739	ivānyāsaṅga-śūnyaṃ sarvataḥ param ity arthaḥ /	iva anya āsaṅga śūnyam sarvatas param iti arthaḥ 
SA_GR14_ss4_krsu-5740	tad uktaṃ śrutyā -yathā hi	tat uktam śrutyā yathā hi 
SA_GR14_ss4_krsu-5741	sarasi padmaṃ tiṣṭhati tathā bhūmyāṃ tiṣṭhati [GTU 2.30] iti /	sarasi padmam tiṣṭhati tathā bhūmyām tiṣṭhati iti 
SA_GR14_ss4_krsu-5742	kiṃ ca brahma-	kim ca brahma 
SA_GR14_ss4_krsu-5743	saṃhitāyām eva tat-stavādau - cintāmaṇi-prakara-sadmasu kalpa-vṛkṣa-	saṃhitāyām eva tad stava ādau cintāmaṇi prakara sadmasu kalpavṛkṣa 
SA_GR14_ss4_krsu-5744	lakṣāvṛteṣu [BrahmaS 5.29] ity ādi /	lakṣa āvṛteṣu brahmas iti ādi 
SA_GR14_ss4_krsu-5745	evaṃ nārada-pañcarātre ca śruti-vidyā-saṃvāde -	evam nāradapañcarātre ca śruti vidyā saṃvāde 
SA_GR14_ss4_krsu-5746	tataḥ śveta-mahā-dvīpaś catur-dikṣu vidikṣu ca /	tatas śveta mahā dvīpaḥ catur dikṣu vidikṣu ca 
SA_GR14_ss4_krsu-5747	adhaś cordhvaṃ ca diṅ-nāthās toyaṃ kṣīrāmṛtārṇavaḥ //	adhas ca ūrdhvam ca diṅnāthāḥ toyam kṣīra amṛta arṇavaḥ 
SA_GR14_ss4_krsu-5748	mahā-vṛndāvanaṃ tatra keli-vṛndāvanāni ca /	mahā vṛndāvanam tatra keli vṛndāvanāni ca 
SA_GR14_ss4_krsu-5749	vṛkṣāḥ sura-drumāś caiva cintāmaṇi-mayī sthalī //	vṛkṣāḥ suradrumāḥ ca eva cintāmaṇi mayī sthalī 
SA_GR14_ss4_krsu-5750	krīḍā-vihaṅga-lakṣaṃ ca surabhīnām anekaśaḥ /	krīḍā vihaṅga lakṣam ca surabhīnām anekaśas 
SA_GR14_ss4_krsu-5751	nānā-citra-vicitra-śrī-rāsa-maṇḍala-bhūmayaḥ //	nānā citra vicitra śrī rāsa maṇḍala bhūmayaḥ 
SA_GR14_ss4_krsu-5752	keli-kuñja-nikuñjāni nānā-saukhya-sthalāni ca /	keli kuñja nikuñjāni nānā saukhya sthalāni ca 
SA_GR14_ss4_krsu-5753	prācīna-cchatra-ratnāni phaṇāḥ śeṣasya bhānty aho //	prācīna chatra ratnāni phaṇāḥ śeṣasya bhānti aho 
SA_GR14_ss4_krsu-5754	yac-chiro-ratna-vṛndānām atula-dyuti-vaibhavam /	yat śiraḥ ratna vṛndānām atula dyuti vaibhavam 
SA_GR14_ss4_krsu-5755	brahmaiva rājate tatra rūpaṃ ko vaktum arhati // iti /	brahma eva rājate tatra rūpam kaḥ vaktum arhati iti 
SA_GR14_ss4_krsu-5756	itthaṃ śrī-vṛndāvanasyāprakaṭa-līlānugata-prakāśa eva goloka iti	ittham śrī vṛndāvanasya aprakaṭa līlā anugata prakāśaḥ eva golokaḥ iti 
SA_GR14_ss4_krsu-5757	vyākhyātam /	vyākhyātam 
SA_GR14_ss4_krsu-5758	tatrāprakaṭa-līlāyā dvaividhye mantropāsanāmayyāṃ kiñcid	tatra aprakaṭa līlāyāḥ dvaividhye mantra upāsana mayyām kiñcid 
SA_GR14_ss4_krsu-5759	vilakṣaṇaḥ /	vilakṣaṇaḥ 
SA_GR14_ss4_krsu-5760	sa ca tat-tan-mantreṣu yathādarśita-pratiniyata-līlā-sthāna-	sa ca tad tad mantreṣu yathā darśita pratiniyata līlā sthāna 
SA_GR14_ss4_krsu-5761	sanniveśaḥ /	sanniveśaḥ 
SA_GR14_ss4_krsu-5762	yathā pūrva-tāpanyāṃ,	yathā pūrvatāpanyām 
SA_GR14_ss4_krsu-5763	yathā ca skānde śrī-nārada-vākyam -	yathā ca skānde śrī nārada vākyam 
SA_GR14_ss4_krsu-5764	yasmin vṛndāvane puṇyaṃ govindasya niketanam /	yasmin vṛndāvane puṇyam govindasya niketanam 
SA_GR14_ss4_krsu-5765	tat-sevaka-samākīrṇaṃ tatraiva sthīyate mayā //	tat sevaka samākīrṇam tatra eva sthīyate mayā 
SA_GR14_ss4_krsu-5766	bhuvi govinda-vaikuṇṭhaṃ tasmin vṛndāvane nṛpa /	bhuvi govinda vaikuṇṭham tasmin vṛndāvane nṛpa 
SA_GR14_ss4_krsu-5767	yatra vṛndādayo bhṛtyāḥ santi govinda-lālasāḥ // iti /	yatra vṛnda ādayaḥ bhṛtyāḥ santi govinda lālasāḥ iti 
SA_GR14_ss4_krsu-5768	atha prakaṭa-līlānugata-prakāśaḥ śrī-viṣṇu-purāṇa-harivaṃśādau	atha prakaṭa līlā anugata prakāśaḥ śrī viṣṇu purāṇa harivaṃśa ādau 
SA_GR14_ss4_krsu-5769	prasiddhaḥ /	prasiddhaḥ 
SA_GR14_ss4_krsu-5770	sa eṣa eva prakāśas tadānīṃ prākṛtair api kaiścid bhāgya-	saḥ eṣaḥ eva prakāśaḥ tadānīm prākṛtaiḥ api kaiścid 
SA_GR14_ss4_krsu-5771	viśeṣodayavadbhir dadṛśe sampraty asmābhir api tad-aṃśo dṛśyate / atra tu	viśeṣa udayavadbhiḥ dadṛśe samprati asmābhiḥ api tad aṃśaḥ dṛśyate atra tu 
SA_GR14_ss4_krsu-5772	yat prākṛta-pradeśa iva rītayo'valokyante tat tu śrī-bhagavatīva svecchayā	yat prākṛta pradeśe iva rītayā uvalokyante tat tu śrī bhagavatī iva sva icchayā 
SA_GR14_ss4_krsu-5773	laukika-līlā-viśeṣāṅgīkāra-nibandhanam iti jñeyam /	                      
SA_GR14_ss4_krsu-5774	śrī-bhagavad-	        
SA_GR14_ss4_krsu-5775	dhāmnāṃ teṣāṃ sarvathā prapañcātītatvādi-guṇaiḥ śruti-smṛtibhyāṃ kṛta-	dhāmnām teṣām sarvathā prapañca atīta tva ādi guṇaiḥ śruti smṛtibhyām kṛta 
SA_GR14_ss4_krsu-5776	pramāṇatvāt /	pramāṇa tvāt 
SA_GR14_ss4_krsu-5777	ataevoktam ādivārāhe -	ataeva uktam ādivārāhe 
SA_GR14_ss4_krsu-5778	vasanti ye mathurāyāṃ viṣṇu-rūpā hi te khalu /	vasanti ye mathurāyām viṣṇu rūpāḥ hi te khalu 
SA_GR14_ss4_krsu-5779	ajñānās tān na paśyanti paśyanti jñāna-cakṣuṣaḥ // iti /	ajñānāḥ tān na paśyanti paśyanti jñāna cakṣuṣaḥ iti 
SA_GR14_ss4_krsu-5780	tad etan-mūla-pramāṇe'py aprakaṭa-līlānugataḥ prakāśaḥ śrī-vṛndāvanasya	tat aprakaṭa līlā anugataḥ prakāśaḥ śrī vṛndāvanasya 
SA_GR14_ss4_krsu-5781	- te cautsukya-dhiyo rājan matvā gopās tam īśvaraḥ [BhP 10.28.11] ity ādau	te ca autsukya dhiyaḥ rājan matvā gopāḥ tam īśvaraḥ iti ādau 
SA_GR14_ss4_krsu-5782	darśita eva /	darśitaḥ eva 
SA_GR14_ss4_krsu-5783	prakaṭa-līlānugato yathā -	prakaṭa līlā anugataḥ yathā 
SA_GR14_ss4_krsu-5784	aho amī deva-varāmarārcitaṃ	aho amī deva vara amara arcitam 
SA_GR14_ss4_krsu-5785	pādāmbujaṃ te sumanaḥ-phalārhaṇam /	pāda ambujam te sumanaḥ phala arhaṇam 
SA_GR14_ss4_krsu-5786	namanty upādāya śikhābhir ātmanas	namanti upādāya śikhābhiḥ ātmanaḥ 
SA_GR14_ss4_krsu-5787	tamo'pahatyai taru-janma yat-kṛtam // [BhP 10.15.5] ity ādi /	tama upahatyai taru janma yat kṛtam bhp iti ādi 
SA_GR14_ss4_krsu-5788	ātmanaḥ sumanaḥ phala-rūpam arhaṇam upādāyātmana eva śikhābhir	ātmanaḥ sumanaḥ phala rūpam arhaṇam upādāya ātmanaḥ eva śikhābhiḥ 
SA_GR14_ss4_krsu-5789	namanti / yad yaiḥ /	namanti yat yaiḥ 
SA_GR14_ss4_krsu-5790	śṛṇvatāṃ paśyatāṃ ca saṃsāriṇāṃ tamo'pahatyai taru-	śṛṇvatām paśyatām ca saṃsāriṇām tama upahatyai taru 
SA_GR14_ss4_krsu-5791	janmaitat-kṛtam iti /	janma etat kṛtam iti 
SA_GR14_ss4_krsu-5792	yat-kṛtam iti tṛtīyā-tat-puruṣo vā //	yat kṛtam iti tṛtīyā tatpuruṣaḥ vā 
SA_GR14_ss4_krsu-5793	// 10.15 // śrī-bhagavān śrī-baladevam // 172 // [173]	ro bhagavant śrī baladevam 
SA_GR14_ss4_krsu-5794	yathā ca -	yathā ca 
SA_GR14_ss4_krsu-5795	sapady evābhitaḥ paśyan diśo 'paśyat puraḥ-sthitam /	sapadi eva abhitas paśyan diśaḥ paśyat puras sthitam 
SA_GR14_ss4_krsu-5796	vṛndāvanaṃ janājīvya- drumākīrṇaṃ samā-priyam //	vṛndāvanam jana ājīvya druma ākīrṇam 
SA_GR14_ss4_krsu-5797	yatra naisarga-durvairāḥ sahāsan nṛ-mṛgādayaḥ /	yatra naisarga durvairāḥ saha āsan nṛ mṛga ādayaḥ 
SA_GR14_ss4_krsu-5798	mitrāṇīvājitāvāsa- druta-ruṭ-tarṣakādikam // [BhP 10.13.59-60] ity ādi /	iti ādi 
SA_GR14_ss4_krsu-5799	(page 90)	page 
SA_GR14_ss4_krsu-5800	samānām ātmārāmāṇām api samasya sahacarasya śrī-bhagavato'pi vā / ā	samānām ātma ārāmāṇām api samasya sahacarasya śrī bhagavataḥ api vā 
SA_GR14_ss4_krsu-5801	sarvatobhāvena sarvāṃśenaiva priyam iti /	sarvatobhāvena sarva aṃśena eva priyam iti 
SA_GR14_ss4_krsu-5802	tatrāsad-aṃśatvaṃ niṣidhya	tatra asat aṃśa tvam niṣidhya 
SA_GR14_ss4_krsu-5803	sarvato'py ānandātiśaya-pradatvaṃ pradarśitam //	ānanda atiśaya prada tvam pradarśitam 
SA_GR14_ss4_krsu-5804	// 10.13 // śrī-śukaḥ // 173 // [174]	ro-0 śrī śukaḥ 
SA_GR14_ss4_krsu-5805	tad evaṃ śrī-kṛṣṇa-līlāspadatvena tāny eva sthānāni darśitāni / tac	tat evam śrī kṛṣṇa līlā āspada tvena tāni eva sthānāni darśitāni tat 
SA_GR14_ss4_krsu-5806	cāvadhāraṇaṃ śrī-kṛṣṇasya vibhutve sati vyabhicāri syāt /	ca avadhāraṇam śrī kṛṣṇasya vibhu tve sati vyabhicāri syāt 
SA_GR14_ss4_krsu-5807	tatra samādhīyate	tatra samādhīyate 
SA_GR14_ss4_krsu-5808	teṣāṃ sthānānāṃ nitya-tal-līlāspadatvena śrūyamānatvāt tad-ādhāra-śakti-	teṣām sthānānām nitya tad līlā āspada tvena śrūyamāna tvāt 
SA_GR14_ss4_krsu-5809	lakṣaṇa-svarūpa-vibhūtitvam avagamyate - sa bhagavaḥ kasmin pratiṣṭhita iti	lakṣaṇa sva rūpa vibhūti tvam avagamyate sa bhagavaḥ kasmin pratiṣṭhitaḥ iti 
SA_GR14_ss4_krsu-5810	sve mahimni [ChāU 7.24.1] iti śruteḥ /	sve mahimni chāu iti śruteḥ 
SA_GR14_ss4_krsu-5811	sākṣād brahma-gopāla-purī [GTU	sākṣāt brahmagopālapurī g tu 
SA_GR14_ss4_krsu-5812	2.26] ity ādeś ca /	iti ādeḥ ca 
SA_GR14_ss4_krsu-5813	tatas tatraivāvyavadhānena tasya līlā /	tatas tatra eva avyavadhānena tasya līlā 
SA_GR14_ss4_krsu-5814	anyeṣāṃ prākṛtatvāt na sākṣāt tat-	anyeṣām prākṛta tvāt na sākṣāt tat 
SA_GR14_ss4_krsu-5815	sparśo'pi sambhavati dhāraṇa-śaktis tu natarām /	sparśaḥ upi sambhavati dhāraṇa śaktiḥ tu natarām 
SA_GR14_ss4_krsu-5816	yatra kvacid vā prakaṭa-	yatra kvacid vā prakaṭa 
SA_GR14_ss4_krsu-5817	līlāyāṃ tad-gamanādikaṃ śrūyate /	līlāyām tad gamana ādikam śrūyate 
SA_GR14_ss4_krsu-5818	tad api teṣām ādhāra-śakti-rūpāṇāṃ	tat api teṣām ādhāra śakti rūpāṇām 
SA_GR14_ss4_krsu-5819	sthānānām āveśād eva mantavyam /	sthānānām āveśāt eva mantavyam 
SA_GR14_ss4_krsu-5820	vaikuṇṭhāntarasya tv aprākṛtatve'pi	vaikuṇṭha antarasya tu a prākṛta tve pi 
SA_GR14_ss4_krsu-5821	śrī-kṛṣṇa-vilāsāspadatākara-nija-yogyatā-viśeṣābhāvān na tādṛśatvam iti	                                                                                                    
SA_GR14_ss4_krsu-5822	jñeyam /	jñeyam 
SA_GR14_ss4_krsu-5823	athāprakaṭa-prakaṭa-līlayoḥ samanvayas tv evaṃ vivecanīyaḥ /	atha aprakaṭa prakaṭa līlayoḥ samanvayaḥ tu evam vivecanīyaḥ 
SA_GR14_ss4_krsu-5824	tatra yadyapi	tatra yadi api 
SA_GR14_ss4_krsu-5825	tasya (mantropāsanāmayy)	tasya mantra upāsana mayī 
SA_GR14_ss4_krsu-5826	-aprakaṭa-līlāyāṃ bālyādikam api vartate tathāpi	aprakaṭa līlāyām bālya ādikam api vartate tathā api 
SA_GR14_ss4_krsu-5827	(svārasika-līlāmaya-)	svārasika līlā maya 
SA_GR14_ss4_krsu-5828	kiśorākārasyaiva mukhyatvāt /	kiśora ākārasya eva mukhya tvāt 
SA_GR14_ss4_krsu-5829	tam āśrityaiva sarvaṃ	tam āśritya eva sarvam 
SA_GR14_ss4_krsu-5830	pravartate iti prakaṭa-līlāpi tam āśrityaiva vaktavyā /	pravartate iti prakaṭa līlā api tam āśritya eva vaktavyā 
SA_GR14_ss4_krsu-5831	yad vā dvārakāyām	yat vā dvārakāyām 
SA_GR14_ss4_krsu-5832	api mathurāyām api vṛndāvane'pi yugapad eka eva kiśorākṛtiḥ śrī-	api mathurāyām api vṛndāvane pi yugapad ekaḥ eva kiśora ākṛtiḥ śrī 
SA_GR14_ss4_krsu-5833	kṛṣṇākhyo bhagavān śrīmad-ānakadundubhi-vraja-rāja-nandana-rūpeṇa	kṛṣṇa ākhyaḥ bhagavān śrīmat ānakadundubhi vraja rāja nandana rūpeṇa 
SA_GR14_ss4_krsu-5834	prāpañcika-lokāprakaṭaṃ nityam eva līlāyamāna āste /	prāpañcika loka aprakaṭam nityam eva līlāyamānaḥ āste 
SA_GR14_ss4_krsu-5835	atha kadācit bhakti-yoga-vidhānārthaṃ kathaṃ paśyema hi striyaḥ [BhP 1.8.20]	atha kadācid bhaktiyoga vidhāna artham katham paśyema hi striyaḥ 
SA_GR14_ss4_krsu-5836	ity ādy-ukta-diśā saty apy ānusaṅgike bhū-bhāra-haraṇādike kārye, sveṣām	iti ādi ukta diśā sati api ānusaṅgike bhū bhāra haraṇa ādike kārye sveṣām 
SA_GR14_ss4_krsu-5837	ānanda-camatkāra-poṣāyaiva loke'smiṃs tad-rīti-sahayoga-camatkṛta-nija-	ānanda camatkāra poṣāya eva loke smin tad rīti saha yoga camatkṛta nija 
SA_GR14_ss4_krsu-5838	janma-bālya-paugaṇḍa-kaiśorātmaka-laukika-līlāḥ prakaṭayan tad-arthaṃ	janma bālya paugaṇḍa kaiśora ātmaka laukika līlāḥ prakaṭayan tad artham 
SA_GR14_ss4_krsu-5839	prathamata evāvatārita-śrīmad-ānakadundubhi-gṛhe tad-vidha-yadu-vṛnda-	prathamatas eva avatārita śrīmat ānakadundubhi gṛhe tad vidha yadu vṛnda 
SA_GR14_ss4_krsu-5840	saṃvalite svayam eva bāla-rūpeṇa prakaṭībhavati /	saṃvalite svayam eva bāla rūpeṇa prakaṭībhavati 
SA_GR14_ss4_krsu-5841	atha ca tatra tatra sthāne vacana-jāta-siddha-nija-nityāvasthita-kaiśoraādi-	atha ca tatra tatra sthāne vacana jāta siddha nija nitya avasthita kaiśora ādi 
SA_GR14_ss4_krsu-5842	vilāsa-sampādanāya tair eva prakāśāntareṇāprakaṭam api sthitaiḥ parikaraiḥ	vilāsa sampādanāya taiḥ eva prakāśa antareṇa aprakaṭam api sthitaiḥ parikaraiḥ 
SA_GR14_ss4_krsu-5843	sākaṃ nija-prakāśāntareṇāprakaṭam api viharaty eva /	sākam nija prakāśa antareṇa aprakaṭam api viharati eva 
SA_GR14_ss4_krsu-5844	atha śrīmad-ānakadundubhi-gṛhe'vatīrya ca tadvad eva	atha śrīmat ānakadundubhi gṛhe iva tīrya ca tadvat eva 
SA_GR14_ss4_krsu-5845	prakāśāntareṇāprakaṭam api sthityaiva svayaṃ prakaṭībhūtasya sa-vraja-śrī-	prakāśa antareṇa aprakaṭam api sthityā eva svayam prakaṭībhūtasya sa vraja śrī 
SA_GR14_ss4_krsu-5846	vraja-rājasya gṛhe'pi tadīyām anādita eva siddhāṃ sva-vātsalya-mādhurīṃ	vrajarājasya gṛhe pi tadīyām anāditas eva siddhām sva vātsalya mādhurīm 
SA_GR14_ss4_krsu-5847	jāto'yaṃ nandayati /	jāta uyam nandayati 
SA_GR14_ss4_krsu-5848	bālo'yaṃ riṅgati /	riṅgati 
SA_GR14_ss4_krsu-5849	paugaṇḍo'yaṃ vikrīḍatīty-ādi-sva-	paugaṇḍaḥ yam vikrīḍati 
SA_GR14_ss4_krsu-5850	vilāsa-viśeṣaiḥ punaḥ punar navīkartuṃ samāyāti /	vilāsa viśeṣaiḥ punar punar navīkartum samāyāti 
SA_GR14_ss4_krsu-5851	tatra ca sakala-mādhurī-	tatra ca sakala mādhurī 
SA_GR14_ss4_krsu-5852	śiromaṇi-mañjarīm ākaiśora-bālya-keli-lakṣmīm ullāsya gokula-janān	śiromaṇi mañjarīm ā kaiśora bālya keli lakṣmīm ullāsya gokula janān 
SA_GR14_ss4_krsu-5853	nitarām ātma-vaśīkṛtāntar-bahir-indriyāṇy āpadya punar api teṣāṃ	nitarām ātma vaśīkṛta antar bahis indriyāṇi āpadya punar api teṣām 
SA_GR14_ss4_krsu-5854	samadhikām api prema-rddhiṃ saṃvardhayan /	samadhikām api prema ṛddhim saṃvardhayan 
SA_GR14_ss4_krsu-5855	śrīmad ānakadundubhi-	        
SA_GR14_ss4_krsu-5856	prabhṛtīn api nandayan bhūbhāra-rājanya-saṅgham api saṃharan mathurāyāṃ	prabhṛtīn api nandayan bhū bhāra rājanya saṅgham api saṃharan mathurāyām 
SA_GR14_ss4_krsu-5857	prayāti / tataś ca dvārakākhyaṃ sva-dhāma-viśeṣaṃ prakāśayituṃ samudraṃ	prayāti tatas ca dvārakā ākhyam sva dhāma viśeṣam prakāśayitum samudram 
SA_GR14_ss4_krsu-5858	gatvā tat-tal-līlā-mādhurīṃ pariveśayati /	gatvā tat tat līlā mādhurīm pariveśayati 
SA_GR14_ss4_krsu-5859	atha siddhāsu nijāpekṣitāsu tat-tal-līlāsu ca tatra tatra nitya- (page 91)	atha siddhāsu nija apekṣitāsu tad tad līlāsu ca tatra tatra 
SA_GR14_ss4_krsu-5860	siddham aprakaṭatvam evorīkṛtya tāv aprakaṭa-līlā-prakāśau prakaṭa-līlā-	siddham aprakaṭa tvam evā urīkṛtya tau aprakaṭa līlā prakāśau prakaṭa līlā 
SA_GR14_ss4_krsu-5861	prakāśābhyām ekīkṛtya tathāvidha-tat-tan-nija-vṛndam apratyūham	prakāśābhyām ekīkṛtya tathāvidha tat tat nija vṛndam apratyūham 
SA_GR14_ss4_krsu-5862	evānandayatīti /	eva ānandayati iti 
SA_GR14_ss4_krsu-5863	tatra pūrṇa-kaiśora-vyāpiny eva vraje prakaṭa-līlā jñeyā -	tatra pūrṇa kaiśora vyāpinī eva vraje prakaṭa līlā jñeyā 
SA_GR14_ss4_krsu-5864	kva cātisukumārāṅgau kiśorau nāpta-yauvanau [BhP 10.44.8] iti /	kva ca ati sukumāra aṅgau kiśorau na āpta yauvanau iti 
SA_GR14_ss4_krsu-5865	nāsmatto yuvayos tāta nityotkaṇṭhitayor api /	na asmattaḥ yuvayoḥ tāta nitya utkaṇṭhitayoḥ api 
