segmentnr	original	analyzed
SA_GR14_ss4_krsu-1813	nanu yathā darśa-paurṇamāsyādy-aṅga-bhūtayā pūrṇāhūtyā sarvān kāmān	nanu yathā darśa paurṇamāsī ādi aṅga bhūtayā pūrṇāhūtyā sarvān kāmān 
SA_GR14_ss4_krsu-1814	avāpnoti ity ādāv arthavādatvaṃ tathaivātrobhayatrāpi bhaviṣyatīti cet, na /	avāpnoti iti ādau artha vāda tvam tathā eva atra ubhayatra api bhaviṣyati iti ced na 
SA_GR14_ss4_krsu-1815	bṛhat-sahasra-nāma-stotraṃ paṭhitvaiva bhojana-kāriṇīṃ devīṃ prati rāma-	bṛhat sahasranāma stotram paṭhitvā eva bhojana kāriṇīm devīm prati rāma 
SA_GR14_ss4_krsu-1816	nāmaiva sakṛt kīrtayitvā kṛta-kṛtyā satī mayā saha bhuṅkṣveti sākṣād-	nāma eva sakṛt kīrtayitvā kṛtakṛtyā satī mayā saha bhuṅkṣva iti sākṣāt 
SA_GR14_ss4_krsu-1817	bhojane śrī-mahādevena pravartanāt /	bhojane śrī mahādevena pravartanāt 
SA_GR14_ss4_krsu-1818	kṛṣṇ-nāmni tu tathārtha-vādatvaṃ	kṛṣṇa nāmni tu tathā arthavāda tvam 
SA_GR14_ss4_krsu-1819	dūrotsāritam eveti //	dūra utsāritam eva iti 
SA_GR14_ss4_krsu-1820	[End Sarva-saṃvādinī]	sarva saṃvādin 
SA_GR14_ss4_krsu-1821	ittham eva śrī-kṛṣṇasyaivāsamorddhva-mahimatvāt svayam eva tenāpi sakala-	ittham eva śrī kṛṣṇasya eva asama ūrddhva mahima tvāt svayam eva tena api 
SA_GR14_ss4_krsu-1822	bhakta-vṛnda-vandita-bhagavat-praṇayaṃ śrīmad-arjunaṃ prati sarva-	bhakta vṛnda vandita bhagavat praṇayam śrīmat arjunam prati sarva 
SA_GR14_ss4_krsu-1823	śāstrārtha-sāra-bhūta-śrī-gītopasaṃhāra-vākye nijākhila-prādurbhāvāntara-	                                                             
SA_GR14_ss4_krsu-1824	bhajanam atikramya sva-bhajanam eva sarva-guhyatamatvenopadiṣṭam /	bhajanam atikramya sva bhajanam eva sarva guhyatama tvena upadiṣṭam 
SA_GR14_ss4_krsu-1825	yathāha - kartuṃ necchasi yan mohāt kariṣyasy avaśo'pi tad [Gītā 18.60] ity	yathā āha kartum na icchasi yat mohāt kariṣyasi tat gītāḥ iti 
SA_GR14_ss4_krsu-1826	anantaram -	anantaram 
SA_GR14_ss4_krsu-1827	īśvaraḥ sarva-bhūtānāṃ hṛd-deśe 'rjuna tiṣṭhati /	īśvaraḥ sarva bhūtānām hṛd deśe rjuna tiṣṭhati 
SA_GR14_ss4_krsu-1828	bhrāmayan sarva-bhūtāni yantrārūḍhāni māyayā //	bhrāmayan sarva bhūtāni yantra ārūḍhāni māyayā 
SA_GR14_ss4_krsu-1829	tam eva śaraṇaṃ gaccha sarva-bhāvena bhārata /	tam eva śaraṇam gaccha sarva bhāvena bhārata 
SA_GR14_ss4_krsu-1830	tat-prasādāt parāṃ śāntiṃ sthānaṃ prāpsyasi śāśvatam //	tad prasādāt parām śāntim sthānam prāpsyasi śāśvatam 
SA_GR14_ss4_krsu-1831	iti te jñānam ākhyātaṃ guhyād guhyataraṃ mayā /	iti te jñānam ākhyātam guhyāt guhyataram mayā 
SA_GR14_ss4_krsu-1832	vimṛśyaitad aśeṣeṇa yathecchasi tathā kuru //	vimṛśya etat aśeṣeṇa yathā icchasi tathā kuru 
SA_GR14_ss4_krsu-1833	sarva-guhyatamaṃ bhūyaḥ śṛṇu me paramaṃ vacaḥ /	sarva guhyatamam bhūyas śṛṇu me paramam vacaḥ 
SA_GR14_ss4_krsu-1834	iṣṭo 'si me dṛḍham iti tato vakṣyāmi te hitam //	iṣṭaḥ u si me dṛḍham iti tatas vakṣyāmi te hitam 
SA_GR14_ss4_krsu-1835	man-manā bhava mad-bhakto mad-yājī māṃ namaskuru /	mad manāḥ bhava mad bhaktaḥ mad yājī mām namaskuru 
SA_GR14_ss4_krsu-1836	mām evaiṣyasi satyaṃ te pratijāne priyo 'si me //	mām eva eṣyasi satyam te pratijāne priyaḥ si me 
SA_GR14_ss4_krsu-1837	sarva-dharmān parityajya mām ekaṃ śaraṇaṃ vraja /	sarva dharmān parityajya mām ekam śaraṇam vraja 
SA_GR14_ss4_krsu-1838	ahaṃ tvā sarva-pāpebhyo mokṣayiṣyāmi mā śucaḥ // [Gītā 18.61-66]	aham tvā sarva pāpebhyaḥ mokṣayiṣyāmi mā śucaḥ gītā 
SA_GR14_ss4_krsu-1839	eṣām arthaḥ - aśocyān anvaśocas tvam ity ādi [Gītā 2.11] grantho na	eṣām arthaḥ a śocyān anvaśocaḥ tvam iti ādi gītā granthaḥ na 
SA_GR14_ss4_krsu-1840	yuddhābhidhāyakaḥ,	yuddha abhidhāyakaḥ 
SA_GR14_ss4_krsu-1841	yataḥ kartum ityādi tataḥ paramārthābhidhāyaka	yatas kartum ityādi tatas parama artha abhidhāyaka 
SA_GR14_ss4_krsu-1842	evāyaṃ tatrāpi guhyataraṃ sarva-guhyatamaṃ ca śṛṇu ity āha /	eva ayam tatra api guhyataram sarva guhyatamam ca śṛṇu iti āha 
SA_GR14_ss4_krsu-1843	īśvara ity ādi /	īśvaraḥ iti ādi 
SA_GR14_ss4_krsu-1844	ya eka sarvāntaryāmī īśvaraḥ sa eva sarvāṇi saṃsāra-yantrāruḍhāni bhūtāni	yaḥ sarva antaryāmī īśvaraḥ saḥ eva sarvāṇi saṃsāra yantra āruḍhāni bhūtāni 
SA_GR14_ss4_krsu-1845	māyayā bhrāmayan teṣām eva hṛd-deśe tiṣṭhati sarva-bhāvena puruṣa	māyayā bhrāmayan teṣām eva hṛd deśe tiṣṭhati sarva bhāvena puruṣa 
SA_GR14_ss4_krsu-1846	evadaṃ sarvam [ŚvetU 3.15] iti bhāvanāyāḥ sarvendriya-pravaṇatayā vā parāṃ	eva dam sarvam śvetu iti bhāvanāyāḥ sarva indriya pravaṇa tayā vā parām 
SA_GR14_ss4_krsu-1847	śāntiṃ tadīyāṃ paramāṃ bhaktiṃ śamo man-niṣṭhatā buddher [BhP 11.19.36]	śāntim tadīyām paramām bhaktim śamaḥ manniṣṭha tā buddheḥ 
SA_GR14_ss4_krsu-1848	ity ukteḥ / sthānaṃ tadīyaṃ dhāma guhyād brahma-jñānād api guhyataraṃ	iti ukteḥ sthānam tadīyam dhāma guhyāt brahma jñānāt api guhyataram 
SA_GR14_ss4_krsu-1849	dvayoḥ prakarṣe tarap /	dvayoḥ prakarṣe tarap 
SA_GR14_ss4_krsu-1850	athedam api nijaikānta-bhakta-varāya tasmai na paryāptam iti avadhyāya	athā idam api nija ekānta bhakta varāya tasmai na paryāptam iti avadhyāya 
SA_GR14_ss4_krsu-1851	svayam eva mahā-kṛpā-bhareṇodghāṭita-parama-rahasyaḥ śrī-bhagavān	svayam eva mahā kṛpā bhareṇa udghāṭita parama rahasyaḥ śrī bhagavān 
SA_GR14_ss4_krsu-1852	anyām api pradyumna-saṅkarṣaṇa-vāsudeva-parama-vyomādhipa-lakṣaṇa-	anyām api pradyumna saṅkarṣaṇa vāsudeva parama vyoma adhipa lakṣaṇa 
SA_GR14_ss4_krsu-1853	bhajanīya-tāratamya-gamyāṃ bhajana-krama-bhūmikām atikramyaiva	bhajanīya tāratamya gamyām bhajana krama bhūmikām atikramya eva 
SA_GR14_ss4_krsu-1854	sarvato'py upādeyam eva sahasopadiśati sarva-guhyatamaṃ bhūyaḥ [18.64] iti /	sarvatas api upādeyam eva sahasā upadiśati sarva guhyatamam bhūyas iti 
SA_GR14_ss4_krsu-1855	yadyapi guhyatamatvokter eva guhya-guhyatarābhyām api prakṛṣṭam idam	yadi api guhyatama tva ukteḥ eva guhya guhyatarābhyām api prakṛṣṭam idam 
SA_GR14_ss4_krsu-1856	ity āyāti tathāpi sarva-śabda-prayogo guhyatamam api parama-vyomādhipādi-	iti āyāti tathā api sarva śabda prayogaḥ guhyatamam api parama vyoma adhipa ādi 
SA_GR14_ss4_krsu-1857	bhajanārtha-śāstrāntara-vākyam atyeti,	bhajana artha śāstra antara vākyam atyeti 
SA_GR14_ss4_krsu-1858	tasya yāvad-artha-vṛttikatvāt /	tasya yāvadartha vṛttika tvāt 
SA_GR14_ss4_krsu-1859	bahūnāṃ prakarṣe tamap /	bahūnām prakarṣe tamap 
SA_GR14_ss4_krsu-1860	ataeva paramam /	ataeva paramam 
SA_GR14_ss4_krsu-1861	sva-kṛta-tādṛśa-hitopadeśa-	sva kṛta tādṛśa hita upadeśa 
SA_GR14_ss4_krsu-1862	śravaṇe hetum āha iṣṭo'si me dṛḍham itīti /	śravaṇe hetum āha iṣṭaḥ asi me dṛḍham iti iti 
SA_GR14_ss4_krsu-1863	paramāptasya mamaitādṛśaṃ	param āptasya mama etādṛśam 
SA_GR14_ss4_krsu-1864	vākyaṃ tvayāvaśyaṃ śrotavyam iti bhāva ity arthaḥ /	vākyam tvayā avaśyam śrotavyam iti bhāvaḥ iti arthaḥ 
SA_GR14_ss4_krsu-1865	svasya ca tādṛśa-rahasya-prakāśane hetum āha tata iti /	svasya ca tādṛśa rahasya prakāśane hetum āha tatas iti 
SA_GR14_ss4_krsu-1866	tatas tādṛśeṣṭatvād	tatas tādṛśa iṣṭa tvāt 
SA_GR14_ss4_krsu-1867	eva hetoḥ / tad evam autsukyam ucchalayya kiṃ tad ity apekṣāyāṃ	eva hetoḥ tat evam autsukyam ucchalayya kim tat iti apekṣāyām 
SA_GR14_ss4_krsu-1868	sapraṇayāśru-kṛtāñjalim etaṃ praty āha man-manā iti /	sa praṇaya aśru kṛta añjalim etam prati āha manmanāḥ iti 
SA_GR14_ss4_krsu-1869	mayi tvan-mitratayā	mayi tvad mitra tayā 
SA_GR14_ss4_krsu-1870	sākṣād asmin sthite śrī-kṛṣṇe mano yasya tathāvidho bhava / evaṃ mad-	sākṣāt asmin sthite śrī kṛṣṇe manaḥ yasya tathāvidhaḥ bhava evam mad 
SA_GR14_ss4_krsu-1871	bhakto mad-eka-tātparyako bhavety ādi /	               
SA_GR14_ss4_krsu-1872	sarvatra mac-chabdāvṛttyā mad-	sarvatra mad śabda āvṛttyā mat 
SA_GR14_ss4_krsu-1873	bhajanasyaiva nānā-prakāratayā āvṛttiḥ kartavyā /	bhajanasya eva nānā prakāra tayā āvṛttiḥ kartavyā 
SA_GR14_ss4_krsu-1874	na tv īśvara-tattva-mātra-	na tu īśvara tattva mātra 
SA_GR14_ss4_krsu-1875	bhajanasyeti bodhyate /	bhajanasya iti bodhyate 
SA_GR14_ss4_krsu-1876	sādhanānurūpam eva phalam āha mām evaiṣyasīti /	sādhana anurūpam eva phalam āha mām eva eṣyasi iti 
SA_GR14_ss4_krsu-1877	anenaiva-kāreṇāpy ātmanaḥ sarva-śreṣṭhatvaṃ sūcitam /	anena eva kāreṇa api ātmanaḥ sarva śreṣṭha tvam sūcitam 
SA_GR14_ss4_krsu-1878	anyasya (page 32)	anyasya page 
SA_GR14_ss4_krsu-1879	kā vārtā mām eveti /	kā vārtā mām eva iti 
SA_GR14_ss4_krsu-1880	etad eva phalaṃ śrī-parīkṣitāpi vyaktīkariṣyate kaliṃ	etat eva phalam śrī parīkṣitā api vyaktīkariṣyate kalim 
SA_GR14_ss4_krsu-1881	prati /	prati 
SA_GR14_ss4_krsu-1882	yas tvaṃ kṛṣṇe gate dūraṃ	yaḥ tvam kṛṣṇe gate dūram 
SA_GR14_ss4_krsu-1883	saha gāṇḍīva-dhanvanā /	saha gāṇḍīvadhanvanā 
SA_GR14_ss4_krsu-1884	śocyo'sy aśocyān rahasi	śocyā asi a śocyān rahasi 
SA_GR14_ss4_krsu-1885	praharan vadham arhasi // [BhP 1.17.6] iti /	praharan vadham arhasi bhp iti 
SA_GR14_ss4_krsu-1886	satyaṃ te ity anenātrārthe tubhyam eva śape'ham iti praṇaya-viśeṣo darśitaḥ /	satyam te iti anena atra arthe tubhyam eva śapa iham iti praṇaya viśeṣaḥ darśitaḥ 
SA_GR14_ss4_krsu-1887	punar apy atikṛpayā sarva-guhyatamam ity ādi vākyārthānāṃ puṣṭy-artham	punar api ati kṛpayā sarva guhyatamam iti ādi vākya arthānām puṣṭi artham 
SA_GR14_ss4_krsu-1888	āha pratijāne iti /	āha pratijāne iti 
SA_GR14_ss4_krsu-1889	nanu nānā-pratibandha-vikṣiptasya mama kathaṃ tvan-manastvādikam eva	nanu nānā pratibandha vikṣiptasya mama katham tvad manaḥ tva ādikam eva 
SA_GR14_ss4_krsu-1890	sidhyet tatrāha sarveti /	sidhyet tatra āha sarva iti 
SA_GR14_ss4_krsu-1891	sarva-śabdena nitya-paryantā dharmāḥ vivakṣitāḥ /	sarva śabdena nitya paryantāḥ dharmāḥ vivakṣitāḥ 
SA_GR14_ss4_krsu-1892	pari-śabdena teṣāṃ svarūpato'pi tyāgaḥ samarthitaḥ /	pari śabdena teṣām sva rūpataḥ api tyāgaḥ samarthitaḥ 
SA_GR14_ss4_krsu-1893	pāpāni pratibandhās	pāpāni pratibandhāḥ 
SA_GR14_ss4_krsu-1894	tad-ājñayā parityāge pāpānutpatteḥ /	tad ājñayā parityāge pāpa anutpatteḥ 
SA_GR14_ss4_krsu-1895	tad eva vyatirekena draḍhayati mā śuca	tat eva vyatirekena draḍhayati mā śuca 
SA_GR14_ss4_krsu-1896	iti / tatra --	iti tatra 
SA_GR14_ss4_krsu-1897	aśocyān anvaśocas tvaṃ	a śocyān anvaśocaḥ tvam 
SA_GR14_ss4_krsu-1898	prajñā-vādāṃś ca bhāṣase /	prajñā vādān ca bhāṣase 
SA_GR14_ss4_krsu-1899	gatāsūn agatāsūṃś ca	gatāsūn a gatāsūn ca 
SA_GR14_ss4_krsu-1900	nānuśocanti paṇḍitāḥ // [Gītā 2.11]	na anuśocanti paṇḍitāḥ gītā 
SA_GR14_ss4_krsu-1901	ity upakrama-vākye tasyāpaṇḍitatvaṃ vyajya śoka-parityāgena mat-	iti upakrama vākye tasya apaṇḍita tvam vyajya śoka parityāgena mat 
SA_GR14_ss4_krsu-1902	kṛtopadeśam eva gṛhāṇeti vivakṣitam /	kṛta upadeśam eva gṛhāṇa iti vivakṣitam 
SA_GR14_ss4_krsu-1903	tataś ca tāratamya-jñānārtham eva	tatas ca tāratamya jñāna artham eva 
SA_GR14_ss4_krsu-1904	bahudhopadiśyāpi mahopasaṃhāra-vākya-sthasya tv asyopadeśasya paramatvaṃ	bahudhā upadiśya api mahā upasaṃhāra vākya sthasya tu asya upadeśasya parama tvam 
SA_GR14_ss4_krsu-1905	nirdiśya śoka-parityāgena tam etam evopadeśaṃ tvaṃ gṛhāṇeti dvayor	nirdiśya śoka parityāgena tam etam evā upadeśam tvam gṛhāṇa iti dvayoḥ 
SA_GR14_ss4_krsu-1906	vākyayor ekārtha-pravṛttatvam api spaṣṭam /	vākyayoḥ eka artha pravṛtta tvam api spaṣṭam 
SA_GR14_ss4_krsu-1907	Sarva-saṃvādinī -- atha īśvaraḥ sarva-bhūtānām ity ādi-śrī-gītā-padya-	                                                    
SA_GR14_ss4_krsu-1908	ṣaṭke vyākhyānāntaram eva vyākhyeyam /	ṣaṭke vyākhyāna antaram eva vyākhyeyam 
SA_GR14_ss4_krsu-1909	tathā hi - atra kaścid vadati	tathā hi atra kaścid vadati 
SA_GR14_ss4_krsu-1910	īśvaraḥ sarva-bhūtānām ity ādau sarva evedam īśvara iti bhāvena yad-	īśvaraḥ sarva bhūtānām iti ādau sarvaḥ eva idam īśvaraḥ iti bhāvena yat 
SA_GR14_ss4_krsu-1911	bhajanaṃ, tatra jñānāṃśa-sparśaḥ /	bhajanam tatra jñāna aṃśa sparśaḥ 
SA_GR14_ss4_krsu-1912	iha tu manmanā bhavetyādi-śuddhaiva	iha tu mad manāḥ bhava ityādi śuddhā eva 
SA_GR14_ss4_krsu-1913	bhaktir upadiṣṭety ata eva sarvaguhyatmatvam /	bhaktiḥ upadiṣṭā iti atas eva sarva guhya tma tvam 
SA_GR14_ss4_krsu-1914	kiṃ vā pūrveṇa vākyena	kim vā pūrveṇa vākyena 
SA_GR14_ss4_krsu-1915	parokṣatayaiveśvaram uddiśyāpareṇa tam evāparokṣatayā nirdiṣṭavān ity ata	parokṣa tayā eva īśvaram uddiśya apareṇa tam eva aparokṣa tayā nirdiṣṭavān iti 
SA_GR14_ss4_krsu-1916	eva na ca vaktavayam / pūrvam api --	eva na ca vaktavayam pūrvam api 
SA_GR14_ss4_krsu-1917	man-manā bhava mad-bhakto	mad manāḥ bhava mad bhakto 
SA_GR14_ss4_krsu-1918	mad-yājī māṃ namaskuru /	mad yājī mām namaskuru 
SA_GR14_ss4_krsu-1919	mām evaiṣyasi yuktvaivam	mām eva eṣyasi yuktvā evam 
SA_GR14_ss4_krsu-1920	ātmānaṃ matparāyaṇaḥ // [9.34]	ātmānam mad parāyaṇaḥ 
SA_GR14_ss4_krsu-1921	ity ādibhiḥ śuddha-bhajanasyoktatvāt /	iti ādibhiḥ śuddha bhajanasya ukta tvāt 
SA_GR14_ss4_krsu-1922	tathāpi adhiyajño'ham evātra dehe	tathā api adhiyajña ūham eva atra dehe 
SA_GR14_ss4_krsu-1923	deha-bhṛtāṃ varaḥ [Gītā 8.4] ity ādau ca svasyāntaryāmitvena coktatvāt /	dehabhṛtām varaḥ gītā iti ādau ca svasya antaryāmi tvena ca ukta tvāt 
SA_GR14_ss4_krsu-1924	sarva-guhyatamatva-guhyataratvayor anupapattir iti /	sarva guhyatama tva guhyatara tvayoḥ anupapattiḥ iti 
SA_GR14_ss4_krsu-1925	yad yad eva pūrvaṃ	yat yat eva pūrvam 
SA_GR14_ss4_krsu-1926	sāmānyatayoktaṃ tasyaivānte vivicya nirdiṣṭatvāt /	sāmānya tayā uktam tasya eva ante vivicya nirdiṣṭa tvāt 
SA_GR14_ss4_krsu-1927	ucyate - na tāvad bhajana-	ucyate na tāvat 
SA_GR14_ss4_krsu-1928	tāratamyam /	tāratamyam 
SA_GR14_ss4_krsu-1929	atra bhajanīya-tāratamyasyāpi sambhave gauṇa-mukhya-	atra bhajanīya tāratamyasya api sambhave gauṇa mukhya 
SA_GR14_ss4_krsu-1930	nyāyena bhajanīya evārtha-sampratīteḥ /	nyāyena bhajanīyaḥ eva artha sampratīteḥ 
SA_GR14_ss4_krsu-1931	mukhyatvaṃ ca tasya phalam ata	mukhya tvam ca tasya phalam 
SA_GR14_ss4_krsu-1932	upapatter iti [Vs 3.2.29] nyāyena /	upapatteḥ iti vs 
SA_GR14_ss4_krsu-1933	viśeṣatas tu tac-chabdena na svayam eva tad-	viśeṣataḥ tu tad śabdena na svayam eva tat 
SA_GR14_ss4_krsu-1934	rūpa iti mac-chabdena svayam evaitad-rūpa iti ca bhedasya vidyamānatvāt	rūpe iti mad śabdena svayam eva etat rūpe iti ca bhedasya vidyamāna tvāt 
SA_GR14_ss4_krsu-1935	upadeśa-dvaye nijenaudāsīnyenāveśena ca liṅgenāpūrṇatvopalambhanāt /	upadeśa dvaye nijena audāsīnyena āveśena ca liṅgena āpūrṇa tva upalambhanāt 
SA_GR14_ss4_krsu-1936	phala-bheda-vyapadeśenaiva-kāreṇa ca tad-arthasyaiva puṣṭatvāt / sākṣād eva	phala bheda vyapadeśena evakāreṇa ca tad arthasya eva puṣṭa tvāt sākṣāt eva 
SA_GR14_ss4_krsu-1937	bhajanīya-tāratamyam upalabhyate /	bhajanīya tāratamyam upalabhyate 
SA_GR14_ss4_krsu-1938	vastutas tu sarva-bhāvenety asya	vastutas tu sarva bhāvena iti asya 
SA_GR14_ss4_krsu-1939	sarvendriya-pravaṇatayety evārthaḥ /	sarva indriya pravaṇa tayā iti eva arthaḥ 
SA_GR14_ss4_krsu-1940	gauṇa-mukhya-nyāyenaiva jñāna-	gauṇa mukhya nyāyena eva 
SA_GR14_ss4_krsu-1941	miśrasya sarvātmatā-bhāvanā-lakṣaṇa-bhajana-rūpārthasya bādhitatvāt /	miśrasya sarva ātma tā bhāvanā lakṣaṇa bhajana rūpa arthasya bādhita tvāt 
SA_GR14_ss4_krsu-1942	sthānaṃ prāpsyasi śāśvatam iti loka-viśeṣa-prāpter eva nirdiṣṭatvāt / tasmān	sthānam prāpsyasi śāśvatam iti loka viśeṣa prāpteḥ eva nirdiṣṭa tvāt tasmāt 
SA_GR14_ss4_krsu-1943	na ca bhajanāvṛtti-tāratamyāvakāśaḥ /	na ca bhajana āvṛtti tāratamya avakāśaḥ 
SA_GR14_ss4_krsu-1944	na ca bhajanīyasyaiva	na ca bhajanīyasya eva 
SA_GR14_ss4_krsu-1945	parokṣāparokṣatayā nirdeśayos tāratamyam /	parokṣa aparokṣa tayā nirdeśayoḥ tāratamyam 
SA_GR14_ss4_krsu-1946	tadaiva tayā	tadā eva tayā 
SA_GR14_ss4_krsu-1947	prācīnayārvācīnayā cānayā gati-kriyayā saṅkoca-vṛttir iyaṃ kalpanīyā /	prācīnayā arvācīnayā ca anayā gati kriyayā saṅkoca vṛttiḥ iyam kalpanīyā 
SA_GR14_ss4_krsu-1948	yady antaryāmiṇaḥ sakāśād anyā parāvasthā na śrūyate,	yadi antaryāmiṇaḥ sakāśāt anyā parā avasthā na śrūyate 
SA_GR14_ss4_krsu-1949	śāstre śrūyate tu	śāstre śrūyate tu 
SA_GR14_ss4_krsu-1950	tad-avasthātaḥ parā,	tad avasthātaḥ parā 
SA_GR14_ss4_krsu-1951	tato'pi parā ca sarvatra /	tatas api parā ca sarvatra 
SA_GR14_ss4_krsu-1952	atraiva tāvat	atra eva tāvat 
SA_GR14_ss4_krsu-1953	sādhibhūtādhidaivaṃ māṃ cādhiyajñaṃ ca ye viduḥ [Gītā 7.30] ity ādau	sa adhibhūta adhidaivam mām ca adhiyajñam ca ye viduḥ gītāḥ iti ādau 
SA_GR14_ss4_krsu-1954	bheda-vyapadeśāt /	bheda vyapadeśāt 
SA_GR14_ss4_krsu-1955	tatra saha-yukte'pradhāne [Pāṇ 2.3.17] iti	tatra saha yukta i pradhāne pāṇ iti 
SA_GR14_ss4_krsu-1956	smaraṇenādhiyajñasyāntar-yāmiṇaḥ sahārtha-tṛtīyāntatayā labdha-samāsa-	smaraṇena adhiyajñasya antaryāmiṇaḥ saha artha tṛtīyā anta tayā labdha samāsa 
SA_GR14_ss4_krsu-1957	padasya svasmād apradhānatvoktes tataḥ paratvaṃ śrī-kṛṣṇasya vyaktam eva /	                             
SA_GR14_ss4_krsu-1958	adhiyajño'ham evātra [Gītā 8.4] ity ādau ca tad eva vyajyate / eṣa vai	adhiyajñaḥ ūham eva atra gītāḥ iti ādau ca tat eva vyajyate eṣa vai 
SA_GR14_ss4_krsu-1959	bhagavān droṇaḥ prajā-rūpeṇa vartate [BhP 1.7.45] itivat /	bhagavān droṇaḥ prajā rūpeṇa vartate itivat 
SA_GR14_ss4_krsu-1960	tasmād bhajanīya-	tasmāt bhajanīya 
SA_GR14_ss4_krsu-1961	tāratamya-vivakṣayaivopadeśa-tāratamyaṃ siddham /	tāratamya vivakṣayā eva upadeśa tāratamyam siddham 
SA_GR14_ss4_krsu-1962	eṣa tu vātivadati yaḥ	eṣa tu vā ativadati yaḥ 
SA_GR14_ss4_krsu-1963	satyenātivadati [ChāU 7.16.1] itivat yaḥ satyena brahmaṇaiva pratipādya-	satyena ativadati chāu itivat yaḥ satyena brahmaṇā eva pratipādya 
SA_GR14_ss4_krsu-1964	bhūtena sarvaṃ vādinam atikramya vadati eṣa eva sarvam atikramya vadatīty	bhūtena sarvam vādinam atikramya vadati eṣaḥ eva sarvam atikramya vadati iti 
SA_GR14_ss4_krsu-1965	arthaḥ / tad evam arthe sati yathā tatra vādasyātiśāyitā-liṅgena nāmādi-	arthaḥ tat evam arthe sati yathā tatra vādasya atiśāyi tā liṅgena nāma ādi 
SA_GR14_ss4_krsu-1966	prāṇa-paryantāni tat-prakaraṇa uttarottara-bhūmatayopadiṣṭāny api sarvāṇi	prāṇa paryantāni tad prakaraṇe uttara uttara bhūmatayā upadiṣṭāni api sarvāṇi 
SA_GR14_ss4_krsu-1967	vastūny atikramya brahmaṇa eva bhūmatvaṃ sādhyate tadvad atrāpy	vastūni atikramya brahmaṇaḥ eva bhūma tvam sādhyate tadvat atra api 
SA_GR14_ss4_krsu-1968	upadeśādhikyena pratipādyādhikyam iti /	upadeśa ādhikyena pratipādya ādhikyam iti 
SA_GR14_ss4_krsu-1969	ataḥ śrī-kṛṣṇasyaivādhikyam ity	atas śrī kṛṣṇasya eva ādhikyam iti 
SA_GR14_ss4_krsu-1970	ante'py uktam iti dik /	ante pi uktam iti diś 
SA_GR14_ss4_krsu-1971	[end Sarva-saṃvādinī]	sarva saṃvādin 
SA_GR14_ss4_krsu-1972	ataḥ śrī-kṛṣṇasyaivādhikyaṃ siddham /	atas śrī kṛṣṇasya eva ādhikyam siddham 
SA_GR14_ss4_krsu-1973	ataeva asad-vyapadeśān neti cen na	ataeva asat vyapadeśāt na iti ced na 
SA_GR14_ss4_krsu-1974	dharmāntareṇa vākya-śeṣād [Vs. 2.1.17] iti nyāyād	dharma antareṇa vākya śeṣāt iti nyāyāt 
SA_GR14_ss4_krsu-1975	upasaṃhārasyaivopakramārthasya ca sarva-śāstrārthatvāt tatroktaṃ viśva-	upasaṃhārasya eva upakrama arthasya ca sarva śāstra artha tvāt tatra uktam viśva 
SA_GR14_ss4_krsu-1976	rūpam abhi tad-adhīnām eva /	rūpam abhi tat adhīnām eva 
SA_GR14_ss4_krsu-1977	tac ca yuktam /	tat ca yuktam 
SA_GR14_ss4_krsu-1978	tenaiva darśitatvāt / tatra ca -	tena eva darśita tvāt tatra ca 
SA_GR14_ss4_krsu-1979	ity arjunaṃ vāsudevas tathoktvā	iti arjunam vāsudevaḥ tathā uktvā 
SA_GR14_ss4_krsu-1980	svakaṃ rūpaṃ darśayām āsa bhūyaḥ // [Gītā 11.50]	svakam rūpam darśayām āsa bhūyas gītā 
SA_GR14_ss4_krsu-1981	ity narākāra-caturbhuja-rūpasyaiva svakatva-nirdeśāt /	iti nara ākāra catur bhuja rūpasya eva svaka tva nirdeśāt 
SA_GR14_ss4_krsu-1982	tad viśva-rūpaṃ na	tat viśva rūpam na 
SA_GR14_ss4_krsu-1983	tasya sākṣāt svarūpam iti spaṣṭam /	tasya sākṣāt svarūpam iti spaṣṭam 
SA_GR14_ss4_krsu-1984	ataeva parama-bhaktasyārjunasyāpi na	ataeva parama bhaktasya arjunasya api na 
SA_GR14_ss4_krsu-1985	tad-abhīṣṭam,	tat abhīṣṭam 
SA_GR14_ss4_krsu-1986	kintu tadīyaṃ svayaṃ rūpam evābhīṣṭam /	kintu tadīyam svayam rūpam eva abhīṣṭam 
SA_GR14_ss4_krsu-1987	adṛṣṭa-pūrvaṃ	a dṛṣṭa pūrvam 
SA_GR14_ss4_krsu-1988	hṛṣito 'smi dṛṣṭvā bhayena ca pravyathitaṃ mano me [Gītā 11.45] / ity ādy	hṛṣitaḥ smi dṛṣṭvā bhayena ca pravyathitam manaḥ me gītā iti ādi 
SA_GR14_ss4_krsu-1989	ukteḥ / tad-darśanārtham arjunaṃ prati divya-dṛṣṭi-dāna-liṅgena tasyaiva	ukteḥ tad darśana artham arjunam prati divya dṛṣṭi dāna liṅgena tasya eva 
SA_GR14_ss4_krsu-1990	māhātmyam iti tu bāla-kolāhalaḥ /	māhātmyam iti tu bāla kolāhalaḥ 
SA_GR14_ss4_krsu-1991	narākṛti paraṃ brahma iti, tad amitaṃ	nara ākṛti param brahma iti tat amitam 
SA_GR14_ss4_krsu-1992	brahmādvayaṃ śiṣyate iti [BhP 10.14.18],	brahma advayam śiṣyate iti bhp 
SA_GR14_ss4_krsu-1993	yan-mitraṃ paramānandam [BhP	yat mitram parama ānandam bhp 
SA_GR14_ss4_krsu-1994	10.14.32] iti, sa eva nityātma-sukhānubhūty-abhi-vyudasta-māyaḥ [BhP 10.12.39]	iti saḥ eva nitya ātma sukha anubhūti abhivyudasta māyaḥ 
SA_GR14_ss4_krsu-1995	iti, sa tvaṃ vibho katham ihākṣa-pathaḥ pratīta iti ca,	iti sa tvam vibho katham iha akṣa pathaḥ pratītaḥ iti ca 
SA_GR14_ss4_krsu-1996	tathā brahmaṇo hi	tathā brahmaṇaḥ hi 
SA_GR14_ss4_krsu-1997	pratiṣṭhāham [Gītā 14.27] iti,	pratiṣṭhā aham gītā iti 
SA_GR14_ss4_krsu-1998	nāhaṃ prakāśaḥ sarvasya [Gītā 7.25] iti ca	na aham prakāśaḥ sarvasya gītāḥ iti ca 
SA_GR14_ss4_krsu-1999	śravaṇena prakṛṣṭa-dṛṣṭes tatrāpy akaraṇatvād bhagavac-chakti-viśeṣa-	               
SA_GR14_ss4_krsu-2000	saṃvalita-dṛṣṭer eva tatra karaṇatvāt /	saṃvalita dṛṣṭeḥ eva tatra karaṇa tvāt 
SA_GR14_ss4_krsu-2001	tatas tasyā dṛṣṭer divyatvaṃ dānaṃ ca	tatas tasyāḥ dṛṣṭeḥ divya tvam dānam ca 
SA_GR14_ss4_krsu-2002	narākāra-para-brahma-darśana-hetu-lakṣaṇāyās tat-svābhāvika-dṛṣṭer	nara ākāra para brahma darśana hetu lakṣaṇāyāḥ tad svābhāvika dṛṣṭeḥ 
SA_GR14_ss4_krsu-2003	anyāsau deva-vapur darśana-hetur ity apekṣayāiva /	anyā asau deva vapuḥ darśana hetuḥ iti apekṣayā iva 
SA_GR14_ss4_krsu-2004	tac ca narākṛti-para-	tat ca nara ākṛti para 
SA_GR14_ss4_krsu-2005	brahma divya-dṛṣṭibhir api durdarśam ity uktam -	brahma divya dṛṣṭibhiḥ api durdarśam iti uktam 
SA_GR14_ss4_krsu-2006	sudurdarśam idaṃ rūpaṃ dṛṣṭavān asi yan mama /	su durdarśam idam rūpam dṛṣṭavān asi yat mama 
SA_GR14_ss4_krsu-2007	devā apy asya rūpasya nityaṃ darśanakāṅkṣiṇaḥ //	devāḥ api asya rūpasya nityam darśana kāṅkṣiṇaḥ 
SA_GR14_ss4_krsu-2008	[Gītā 11.52] ity ādinā /	gītāḥ iti ādinā 
SA_GR14_ss4_krsu-2009	kintu bhaktyaiva sudarśanam ity apy uktam /	kintu bhaktyā eva sudarśanam iti api uktam 
SA_GR14_ss4_krsu-2010	bhaktyā tv ananyayā śakya aham evaṃvidho 'rjuna /	bhaktyā tu ananyayā śakya aham evaṃvidhaḥ rjuna 
SA_GR14_ss4_krsu-2011	jñātuṃ draṣṭuṃ ca tattvena praveṣṭuṃ ca paraṃtapa //	jñātum draṣṭum ca tattvena praveṣṭum ca paraṃtapa 
SA_GR14_ss4_krsu-2012	[Gītā 11.54] ity ādinā /	gītāḥ iti ādinā 
SA_GR14_ss4_krsu-2013	na ca sudurdarśam (page 33)	na ca su durdarśam page 
SA_GR14_ss4_krsu-2014	ity ādikaṃ viśva-rūpa-param / dṛṣṭvedaṃ	iti ādikam viśva rūpa param 
SA_GR14_ss4_krsu-2015	mānuṣaṃ rūpam [Gītā 11.51] ity āder evāvyavahita-pūrvoktatvāt viśva-rūpa-	mānuṣam rūpam gītā iti ādeḥ eva avyavahita pūrva ukta tvāt viśvarūpa 
SA_GR14_ss4_krsu-2016	prakaraṇasya tad-vyavadhānāc ca /	prakaraṇasya tad vyavadhānāt ca 
SA_GR14_ss4_krsu-2017	tathā caikādaśe sarveṣāṃ devādīnām	tathā ca ekādaśe sarveṣām deva ādīnām 
