segmentnr	original	analyzed
SA_GSP33_brahmsuu-0	athāto brahmajijñāsā / BBs_1,1.1 /	atha atas brahma jijñāsā 
SA_GSP33_brahmsuu-1	janmādyasya yataḥ / BBs_1,1.2 /	janma ādyasya yatas 
SA_GSP33_brahmsuu-2	śāstrayonitvāt / BBs_1,1.3 /	śāstra yoni tvāt 
SA_GSP33_brahmsuu-3	tat tu samanvayāt / BBs_1,1.4 /	tat tu samanvayāt 
SA_GSP33_brahmsuu-4	īkṣater nāśabdam / BBs_1,1.5 /	īkṣateḥ na a śabdam 
SA_GSP33_brahmsuu-5	gauṇaś cen nātmaśabdāt / BBs_1,1.6 /	gauṇaḥ ced na ātma śabdāt  /
SA_GSP33_brahmsuu-6	tanniṣṭhasya mokṣopadeśāt / BBs_1,1.7 /	tad niṣṭhasya mokṣa upadeśāt 
SA_GSP33_brahmsuu-7	heyatvāvacanāc ca / BBs_1,1.8 /	heya tva avacanāt ca 
SA_GSP33_brahmsuu-8	pratijñāvirodhāt / BBs_1,1.9 /	pratijñā virodhāt 
SA_GSP33_brahmsuu-9	svāpyayāt / BBs_1,1.10 /	sva apyayāt  
SA_GSP33_brahmsuu-10	gatisāmānyāt / BBs_1,1.11 /	gati sāmānyāt 
SA_GSP33_brahmsuu-11	śrutatvāc ca / BBs_1,1.12 /	śruta tvāt ca 
SA_GSP33_brahmsuu-12	ānandamayo 'bhyāsāt / BBs_1,1.13 /	ānanda mayaḥ bhyāsāt 
SA_GSP33_brahmsuu-13	vikāraśabdān neti cen na prācuryāt / BBs_1,1.14 /	vikāra śabdāt na iti ced na prācuryāt 
SA_GSP33_brahmsuu-14	taddhetuvyapadeśāc ca / BBs_1,1.15 /	tad hetu vyapadeśāt ca 
SA_GSP33_brahmsuu-15	māntravarṇikameva ca gīyate / BBs_1,1.16 /	māntravarṇikam eva ca gīyate 
SA_GSP33_brahmsuu-16	netaro 'nupapatteḥ / BBs_1,1.17 /	na itaraḥ nupapatteḥ  /
SA_GSP33_brahmsuu-17	bhedavyapadeśāc ca / BBs_1,1.18 /	bheda vyapadeśāt ca 
SA_GSP33_brahmsuu-18	kāmāc ca nānumānāpekṣā / BBs_1,1.19 /	kāmāt ca na anumāna apekṣā 
SA_GSP33_brahmsuu-19	asminn asya ca tadyogaṃ śāsti / BBs_1,1.20 /	asmin asya ca tad yogam śāsti  /
SA_GSP33_brahmsuu-20	antas taddharmopadeśāt / BBs_1,1.21 /	antar tad dharma upadeśāt 
SA_GSP33_brahmsuu-21	bhedavyapadeśāc cānyaḥ / BBs_1,1.22 /	bheda vyapadeśāt ca anyaḥ 
SA_GSP33_brahmsuu-22	ākāśas talliṅgāt / BBs_1,1.23 /	ākāśaḥ tad liṅgāt  /
SA_GSP33_brahmsuu-23	ata eva prāṇaḥ / BBs_1,1.24 /	atas eva prāṇaḥ 
SA_GSP33_brahmsuu-24	jyotiś caraṇābhidhānāt / BBs_1,1.25 /	jyotiḥ caraṇa abhidhānāt 
SA_GSP33_brahmsuu-25	chando 'bhidhānān neti cen na tathā ceto'rpaṇanigadāt tathā hi darśanam / BBs_1,1.26 /	chandaḥ abhidhānāt na iti ced na tathā cetaḥ ūrpaṇa nigadāt tathā hi darśanam 
SA_GSP33_brahmsuu-26	bhūtādipādavyapadeśopapatteś caivam / BBs_1,1.27 /	bhūta ādi pāda vyapadeśa upapatteḥ ca evam 
SA_GSP33_brahmsuu-27	upadeśabhedān neti cen nobhayasminn apy avirodhāt / BBs_1,1.28 /	upadeśa bhedāt na iti ced na ubhayasmin api avirodhāt 
SA_GSP33_brahmsuu-28	prāṇas tathānugamāt / BBs_1,1.29 /	prāṇaḥ tathā anugamāt 
SA_GSP33_brahmsuu-29	na vaktur ātmopadeśād iti ced adhyātmasaṃbandhabhūmā hy asmin / BBs_1,1.30 /	na vaktuḥ ātma upadeśāt iti ced adhyātma saṃbandha bhūmā hi asmin 
SA_GSP33_brahmsuu-30	śāstradṛṣṭyā tūpadeśo vāmadevavat / BBs_1,1.31 /	śāstra dṛṣṭyā tu upadeśaḥ vāmadeva vat 
SA_GSP33_brahmsuu-31	jīvamukhyaprāṇaliṅgān neti cen nopāsātraividhyādāśritatvād iha tadyogāt / BBs_1,1.32 /	jīva mukhya prāṇa liṅgāt na iti ced na upāsā traividhyāt āśrita tvāt iha tad yogāt 
SA_GSP33_brahmsuu-32	sarvatra prasiddhopadeśāt / BBs_1,2.1 /	sarvatra prasiddha upadeśāt 
SA_GSP33_brahmsuu-33	vivakṣitaguṇopapatteś ca / BBs_1,2.2 /	vivakṣita guṇa upapatteḥ ca 
SA_GSP33_brahmsuu-34	anupapattes tu na śārīraḥ / BBs_1,2.3 /	anupapatteḥ tu na śārīraḥ 
SA_GSP33_brahmsuu-35	karmakartṛvyapadeśāc ca / BBs_1,2.4 /	karma kartṛ vyapadeśāt ca 
SA_GSP33_brahmsuu-36	śabdaviśeṣāt / BBs_1,2.5 /	śabda viśeṣāt 
SA_GSP33_brahmsuu-37	smṛteś ca / BBs_1,2.6 /	smṛteḥ ca 
SA_GSP33_brahmsuu-38	arbhakaustvāt tadvyapadeśāc ca neti cen na nicāyyatvād evaṃ vyomavac ca / BBs_1,2.7 /	arbhakaustvāt tad vyapadeśāt ca na iti ced na nicāyya tvāt evam vyoma vat ca 
SA_GSP33_brahmsuu-39	saṃbhogaprāptir iti cen na vaiśeṣyāt / BBs_1,2.8 /	saṃbhoga prāptiḥ iti ced na vaiśeṣyāt 
SA_GSP33_brahmsuu-40	attā carācaragrahaṇāt / BBs_1,2.9 /	attā cara acara grahaṇāt 
SA_GSP33_brahmsuu-41	prakaraṇāc ca / BBs_1,2.10 /	prakaraṇāt ca 
SA_GSP33_brahmsuu-42	guhāṃ praviṣṭāv ātmānau hi taddarśanāt / BBs_1,2.11 /	guhām praviṣṭau ātmānau hi tad darśanāt 
SA_GSP33_brahmsuu-43	viśeṣaṇāc ca / BBs_1,2.12 /	viśeṣaṇāt ca 
SA_GSP33_brahmsuu-44	antara upapatteḥ / BBs_1,2.13 /	antare upapatteḥ 
SA_GSP33_brahmsuu-45	sthānādivyapadeśāc ca / BBs_1,2.14 /	sthāna ādi vyapadeśāt ca 
SA_GSP33_brahmsuu-46	sukhaviśiṣṭābhidhānād eva ca / BBs_1,2.15 /	sukha viśiṣṭa abhidhānāt eva ca 
SA_GSP33_brahmsuu-47	ata eva ca sa brahma / BBs_1,2.16 /	atas eva ca sa brahma  
SA_GSP33_brahmsuu-48	śrutopaniṣatkagatyabhidhānāc ca / BBs_1,2.17 /	śruta upaniṣatka gati abhidhānāt ca 
SA_GSP33_brahmsuu-49	anavasthiter asaṃbhavāc ca netaraḥ / BBs_1,2.18 /	anavasthiteḥ asaṃbhavāt ca na itaraḥ 
SA_GSP33_brahmsuu-50	antaryāmyadhidaivādhilokādiṣu taddharmavyapadeśāt / BBs_1,2.19 /	antaryāmi adhidaiva adhiloka ādiṣu tad dharma vyapadeśāt 
SA_GSP33_brahmsuu-51	na ca smārtam ataddharmābhilāpāc chārīraś ca / BBs_1,2.20 /	na ca smārtam a tad dharma abhilāpāt śārīraḥ ca 
SA_GSP33_brahmsuu-52	ubhaye 'pi hi bhedenainam adhīyate / BBs_1,2.21 /	ubhaye pi hi bhedena enam adhīyate   /
SA_GSP33_brahmsuu-53	adṛśyatvādiguṇako dharmokteḥ / BBs_1,2.22 /	adṛśya tva ādi guṇakaḥ dharma ukteḥ 
SA_GSP33_brahmsuu-54	viśeṣaṇabhedavyapadeśābhyāṃ ca netarau / BBs_1,2.23 /	viśeṣaṇa bheda vyapadeśābhyām ca na itarau 
SA_GSP33_brahmsuu-55	rūpopanyāsāc ca / BBs_1,2.24 /	rūpa upanyāsāt ca 
SA_GSP33_brahmsuu-56	vaiśvānaraḥ sādhāraṇaśabdaviśeṣāt / BBs_1,2.25 /	vaiśvānaraḥ sādhāraṇa śabda viśeṣāt 
SA_GSP33_brahmsuu-57	smaryamāṇam anumānaṃ syād iti / BBs_1,2.26 /	smaryamāṇam anumānam syāt iti 
SA_GSP33_brahmsuu-58	śabdādibhyo 'ntaḥpratiṣṭhānāc ca neti cen na tathā dṛṣṭyupadeśād asambhavāt puruṣamapi cainam adhīyate / BBs_1,2.27 /	śabda ādibhyaḥ ntar pratiṣṭhānāt ca na iti ced na tathā dṛṣṭi upadeśāt asambhavāt puruṣam api ca enam adhīyate  /
SA_GSP33_brahmsuu-59	ata eva na devatā bhūtaṃ ca / BBs_1,2.28 /	atas eva na devatā bhūtam ca 
SA_GSP33_brahmsuu-60	sākṣād apy avirodhaṃ jaiminiḥ / BBs_1,2.29 /	sākṣāt api avirodham jaiminiḥ 
SA_GSP33_brahmsuu-61	abhivyakter ity āśmarathyaḥ / BBs_1,2.30 /	abhivyakteḥ iti āśmarathyaḥ 
SA_GSP33_brahmsuu-62	anusmṛter bādariḥ / BBs_1,2.31 /	anusmṛteḥ bādariḥ 
SA_GSP33_brahmsuu-63	saṃpatter iti jaiminis tathā hi darśayati / BBs_1,2.32 /	saṃpatteḥ iti jaiminiḥ tathā hi darśayati 
SA_GSP33_brahmsuu-64	āmananti cainam asmin / BBs_1,2.33 /	āmananti ca enam asmin  /
SA_GSP33_brahmsuu-65	dyubhvādyāyatanaṃ svaśabdāt / BBs_1,3.1 /	dyu bhū ādi āyatanam sva śabdāt  /
SA_GSP33_brahmsuu-66	muktopasṛpyavyapadeśāc ca / BBs_1,3.2 /	mukta upasṛpya vyapadeśāt ca 
SA_GSP33_brahmsuu-67	nānumānam atacchabdāt prāṇabhṛc ca / BBs_1,3.3 /	na anumānam a tad śabdāt prāṇabhṛt ca 
SA_GSP33_brahmsuu-68	bhedavyapadeśāt / BBs_1,3.4 /	bheda vyapadeśāt 
SA_GSP33_brahmsuu-69	prakaraṇāt / BBs_1,3.5 /	prakaraṇāt 
SA_GSP33_brahmsuu-70	sthityadanābhyāṃ ca / BBs_1,3.6 /	sthiti adanābhyām ca 
SA_GSP33_brahmsuu-71	bhūmā saṃprasādād adhyupadeśāt / BBs_1,3.7 /	bhūmā saṃprasādāt adhyupadeśāt 
SA_GSP33_brahmsuu-72	dharmopapatteś ca / BBs_1,3.8 /	dharma upapatteḥ ca 
SA_GSP33_brahmsuu-73	akṣaram ambarāntadhṛteḥ / BBs_1,3.9 /	akṣaram ambara anta dhṛteḥ  /
SA_GSP33_brahmsuu-74	sā ca praśāsanāt / BBs_1,3.10 /	sā ca praśāsanāt 
SA_GSP33_brahmsuu-75	anyabhāvavyāvṛtteśca / BBs_1,3.11 /	anya bhāva vyāvṛtteḥ ca 
SA_GSP33_brahmsuu-76	īkṣatikarmavyapadeśāt saḥ / BBs_1,3.12 /	īkṣati karma vyapadeśāt saḥ 
SA_GSP33_brahmsuu-77	dahara uttarebhyaḥ / BBs_1,3.13 /	daharaḥ uttarebhyaḥ 
SA_GSP33_brahmsuu-78	gatiśabdābhyāṃ tathā hi dṛṣṭaṃ liṅgaṃ ca / BBs_1,3.14 /	gati śabdābhyām tathā hi dṛṣṭam liṅgam ca 
SA_GSP33_brahmsuu-79	dhṛteś ca mahimno 'syāsminn upalabdheḥ / BBs_1,3.15 /	dhṛteḥ ca mahimnaḥ sya asmin upalabdheḥ  
SA_GSP33_brahmsuu-80	prasiddheś ca / BBs_1,3.16 /	prasiddheḥ ca 
SA_GSP33_brahmsuu-81	itaraparāmarśāt sa iti cen nāsaṃbhavāt / BBs_1,3.17 /	itara parāmarśāt saḥ iti ced na asaṃbhavāt 
SA_GSP33_brahmsuu-82	uttarāc ced āvirbhūtasvarūpas tu / BBs_1,3.18 /	uttarāt ced āvirbhūta svarūpaḥ tu 
SA_GSP33_brahmsuu-83	anyārthaś ca parāmarśaḥ / BBs_1,3.19 /	anya arthaḥ ca parāmarśaḥ 
SA_GSP33_brahmsuu-84	alpaśruter iti cet tad uktam / BBs_1,3.20 /	alpa śruteḥ iti ced tat uktam 
SA_GSP33_brahmsuu-85	anukṛtes tasya ca / BBs_1,3.21 /	anukṛteḥ tasya ca 
SA_GSP33_brahmsuu-86	api ca smaryate / BBs_1,3.22 /	api ca smaryate  /
SA_GSP33_brahmsuu-87	śabdād eva pramitaḥ / BBs_1,3.23 /	śabdāt eva pramitaḥ 
SA_GSP33_brahmsuu-88	hṛdyapekṣayā tu manuṣyādhikāratvāt / BBs_1,3.24 /	hṛdi apekṣayā tu manuṣya adhikāra tvāt 
SA_GSP33_brahmsuu-89	tadupary api bādarāyaṇaḥ saṃbhavāt / BBs_1,3.25 /	tad upari api bādarāyaṇaḥ saṃbhavāt  /
SA_GSP33_brahmsuu-90	virodhaḥ karmaṇīti cen nānekapratipatter darśanāt / BBs_1,3.26 /	virodhaḥ karmaṇi iti ced na aneka pratipatteḥ darśanāt  /
SA_GSP33_brahmsuu-91	śabda iti cen nātaḥ prabhavāt pratyakṣānumānābhyām / BBs_1,3.27 /	śabdaḥ iti ced na atas prabhavāt pratyakṣa anumānābhyām 
SA_GSP33_brahmsuu-92	ata eva ca nityatvam / BBs_1,3.28 /	atas eva ca nitya tvam 
SA_GSP33_brahmsuu-93	samānanāmarūpatvāccāvṛttāvapyavirodho darśanāt smṛteś ca / BBs_1,3.29 /	samāna nāma rūpa tvāt ca avṛttau api avirodhaḥ darśanāt smṛteḥ ca 
SA_GSP33_brahmsuu-94	madhvādiṣv asaṃbhavād anadhikāraṃ jaiminiḥ / BBs_1,3.30 /	madhu ādiṣu asaṃbhavāt anadhikāram jaiminiḥ 
SA_GSP33_brahmsuu-95	jyotiṣi bhāvāc ca / BBs_1,3.31 /	jyotiṣi bhāvāt ca 
SA_GSP33_brahmsuu-96	bhāvaṃ tu bādarāyaṇo 'sti hi / BBs_1,3.32 /	bhāvam tu bādarāyaṇaḥ sti hi 
SA_GSP33_brahmsuu-97	śugasya tadanādaraśravaṇāt tadādravaṇāt sūcyate hi / BBs_1,3.33 /	śugasya tad anādara śravaṇāt tad ādravaṇāt sūcyate hi 
SA_GSP33_brahmsuu-98	kṣatriyatvagateś ca / BBs_1,3.34 /	kṣatriya tva gateḥ ca 
SA_GSP33_brahmsuu-99	uttaratra caitrarathena liṅgāt / BBs_1,3.35 /	uttaratra caitrarathena liṅgāt  /
SA_GSP33_brahmsuu-100	saṃskāraparāmarśāt tadabhāvābhilāpāc ca / BBs_1,3.36 /	saṃskāra parāmarśāt tad abhāva abhilāpāt ca 
SA_GSP33_brahmsuu-101	tadabhāvanirdhāraṇe ca pravṛtteḥ / BBs_1,3.37 /	tad abhāva nirdhāraṇe ca pravṛtteḥ 
SA_GSP33_brahmsuu-102	śravaṇādhyayanārthapratiṣedhāt / BBs_1,3.38 /	śravaṇa adhyayana artha pratiṣedhāt 
SA_GSP33_brahmsuu-103	smṛteś ca / BBs_1,3.39 /	smṛteḥ ca 
SA_GSP33_brahmsuu-104	kampanāt / BBs_1,3.40 /	kampanāt 
SA_GSP33_brahmsuu-105	jyotir darśanāt / BBs_1,3.41 /	jyotiḥ darśanāt 
SA_GSP33_brahmsuu-106	ākāśo 'rthāntaratvādivyapadeśāt / BBs_1,3.42 /	ākāśaḥ ṛtha antara tva ādi vyapadeśāt 
SA_GSP33_brahmsuu-107	suṣuptyutkrāntyor bhedena / BBs_1,3.43 /	suṣupti utkrāntyoḥ bhedena 
SA_GSP33_brahmsuu-108	patyādiśabdebhyaḥ / BBs_1,3.44 /	pati ādi śabdebhyaḥ 
SA_GSP33_brahmsuu-109	ānumānikam apy ekeṣām iti cen na śarīra-rūpaka-vinyasta-gṛhīter darśayati ca / BBs_1,4.1 /	ānumānikam api ekeṣām iti ced na śarīra rūpaka vinyasta gṛhīteḥ darśayati ca 
SA_GSP33_brahmsuu-110	sūkṣmaṃ tu tadarhatvāt / BBs_1,4.2 /	sūkṣmam tu tad arha tvāt 
SA_GSP33_brahmsuu-111	tadadhīnatvād arthavat / BBs_1,4.3 /	tad adhīna tvāt arthavat  /
SA_GSP33_brahmsuu-112	jñeyatvāvacanāc ca / BBs_1,4.4 /	jñeya tva avacanāt ca 
SA_GSP33_brahmsuu-113	vadatīti cen na prājño hi prakaraṇāt / BBs_1,4.5 /	vadati iti ced na prājñaḥ hi prakaraṇāt 
SA_GSP33_brahmsuu-114	trayāṇām eva caivam upanyāsaḥ praśnaś ca / BBs_1,4.6 /	trayāṇām eva ca evam upanyāsaḥ praśnaḥ ca 
SA_GSP33_brahmsuu-115	mahadvac ca / BBs_1,4.7 /	mahadvat ca 
SA_GSP33_brahmsuu-116	camasavadaviśeṣāt / BBs_1,4.8 /	camasa vat aviśeṣāt  /
SA_GSP33_brahmsuu-117	jyotirupakramā tu tathā hy adhīyata eke / BBs_1,4.9 /	jyotiḥ upakramā tu tathā hi adhīyate eke  /
SA_GSP33_brahmsuu-118	kalpanopadeśāc ca madhvādivadavirodhaḥ / BBs_1,4.10 /	kalpanā upadeśāt ca madhu ādi vat avirodhaḥ 
SA_GSP33_brahmsuu-119	na saṃkhyopasaṃgrahādapi jñānābhāvād atirekāc ca / BBs_1,4.11 /	na saṃkhyā upasaṃgrahāt api jñāna abhāvāt atirekāt ca 
SA_GSP33_brahmsuu-120	prāṇādayo vākyaśeṣāt / BBs_1,4.12 /	prāṇa ādayaḥ vākya śeṣāt 
SA_GSP33_brahmsuu-121	jyotiṣaikeṣām asatyanne / BBs_1,4.13 /	jyotiṣā ekeṣām a sati anne  /
SA_GSP33_brahmsuu-122	kāraṇatvena cākāśādiṣu yathāvyapadiṣṭokteḥ / BBs_1,4.14 /	kāraṇa tvena ca ākāśa ādiṣu yathā vyapadiṣṭa ukteḥ 
SA_GSP33_brahmsuu-123	samākarṣāt / BBs_1,4.15 /	samākarṣāt 
SA_GSP33_brahmsuu-124	jagadvācitvāt / BBs_1,4.16 /	jagat vāci tvāt 
SA_GSP33_brahmsuu-125	jīvamukhyaprāṇaliṅgān neti cet tadvyākhyātam / BBs_1,4.17 /	jīva mukhya prāṇa liṅgāt na iti ced tat vyākhyātam 
SA_GSP33_brahmsuu-126	anyārthaṃ tu jaiminiḥ praśnavyākhyānābhyām api caivam eke / BBs_1,4.18 /	anya artham tu jaiminiḥ praśna vyākhyānābhyām api ca evam eke  /
SA_GSP33_brahmsuu-127	vākyānvayāt / BBs_1,4.19 /	vākya anvayāt  /
SA_GSP33_brahmsuu-128	pratijñāsiddher liṅgam āśmarathyaḥ / BBs_1,4.20 /	pratijñā siddheḥ liṅgam āśmarathyaḥ 
SA_GSP33_brahmsuu-129	utkramiṣyata evaṃ bhāvād ity auḍulomiḥ / BBs_1,4.21 /	utkramiṣyate evam bhāvāt iti auḍulomiḥ   
SA_GSP33_brahmsuu-130	avasthiter iti kāśakṛtsnaḥ / BBs_1,4.22 /	avasthiteḥ iti kāśakṛtsnaḥ 
SA_GSP33_brahmsuu-131	prakṛtiś ca pratijñādṛṣṭāntānuparodhāt / BBs_1,4.23 /	prakṛtiḥ ca pratijñā dṛṣṭānta an uparodhāt 
SA_GSP33_brahmsuu-132	abhidhyopadeśāc ca / BBs_1,4.24 /	abhidhyā upadeśāt ca 
SA_GSP33_brahmsuu-133	sākṣāc cobhayāmnānāt / BBs_1,4.25 /	sākṣāt ca ubhaya āmnānāt  /
SA_GSP33_brahmsuu-134	ātmakṛteḥ / BBs_1,4.26 /	ātma kṛteḥ 
SA_GSP33_brahmsuu-135	pariṇāmāt / BBs_1,4.27 /	pariṇāmāt 
SA_GSP33_brahmsuu-136	yoniś ca hi gīyate / BBs_1,4.28 /	yoniḥ ca hi gīyate  /
SA_GSP33_brahmsuu-137	etena sarve vyākhyātā vyākhyātāḥ / BBs_1,4.29 /	etena sarve vyākhyātāḥ vyākhyātāḥ 
SA_GSP33_brahmsuu-138	smṛtyanavakāśadoṣaprasaṅga iti cen nānyasmṛtyanavakāśadoṣaprasaṅgāt / BBs_2,1.1 /	smṛti anavakāśa doṣa prasaṅgaḥ iti ced na anya smṛti anavakāśa doṣa prasaṅgāt 
SA_GSP33_brahmsuu-139	itareṣāṃ cānupalabdheḥ / BBs_2,1.2 /	itareṣām ca anupalabdheḥ 
SA_GSP33_brahmsuu-140	etena yogaḥ pratyuktaḥ / BBs_2,1.3 /	etena yogaḥ pratyuktaḥ 
SA_GSP33_brahmsuu-141	na vilakṣaṇatvād asya tathātvaṃ ca śabdāt / BBs_2,1.4 /	na vilakṣaṇa tvāt asya tathātvam ca śabdāt 
SA_GSP33_brahmsuu-142	abhimānivyapadeśas tu viśeṣānugatibhyām / BBs_2,1.5 /	abhimāni vyapadeśaḥ tu viśeṣa anugatibhyām 
SA_GSP33_brahmsuu-143	dṛśyate tu / BBs_2,1.6 /	dṛśyate tu 
SA_GSP33_brahmsuu-144	asad iti cen na pratiṣedhamātratvāt / BBs_2,1.7 /	asat iti ced na pratiṣedha mātra tvāt 
SA_GSP33_brahmsuu-145	apītau tadvatprasaṅgād asamañjasam / BBs_2,1.8 /	apītau tadvat prasaṅgāt asamañjasam  /
SA_GSP33_brahmsuu-146	na tu dṛṣṭāntabhāvāt / BBs_2,1.9 /	na tu dṛṣṭānta bhāvāt 
SA_GSP33_brahmsuu-147	svapakṣadoṣāc ca / BBs_2,1.10 /	sva pakṣa doṣāt ca 
SA_GSP33_brahmsuu-148	tarkāpratiṣṭhānād api / BBs_2,1.11 /	tarka apratiṣṭhānāt api 
SA_GSP33_brahmsuu-149	anyathānumeyam iti ced evam apy anirmokṣaprasaṅgaḥ / BBs_2,1.12 /	anyathā anumeyam iti ced evam api anirmokṣa prasaṅgaḥ 
SA_GSP33_brahmsuu-150	etena śiṣṭāparigrahā api vyākhyātāḥ / BBs_2,1.13 /	etena śiṣṭa a parigrahāḥ api vyākhyātāḥ 
SA_GSP33_brahmsuu-151	bhoktrāpatter avibhāgaś cet syāl lokavat / BBs_2,1.14 /	bhoktṛ āpatteḥ avibhāgaḥ ced syāt loka vat 
SA_GSP33_brahmsuu-152	tadananyatvam ārambhaṇaśabdādibhyaḥ / BBs_2,1.15 /	tad ananya tvam ārambhaṇa śabda ādibhyaḥ 
SA_GSP33_brahmsuu-153	bhāve copalabdheḥ / BBs_2,1.16 /	bhāve ca upalabdheḥ 
SA_GSP33_brahmsuu-154	satvāc cāparasya / BBs_2,1.17 /	sa tvāt ca aparasya  /
SA_GSP33_brahmsuu-155	asadvyapadeśān neti cen na dharmāntareṇa vākyaśeṣādyukteḥ śabdāntarāc ca / BBs_2,1.18 /	asat vyapadeśāt na iti ced na dharma antareṇa vākyaśeṣa ādi ukteḥ śabda antarāt ca 
SA_GSP33_brahmsuu-156	paṭavac ca / BBs_2,1.19 /	paṭa vat ca 
SA_GSP33_brahmsuu-157	yathā ca prāṇādiḥ / BBs_2,1.20 /	yathā ca prāṇa ādiḥ 
SA_GSP33_brahmsuu-158	itaravyapadeśād dhitākaraṇādidoṣaprasaktiḥ / BBs_2,1.21 /	itara vyapadeśāt dhita akaraṇa ādi doṣa prasaktiḥ 
SA_GSP33_brahmsuu-159	adhikaṃ tu bhedanirdeśāt / BBs_2,1.22 /	adhikam tu bheda nirdeśāt 
SA_GSP33_brahmsuu-160	aśmādivac ca tadanupapattiḥ / BBs_2,1.23 /	aśma ādi vat ca tad anupapattiḥ 
SA_GSP33_brahmsuu-161	upasaṃhāradarśanān neti cen na kṣīravad dhi / BBs_2,1.24 /	upasaṃhāra darśanāt na iti ced na kṣīravat hi 
SA_GSP33_brahmsuu-162	devādivad api loke / BBs_2,1.25 /	deva ādi vat api loke  /
SA_GSP33_brahmsuu-163	kṛtsnaprasaktir niravayavatvaśabdakopo vā / BBs_2,1.26 /	kṛtsna prasaktiḥ niravayava tva śabda kopaḥ vā 
SA_GSP33_brahmsuu-164	śrutes tu śabdamūlatvāt / BBs_2,1.27 /	śruteḥ tu śabda mūla tvāt 
SA_GSP33_brahmsuu-165	ātmani caivaṃ vicitrāś ca hi / BBs_2,1.28 /	ātmani ca evam vicitrāḥ ca hi 
SA_GSP33_brahmsuu-166	svapakṣadoṣāc ca / BBs_2,1.29 /	sva pakṣa doṣāt ca 
SA_GSP33_brahmsuu-167	sarvopetā ca taddarśanāt / BBs_2,1.30 /	sarva upetā ca tad darśanāt 
SA_GSP33_brahmsuu-168	vikaraṇatvān neti cet tad uktam / BBs_2,1.31 /	vikaraṇa tvāt na iti ced tat uktam 
SA_GSP33_brahmsuu-169	na prayojanavattvāt / BBs_2,1.32 /	na prayojanavat tvāt 
SA_GSP33_brahmsuu-170	lokavat tu līlākaivalyam / BBs_2,1.33 /	loka vat tu līlā kaivalyam 
SA_GSP33_brahmsuu-171	vaiṣamyanairghṛṇye na sāpekṣatvāt tathā hi darśayati / BBs_2,1.34 /	vaiṣamya nairghṛṇye na sāpekṣa tvāt tathā hi darśayati 
SA_GSP33_brahmsuu-172	na karmāvibhāgād iti cen nānāditvād upapadyate cāpy upalabhyate ca / BBs_2,1.35 /	na karma avibhāgāt iti ced na anādi tvāt upapadyate ca api upalabhyate ca  /
SA_GSP33_brahmsuu-173	sarvadharmopapatteś ca / BBs_2,1.36 /	sarva dharma upapatteḥ ca 
SA_GSP33_brahmsuu-174	racanānupapatteś ca nānumānaṃ pravṛtteś ca / BBs_2,2.1 /	racanā anupapatteḥ ca na anumānam pravṛtteḥ ca 
SA_GSP33_brahmsuu-175	payo 'mbuvac cet tatrāpi / BBs_2,2.2 /	payaḥ mbu vat ced tatra api 
SA_GSP33_brahmsuu-176	vyatirekānavasthiteś cānapekṣatvāt / BBs_2,2.3 /	vyatireka anavasthiteḥ ca anapekṣa tvāt 
SA_GSP33_brahmsuu-177	anyatrābhāvāc ca na tṛṇādivat / BBs_2,2.4 /	anyatra abhāvāt ca na tṛṇa ādi vat 
SA_GSP33_brahmsuu-178	puruṣāśmavad iti cet tathāpi / BBs_2,2.5 /	puruṣa aśma vat iti ced tathā api 
SA_GSP33_brahmsuu-179	aṅgitvānupapatteś ca / BBs_2,2.6 /	aṅgi tva anupapatteḥ ca 
SA_GSP33_brahmsuu-180	anyathānumitau ca jñaśaktiviyogāt / BBs_2,2.7 /	anyathā anumitau ca jña śakti viyogāt 
SA_GSP33_brahmsuu-181	abhyupagame 'py arthābhāvāt / BBs_2,2.8 /	abhyupagame pi artha abhāvāt 
SA_GSP33_brahmsuu-182	vipratiṣedhāc cāsamañjasam / BBs_2,2.9 /	vipratiṣedhāt ca asamañjasam 
SA_GSP33_brahmsuu-183	mahaddīrghavad vā hrasvaparimaṇḍalābhyām / BBs_2,2.10 /	mahat dīrgha vat vā hrasva parimaṇḍalābhyām 
SA_GSP33_brahmsuu-184	ubhayathāpi na karmātastadabhāvaḥ / BBs_2,2.11 /	ubhayathā api na karma atas tad abhāvaḥ 
SA_GSP33_brahmsuu-185	samavāyābhyupagamāc ca sāmyād anavasthiteḥ / BBs_2,2.12 /	samavāya abhyupagamāt ca sāmyāt anavasthiteḥ 
SA_GSP33_brahmsuu-186	nityam eva ca bhāvāt / BBs_2,2.13 /	nityam eva ca bhāvāt 
SA_GSP33_brahmsuu-187	rūpādimattvāc ca viparyayo darśanāt / BBs_2,2.14 /	rūpa ādimat tvāt ca viparyayaḥ darśanāt 
SA_GSP33_brahmsuu-188	ubhayathā ca doṣāt / BBs_2,2.15 /	ubhayathā ca doṣāt 
SA_GSP33_brahmsuu-189	aparigrahāc cātyantam anapekṣā / BBs_2,2.16 /	aparigrahāt ca atyantam anapekṣā 
SA_GSP33_brahmsuu-190	samudāya ubhayahetuke 'pi tadaprāptiḥ / BBs_2,2.17 /	samudāyaḥ ubhaya hetuke tad aprāptiḥ 
SA_GSP33_brahmsuu-191	itaretarapratyayatvād upapannam iti cen na saṅghātabhāvānimittatvāt / BBs_2,2.18 /	itaretara pratyaya tvāt upapannam iti ced na saṅghāta bhāva animitta tvāt 
SA_GSP33_brahmsuu-192	uttarotpāde ca pūrvanirodhāt / BBs_2,2.19 /	uttara utpāde ca pūrva nirodhāt 
SA_GSP33_brahmsuu-193	asati pratijñoparodho yaugapadyamanyathā / BBs_2,2.20 /	asati pratijñā uparodhaḥ yaugapadyam anyathā 
SA_GSP33_brahmsuu-194	pratisaṃkhyāpratisaṃkhyānirodhāprāptir avicchedāt / BBs_2,2.21 /	pratisaṃkhyā pratisaṃkhyā nirodha aprāptiḥ avicchedāt 
SA_GSP33_brahmsuu-195	ubhayathā ca doṣāt / BBs_2,2.22 /	ubhayathā ca doṣāt 
SA_GSP33_brahmsuu-196	ākāśe cāviśeṣāt / BBs_2,2.23 /	ākāśe ca aviśeṣāt 
SA_GSP33_brahmsuu-197	anusmṛteś ca / BBs_2,2.24 /	anusmṛteḥ ca 
SA_GSP33_brahmsuu-198	nāsato 'dṛṣṭatvāt / BBs_2,2.25 /	na asataḥ dṛṣṭa tvāt  /
SA_GSP33_brahmsuu-199	udāsīnānām api caivaṃ siddhiḥ / BBs_2,2.26 /	udāsīnānām api ca evam siddhiḥ 
SA_GSP33_brahmsuu-200	nābhāva upalabdheḥ / BBs_2,2.27 /	na abhāvaḥ upalabdheḥ 
SA_GSP33_brahmsuu-201	vaidharmyāc ca na svapnādivat / BBs_2,2.28 /	vaidharmyāt ca na svapna ādi vat 
SA_GSP33_brahmsuu-202	na bhāvo 'nupalabdheḥ / BBs_2,2.29 /	na bhāvaḥ n upalabdheḥ 
SA_GSP33_brahmsuu-203	sarvathānupapatteś ca / BBs_2,2.30 /	sarvathā anupapatteḥ ca 
SA_GSP33_brahmsuu-204	naikasminn asambhavāt / BBs_2,2.31 /	na ekasmin asambhavāt  /
SA_GSP33_brahmsuu-205	evaṃ cātmākārtsnyam / BBs_2,2.32 /	evam ca ātma akārtsnyam 
SA_GSP33_brahmsuu-206	na ca paryāyād apy avirodho vikārādibhyaḥ / BBs_2,2.33 /	na ca paryāyāt api avirodhaḥ vikāra ādibhyaḥ 
SA_GSP33_brahmsuu-207	antyāvasthiteś cobhayanityatvād aviśeṣaḥ / BBs_2,2.34 /	antya avasthiteḥ ca ubhaya nitya tvāt aviśeṣaḥ 
SA_GSP33_brahmsuu-208	patyur asāmañjasyāt / BBs_2,2.35 /	patyuḥ asāmañjasyāt  /
SA_GSP33_brahmsuu-209	adhiṣṭhānānupapatteś ca / BBs_2,2.36 /	adhiṣṭhāna anupapatteḥ ca 
SA_GSP33_brahmsuu-210	karaṇavac cen na bhogādibhyaḥ / BBs_2,2.37 /	karaṇavat ced na bhoga ādibhyaḥ 
SA_GSP33_brahmsuu-211	antavattvam asarvajñatā vā / BBs_2,2.38 /	antavat tvam asarvajña tā vā 
SA_GSP33_brahmsuu-212	utpattyasaṃbhavāt / BBs_2,2.39 /	utpatti asaṃbhavāt 
SA_GSP33_brahmsuu-213	na ca kartuḥ karaṇam / BBs_2,2.40 /	na ca kartuḥ karaṇam  /
SA_GSP33_brahmsuu-214	vijñānādibhāve vā tadapratiṣedhaḥ / BBs_2,2.41 /	vijñāna ādi bhāve vā tad apratiṣedhaḥ 
SA_GSP33_brahmsuu-215	vipratiṣedhāc ca / BBs_2,2.42 /	vipratiṣedhāt ca 
SA_GSP33_brahmsuu-216	na viyadaśruteḥ / BBs_2,3.1 /	na viyat aśruteḥ 
SA_GSP33_brahmsuu-217	asti tu / BBs_2,3.2 /	asti tu 
SA_GSP33_brahmsuu-218	gauṇyasaṃbhavāc chabdāc ca / BBs_2,3.3 /	gauṇī asaṃbhavāt śabdāt ca 
SA_GSP33_brahmsuu-219	syāc caikasya brahmaśabdavat / BBs_2,3.4 /	syāt ca ekasya brahma śabda vat 
SA_GSP33_brahmsuu-220	pratijñāhānir avyatirekāt / BBs_2,3.5 /	pratijñāhāniḥ avyatirekāt 
SA_GSP33_brahmsuu-221	śabdebhyaḥ / BBs_2,3.6 /	śabdebhyaḥ 
SA_GSP33_brahmsuu-222	yāvadvikāraṃ tu vibhāgo lokavat / BBs_2,3.7 /	yāvadvikāram tu vibhāgaḥ loka vat 
SA_GSP33_brahmsuu-223	etena mātariśvā vyākhyātaḥ / BBs_2,3.8 /	etena mātariśvā vyākhyātaḥ  /
SA_GSP33_brahmsuu-224	asaṃbhavas tu sato 'nupapatteḥ / BBs_2,3.9 /	asaṃbhavaḥ tu sataḥ nupapatteḥ 
SA_GSP33_brahmsuu-225	tejo 'tas tathā hy āha / BBs_2,3.10 /	tejaḥ taḥ tathā hi āha  /
SA_GSP33_brahmsuu-226	āpaḥ / BBs_2,3.11 /	āpaḥ 
SA_GSP33_brahmsuu-227	pṛthivī / BBs_2,3.12 /	pṛthivī 
SA_GSP33_brahmsuu-228	adhikārarūpaśabdāntarebhyaḥ / BBs_2,3.13 /	adhikāra rūpa śabda antarebhyaḥ 
SA_GSP33_brahmsuu-229	tadabhidhyānād eva tu talliṅgāt saḥ / BBs_2,3.14 /	tad abhidhyānāt eva tu tad liṅgāt saḥ 
SA_GSP33_brahmsuu-230	viparyayeṇa tu kramo 'ta upapadyate ca / BBs_2,3.15 /	viparyayeṇa tu te upapadyate ca 
SA_GSP33_brahmsuu-231	antarā vijñānamanasī krameṇa talliṅgād iti cen nāviśeṣāt / BBs_2,3.16 /	antarā vijñāna manasī krameṇa tad liṅgāt iti ced na aviśeṣāt 
SA_GSP33_brahmsuu-232	carācaravyapāśrayas tu syāt tadvyapadeśo bhāktas tadbhāvabhāvitvāt / BBs_2,3.17 /	carācara vyapāśrayaḥ tu syāt tad vyapadeśaḥ bhāktaḥ tad bhāva bhāvi tvāt 
SA_GSP33_brahmsuu-233	nātmā śruter nityatvāc ca tābhyaḥ / BBs_2,3.18 /	na ātmā śruteḥ nitya tvāt ca tābhyaḥ 
SA_GSP33_brahmsuu-234	jño 'ta eva / BBs_2,3.19 /	te eva 
SA_GSP33_brahmsuu-235	utkrāntigatyāgatīnām / BBs_2,3.20 /	utkrānti gati āgatīnām 
SA_GSP33_brahmsuu-236	svātmanā cottarayoḥ / BBs_2,3.21 /	sva ātmanā ca uttarayoḥ  /
