segmentnr	original	analyzed
SA_GK19_ragh1-6u-324	tasyāḥ prasannendumukhaḥ prasādaṃ gururnṛpāṇāṃ gurave nivedya /	tasyāḥ prasanna indu mukhaḥ prasādam guruḥ nṛpāṇām gurave nivedya 
SA_GK19_ragh1-6u-325	mukhaprasādānumitaṃ priyāyai śaśaṃsa vācā punaruktayaiva // Ragh(K)_2.68 //	mukha prasāda anumitam priyāyai śaśaṃsa vācā punar uktayā eva 
SA_GK19_ragh1-6u-326	sa nandinīstanyamaninditātmā sadvatsalo vatsanipītaśeṣam /	sa nandinī stanyam anindita ātmā sat vatsalaḥ vatsa nipīta śeṣam 
SA_GK19_ragh1-6u-327	papau vasiṣṭhena kṛtābhyanujñaḥ śuddhaṃ yaśo bhūya ivāvitṛptaḥ // Ragh(K)_2.69 //	papau vasiṣṭhena kṛta abhyanujñaḥ śuddham yaśaḥ bhūyas iva a vitṛptaḥ 
SA_GK19_ragh1-6u-328	prātaryathoktavratapāraṇānte prāsthānikaṃ svastyayanaṃ prayujya /	prātar yathā ukta vrata pāraṇa ante prāsthānikam svastyayanam prayujya 
SA_GK19_ragh1-6u-329	tau dampatī svāṃ prati rājadhānīṃ prasthāpayāmāsa vaśī vasiṣṭhaḥ // Ragh(K)_2.70 //	tau dampatī svām prati rājadhānīm prasthāpayāmāsa vaśī vasiṣṭhaḥ 
SA_GK19_ragh1-6u-330	pradakṣiṇīkṛtya hutaṃ hutāśamanantaraṃ bharturarundhatīṃ ca /	pradakṣiṇīkṛtya hutam hutāśam anantaram bhartuḥ arundhatīm ca 
SA_GK19_ragh1-6u-331	dhenuṃ savatsāṃ ca nṛpaḥ pratasthe sanmaṅgalodagratarānubhāvaḥ // Ragh(K)_2.71 //	dhenum sa vatsām ca nṛpaḥ pratasthe sat maṅgala udagratara anubhāvaḥ 
SA_GK19_ragh1-6u-332	śrotrābhirāmadhvaninā rathena sa dharmapatnīsahitaḥ sahiṣṇuḥ /	śrotra abhirāma dhvaninā rathena sa dharma patnī sahitaḥ sahiṣṇuḥ 
SA_GK19_ragh1-6u-333	yayāvanudghātasukhena mārgaṃ sveneva pūrṇena manorathena // Ragh(K)_2.72 //	yayau an udghāta sukhena mārgam svena iva pūrṇena manorathena 
SA_GK19_ragh1-6u-334	tamāhitotkaṇṭhamadarśanena prajāḥ prajārthavratakarṣitāṅgam /	tam āhita utkaṇṭham adarśanena prajāḥ prajā artha vrata karṣita aṅgam 
SA_GK19_ragh1-6u-335	netraiḥ papustṛptimanāpnuvadbhirnavoditaṃ nāthamivauṣadhīnām // Ragh(K)_2.73 //	netraiḥ papuḥ tṛptim an āpnuvadbhiḥ nava uditam nātham iva oṣadhīnām 
SA_GK19_ragh1-6u-336	purandaraśrīḥ puramutpatākaṃ praviśya paurairabhinandyamānaḥ /	purandara śrīḥ puram utpatākam praviśya pauraiḥ abhinandyamānaḥ 
SA_GK19_ragh1-6u-337	bhuje bhujaṅgendrasamānasāre bhūyaḥ sa bhūmerdhuramāsasañja // Ragh(K)_2.74 //	bhuje bhujaṅga indra samāna sāre bhūyas sa bhūmeḥ dhuram āsasañja 
SA_GK19_ragh1-6u-338	atha nayanasamutthaṃ jyotiratreriva dyauḥ surasaridiva tejo vahniniṣṭhyūtamaiśam /	atha nayana samuttham jyotiḥ atreḥ iva dyauḥ surasarit iva tejaḥ vahni niṣṭhyūtam aiśam 
SA_GK19_ragh1-6u-339	narapatikulabhūtyai garbhamādhatta rājñī gurubhirabhiniviṣṭaṃ lokapālānubhāvaiḥ // Ragh(K)_2.75 //	narapati kula bhūtyai garbham ādhatta rājñī gurubhiḥ abhiniviṣṭam lokapāla anubhāvaiḥ 
SA_GK19_ragh1-6u-340	// iti raghuvaṃśe mahākāvye dvitīyaḥ sargaḥ //	iti raghuvaṃśe mahākāvye dvitīyaḥ sargaḥ 
SA_GK19_ragh1-6u-341	athepsitaṃ bharturupasthitodayaṃ sakhījanodvīkṣaṇakaumudīmukham /	athā īpsitam bhartuḥ upasthita udayam sakhī jana udvīkṣaṇa kaumudī mukham 
SA_GK19_ragh1-6u-342	nidānamikṣvākukulasya santateḥ sudakṣiṇā dauhadalakṣaṇaṃ dadhau // Ragh(K)_3.1 //	nidānam ikṣvāku kulasya santateḥ sudakṣiṇā dauhada lakṣaṇam 
SA_GK19_ragh1-6u-343	mukhena sā ketakapattrapāṇḍunā kṛśāṅgayaṣṭiḥ parimeyabhūṣaṇā /	mukhena sā ketaka pattra pāṇḍunā kṛśa aṅgayaṣṭiḥ parimeya bhūṣaṇā 
SA_GK19_ragh1-6u-344	sthitālpatārāṃ karuṇendumaṇḍalāṃ vibhātakalpāṃ rajanīṃ vyaḍambayat // Ragh(K)_3.2 //	sthita alpa tārām karuṇa indu maṇḍalām vibhāta kalpām rajanīm vyaḍambayat 
SA_GK19_ragh1-6u-345	tadānanaṃ sevitamṛttikālavaṃ nṛpaḥ samāghrāya na tṛptimāyayau /	tad ānanam sevita mṛttikā lavam nṛpaḥ samāghrāya na tṛptim āyayau 
SA_GK19_ragh1-6u-346	karīva siktaṃ pṛṣataiḥ payomucāṃ śucivyapāye vanarājipalvalam // Ragh(K)_3.3 //	karī iva siktam pṛṣataiḥ payomucām śuci vyapāye vana rāji palvalam 
SA_GK19_ragh1-6u-347	divaṃ marutvāniva bhokṣyate mahīṃ digantaviśrāntaratho hi matsutaḥ /	divam marutvān iva bhokṣyate mahīm diganta viśrānta rathaḥ hi mad sutaḥ 
SA_GK19_ragh1-6u-348	ato 'bhilāṣe prathamaṃ tathāvidhe mano babandhānyarasānvilaṅghya sā // Ragh(K)_3.4 //	atas bhilāṣe prathamam tathāvidhe manaḥ babandha anya rasān vilaṅghya sā 
SA_GK19_ragh1-6u-349	na me hriyā śaṃsati kiñcidīpsitaṃ spṛhāvatī vastuṣu keṣu māgadhī /	na me hriyā śaṃsati kiñcid īpsitam spṛhāvatī vastuṣu keṣu māgadhī 
SA_GK19_ragh1-6u-350	iti sma pṛcchatyativelamādṛtaḥ priyāsakhīruttarakosaleśvaraḥ // Ragh(K)_3.5 //	iti sma pṛcchati ativelam ādṛtaḥ priyā sakhīḥ uttarakosala īśvaraḥ 
SA_GK19_ragh1-6u-351	upetya sā dohadaduḥkhaśīlatāṃ yadeva vavre tadapaśyadāhṛtam /	upetya sā dohada duḥkha śīla tām yat eva vavre tat apaśyat āhṛtam 
SA_GK19_ragh1-6u-352	na hīṣṭamasyāstridive 'pi bhūpaterbabhūva duṣprāpamadhijyadhanvanaḥ // Ragh(K)_3.6 //	na hi iṣṭam asyāḥ tridive pi bhūpateḥ babhūva duṣprāpam adhijya dhanvanaḥ 
SA_GK19_ragh1-6u-353	dineṣu gacchatsu madhūkapāṇḍuraṃ tadīyamāśyāmamukhaṃ stanadvayam /	dineṣu gacchatsu madhūka pāṇḍuram tadīyam āśyāma mukham stana dvayam 
SA_GK19_ragh1-6u-354	samudgayorvāraṇadantakośayorbabhāra kāntiṃ gavalāpidhānayoḥ // Ragh(K)_3.7 //	samudgayoḥ vāraṇa dantakośayoḥ babhāra kāntim gavala apidhānayoḥ 
SA_GK19_ragh1-6u-355	krameṇa nistīrya ca dohadavyathāmupoḍhagātropacayā rarāja sā /	krameṇa nistīrya ca dohada vyathām upoḍha gātra upacayā rarāja sā 
SA_GK19_ragh1-6u-356	purāṇapattrāpagamādanantaraṃ lateva sannaddhamanojñapallavā // Ragh(K)_3.8 //	purāṇa pattra apagamāt anantaram latā iva sannaddha manojña pallavā 
SA_GK19_ragh1-6u-357	nidhānagarbhāmiva sāgarāmbarāṃ śamīmivābhyantaralīnapāvakām /	nidhāna garbhām iva sāgarāmbarām śamīm iva abhyantara līna pāvakām 
SA_GK19_ragh1-6u-358	nadīmivāntaḥsalilāṃ sarasvatīṃ nṛpaḥ sagarbhāṃ mahiṣīmamanyata // Ragh(K)_3.9 //	nadīm iva antar salilām sarasvatīm nṛpaḥ sagarbhām mahiṣīm amanyata 
SA_GK19_ragh1-6u-359	priyānurāgasya manaḥsamunnaterbhujārjitānāṃ ca digantasampadām /	priya anurāgasya manaḥ samunnateḥ bhuja arjitānām ca diganta sampadām 
SA_GK19_ragh1-6u-360	yathākramaṃ puṃsavanādikāḥ kriyā dhṛteśca dhīraḥ sadṛśīrvyadhatta saḥ // Ragh(K)_3.10 //	yathākramam puṃsavana ādikāḥ kriyāḥ dhṛteḥ ca dhīraḥ sadṛśīḥ vyadhatta saḥ 
SA_GK19_ragh1-6u-361	surendramātrāśritagarbhagauravāt prayatnamuktāsanayā gṛhāgataḥ /	sura indra mātra āśrita garbha gauravāt prayatna mukta āsanayā gṛha āgataḥ 
SA_GK19_ragh1-6u-362	tayopacārāñjalikhinnahastayā nananda pāriplavanetrayā nṛpaḥ // Ragh(K)_3.11 //	tayā upacāra añjali khinna hastayā nananda pāriplava netrayā nṛpaḥ 
SA_GK19_ragh1-6u-363	kumārabhṛtyaiḥ kuśalairadhiṣṭhite bhiṣagbhirāptairatha garbhaveśmani /	kumāra bhṛtyaiḥ kuśalaiḥ adhiṣṭhite bhiṣagbhiḥ āptaiḥ atha garbhaveśmani 
SA_GK19_ragh1-6u-364	niratyayāya prasavāya tasthuṣī babhau samāsannaphalā kriyeva sā // Ragh(K)_3.12 //	niratyayāya prasavāya tasthuṣī babhau samāsanna phalā kriyā iva sā 
SA_GK19_ragh1-6u-365	grahaistataḥ pañcabhiruccasaṃśrayairasūryagaiḥ sūcitabhāgyasampadam /	grahaiḥ tatas pañcabhiḥ ucca saṃśrayaiḥ a sūrya gaiḥ sūcita bhāgya sampadam 
SA_GK19_ragh1-6u-366	asūta putraṃ samaye śacīsamā trisādhanā śaktirivārthamakṣatam // Ragh(K)_3.13 //	asūta putram samaye śacī samā tri sādhanā śaktiḥ iva artham akṣatam 
SA_GK19_ragh1-6u-367	diśaḥ prasedurmaruto vavuḥ śivāḥ pradakṣiṇārcirhutamagnirādade /	diśaḥ praseduḥ marutaḥ vavuḥ śivāḥ pradakṣiṇa arciḥ hutam agniḥ ādade 
SA_GK19_ragh1-6u-368	babhūva sarvaṃ śubhaśaṃsi tatkṣaṇaṃ bhavo hi lokābhyudayāya tādṛśām // Ragh(K)_3.14 //	babhūva sarvam śubha śaṃsi tad kṣaṇam bhavaḥ hi loka abhyudayāya tādṛśām 
SA_GK19_ragh1-6u-369	ariṣṭaśayyāṃ parito visāriṇā sujanmanastasya nijena tejasā /	ariṣṭa śayyām paritas visāriṇā su janmanaḥ tasya nijena tejasā 
SA_GK19_ragh1-6u-370	niśīthadīpāḥ sahasā hatatviṣo babhūvurālekhyasamarpitā iva // Ragh(K)_3.15 //	niśītha dīpāḥ sahasā hata tviṣaḥ babhūvuḥ ālekhya samarpitāḥ iva 
SA_GK19_ragh1-6u-371	janāya śuddhāntacarāya śaṃsate kumārajanmāmṛtasammitākṣaram /	janāya śuddhānta carāya śaṃsate kumāra janma amṛta sammita akṣaram 
SA_GK19_ragh1-6u-372	adeyamāsīttrayameva bhūpateḥ śaśiprabhaṃ chattramubhe ca cāmare // Ragh(K)_3.16 //	adeyam āsīt trayam eva bhūpateḥ śaśi prabham chattram ubhe ca cāmare 
SA_GK19_ragh1-6u-373	sa vīkṣya putrasya cirātpitā mukhaṃ nidhānakumbhasya yuveva durgataḥ /	sa vīkṣya putrasya cirāt pitā mukham nidhāna kumbhasya yuvā iva durgataḥ 
SA_GK19_ragh1-6u-374	mudā śarīre prababhūva nātmanaḥ payodhirindūdayamūrchito yathā // Ragh(K)_3.17 //	mudā śarīre prababhūva nā ātmanaḥ payodhiḥ indu udaya mūrchitaḥ yathā 
SA_GK19_ragh1-6u-375	sa jātakarmaṇyakhile tapasvinā tapovanādetya purodhasā kṛte /	sa jātakarmaṇi akhile tapasvinā tapaḥ vanāt etya purodhasā kṛte 
SA_GK19_ragh1-6u-376	dilīpasūnurmaṇirākarodgataḥ prayuktasaṃskāra ivādhikaṃ babhau // Ragh(K)_3.18 //	dilīpa sūnuḥ maṇiḥ ākara udgataḥ prayukta saṃskāraḥ iva adhikam babhau 
SA_GK19_ragh1-6u-377	sukhaśravā maṅgalatūryaniḥsvanāḥ pramodanṛttaiḥ saha vārayoṣitām /	sukha śravāḥ maṅgala tūrya niḥsvanāḥ pramoda nṛttaiḥ saha vāra yoṣitām 
SA_GK19_ragh1-6u-378	na kevalaṃ sadmani māgadhīpateḥ pathi vyajṛmbhanta divaukasāmapi // Ragh(K)_3.19 //	na kevalam sadmani māgadhī pateḥ pathi vyajṛmbhanta divaukasām api 
SA_GK19_ragh1-6u-379	na saṃyatastasya babhūva rakṣiturvimocayedyaṃ sutajanmaharṣitaḥ /	na saṃyataḥ tasya babhūva rakṣituḥ vimocayet yam suta janma harṣitaḥ 
SA_GK19_ragh1-6u-380	ṛṇābhidhānātsvayameva kevalaṃ tadā pitṚṇāṃ mumuce sa bandhanāt // Ragh(K)_3.20 //	ṛṇa abhidhānāt svayam eva kevalam tadā pitṛṇām mumuce sa bandhanāt 
SA_GK19_ragh1-6u-381	śrutasya yāyādayamantamarbhakastathā pareṣāṃ yudhi ceti pārthivaḥ /	śrutasya yāyāt ayam antam arbhakaḥ tathā pareṣām yudhi ca iti pārthivaḥ 
SA_GK19_ragh1-6u-382	avekṣya dhātorgamanārthamarthaviccakāra nāmnā raghumātmasambhavam // Ragh(K)_3.21 //	avekṣya dhātoḥ gamana artham artha vid cakāra nāmnā raghum ātmasambhavam 
SA_GK19_ragh1-6u-383	pituḥ prayatnātsa samagrasampadaḥ śubhaiḥ śarīrāvayavairdine dine /	pituḥ prayatnāt sa samagra sampadaḥ śubhaiḥ śarīra avayavaiḥ dine dine 
SA_GK19_ragh1-6u-384	pupoṣa vṛddhiṃ haridaśvadīdhiteranupraveśādiva bālacandramāḥ // Ragh(K)_3.22 //	pupoṣa vṛddhim harit aśva dīdhiteḥ anupraveśāt iva bāla candramāḥ 
SA_GK19_ragh1-6u-385	umāvṛṣāṅkau śarajanmanā yathā yathā jayantena śacīpurandarau /	umā vṛṣāṅkau śara janmanā yathā yathā jayantena śacī purandarau 
SA_GK19_ragh1-6u-386	tathā nṛpaḥ sā ca sutena māgadhī nanandatustatsadṛśena tatsamau // Ragh(K)_3.23 //	tathā nṛpaḥ sā ca sutena māgadhī nanandatuḥ tad sadṛśena tad samau 
SA_GK19_ragh1-6u-387	rathāṅganāmnoriva bhāvabandhanaṃ babhūva yatprema parasparaṃ prati /	rathāṅga nāmnoḥ iva bhāva bandhanam babhūva yat prema parasparam prati 
SA_GK19_ragh1-6u-388	vibhaktamapyekasute na tattayoḥ parasparasyopari paryahīyata // Ragh(K)_3.24 //	vibhaktam api eka sute na tat tayoḥ parasparasya upari paryahīyata 
SA_GK19_ragh1-6u-389	yadāha dhātryā prathamoditaṃ vaco yayau tadīyāmavalambya cāṅgulim /	yat āha dhātryā prathama uditam vacaḥ yayau tadīyām avalambya ca aṅgulim 
SA_GK19_ragh1-6u-390	abhūcca namraḥ praṇipātaśikṣayā piturmudaṃ tena tatāna so 'rbhakaḥ // Ragh(K)_3.25 //	abhūt ca namraḥ praṇipāta śikṣayā pituḥ mudam tena tatāna saḥ ṛbhakaḥ 
SA_GK19_ragh1-6u-391	tamaṅkamāropya śarīrayogajaiḥ sukhairniṣiñcantamivāmṛtaṃ tvaci /	tam aṅkam āropya śarīra yoga jaiḥ sukhaiḥ niṣiñcantam iva amṛtam tvaci 
SA_GK19_ragh1-6u-392	tribhāgasammīlitalocano nṛpaścirātsutasparśarasajñatāṃ yayau // Ragh(K)_3.26 //	tri bhāga sammīlita locanaḥ nṛpaḥ cirāt suta sparśa rasa jña tām yayau 
SA_GK19_ragh1-6u-393	amaṃsta cānena parārdhyajanmanā sthiterabhettā sthitimantamanvayam /	amaṃsta ca anena parārdhya janmanā sthiteḥ abhettā sthitimantam anvayam 
SA_GK19_ragh1-6u-394	svamūrtibhedena guṇāgryavṛttinā patiḥ prajānāmiva sargamātmanaḥ // Ragh(K)_3.27 //	sva mūrti bhedena guṇa agrya vṛttinā patiḥ prajānām iva sargam ātmanaḥ 
SA_GK19_ragh1-6u-395	sa vṛttacūlaścalakākapakṣakairamātyaputraiḥ savayobhiranvitaḥ /	sa vṛtta cūlaḥ cala kākapakṣakaiḥ amātya putraiḥ sa vayobhiḥ anvitaḥ 
SA_GK19_ragh1-6u-396	liperyathāvadgrahaṇena vāṅmayaṃ nadīmukheneva samudramāviśat // Ragh(K)_3.28 //	lipeḥ yathāvat grahaṇena vāc mayam nadī mukhena iva samudram āviśat 
SA_GK19_ragh1-6u-397	athopanītaṃ vidhivadvipaścito vininyurenaṃ guravo gurupriyam /	athā upanītam vidhivat vipaścitaḥ vininyuḥ enam guravaḥ guru priyam 
SA_GK19_ragh1-6u-398	avandhyayatnāśca babhūvuratra te kriyā hi vastūpahitā prasīdati // Ragh(K)_3.29 //	avandhya yatnāḥ ca babhūvuḥ atra te kriyā hi vastu upahitā prasīdati 
SA_GK19_ragh1-6u-399	dhiyaḥ samagraiḥ sa guṇairudāradhīḥ kramāccatasraścaturarṇavopamāḥ /	dhiyaḥ samagraiḥ sa guṇaiḥ udāra dhīḥ kramāt catasraḥ catur arṇava upamāḥ 
SA_GK19_ragh1-6u-400	tatāra vidyāḥ pavanātipātibhirdiśo haridbhirharitāmiveśvaraḥ // Ragh(K)_3.30 //	tatāra vidyāḥ pavana atipātibhiḥ diśaḥ haridbhiḥ haritām iva īśvaraḥ 
SA_GK19_ragh1-6u-401	tvacaṃ sa medhyāṃ paridhāya rauravīmaśikṣatāstraṃ pitureva mantravat /	tvacam sa medhyām paridhāya rauravīm aśikṣata astram pituḥ eva mantravat 
SA_GK19_ragh1-6u-402	prayogasaṃhārarahasyavittamo babhūva cāstreṣu yathā purandaraḥ // Ragh(K)_3.31//	prayoga saṃhāra rahasya vittamaḥ babhūva ca astreṣu yathā purandaraḥ 
SA_GK19_ragh1-6u-403	mahokṣatāṃ vatsataraḥ spṛśanniva dvipendrabhāvaṃ kalabhaḥ śrayanniva /	mahā ukṣatām vatsataraḥ spṛśan iva dvipa indra bhāvam kalabhaḥ śrayan iva 
SA_GK19_ragh1-6u-404	raghuḥ kramādyauvanabhinnaśaiśavaḥ pupoṣa gambhīramanoharaṃ vapuḥ // Ragh(K)_3.32 //	raghuḥ kramāt yauvana bhinna śaiśavaḥ pupoṣa gambhīra manoharam vapuḥ 
SA_GK19_ragh1-6u-405	athāsya godānavidheranantaraṃ vivāhadīkṣāṃ niravartayatprabhuḥ /	atha asya godāna vidheḥ anantaram vivāha dīkṣām niravartayat prabhuḥ 
SA_GK19_ragh1-6u-406	narendrakanyāstamavāpya satpatiṃ tamopahaṃ dakṣasutā ivābabhuḥ // Ragh(K)_3.33 //	narendra kanyāḥ tam avāpya sat patim tama upaham dakṣa sutāḥ iva ābabhuḥ 
SA_GK19_ragh1-6u-407	yuvā yugavyāyatabāhuraṃsalaḥ kavāṭavakṣāḥ pariṇaddhakandharaḥ /	yuvā yuga vyāyata bāhuḥ aṃsalaḥ kavāṭa vakṣāḥ pariṇaddha kandharaḥ 
SA_GK19_ragh1-6u-408	vapuṣprakarṣādajayadguruṃ raghustathāpi nīcairvinayādadṛśyata // Ragh(K)_3.34 //	vapuḥ prakarṣāt ajayat gurum raghuḥ tathā api nīcaiḥ vinayāt adṛśyata 
SA_GK19_ragh1-6u-409	atha prajānāṃ ciramātmanā dhṛtāṃ nitāntagurvīṃ laghayiṣyatā dhuram /	atha prajānām ciram ātmanā dhṛtām nitānta gurvīm laghayiṣyatā dhuram 
SA_GK19_ragh1-6u-410	vaśīti matvā maticakṣuṣā suto nṛpeṇa cakre yuvarājaśabdabhāk // Ragh(K)_3.35 //	vaśī iti matvā mati cakṣuṣā sutaḥ nṛpeṇa cakre yuvarāja śabda bhāj 
SA_GK19_ragh1-6u-411	narendramūlāyatanādanantaraṃ tadāspadaṃ śrīryuvarājasaṃjñitam /	narendra mūla āyatanāt anantaram tad āspadam śrīḥ yuvarāja saṃjñitam 
SA_GK19_ragh1-6u-412	agacchadaṃśena guṇābhilāṣiṇī navāvatāraṃ kamalādivotpalam // Ragh(K)_3.36 //	agacchat aṃśena guṇa abhilāṣiṇī nava avatāram kamalāt iva utpalam 
SA_GK19_ragh1-6u-413	uṣarbudhaḥ sārathineva vāyunā ghanavyapāyena gabhastimāniva /	uṣarbudhaḥ sārathinā iva vāyunā ghana vyapāyena gabhastimān iva 
SA_GK19_ragh1-6u-414	babhūva tenātitarāṃ durutsahaḥ kaṭaprabhedena karīva pārthivaḥ // Ragh(K)_3.37 //	babhūva tena atitarām durutsahaḥ kaṭa prabhedena karī iva pārthivaḥ 
SA_GK19_ragh1-6u-415	niyujya taṃ medhyaturaṅgarakṣaṇe dhanurdharai rājasutairanudrutam /	niyujya tam medhya turaṅga rakṣaṇe dhanurdharaiḥ rāja sutaiḥ anudrutam 
SA_GK19_ragh1-6u-416	apūrṇamekena śatakratūpamaḥ śataṃ kratūnāmapavighnamāpa saḥ // Ragh(K)_3.38 //	apūrṇam ekena śatakratu upamaḥ śatam kratūnām apavighnam āpa saḥ 
SA_GK19_ragh1-6u-417	ataḥ paraṃ tena makhāya yajvanā turaṅgamutsṛṣṭamanargalaṃ punaḥ /	atas param tena makhāya yajvanā turaṅgam utsṛṣṭam anargalam punar 
SA_GK19_ragh1-6u-418	dhanurbhṛtāmagrata eva rakṣiṇāṃ jahāra śakraḥ kila gūḍhavigrahaḥ // Ragh(K)_3.39 //	dhanurbhṛtām agratas eva rakṣiṇām jahāra śakraḥ kila gūḍha vigrahaḥ 
SA_GK19_ragh1-6u-419	viṣādaluptapratipatti vismitaṃ kumārasainyaṃ sapadi sthitaṃ ca tat /	viṣāda lupta pratipatti vismitam kumāra sainyam sapadi sthitam ca tat 
SA_GK19_ragh1-6u-420	vasiṣṭhadhenuśca yadṛcchayāgatā śrutaprabhāvā dadṛśe 'tha nandinī // Ragh(K)_3.40 //	vasiṣṭha dhenuḥ ca yadṛcchayā āgatā śruta prabhāvā dadṛśe nandinī 
SA_GK19_ragh1-6u-421	tadaṅganiḥṣyandalavena locane pramṛjya puṇyena puraskṛtaḥ satām /	tad aṅga niḥṣyanda lavena locane pramṛjya puṇyena puraskṛtaḥ satām 
SA_GK19_ragh1-6u-422	atīndriyeṣvapyupapannadarśano babhūva bhāveṣu dilīpanandanaḥ // Ragh(K)_3.41 //	atīndriyeṣu api upapanna darśanaḥ babhūva bhāveṣu dilīpa nandanaḥ 
SA_GK19_ragh1-6u-423	sa pūrvataḥ parvatapakṣaśātanaṃ dadarśa devaṃ naradevasambhavaḥ /	sa pūrvatas parvata pakṣa śātanam dadarśa devam naradeva sambhavaḥ 
SA_GK19_ragh1-6u-424	punaḥ punaḥ sūtaniṣiddhacāpalaṃ harantamaśvaṃ ratharaśmisaṃyutam // Ragh(K)_3.42 //	punar punar sūta niṣiddha cāpalam harantam aśvam ratha raśmi saṃyutam 
SA_GK19_ragh1-6u-425	śataistamakṣṇāmanimeṣavṛttibhirhariṃ viditvā haribhiśca vājibhiḥ /	śataiḥ tam akṣṇām animeṣa vṛttibhiḥ harim viditvā haribhiḥ ca vājibhiḥ 
SA_GK19_ragh1-6u-426	avocadenaṃ gaganaspṛśā raghuḥ svareṇa dhīreṇa nivartayanniva // Ragh(K)_3.43 //	avocat enam gagana spṛśā raghuḥ svareṇa dhīreṇa nivartayan iva 
SA_GK19_ragh1-6u-427	makhāṃśabhājāṃ prathamo manīṣibhistvameva devendra yadā nigadyase /	makha aṃśa bhājām prathamaḥ manīṣibhiḥ tvam eva deva indra yadā nigadyase 
SA_GK19_ragh1-6u-428	ajasradīkṣāprayatasya madguroḥ kriyāvighātāya kathaṃ pravartase // Ragh(K)_3.44 //	ajasra dīkṣā prayatasya mad guroḥ kriyā vighātāya katham pravartase 
SA_GK19_ragh1-6u-429	trilokanāthena satā makhadviṣastvayā niyāmyā nanu divyacakṣuṣā /	triloka nāthena satā makha dviṣaḥ tvayā niyāmyāḥ nanu divya cakṣuṣā 
SA_GK19_ragh1-6u-430	sa cetsvayaṃ karmasu dharmacāriṇāṃ tvamantarāyībhavasi cyuto vidhiḥ // Ragh(K)_3.45 //	sa ced svayam karmasu dharma cāriṇām tvam antarāyībhavasi cyutaḥ vidhiḥ 
SA_GK19_ragh1-6u-431	tadaṅgamagryaṃ maghavanmahākratoramuṃ turaṅgaṃ pratimoktumarhasi /	tat aṅgam agryam maghavan mahā kratoḥ amum turaṅgam pratimoktum arhasi 
SA_GK19_ragh1-6u-432	pathaḥ śucerdarśayitāra īśvarā malīmasāmādadate na paddhatim // Ragh(K)_3.46 //	pathaḥ śuceḥ darśayitāraḥ īśvarāḥ malīmasām ādadate na paddhatim 
SA_GK19_ragh1-6u-433	iti pragalbhaṃ raghuṇā samīritaṃ vaco niśamyādhipatirdivaukasām /	iti pragalbham raghuṇā samīritam vacaḥ niśamya adhipatiḥ divaukasām 
SA_GK19_ragh1-6u-434	nivartayāmāsa rathaṃ savismayaḥ pracakrame ca prativaktumuttaram // Ragh(K)_3.47 //	nivartayāmāsa ratham sa vismayaḥ pracakrame ca prativaktum uttaram 
SA_GK19_ragh1-6u-435	yathāttha rājanyakumāra tattathā yaśastu rakṣyaṃ parito yaśodhanaiḥ /	yathā āttha rājanya kumāra tat tathā yaśaḥ tu rakṣyam paritas yaśaḥ dhanaiḥ 
SA_GK19_ragh1-6u-436	jagatprakāśaṃ tadaśeṣamijyayā bhavadgururlaṅghayituṃ mamodyataḥ // Ragh(K)_3.48 //	jagat prakāśam tat aśeṣam ijyayā bhavadguruḥ laṅghayitum mama udyataḥ 
SA_GK19_ragh1-6u-437	hariryathaikaḥ puruṣottamaḥ smṛto maheśvarastryambaka eva nāparaḥ /	hariḥ yathā ekaḥ puruṣottamaḥ smṛtaḥ maheśvaraḥ tryambakaḥ eva nā aparaḥ 
SA_GK19_ragh1-6u-438	tathā vidurmāṃ munayaḥ śatakratuṃ dvitīyagāmī na hi śabda eṣa naḥ // Ragh(K)_3.49 //	tathā viduḥ mām munayaḥ śatakratum dvitīya gāmī na hi śabdaḥ eṣa naḥ 
SA_GK19_ragh1-6u-439	ato 'yamaśvaḥ kapilānukāriṇā pitustvadīyasya mayāpahāritaḥ /	atas yam aśvaḥ kapila anukāriṇā pituḥ tvadīyasya mayā apahāritaḥ 
SA_GK19_ragh1-6u-440	alaṃ prayatnena tavātra mā nidhāḥ padaṃ padavyāṃ sagarasya santateḥ // Ragh(K)_3.50 //	alam prayatnena tava atra mā nidhāḥ padam padavyām sagarasya santateḥ 
SA_GK19_ragh1-6u-441	tataḥ prahasyāha punaḥ purandaraṃ vyapetabhīrbhūmipurandarātmajaḥ /	tatas prahasya āha punar purandaram vyapeta bhīḥ bhūmi purandara ātmajaḥ 
SA_GK19_ragh1-6u-442	gṛhāṇa śastraṃ yadi sarga eṣa te na khalvanirjitya raghuṃ kṛtī bhavān // Ragh(K)_3.51 //	gṛhāṇa śastram yadi sargaḥ eṣa te na khalu a nirjitya raghum kṛtī bhavān 
SA_GK19_ragh1-6u-443	sa evamuktvā maghavantamunmukhaḥ kariṣyamāṇaḥ saśaraṃ śarāsanam /	saḥ evam uktvā maghavantam unmukhaḥ kariṣyamāṇaḥ sa śaram śarāsanam 
SA_GK19_ragh1-6u-444	atiṣṭhadālīḍhaviśeṣaśobhinā vapuṣprakarṣeṇa viḍambiteśvaraḥ // Ragh(K)_3.52 //	atiṣṭhat ālīḍha viśeṣa śobhinā vapuḥ prakarṣeṇa viḍambita īśvaraḥ 
SA_GK19_ragh1-6u-445	raghoravaṣṭambhamayena pattriṇā hṛdi kṣato gotrabhidapyamarṣaṇaḥ /	raghoḥ avaṣṭambha mayena pattriṇā hṛdi kṣataḥ gotrabhid api amarṣaṇaḥ 
SA_GK19_ragh1-6u-446	navāmbudānīkamuhūrtalāñchane dhanuṣyamoghaṃ samadhatta mārgaṇam // Ragh(K)_3.53 //	nava ambuda anīka muhūrta lāñchane dhanuṣi amogham samadhatta mārgaṇam 
SA_GK19_ragh1-6u-447	narendrasūnoḥ sa bṛhadbhujāntaraṃ praviśya bhīmāsuraśoṇitocitaḥ /	narendra sūnoḥ sa bṛhat bhujāntaram praviśya bhīma asura śoṇita ucitaḥ 
SA_GK19_ragh1-6u-448	papāvanāsvāditapūrvamāśugaḥ kutūhaleneva manuṣyaśoṇitam // Ragh(K)_3.54 //	papau an āsvādita pūrvam āśu gaḥ kutūhalena iva manuṣya śoṇitam 
SA_GK19_ragh1-6u-449	hareḥ kumāro 'pi kumāravikramaḥ suradvipāsphālanakarkaśāṅgulau /	kumāra vikramaḥ sura dvipa āsphālana karkaśa aṅgulau 
SA_GK19_ragh1-6u-450	bhuje śacīpattraviśeṣakāṅkite svanāmacihnaṃ nicakhāna sāyakam // Ragh(K)_3.55 //	bhuje śacīpattra viśeṣaka aṅkite sva nāma cihnam nicakhāna sāyakam 
SA_GK19_ragh1-6u-451	jahāra cānyena mayūralāñchanaṃ śareṇa śakrasya mahāśanidhvajam /	jahāra ca anyena mayūra lāñchanam śareṇa śakrasya mahā aśani dhvajam 
SA_GK19_ragh1-6u-452	cukopa tasmai sa bhṛśaṃ suraśriyaḥ prasahya keśavyaparopaṇādiva // Ragh(K)_3.56 //	cukopa tasmai sa bhṛśam sura śriyaḥ prasahya keśa vyaparopaṇāt iva 
SA_GK19_ragh1-6u-453	tayorupāntasthitasiddhasainikaṃ garutmadāśīviṣabhīmadarśanaiḥ /	tayoḥ upānta sthita siddha sainikam garutmat āśīviṣa bhīma darśanaiḥ 
SA_GK19_ragh1-6u-454	babhūva yuddhaṃ tumulaṃ jayaiṣiṇoradhomukhairūrdhvamukhaiśca pattribhiḥ // Ragh(K)_3.57 //	babhūva yuddham tumulam jaya eṣiṇoḥ adhomukhaiḥ ūrdhva mukhaiḥ ca pattribhiḥ 
SA_GK19_ragh1-6u-455	atiprabandhaprahitāstravṛṣṭibhistamāśrayaṃ duṣprasahasya tejasaḥ /	ati prabandha prahita astra vṛṣṭibhiḥ tam āśrayam duṣprasahasya tejasaḥ 
SA_GK19_ragh1-6u-456	śaśāka nirvāpayituṃ na vāsavaḥ svataścyutaṃ vahnimivādbhirambudaḥ // Ragh(K)_3.58 //	śaśāka nirvāpayitum na vāsavaḥ svatas cyutam vahnim iva adbhiḥ ambudaḥ 
SA_GK19_ragh1-6u-457	tataḥ prakoṣṭhāddharicandanāṅkitāt pramathyamānārṇavadhīranādinīm /	tatas prakoṣṭhāt haricandana aṅkitāt pramathyamāna arṇava dhīra nādinīm 
SA_GK19_ragh1-6u-458	raghuḥ śaśāṅkārdhamukhena pattriṇā śarāsanajyāmalunādbiḍaujasaḥ // Ragh(K)_3.59 //	raghuḥ śaśāṅka ardha mukhena pattriṇā śarāsana jyām alunāt viḍaujasaḥ 
SA_GK19_ragh1-6u-459	sa cāpamutsṛjya vivṛddhamatsaraḥ pravāsanāya prabalasya vidviṣaḥ /	sa cāpam utsṛjya vivṛddha matsaraḥ pravāsanāya prabalasya vidviṣaḥ 
