segmentnr	original	analyzed
SA_GR14_ss4_krsu-3661	nirmāṇaṃ tu jaḍasyātra kriyate na parātmanaḥ /	nirmāṇam tu jaḍasya atra kriyate na parātmanaḥ 
SA_GR14_ss4_krsu-3662	uddhariṣyāmi ca mahīṃ vārāhaṃ rūpam āsthitaḥ //	uddhariṣyāmi ca mahīm vārāham rūpam āsthitaḥ 
SA_GR14_ss4_krsu-3663	tadā punaḥ pṛthivyāṃ hi kāśī sthāsyāmi mat-priyā // iti /	tadā punar pṛthivyām hi kāśī sthāsyāmi mad priyā iti 
SA_GR14_ss4_krsu-3664	cetanā-śabdenātrāntaryāmī upalakṣyate /	cetanā śabdena atra antaryāmī upalakṣyate 
SA_GR14_ss4_krsu-3665	jaḍa-śabdena tu dehaḥ	jaḍa śabdena tu dehaḥ 
SA_GR14_ss4_krsu-3666	paramātmana ity uktatvāt /	paramātmanaḥ iti ukta tvāt 
SA_GR14_ss4_krsu-3667	tataś ca kecit svadehāntar-hṛdayāvakāśe prādeśa-	tatas ca kecid sva deha antar hṛdaya avakāśe prādeśa 
SA_GR14_ss4_krsu-3668	mātraṃ puruṣaṃ vasantam [BhP 2.2.8] ity ādinā caturbhujatvena	mātram puruṣam vasantam iti ādinā catur bhuja tvena 
SA_GR14_ss4_krsu-3669	varṇito'ntaryāmī dehe sthito'pi yathā deha-vedanādinā na spṛśyate tadvad iti	varṇitaḥ untaryāmī dehe sthitaḥ api yathā deha vedanā ādinā na spṛśyate tadvat iti 
SA_GR14_ss4_krsu-3670	jñeyam /	jñeyam 
SA_GR14_ss4_krsu-3671	tad evaṃ tad-dhāmnām upary-adhaḥ prakāśa-mātratvenobhaya-vidhatvaṃ	tat evam tat dhāmnām upari adhas prakāśa mātra tvena ubhayavidha tvam 
SA_GR14_ss4_krsu-3672	prasaktam / vastutas tu śrī-bhagavan-nityādhiṣṭhānatvena tac-chrī-	                             
SA_GR14_ss4_krsu-3673	vigrahavad ubhayatra prakāśāvirodhāt samāna-guṇa-nāma-	vigraha vat ubhayatra prakāśa avirodhāt samāna guṇa nāma 
SA_GR14_ss4_krsu-3674	rūpatvenāmnātatvāl lāghavāc caika-vidhatvam eva mantavyam / ekasyaiva	rūpa tvena āmnāta tvāt lāghavāt ca ekavidha tvam eva mantavyam ekasya eva 
SA_GR14_ss4_krsu-3675	śrī-vigrahasya bahutra prakāśaś ca dvitīya-sandarbhe darśitaḥ /	śrī vigrahasya bahutra prakāśaḥ ca dvitīya sandarbhe darśitaḥ 
SA_GR14_ss4_krsu-3676	citraṃ bataitad ekena vapuṣā yugapat pṛthak	citram bata etat ekena vapuṣā yugapad pṛthak 
SA_GR14_ss4_krsu-3677	gṛheṣu dvy-aṣṭa-sāhasraṃ striya eka udāvahat // [BhP 10.69.1] ity ādinā /	gṛheṣu dvi aṣṭa sāhasram striyaḥ ekaḥ udāvahat iti ādinā 
SA_GR14_ss4_krsu-3678	evaṃvidhatvaṃ ca tasyācintya-śakti-svīkāreṇa sambhāvitam eva / svīkṛtaṃ	evaṃvidha tvam ca tasya acintya śakti svīkāreṇa sambhāvitam eva svīkṛtam 
SA_GR14_ss4_krsu-3679	cācintya-śaktitvam śrutes tu śabda-mūlatvāt [Vs 2.1.27] ity ādau / tad evam	ca acintya śakti tvam śruteḥ tu śabda mūla tvāt iti ādau tat evam 
SA_GR14_ss4_krsu-3680	ubhayābhedābhiprāyeṇaiva śrī-hari-vaṃśe'pi golokam uddiśya sa hi sarva-	ubhaya abheda abhiprāyeṇa eva śrī harivaṃśe pi golokam uddiśya sa hi sarva 
SA_GR14_ss4_krsu-3681	gato mahān [HV 2.19.30] ity uktam /	gataḥ mahān hu iti uktam 
SA_GR14_ss4_krsu-3682	bhede tu brahma-saṃhitāyām api goloka	bhede tu brahmasaṃhitāyām api 
SA_GR14_ss4_krsu-3683	eva nivasaty akhilātma-bhūtaḥ [BrahmaS 5.48] ity eva-kāro'tra svakīya-nitya-	eva nivasati akhila ātma bhūtaḥ iti 
SA_GR14_ss4_krsu-3684	vihāra-pratipādaka-vārāhādi-vacanair virudhyeta /	vihāra pratipādaka vārāha ādi vacanaiḥ virudhyeta 
SA_GR14_ss4_krsu-3685	avirodhas tūbhayeṣām	avirodhaḥ tu ubhayeṣām 
SA_GR14_ss4_krsu-3686	aikyenaiva bhavatīti taṃ nyāya-siddham evārthaṃ brahma-saṃhitā tu gṛhṇāti /	aikyena eva bhavati iti tam nyāya siddham eva artham brahma saṃhitā tu gṛhṇāti 
SA_GR14_ss4_krsu-3687	ataeva śrī-hari-vaṃśe'pi śakreṇa -	ataeva śrī harivaṃśe pi śakreṇa 
SA_GR14_ss4_krsu-3688	sa tu lokas tvayā kṛṣṇa sīdamānaḥ kṛtātmanā /	sa tu lokaḥ tvayā kṛṣṇa sīdamānaḥ kṛtātmanā 
SA_GR14_ss4_krsu-3689	dhṛto dhṛtimatā vīra nighnatopadravān gavām // [HV 2.19.35] iti /	dhṛtaḥ dhṛtimatā vīra nighnatā upadravān gavām hu iti 
SA_GR14_ss4_krsu-3690	goloka-gokulayor abhedenaivoktam /	goloka gokulayoḥ abhedena eva uktam 
SA_GR14_ss4_krsu-3691	tasmād abhedena ca bhedena	tasmāt abhedena ca bhedena 
SA_GR14_ss4_krsu-3692	copakrāntatvād eka-vidhāny eva śrī-mathurādīni prakāśa-bhedenaiva	ca upakrānta tvāt ekavidhāni eva śrī mathurā ādīni prakāśa bhedena eva 
SA_GR14_ss4_krsu-3693	tūbhaya-vidhatvenāmnātānīti sthitam /	tu ubhayavidha tvena āmnātāni iti sthitam 
SA_GR14_ss4_krsu-3694	darśayiṣyate cāgre / kṣauṇi-	darśayiṣyate ca agre 
SA_GR14_ss4_krsu-3695	prakāśamāna eva śrī-vṛndāvane śrī-goloka-darśanam /	prakāśamāne eva śrī vṛndāvane śrī go loka darśanam 
SA_GR14_ss4_krsu-3696	tato'syaivāparicchinnasya golokākhya-vṛndāvanīya-prakāśa-viśeṣasya	tatas asya eva aparicchinnasya goloka ākhya vṛndāvanīya prakāśa viśeṣasya 
SA_GR14_ss4_krsu-3697	vaikuṇṭhopary api sthitir māhātmyāvalambanena bhajatāṃ sphuratīti	vaikuṇṭha upari api sthitiḥ māhātmya avalambanena bhajatām sphurati iti 
SA_GR14_ss4_krsu-3698	jñeyam / ayam eva mathurā-dvārakā-gokula-prakāśa-viśeṣātmakaḥ śrī-	jñeyam ayam eva mathurā dvārakā gokula prakāśa viśeṣa ātmakaḥ śrī 
SA_GR14_ss4_krsu-3699	kṛṣṇa-lokas tad-virahiṇā śrīmad-uddhavenāpi samādhāv anubhūta ity āha - @-	kṛṣṇa lokaḥ tad virahiṇā śrīmat uddhavena api samādhau anubhūtaḥ iti āha 
SA_GR14_ss4_krsu-3700	śanakair bhagaval-lokān nṛ-lokaṃ punar āgataḥ /	śanakais bhagavat lokāt nṛ lokam punar āgataḥ 
SA_GR14_ss4_krsu-3701	vimṛjya netre viduraṃ prītyāhoddhava utsmayan // [BhP 3.2.6]	vimṛjya netre viduram prītyā āha uddhavaḥ utsmayan 
SA_GR14_ss4_krsu-3702	spaṣṭam // 3.2 // śrī-śukaḥ // 106 // [107]	spaṣṭam       
SA_GR14_ss4_krsu-3703	imam eva lokaṃ dyu-śabdenāpy āha -	imam eva lokam dyu śabdena api āha 
SA_GR14_ss4_krsu-3704	viṣṇor bhagavato bhānuḥ kṛṣṇākhyo 'sau divaṃ gataḥ /	viṣṇoḥ bhagavataḥ bhānuḥ kṛṣṇa ākhyaḥ sau divam gataḥ 
SA_GR14_ss4_krsu-3705	tadāviśat kalir lokaṃ pāpe yad ramate janaḥ //	tadā aviśat kaliḥ lokam pāpe yat ramate janaḥ 
SA_GR14_ss4_krsu-3706	yāvat sa pāda-padmābhyāṃ spṛśan āste ramā-patiḥ /	yāvat sa pāda padmābhyām spṛśan āste ramāpatiḥ 
SA_GR14_ss4_krsu-3707	tāvat kalir vai pṛthivīṃ parākrantuṃ na cāśakat // [BhP 12.2.29-30]	tāvat kaliḥ vai pṛthivīm parākrantum na ca aśakat  bhp 
SA_GR14_ss4_krsu-3708	yadā guṇāvatārasya bhagavato viṣṇos tad-aṃśatvād raśmi-sthānīyasya	yadā guṇa avatārasya bhagavataḥ viṣṇoḥ tad aṃśa tvāt raśmi sthānīyasya 
SA_GR14_ss4_krsu-3709	kṛṣṇākhyo bhānuḥ sūrya-maṇḍala-sthānīyo divaṃ prāpañcika-lokāgocaraṃ	kṛṣṇa ākhyaḥ bhānuḥ sūrya maṇḍala sthānīyaḥ divam prāpañcika loka agocaram 
SA_GR14_ss4_krsu-3710	mathurādīnām eva prakāśa-viśeṣa-rūpaṃ vaikuṇṭha-lokaṃ gatas tadā kalir	mathurā ādīnām eva prakāśa viśeṣa rūpam vaikuṇṭha lokam gataḥ tadā kaliḥ 
SA_GR14_ss4_krsu-3711	lokam āviśat /	lokam āviśat 
SA_GR14_ss4_krsu-3712	eṣāṃ sa ca prakāśaḥ pṛthivīstho'py antardhāna-śaktyā tām	eṣām sa ca prakāśaḥ pṛthivī sthaḥ api antardhāna śaktyā tām 
SA_GR14_ss4_krsu-3713	apṛśann eva virājate /	a pṛśan eva virājate 
SA_GR14_ss4_krsu-3714	atas tayā na spṛśyate pṛthivy-ādi-bhūtamayair asmābhir	atas tayā na spṛśyate pṛthivī ādi bhūta mayaiḥ asmābhiḥ 
SA_GR14_ss4_krsu-3715	vārāhokta-mahā-kadambādir iva /	vārāha ukta mahā kadamba ādiḥ iva 
SA_GR14_ss4_krsu-3716	yas tu prāpañcika-loka-gocaro mathurādi-	yaḥ tu prāpañcika loka gocaraḥ mathurā ādi 
SA_GR14_ss4_krsu-3717	prakāśaḥ so'yaṃ kṛpayā pṛthivīṃ spṛśann evāvatīrṇaḥ /	prakāśaḥ saḥ ayam kṛpayā pṛthivīm spṛśan eva avatīrṇaḥ 
SA_GR14_ss4_krsu-3718	atas tayā ca spṛśyate	atas tayā ca spṛśyate 
SA_GR14_ss4_krsu-3719	tādṛśair asmābhir dṛśyamāna-kadambādir iva /	tādṛśaiḥ asmābhiḥ dṛśyamāna kadamba ādiḥ iva 
SA_GR14_ss4_krsu-3720	asmiṃś ca (page 57) prakāśe	asmin ca page prakāśe 
SA_GR14_ss4_krsu-3721	yadāvatīrṇo bhagavāṃs tadā tat-sparśenāpi tat-sparśāt tāṃ spṛśann evāste	yadā avatīrṇaḥ bhagavān tadā tad sparśena api tad sparśāt tām spṛśan eva āste 
SA_GR14_ss4_krsu-3722	sma / samprati tad-aspṛṣṭa-prakāśe virahamāṇaḥ punar aspṛśann eva	sma samprati tad a spṛṣṭa prakāśe virahamāṇaḥ punar a spṛśan eva 
SA_GR14_ss4_krsu-3723	bhavati / [Vṛ. adds. yadyapy evaṃ tathāpi kvacid dvayor bhedena kvacid	bhavati yadi api evam tathā api kvacid dvayoḥ bhedena kvacid 
SA_GR14_ss4_krsu-3724	abhedena ca vivakṣā tatrāvagantavyā /	abhedena ca vivakṣā tatra avagantavyā 
SA_GR14_ss4_krsu-3725	end Vṛ.] tad etad abhipretyāha yāvad	ā it vṛ tat etat abhipretya āha yāvat 
SA_GR14_ss4_krsu-3726	iti / parākrantum ity anena tat-pūrvam api kaṃcit kālaṃ prāpya praviṣṭo'sāv	iti parākrantum iti anena tad pūrvam api kaṃcid kālam prāpya praviṣṭā asau 
SA_GR14_ss4_krsu-3727	iti jñāpitam //	iti jñāpitam 
SA_GR14_ss4_krsu-3728	// 12.2 // śrī-śukaḥ // 107 // [108]	ro-0 śrī śukaḥ 
SA_GR14_ss4_krsu-3729	tene dhīrā api yanti brahma-vida utkramya svarga-lokam ito vimuktāḥ [BAU	tene dhīrāḥ api yanti brahma vidaḥ utkramya svarga lokam itas vimuktāḥ 
SA_GR14_ss4_krsu-3730	4.4.8] iti śruty-anusāreṇa svarga-śabdenāpy āha - yātu-dhāny api sā svargam	iti śruti anusāreṇa svarga śabdena api āha yātudhānī api sā svargam 
SA_GR14_ss4_krsu-3731	āpa jananī-gatim [BhP 10.6.38] iti /	āpa jananī gatim bhp iti 
SA_GR14_ss4_krsu-3732	atra jananī-gatim iti viśeṣaṇena lokāntaraṃ nirastam /	atra jananī gatim iti viśeṣaṇena loka antaram nirastam 
SA_GR14_ss4_krsu-3733	tat-prakaraṇa eva	tad prakaraṇe eva 
SA_GR14_ss4_krsu-3734	tadādīnāṃ bahuśo gaty-antara-niṣedhāt /	tad ādīnām bahuśas gati antara niṣedhāt 
SA_GR14_ss4_krsu-3735	sad-veṣād iva pūtanāpi sakulā	sa dveṣāt iva pūtanā api sa kulā 
SA_GR14_ss4_krsu-3736	tvām eva devāpitā [BhP 10.14.35] ity atra sākṣāt tat-prāpti-nirdhāraṇāc ca /	tvām eva devāpitā bhp iti atra sākṣāt tad prāpti nirdhāraṇāt ca 
SA_GR14_ss4_krsu-3737	tathā ca kenopaniṣadi dṛśyate - keneṣitaṃ manaḥ patati prāṇasya prāṇam uta	tathā ca kena upaniṣadi dṛśyate kena iṣitam manaḥ patati prāṇasya prāṇam uta 
SA_GR14_ss4_krsu-3738	cakṣuṣaś cakṣur atimucya dhīrāḥ pretyāsmāl lokād amṛtā bhavanti [KenaU	cakṣuṣaḥ cakṣuḥ atimucya dhīrāḥ pretya asmāt lokāt amṛtāḥ bhavanti kenau 
SA_GR14_ss4_krsu-3739	1.1-2] ity upakramya,	iti upakramya 
SA_GR14_ss4_krsu-3740	tad eva brahma tvaṃ viddhi [KenaU 1.4] iti madhye	tat eva brahma tvam viddhi kenau iti madhye 
SA_GR14_ss4_krsu-3741	procya, amṛtatvaṃ hi vidante [KenaU 2.4],	procya amṛta tvam hi vidante kenau 
SA_GR14_ss4_krsu-3742	satyam āyatanaṃ [KenaU 4.8] yo vā	satyam āyatanam kenau yaḥ vā 
SA_GR14_ss4_krsu-3743	etām evam upaniṣadaṃ vedāpahatya pāpmānam anante svarge loke	etām evam upaniṣadam veda apahatya pāpmānam anante svarge loke 
SA_GR14_ss4_krsu-3744	pratiṣṭhati [KenaU 4.9] iti upasaṃhṛtam /	pratiṣṭhati kenau iti upasaṃhṛtam 
SA_GR14_ss4_krsu-3745	tataḥ ko vāsudevaḥ kiṃ tad vanaṃ ko	tatas kaḥ vāsudevaḥ kim tat vanam kaḥ 
SA_GR14_ss4_krsu-3746	vā svargaḥ kiṃ tad brahma ity apekṣāyām puruṣo ha vai nārāyaṇaḥ ity	vā svargaḥ kim tat brahma iti apekṣāyām puruṣaḥ ha vai nārāyaṇaḥ iti 
SA_GR14_ss4_krsu-3747	upakramya, punaś cābhyāsena nityo deva eko nārāyaṇaḥ ity uktvā	upakramya punar ca abhyāsena nityaḥ devaḥ ekaḥ nārāyaṇaḥ iti uktvā 
SA_GR14_ss4_krsu-3748	nārāyaṇopāsakasya ca stutiṃ kṛtvā tad brahma nārāyaṇa eveti vyajya svargaṃ	nārāyaṇa upāsakasya ca stutim kṛtvā tat brahma nārāyaṇaḥ eva iti vyajya svargam 
SA_GR14_ss4_krsu-3749	pratipādayituṃ vaikuṇṭhaṃ vana-lokaṃ gamiṣyati tad idaṃ puram idaṃ	pratipādayitum vaikuṇṭham vana lokam gamiṣyati tat idam puram idam 
SA_GR14_ss4_krsu-3750	puṇḍarīkaṃ vijñāna-ghanaṃ tasmāt tad ihāvabhāsam iti vana-lokākārasya	puṇḍarīkam vijñāna ghanam tasmāt tat iha avabhāsam iti vana loka ākārasya 
SA_GR14_ss4_krsu-3751	vaikuṇṭhasyānandātmakatvaṃ pratipādya sa ca tad-adhiṣṭhātā nārāyaṇaḥ	vaikuṇṭhasya ānanda ātmaka tvam pratipādya sa ca tad adhiṣṭhātā nārāyaṇaḥ 
SA_GR14_ss4_krsu-3752	kṛṣṇa evety upasaṃharati brahmaṇyo devakī-putraḥ iti /	kṛṣṇaḥ eva iti upasaṃharati brahmaṇyaḥ devakīputraḥ iti 
SA_GR14_ss4_krsu-3753	// 10.6 // śrī-śukaḥ // 108 // [109]	ro-0 śrī śukaḥ 
SA_GR14_ss4_krsu-3754	kāṣṭhā-śabdenāpi tam evoddiśati -	kāṣṭhā śabdena api tam eva uddiśati 
SA_GR14_ss4_krsu-3755	brūhi yogeśvare kṛṣṇe brahmaṇye dharma-varmaṇi /	brūhi yogeśvare kṛṣṇe brahmaṇye dharmavarmaṇi 
SA_GR14_ss4_krsu-3756	svāṃ kāṣṭhām adhunopete dharmaḥ kaṃ śaraṇaṃ gataḥ // [BhP 1.1.23]	svām kāṣṭhām adhunā upete dharmaḥ kam śaraṇam gataḥ bhp 
SA_GR14_ss4_krsu-3757	svāṃ kāṣṭhāṃ diśam /	svām kāṣṭhām diśam 
SA_GR14_ss4_krsu-3758	yatra svayaṃ nityaṃ tiṣṭhati tatraiva prāpañcika-loka-	yatra svayam nityam tiṣṭhati tatra eva prāpañcika loka 
SA_GR14_ss4_krsu-3759	sambandhaṃ tyaktvā gate satītyarthaḥ /	sambandham tyaktvā gate sati iti arthaḥ 
SA_GR14_ss4_krsu-3760	// 1.1 // śrī-śaunakaḥ // 109 // [110]	ro-0 śaunakaḥ 
SA_GR14_ss4_krsu-3761	tad evam abhipretya dvārakāyās tāvan nitya-śrī-kṛṣṇa-dhāmatvam āha -	tat evam abhipretya dvārakāyāḥ tāvat nitya śrī kṛṣṇa dhāma tvam āha 
SA_GR14_ss4_krsu-3762	satyaṃ bhayād iva guṇebhya urukramāntaḥ	satyam bhayāt iva guṇebhyaḥ uru krama antaḥ 
SA_GR14_ss4_krsu-3763	śete samudra upalambhana-mātra ātmā /	śete samudre upalambhana mātraḥ ātmā 
SA_GR14_ss4_krsu-3764	nityaṃ kad-indriya-gaṇaiḥ kṛta-vigrahas tvaṃ	nityam kad indriya gaṇaiḥ kṛta vigrahaḥ tvam 
SA_GR14_ss4_krsu-3765	tvat-sevakair nṛpa-padaṃ vidhutaṃ tamo 'ndham // [BhP 10.60.35]	tvad sevakaiḥ nṛpa padam vidhutam tamaḥ 
SA_GR14_ss4_krsu-3766	ayam arthaḥ /	ayam arthaḥ 
SA_GR14_ss4_krsu-3767	pūrvaṃ śrī-kṛṣṇa-devena śrī-rukmiṇī-devyai --	pūrvam śrī kṛṣṇa devena śrī rukmiṇī devyai 
SA_GR14_ss4_krsu-3768	rājabhyo bibhyataḥ su-bhru samudraṃ śaraṇaṃ gatān /	rājabhyaḥ bibhyataḥ subhru samudram śaraṇam gatān 
SA_GR14_ss4_krsu-3769	bala-vadbhiḥ kṛta-dveṣān prāyas tyakta-nṛpāsanān // [BhP 10.60.12]	balavadbhiḥ kṛta dveṣān prāyas tyakta nṛpāsanān 
SA_GR14_ss4_krsu-3770	kasmān no vavṛṣe iti parihasitam /	kasmāt naḥ vavṛṣe iti parihasitam 
SA_GR14_ss4_krsu-3771	atrottaram āha satyam iti /	atra uttaram āha satyam iti 
SA_GR14_ss4_krsu-3772	atrātmā tvam	atra ātmā tvam 
SA_GR14_ss4_krsu-3773	ity etayoḥ padayor yugapac chetu iti kriyānvayāyogāt viśeṣaṇa-viśeṣya-	iti etayoḥ padayoḥ yugapad śetu iti kriyā anvaya ayogāt viśeṣaṇa viśeṣya 
SA_GR14_ss4_krsu-3774	bhāvaḥ pratihanyeta /	bhāvaḥ pratihanyeta 
SA_GR14_ss4_krsu-3775	vākya-cchede tu kaṣṭatāpatet /	vākya chede tu kaṣṭa tā āpatet 
SA_GR14_ss4_krsu-3776	tataś copamānopameya-	tatas ca upamāna upameya 
SA_GR14_ss4_krsu-3777	bhāvenaiva te upatiṣṭhataḥ /	bhāvena eva te upatiṣṭhataḥ 
SA_GR14_ss4_krsu-3778	iyaṃ ca luptopamā /	iyam ca lupta upamā 
SA_GR14_ss4_krsu-3779	tathā ca ātmā sākṣī yathā	tathā ca ātmā sākṣī yathā 
SA_GR14_ss4_krsu-3780	guṇebhyaḥ sattvādi-vikārebhyas tad-asparśāliṅgād bhayād iva samudre	guṇebhyaḥ sattva ādi vikārebhyaḥ tad asparśa aliṅgāt bhayāt iva samudre 
SA_GR14_ss4_krsu-3781	tadvad agādhe viṣayākārair aparicchinne upalambhana-mātre jñāna-mātra-	tadvat agādhe viṣaya ākāraiḥ aparicchinne upalambhana mātre jñāna mātra 
SA_GR14_ss4_krsu-3782	sva-śaktyākāre'ntar-hṛdaye nityaṃ śete,	sva śakti ākāre ntar hṛdaye nityam śete 
SA_GR14_ss4_krsu-3783	akṣubdhatayā prakāśate / he	a kṣubdha tayā prakāśate he 
SA_GR14_ss4_krsu-3784	urukrama tathā tvam api tebhyaḥ samprati tad-vikāramayebhyo rājabhyo	urukrama tathā tvam api tebhyaḥ samprati tad vikāra mayebhyaḥ rājabhyaḥ 
SA_GR14_ss4_krsu-3785	bhayād iva upalambhana-mātre vaikuṇṭhāntaravat cid-eka-vilāse antaḥ-	bhayāt iva upalambhana mātre vaikuṇṭha antara vat cit eka vilāse antar 
SA_GR14_ss4_krsu-3786	samudre dvārakākhye dhāmni nityam eva śeṣe svarūpānanda-vilāsair gūḍhaṃ	samudre dvārakā ākhye dhāmni nityam eva śeṣe svarūpa ānanda vilāsaiḥ gūḍham 
SA_GR14_ss4_krsu-3787	viharasi / artha-vaśād vibhakti-vipariṇāmaḥ prasiddha eva /	viharasi artha vaśāt vibhakti vipariṇāmaḥ prasiddhaḥ eva 
SA_GR14_ss4_krsu-3788	udāhariṣyate ca	udāhariṣyate ca 
SA_GR14_ss4_krsu-3789	nitya-sthāyitvaṃ dvārakāṃ hariṇā tyaktām [BhP 11.31.23] (page 58) ity ādau	nitya sthāyi tvam dvārakām hariṇā tyaktām bhp  iti ādau 
SA_GR14_ss4_krsu-3790	nityaṃ sannihitas tatra bhagavān madhusūdanaḥ [BhP 11.31.24] iti /	nityam sannihitaḥ tatra bhagavān madhusūdanaḥ bhp  iti 
SA_GR14_ss4_krsu-3791	ato vastutas tasya tadāśrayakasya jīva-caitanyasya yadi tebhyo bhayaṃ nāsti	atas vastutas tasya tad āśrayakasya jīva caitanyasya yadi tebhyaḥ bhayam nā asti 
SA_GR14_ss4_krsu-3792	tadā sutarām eva tava nāsti kintūbhayatrāpi sva-dhāmaikya-vilāsitvāt	tadā sutarām eva tava nā asti kintu ubhayatra api sva dhāma aikya vilāsi tvāt 
SA_GR14_ss4_krsu-3793	tatraudāsīnyam eva bhayatvenotprekṣata iti bhāvaḥ /	tatra audāsīnyam eva bhaya tvena utprekṣate iti bhāvaḥ 
SA_GR14_ss4_krsu-3794	evaṃ tasya eva ca	evam tasya eva ca 
SA_GR14_ss4_krsu-3795	samañjasatā /	samañjasa tā 
SA_GR14_ss4_krsu-3796	teṣāṃ tu daurātmyam evety āha /	teṣām tu daurātmyam eva iti āha 
SA_GR14_ss4_krsu-3797	tathāpy ātmā kutsitānām	tathā api ātmā kutsitānām 
SA_GR14_ss4_krsu-3798	indriyāṇāṃ gaṇais tadīya-nānā-vṛtti-rūpaiḥ kṛto vigraho yatra tathāvidhas	indriyāṇām gaṇaiḥ tadīya nānā vṛtti rūpaiḥ kṛtaḥ vigrahaḥ yatra tathāvidhaḥ 
SA_GR14_ss4_krsu-3799	tvam api kutsita indriya-gaṇo yeṣāṃ tathābhūtaiḥ rājabhiḥ kṛta-vigrahaḥ /	tvam api kutsitaḥ indriya gaṇaḥ yeṣām tathābhūtaiḥ rājabhiḥ kṛta vigrahaḥ 
SA_GR14_ss4_krsu-3800	ubhayatrāpyāvaraṇa-dhārṣṭyam /	ubhayatra api āvaraṇa dhārṣṭyam 
SA_GR14_ss4_krsu-3801	yady evambhūtas tvaṃ tarhi kā tava	yadi evambhūtaḥ tvam tarhi kā tava 
SA_GR14_ss4_krsu-3802	nṛpāsana-parityāge hāniḥ /	nṛpāsana parityāge hāniḥ 
SA_GR14_ss4_krsu-3803	tat tu tvat-sevakaiḥ prāthamikatvad-	tat tu tvad sevakaiḥ prāthamika tvat 
SA_GR14_ss4_krsu-3804	bhajanonmukhair eva vidhutaṃ tyaktam /	bhajana unmukhaiḥ eva vidhutam tyaktam 
SA_GR14_ss4_krsu-3805	tac coktaṃ tayaiva yad-vāñchayā	tat ca uktam tayā eva yad vāñchayā 
SA_GR14_ss4_krsu-3806	nṛpa-śikhāmaṇayaḥ [BhP 10.60.41] ity ādinā /	nṛpa śikhāmaṇayaḥ iti ādinā 
SA_GR14_ss4_krsu-3807	yato'ndhaṃ tama eva tat prākṛta-	yatas undham tamaḥ eva tat prākṛta 
SA_GR14_ss4_krsu-3808	sukha-mayatvāt /	sukha maya tvāt 
SA_GR14_ss4_krsu-3809	ataḥ śrī-dvārakāyā nityatvam api dhvanitam /	atas śrī dvārakāyāḥ nitya tvam api dhvanitam 
SA_GR14_ss4_krsu-3810	// 10.60 // śrī-rukmiṇī śrī-bhagavantam // 110 // [111]	      
SA_GR14_ss4_krsu-3811	atha śrī-mathurāyāḥ /	atha śrī mathurāyāḥ 
SA_GR14_ss4_krsu-3812	mathurā bhagavān yatra nityaṃ sannihito hariḥ // [BhP	mathurā bhagavān yatra nityam sannihitaḥ hariḥ  bhp 
SA_GR14_ss4_krsu-3813	10.1.28] arthāt tatratyānām /	arthāt tatratyānām 
SA_GR14_ss4_krsu-3814	// 10.1 // śrī-śukaḥ // 111 // [112]	ro-0 śrī śukaḥ 
SA_GR14_ss4_krsu-3815	tat tāta gaccha bhadraṃ te yamunāyās taṭaṃ śuci /	tat tāta gaccha bhadram te yamunāyāḥ taṭam śuci 
SA_GR14_ss4_krsu-3816	puṇyaṃ madhu-vanaṃ yatra sānnidhyaṃ nityadā hareḥ // [BhP 4.8.42]	puṇyam madhuvanam yatra sānnidhyam nityadā hareḥ 
SA_GR14_ss4_krsu-3817	spaṣṭam // 4.8 // śrī-nārado dhruvam // 112 // [113]	       
SA_GR14_ss4_krsu-3818	tasya hareḥ śrī-kṛṣṇatvam eva vyanakti -	tasya hareḥ śrī kṛṣṇa tvam eva vyanakti 
SA_GR14_ss4_krsu-3819	ity uktas taṃ parikramya praṇamya ca nṛpārbhakaḥ /	iti uktaḥ tam parikramya praṇamya ca nṛpa arbhakaḥ 
SA_GR14_ss4_krsu-3820	yayau madhu-vanaṃ puṇyaṃ hareś caraṇa-carcitam // [BhP 4.8.62]	yayau madhuvanam puṇyam hareḥ caraṇa carcitam 
SA_GR14_ss4_krsu-3821	[Vṛ. here reads:	vṛ here reads 
SA_GR14_ss4_krsu-3822	pādma-kalpārambha-kathane prathama-svāyambhuva-	pādma kalpa ārambha kathane 
SA_GR14_ss4_krsu-3823	manvantare tasmin hareś caraṇa-carcitavaṃ śrī-mathurāyās tan-nityatvāt śrī-	manvantare tasmin hareḥ caraṇa carcitavam śrī mathurāyāḥ tad nitya tvāt śrī 
SA_GR14_ss4_krsu-3824	kṛṣṇāvatārasya /	kṛṣṇa avatārasya 
SA_GR14_ss4_krsu-3825	tathā hari-śabdenāpy atra śrī-kṛṣṇa eva vivakṣitaḥ śruty-	tathā hari śabdena api atra śrī kṛṣṇaḥ eva vivakṣitaḥ śrutī 
SA_GR14_ss4_krsu-3826	ādau tad-avasthiti-prasiddheḥ /	ādau tad avasthiti prasiddheḥ 
SA_GR14_ss4_krsu-3827	End addition.]	end addition 
SA_GR14_ss4_krsu-3828	pratikalpam āvirbhāvāt tasyaiva caraṇābhyāṃ carcitam iti śrī-kṛṣṇasyaiva	pratikalpam āvirbhāvāt tasya eva caraṇābhyām carcitam iti śrī kṛṣṇasya eva 
SA_GR14_ss4_krsu-3829	nitya-sānnidhyatvaṃ gamyate /	nitya sānnidhya tvam gamyate 
SA_GR14_ss4_krsu-3830	ataeva dvādaśākṣara-vidyā-daivatasya śrī-	ataeva dvādaśa akṣara vidyā daivatasya śrī 
SA_GR14_ss4_krsu-3831	dhruvārādhyasya tv anyata eva tatrāgamanam abhihitam iti madhor vanaṃ	dhruva ārādhyasya tu anyatas eva tatra āgamanam abhihitam iti madhoḥ vanam 
SA_GR14_ss4_krsu-3832	bhṛtya-didṛkṣayā gataḥ [BhP 4.9.1] ity aneneti /	bhṛtya didṛkṣayā gataḥ bhp  iti anena iti 
SA_GR14_ss4_krsu-3833	// 4.8 // śrī-maitreyaḥ // 113 // [114]	ro-0 
SA_GR14_ss4_krsu-3834	atha śrī-vṛndāvanasya -	atha śrī vṛndāvanasya 
SA_GR14_ss4_krsu-3835	puṇyā bata vraja-bhuvo yad ayaṃ nṛ-liṅga-	puṇyāḥ bata vraja bhuvaḥ yat ayam nṛliṅga 
SA_GR14_ss4_krsu-3836	gūḍhaḥ purāṇa-puruṣo vana-citra-mālyaḥ /	gūḍhaḥ purāṇapuruṣaḥ vana citra mālyaḥ 
SA_GR14_ss4_krsu-3837	gāḥ pālayan saha-balaḥ kvaṇayaṃś ca veṇuṃ	gāḥ pālayan sahabalaḥ kvaṇayan ca veṇum 
SA_GR14_ss4_krsu-3838	vikrīḍayāñcati giritra-ramārcitāṅghriḥ // [BhP 10.44.12]	vikrīḍayā añcati giritra ramā arcita aṅghriḥ 
SA_GR14_ss4_krsu-3839	atra pūrvodāhṛta-śruty-ādy-avaṣṭambhena tiṣṭhanti parvatā itivad añcati	atra pūrva udāhṛta śruti ādi avaṣṭambhena tiṣṭhanti parvatāḥ iti vat añcati 
SA_GR14_ss4_krsu-3840	sadaiva viharatīti mathurā-strīṇāṃ śrī-bhagavat-prasādajā yathāvad bhāratī-	sadā eva viharati iti mathurā strīṇām śrī bhagavat prasāda jā yathāvat bhāratī 
SA_GR14_ss4_krsu-3841	niḥsṛtir iyam iti vyākhyeyam / (page 59)	niḥsṛtiḥ iyam iti vyākhyeyam page 
SA_GR14_ss4_krsu-3842	// 10.44 // pura-striyaḥ parasparam // 114 //	ro pura striyaḥ parasparam 
SA_GR14_ss4_krsu-3843	[Vṛ. reads for this section:	vṛ reads for this section 
SA_GR14_ss4_krsu-3844	sa ca vṛndāvana-guṇair vasanta iva lakṣitaḥ /	sa ca vṛndāvana guṇaiḥ vasantaḥ iva lakṣitaḥ 
SA_GR14_ss4_krsu-3845	yatrāste bhagavān sākṣād rāmeṇa saha keśavaḥ // [BhP 10.18.3]	yatra āste bhagavān sākṣāt rāmeṇa saha keśavaḥ 
SA_GR14_ss4_krsu-3846	atra yatrāsīd ity aprocya yatrāste ity uktyā nitya-sthititvam eva vyaktīkṛtam //	atra yatra āsīt iti a procya yatra āste iti uktyā nitya sthiti tvam eva vyaktīkṛtam 
SA_GR14_ss4_krsu-3847	// 10.18 // śrī-śukaḥ // 114 //	ro-0 śrī śukaḥ 
SA_GR14_ss4_krsu-3848	End alternative reading.] [115]	end alternative reading 
SA_GR14_ss4_krsu-3849	athavā triṣv apy etad evodhāraṇīyam -	athavā triṣu api etat eva udhāraṇīyam 
SA_GR14_ss4_krsu-3850	jayati jana-nivāso devakī-janma-vādo	jayati jana nivāsaḥ 
SA_GR14_ss4_krsu-3851	yadu-vara-pariṣat svair dorbhir asyann adharmam /	yadu vara pariṣad svaiḥ dorbhiḥ asyan adharmam 
SA_GR14_ss4_krsu-3852	sthira-cara-vṛjina-ghnaḥ su-smita- śrī-mukhena	sthira cara vṛjina ghnaḥ su smita śrī mukhena 
SA_GR14_ss4_krsu-3853	vraja-pura-vanitānāṃ vardhayan kāma-devam // [BhP 10.90.48]	vraja pura vanitānām vardhayan kāmadevam 
SA_GR14_ss4_krsu-3854	yadu-varāḥ pariṣat sabhya-rūpā yasya saḥ /	yadu varāḥ pariṣad sabhya rūpā yasya saḥ 
SA_GR14_ss4_krsu-3855	devakī-janma-vādas taj-	devakī janma vādaḥ tat 
SA_GR14_ss4_krsu-3856	janmatvena labdha-khyātiḥ /	janma tvena labdha khyātiḥ 
SA_GR14_ss4_krsu-3857	devakyāṃ janmeti vādas tattva-bubhutsu-kathā	devakyām janma iti vādaḥ tattva bubhutsu kathā 
SA_GR14_ss4_krsu-3858	yasya sa iti vā /	yasya saḥ iti vā 
