segmentnr	original	analyzed
SA_GSP28_sastrdiu-1813	bhūtalamātraṃ jñāyate na ghaṭastadabhāvo vetyarthaḥ /	bhū tala mātram jñāyate na ghaṭaḥ tad abhāvaḥ vā iti arthaḥ 
SA_GSP28_sastrdiu-1814	tena yadi bhavānapi ghaṭādijñānābhāvayuktaṃ bhūtalajñānamaṅgīkuryāt tato jñānābhāvāṅgīkartavya ityuktameva /	tena yadi bhavān api ghaṭa ādi jñāna abhāva yuktam bhū tala jñānam aṅgīkuryāt tatas jñāna abhāva aṅgīkartavyaḥ iti uktam eva 
SA_GSP28_sastrdiu-1815	tena naivaṃ bhramitavyam- abhāvavādināpi svarūpamātraṃ dṛṣṭvā ca paścātkiñcitsmaraṇannapīti vadatā bhāvajñānātirekeṇa tanmātravedanamaṅgīkṛtam,	tena nā evam bhramitavyam abhāva vādinā api svarūpa mātram dṛṣṭvā ca paścāt kiñcid smaraṇat api iti vadatā bhāva jñāna atirekeṇa tanmātra vedanam aṅgīkṛtam 
SA_GSP28_sastrdiu-1816	tadeva dṛśye pratiyogini nāstīti vyavahārakāraṇatvānnāstīti śabdasyārthābhāvādbhūtalavedanameva kāraṇamiti vaktavyam /	tat eva dṛśye pratiyogini na asti iti vyavahāra kāraṇa tvāt na asti iti śabdasya artha abhāvāt bhū tala vedanam eva kāraṇam iti vaktavyam 
SA_GSP28_sastrdiu-1817	tataśca ghaṭavatyapi prasaṅga iti sthitaṃ dūṣaṇam //*//	tatas ca ghaṭavati api prasaṅgaḥ iti sthitam dūṣaṇam 
SA_GSP28_sastrdiu-1818	atha bhāve deśāntarasthe deśāntaragrahaṇaṃ kāraṇamiti mataṃ,	atha bhāve deśa antara sthe deśa antara grahaṇam kāraṇam iti matam 
SA_GSP28_sastrdiu-1819	tataḥ śābaleyasthitaṃ gotvaṃ dhāvaleye nāstīti vyavahriyeta,	tatas śābaleya sthitam go tvam dhāvaleye na asti iti vyavahriyeta 
SA_GSP28_sastrdiu-1820	sthūṇāntarasthitaśca vaṃśaḥ sthūṇāntare 'nusyūto 'pi tatra nāstīti vyavahartavyaḥ syāt,	sthūṇā antara sthitaḥ ca vaṃśaḥ sthūṇā antare tatra na asti iti vyavahartavyaḥ syāt 
SA_GSP28_sastrdiu-1821	ato 'trābhāva eva nāstīti vyavahārakāraṇam,	atas tra abhāvaḥ eva na asti iti vyavahāra kāraṇam 
SA_GSP28_sastrdiu-1822	nānyatra sadbhāvaḥ /	na anyatra sadbhāvaḥ 
SA_GSP28_sastrdiu-1823	smaryamāṇe ghaṭe bhūtalavedanaṃ nāstīti vyavahārakāraṇamiticet / na /	smaryamāṇe ghaṭe bhū tala vedanam na asti iti vyavahāra kāraṇam iti ced na 
SA_GSP28_sastrdiu-1824	gṛhyamāṇasyāpi pārśvadeśeṣvabhāvavyavahārāt /	gṛhyamāṇasya api pārśva deśeṣu abhāva vyavahārāt 
SA_GSP28_sastrdiu-1825	saṃpratyānītasya ca ghaṭasya gṛhyamāṇasyaiva prāgayamiha nāsīt iti prākkālīnābhāvavyavahārāt //	saṃpratyānītasya ca ghaṭasya gṛhyamāṇasya eva prāk ayam iha na āsīt iti prāc kālīna abhāva vyavahārāt 
SA_GSP28_sastrdiu-1826	prabhākaramatānuvādaḥ //	         
SA_GSP28_sastrdiu-1827	nanu bhavanmate pramīyamānasya ghaṭasya prākkālīnābhāvajñānaṃ bhāvapramāṇabhāvo hyabhāvajñānakāraṇam /	nanu bhavat mate pramīyamānasya ghaṭasya prāc kālīna abhāva jñānam bhāva pramāṇa bhāvaḥ hi abhāva jñāna kāraṇam 
SA_GSP28_sastrdiu-1828	na ca pramāyamāṇo 'pi ghaṭaḥ prākkālasaṃbandhitayā na pramīyate ataḥ prākkālasaṃbandhagocarapramāṇānudayāttatkālīnābhāvajñānaṃ yuktameveti  #	na ca pramāyamāṇaḥ pi ghaṭaḥ prāk kāla saṃbandhi tayā na pramīyate atas prāk kāla saṃbandha gocara pramāṇa anudayāt tad kālīna abhāva jñānam yuktam eva iti 
SA_GSP28_sastrdiu-1829	cet / na /	ced na 
SA_GSP28_sastrdiu-1830	ayogyatvāt /	ayogya tvāt 
SA_GSP28_sastrdiu-1831	na hi prākkālasaṃbandho 'dhunā pramātuṃ yogyaḥ,	na hi prāc kāla saṃbandhaḥ dhunā pramātum yogyaḥ 
SA_GSP28_sastrdiu-1832	yogyapramāṇābhāvaścābhāvajñānakāraṇaṃ na pramāṇābhāvamātram /	yogya pramāṇa abhāvaḥ ca abhāva jñāna kāraṇam na pramāṇa abhāva mātram 
SA_GSP28_sastrdiu-1833	prākkāle tu yogyasyaiva prāmāṇasyānudaya āsīt,	prāc kāle tu yogyasya eva prāmāṇasya anudayaḥ āsīt 
SA_GSP28_sastrdiu-1834	na hi tadānīṃ ghaṭābhāvaḥ sannapi pramitaḥ pratiyogino ghaṭasyāparāmarśāt tadapekṣatvāccābhāvajñānasya,	na hi tadānīm ghaṭa abhāvaḥ san api pramitaḥ pratiyoginaḥ ghaṭasya aparāmarśāt tad apekṣa tvāt ca abhāva jñānasya 
SA_GSP28_sastrdiu-1835	ata eva ghaṭābhāvo 'dhunā smaryata iti na yuktam /	atas eva ghaṭa abhāvaḥ dhunā smaryate iti na yuktam 
SA_GSP28_sastrdiu-1836	apramitasya smaraṇayogāt /	apramitasya smaraṇa yogāt 
SA_GSP28_sastrdiu-1837	yaścāyaṃ prākkālīnaḥ pramāṇānudayaḥ so 'dhunā pramāṇodayena naṣṭo nābhāvajñānamutpādayitumarhati,	yaḥ ca ayam prāc kālīnaḥ pramāṇa anudayaḥ saḥ dhunā pramāṇa udayena naṣṭaḥ na abhāva jñānam utpādayitum arhati 
SA_GSP28_sastrdiu-1838	uddhṛtamiva netraṃ rūpabuddhim //*//	uddhṛtam iva netram rūpa buddhim 
SA_GSP28_sastrdiu-1839	atha naṣṭo 'pi pramāṇānudayaḥ saṃprati smaryamāṇo hyastanāgnijñānam /	atha naṣṭaḥ pramāṇa anudayaḥ saṃprati smaryamāṇaḥ hyastana agni jñānam 
SA_GSP28_sastrdiu-1840	syādevaṃ yadi pramāṇābhāvo jñāyamānatayā meyābhāvaṃ bodhayet liṅgamiva liṅginam /	syāt evam yadi pramāṇa abhāvaḥ jñāyamāna tayā meya abhāvam bodhayet liṅgam iva liṅginam 
SA_GSP28_sastrdiu-1841	na ca tathā saṃbhavati anavasthāprasaṅgāt /	na ca tathā saṃbhavati anavasthā prasaṅgāt 
SA_GSP28_sastrdiu-1842	prameyābhāvaṃ bodhayet jñātavyaḥ /	prameya abhāvam bodhayet jñātavyaḥ 
SA_GSP28_sastrdiu-1843	sopicābhāvatvādanyenābhāvajñānena jñātavyaḥ,	saḥ u pi ca abhāva tvāt anyena abhāva jñānena jñātavyaḥ 
SA_GSP28_sastrdiu-1844	so 'pyanyeneti na janmasahasreṇāpi ghaṭābhāvo 'vadhāryeta /	saḥ u pi anyena iti na janma sahasreṇa api ghaṭa abhāvaḥ vadhāryeta 
SA_GSP28_sastrdiu-1845	tasmātsattāmātreṇaiva pramāṇābhāvo 'bhāvajñānamutpādayati netrādivadityaṅgīkartavyam,	tasmāt sattā mātreṇa eva pramāṇa abhāvaḥ bhāva jñānam utpādayati netra ādi vat iti aṅgīkartavyam 
SA_GSP28_sastrdiu-1846	ataḥ pramīyamāṇasya ghaṭasya kathaṃ prākkālābhāvapramitiriti vaktavyam //*//	atas pramīyamāṇasya ghaṭasya katham prāc kāla abhāva pramitiḥ iti vaktavyam 
SA_GSP28_sastrdiu-1847	ucyate- sattāmātreṇa jñānābhāvo jñāyābhāvaṃ bodhayatīti samyaguktam,	ucyate sattā mātreṇa jñāna abhāvaḥ jñāya abhāvam bodhayati iti samyak uktam 
SA_GSP28_sastrdiu-1848	astyeva tvadhunā dṛśyamānasyāpi ghaṭasya	asti eva tu adhunā dṛśyamānasya api ghaṭasya 
SA_GSP28_sastrdiu-1849	prākkālasaṃbandhagocarayogyajñānānudayaḥ,	            
SA_GSP28_sastrdiu-1850	sahi prākkālisaṃbandhitayā smartuṃ yogyaḥ sannapi na smaryate,	sa hi prāc kāli saṃbandhi tayā smartum yogyaḥ san api na smaryate 
SA_GSP28_sastrdiu-1851	nacāvaśyaṃpramāṇābāva	naca avaśyam pramāṇa 
SA_GSP28_sastrdiu-1852	evābhāvasya bodhakaḥ smaraṇajñānasyāpi yogyatve satyanudayo bhāvaṃ bodhayatyeva,	eva abhāvasya bodhakaḥ smaraṇa jñānasya api yogya tve sati anudayaḥ bhāvam bodhayati eva 
SA_GSP28_sastrdiu-1853	tena saṃprati dṛśyamāno 'pi ghaṭo yadi prāgapyāsīttato 'vaśyaṃ tatra sthitena pramitaḥ syāt,	tena saṃprati dṛśyamānaḥ pi ghaṭaḥ yadi prāk api āsīt tatas vaśyam tatra sthitena pramitaḥ syāt 
SA_GSP28_sastrdiu-1854	pramitaścādhunā smartavyaḥ syāt,	pramitaḥ ca adhunā smartavyaḥ syāt 
SA_GSP28_sastrdiu-1855	evaṃ satyapi na smaryate so 'yaṃ smartavyaviṣayasmaraṇānudayaḥ saṃprati vidyamānaḥ saṃpratitanaṃ prākkālīnābhāvaviṣayaṃ vijñānaṃ janayatīti  #	evam sati api na smaryate saḥ yam smartavya viṣaya smaraṇa anudayaḥ saṃprati vidyamānaḥ saṃpratitanam prāc kālīna abhāva viṣayam vijñānam janayati iti 
SA_GSP28_sastrdiu-1856	na kiñcidanupapannam /	na kiñcid anupapannam 
SA_GSP28_sastrdiu-1857	bhāṣye ca pramāṇābhāvaśabdaḥ smaraṇābhāvasyāpyupalakṣaṇārthaḥ,	bhāṣye ca pramāṇa abhāva śabdaḥ smaraṇa abhāvasya api upalakṣaṇa arthaḥ 
SA_GSP28_sastrdiu-1858	tathā vārtike 'pi /	tathā vārtike pi 
SA_GSP28_sastrdiu-1859	yadvā pramāṇasya smaraṇaphalatvāttadabhāvo 'pi phalataḥ pramāṇābāva eveti śakyate vaktum //	yat vā pramāṇasya smaraṇa phala tvāt tad abhāvaḥ pi phalataḥ pramāṇa abāvaḥ eva iti śakyate vaktum 
SA_GSP28_sastrdiu-1860	uktaprabhākarakhaṇḍanam /	         
SA_GSP28_sastrdiu-1861	nanu na sattāmātreṇa yogyānupalabdherabhāvabodhakatvaṃ yuktaṃ,	nanu na sattā mātreṇa yogya anupalabdheḥ abhāva bodhaka tvam yuktam 
SA_GSP28_sastrdiu-1862	satyāmapi tasyāṃ kadācidabhāvabuddhyanudayāt,	satyām api tasyām kadācid abhāva buddhi anudayāt 
SA_GSP28_sastrdiu-1863	asatyāmapi kadācidudayāt /	asatyām api kadācid udayāt 
SA_GSP28_sastrdiu-1864	tathāhi yo 'ṅgulīyakabubhutsayā sasantamasāvapavarakadeśaṃ hastābhyāṃ sarvataḥ parāmṛṣṭavān tasya tāvat sarvadeśaparāmarśāt vastuto yogyānupalabdhirjātaiva,	tathā hi yaḥ ṅgulīyaka bubhutsayā sa santam asau apavaraka deśam hastābhyām sarvatas parāmṛṣṭavān tasya tāvat sarva deśa parāmarśāt vastutas yogya anupalabdhiḥ jātā eva 
SA_GSP28_sastrdiu-1865	atha ca kiṃ sarvo deśaḥ parāmṛṣṭaḥ kiṃ vā kaściddeśo syāditi saṃdihāno yogyānupalabdheraniścayāt satyāpi tasyāṃ nāṅgulīyakasyābhāvamavadhārayati	atha ca kim sarvaḥ deśaḥ parāmṛṣṭaḥ kim vā kaścid deśaḥ syāt iti saṃdihānaḥ yogya anupalabdheḥ aniścayāt satyā api tasyām na aṅgulīyakasya abhāvam avadhārayati 
SA_GSP28_sastrdiu-1866	kadācittu sarvato 'parāmṛśyāpi sarvataḥ parāmṛṣṭamiti bhrāntyā yogyānupalabdhiṃ niścityāsatyāmeva tasyāṃ bhrāntyāṅgulīyakasyābhāvamavadhārayati	kadācid tu parāmṛśya api sarvatas parāmṛṣṭam iti bhrāntyā yogya anupalabdhim niścitya asatyām eva tasyām bhrāntyā aṅgulīyakasya abhāvam avadhārayati 
SA_GSP28_sastrdiu-1867	tasmājjñātatayaiva yogyānupalabdhirabhāvajñānakāraṇamityabhyupagantavyam /	tasmāt jñāta tayā eva yogya anupalabdhiḥ abhāva jñāna kāraṇam iti abhyupagantavyam 
SA_GSP28_sastrdiu-1868	tathācānavasthāprasaṅgaḥ /	tathā ca anavasthā prasaṅgaḥ 
SA_GSP28_sastrdiu-1869	tasmātsvasaṃvedyā tanmātrasaṃvideva dṛśyasya pratiyogino 'bhāvo na tatvāntaram /-- /	tasmāt sva saṃvedyā tanmātra saṃvid eva dṛśyasya pratiyoginaḥ bhāvaḥ na tatva antaram 
SA_GSP28_sastrdiu-1870	nanu cābhāvalaṅgīkāre tanmātradhīrapi na kadācinnirūpayituṃ śakyate,	nanu ca abhāva laṅgīkāre tanmātra dhīḥ api na kadācid nirūpayitum śakyate 
SA_GSP28_sastrdiu-1871	na ca bhūtaladhīreva tanmātradhīḥ,	na ca bhū tala dhīḥ eva tanmātra dhīḥ 
SA_GSP28_sastrdiu-1872	saṃsṛṣṭadhiyo 'pi tanmātratāpātāt /	saṃsṛṣṭa dhiyaḥ api tanmātra tā āpātāt 
SA_GSP28_sastrdiu-1873	tatrāpi bhūtalāvabhāsāt /	tatra api bhū tala avabhāsāt 
SA_GSP28_sastrdiu-1874	ato ghaṭādivedanābhāve sati yā bhūtaladhīḥ sā tanmātradhīḥ /	atas ghaṭa ādi vedanā abhāve sati yā bhū tala dhīḥ sā tanmātra dhīḥ 
SA_GSP28_sastrdiu-1875	evaṃ ca jñānābhāvāṅgīkārādabhāvapahnavo 'narthakaḥ /	evam ca jñāna abhāva aṅgīkārāt abhāva apahnavaḥ narthakaḥ 
SA_GSP28_sastrdiu-1876	kathaṃ tarhyetannirūpayitavm,	katham tarhi etat nirūpayitavm 
SA_GSP28_sastrdiu-1877	tadabhidhīyate- ghaṭādyabhāvo 'sti prameyam /	tat abhidhīyate ghaṭa ādi abhāvaḥ sti prameyam 
SA_GSP28_sastrdiu-1878	yogyapramāṇānudayaśca tasya sattāmātreṇaiva netrādivadbodhako na jñātatayā,	yogya pramāṇa anudayaḥ ca tasya sattā mātreṇa eva netra ādi vat bodhakaḥ na jñāta tayā 
SA_GSP28_sastrdiu-1879	yato anavasthā syāt //*//	yatas anavasthā syāt 
SA_GSP28_sastrdiu-1880	yattu satyāpi yogyānupalambho hi kāraṇaṃ tatra yogyatvaṃ jñātatayaiva kāraṇaṃ na sattāmātreṇa,	yat tu satyā api yogya anupalambhaḥ hi kāraṇam tatra yogya tvam jñāta tayā eva kāraṇam na sattā mātreṇa 
SA_GSP28_sastrdiu-1881	tataḥ yogyatvaṃ kadācidajñātaṃ nābhāvamavadhārayati kadācittvavidyamānameva yogyatvaṃ bhrāntyā niścityābhāvamavadhārayati /	tatas yogya tvam kadācid ajñātam na abhāvam avadhārayati kadācid tu avidyamānam eva yogya tvam bhrāntyā niścitya abhāvam avadhārayati 
SA_GSP28_sastrdiu-1882	upalabdhyabhāvastu sanmātratayā kāraṇaṃ na jñātatayā,	upalabdhi abhāvaḥ tu sat mātra tayā kāraṇam na jñāta tayā 
SA_GSP28_sastrdiu-1883	tena nānavasthāpattiriti sarvamavadātam /	tena na anavasthā āpattiḥ iti sarvam avadātam 
SA_GSP28_sastrdiu-1884	ato 'styabhāvākhyaṃ prameyam //	atas sti abhāva ākhyam prameyam 
SA_GSP28_sastrdiu-1885	abhāvasyānupalabdhigamyatvam //	abhāvasya anupalabdhi gamya tvam 
SA_GSP28_sastrdiu-1886	na ca tadaindriyakam,	na ca tat aindriyakam 
SA_GSP28_sastrdiu-1887	indriyavyāpārābhāve 'pi tajjñānotpattidarśanāt /	indriya vyāpāra abhāve pi tad jñāna utpatti darśanāt 
SA_GSP28_sastrdiu-1888	yo 'hani prātaḥkāle gṛhe 'vasthito madhyandinasamaye pṛcchyate kimasmingṛhe prātaḥkāle	yaḥ hani prātaḥkāle gṛhe vasthitaḥ madhyandina samaye pṛcchyate kim asmin gṛhe prātaḥkāle 
SA_GSP28_sastrdiu-1889	māthuraḥ kiścitpuruṣaḥ śuklavāsā dīrghatamo lohitavarṇaḥ samāgataḥ iti sa tadānīmeva	māthuraḥ kiścid puruṣaḥ śukla vāsāḥ dīrghatamaḥ lohita varṇaḥ samāgataḥ iti sa tadānīm eva 
SA_GSP28_sastrdiu-1890	yogyasmaraṇānudayāttasyābhāvaṃ prātaḥkālīnamavadhārayati vinaivendriyavyāpāreṇa /	yogya smaraṇa anudayāt tasya abhāvam prātar kālīnam avadhārayati vinā eva indriya vyāpāreṇa 
SA_GSP28_sastrdiu-1891	na ca prātaravagato 'bāvastadā smaryata iti vācyam /	na ca prātar avagataḥ bāvaḥ tadā smaryate iti vācyam 
SA_GSP28_sastrdiu-1892	pratiyogino māthurasya tadānīṃ kathañcidapi buddhāvanārohāt,	pratiyoginaḥ māthurasya tadānīm kathañcid api buddhau anārohāt 
SA_GSP28_sastrdiu-1893	abuddhisthe ca pratiyogini bhāve tadabhāvajñānasaṃbhavāt /	a buddhi sthe ca pratiyogini bhāve tad abhāva jñāna saṃbhavāt 
SA_GSP28_sastrdiu-1894	evaṃ ca yatrāpīdānīmevānuparatendriyavyāpāreṇa saṃnihitadeśakālavarttyabhāvaḥ pratīyate	evam ca yatra api idānīm eva anuparata indriya vyāpāreṇa saṃnihita deśa kāla vartti abhāvaḥ pratīyate 
SA_GSP28_sastrdiu-1895	tatrāpi yogyajñānānudayasyaiva kḷptasāmarthyasya kāraṇatvasaṃbhavānnendriyasya kāraṇatvaṃ kalpayituṃ śakyam /	tatra api yogya jñāna anudayasya eva kḷpta sāmarthyasya kāraṇa tva saṃbhavāt na indriyasya kāraṇa tvam kalpayitum śakyam 
SA_GSP28_sastrdiu-1896	tasmānna pratyakṣo 'bhāvaḥ /	tasmāt na pratyakṣaḥ bhāvaḥ 
SA_GSP28_sastrdiu-1897	nāpyanumeyaḥ,	na api anumeyaḥ 
SA_GSP28_sastrdiu-1898	ajñātena tena kasyacilliṅgasya saṃbandhagrahaṇasaṃbhavāt //*//	ajñātena tena kasyacid liṅgasya saṃbandha grahaṇa saṃbhavāt 
SA_GSP28_sastrdiu-1899	yadatra kaiściducyate- dṛśyasya sattādarśanavyāptā tena	yat atra kaiścid ucyate dṛśyasya sattā darśana vyāptā tena 
SA_GSP28_sastrdiu-1900	vyāpakībhūtadarśananivṛttyā vyāpyasya dṛśyasya nivṛttiravasīyata iti tannirastam /	vyāpakībhūta darśana nivṛttyā vyāpyasya dṛśyasya nivṛttiḥ avasīyate iti tat nirastam 
SA_GSP28_sastrdiu-1901	vyāpakanivṛttyā vyāpyanivṛttimanumimānenāvaśyaṃ dṛṣṭāntadharmiṣu nivṛttidvayamavagamya tato dṛśyanivṛttiranumātavyā,	vyāpaka nivṛttyā vyāpya nivṛttim anumimānena avaśyam dṛṣṭānta dharmiṣu nivṛtti dvayam avagamya tatas dṛśya nivṛttiḥ anumātavyā 
SA_GSP28_sastrdiu-1902	nivṛtteścābhāvātmikayai na pratyakṣeṇa grahaṇaṃ saṃbhavati,	nivṛtteḥ ca abhāva ātmikayai na pratyakṣeṇa grahaṇam saṃbhavati 
SA_GSP28_sastrdiu-1903	nivṛttyantareṇa tadanumāne tadapi nivṛttirūpatvānnivṛttyantareṇānumātavyam tadapi tathetyanavasthāpattiḥ /	nivṛtti antareṇa tad anumāne tat api nivṛtti rūpa tvāt nivṛtti antareṇa anumātavyam tat api tathā iti anavasthā āpattiḥ 
SA_GSP28_sastrdiu-1904	ato 'vaśyaṃ kvacitpramāṇāntarabhūtayānupalabdhyābhāvaḥ pratyetavyaḥ /	atas vaśyam kvacid pramāṇa antara bhūtayā anupalabdhyā abhāvaḥ pratyetavyaḥ 
SA_GSP28_sastrdiu-1905	pramiteca tasminpaścādbhavatvanumānam /	pramite ca tasmin paścāt bhavatu anumānam 
SA_GSP28_sastrdiu-1906	siddhaṃ tāvadabhāvasya pramāṇāntaratvaṃ śabdopamānārthāpattayastu nāśaṅganīyā eva /	siddham tāvat abhāvasya pramāṇa antara tvam śabda upamāna artha āpattayaḥ tu na āśaṅganīyāḥ eva 
SA_GSP28_sastrdiu-1907	ataḥ siddhaṃ ṣaṣṭhaṃ pramāṇam /	atas siddham ṣaṣṭham pramāṇam 
SA_GSP28_sastrdiu-1908	etāvantyeva ca pramāṇāni //*//	etāvanti eva ca pramāṇāni 
SA_GSP28_sastrdiu-1909	yattvadhikaṃ saṃbhavākhyaṃ pramāṇaṃ sahasrādisaṃkhyayāvayavabhūtaśatādisaṃkhyāvagatiḥ āḍhakapramāṇenāvayavakuḍavaparimāṇāvagatiḥ kaiścidiṣyate,	yat tu adhikam saṃbhava ākhyam pramāṇam sahasra ādi saṃkhyayā avayava bhūta śata ādi saṃkhyā avagatiḥ āḍhaka pramāṇena avayava kuḍava parimāṇa avagatiḥ kaiścid iṣyate 
SA_GSP28_sastrdiu-1910	tadavinābhāvanimittatvādanumānameva /	tad avinābhāva nimitta tvāt anumānam eva 
SA_GSP28_sastrdiu-1911	vaṭevaṭe vaiśravaṇaḥ ityādikaṃ caitihyaṃ pramāṇameva na bhavati nirṇayābhāvāt /	vaṭevaṭe vaiśravaṇaḥ iti ādikam caitihyam pramāṇam eva na bhavati nirṇaya abhāvāt 
SA_GSP28_sastrdiu-1912	prāmāṇyepi vā'game 'ntargatatvānna pramāṇāntaram /	prāmāṇye api vā āgame ntargata tvāt na pramāṇa antaram 
SA_GSP28_sastrdiu-1913	prātibhākhyamapi pramāṇaṃ kaiścidiṣṭaṃ śvaste bhrātāgantetyādikaṃ,	prātibhākhyam api pramāṇam kaiścid iṣṭam śvas te bhrātā āgantā iti ādikam 
SA_GSP28_sastrdiu-1914	tattu liṅgādyābhāsajaṃ,	tat tu liṅga ādi ābhāsa jam 
SA_GSP28_sastrdiu-1915	aniścāyakatvādevāpramāṇam /	aniścāyaka tvāt eva apramāṇam 
SA_GSP28_sastrdiu-1916	ato yatkāśyapīyaiḥ pratibhāgamyamṛṣīṇāṃ dharmādharmatvamāśritam tadasāram /	atas yat kāśyapīyaiḥ pratibhā agamyam ṛṣīṇām dharma adharma tvam āśritam tat asāram 
SA_GSP28_sastrdiu-1917	lokaprasiddhirapi pratyakṣāntargataiveti na pramāṇāntaram /	loka prasiddhiḥ api pratyakṣa antargatā eva iti na pramāṇa antaram 
SA_GSP28_sastrdiu-1918	ataḥ ṣaḍeva pramāṇāni /	atas ṣaḍ eva pramāṇāni 
SA_GSP28_sastrdiu-1919	tathā ca bhagavadrāmāyaṇe rāma ṣaḍyuktayo loke yābhiḥ sarvo 'nudṛśyate iti /	tathā ca bhagavat rāmāyaṇe rāma ṣaḍ yuktayaḥ loke yābhiḥ sarvaḥ nu dṛśyate iti 
SA_GSP28_sastrdiu-1920	ityābhāvavādaḥ //	iti ābhāva vādaḥ 
SA_GSP28_sastrdiu-1921	citrādyaihikaphalacodanāsvākṣepaḥ //	citra ādi aihika phala codanāsu ākṣepaḥ 
SA_GSP28_sastrdiu-1922	lokaprasiddhasvataḥprāmāṇyadarśanena pratyakṣādīnāṃ tadantargatasyāpi ca śāstrasya svataḥprāmāṇyāt codanālakṣaṇor'tho dharmaḥ	loka prasiddha svatas prāmāṇya darśanena pratyakṣa ādīnām tad antargatasya api ca śāstrasya svatas prāmāṇyāt codanā lakṣaṇa ūrthaḥ dharmaḥ 
SA_GSP28_sastrdiu-1923	iti pratijñāter'the sādhite saṃprati animittaṃ vidyamānopalambhanatvāt ityanena citrādicodanānāmaihikaphalānāṃ pratyakṣādibhirasaṃvādena visaṃvādena  #	iti pratijñāta irthe sādhite saṃprati animittam vidyamāna upalambhana tvāt iti anena citra ādi codanānām aihika phalānām pratyakṣa ādibhiḥ asaṃvādena visaṃvādena 
SA_GSP28_sastrdiu-1924	ca prāmāṇyamākṣipyate,	ca prāmāṇyam ākṣipyate 
SA_GSP28_sastrdiu-1925	pūrvoktastu nanvatathābhūtaṃ ityākṣepaḥ paralokaphalasvargakāmādicodanāviṣaya iti viṣayabhedādapaunaruktyam //*//	pūrva uktaḥ tu nanu atathābhūtam iti ākṣepaḥ para loka phala svarga kāma ādi codanā viṣayaḥ iti viṣaya bhedāt apaunaruktyam 
SA_GSP28_sastrdiu-1926	nanu ca nanvatathābhūtamapyarthaṃ brūyāccodaneti codanāmātraparigrahādaviśeṣeṇaivāsāvākṣepaḥ tathehāpi yadā tāvadasau vidyamānāsīt tadā phalaṃ  #	nanu ca nanu atathābhūtam api artham brūyāt codanā iti codanā mātra parigrahāt aviśeṣeṇa eva asau ākṣepaḥ tathā iha api yadā tāvat asau vidyamānā āsīt tadā phalam 
SA_GSP28_sastrdiu-1927	na dattavatī /	na dattavatī 
SA_GSP28_sastrdiu-1928	yadā phalamutpadyate tadāsau nāsti kathamasatī phalaṃ dāsyatītyākṣepasya svargakāmacodanāsvapi tulyatvādaviśeṣatvamiti nāsti viṣayabhedaḥ /	yadā phalam utpadyate tadā asau na asti katham asatī phalam dāsyati iti ākṣepasya svarga kāma codanāsu api tulya tvāt aviśeṣa tvam iti na asti viṣaya bhedaḥ 
SA_GSP28_sastrdiu-1929	ucyate- pūrvākṣepastāvatparalokaphalaviṣaya eva /	ucyate pūrva ākṣepaḥ tāvat paraloka phala viṣayaḥ eva 
SA_GSP28_sastrdiu-1930	tatra hi pramāṇāntarāpekṣaḥ śabdo na svātantryeṇa pramāṇam /	tatra hi pramāṇa antara apekṣaḥ śabdaḥ na svātantryeṇa pramāṇam 
SA_GSP28_sastrdiu-1931	na ca codanārthe pramāṇāntaramasti ato 'pramāṇaṃ codanetyayamākṣepaḥ,	na ca codanā arthe pramāṇa antaram asti pramāṇam codanā iti ayam ākṣepaḥ 
SA_GSP28_sastrdiu-1932	sa cāyaṃ paralokaphalaviṣaya eva bhavati /	sa ca ayam para loka phala viṣayaḥ eva bhavati 
SA_GSP28_sastrdiu-1933	paśukāmacodanāsu hi yadi tāvatkarmānantarameva paśvādīnyupalabhyante tato 'pekṣitamūlapramāṇalābhātsiddhyati codanāyāḥ prāmāṇyam /	paśu kāma codanāsu hi yadi tāvat karma anantaram eva paśu ādīni upalabhyante tatas u pekṣita mūlapramāṇa lābhāt siddhi ati codanāyāḥ prāmāṇyam 
SA_GSP28_sastrdiu-1934	atha nopalabhyate tataḥ pramāṇāntarabādhenaiva sukhaprāmāṇyamabhidhātuṃ śakyata iti kimākṣepasārūpyapratipādanavyasanena /	atha nā upalabhyate tatas pramāṇa antara bādhena eva sukha prāmāṇyam abhidhātum śakyate iti kim ākṣepa sārūpya pratipādana vyasanena 
SA_GSP28_sastrdiu-1935	tasmātsa tāvatparalokaphalaviṣaya eva /	tasmāt sa tāvat para loka phala viṣayaḥ eva 
SA_GSP28_sastrdiu-1936	ayaṃ tvaihikaphalaviṣaya /	ayam tu aihika phala viṣaya 
SA_GSP28_sastrdiu-1937	na hi pāralaukikasya phalasyānantarakālānupalabdhyā nirāsaḥ saṃbhavati /	na hi pāralaukikasya phalasya anantara kāla anupalabdhyā nirāsaḥ saṃbhavati 
SA_GSP28_sastrdiu-1938	na hi tenānantaraṃ bhavitavyam,	na hi tena anantaram bhavitavyam 
SA_GSP28_sastrdiu-1939	janmāntarabhāvitatvāt //*//	janma antara bhāvita tvāt 
SA_GSP28_sastrdiu-1940	nanu asatī kathaṃ phalaṃ dāsyatītīdaṃ tulyam /	nanu asatī katham phalam dāsyati iti idam tulyam 
SA_GSP28_sastrdiu-1941	neti brūmaḥ- apūrvadvāreṇa saṃbhavāt /	na iti brūmaḥ apūrva dvāreṇa saṃbhavāt 
SA_GSP28_sastrdiu-1942	svargo hi svabhāvāddehāntarānubhavanīyatvādanantarāsaṃbhavitvena śāstrārthāvadhāraṇavelāyāmeva kālāntare niścīyata ityapūrvamantarbhāvyaiva  #	svargaḥ hi svabhāvāt deha antara anubhavanīya tvāt anantara asaṃbhavi tvena śāstra artha avadhāraṇa velāyām eva kāla antare niścīyate iti apūrvam antar bhāvyā eva 
SA_GSP28_sastrdiu-1943	tatra śāstrārtho 'vadhāryate,	tatra śāstra arthaḥ vadhāryate 
SA_GSP28_sastrdiu-1944	tacca cirasthāyīti kāraṇasyāvināśātsaṃbhavati kālāntare svargasyotpattiḥ /	tat ca cira sthāyi iti kāraṇasya avināśāt saṃbhavati kāla antare svargasya utpattiḥ 
SA_GSP28_sastrdiu-1945	paścādayastvanantaramapi saṃbhavantīti tatsādhanatvena codyamānānāṃ citrādīnāṃ śāstrārthāvadhāraṇasamaye	paścādayaḥ tu anantaram api saṃbhavanti iti tad sādhana tvena codyamānānām citra ādīnām śāstra artha avadhāraṇa samaye 
SA_GSP28_sastrdiu-1946	'pūrvapraṇāḍīsamāśrayaṇe kāraṇaṃ na kiñcidastīti svarūpeṇaiva phalasādhanatvaṃ śāstrārtho 'vadhāryate /	pūrva praṇāḍī samāśrayaṇe kāraṇam na kiñcid asti iti svarūpeṇa eva phala sādhanatvam śāstra arthaḥ vadhāryate 
SA_GSP28_sastrdiu-1947	tathācānantarameva palena bavitavyam /	tathā ca anantaram eva palena 
SA_GSP28_sastrdiu-1948	kālāntare karmasvarūpasya vinaṣṭatvāt kāraṇatvābhāvāt,	kāla antare karma svarūpasya vinaṣṭa tvāt kāraṇa tva abhāvāt 
SA_GSP28_sastrdiu-1949	anantaraṃ ca phalamanupalabdhyaiva nirastamityaprāmāṇyaṃ citrādicodanānām //	anantaram ca phalam anupalabdhyā eva nirastam iti aprāmāṇyam citra ādi codanānām 
SA_GSP28_sastrdiu-1950	citrādīcodanāsvākṣepaparihārau /	citra ādi codanāsu ākṣepa parihārau 
SA_GSP28_sastrdiu-1951	nacānuṣṭhānānantaraṃ phalānupalabdhyaiva śāstrārthe 'pūrvamantarbhāvayituṃ śakyate śāstrārthāvadhāraṇapūrvakaṃ hyanuṣṭhānaṃ nānuṣṭhānapūrvakaṃ	na ca anuṣṭhāna anantaram phala anupalabdhyā eva śāstra arthe pūrvam antarbhāvayitum śakyate śāstra artha avadhāraṇa pūrvakam hi anuṣṭhānam na anuṣṭhāna pūrvakam 
SA_GSP28_sastrdiu-1952	tasmādaihikānāmatrākṣepa iti yukto viṣayabhedaḥ /	tasmāt aihikānām atra ākṣepaḥ iti yuktaḥ viṣaya bhedaḥ 
SA_GSP28_sastrdiu-1953	viṣayabhedācca nyāyopi bhidyate /	viṣaya bhedāt ca nyāyaḥ api bhidyate 
