segmentnr	original	analyzed
SA_GK19_ragh1-6u-460	mahīdhrapakṣavyaparopaṇoddhataṃ sphuratprabhāmaṇḍalamastramādade // Ragh(K)_3.60 //	mahīdhra pakṣa vyaparopaṇa uddhatam sphurat prabhā maṇḍalam astram ādade 
SA_GK19_ragh1-6u-461	raghurbhṛśaṃ vakṣasi tena tāḍitaḥ papāta bhūmau saha sainikāsrubhiḥ /	raghuḥ bhṛśam vakṣasi tena tāḍitaḥ papāta bhūmau saha sainika asrubhiḥ 
SA_GK19_ragh1-6u-462	nimeṣamātrādavadhūya ca vyathāṃ sahotthitaḥ sainikaharṣaniḥsvanaiḥ // Ragh(K)_3.61 //	nimeṣa mātrāt avadhūya ca vyathām saha utthitaḥ sainika harṣa niḥsvanaiḥ 
SA_GK19_ragh1-6u-463	tathāpi śastravyavahāraniṣṭhure vipakṣabhāve sthiramasya tasthuṣaḥ /	tathā api śastra vyavahāra niṣṭhure vipakṣa bhāve sthiram asya tasthuṣaḥ 
SA_GK19_ragh1-6u-464	tutoṣa vīryātiśayena vṛtrahā padaṃ hi sarvatra guṇairvidhīyate // Ragh(K)_3.62 //	tutoṣa vīrya atiśayena vṛtrahā padam hi sarvatra guṇaiḥ vidhīyate 
SA_GK19_ragh1-6u-465	asaṅgamadriṣvapi sāravattayā na me tvadanyena visoḍhamāyudham /	asaṅgam adriṣu api sāravat tayā na me tvad anyena visoḍham āyudham 
SA_GK19_ragh1-6u-466	avaihi māṃ prītamṛte turaṅgamādvaraṃ vṛṇīṣveti tamāha vṛtrahā // Ragh(K)_3.63 //	avaihi mām prītam ṛte turaṅgamāt varam vṛṇīṣva iti tam āha vṛtrahā 
SA_GK19_ragh1-6u-467	tato niṣaṅgādasamagramuddhṛtaṃ suvarṇapuṅkhadyutirañjitāṅgulim /	tatas niṣaṅgāt asamagram uddhṛtam suvarṇa puṅkha dyuti rañjita aṅgulim 
SA_GK19_ragh1-6u-468	dilīpasūnuḥ pratisaṃharanniṣuṃ priyaṃ vadaḥ pratyavadatsureśvaram // Ragh(K)_3.64 //	dilīpa sūnuḥ pratisaṃharan iṣum priyam vadaḥ pratyavadat sureśvaram 
SA_GK19_ragh1-6u-469	amocyamaśvaṃ yadi manyate prabhustataḥ samāpte vidhineva karmaṇi /	amocyam aśvam yadi manyate prabhuḥ tatas samāpte vidhinā iva karmaṇi 
SA_GK19_ragh1-6u-470	ajasradīkṣātanuradya me guruḥ kratoraśeṣeṇa phalena yujyatām // Ragh(K)_3.65 //	ajasra dīkṣā tanuḥ adya me guruḥ kratoḥ aśeṣeṇa phalena yujyatām 
SA_GK19_ragh1-6u-471	yathā ca vṛttāntamimaṃ sadogatastrilocanaikāṃśatayā durāsadaḥ /	yathā ca vṛttāntam imam sadaḥ gataḥ trilocana eka aṃśa tayā durāsadaḥ 
SA_GK19_ragh1-6u-472	tavaiva sandeśaharādviśāṃpatiḥ śṛṇoti nākeśa tathā vidhīyatām // Ragh(K)_3.66 //	tava eva sandeśa harāt viśām patiḥ śṛṇoti nākeśa tathā vidhīyatām 
SA_GK19_ragh1-6u-473	tatheti kāmaṃ pratiśuśruvānraghoryathāgataṃ mātalisārathiryayau /	tathā iti kāmam pratiśuśruvān raghoḥ yathāgatam mātali sārathiḥ yayau 
SA_GK19_ragh1-6u-474	nṛpasya nātipramanāḥ sadogṛhaṃ sudakṣiṇāsūnurapi nyavartata // Ragh(K)_3.67 //	nṛpasya na ati pramanāḥ sadogṛham sudakṣiṇā sūnuḥ api nyavartata 
SA_GK19_ragh1-6u-475	tamabhyanandatprathamaprabodhitaḥ prajeśvaraḥ śāsanahāriṇā hareḥ /	tam abhyanandat prathama prabodhitaḥ prajeśvaraḥ śāsana hāriṇā hareḥ 
SA_GK19_ragh1-6u-476	parāmṛśanharṣacalena pāṇinā tadīyamaṅgaṃ kuliśavraṇāṅkitam // Ragh(K)_3.68 //	parāmṛśan harṣa calena pāṇinā tadīyam aṅgam kuliśa vraṇa aṅkitam 
SA_GK19_ragh1-6u-477	iti kṣitīśo navatiṃ navādhikāṃ mahākratūnāṃ mahanīyaśāsanaḥ /	iti kṣitīśaḥ navatim nava adhikām mahā kratūnām mahanīya śāsanaḥ 
SA_GK19_ragh1-6u-478	samārurukṣurdivamāyuṣaḥ kṣaye tatāna sopānaparamparāmiva // Ragh(K)_3.69 //	samārurukṣuḥ divam āyuṣaḥ kṣaye tatāna sopāna paramparām iva 
SA_GK19_ragh1-6u-479	atha sa viṣayavyāvṛttātmā yathāvidhi sūnave nṛpatikakudaṃ dattvā yūne sitātapavāraṇam /	atha sa viṣaya vyāvṛtta ātmā yathāvidhi sūnave nṛpati kakudam dattvā yūne sita ātapa vāraṇam 
SA_GK19_ragh1-6u-480	munivanatarucchāyāṃ devyā tayā saha śiśriye galitavayasāmikṣvākūṇāmidaṃ hi kulavratam // Ragh(K)_3.70 //	muni vana taru chāyām devyā tayā saha śiśriye galita vayasām ikṣvākūṇām idam hi kula vratam 
SA_GK19_ragh1-6u-481	// iti raghuvaṃśe mahākāvye tṛtīyaḥ sargaḥ //	iti raghuvaṃśe mahākāvye tṛtīyaḥ sargaḥ 
SA_GK19_ragh1-6u-482	sa rājyaṃ guruṇā dattaṃ pratipadyādhikaṃ babhau /	sa rājyam guruṇā dattam pratipadya adhikam babhau 
SA_GK19_ragh1-6u-483	dinānte nihitaṃ tejaḥ savitreva hutāśanaḥ // Ragh(K)_4.1 //	dina ante nihitam tejaḥ savitrā iva hutāśanaḥ 
SA_GK19_ragh1-6u-484	nyastaśastraṃ dilīpaṃ ca taṃ ca śuśruvuṣāṃ prabhum /	nyasta śastram dilīpam ca tam ca śuśruvuṣām prabhum 
SA_GK19_ragh1-6u-485	rājñāmuddhṛtanārāce hṛdi śūlamivārpitam // Ragh(K)_4.2 //	rājñām uddhṛta nārāce hṛdi śūlam iva arpitam 
SA_GK19_ragh1-6u-486	puruhūtadhvajasyeva tasyonnayanapaṅktayaḥ /	puruhūta dhvajasya iva tasya unnayana paṅktayaḥ 
SA_GK19_ragh1-6u-487	navābhyutthānadarśinyo nananduḥ saprajāḥ prajāḥ // Ragh(K)_4.3 //	nava abhyutthāna darśinyaḥ nananduḥ sa prajāḥ prajāḥ 
SA_GK19_ragh1-6u-488	samameva samākrāntaṃ dvayaṃ dviradagāminā /	samam eva samākrāntam dvayam dvirada gāminā 
SA_GK19_ragh1-6u-489	tena siṃhāsanaṃ pitryamakhilaṃ cārimaṇḍalam // Ragh(K)_4.4 //	tena siṃhāsanam pitryam akhilam cāri maṇḍalam 
SA_GK19_ragh1-6u-490	chāyāmaṇḍalalakṣyeṇa tamadṛśyā kila svayam /	chāyā maṇḍala lakṣyeṇa tam adṛśyā kila svayam 
SA_GK19_ragh1-6u-491	padmā padmātapatreṇa bheje sāmrājyadīkṣitam // Ragh(K)_4.5 //	padmā padma ātapatreṇa bheje sāmrājya dīkṣitam 
SA_GK19_ragh1-6u-492	parikalpitasānnidhyā kāle kāle ca vandiṣu /	parikalpita sānnidhyā kāle kāle ca vandiṣu 
SA_GK19_ragh1-6u-493	stutyaṃ stutibhirarthyābhirupatasthe sarasvatī // Ragh(K)_4.6 //	stutyam stutibhiḥ arthyābhiḥ upatasthe sarasvatī 
SA_GK19_ragh1-6u-494	manuprabhṛtibhirmānyairbhuktā yadyapi rājabhiḥ /	manu prabhṛtibhiḥ mānyaiḥ bhuktāḥ yadi api rājabhiḥ 
SA_GK19_ragh1-6u-495	tathāpyananyapūrveva tasminnāsīdvasundharā // Ragh(K)_4.7 //	tathā api ananya pūrvā iva tasmin āsīt vasundharā 
SA_GK19_ragh1-6u-496	sa hi sarvasya lokasya yuktadaṇḍatayā manaḥ /	sa hi sarvasya lokasya yukta daṇḍa tayā manaḥ 
SA_GK19_ragh1-6u-497	ādade nātiśītoṣṇo nabhasvāniva dakṣiṇaḥ // Ragh(K)_4.8 //	ādade na ati śīta uṣṇaḥ nabhasvān iva dakṣiṇaḥ 
SA_GK19_ragh1-6u-498	kāmaṃ kamalapattrāṇāṃ netre tasyānukāriṇī /	kāmam kamala pattrāṇām netre tasya anukāriṇī 
SA_GK19_ragh1-6u-499	cakṣuṣmattā tu śāstreṇa sūkṣmakāryārthadarśinā // Ragh(K)_4.9 //	cakṣuṣmat tā tu śāstreṇa sūkṣma kārya artha darśinā 
SA_GK19_ragh1-6u-500	yathā prahlādanāccandraḥ pratāpāttapano yathā /	yathā prahlādanāt candraḥ pratāpāt tapanaḥ yathā 
SA_GK19_ragh1-6u-501	tathaiva so 'bhūdanvartho rājā prakṛtirañjanāt // Ragh(K)_4.10 //	tathā eva saḥ bhūt anvarthaḥ rājā prakṛti rañjanāt 
SA_GK19_ragh1-6u-502	nayavidbhirnave rājñi sadasaccopadarśitam /	naya vidbhiḥ nave rājñi sat asat ca upadarśitam 
SA_GK19_ragh1-6u-503	pūrva evābhavatpakṣastasminnābhavaduttaraḥ // Ragh(K)_4.11 //	pūrvaḥ eva abhavat pakṣaḥ tasmin na abhavat uttaraḥ 
SA_GK19_ragh1-6u-504	mandotkaṇṭhāḥ kṛtāstena guṇādhikatayā gurau /	manda utkaṇṭhāḥ kṛtāḥ tena guṇa adhika tayā gurau 
SA_GK19_ragh1-6u-505	phalena sahakārasya puṣpodgama iva prajāḥ // Ragh(K)_4.12 //	phalena sahakārasya puṣpa udgamaḥ iva prajāḥ 
SA_GK19_ragh1-6u-506	pañcānāmapi bhūtānāmutkarṣaṃ pupuṣurguṇāḥ /	pañcānām api bhūtānām utkarṣam pupuṣuḥ guṇāḥ 
SA_GK19_ragh1-6u-507	nave tasminmahīpāle sarvaṃ navamivābhavat // Ragh(K)_4.13 //	nave tasmin mahīpāle sarvam navam iva abhavat 
SA_GK19_ragh1-6u-508	labdhapraśamanasvasthamathainaṃ samupasthitā /	labdha praśamana svastham atha enam samupasthitā 
SA_GK19_ragh1-6u-509	pārthivaśrīrdvitīyeva śaratpaṅkajalakṣaṇā // Ragh(K)_4.14//	pārthiva śrīḥ dvitīyā iva śarad paṅkaja lakṣaṇā 
SA_GK19_ragh1-6u-510	nirvṛṣṭalaghubhirmeghaiḥ savitustasya cobhayoḥ /	nirvṛṣṭa laghubhiḥ meghaiḥ savituḥ tasya ca ubhayoḥ 
SA_GK19_ragh1-6u-511	vardhiṣṇavo diśāṃ bhāgāḥ pratāpāyeva recitāḥ // Ragh(K)_4.15 //	vardhiṣṇavaḥ diśām bhāgāḥ pratāpāya iva recitāḥ 
SA_GK19_ragh1-6u-512	adhijyamāyudhaṃ kartuṃ samayo 'yaṃ raghoriti /	adhijyam āyudham kartum samayaḥ yam raghoḥ iti 
SA_GK19_ragh1-6u-513	svaṃ dhanuḥ śaṅkiteneva saṃjahre śatamanyunā // Ragh(K)_4.16 //	svam dhanuḥ śaṅkitena iva saṃjahre śatamanyunā 
SA_GK19_ragh1-6u-514	puṇḍarīkātapatrastaṃ vikasatkāśacāmaraḥ /	puṇḍarīka ātapatraḥ tam vikasat kāśa cāmaraḥ 
SA_GK19_ragh1-6u-515	ṛturviḍambayāmāsa na punaḥ prāpa tacchriyam // Ragh(K)_4.17 //	ṛtuḥ viḍambayāmāsa na punar prāpa tad śriyam 
SA_GK19_ragh1-6u-516	prasādasumukhe tasmiṃścandre ca viṣadaprabhe /	prasāda su mukhe tasmin candre ca viṣada prabhe 
SA_GK19_ragh1-6u-517	tadā cakṣuṣmatāṃ prītirāsītsamarasā dvayoḥ // Ragh(K)_4.18 //	tadā cakṣuṣmatām prītiḥ āsīt samarasā dvayoḥ 
SA_GK19_ragh1-6u-518	haṃsaśreṇiṣu tārāsu kumudvatsu ca vāriṣu /	haṃsa śreṇiṣu tārāsu kumudvatsu ca vāriṣu 
SA_GK19_ragh1-6u-519	vibhūtayastadīyānāṃ paryastā yaśasāmiva // Ragh(K)_4.19 //	vibhūtayaḥ tadīyānām paryastāḥ yaśasām iva 
SA_GK19_ragh1-6u-520	ikṣucchāyāniṣādinyastasya gopturguṇodayam /	ikṣu chāyā niṣādi nyaḥ tasya goptuḥ guṇa udayam 
SA_GK19_ragh1-6u-521	ākumārakathodghātaṃ śāligopyo jaguryaśaḥ // Ragh(K)_4.20 //	ā kumāra kathā udghātam śāli gopyaḥ jaguḥ yaśaḥ 
SA_GK19_ragh1-6u-522	prasasādodayādambhaḥ kumbhayonermahaujasaḥ /	prasasāda udayāt ambhaḥ kumbhayoneḥ mahā ojasaḥ 
SA_GK19_ragh1-6u-523	raghostvabhibhavāśaṅki cukṣubhe dviṣatāṃ manaḥ // Ragh(K)_4.21 //	raghoḥ tu abhibhava āśaṅki cukṣubhe dviṣatām manaḥ 
SA_GK19_ragh1-6u-524	madodagrāḥ kakudmantaḥ saritāṃ kūlamudrujāḥ /	mada udagrāḥ kakudmantaḥ saritām kūlam udru jāḥ 
SA_GK19_ragh1-6u-525	līlākhelamanuprāpurmahokṣāstasya vikramam // Ragh(K)_4.22 //	līlā khelam anuprāpuḥ mahā ukṣāḥ tasya vikramam 
SA_GK19_ragh1-6u-526	prasavaiḥ saptaparṇānāṃ madagandhibhirāhatāḥ /	prasavaiḥ sapta parṇānām mada gandhibhiḥ āhatāḥ 
SA_GK19_ragh1-6u-527	asūyayeva tannāgāḥ saptadhaiva prasusruvuḥ // Ragh(K)_4.23 //	asūyayā iva tat nāgāḥ saptadhā eva prasusruvuḥ 
SA_GK19_ragh1-6u-528	saritaḥ kurvatī gādhāḥ pathaścāśyānakardamān /	saritaḥ kurvatī gādhāḥ pathaḥ ca āśyāna kardamān 
SA_GK19_ragh1-6u-529	yātrāyai codayāmāsa taṃ śakteḥ prathamaṃ śarat // Ragh(K)_4.24 //	yātrāyai codayāmāsa tam śakteḥ prathamam śarad 
SA_GK19_ragh1-6u-530	tasmai samyagghuto vahnirvājinīrājanāvidhau /	tasmai samyak hutaḥ vahniḥ vājinī rājanā vidhau 
SA_GK19_ragh1-6u-531	pradakṣiṇārcirvyājena hasteneva jayaṃ dadau // Ragh(K)_4.25 //	pradakṣiṇa arciḥ vyājena hastena iva jayam dadau 
SA_GK19_ragh1-6u-532	sa guptamūlapratyantaḥ śuddhapārṣṇirayānvitaḥ /	sa gupta mūla pratyantaḥ śuddha pārṣṇi raya anvitaḥ 
SA_GK19_ragh1-6u-533	ṣaḍvidhaṃ balamādāya pratasthe digjigīṣayā // Ragh(K)_4.26 //	ṣaḍvidham balam ādāya pratasthe diś jigīṣayā 
SA_GK19_ragh1-6u-534	avākiranvayovṛddhāstaṃ lājaiḥ paurayoṣitaḥ /	avākiran vayaḥ vṛddhāḥ tam lājaiḥ paura yoṣitaḥ 
SA_GK19_ragh1-6u-535	pṛṣatairmandaroddhūtaiḥ kṣīrormaya ivācyutam // Ragh(K)_4.27 //	pṛṣataiḥ mandara uddhūtaiḥ kṣīra ūrmayaḥ iva acyutam 
SA_GK19_ragh1-6u-536	sa yayau prathamaṃ prācīṃ tulyaḥ prācīnabarhiṣā /	sa yayau prathamam prācīm tulyaḥ prācīnabarhiṣā 
SA_GK19_ragh1-6u-537	ahitānaniloddhūtaistarjayanniva ketubhiḥ // Ragh(K)_4.28 //	ahitān anila uddhūtaiḥ tarjayan iva ketubhiḥ 
SA_GK19_ragh1-6u-538	rajobhiḥ syandanoddhūtairgajaiśca ghanasannibhaiḥ /	rajobhiḥ syandana uddhūtaiḥ gajaiḥ ca ghana sannibhaiḥ 
SA_GK19_ragh1-6u-539	bhuvastalamiva vyoma kurvanvyomeva bhūtalam // Ragh(K)_4.29 //	bhuvaḥ talam iva vyoma kurvan vyoma iva bhū talam 
SA_GK19_ragh1-6u-540	pratāpo 'gre tataḥ śabdaḥ purogāstadanantaram /	pratāpaḥ gre tatas śabdaḥ purogāḥ tad anantaram 
SA_GK19_ragh1-6u-541	yayau paścādgajānīkaṃ catuḥskandheva sā camūḥ // Ragh(K)_4.30 //	yayau paścāt gaja anīkam catur skandhā iva sā camūḥ 
SA_GK19_ragh1-6u-542	purogaiḥ kaluṣāstasya sahaprasthāyibhiḥ kṛśāḥ /	purogaiḥ kaluṣāḥ tasya saha prasthāyibhiḥ kṛśāḥ 
SA_GK19_ragh1-6u-543	paścātprayāyibhiḥ paṅkaṃ cakrire mārganimnagāḥ // Ragh(K)_4.31 //	paścāt prayāyibhiḥ paṅkam cakrire mārga nimnagāḥ 
SA_GK19_ragh1-6u-544	marupṛṣṭhānyudambhāṃsi nāvyāḥ supratarā nadīḥ /	maru pṛṣṭhāni udambhāṃsi nāvyāḥ su pratarāḥ nadīḥ 
SA_GK19_ragh1-6u-545	vipināni prakāśāni śaktimattvāccakāra saḥ // Ragh(K)_4.32 //	vipināni prakāśāni śaktimat tvāt cakāra saḥ 
SA_GK19_ragh1-6u-546	sa senāṃ mahatīṃ karṣanpūrvasāgaragāminīm /	sa senām mahatīm karṣan pūrva sāgara gāminīm 
SA_GK19_ragh1-6u-547	babhau harajaṭābhraṣṭāṃ gaṅgāmiva bhagīrathaḥ // Ragh(K)_4.33 //	babhau hara jaṭā bhraṣṭām gaṅgām iva bhagīrathaḥ 
SA_GK19_ragh1-6u-548	tyājitaiḥ phalamutkhātairbhagnaiśca bahudhā nṛpaiḥ /	tyājitaiḥ phalam utkhātaiḥ bhagnaiḥ ca bahudhā nṛpaiḥ 
SA_GK19_ragh1-6u-549	tasyāsīdulbaṇo mārgaḥ pādapairiva dantinaḥ // Ragh(K)_4.34 //	tasya āsīt ulbaṇaḥ mārgaḥ pādapaiḥ iva dantinaḥ 
SA_GK19_ragh1-6u-550	paurastyānevamākrāmaṃstāṃstāñjanapadāñjitī /	paurastyān evam ākrāman tān tān janapadān jitī 
SA_GK19_ragh1-6u-551	prāpa tālīvanaśyāmamupakaṇṭhaṃ mahodadheḥ // Ragh(K)_4.35 //	prāpa tālī vana śyāmam upakaṇṭham mahā udadheḥ 
SA_GK19_ragh1-6u-552	anamrāṇāṃ samuddhartustasmātsindhurayādiva /	anamrāṇām samuddhartuḥ tasmāt sindhuḥ ayāt iva 
SA_GK19_ragh1-6u-553	ātmā saṃrakṣitaḥ suhmairvṛttimāśritya vaitasīm // Ragh(K)_4.36 //	ātmā saṃrakṣitaḥ suhmaiḥ vṛttim āśritya vaitasīm 
SA_GK19_ragh1-6u-554	vaṅgānutkhāya tarasā netā nausādhanoddhatān /	vaṅgān utkhāya tarasā netā nau sādhana uddhatān 
SA_GK19_ragh1-6u-555	nicakhāna jayastambhāngaṅgāsrotontareṣu saḥ // Ragh(K)_4.37 //	nicakhāna jaya stambhān gaṅgā srotaḥ ntareṣu saḥ 
SA_GK19_ragh1-6u-556	āpādapadmapraṇatāḥ kalamā iva te raghum /	ā pāda padma praṇatāḥ kalamāḥ iva te raghum 
SA_GK19_ragh1-6u-557	phalaiḥ saṃvardhayāmāsurutkhātapratiropitāḥ // Ragh(K)_4.38 //	phalaiḥ saṃvardhayāmāsuḥ utkhāta pratiropitāḥ 
SA_GK19_ragh1-6u-558	sa tīrtvā kayimāṃ sainyairbaddhadviradasetubhiḥ /	sa tīrtvā kayimām sainyaiḥ baddha dvirada setubhiḥ 
SA_GK19_ragh1-6u-559	utkalādeśitapathaḥ kaliṅgābhimukho yayau // Ragh(K)_4.39 //	utkalā deśita pathaḥ kaliṅga abhimukhaḥ yayau 
SA_GK19_ragh1-6u-560	sa pratāpaṃ mahendrasya mūrdhni tīkṣṇaṃ nyaveśayat /	sa pratāpam mahā indrasya mūrdhni tīkṣṇam nyaveśayat 
SA_GK19_ragh1-6u-561	aṅkuśaṃ dviradasyeva yantā gambhīravedinaḥ // Ragh(K)_4.40 //	aṅkuśam dviradasya iva yantā gambhīra vedinaḥ 
SA_GK19_ragh1-6u-562	pratijagrāha kāliṅgastamastrairgajasādhanaḥ /	pratijagrāha kāliṅgaḥ tam astraiḥ gaja sādhanaḥ 
SA_GK19_ragh1-6u-563	pakṣacchedodyataṃ śakraṃ śilāvarṣīva parvataḥ // Ragh(K)_4.41 //	pakṣa cheda udyatam śakram śilā varṣī iva parvataḥ 
SA_GK19_ragh1-6u-564	dviṣāṃ viṣahya kākutsthastatra nārācadurdinam /	dviṣām viṣahya kākutsthaḥ tatra nārāca durdinam 
SA_GK19_ragh1-6u-565	sanmaṅgalasnāta iva pratipede jayaśriyam // Ragh(K)_4.42 //	sat maṅgala snātaḥ iva pratipede jaya śriyam 
SA_GK19_ragh1-6u-566	vāyavyāstravinirdhūtātpakṣāviddhādivodadheḥ /	vāyavya astra vinirdhūtāt pakṣa āviddhāt iva udadheḥ 
SA_GK19_ragh1-6u-567	gajānīkātsa kāliṅgaṃ tārkṣyaḥ sarpamivādade // Ragh(K)_4.43 //	gaja anīkāt sa kāliṅgam tārkṣyaḥ sarpam iva ādade 
SA_GK19_ragh1-6u-568	tāmbūlīnāṃ dalaistasya racitāpānabhūmayaḥ /	tāmbūlīnām dalaiḥ tasya racita āpānabhūmayaḥ 
SA_GK19_ragh1-6u-569	nārikelāsavaṃ yodhāḥ śātravaṃ ca yaśaḥ papuḥ // Ragh(K)_4.44 //	nārikela āsavam yodhāḥ śātravam ca yaśaḥ papuḥ 
SA_GK19_ragh1-6u-570	gṛhītapratimuktasya sa dharmavijayī nṛpaḥ /	gṛhīta pratimuktasya sa dharma vijayī nṛpaḥ 
SA_GK19_ragh1-6u-571	hriyaṃ mahendranāthasya jahāra na tu medinīm // Ragh(K)_4.45 //	hriyam mahā indra nāthasya jahāra na tu medinīm 
SA_GK19_ragh1-6u-572	tato velātaṭenaiva phalavatpūgamālinā /	tatas velā taṭena eva phalavat pūga mālinā 
SA_GK19_ragh1-6u-573	agastyacaritāmāśāmanāśāsyajayo yayau // Ragh(K)_4.46 //	agastya caritām āśām anāśāsya jayaḥ yayau 
SA_GK19_ragh1-6u-574	sa sainyaparibhogena gajadānasugandhinā /	sa sainya paribhogena gaja dāna sugandhinā 
SA_GK19_ragh1-6u-575	kāverīṃ saritāṃ patyuḥ śaṅkanīyāmivākarot // Ragh(K)_4.47 //	kāverīm saritām patyuḥ śaṅkanīyām iva akarot 
SA_GK19_ragh1-6u-576	bhayotsṛṣṭavibhūṣāṇāṃ tena keralayoṣitām /	bhaya utsṛṣṭa vibhūṣāṇām tena kerala yoṣitām 
SA_GK19_ragh1-6u-577	alakeṣu camūreṇuścūrṇapratinidhīkṛtaḥ // Ragh(K)_4.48 //	alakeṣu camū reṇuḥ cūrṇa pratinidhīkṛtaḥ 
SA_GK19_ragh1-6u-578	balairadhyuṣitāstasya vijigīṣorgatādhvanaḥ /	balaiḥ adhyuṣitāḥ tasya vijigīṣoḥ gata adhvanaḥ 
SA_GK19_ragh1-6u-579	hārītocchiṣṭamaricā malayādrerupatyakāḥ // Ragh(K)_4.49 //	hārīta ucchiṣṭa maricāḥ malaya adreḥ upatyakāḥ 
SA_GK19_ragh1-6u-580	ājāneyakhurakṣuṇṇapakvailākṣetrasambhavam /	ājāneya khura kṣuṇṇa pakva elā kṣetra sambhavam 
SA_GK19_ragh1-6u-581	vyānaśe sapadi vyoma kīṭakośābilaṃ rajaḥ // Ragh(K)_4.50 //	vyānaśe sapadi vyoma kīṭa kośā bilam rajaḥ 
SA_GK19_ragh1-6u-582	bhogiveṣṭanamārgeṣu candanānāṃ samarpitam /	bhogi veṣṭana mārgeṣu candanānām samarpitam 
SA_GK19_ragh1-6u-583	nāsraṃsatkariṇāṃ graivaṃ tripadīchedināmapi // Ragh(K)_4.51 //	na asraṃsat kariṇām graivam tripadī chedinām api 
SA_GK19_ragh1-6u-584	diśi mandāyate tejo dakṣiṇasyāṃ raverapi /	diśi mandāyate tejaḥ dakṣiṇasyām raveḥ api 
SA_GK19_ragh1-6u-585	tasyāmeva raghoḥ pāṇḍyāḥ pratāpaṃ na viṣehire // Ragh(K)_4.52 //	tasyām eva raghoḥ pāṇḍyāḥ pratāpam na viṣehire 
SA_GK19_ragh1-6u-586	tāmraparṇīsametasya muktāsāraṃ mahodadheḥ /	tāmraparṇī sametasya muktā sāram mahā udadheḥ 
SA_GK19_ragh1-6u-587	te nipatya dadustasmai yaśaḥ svamiva sañcitam // Ragh(K)_4.53 //	te nipatya daduḥ tasmai yaśaḥ svam iva sañcitam 
SA_GK19_ragh1-6u-588	sa nirviśya yathākāmaṃ taṭasvādhīnacandanau /	sa nirviśya yathākāmam taṭa svādhīna candanau 
SA_GK19_ragh1-6u-589	stanāviva diśastasyāḥ śailau malayadurdurau // Ragh(K)_4.54 //	stanau iva diśaḥ tasyāḥ śailau malaya durdurau 
SA_GK19_ragh1-6u-590	asahyavikramaḥ sahyaṃ dūramuktamudanvatā /	asahya vikramaḥ sahyam dūram uktam udanvatā 
SA_GK19_ragh1-6u-591	nitambamiva medinyāḥ srastāṃśukamalaṅghayat // Ragh(K)_4.55 //	nitambam iva medinyāḥ srasta aṃśukam alaṅghayat 
SA_GK19_ragh1-6u-592	tasyānīkairvisarpadbhiraparāntajayodyataiḥ /	tasya anīkaiḥ visarpadbhiḥ aparānta jaya udyataiḥ 
SA_GK19_ragh1-6u-593	rāmeṣūtsārito 'pyāsītsahyalagna ivārṇavaḥ // Ragh(K)_4.56 //	rāmeṣu utsāritaḥ pi āsīt sahya lagnaḥ iva arṇavaḥ 
SA_GK19_ragh1-6u-594	puro yanmārutoddhūtamagamatkaitakaṃ rajaḥ /	puras yat māruta uddhūtam agamat kaitakam rajaḥ 
SA_GK19_ragh1-6u-595	tadyodhavāravāṇānāmayatnapaṭavāsatām // Ragh(K)_4.57 //	tad yodha vāra vāṇānām ayatna paṭa vāsatām 
SA_GK19_ragh1-6u-596	abhyabhūyata vāhānāṃ rathānāṃ cāsya śiñjitaiḥ /	abhyabhūyata vāhānām rathānām ca asya śiñjitaiḥ 
SA_GK19_ragh1-6u-597	marmaraḥ pavanoddhūtarājatālīvanadhvaniḥ // Ragh(K)_4.58 //	marmaraḥ pavana uddhūta rājatālī vana dhvaniḥ 
SA_GK19_ragh1-6u-598	kharjūrīskandhanaddhānāṃ madodgārasugandhiṣu /	kharjūrī skandha naddhānām mada udgāra sugandhiṣu 
SA_GK19_ragh1-6u-599	kaṭeṣu kariṇāṃ petuḥ punnāgebhyaḥ śilīmukhāḥ // Ragh(K)_4.59 //	kaṭeṣu kariṇām petuḥ punnāgebhyaḥ śilīmukhāḥ 
SA_GK19_ragh1-6u-600	avakāśaṃ kilodanvānrāmāyābhyarthito dadau /	avakāśam kila udanvān rāmāya abhyarthitaḥ dadau 
SA_GK19_ragh1-6u-601	aparāntamahīpālavyājena raghave karam // Ragh(K)_4.60 //	aparānta mahīpāla vyājena raghave karam 
SA_GK19_ragh1-6u-602	mahebharadanotkīrṇavyaktavikramalakṣaṇam /	mahā ibha radana utkīrṇa vyakta vikrama lakṣaṇam 
SA_GK19_ragh1-6u-603	trikūṭameva tatroccairjayastambhaṃ cakāra saḥ // Ragh(K)_4.61 //	trikūṭam eva tatra uccais jaya stambham cakāra saḥ 
SA_GK19_ragh1-6u-604	pārasīkāṃstato jetuṃ pratasthe sthalavartmanā /	pārasīkān tatas jetum pratasthe sthala vartmanā 
SA_GK19_ragh1-6u-605	indriyākhyāniva ripūṃstattvajñānena saṃyamī // Ragh(K)_4.62 //	indriya ākhyān iva ripūn tattva jñānena saṃyamī 
SA_GK19_ragh1-6u-606	yavanīmukhapadmānāṃ sehe madhumadaṃ na saḥ /	yavanī mukha padmānām sehe madhu madam na saḥ 
SA_GK19_ragh1-6u-607	bālātapamivābjānāmakālajaladodayaḥ // Ragh(K)_4.63 //	bāla ātapam iva abjānām akāla jalada udayaḥ 
SA_GK19_ragh1-6u-608	saṅgrāmastumulastasya pārasīkāśvasādhanaiḥ /	saṅgrāmaḥ tumulaḥ tasya pārasīka aśva sādhanaiḥ 
SA_GK19_ragh1-6u-609	śārṅgakūjitavijñeyapratiyodho rajasyabhūt // Ragh(K)_4.64 //	śārṅga kūjita vijñeya pratiyodhaḥ rajasi abhūt 
SA_GK19_ragh1-6u-610	bhallāpavarjitaisteṣāṃ śirobhiḥ śmaśrulairmahīm /	bhallāpa varjitaiḥ teṣām śirobhiḥ śmaśrulaiḥ mahīm 
SA_GK19_ragh1-6u-611	tastāra saraghāvyāptaiḥ sa kṣaudrapaṭalairiva // Ragh(K)_4.65 //	tastāra saraghā vyāptaiḥ sa kṣaudra paṭalaiḥ iva 
SA_GK19_ragh1-6u-612	apanītaśirastrāṇāḥ śeṣāstaṃ śaraṇaṃ yayuḥ /	apanīta śirastrāṇāḥ śeṣāḥ tam śaraṇam yayuḥ 
SA_GK19_ragh1-6u-613	praṇipātapratīkāraḥ saṃrambho hi mahātmanām // Ragh(K)_4.66 //	praṇipāta pratīkāraḥ saṃrambhaḥ hi mahātmanām 
SA_GK19_ragh1-6u-614	vinayante sma tadyodhā madhubhirvijayaśramam /	vinayante sma tad yodhāḥ madhubhiḥ vijaya śramam 
SA_GK19_ragh1-6u-615	āstīrṇājinaratnāsu drākṣāvalayabhūmiṣu // Ragh(K)_4.67 //	āstīrṇa ajina ratnāsu drākṣā valaya bhūmiṣu 
SA_GK19_ragh1-6u-616	tataḥ pratasthe kauberīṃ bhāsvāniva raghurdiśam /	tatas pratasthe kauberīm bhāsvān iva raghuḥ diśam 
SA_GK19_ragh1-6u-617	śarairusrairivodīcyānuddhariṣyanrasāniva // Ragh(K)_4.68 //	śaraiḥ usraiḥ iva udīcyān uddhariṣyan rasān iva 
SA_GK19_ragh1-6u-618	jitānajayyastāneva kṛtvā rathapuraḥsarān /	jitān ajayyaḥ tān eva kṛtvā ratha puraḥsarān 
SA_GK19_ragh1-6u-619	mahārṇavamivaurvāgniḥ praviveśottarāpatham // Ragh(K)_4.69 //	mahā arṇavam iva aurva agniḥ praviveśa uttarāpatham 
SA_GK19_ragh1-6u-620	vinītādhvaśramāstasya vaṅkṣutīraviveṣṭanaiḥ /	vinīta adhva śramāḥ tasya vaṅkṣu tīra viveṣṭanaiḥ 
SA_GK19_ragh1-6u-621	dudhuvurvājinaḥ skandhāṃllagnakuṅkumakesarān // Ragh(K)_4.70 //	dudhuvuḥ vājinaḥ skandhān lagna kuṅkuma kesarān 
SA_GK19_ragh1-6u-622	tatra hūnāvarodhānāṃ bhartṛṣu vyaktavikramam /	tatra hūna avarodhānām bhartṛṣu vyakta vikramam 
SA_GK19_ragh1-6u-623	kapolapāṭanādeśi babhūva raghuceṣṭitam // Ragh(K)_4.71 //	kapola pāṭana ādeśi babhūva raghu ceṣṭitam 
SA_GK19_ragh1-6u-624	kāmbojāḥ samare vīryaṃ tasya soḍhumanīśvarāḥ /	kāmbojāḥ samare vīryam tasya soḍhum anīśvarāḥ 
SA_GK19_ragh1-6u-625	gajālānaparikliṣṭairakṣoṭaiḥ sārdhamānatāḥ // Ragh(K)_4.72 //	gaja ālāna parikliṣṭaiḥ akṣoṭaiḥ sārdham ānatāḥ 
SA_GK19_ragh1-6u-626	teṣāṃ sadaśvabhūyiṣṭhāstuṅgā draviṇarāśayaḥ /	teṣām sat aśva bhūyiṣṭhāḥ tuṅgāḥ draviṇa rāśayaḥ 
SA_GK19_ragh1-6u-627	viviśustaṃ viśāṃ nāthamudanvantamivāpagāḥ // Ragh(K)_4.73 //	viviśuḥ tam viśām nātham udanvantam iva āpagāḥ 
SA_GK19_ragh1-6u-628	tato gaurīguruṃ śailamāruroha sasādhanaḥ /	tatas gaurīgurum śailam āruroha sa sādhanaḥ 
SA_GK19_ragh1-6u-629	vardhayanniva tatkūṭānuddhatairdhātureṇubhiḥ // Ragh(K)_4.74 //	vardhayan iva tad kūṭān uddhataiḥ dhātu reṇubhiḥ 
SA_GK19_ragh1-6u-630	praśaṃsaṃstulyasattvānāṃ sainyaghoṣe 'pyasambhramam /	praśaṃsan tulya sattvānām sainya ghoṣe pi asambhramam 
SA_GK19_ragh1-6u-631	guhāgatānāṃ siṃhānāṃ parivṛttyāvalokitam // Ragh(K)_4.75 //	guhā gatānām siṃhānām parivṛttyā avalokitam 
SA_GK19_ragh1-6u-632	bhūrjeṣu marmarībhūtāḥ kīcakadhvanihetavaḥ /	bhūrjeṣu marmarībhūtāḥ kīcaka dhvani hetavaḥ 
