segmentnr	original	analyzed
SA_GSP31_bhgank_u-574	* tadevaṃ nirvartyopahāraṃ dhyāyannīśaṃ hasitagītanṛtyahuḍukkāranamaskārajapyaiḥ	tat evam nirvartya upahāram dhyāyan īśam hasita gīta nṛtya huḍukkāra namaskāra japyaiḥ 
SA_GSP31_bhgank_u-575	ṣaḍaṅgopahāraṃ bhagavanmahādeva yuṣmadanujñayā nirvartitavān aham avabhṛthasnānaṃ	ṣaḍaṅga upahāram bhagavat mahādeva yuṣmad anujñayā nirvartitavān aham avabhṛthasnānam 
SA_GSP31_bhgank_u-576	ca kariṣyāmītyevaṃ nivedayet // GkT_1.7:47	ca kariṣyāmi iti evam nivedayet 
SA_GSP31_bhgank_u-577	* tato niṣkramyeśaṃ praṇamya praṇāmāntaṃ pradakṣiṇatrayaṃ japann eva śanaiḥ kuryāt // GkT_1.7:48	tatas niṣkramya īśam praṇamya praṇāma antam pradakṣiṇa trayam japan eva śanais kuryāt 
SA_GSP31_bhgank_u-578	* tato'vabhṛthasnānaṃ kṛtvā bhagavaṃllakulīśādīn rāśīkarāntāṃśca tīrthakarānanukrameṇa yathāvadbhaktyā namaskuryāt tadanu pradakṣiṇamekamiti	tatas avabhṛthasnānam kṛtvā bhagavat lakulīśa ādīn rāśīkara antān ca tīrthakarān anukrameṇa yathāvat bhaktyā namaskuryāt tadanu pradakṣiṇam ekam iti 
SA_GSP31_bhgank_u-579	* anyadā tu yāvadicchaṃ pradakṣiṇaṃ japann eva kuryāt pañcamantrajapastu kevalo'pi dharmahetur iti // GkT_1.7:50	anyadā tu yāvadiccham pradakṣiṇam japan eva kuryāt pañca mantra japaḥ tu kevalaḥ api dharma hetuḥ iti 
SA_GSP31_bhgank_u-580	* athāyatanasaṃdhinaṃ deśaṃ divā parigṛhītasthāvarādidoṣavarjitatvena suparīkṣitaṃ saṃdhyāvasāne vastrāntādimṛdupavitreṇa vivecya bhasmanaiva  #	atha āyatana saṃdhinam deśam divā parigṛhīta sthāvara ādi doṣa varjita tvena su parīkṣitam saṃdhyā avasāne vastra anta ādi mṛdu pavitreṇa vivecya bhasmanā eva 
SA_GSP31_bhgank_u-581	śuciṃ kuryāt // GkT_1.7:51	śucim kuryāt 
SA_GSP31_bhgank_u-582	* tadanu tatropaviśya vidhyabhiniviṣṭas tāvat tiṣṭhed yāvad atinidrābhibhūtaḥ śrāntaśca bhavati // GkT_1.7:52	tadanu tatra upaviśya vidhi abhiniviṣṭaḥ tāvat tiṣṭhet yāvat atinidrā abhibhūtaḥ śrāntaḥ ca bhavati 
SA_GSP31_bhgank_u-583	* tataḥ punarutthāya vivecayet // GkT_1.7:53	tatas punar utthāya vivecayet 
SA_GSP31_bhgank_u-584	* tadanu mantraiḥ saṃskṛtya bhasma prabhūtaṃ prastaret // GkT_1.7:54	tadanu mantraiḥ saṃskṛtya bhasma prabhūtam prastaret 
SA_GSP31_bhgank_u-585	* tatastatra pañca mantrānāvartayanneva svapet punarutthāyānenaiva vidhinā svapedyenāśveva śuddhivṛddhī bhavataḥ // GkT_1.7:55	tatas tatra pañca mantrān āvartayan eva svapet punar utthāya anena eva vidhinā svapet yena āśu eva śuddhi vṛddhī bhavataḥ 
SA_GSP31_bhgank_u-586	* suptasyāpi prāṇātyaye cātigatiḥ syādanyathā vidhibhraṣṭasya saṃsārāpattir eveti // GkT_1.7:56	suptasya api prāṇātyaye ca atigatiḥ syāt anyathā vidhi bhraṣṭasya saṃsāra āpattiḥ eva iti 
SA_GSP31_bhgank_u-587	* evaṃ prathamāvasthāyāṃ vidhim anuṣṭhāya yadā khalu prāptajñānaḥ prakṣīṇakaluṣaḥ	evam prathama avasthāyām vidhim anuṣṭhāya yadā khalu prāpta jñānaḥ prakṣīṇa kaluṣaḥ 
SA_GSP31_bhgank_u-588	kṛtābhyanujñaśca bhavati tadāvasthāntaraṃ gatvā raṅgavadavasthiteṣu janeṣu madhye	kṛta abhyanujñaḥ ca bhavati tadā avasthā antaram gatvā raṅga vat avasthiteṣu janeṣu madhye 
SA_GSP31_bhgank_u-589	naṭavadavasthito vivecya vivecya krāthanādīni kuryāt // GkT_1.7:57	naṭa vat avasthitaḥ vivecya vivecya krāthana ādīni kuryāt 
SA_GSP31_bhgank_u-590	* tatrāsuptasyeva suptaliṅgapradarśanaṃ krāthanaṃ vāyvabhibhūtasyeva śarīrāvayavānāṃ kampanaṃ spandanam upahatapādendriyasyeva gamanaṃ mandanam	tatra asuptasya iva supta liṅga pradarśanam krāthanam vāyu abhibhūtasya iva śarīra avayavānām kampanam spandanam upahata pāda indriyasya iva gamanam mandanam 
SA_GSP31_bhgank_u-591	* yauvanasampannāṃ striyamavalokayan kāmukam ivātmānaṃ yair liṅgaiḥ pradarśayati	yauvana sampannām striyam avalokayan kāmukam iva ātmānam yaiḥ liṅgaiḥ pradarśayati 
SA_GSP31_bhgank_u-592	tac chṛṅgāraṇaṃ kāryākāryavivekaśūnyasyeva lokaninditakaraṇam api tatkaraṇaṃ vyāhatāpārthakādiśabdoccāraṇam	tat śṛṅgāraṇam kārya akārya viveka śūnyasya iva loka nindita karaṇam api tat karaṇam vyāhata apārthaka ādi śabda uccāraṇam 
SA_GSP31_bhgank_u-593	api tad bhāṣaṇam iti // GkT_1.7:59	api tat bhāṣaṇam iti 
SA_GSP31_bhgank_u-594	* na caiṣāṃ kramo niyamyate // GkT_1.7:60	na ca eṣām kramaḥ niyamyate 
SA_GSP31_bhgank_u-595	* kiṃtvapamānādiniṣpādakatvaṃ yena paribhavaṃ gacched ityupadeśād davāgnitulyatvenāpamānāder iṣṭatamatvād iti // GkT_1.7:61	kiṃtu apamāna ādi niṣpādaka tvam yena paribhavam gacchet iti upadeśāt dava agni tulya tvena apamāna ādeḥ iṣṭatama tvāt iti 
SA_GSP31_bhgank_u-596	* evaṃ tarhi hiṃsāsteyādikaraṇaduṣṭaśabdoccāraṇaprasaṅgo'pi syād apamānādiniṣpādakatvād iti // GkT_1.7:62	evam tarhi hiṃsā steya ādi karaṇa duṣṭa śabda uccāraṇa prasaṅgaḥ api syāt apamāna ādi niṣpādaka tvāt iti 
SA_GSP31_bhgank_u-597	* nāpi tatkaraṇāpi tadbhāṣaṇo devāśeṣakriyāvyāptāvahiṃsādyavirodhajñāpanārthatvāt krāthanādyārambhasyeti /	na api tad karaṇā api tad bhāṣaṇaḥ deva aśeṣa kriyā vyāptau ahiṃsā ādi avirodha jñāpana artha tvāt krāthana ādi ārambhasya iti 
SA_GSP31_bhgank_u-598	* devanityatve kastarhi upāya ityāha japadhyānam iti // GkT_1.7:63	deva nitya tve kaḥ tarhi upāyaḥ iti āha japa dhyānam iti 
SA_GSP31_bhgank_u-599	* tatra tṛtīyacaturthakasya mantrasyāvartanaṃ japaḥ // GkT_1.7:64	tatra tṛtīya caturthakasya mantrasya āvartanam japaḥ 
SA_GSP31_bhgank_u-600	* sa dvividhaḥ pratyāhāraphalaḥ samādhiphalaśceti // GkT_1.7:65	sa dvividhaḥ pratyāhāra phalaḥ samādhi phalaḥ ca iti 
SA_GSP31_bhgank_u-601	* tatrādyaḥ pratyāhāraphalastanniṣpattau ca kriyamāṇo japaḥ samādhiphala iti // GkT_1.7:66	tatra ādyaḥ pratyāhāra phalaḥ tad niṣpattau ca kriyamāṇaḥ japaḥ samādhi phalaḥ iti 
SA_GSP31_bhgank_u-602	* nanu cānyāsaktatve kriyamāṇo japaḥ saṃvatsaraśatenāpi na pratyāhāraṃ karotyapi tu doṣameva tasya janayatīti // GkT_1.7:67	nanu ca anya āsakta tve kriyamāṇaḥ japaḥ saṃvatsara śatena api na pratyāhāram karoti api tu doṣam eva tasya janayati iti 
SA_GSP31_bhgank_u-603	* satyam evametat // GkT_1.7:68	satyam evam etat 
SA_GSP31_bhgank_u-604	* kiṃtu pratyāhāradvaividhyamiheṣṭaṃ parāparabhedāt // GkT_1.7:69	kiṃtu pratyāhāra dvaividhyam iha iṣṭam para apara bhedāt 
SA_GSP31_bhgank_u-605	* tatrāntaḥkaraṇapūrvako 'paraḥ // GkT_1.7:70	tatra antaḥkaraṇa pūrvakaḥ paraḥ 
SA_GSP31_bhgank_u-606	* tatsahitena japena nirmalīkṛtaṃ cittaṃ prayatnanirapekṣamapi brahmaṇyevālātacakravad avatiṣṭhate yadā tadāsau paraḥ pratyāhāro japapūrvaka  #	tad sahitena japena nirmalīkṛtam cittam prayatna nirapekṣam api brahmaṇi eva alāta cakra vat avatiṣṭhate yadā tadā asau paraḥ pratyāhāraḥ japa pūrvaka 
SA_GSP31_bhgank_u-607	evāyam ityuktaḥ // GkT_1.7:71	eva ayam iti uktaḥ 
SA_GSP31_bhgank_u-608	* sa hy anekajanmopārjitaṃ karma lakṣaṇamātreṇa dagdhvā dhyeyatattve cittaṃ stambhanikṣiptāyaḥkīlakavan niścalīkaroti // GkT_1.7:72	sa hi aneka janma upārjitam karma lakṣaṇa mātreṇa dagdhvā dhyeya tattve cittam stambha nikṣipta ayaḥ kīlaka vat niścalīkaroti 
SA_GSP31_bhgank_u-609	* rudratattve sadṛśaścintāpravāho dhyānam // GkT_1.7:73	rudra tattve sadṛśaḥ cintā pravāhaḥ dhyānam 
SA_GSP31_bhgank_u-610	* tad dvividhaṃ japapūrvakaṃ dhāraṇāpūrvakaṃ ca // GkT_1.7:74	tat dvividham japa pūrvakam dhāraṇā pūrvakam ca 
SA_GSP31_bhgank_u-611	* tatra japapūrvakaṃ prasaṅgenaiva pūrvam uktaṃ dhāraṇāpūrvakaṃ tūcyate // GkT_1.7:75	tatra japa pūrvakam prasaṅgena eva pūrvam uktam dhāraṇā pūrvakam tu ucyate 
SA_GSP31_bhgank_u-612	* nirālambanaṃ cittamamūḍhasya dhāraṇam // GkT_1.7:76	nirālambanam cittam amūḍhasya dhāraṇam 
SA_GSP31_bhgank_u-613	* saṃhṛtamūrchādyavasthasyāpi cittaṃ vṛttālābhānnirālambanam astīti tannivṛttyartham amūḍhasyetyuktam // GkT_1.7:77	saṃhṛta mūrchā ādi avasthasya api cittam vṛtta alābhāt nirālambanam asti iti tad nivṛtti artham amūḍhasya iti uktam 
SA_GSP31_bhgank_u-614	* yo vidyānugṛhītayā buddhyā svaṃ cittaṃ nirālambanaṃ karoti so 'mūḍha ityucyate // GkT_1.7:78	yaḥ vidyā anugṛhītayā buddhyā svam cittam nirālambanam karoti saḥ mūḍhaḥ iti ucyate 
SA_GSP31_bhgank_u-615	* tayā dhāraṇayā nirmalīkṛtaṃ cittaṃ rudratattve sthāpitaṃ sudīrghakālaṃ na cyavata	tayā dhāraṇayā nirmalīkṛtam cittam rudra tattve sthāpitam su dīrgha kālam na cyavata 
SA_GSP31_bhgank_u-616	ityanenaiva viśeṣeṇa pūrvadhyānāpekṣayedaṃ dhāraṇāsahitaṃ dhyānaṃ paramityuktaṃ śrīmadbhāṣyakṛtā	iti anena eva viśeṣeṇa pūrva dhyāna apekṣayā idam dhāraṇā sahitam dhyānam param iti uktam śrīmat bhāṣyakṛtā 
SA_GSP31_bhgank_u-617	paramayoginā // GkT_1.7:79	parama yoginā 
SA_GSP31_bhgank_u-618	* yadyapyeva dīkṣāprabhṛti cittaṃ nirmalīkartuṃ na śakyate tathāpi dhānuṣkacitrakarādivad	yadi api eva dīkṣā prabhṛti cittam nirmalīkartum na śakyate tathā api dhānuṣka citrakara ādi vat 
SA_GSP31_bhgank_u-619	abhyāsārthaṃ sarvāvasthāsu yathāśaktyā dhyānaṃ kartavyaṃ mṛtyukālasyāniścitatvāt // GkT_1.7:80	abhyāsa artham sarva avasthāsu yathāśaktyā dhyānam kartavyam mṛtyu kālasya aniścita tvāt 
SA_GSP31_bhgank_u-620	* anyathā hi yuddhakāla eva aśvadamananyāyaḥ syāditi // GkT_1.7:81	anyathā hi yuddha kāle eva aśva damana nyāyaḥ syāt iti 
SA_GSP31_bhgank_u-621	* itthaṃ samyagvidhiṃ jñātvā yastu dhyāyati śaṃkaram /	ittham samyak vidhim jñātvā yaḥ tu dhyāyati śaṃkaram 
SA_GSP31_bhgank_u-622	* niśādāv ardharātre ca niśānte cācyutavrataḥ // GkT_1.7:82	niśā ādau ardharātre ca niśā ante ca acyuta vrataḥ 
SA_GSP31_bhgank_u-623	* yāmaṃ yāmaṃ tadarghaṃ yāvacchaktyā divāpi ca /	yāmam yāmam tad argham yāvat śaktyā divā api ca 
SA_GSP31_bhgank_u-624	* saṃtyajyāsaktim anyatra paśyanduḥkhamayaṃ bhavam // GkT_1.7:83	saṃtyajya āsaktim anyatra paśyan duḥkha mayam bhavam 
SA_GSP31_bhgank_u-625	* paraṃ vairāgyamāsthāya laghvāhāro jitendriyaḥ /	param vairāgyam āsthāya laghu āhāraḥ jita indriyaḥ 
SA_GSP31_bhgank_u-626	* utsāhātiśayaṃ kurvan śuddhotkarṣaṃ vivardhayan // GkT_1.7:84	utsāha atiśayam kurvan śuddha utkarṣam vivardhayan 
SA_GSP31_bhgank_u-627	* nairantaryeṇa ṣaṇmāsaṃ brahmahatyādimānapi /	nairantaryeṇa ṣaṣ māsam brahmahatyā ādimān api 
SA_GSP31_bhgank_u-628	* ekaṃ saṃvatsaraṃ vāpi taccittastanmayo bhavet // GkT_1.7:85	ekam saṃvatsaram vā api tad cittaḥ tanmayaḥ bhavet 
SA_GSP31_bhgank_u-629	* sa hatvā duṣkṛtaṃ ghoraṃ rāgādīnāṃ ca pañjaram /	sa hatvā duṣkṛtam ghoram rāga ādīnām ca pañjaram 
SA_GSP31_bhgank_u-630	* paśyatyevākhilaṃ tattvaṃ sarvopādhisamanvitam // GkT_1.7:86	paśyati eva akhilam tattvam sarva upādhi samanvitam 
SA_GSP31_bhgank_u-631	* sarvasattvādhipaṃ paśyann anantaṃ śivamavyayam /	sarva sattva adhipam paśyan anantam śivam avyayam 
SA_GSP31_bhgank_u-632	* yo na pāśupatādanyair yogīśairapi dṛśyate // GkT_1.7:87	yaḥ na pāśupatāt anyaiḥ yogi īśaiḥ api dṛśyate 
SA_GSP31_bhgank_u-633	* taṃ dṛṣṭvā paramaiśvaryaṃ labdhvā syānnirbhayaḥ sadā /	tam dṛṣṭvā parama aiśvaryam labdhvā syāt nirbhayaḥ sadā 
SA_GSP31_bhgank_u-634	* ajñātvāpi vidhānaṃ yasteṣu kāleṣu suvrataḥ // GkT_1.7:88	a jñātvā api vidhānam yaḥ teṣu kāleṣu suvrataḥ 
SA_GSP31_bhgank_u-635	* sadbhaktyutsāhavairāgyair nityaṃ dhyāyati śaṃkaram /	sat bhakti utsāha vairāgyaiḥ nityam dhyāyati śaṃkaram 
SA_GSP31_bhgank_u-636	* tasyāpīśaḥ prasannastāṃ siddhiṃ dadyādanuttamām // GkT_1.7:89	tasya api īśaḥ prasannaḥ tām siddhim dadyāt anuttamām 
SA_GSP31_bhgank_u-637	* yāṃ prāpya tyaktasaṃsāraḥ svatantraḥ śivavadbhavet /	yām prāpya tyakta saṃsāraḥ svatantraḥ śiva vat bhavet 
SA_GSP31_bhgank_u-638	* dhyāyanneva tamīśānaṃ yadi prāṇān vimuñcati // GkT_1.7:90	dhyāyan eva tam īśānam yadi prāṇān vimuñcati 
SA_GSP31_bhgank_u-639	* tasya dehāntakāle vai dadyādīśaḥ parāṃ gatim /	tasya deha anta kāle vai dadyāt īśaḥ parām gatim 
SA_GSP31_bhgank_u-640	* abbhakṣā vāyubhakṣāśca ye cātyugratapaścarāḥ // GkT_1.7:91	abbhakṣāḥ vāyubhakṣāḥ ca ye ca ati ugra tapaḥ carāḥ 
SA_GSP31_bhgank_u-641	* kṣityādīnāṃ ca dātāro yajñānuṣṭhāyinaśca ye /	kṣiti ādīnām ca dātāraḥ yajña anuṣṭhāyinaḥ ca ye 
SA_GSP31_bhgank_u-642	* saṃvatsarasahasreṇa yāṃ siddhiṃ prāpnuvanti te // GkT_1.7:92	saṃvatsara sahasreṇa yām siddhim prāpnuvanti te 
SA_GSP31_bhgank_u-643	* tāṃ prāpnotyardhayāmena japadhyāne rato yatiḥ /	tām prāpnoti ardha yāmena japa dhyāne rataḥ yatiḥ 
SA_GSP31_bhgank_u-644	* jñātvaivaṃ yogamāhātmyaṃ dehādeḥ sthityaniścayam // GkT_1.7:93	jñātvā evam yoga māhātmyam deha ādeḥ sthiti aniścayam 
SA_GSP31_bhgank_u-645	* duḥkhārṇavaṃ ca saṃsāraṃ na kuryādanyathā matim /	duḥkha arṇavam ca saṃsāram na kuryāt anyathā matim 
SA_GSP31_bhgank_u-646	* śarīraṃ dhriyate yāvadyāvadbuddhirna hīyate // GkT_1.7:94	śarīram dhriyate yāvat yāvat buddhiḥ na hīyate 
SA_GSP31_bhgank_u-647	* tāvaddhyānaṃ japaṃ caiva yāvacchaktyā samabhyaset /	tāvat dhyānam japam ca eva yāvat śaktyā samabhyaset 
SA_GSP31_bhgank_u-648	* iṣṭaṃ dravyaṃ yathā naṣṭaṃ kaściddhyāyatyaharniśam /	iṣṭam dravyam yathā naṣṭam kaścid dhyāyati aharniśam 
SA_GSP31_bhgank_u-649	* tadvadvāgādyasaṃsṛṣṭaṃ śivaṃ dhyāyed anālasaḥ // GkT_1.7:95	tadvat vāc ādya saṃsṛṣṭam śivam dhyāyet anālasaḥ 
SA_GSP31_bhgank_u-650	* vivakṣor vāgviśuddhaḥ prāg yadvaccetasi bhāsate /	vivakṣoḥ vāc viśuddhaḥ prāk yadvat cetasi bhāsate 
SA_GSP31_bhgank_u-651	* tadvattaṃ praṇidhānena divā rātrau ca cintayet // GkT_1.7:96	tadvat tam praṇidhānena divā rātrau ca cintayet 
SA_GSP31_bhgank_u-652	* guṇairdharmairviśiṣṭaṃ vā bhāvayitvāśu niścitaḥ /	guṇaiḥ dharmaiḥ viśiṣṭam vā bhāvayitvā āśu niścitaḥ 
SA_GSP31_bhgank_u-653	* paścāttaṃ kevalaṃ dhyāyedbuddhyā kṛtvā pṛthaktataḥ // GkT_1.7:97	paścāt tam kevalam dhyāyet buddhyā kṛtvā pṛthak tatas 
SA_GSP31_bhgank_u-654	* ityetat pāśupatayogavidhānaṃ paramottamaṃ surairapi alabhyaṃ paramaguhyam ā parameśvarād	iti etat pāśupata yoga vidhānam parama uttamam suraiḥ api alabhyam parama guhyam parameśvarāt 
SA_GSP31_bhgank_u-655	gurupāramparyopadeśaikasamadhigamyaṃ svalpaprajñānām anugrahārthaṃ vyaktam evopanyastam // GkT_1.7:98	guru pāramparya upadeśa eka samadhigamyam su alpa prajñānām anugraha artham vyaktam eva upanyastam 
SA_GSP31_bhgank_u-656	* yastvevaṃ na śraddadhātyaparīkṣitebhyo vā dadāti tasya brahmahatyādibhyo 'pi garīyaḥ pātakaṃ syād ityataḥ śiṣyaparīkṣāyāṃ śraddhāyāṃ ca yatnaḥ  #	yaḥ tu evam na śraddadhāti aparīkṣitebhyaḥ vā dadāti tasya garīyaḥ pātakam syāt iti atas śiṣya parīkṣāyām śraddhāyām ca yatnaḥ 
SA_GSP31_bhgank_u-657	kartavya iti // GkT_1.7:99	kartavyaḥ iti 
SA_GSP31_bhgank_u-658	* sthiter upāyamāha // GkT_1.7:100	sthiteḥ upāyam āha 
SA_GSP31_bhgank_u-659	* sadārudrasmṛtis tathā iti // GkT_1.7:101	sadā rudra smṛtiḥ tathā iti 
SA_GSP31_bhgank_u-660	* devanityatvameva sadāsmṛtir ity ucyate // GkT_1.7:102	deva nitya tvam eva sadāsmṛtiḥ iti ucyate 
SA_GSP31_bhgank_u-661	* sthitiṃ pratyupāyatvapratipādanārthaṃ saṃjñāntarābhidhānam iti // GkT_1.7:103	sthitim prati upāyatva pratipādana artham saṃjñā antara abhidhānam iti 
SA_GSP31_bhgank_u-662	* tathāśabdaḥ samānārthaḥ // GkT_1.7:104	tathāśabdaḥ samāna arthaḥ 
SA_GSP31_bhgank_u-663	* yathā devanityatvaṃ pratyadhyayanadhyānayorevopāyatvaṃ dharmaṃ ca prati caryāyā	yathā deva nitya tvam prati adhyayana dhyānayoḥ eva upāya tvam dharmam ca prati caryāyāḥ 
SA_GSP31_bhgank_u-664	eva tadanugrāhakatvenānusnānādiyamayantraṇādir apyupāyatvam upacaryate tathā sthitiṃ	eva tad anugrāhaka tvena anusnāna ādi yama yantraṇa ādiḥ api upāya tvam upacaryate tathā sthitim 
SA_GSP31_bhgank_u-665	prati smṛtireva prādhānyenopāyas tadanugrāhakatvenendriyajayo 'pyupāyatvenokta ityato	prati smṛtiḥ eva prādhānyena upāyaḥ tad anugrāhaka tvena indriya jayaḥ u pi upāya tvena uktaḥ iti atas 
SA_GSP31_bhgank_u-666	nendriyajayād ityanena virodhaḥ // GkT_1.7:105	na indriya jayāt iti anena virodhaḥ 
SA_GSP31_bhgank_u-667	* saṅgādinivṛtterupāyāntaramindriyajaya ityeke // GkT_1.7:106	saṅga ādi nivṛtteḥ upāya antaram indriya jayaḥ iti eke 
SA_GSP31_bhgank_u-668	* tanna pañcopāyatvavirodhāt tyāgādānasūtrabhāṣyavirodhāc ca // GkT_1.7:107	tat na pañca upāya tva virodhāt tyāga ādāna sūtra bhāṣya virodhāt ca 
SA_GSP31_bhgank_u-669	* devanityatvendriyajayayor abheda ityanye 'pi // GkT_1.7:108	deva nitya tva indriya jayayoḥ abhedaḥ iti anye pi 
SA_GSP31_bhgank_u-670	* tadapi na // GkT_1.7:109	tat api na 
SA_GSP31_bhgank_u-671	* lakṣaṇabhedādīndriyotsargagrahayoḥ prabhutvamindriyajayaḥ // GkT_1.7:110	              
SA_GSP31_bhgank_u-672	* deve bhāvābhyāsataratvaṃ devanityatvamiti // GkT_1.7:111	deve bhāva abhyāsatara tvam deva nitya tvam iti 
SA_GSP31_bhgank_u-673	* siddhestarhyupāyo vācya ityata āha // GkT_1.7:112	siddheḥ tarhi upāyaḥ vācyaḥ iti atas āha 
SA_GSP31_bhgank_u-674	* prasādaś caiva iti // GkT_1.7:113	prasādaḥ ca eva iti 
SA_GSP31_bhgank_u-675	* kāraṇasya svaguṇaditsā prasāda ityucyate // GkT_1.7:114	kāraṇasya sva guṇa ditsā prasādaḥ iti ucyate 
SA_GSP31_bhgank_u-676	* caśabdo nyūnādhikavyavacchedasūcakaḥ // GkT_1.7:115	          
SA_GSP31_bhgank_u-677	* evaśabdaḥ prasādasyānyānapekṣatvam avadhārayati // GkT_1.7:116	evaśabdaḥ prasādasya anya anapekṣa tvam avadhārayati 
SA_GSP31_bhgank_u-678	* lābhānāmupāyā ityetad gamyamānārthasyāpyabhidhānaṃ śāstrāntaroktānāṃ mokṣopāyānām anupāyatvajñāpanārtham // GkT_1.7:117	lābhānām upāyāḥ iti etat gamyamāna arthasya api abhidhānam śāstra antara uktānām mokṣa upāyānām anupāya tva jñāpana artham 
SA_GSP31_bhgank_u-679	* pañca ityupasaṃhārārtham // GkT_1.7:118	pañca iti upasaṃhāra artham 
SA_GSP31_bhgank_u-680	* niścitā ityāptairdṛṣṭā ityarthaḥ // GkT_1.7:119	niścitāḥ iti āptaiḥ dṛṣṭāḥ iti arthaḥ 
SA_GSP31_bhgank_u-681	* atha kimetairupāyaiḥ pañcalābhā eva prāptavyā iti na kiṃ tarhi malāśca pañca kṣapaṇīyāḥ // GkT_1.7:120	atha kim etaiḥ upāyaiḥ pañca lābhāḥ eva prāptavyāḥ iti na kim tarhi malāḥ ca pañca kṣapaṇīyāḥ 
SA_GSP31_bhgank_u-682	* ke punaste ityāha // GkT_1.7:121]	ke punar te iti āha 
SA_GSP31_bhgank_u-683	mithyājñānamadharmaśca saktihetuś cyutistathā /	mithyājñānam adharmaḥ ca sakti hetuḥ cyutiḥ tathā 
SA_GSP31_bhgank_u-684	paśutvaṃ mūlaṃ pañcaite tantre heyādhikārataḥ // Gk_1.8 * [	paśu tvam mūlam pañca ete tantre heya adhikārataḥ 
SA_GSP31_bhgank_u-685	* tatra pramāṇābhāsajaṃ jñānaṃ mithyājñānam uktaṃ saṃśayaviparyayādilakṣaṇam // GkT_1.8:1	tatra pramāṇa ābhāsa jam jñānam mithyājñānam uktam saṃśaya viparyaya ādi lakṣaṇam 
SA_GSP31_bhgank_u-686	* śāstrāntarebhyo'pi tarhi saṃśayādinivṛtter aviśeṣaprasaṅga iti cen na śāstrāntarapraṇetḥṇām api viparyayānivṛttipratipādanād ācāryavaiśeṣyaprakaraṇe	śāstra antarebhyaḥ api tarhi saṃśaya ādi nivṛtteḥ aviśeṣa prasaṅgaḥ iti ced na śāstra antara praṇetḥṇām api viparyaya anivṛtti pratipādanāt ācārya vaiśeṣya prakaraṇe 
SA_GSP31_bhgank_u-687	* tanna śāstrāntarebhyo'pi saṃśayādinivṛttiriti // GkT_1.8:3	tat na śāstra antarebhyaḥ api saṃśaya ādi nivṛttiḥ iti 
SA_GSP31_bhgank_u-688	* kāmakrodhadveṣāḥ kaluṣaṃ tasyāpyajñāne 'ntarbhāvaḥ // GkT_1.8:4	kāma krodha dveṣāḥ kaluṣam tasya api ajñāne ntarbhāvaḥ 
SA_GSP31_bhgank_u-689	* kasmāt // GkT_1.8:5	kasmāt 
SA_GSP31_bhgank_u-690	* avyaktāvasthāgamane pratyanīkatvāt // GkT_1.8:6	avyakta avasthā gamane pratyanīka tvāt 
SA_GSP31_bhgank_u-691	* tadidaṃ saṃśayādi kaluṣaṃ ca saha bījena mithyājñānam ityucyate // GkT_1.8:7	tat idam saṃśaya ādi kaluṣam ca saha bījena mithyājñānam iti ucyate 
SA_GSP31_bhgank_u-692	* dvitīyaṃ malaṃ darśayati adharmaśca iti // GkT_1.8:8	dvitīyam malam darśayati adharmaḥ ca iti 
SA_GSP31_bhgank_u-693	* pāpmabījaṃ pāpam evātrādharma ityabhipretam // GkT_1.8:9	pāpma bījam pāpam eva atra adharmaḥ iti abhipretam 
SA_GSP31_bhgank_u-694	* tasya savikārasyaikamalatvaṃ vikāravikāriṇorananyatvād iti // GkT_1.8:10	tasya sa vikārasya eka mala tvam vikāra vikāriṇoḥ ananyatvāt iti 
SA_GSP31_bhgank_u-695	* saty apy ajñānakaluṣasaṅgacyutihetor adharmatve pāpākhya evātrādharmo 'bhipreta iti caḥ sūcayati // GkT_1.8:11	sati api ajñāna kaluṣa saṅga cyuti hetoḥ adharma tve pāpa ākhyaḥ eva atra adharmaḥ bhipretaḥ iti caḥ sūcayati 
SA_GSP31_bhgank_u-696	* tṛtīyaṃ malam āha // GkT_1.8:12	tṛtīyam malam āha 
SA_GSP31_bhgank_u-697	* saktihetuḥ iti // GkT_1.8:13	sakti hetuḥ iti 
SA_GSP31_bhgank_u-698	* saktiḥ saṅgaḥ viṣayāsaktilakṣaṇasukhaṃ bhāṣye sukhābhimāna ityanenoktam // GkT_1.8:14	saktiḥ saṅgaḥ viṣaya āsakti lakṣaṇa sukham bhāṣye sukha abhimānaḥ iti anena uktam 
SA_GSP31_bhgank_u-699	* tasyaiva lakṣaṇārthaṃ bhāṣyam avivecanamiśraṇapreraṇalakṣaṇo vanagajavat iti // GkT_1.8:15	tasya eva lakṣaṇa artham bhāṣyam avivecanā miśraṇa preraṇa lakṣaṇaḥ vana gaja vat iti 
SA_GSP31_bhgank_u-700	* tasya saṅgasya hetus tanmayakaraṇaṃ vidhyantaropārjito dharmaḥ saṅgakara iti ya uktaḥ saha vikāreṇāsau tṛtīyo mala iti // GkT_1.8:16	tasya saṅgasya hetuḥ tanmaya karaṇam vidhi antara upārjitaḥ dharmaḥ saṅga karaḥ iti yaḥ uktaḥ saha vikāreṇa asau tṛtīyaḥ malaḥ iti 
SA_GSP31_bhgank_u-701	* caturthaṃ malam āha // GkT_1.8:17	caturtham malam āha 
SA_GSP31_bhgank_u-702	* cyutis tathā iti // GkT_1.8:18	cyutiḥ tathā iti 
SA_GSP31_bhgank_u-703	* rudratattvādīṣaccittaṃ cyavate viṣayaṃ na prāpnoti taccittacyavanaṃ cyutir ityucyate // GkT_1.8:19	rudra tattvāt īṣat cittam cyavate viṣayam na prāpnoti tat citta cyavanam cyutiḥ iti ucyate 
SA_GSP31_bhgank_u-704	* tathāśabdaḥ samānārthe // GkT_1.8:20	tathāśabdaḥ samāna arthe 
SA_GSP31_bhgank_u-705	* yathā mithyājñānasya svabījena saha malatvam adharmasaṅgakarayoś ca savikāreṇa tathā cyuterapi ūṣmavad avasthitādharmākhyena svabījena saha  #	yathā mithyājñānasya sva bījena saha mala tvam adharma saṅga karayoḥ ca sa vikāreṇa tathā cyuteḥ api ūṣma vat avasthita adharma ākhyena sva bījena saha 
SA_GSP31_bhgank_u-706	malatvam iti // GkT_1.8:21	mala tvam iti 
SA_GSP31_bhgank_u-707	* atra bhāṣyavirodhānna mithyājñānakaluṣapāpmasaṅgacyutayaḥ puruṣasya bhāvāś cittavidyayor vā // GkT_1.8:22	atra bhāṣya virodhāt na mithyājñāna kaluṣa pāpma saṅga cyutayaḥ puruṣasya bhāvāḥ citta vidyayoḥ vā 
SA_GSP31_bhgank_u-708	* nāpi kaluṣamicchāyā bhāvaḥ kiṃtvadharmavikārā evaite jñānecchābhyāṃ saha kṣīrodakavad abhinnā iva gṛhyante // GkT_1.8:23	nā api kaluṣam icchāyāḥ bhāvaḥ kiṃtu adharma vikārāḥ eva ete jñāna icchābhyām saha kṣīrodaka vat abhinnāḥ iva gṛhyante 
SA_GSP31_bhgank_u-709	* tathā ca satkāryavicāre prapañcitametad iti // GkT_1.8:24	           
SA_GSP31_bhgank_u-710	* pañcamaṃ malamāha paśutvam iti // GkT_1.8:25	pañcamam malam āha paśu tvam iti 
SA_GSP31_bhgank_u-711	* dharmādharmavyatiriktaḥ pratighātānumeyaḥ puruṣaguṇaḥ paśutvam // GkT_1.8:26	dharma adharma vyatiriktaḥ pratighāta anumeyaḥ puruṣa guṇaḥ paśu tvam 
SA_GSP31_bhgank_u-712	* tasya caturdaśalakṣaṇopetasya malatvam // GkT_1.8:27	tasya caturdaśa lakṣaṇa upetasya mala tvam 
SA_GSP31_bhgank_u-713	* tāni ca lakṣaṇāny asarvajñatvādīny apatitvāntāni sarvajñatvādiviparyayeṇaiva vyākhyātānīti // GkT_1.8:28	tāni ca lakṣaṇāni asarvajña tva ādīni apatitva antāni sarvajña tva ādi viparyayeṇa eva vyākhyātāni iti 
SA_GSP31_bhgank_u-714	* taccetthaṃbhūtaṃ paśutvaṃ saṃsārasyānādikāraṇaṃ pradhānabhūtam ityevaṃ matvāha mūlamiti // GkT_1.8:29	tat ca itthaṃbhūtam paśutvam saṃsārasya anādi kāraṇam pradhāna bhūtam iti evam matvā āha mūlam iti 
SA_GSP31_bhgank_u-715	* tathāhi kaivalyagatānāmanyamalābhāve 'pi paśutvādeva punaḥ saṃsārāpattiriti // GkT_1.8:30	tathā hi kaivalya gatānām anya mala abhāve pi paśutvāt eva punar saṃsāra āpattiḥ iti 
SA_GSP31_bhgank_u-716	* pañca iti nyūnādhikavyavacchedenopasaṃhārārtham // GkT_1.8:31	pañca iti nyūna adhika vyavacchedena upasaṃhāra artham 
