segmentnr	original	analyzed
SA_GV01_rv_10_u-2465	RV_10.107.01.2{03} mahi jyotiḥ pitṛbhirdattamāgāduruḥ panthādakṣiṇāyā adarśi	mahi jyotiḥ pitṛbhiḥ dattam āgāt uruḥ panthāḥ dakṣiṇāyāḥ adarśi 
SA_GV01_rv_10_u-2466	RV_10.107.02.1{03} uccā divi dakṣiṇāvanto asthurye aśvadāḥ saha tesūryeṇa	uccā divi dakṣiṇāvantaḥ asthuḥ ye aśva dāḥ saha te sūryeṇa 
SA_GV01_rv_10_u-2467	RV_10.107.02.2{03} hiraṇyadā amṛtatvaṃ bhajante vāsodāḥ soma pratiranta āyuḥ	hiraṇya dāḥ amṛta tvam bhajante vāsaḥ dāḥ soma pratirante āyuḥ 
SA_GV01_rv_10_u-2468	RV_10.107.03.1{03} daivī pūrtirdakṣiṇā devayajyā na kavāribhyo nahi tepṛṇanti	daivī pūrtiḥ dakṣiṇā deva yajyā na kavā aribhyaḥ nahi tepṛṇanti 
SA_GV01_rv_10_u-2469	RV_10.107.03.2{03} athā naraḥ prayatadakṣiṇāso 'vadyabhiyābahavaḥ pṛṇanti	athā naraḥ prayata dakṣiṇāsaḥ vadya bhiyā bahavaḥ pṛṇanti 
SA_GV01_rv_10_u-2470	RV_10.107.04.1{03} śatadhāraṃ vāyumarkaṃ svarvidaṃ nṛcakṣasaste abhicakṣate haviḥ	śata dhāram vāyum arkam svar vidam nṛ cakṣasaḥ te abhicakṣate haviḥ 
SA_GV01_rv_10_u-2471	RV_10.107.04.2{03} ye pṛṇanti pra ca yachanti saṃgame tedakṣiṇāṃ duhate saptamātaram	ye pṛṇanti pra ca yacchanti saṃgame te dakṣiṇām duhate sapta mātaram 
SA_GV01_rv_10_u-2472	RV_10.107.05.1{03} dakṣiṇāvān prathamo hūta eti dakṣiṇāvān grāmaṇīragrameti	dakṣiṇāvān prathamaḥ hūtaḥ eti dakṣiṇāvān grāmaṇīḥ agram eti 
SA_GV01_rv_10_u-2473	RV_10.107.05.2{03} tameva manye nṛpatiṃ janānāṃ yaḥ prathamodakṣiṇāmāvivāya	tam eva manye nṛpatim janānām yaḥ prathamaḥ udakṣiṇām āvivāya 
SA_GV01_rv_10_u-2474	RV_10.107.06.1{04} tameva ṛṣiṃ tamu brahmāṇamāhuryajñanyaṃ sāmagāmukthaśāsam	tam eva ṛṣim tam u brahmāṇam āhuḥ yajñanyam sāma gām uktha śāsam 
SA_GV01_rv_10_u-2475	RV_10.107.06.2{04} sa śukrasya tanvo veda tisro yaḥ prathamodakṣiṇayā rarādha	sa śukrasya tanvaḥ veda tisraḥ yaḥ prathamaḥ udakṣiṇayā rarādha 
SA_GV01_rv_10_u-2476	RV_10.107.07.1{04} dakṣiṇāśvaṃ dakṣiṇā gāṃ dadāti dakṣiṇā candramuta yad dhiraṇyam	dakṣiṇā aśvam dakṣiṇā gām dadāti dakṣiṇā candram uta yat hiraṇyam 
SA_GV01_rv_10_u-2477	RV_10.107.07.2{04} dakṣiṇānnaṃ vanute yo na ātmādakṣiṇāṃ varma kṛṇute vijānan	dakṣiṇā annam vanute yaḥ naḥ ātmā a dakṣiṇām varma kṛṇute vijānan 
SA_GV01_rv_10_u-2478	RV_10.107.08.1{04} na bhojā mamrurna nyarthamīyurna riṣyanti na vyathante habhojāḥ	na bhojāḥ mamruḥ na nyartham īyuḥ na riṣyanti na vyathante habhojāḥ 
SA_GV01_rv_10_u-2479	RV_10.107.08.2{04} idaṃ yad viśvaṃ bhuvanaṃ svaścaitat sarvandakṣiṇaibhyo dadāti	idam yat viśvam bhuvanam svar ca etat sarvan dakṣiṇā ebhyaḥ dadāti 
SA_GV01_rv_10_u-2480	RV_10.107.09.1{04} bhojā jigyuḥ surabhiṃ yonimagre bhojā jigyurvadhvaṃ yāsuvāsāḥ	bhojāḥ jigyuḥ surabhim yonim agre bhojāḥ jigyuḥ vadhvam yāsu vāsāḥ 
SA_GV01_rv_10_u-2481	RV_10.107.09.2{04} bhojā jigyurantaḥpeyaṃ surāyā bhojā jigyurye ahūtāḥ prayanti	bhojāḥ jigyuḥ antaḥpeyam surāyāḥ bhojāḥ jigyuḥ ye a hūtāḥ prayanti 
SA_GV01_rv_10_u-2482	RV_10.107.10.1{04} bhojāyāśvaṃ saṃ mṛjantyāśuṃ bhojāyāste kanyāśumbhamānā	bhojāya aśvam sam mṛjanti āśum bhojāya āste kanyā āśumbhamānā 
SA_GV01_rv_10_u-2483	RV_10.107.10.2{04} bhojasyedaṃ puṣkariṇīva veśma pariṣkṛtandevamāneva citram	bhojasya idam puṣkariṇī iva veśma citram 
SA_GV01_rv_10_u-2484	RV_10.107.11.1{04} bhojamaśvāḥ suṣṭhuvāho vahanti suvṛd ratho vartatedakṣiṇāyāḥ	bhojam aśvāḥ suṣṭhuvāhaḥ vahanti suvṛt rathaḥ vartate dakṣiṇāyāḥ 
SA_GV01_rv_10_u-2485	RV_10.107.11.2{04} bhojaṃ devāso 'vatā bhareṣu bhojaḥśatrūn samanīkeṣu jetā	bhojam devāsaḥ vatā bhareṣu bhojaḥśatrūn samanīkeṣu jetā 
SA_GV01_rv_10_u-2486	RV_10.108.01.1{05} kimichantī saramā predamānaḍ dūre hyadhvā jaguriḥparācaiḥ	kim icchantī saramā pra idam ānaṭ dūre hi adhvā jaguriḥ parācais 
SA_GV01_rv_10_u-2487	RV_10.108.01.2{05} kāsmehitiḥ kā paritakmyāsīt kathaṃ rasāyāataraḥ payāṃsi	kā asmehitiḥ kā paritakmyā āsīt katham payāṃsi 
SA_GV01_rv_10_u-2488	RV_10.108.02.1{05} indrasya dūtīriṣitā carāmi maha ichantī paṇayo nidhīnvaḥ	indrasya dūtīḥ iṣitā carāmi mahaḥ ichantī paṇayaḥ nidhīn vaḥ 
SA_GV01_rv_10_u-2489	RV_10.108.02.2{05} atiṣkado bhiyasā tan na āvat tathā rasāyā atarampayāṃsi	atiṣkadaḥ bhiyasā tat naḥ āvat tathā rasāyāḥ ataram payāṃsi 
SA_GV01_rv_10_u-2490	RV_10.108.03.1{05} kīdṛṃṃ indraḥ sarame kā dṛśīkā yasyedaṃ dūtīrasaraḥ parākāt	kīdṛṃṃ indraḥ sarame kā dṛśīkā yasya idam dūtīra saraḥ parākāt 
SA_GV01_rv_10_u-2491	RV_10.108.03.2{05} ā ca gachān mitramenā dadhāmāthāgavāṃ gopatirno bhavāti	ā ca gacchāt mitram enā dadhāma atha a gavām go patiḥ naḥ bhavāti 
SA_GV01_rv_10_u-2492	RV_10.108.04.1{05} nāhaṃ taṃ veda dabhyaṃ dabhat sa yasyedaṃ dūtīrasaraṃ parākāt	na aham tam veda dabhyam dabhat sa yasya idam parākāt 
SA_GV01_rv_10_u-2493	RV_10.108.04.2{05} na taṃ gūhanti sravato gabhīrā hatāindreṇa paṇayaḥ śayadhve	na tam gūhanti sravataḥ gabhīrāḥ hatāḥ aindreṇa paṇayaḥ śayadhve 
SA_GV01_rv_10_u-2494	RV_10.108.05.1{05} imā gāvaḥ sarame yā aichaḥ pari divo antān subhagepatantī	imāḥ gāvaḥ sarame yāḥ aichaḥ pari divaḥ antān subhagā patantī 
SA_GV01_rv_10_u-2495	RV_10.108.05.2{05} kasta enā ava sṛjādayudhvyutāsmākamāyudhāsanti tigmā	kaḥ te enāḥ ava sṛjāt ayudhvī uta asmākam āyudhā asanti tigmā 
SA_GV01_rv_10_u-2496	RV_10.108.06.1{06} asenyā vaḥ paṇayo vacāṃsyaniṣavyāstanvaḥ santu pāpīḥ	asenyā vaḥ paṇayaḥ vacāṃsi aniṣavyāḥ tanvaḥ santu pāpīḥ 
SA_GV01_rv_10_u-2497	RV_10.108.06.2{06} adhṛṣṭo va etavā astu panthā bṛhaspatirva ubhayā namṛḷāt	adhṛṣṭaḥ vaḥ etavai astu panthāḥ bṛhaspatiḥ vaḥ ubhayā namṛḷāt 
SA_GV01_rv_10_u-2498	RV_10.108.07.1{06} ayaṃ nidhiḥ sarame adribudhno gobhiraśvebhirvasubhirnyṛṣṭaḥ	ayam nidhiḥ sarame adri budhnaḥ gobhiḥ aśvebhiḥ vasubhiḥ ni ṛṣṭaḥ 
SA_GV01_rv_10_u-2499	RV_10.108.07.2{06} rakṣanti taṃ paṇayo ye sugopā reku padamalakamā jagantha	rakṣanti tam paṇayaḥ ye su gopāḥ jagantha 
SA_GV01_rv_10_u-2500	RV_10.108.08.1{06} eha gamannṛṣayaḥ somaśitā ayāsyo aṅgiraso navagvāḥ	ā iha gaman ṛṣayaḥ soma śitāḥ ayāsyaḥ aṅgirasaḥ navagvāḥ 
SA_GV01_rv_10_u-2501	RV_10.108.08.2{06} ta etamūrvaṃ vi bhajanta gonāmathaitad vacaḥ paṇayovamannit	te etam ūrvam vi bhajanta gonām atha etat vacaḥ paṇayaḥ vaman id 
SA_GV01_rv_10_u-2502	RV_10.108.09.1{06} evā ca tvaṃ sarama ājagantha prabādhitā sahasā daivyena	evā ca tvam sarame ājagantha prabādhitā sahasā daivyena 
SA_GV01_rv_10_u-2503	RV_10.108.09.2{06} svasāraṃ tvā kṛṇavai mā punargā apa te gavāṃ subhagebhajāma	svasāram tvā kṛṇavai mā punar gāḥ apa te gavām subhagebhajāma 
SA_GV01_rv_10_u-2504	RV_10.108.10.1{06} nāhaṃ veda bhrātṛtvaṃ no svasṛtvamindro viduraṅgirasaśca ghorāḥ	na aham veda bhrātṛ tvam no svasṛ tvam indraḥ viduḥ aṅgirasaḥ ca ghorāḥ 
SA_GV01_rv_10_u-2505	RV_10.108.10.2{06} gokāmā me achadayan yadāyamapāta ita paṇayovarīyaḥ	go kāmāḥ me achadayan yadā ayam apātaḥ ita paṇayoḥ varīyaḥ 
SA_GV01_rv_10_u-2506	RV_10.108.11.1{06} dūramita paṇayo varīya ud gāvo yantu minatīr{ṛ}tena	dūramita paṇayaḥ varīyaḥ ud gāvaḥ yantu minatīḥ ṛtena 
SA_GV01_rv_10_u-2507	RV_10.108.11.2{06} bṛhaspatiryā avindan nigūḷāḥ somo grāvāṇa ṛṣayaśca viprāḥ	bṛhaspatiḥ yāḥ avindat nigūḷāḥ somaḥ grāvāṇaḥ ṛṣayaḥ ca viprāḥ 
SA_GV01_rv_10_u-2508	RV_10.109.01.1{07} te 'vadan prathamā brahmakilbiṣe 'kūpāraḥ salilomātariśvā	te vadan prathamāḥ brahma kilbiṣe kūpāraḥ salilomātariśvā 
SA_GV01_rv_10_u-2509	RV_10.109.01.2{07} vīḷuharāstapa ugro mayobhūrāpo devīḥprathamajā ṛtena	vīḍu harāḥ tapaḥ ugraḥ mayaḥ bhūḥ āpaḥ devīḥ prathama jāḥ ṛtena 
SA_GV01_rv_10_u-2510	RV_10.109.02.1{07} somo rājā prathamo brahmajāyāṃ punaḥ prāyachadahṛṇīyamānaḥ	somaḥ rājā prathamaḥ brahma jāyām punar prāyacchat a hṛṇīyamānaḥ 
SA_GV01_rv_10_u-2511	RV_10.109.02.2{07} anvartitā varuṇo mitra āsīdagnirhotāhastagṛhyā nināya	anvartitā varuṇaḥ mitraḥ āsīt agniḥ hotā a hasta gṛhya ā nināya 
SA_GV01_rv_10_u-2512	RV_10.109.03.1{07} hastenaiva grāhya ādhirasyā brahmajāyeyamiti cedavocan	hastena eva grāhyaḥ ādhiḥ asyāḥ brahma jāyā iyam iti ced avocan 
SA_GV01_rv_10_u-2513	RV_10.109.03.2{07} na dūtāya prahye tastha eṣā tathā rāṣṭraṃ gupitaṃkṣatriyasya	na dūtāya prahye tasthe eṣā tathā rāṣṭram gupitam kṣatriyasya 
SA_GV01_rv_10_u-2514	RV_10.109.04.1{07} devā etasyāmavadanta pūrve saptaṛṣayastapase ye niṣeduḥ	devāḥ etasyām avadanta pūrve sapta ṛṣayaḥ tapase ye niṣeduḥ 
SA_GV01_rv_10_u-2515	RV_10.109.04.2{07} bhīmā jāyā brāhmaṇasyopanītā durdhāṃ dadhātiparame vyoman	bhīmā jāyā brāhmaṇasya upanītā durdhām dadhāti parame vyoman 
SA_GV01_rv_10_u-2516	RV_10.109.05.1{07} brahmacārī carati veviṣad viṣaḥ sa devānāṃ bhavatyekamaṅgam	brahmacārī carati veviṣat viṣaḥ sa devānām bhavati ekam aṅgam 
SA_GV01_rv_10_u-2517	RV_10.109.05.2{07} tena jāyāmanvavindad bṛhaspatiḥ somena nītāṃjuhvaṃ na devāḥ	tena jāyām anvavindat bṛhaspatiḥ somena nītām juhvam na devāḥ 
SA_GV01_rv_10_u-2518	RV_10.109.06.1{07} punarvai devā adaduḥ punarmanuṣyā uta	punar vai devāḥ adaduḥ punar manuṣyāḥ uta 
SA_GV01_rv_10_u-2519	RV_10.109.06.2{07} rājānaḥsatyaṃ kṛṇvānā brahmajāyāṃ punardaduḥ	rājānaḥ satyam kṛṇvānāḥ brahma jāyām punar daduḥ 
SA_GV01_rv_10_u-2520	RV_10.109.07.1{07} punardāya brahmajāyāṃ kṛtvī devairnikilbiṣam	punar dāya brahma jāyām kṛtvī devaiḥ nikilbiṣam 
SA_GV01_rv_10_u-2521	RV_10.109.07.2{07} ūrjampṛthivyā bhaktvāyorugāyamupāsate	ūrjam pṛthivyā bhaktvāya urugāyam upāsate 
SA_GV01_rv_10_u-2522	RV_10.110.01.1{08} samiddho adya manuṣo duroṇe devo devān yajasi jātavedaḥ	samiddhaḥ adya manuṣaḥ duroṇe devaḥ devān yajasi jātavedaḥ 
SA_GV01_rv_10_u-2523	RV_10.110.01.2{08} ā ca vaha mitramahaścikitvān tvaṃ dūtaḥ kavirasipracetāḥ	ā ca vaha mitra mahaḥ cikitvān tvam dūtaḥ kaviḥ asi pracetāḥ 
SA_GV01_rv_10_u-2524	RV_10.110.02.1{08} tanūnapāt patha ṛtasya yānān madhvā samañjan svadayāsujihva	tanūnapāt pathaḥ ṛtasya yānān madhvā samañjan svadaya asujihva 
SA_GV01_rv_10_u-2525	RV_10.110.02.2{08} manmāni dhībhiruta yajñam ṛndhan devatrā cakṛṇuhyadhvaraṃ naḥ	manmāni dhībhiḥ uta yajñam ṛndhan devatrā cakṛṇuhi adhvaram naḥ 
SA_GV01_rv_10_u-2526	RV_10.110.03.1{08} ājuhvāna īḍyo vandyaścā yāhyagne vasubhiḥ sajoṣāḥ	ājuhvānaḥ īḍyaḥ vandyaḥ ca ā yāhi agne vasubhiḥ sajoṣāḥ 
SA_GV01_rv_10_u-2527	RV_10.110.03.2{08} tvaṃ devānāmasi yahva hotā sa enān yakṣīṣito yajīyān	tvam devānām asi yahva hotā saḥ enān yakṣi iṣitaḥ yajīyān 
SA_GV01_rv_10_u-2528	RV_10.110.04.1{08} prācīnaṃ barhiḥ pradiśā pṛthivyā vastorasyā vṛjyateagre ahnām	prācīnam barhiḥ pradiśā pṛthivyāḥ vastoḥ asyāḥ vṛjyate agre ahnām 
SA_GV01_rv_10_u-2529	RV_10.110.04.2{08} vyu prathate vitaraṃ varīyo devebhyo aditayesyonam	vi u prathate vitaram varīyaḥ devebhyaḥ aditaye syonam 
SA_GV01_rv_10_u-2530	RV_10.110.05.1{08} vyacasvatīrurviyā vi śrayantāṃ patibhyo na janayaḥśumbhamānāḥ	vyacasvatīḥ urviyā vi śrayantām patibhyaḥ na janayaḥ śumbhamānāḥ 
SA_GV01_rv_10_u-2531	RV_10.110.05.2{08} devīrdvāro bṛhatīrviśvaminvā devebhyobhavata suprāyaṇāḥ	devīḥ dvāraḥ bṛhatīḥ viśvaminvāḥ devebhyaḥ bhavata su prāyaṇāḥ 
SA_GV01_rv_10_u-2532	RV_10.110.06.1{09} ā suṣvayantī yajate upāke uṣāsānaktā sadatāṃ niyonau	ā yajate upāke uṣāsānaktā sadatām niyonau 
SA_GV01_rv_10_u-2533	RV_10.110.06.2{09} divye yoṣaṇe bṛhatī surukme adhi śriyaṃśukrapiśaṃ dadhāne	divye yoṣaṇe bṛhatī su rukme adhi śriyam śu krapiśam dadhāne 
SA_GV01_rv_10_u-2534	RV_10.110.07.1{09} daivyā hotārā prathamā suvācā mimānā yajñaṃ manuṣoyajadhyai	daivyā hotārā prathamā su vācā mimānā yajñam manuṣaḥ yajadhyai 
SA_GV01_rv_10_u-2535	RV_10.110.07.2{09} pracodayantā vidatheṣu kārū prācīnaṃ jyotiḥpradiśā diśantā	pracodayantā vidatheṣu kārū prācīnam jyotiḥ pradiśā diśantā 
SA_GV01_rv_10_u-2536	RV_10.110.08.1{09} ā no yajñaṃ bhāratī tūyametviḷā manuṣvadihacetayantī	ā naḥ yajñam bhāratī tūyam etu iḷā manuṣvat iha cetayantī 
SA_GV01_rv_10_u-2537	RV_10.110.08.2{09} tisro devīrbarhiredaṃ syonaṃ sarasvatīsvapasaḥ sadantu	tisraḥ devīḥ barhiḥ ā idam syonam sarasvatīsu apasaḥ sadantu 
SA_GV01_rv_10_u-2538	RV_10.110.09.1{09} ya ime dyāvāpṛthivī janitrī rūpairapiṃśad bhuvanāniviśvā	yaḥ ime dyāvāpṛthivī janitrī rūpaiḥ apiṃśat bhuvanāni viśvā 
SA_GV01_rv_10_u-2539	RV_10.110.09.2{09} tamadya hotariṣito yajīyān devaṃ tvaṣṭāramiha yakṣi vidvān	tam adya hotar iṣitaḥ yajīyān devam tvaṣṭāram iha yakṣi vidvān 
SA_GV01_rv_10_u-2540	RV_10.110.10.1{09} upāvasṛja tmanyā samañjan devānāṃ pātha ṛtuthāhavīṃṣi	upa avasṛja tmanyā samañjan devānām pāthaḥ ṛtuthā havīṃṣi 
SA_GV01_rv_10_u-2541	RV_10.110.10.2{09} vanaspatiḥ śamitā devo agniḥ svadantu havyammadhunā ghṛtena	vanaspatiḥ śamitā devaḥ agniḥ svadantu havyam madhunā ghṛtena 
SA_GV01_rv_10_u-2542	RV_10.110.11.1{09} sadyo jāto vyamimīta yajñamagnirdevānāmabhavatpurogāḥ	sadyas jātaḥ vyamimīta yajñam agniḥ devānām abhavat purogāḥ 
SA_GV01_rv_10_u-2543	RV_10.110.11.2{09} asya hotuḥ pradiśy ṛtasya vāci svāhākṛtaṃhaviradantu devāḥ	asya hotuḥ pradiśi ṛtasya vāci svāhākṛtam haviḥ adantu devāḥ 
SA_GV01_rv_10_u-2544	RV_10.111.01.1{10} manīṣiṇaḥ pra bharadhvaṃ manīṣāṃ yathā-yathā matayaḥsanti nṛṇām	manīṣiṇaḥ pra bharadhvam manīṣām yathā yathā matayaḥ santi nṛṇām 
SA_GV01_rv_10_u-2545	RV_10.111.01.2{10} indraṃ satyairerayāmā kṛtebhiḥ sa hivīro girvaṇasyurvidānaḥ	indram satyaiḥ erayāma kṛtebhiḥ sa hi vīraḥ girvaṇasyuḥ vidānaḥ 
SA_GV01_rv_10_u-2546	RV_10.111.02.1{10} ṛtasya hi sadaso dhītiradyaut saṃ gārṣṭeyo vṛṣabhogobhirānaṭ	ṛtasya hi sadasaḥ dhītiḥ adyaut sam gārṣṭeyaḥ vṛṣabhaḥ gobhiḥ ānaṭ 
SA_GV01_rv_10_u-2547	RV_10.111.02.2{10} udatiṣṭhat taviṣeṇā raveṇa mahānti citsaṃ vivyācā rajāṃsi	udatiṣṭhat taviṣeṇa raveṇa mahānti citsam vivyāca rajāṃsi 
SA_GV01_rv_10_u-2548	RV_10.111.03.1{10} indraḥ kila śrutyā asya veda sa hi jiṣṇuḥ pathikṛtsūryāya	indraḥ kila śrutyāḥ asya veda sa hi jiṣṇuḥ pathikṛt sūryāya 
SA_GV01_rv_10_u-2549	RV_10.111.03.2{10} ān menāṃ kṛṇvannacyuto bhuvad goḥ patirdivaḥ sanajā apratītaḥ	āt menām kṛṇvan acyutaḥ bhuvat goḥ patiḥ divaḥ sana jāḥ apratītaḥ 
SA_GV01_rv_10_u-2550	RV_10.111.04.1{10} indro mahnā mahato arṇavasya vratāminādaṅgirobhirgṛṇānaḥ	indraḥ mahnā mahataḥ arṇavasya vratā amināt aṅgirobhiḥ gṛṇānaḥ 
SA_GV01_rv_10_u-2551	RV_10.111.04.2{10} purūṇi cin ni tatānā rajāṃsi dādhāra yodharuṇaṃ satyatātā	purūṇi cit ni tatāna rajāṃsi dādhāra yodharuṇam satyatātā 
SA_GV01_rv_10_u-2552	RV_10.111.05.1{10} indro divaḥ pratimānaṃ pṛthivyā viśvā veda savanā hantiśuṣṇam	indraḥ divaḥ pratimānam pṛthivyāḥ viśvā veda savanā hantiśuṣṇam 
SA_GV01_rv_10_u-2553	RV_10.111.05.2{10} mahīṃ cid dyāmātanot sūryeṇa cāskambha citkambhanena skabhīyān	mahīm cit dyām ātanot sūryeṇa cāskambha cit kambhanena skabhīyān 
SA_GV01_rv_10_u-2554	RV_10.111.06.1{11} vajreṇa hi vṛtrahā vṛtramastaradevasya śūśuvānasyamāyāḥ	vajreṇa hi vṛtrahā vṛtram astaradevasya śūśuvānasya māyāḥ 
SA_GV01_rv_10_u-2555	RV_10.111.06.2{11} vi dhṛṣṇo atra dhṛṣatā jaghanthāthābhavomaghavan bāhvojāḥ	vi dhṛṣṇaḥ atra dhṛṣatā jaghantha atha abhavaḥ maghavan bāhu ojāḥ 
SA_GV01_rv_10_u-2556	RV_10.111.07.1{11} sacanta yaduṣasaḥ sūryeṇa citrāmasya ketavo rāmavindan	sacanta yat uṣasaḥ sūryeṇa citrāmasya ketavaḥ rāmavindan 
SA_GV01_rv_10_u-2557	RV_10.111.07.2{11} ā yan nakṣatraṃ dadṛśe divo na punaryato nakiraddhā nu veda	ā yat nakṣatram dadṛśe divaḥ na punaryataḥ nakirat hā nu veda 
SA_GV01_rv_10_u-2558	RV_10.111.08.1{11} dūraṃ kila prathamā jagmurāsāmindrasya yāḥ prasavesasrurāpaḥ	dūram kila prathamāḥ jagmuḥ āsām indrasya yāḥ prasavesasruḥ āpaḥ 
SA_GV01_rv_10_u-2559	RV_10.111.08.2{11} kva svidagraṃ kva budhna āsāmāpomadhyaṃ kva vo nūnamantaḥ	kva svid agram kva budhnaḥ āsām āpaḥ madhyam kva vaḥ nūnam antaḥ 
SA_GV01_rv_10_u-2560	RV_10.111.09.1{11} sṛjaḥ sindhūnrahinā jagrasānānādidetāḥ pra vivijrejavena	sṛjaḥ sindhūn rahinā jagrasa an an ādidetāḥ pra vivij rejavena 
SA_GV01_rv_10_u-2561	RV_10.111.09.2{11} mumukṣamāṇā uta yā mumucre 'dhedetā naramante nitiktāḥ	mumukṣamāṇāḥ uta yāḥ mumucre dhedetāḥ naramante nitiktāḥ 
SA_GV01_rv_10_u-2562	RV_10.111.10.1{11} sadhrīcīḥ sindhumuśatīrivāyan sanājjāra āritaḥpūrbhidāsām	sadhrīcīḥ sindhum uśatīḥ iva āyan sanāt jāraḥ āritaḥpūrbhidāsām 
SA_GV01_rv_10_u-2563	RV_10.111.10.2{11} astamā te pārthivā vasūnyasme jagmuḥsūnṛtā indra pūrvīḥ	astamā te pārthivā vasūni asme jagmuḥ sūnṛtāḥ indra pūrvīḥ 
SA_GV01_rv_10_u-2564	RV_10.112.01.1{12} indra piba pratikāmaṃ sutasya prātaḥsāvastava hipūrvapītiḥ	indra piba pratikāmam sutasya prātaḥsāvaḥ tava hi pūrva pītiḥ 
SA_GV01_rv_10_u-2565	RV_10.112.01.2{12} harṣasva hantave śūra śatrūnukthebhiṣ ṭevīryā pra bravāma	harṣasva hantave śūra śatrūn ukthebhiḥ tevī iryā pra bravāma 
SA_GV01_rv_10_u-2566	RV_10.112.02.1{12} yaste ratho manaso javīyānendra tena somapeyāya yāhi	yaḥ te rathaḥ manasaḥ javīyān indra tena soma peyāya yāhi 
SA_GV01_rv_10_u-2567	RV_10.112.02.2{12} tūyamā te harayaḥ pra dravantu yebhiryāsi vṛṣabhirmandamānaḥ	tūyamā te harayaḥ pra dravantu yebhiḥ yāsi vṛṣabhiḥ mandamānaḥ 
SA_GV01_rv_10_u-2568	RV_10.112.03.1{12} haritvatā varcasā sūryasya śreṣṭhai rūpaistanvaṃsparśayasva	haritvatā varcasā sūryasya śreṣṭhaiḥ rūpaiḥ tanvam sparśayasva 
SA_GV01_rv_10_u-2569	RV_10.112.03.2{12} asmābhirindra sakhibhirhuvānaḥ sadhrīcīnomādayasvā niṣadya	asmābhiḥ indra sakhibhiḥ huvānaḥ sadhrīcīnaḥ umā ādayasva niṣadya 
SA_GV01_rv_10_u-2570	RV_10.112.04.1{12} yasya tyat te mahimānaṃ madeṣvime mahī rodasīnāviviktām	yasya tyad te mahimānam madeṣu ime mahī rodasīn āviviktām 
SA_GV01_rv_10_u-2571	RV_10.112.04.2{12} tadoka ā haribhirindra yuktaiḥ priyebhiryāhi priyamannamacha	tat okaḥ ā haribhiḥ indra yuktaiḥ priyebhiḥ yāhi priyam annam acha 
SA_GV01_rv_10_u-2572	RV_10.112.05.1{12} yasya śaśvat papivānindra śatrūnanānukṛtyā raṇyācakartha	yasya śaśvat papivān indra śatrūn anā anukṛtyā 
SA_GV01_rv_10_u-2573	RV_10.112.05.2{12} sa te purandhiṃ taviṣīmiyarti sa te madāyasuta indra somaḥ	sa te purandhim taviṣīm iyarti sa te madāya sutaḥ indra somaḥ 
SA_GV01_rv_10_u-2574	RV_10.112.06.1{13} idaṃ te pātraṃ sanavittamindra pibā somamenā śatakrato	idam te pātram sanavittam indra piba somam enā śatakrato 
SA_GV01_rv_10_u-2575	RV_10.112.06.2{13} pūrṇa āhāvo madirasya madhvo yaṃ viśva idabhiharyantidevāḥ	pūrṇaḥ āhāvaḥ madirasya madhvaḥ yam viśve id abhiharyanti devāḥ 
SA_GV01_rv_10_u-2576	RV_10.112.07.1{13} vi hi tvāmindra purudhā janāso hitaprayaso vṛṣabhahvayante	vi hi tvām indra purudhā janāsaḥ hita prayasaḥ vṛṣabha hvayante 
SA_GV01_rv_10_u-2577	RV_10.112.07.2{13} asmākaṃ te madhumattamānīmā bhuvan savanā teṣuharya	asmākam te madhumattamāni imā bhuvan savanā teṣuharya 
SA_GV01_rv_10_u-2578	RV_10.112.08.1{13} pra ta indra pūrvyāṇi pra nūnaṃ vīryā vocaṃ prathamākṛtāni	pra te indra pūrvyāṇi pra nūnam vīryā vocam prathamākṛtāni 
SA_GV01_rv_10_u-2579	RV_10.112.08.2{13} satīnamanyuraśrathāyo adriṃ suvedanāmakṛṇorbrahmaṇe gām	satīna manyuḥ aśrathāyaḥ adrim su vedanām akṛṇoḥ brahmaṇe gām 
SA_GV01_rv_10_u-2580	RV_10.112.09.1{13} ni ṣu sīda gaṇapate gaṇeṣu tvāmāhurvipratamaṃkavīnām	ni su sīda gaṇapate gaṇeṣu tvām āhuḥ vipratamam kavīnām 
SA_GV01_rv_10_u-2581	RV_10.112.09.2{13} na ṛte tvat kriyate kiṃ canāre mahāmarkaṃmaghavañcitramarca	na ṛte tvat kriyate kim cana are mahām arkam maghavan citram arca 
SA_GV01_rv_10_u-2582	RV_10.112.10.1{13} abhikhyā no maghavan nādhamānān sakhe bodhi vasupatesakhīnām	naḥ maghavan nādhamānān sakhe bodhi vasupate sakhīnām 
SA_GV01_rv_10_u-2583	RV_10.112.10.2{13} raṇaṃ kṛdhi raṇakṛt satyaśuṣmābhakte cidābhajā rāye asmān	raṇam kṛdhi raṇa kṛt satya śuṣma a bhakte cit ābhaja rāye asmān 
SA_GV01_rv_10_u-2584	RV_10.113.01.1{14} tamasya dyāvāpṛthivī sacetasā viśvebhirdevairanuśuṣmamāvatām	tam asya dyāvāpṛthivī sacetasā viśvebhiḥ devaiḥ anuśuṣmam āvatām 
SA_GV01_rv_10_u-2585	RV_10.113.01.2{14} yadait kṛṇvāno mahimānamindriyampītvī somasya kratumānavardhata	yadā ait kṛṇvānaḥ mahimānam indriyam pītvī somasya kratumān avardhata 
SA_GV01_rv_10_u-2586	RV_10.113.02.1{14} tamasya viṣṇurmahimānamojasāṃśuṃ dadhanvān madhunovi rapśate	tam asya viṣṇuḥ mahimānam ojasā aṃśum dadhanvān madhunā uvi rapśate 
SA_GV01_rv_10_u-2587	RV_10.113.02.2{14} devebhirindro maghavā sayāvabhirvṛtraṃjaghanvānabhavad vareṇyaḥ	devebhiḥ indraḥ maghavā sa yāvabhiḥ vṛtram jaghanvān abhavat vareṇyaḥ 
SA_GV01_rv_10_u-2588	RV_10.113.03.1{14} vṛtreṇa yadahinā bibhradāyudhā samasthithā yudhayeśaṃsamāvide	vṛtreṇa yat ahinā bibhrat āyudhā samasthithāḥ yudhayeśaṃsam āvide 
SA_GV01_rv_10_u-2589	RV_10.113.03.2{14} viśve te atra marutaḥ saha tmanāvardhannugra mahimānamindriyam	viśve te atra marutaḥ saha tmanā avardhan ugra mahimānam indriyam 
SA_GV01_rv_10_u-2590	RV_10.113.04.1{14} jajñāna eva vyabādhata spṛdhaḥ prāpaśyad vīro abhipauṃsyaṃ raṇam	jajñānaḥ eva vyabādhata spṛdhaḥ prāpaśyat vīraḥ abhipauṃsyam raṇam 
SA_GV01_rv_10_u-2591	RV_10.113.04.2{14} avṛścadadrimava sasyadaḥ sṛjadastabhnān nākaṃ svapasyayā pṛthum	avṛścat adrim ava sasyadaḥ sṛjat astabhnāt nākam su apasyayā pṛthum 
SA_GV01_rv_10_u-2592	RV_10.113.05.1{14} ādindraḥ satrā taviṣīrapatyata varīyo dyāvāpṛthivīabādhata	āt indraḥ satrā taviṣīḥ apatyata varīyaḥ dyāvāpṛthivī abādhata 
SA_GV01_rv_10_u-2593	RV_10.113.05.2{14} avābharad dhṛṣito vajramāyasaṃ śevaṃ mitrāyavaruṇāya dāśuṣe	avābharat dhṛṣitaḥ vajram āyasam śevam mitrāya varuṇāya dāśuṣe 
SA_GV01_rv_10_u-2594	RV_10.113.06.1{15} indrasyātra taviṣībhyo virapśina ṛghāyato araṃhayantamanyave	indrasya atra taviṣībhyaḥ virapśinaḥ ṛghāyataḥ a raṃhayanta manyave 
SA_GV01_rv_10_u-2595	RV_10.113.06.2{15} vṛtraṃ yadugro vyavṛścadojasāpo bibhratantamasā parīvṛtam	vṛtram yat ugraḥ vyavṛścat ojasā apaḥ bibhratan tamasā parīvṛtam 
SA_GV01_rv_10_u-2596	RV_10.113.07.1{15} yā vīryāṇi prathamāni kartvā mahitvebhiryatamānausamīyatuḥ	yā vīryāṇi prathamāni kartvā mahitvebhiḥ yatamānau samīyatuḥ 
SA_GV01_rv_10_u-2597	RV_10.113.07.2{15} dhvāntaṃ tamo 'va dadhvase hata indro mahnāpūrvahūtāvapatyata	dhvāntam tamaḥ vaḥ dadhvase hataḥ indraḥ mahnā apūrva hūtau apatyata 
SA_GV01_rv_10_u-2598	RV_10.113.08.1{15} viśve devāso adha vṛṣṇyāni te 'vardhayan somavatyāvacasyayā	viśve devāsaḥ adha vṛṣṇyāni te vardhayan somavatyā avacasyayā 
SA_GV01_rv_10_u-2599	RV_10.113.08.2{15} raddhaṃ vṛtramahimindrasya hanmanāgnirnajambhaistṛṣvannamāvayat	raddham vṛtram ahim indrasya hanmanā agniḥ na jambhaiḥ tṛṣu annam āvayat 
SA_GV01_rv_10_u-2600	RV_10.113.09.1{15} bhūri dakṣebhirvacanebhir{ṛ}kvabhiḥ sakhyebhiḥ sakhyānipra vocata	bhūri dakṣebhiḥ vacanebhiḥ ṛkvabhiḥ sakhyebhiḥ sakhyāni pra vocata 
SA_GV01_rv_10_u-2601	RV_10.113.09.2{15} indro dhuniṃ ca cumuriṃ ca dambhayañchraddhāmanasyā śṛṇute dabhītaye	indraḥ dhunim ca cumurim ca dambhayan śraddhāmanasyā śṛṇute dabhītaye 
SA_GV01_rv_10_u-2602	RV_10.113.10.1{15} tvaṃ purūṇyā bharā svaśvyā yebhirmaṃsai nivacanāniśaṃsan	tvam purūṇyā bhara su aśvyā yebhiḥ maṃsai nivacanā a niśaṃsan 
