segmentnr	original	analyzed
SA_GSP28_sastrdiu-912	na tāvatsvapnādipratyayāḥ svāṃśāvalambanāḥ,	na tāvat svapna ādi pratyayāḥ sva aṃśa avalambanāḥ 
SA_GSP28_sastrdiu-913	te 'pi bāhyārthamevānyathāsantamevānyathā gṛhṇantīti vakṣyāmaḥ /	te pi bāhya artham eva anyathā asantam eva anyathā gṛhṇanti iti vakṣyāmaḥ 
SA_GSP28_sastrdiu-914	bhavatu vā tatrātmakhyānaṃ,	bhavatu vā tatra ātma khyānam 
SA_GSP28_sastrdiu-915	naitāvatā nīlādipratyayāstathā bhavitumarhanti,	na etāvatā nīla ādi pratyayāḥ tathā bhavitum arhanti 
SA_GSP28_sastrdiu-916	tatra hi nīlamidaṃ pītamidaṃ stambho 'yaṃ ghaṭo 'yamityevamidamākārāspadībhūtaṃ bāhyaṃ nīlādi pratyakṣeṇāvagamyamānaṃ na śakyamanumānenāpahnotum	tatra hi nīlam idam pītam idam stambhaḥ yam ghaṭaḥ yam iti evam idam ākāra āspadībhūtam bāhyam nīla ādi pratyakṣeṇa avagamyamānam na śakyam anumānena apahnotum 
SA_GSP28_sastrdiu-917	ātmagrāhitve hyahaṃ nīlamiti syāt //*//	ātma grāhi tve hi aham nīlam iti syāt 
SA_GSP28_sastrdiu-918	tadevaṃ pratyakṣameva bāhyārthamupasthāpya tadapahnavapravṛttasyānumānasyodayaṃ niruṇaddhi /	tat evam pratyakṣam eva bāhya artham upasthāpya tad apahnava pravṛttasya anumānasya udayam niruṇaddhi 
SA_GSP28_sastrdiu-919	svapnādiṣu tu bādhakena jñānāntareṇa bāhyasadbhāvanirākaraṇādyujyetātmakhyātiḥ /	svapna ādiṣu tu bādhakena jñāna antareṇa bāhya sadbhāva nirākaraṇāt yujyeta ātma khyātiḥ 
SA_GSP28_sastrdiu-920	natviha tathā bādhakamastyanyat bhavaduktādanumānāt /	na tu iha tathā bādhakam asti anyat bhavat uktāt anumānāt 
SA_GSP28_sastrdiu-921	nacānumānamalaṃ bādhitumityuktam /	na ca anumānam alam bādhitum iti uktam 
SA_GSP28_sastrdiu-922	dūṣaṇasahasraṃ cāsyānumānasya vārtike prapañcitamityuparamyate //	dūṣaṇa sahasram ca asya anumānasya vārtike prapañcitam iti uparamyate 
SA_GSP28_sastrdiu-923	yogācārasautrāntikayoḥ kalahaḥ //	yoga ācāra sautrāntikayoḥ kalahaḥ 
SA_GSP28_sastrdiu-924	evamanumāne pratyakṣavirodhena nirākṛte pratyakṣasya bahiḥpravṛttau sāmarthye nāstītyevaṃ pūrvoktākṣepeṇa śūnyastvityādinā sa eva śūnyavādī  #	evam anumāne pratyakṣa virodhena nirākṛte pratyakṣasya bahis pravṛttau sāmarthye na asti iti evam pūrva ukta ākṣepeṇa śūnyaḥ tu ityādinā saḥ eva śūnyavādī 
SA_GSP28_sastrdiu-925	punaḥ pratyakṣavatiṣṭhate /	punar pratyakṣa avatiṣṭhate 
SA_GSP28_sastrdiu-926	tadihaivaṃ cintyate- yadidaṃ nīlamidaṃ pītamidamiti nīlādyākāraṃ vastu prathate tatkiṃ vijñānameva tathā prathate kiṃvā bāhyaṃ vastviti /	tat iha evam cintyate yat idam nīlam idam pītam idam iti nīla ādi ākāram vastu prathate tat kim vijñānam eva tathā prathate kiṃvā bāhyam vastu iti 
SA_GSP28_sastrdiu-927	tadarthamidaṃ vicāryate- kiṃ vijñānaṃ pratyakṣamutānumeyamiti,	tad artham idam vicāryate kim vijñānam pratyakṣam uta anumeyam iti 
SA_GSP28_sastrdiu-928	pratyakṣatve sati nirākārasya pratyakṣagrahaṇayogāt,	pratyakṣa tve sati nirākārasya pratyakṣa grahaṇa yogāt 
SA_GSP28_sastrdiu-929	ākārasya caikasyaiva grahaṇāt gṛhyamāṇa ākāro jñāna evāvatiṣṭhata ityarthasyāgṛhyamāṇatvādasattvameva bhavati /	ākārasya ca ekasya eva grahaṇāt gṛhyamāṇaḥ ākāraḥ jñāne eva avatiṣṭhate iti arthasya a gṛhyamāṇa tvāt asattvam eva bhavati 
SA_GSP28_sastrdiu-930	anumeyatve tu bāhyārthaṃ vinānumānāsaṃbhavādbāhyārthasiddhiḥ /	anumeya tve tu bāhya artham vinā anumāna asaṃbhavāt bāhya artha siddhiḥ 
SA_GSP28_sastrdiu-931	tatra- jñānamevaivamākāramātmanā prathate kutaḥ //	tatra jñānam eva evam ākāram ātmanā prathate kutas 
SA_GSP28_sastrdiu-932	nāpratyakṣasya tasyāsti pramāṇāntarato gatiḥ //	na apratyakṣasya tasya asti pramāṇa antarataḥ gatiḥ 
SA_GSP28_sastrdiu-933	saṃvedyatvācca nīlāderjñānākāratvaniścayaḥ //	saṃvedya tvāt ca nīla ādeḥ jñāna ākāra tva niścayaḥ 
SA_GSP28_sastrdiu-934	arthāntarasya ca grāhyalakṣaṇaṃ nahi yujyate //*//	artha antarasya ca grāhya lakṣaṇam nahi yujyate 
SA_GSP28_sastrdiu-935	yo hi vijñānapratyakṣamicchati tasya jñānameva na sidhyet pramāṇāntarasaṃbhavāt /	yaḥ hi vijñāna pratyakṣam icchati tasya jñānam eva na sidhyet pramāṇa antara saṃbhavāt 
SA_GSP28_sastrdiu-936	anumānamiti cet /	anumānam iti ced 
SA_GSP28_sastrdiu-937	na liṅgābhāvāt /	na liṅga abhāvāt 
SA_GSP28_sastrdiu-938	na tāvadartho liṅgam,	na tāvat arthaḥ liṅgam 
SA_GSP28_sastrdiu-939	vināpi tena suṣuptyādyavasthāyāmarthasadbhāvābhyupagamāt /	vinā api tena suṣupti ādi avasthāyām artha sadbhāva abhyupagamāt 
SA_GSP28_sastrdiu-940	arthavyavahāro liṅgaṃ - sa hi kādācitkaṃ kāraṇaṃ kalpayatīticet,	artha vyavahāraḥ liṅgam sa hi kādācitkam kāraṇam kalpayati iti ced 
SA_GSP28_sastrdiu-941	evantu prāgvyavahārājjñānapratibhāso na syāt /	evam tu prāk vyavahārāt jñāna pratibhāsaḥ na syāt 
SA_GSP28_sastrdiu-942	avyavahārannapi ghaṭaṃ paśyan jāne 'haṃ ghaṭamiti jñānamanusaṃdhatte	avyavahārān api ghaṭam paśyan jāne haṃ ghaṭam iti jñānam anusaṃdhatte 
SA_GSP28_sastrdiu-943	iti pratītisākṣikam /	iti pratīti sākṣikam 
SA_GSP28_sastrdiu-944	arthadharmo jñānajanmā liṅgamiticet / na /	artha dharmaḥ jñāna janmā liṅgam iti ced na 
SA_GSP28_sastrdiu-945	tatsadbhāve pramāṇābhāvāt /	tad sadbhāve pramāṇa abhāvāt 
SA_GSP28_sastrdiu-946	atītānāgatayoścārthayordharmāsaṃbhavādatītādyanumāne jñānasiddhirna syāt,	atīta anāgatayoḥ ca arthayoḥ dharma asaṃbhavāt atīta ādi anumāne jñāna siddhiḥ na syāt 
SA_GSP28_sastrdiu-947	tasmādavaśyaṃ vijñānaṃ pratyakṣameṣitavyam /	tasmāt avaśyam vijñānam pratyakṣam eṣitavyam 
SA_GSP28_sastrdiu-948	evaṃ ca tasyaivāyamākāra iti niṣpramāṇakor'thaḥ //*//	evam ca tasya eva ayam ākāraḥ iti niṣpramāṇakaḥ ṛthaḥ 
SA_GSP28_sastrdiu-949	kiñca vedyatvādapi nīlāderjñānākāratvaṃ,	kiñca vedya tvāt api nīla ādeḥ jñāna ākāra tvam 
SA_GSP28_sastrdiu-950	nahyanātmano nīlasya pītavadvedyatā	na hi anātmanaḥ nīlasya pīta vat vedya tā 
SA_GSP28_sastrdiu-951	saṃbhavati /	saṃbhavati 
SA_GSP28_sastrdiu-952	yadi cārthāntaraṃ nīlaṃ tato 'sya kiṃ lakṣaṇaṃ vedyatvam /	yadi ca artha antaram nīlam kim lakṣaṇam vedya tvam 
SA_GSP28_sastrdiu-953	yadyarthatvalakṣaṇaṃ syāt,	yadi artha tva lakṣaṇam syāt 
SA_GSP28_sastrdiu-954	sarvaṃ sarvasya vedyaṃ syāt vyavasthāhetutvabhāvāt /	sarvam sarvasya vedyam syāt vyavasthā hetu tva bhāvāt 
SA_GSP28_sastrdiu-955	atha vyavasthāpakaṃ - ya evārtho jñānasya hetuḥ,	atha vyavasthāpakam yaḥ eva arthaḥ jñānasya hetuḥ 
SA_GSP28_sastrdiu-956	sa eva vedyo nānya iti cet / na /	saḥ eva vedyaḥ na anyaḥ iti ced na 
SA_GSP28_sastrdiu-957	netrāderapi vedyatvaprasaṅgāt /	netra ādeḥ api vedya tva prasaṅgāt 
SA_GSP28_sastrdiu-958	sādṛśyaṃ hetutvaṃ ca viṣayatvam,	sādṛśyam hetu tvam ca viṣaya tvam 
SA_GSP28_sastrdiu-959	nīlārthaśca nīlajñānena sadṛśo na netramiticet,	nīla arthaḥ ca nīla jñānena sadṛśaḥ na netram iti ced 
SA_GSP28_sastrdiu-960	evamapi samanantarapratyayasya hetutvāt vijñānatvena ca sādṛśyādviṣayatvaṃ syāt //*//	evam api samanantara pratyayasya hetu tvāt vijñāna tvena ca sādṛśyāt viṣaya tvam syāt 
SA_GSP28_sastrdiu-961	athāsādhāraṇatvena viṣayākāreṇa sādṛśyaṃ viṣayalakṣaṇam- jñānatvaṃ hi sarvajñānasādhāraṇaṃ nīlādyākārastu keṣāñcidevāsādharaṇastena tadākāreṇa  #	atha asādhāraṇa tvena viṣaya ākāreṇa sādṛśyam viṣaya lakṣaṇam jñāna tvam hi sarva jñāna sādhāraṇam nīla ādi ākāraḥ tu keṣāñcid eva asādharaṇaḥ tena tad ākāreṇa 
SA_GSP28_sastrdiu-962	sādṛśyaṃ viṣayatvam /	sādṛśyam viṣaya tvam 
SA_GSP28_sastrdiu-963	evamapi dhārāvāhikeṣu pūrvamuttarasya viṣayaḥ syāt- ubhayornīlarūpatvāddhetutvācca //*//	evam api dhārāvāhikeṣu pūrvam uttarasya viṣayaḥ syāt ubhayoḥ nīla rūpa tvāt hetu tvāt ca 
SA_GSP28_sastrdiu-964	syānmatam- na sādṛśyaṃ viṣayatvaṃ kintu yo jñāne nīlādyākāraviśeṣasamarthako hetuḥ sa viṣayaḥ,	syāt matam na sādṛśyam viṣayatvam kintu yaḥ jñāne nīla ādi ākāra viśeṣa samarthakaḥ hetuḥ sa viṣayaḥ 
SA_GSP28_sastrdiu-965	samanantarapratyayastu na nīlādyākārāṇāṃ samarpakaḥ /	samanantara pratyayaḥ tu na nīla ādi ākārāṇām samarpakaḥ 
SA_GSP28_sastrdiu-966	tathāsati nīlajñānāntaraṃ sarvadaiva nīlavijñānaṃ syāt /	tathā asati nīla jñāna antaram sarvadā eva nīla vijñānam syāt 
SA_GSP28_sastrdiu-967	tatraikasminsaṃtāne nīlapītādivicitrārthasaṃnidhiviśeṣakṛtaścāyaṃ vicitrākārodaya ityarthasyaiva grāhyatvam //	tatra ekasmin saṃtāne nīla pīta ādi vicitra artha saṃnidhi viśeṣa kṛtaḥ ca ayam vicitra ākāra udayaḥ iti arthasya eva grāhya tvam 
SA_GSP28_sastrdiu-968	punaryogācāraśaṅkā /	punar yoga ācāra śaṅkā 
SA_GSP28_sastrdiu-969	nanu kāryabhūtasamaye kāraṇabhūtasyārthasya kṣaṇikatvenātītatvātkathaṃ pratyakṣagrāhyatvam,	nanu kārya bhūta samaye kāraṇa bhūtasya arthasya kṣaṇika tvena atīta tvāt katham pratyakṣa grāhya tvam 
SA_GSP28_sastrdiu-970	etadevārthasya grāhyatvaṃ yajjñānākārarpaṇakṣamahetutvam /	etat eva arthasya grāhya tvam yat jñāna ākāra arpaṇa kṣama hetu tvam 
SA_GSP28_sastrdiu-971	yathāhuḥ- bhinnakālaṃ kathaṃ grāhyamiti cedgrāhyatāṃ viduḥ //	yathā āhuḥ bhinna kālam katham grāhyam iti ced grāhya tām viduḥ 
SA_GSP28_sastrdiu-972	hetutvameva tadyuktaṃ jñānākārārpaṇakṣamam iti /	hetu tvam eva tat yuktam jñāna ākāra arpaṇa kṣamam iti 
SA_GSP28_sastrdiu-973	yadyevaṃ kasyāyamākāro yo vartamānaḥ prathate,	yadi evam kasya ayam ākāraḥ yaḥ vartamānaḥ prathate 
SA_GSP28_sastrdiu-974	yadi jñānasyaiva tarhi arthasyāprathamānasya sadbhāve jñānaṃ prati hetutve ca kaṃ pramāṇam /	yadi jñānasya eva tarhi arthasya aprathamānasya sadbhāve jñānam prati hetu tve ca kam pramāṇam 
SA_GSP28_sastrdiu-975	jñānavaicitryameva,	jñāna vaicitryam eva 
SA_GSP28_sastrdiu-976	na hi tatsamanantarapratyayamātrātsaṃbhavatītyuktam /	na hi tad samanantara pratyaya mātrāt saṃbhavati iti uktam 
SA_GSP28_sastrdiu-977	evaṃ tarhyanumeyor'thaḥ kathaṃ pratyakṣagrāhya ityucyate /	evam tarhi anumeya ūrthaḥ katham pratyakṣa grāhyaḥ iti ucyate 
SA_GSP28_sastrdiu-978	etadeva hi pratyakṣagrāhyatvamarthasya yatsākṣādākārasamarpaṇena hetutvam,	etat eva hi pratyakṣa grāhya tvam arthasya yat sākṣāt ākāra samarpaṇena hetu tvam 
SA_GSP28_sastrdiu-979	yastu paraṃparayā jñānākārasamarpako hetuśca so 'numeyaḥ /	yaḥ tu paraṃparayā jñāna ākāra samarpakaḥ hetuḥ ca saḥ nu meyaḥ 
SA_GSP28_sastrdiu-980	tadyathā- vahnisvalakṣaṇaṃ dhūmasvalakṣaṇataddarśanatadvikalpapraṇāḍyā vahnijñānaṃ janayadanumeyam /	tat yathā vahni sva lakṣaṇam dhūma sva lakṣaṇa tad darśana tad vikalpa praṇāḍyā vahni jñānam janayat anumeyam 
SA_GSP28_sastrdiu-981	ata eva pratyakṣamanumānaṃ ca dve eva pramāṇe jñānārthayorbhinnatvāt /	atas eva pratyakṣam anumānam ca dve eva pramāṇe jñāna arthayoḥ bhinna tvāt 
SA_GSP28_sastrdiu-982	asati tādātmye tadutpattinibandhana eva jñānādarthaniścayaḥ /	asati tādātmye tad utpatti nibandhanaḥ eva jñānāt artha niścayaḥ 
SA_GSP28_sastrdiu-983	tatra sākṣādutpattau pratyakṣaṃ praṇāḍyau tvanumānamiti dve eva vidhe /	tatra sākṣāt utpattau pratyakṣam praṇāḍyau tu anumānam iti dve eva vidhe 
SA_GSP28_sastrdiu-984	eta eva viṣayasādṛśyameva prāmāṇyaṃ tadadhīnatvādarthaviśeṣavyavasthāpanasya /	ete eva viṣaya sādṛśyam eva prāmāṇyam tad adhīna tvāt artha viśeṣa vyavasthāpanasya 
SA_GSP28_sastrdiu-985	na hi jñānamityeva nīlavedanaṃ bhavati pītādāvapi tulyatvāt /	na hi jñānam iti eva nīla vedanam bhavati pīta ādau api tulya tvāt 
SA_GSP28_sastrdiu-986	nīlimnā tu nīlavedanasiddhiḥ /	        
SA_GSP28_sastrdiu-987	yathāhuḥ- nahi saṃvittisattayaiva tadvedanā yuktā tasyāḥ sarvatrāviśeṣādaviśeṣaprasaṅgāt,	yathā āhuḥ nahi saṃvitti sattayā eva tad vedanā yuktā tasyāḥ sarvatra aviśeṣāt aviśeṣa prasaṅgāt 
SA_GSP28_sastrdiu-988	tāṃ tu sārūpyamāviśat sarūpayituṃ ghaṭayediti /	tām tu sārūpyam āviśat sarūpayitum ghaṭayet iti 
SA_GSP28_sastrdiu-989	tasmātsākāre vijñāne siddhamarthasya sattvaṃ grāhyalakṣaṇaṃ ceti sautrāntikāḥ //	tasmāt sa ākāre vijñāne siddham arthasya sattvam grāhya lakṣaṇam ca iti sautrāntikāḥ 
SA_GSP28_sastrdiu-990	atra vadāmaḥ- syādidaṃ grāhyalakṣaṇaṃ yadyarthasyākārasamarpakatve hetutve vā pramāṇaṃ syāt,	atra vadāmaḥ syāt idam grāhya lakṣaṇam yadi arthasya ākāra samarpaka tve hetu tve vā pramāṇam syāt 
SA_GSP28_sastrdiu-991	natu tadasti,	na tu tat asti 
SA_GSP28_sastrdiu-992	samanantarapratyayaviśeṣādeva vicitrākārodayasaṃbhavāt /	samanantara pratyaya viśeṣāt eva vicitra ākāra udaya saṃbhavāt 
SA_GSP28_sastrdiu-993	tathāhi- tvayāpi hi svapnāvasthāyāmasatyapyarthasaṃnidhau jñānavaicitryadarśanādavaśyaṃ samanantarapratyayakṛtatvamaṅgīkartavyam /	tathā hi tvayā api hi svapna avasthāyām asati api artha saṃnidhau jñāna vaicitrya darśanāt avaśyam samanantara pratyaya kṛta tvam aṅgīkartavyam 
SA_GSP28_sastrdiu-994	evañcejjāgratpratyayānāmapi tathaivāstu kimarthagrahaṇena,	evam ced jāgrat pratyayānām api tathā evā astu kim artha grahaṇena 
SA_GSP28_sastrdiu-995	ato na hetutvaṃ grāhyalakṣaṇam //*//	atas na hetu tvam grāhya lakṣaṇam 
SA_GSP28_sastrdiu-996	atha jñāninibandhano yatropādānādivyavahāraḥ sa viṣaya ityucyate,	atha jñāni nibandhanaḥ yatra upādāna ādi vyavahāraḥ sa viṣayaḥ iti ucyate 
SA_GSP28_sastrdiu-997	tathāsati nīlajñānasya nīlāntargatāḥ paramāṇavo rasādayaśca viṣayabhāvamaśruvīran,	tathā asati nīla jñānasya nīla antargatāḥ paramāṇavaḥ rasa ādayaḥ ca viṣaya bhāvam aśruvīran 
SA_GSP28_sastrdiu-998	upādīyaṃmānatvāt //*//	upādīyaṃmāna tvāt 
SA_GSP28_sastrdiu-999	atha dravyasyaivopādānaṃ na guṇānāṃ rasādīnām /	atha dravyasya eva upādānam na guṇānām rasa ādīnām 
SA_GSP28_sastrdiu-1000	evaṃ tarhi rūpasyāpi viṣayatvaṃ na syāt /	evam tarhi rūpasya api viṣaya tvam na syāt 
SA_GSP28_sastrdiu-1001	kiñca sukhārthaḥ sarvo	kiñca sukha arthaḥ 
SA_GSP28_sastrdiu-1002	vyavahāro 'to 'nubhūte sukhe na kaścitsukhaviṣayo vyavahāro 'sti na ca saṃbhavati,	sukhe na kaścid sukha viṣayaḥ vyavahāraḥ sti na ca saṃbhavati 
SA_GSP28_sastrdiu-1003	yataḥ sukhapratibaddhavyavahāro 'stīti kathaṃ tasya viṣayatvam //*//	yatas sukha pratibaddha vyavahāraḥ sti iti katham tasya viṣaya tvam 
SA_GSP28_sastrdiu-1004	nanu nopādānameva vyavahāraḥ śabdaprayogasyāpi vyavahāratvāt,	nanu nā upādānam eva vyavahāraḥ śabda prayogasya api vyavahāra tvāt 
SA_GSP28_sastrdiu-1005	ato nīlajñānanibandhanaśabdaprayogagocaratvānnīlimno viṣayatvam,	atas nīla jñāna nibandhana śabda prayoga gocara tvāt nīlimnaḥ viṣaya tvam 
SA_GSP28_sastrdiu-1006	evaṃ sukhāderapi /	evam sukha ādeḥ api 
SA_GSP28_sastrdiu-1007	evamapyupādānasyāpi vyavahāratvāttagadviṣayabhūtānāṃ paramāṇūnāṃ viṣayattvāpattistadavasthaiva //*//	evam api upādānasya api vyavahāra tvāt tagat viṣaya bhūtānām paramāṇūnām viṣaya tva āpattiḥ tad avasthā eva 
SA_GSP28_sastrdiu-1008	kiñca na śabdaprayogavaśena jñānasya viṣayanirūpaṇaṃ śakyaṃ viparītatvāt /	kiñca na śabda prayoga vaśena jñānasya viṣaya nirūpaṇam śakyam viparīta tvāt 
SA_GSP28_sastrdiu-1009	arthasaṃbaddhaśabdaprayogo hi lakṣaṇaṃ na śabdamātraprayogaḥ,	artha saṃbaddha śabda prayogaḥ hi lakṣaṇam na śabda mātra prayogaḥ 
SA_GSP28_sastrdiu-1010	pratyāyyapratyāyakatvameva hi śabdārthayoḥ saṃbandho 'to yadarthaviṣayaṃ jñānaṃ yaḥ śabdo janayati sa tasya vācyaḥ,	pratyāyya pratyāyaka tvam eva hi śabda arthayoḥ yad artha viṣayam jñānam yaḥ śabdaḥ janayati sa tasya vācyaḥ 
SA_GSP28_sastrdiu-1011	ato jñānaviṣayanirūpaṇapūrvakaṃ śabdaviṣayanirūpaṇaṃ,	atas jñāna viṣaya nirūpaṇa pūrvakam śabda viṣaya nirūpaṇam 
SA_GSP28_sastrdiu-1012	tadadhīne tu tasmin duruttaramitaretarāśrayamāpadyeta //*//	tad adhīne tu tasmin duruttaram itaretarāśrayam āpadyeta 
SA_GSP28_sastrdiu-1013	jñānajanyātiśayabhāktvameva grāhyatvamiti cet,	jñāna janya atiśaya bhāktvam eva grāhya tvam iti ced 
SA_GSP28_sastrdiu-1014	nāsāvupalabhyate,	na asau upalabhyate 
SA_GSP28_sastrdiu-1015	na ca saṃbhavati bhūtabhaviṣyatorityuktam /	na ca saṃbhavati bhūta bhaviṣyatoḥ iti uktam 
SA_GSP28_sastrdiu-1016	atha saṃprayuktendriyajaṃ jñānaṃ yatvyāptaliṅgajaṃ vā sa viṣaya iti matam /	atha saṃprayukta indriya jam jñānam yat vyāpta liṅga jam vā sa viṣayaḥ iti matam 
SA_GSP28_sastrdiu-1017	tato netrajanyasya nīlajñānasya sparśo viṣayaḥ syāt,	tatas netra janyasya nīla jñānasya sparśaḥ viṣayaḥ syāt 
SA_GSP28_sastrdiu-1018	asti ca sparśasyāpi rūpasyaiva saṃyuktasamavāyalakṣaṇaḥ saṃbandho netreṇa /	asti ca sparśasya api rūpasya eva saṃyukta samavāya lakṣaṇaḥ saṃbandhaḥ netreṇa 
SA_GSP28_sastrdiu-1019	tathā gandhaliṅgasya rasānumānasya rūpamapi viṣayaḥ syāt,	tathā gandha liṅgasya rasa anumānasya rūpam api viṣayaḥ syāt 
SA_GSP28_sastrdiu-1020	rūpeṇāpi raseneva tasya vyāptatvāt /	rūpeṇa api rasena iva tasya vyāpta tvāt 
SA_GSP28_sastrdiu-1021	tasmāt jñānātmakatvameva nīlāderviṣayalakṣaṇamiti siddhaṃ tādātmyam //*//	tasmāt jñāna ātmaka tvam eva nīla ādeḥ viṣaya lakṣaṇam iti siddham tādātmyam 
SA_GSP28_sastrdiu-1022	sahopalambhaniyamo 'pi jñānārthayoraniyamavyāptaṃ bhedaṃ vyāpakaviruddhopalabdhyā pratiṣedhanna bhedamupasthāpayati,	saha upalambha niyamaḥ pi jñāna arthayoḥ aniyama vyāptam bhedam vyāpaka viruddha upalabdhyā pratiṣedhan na bhedam upasthāpayati 
SA_GSP28_sastrdiu-1023	bhinnānāṃ ghaṭapaṭādīnāmaniyatasahopalambhatvāt /	bhinnānām ghaṭa paṭa ādīnām aniyata sahopalambha tvāt 
SA_GSP28_sastrdiu-1024	na cāsiddhau vedyopalambhasamaye vitterupalambha iti vācyam /	na ca asiddhau vedya upalambha samaye vitteḥ upalambhaḥ iti vācyam 
SA_GSP28_sastrdiu-1025	uttarakālaṃ sahaiva jñānena viṣayasmaraṇadarśanāt- jñāto ghaṭa iti /	uttara kālam saha eva jñānena viṣaya smaraṇa darśanāt jñātaḥ ghaṭaḥ iti 
SA_GSP28_sastrdiu-1026	nacānubhūtasya smaraṇaṃ saṃbhavati,	na ca anubhūtasya smaraṇam saṃbhavati 
SA_GSP28_sastrdiu-1027	tasmādutpattivelāyāmeva jñānasya	tasmāt utpatti velāyām eva jñānasya 
SA_GSP28_sastrdiu-1028	prakāśanamaṅgīkartavyam /	prakāśanam aṅgīkartavyam 
SA_GSP28_sastrdiu-1029	na ca nirākārasyopalabdhirastīti siddhaṃ jñānātmakatvaṃ nīlādeḥ /	na ca nirākārasya upalabdhiḥ asti iti siddham jñāna ātmaka tvam nīla ādeḥ 
SA_GSP28_sastrdiu-1030	avaśyaṃ ca svapnādibodhe bandhyāsuto yāti,	avaśyam ca svapna ādi bodhe bandhyā sutaḥ yāti 
SA_GSP28_sastrdiu-1031	aṅgulyagre hastiyūthaśatamityādau cātyantāsaṃbhavādbāhyasya jñānātmakatvamevākāraṇāmabhyupagantavyam /	aṅguli agre hasti yūtha śatam ityādau ca atyanta asaṃbhavāt bāhyasya jñāna ātmaka tvam eva akāraṇām abhyupagantavyam 
SA_GSP28_sastrdiu-1032	tathānyatrāpyastu,	tathā anyatra api astu 
SA_GSP28_sastrdiu-1033	tasmānna bāhyamastīti prāpte /	tasmāt na bāhyam asti iti prāpte 
SA_GSP28_sastrdiu-1034	yogācāramatakhaṇḍanam /	       
SA_GSP28_sastrdiu-1035	abhidhīyate nīlādivitterātmāṃśagrāhitvaṃ kena gṛhyate /	abhidhīyate nīla ādi vitteḥ ātma aṃśa grāhi tvam kena gṛhyate 
SA_GSP28_sastrdiu-1036	nātmanā nānyasaṃvittyā sāpi hyātmāvasāyinī //	na ātmanā na anya saṃvittyā sā api hi ātma avasāyinī 
SA_GSP28_sastrdiu-1037	ajñānasthiracitratvabāhyatvāderanātmanaḥ //	ajñāna sthira citra tva bāhya tva ādeḥ anātmanaḥ 
SA_GSP28_sastrdiu-1038	asato vā sato vāpi kathaṃ vijñānavedyatā //	asataḥ vā sataḥ vā api katham vijñāna vedya tā 
SA_GSP28_sastrdiu-1039	vijñānavādī hi sarvameva vijñānamātmanameva gṛhṇāti nānyat,	vijñāna vādī hi sarvam eva vijñānam ātmanam eva gṛhṇāti na anyat 
SA_GSP28_sastrdiu-1040	atmanaiva ca gṛhyate nānyena,	atmanā eva ca gṛhyate na anyena 
SA_GSP28_sastrdiu-1041	tasyāpyanyasya svātmaparyavasāyitvāditi vadati /	tasya api anyasya sva ātma paryavasāyi tvāt iti vadati 
SA_GSP28_sastrdiu-1042	yathoktam- nānyo 'nubhāvyo buddhyāsti tasyā nānubhavo 'paraḥ //	yathā uktam na anyaḥ nubhāvyaḥ buddhyā asti tasyāḥ paraḥ 
SA_GSP28_sastrdiu-1043	grāhyagrāhakavaidhuryātsvayaṃ saiva prakāśate iti tamevaṃvādinaṃ pratyucyate- nīlajñānasyātmāvasāyitvaṃ nīlasya ca vijñānakāraṇatvaṃ kena jñānena  #	grāhya grāhaka vaidhuryāt svayam sā eva prakāśate iti tam evaṃvādinam pratyucyate nīla jñānasya ātma avasāyi tvam nīlasya ca vijñāna kāraṇa tvam kena jñānena 
SA_GSP28_sastrdiu-1044	gṛhyate /	gṛhyate 
SA_GSP28_sastrdiu-1045	na tāvadātmanaiva - nahi nīlamidamityatra svātmaparyavasāyitvaṃ nīlākārasya ca jñānātmakatvaṃ prakāśate nīmamātraprakāśanāt /	na tāvat ātmanā eva nahi nīlam idam iti atra svātma paryavasāyi tvam nīla ākārasya ca jñāna ātmaka tvam prakāśate nīma mātra prakāśanāt 
SA_GSP28_sastrdiu-1046	saṃvedyatvagrāhyalakṣaṇayogasahopalambhaniyamādiliṅganimittakena tvanumānenaiva tadavagantavyaṃ- tadapi tvanumānamātmāṃśagrāhi cet,	saṃvedya tva grāhya lakṣaṇa yoga saha upalambha niyama ādi liṅga nimittakena tu anumānena eva tat avagantavyam tat api tu anumānam ātma aṃśa grāhi ced 
SA_GSP28_sastrdiu-1047	na jñānāntarasya svātmaparyavasāyitāṃ grahītumalam //*//	na jñāna antarasya sva ātma paryavasāyi tām grahītum alam 
SA_GSP28_sastrdiu-1048	athānumānaṃ na svātmāṃśagrāhi,	atha anumānam na sva ātma aṃśa grāhi 
SA_GSP28_sastrdiu-1049	tato nīlādivijñānaiḥ kimaparāddhaṃ,	tatas nīla ādi vijñānaiḥ kim aparāddham 
SA_GSP28_sastrdiu-1050	yena tānīdaṅkārāspadībhūtabāhyanīlādiprakāśakatvenāvabhāsamānānyapi svātmanyevāvarudhyante /	yena tāni idaṅkāra āspadībhūta bāhya nīla ādi prakāśaka tvena avabhāsamānāni api sva ātmani eva avarudhyante 
SA_GSP28_sastrdiu-1051	na hi tadaitadvaktuṃ śakyam- nānātmanaḥ saṃvedanaṃ grāhyalakṣaṇaṃ sahopalambhaniyamo vā saṃbhavatīti /	na hi tadā etat vaktum śakyam na anātmanaḥ saṃvedanam grāhya lakṣaṇam saha upalambha niyamaḥ vā saṃbhavati iti 
SA_GSP28_sastrdiu-1052	teṣāṃ sarveṣāmevātasminnaiva bhavadīye 'numāne vyabhicārāt /	teṣām sarveṣām eva a tasmin na eva bhavadīye numāne vyabhicārāt 
SA_GSP28_sastrdiu-1053	tatkhalvātmānamatikramya nīlādivitternīlādyātmabhūtasvātmāṃśāvasāyitāṃ gṛhṇātītyabhyupagantavyam /	tat khalu ātmānam atikramya nīla ādi vitteḥ nīla ādi ātma bhūta sva ātma aṃśa avasāyi tām gṛhṇāti iti abhyupagantavyam 
SA_GSP28_sastrdiu-1054	tasyāpi	tasya api 
SA_GSP28_sastrdiu-1055	svātmaparyavasāyitve nīlabuddhestadvaśena svātmāṃśagrāhitā na siddhyet /	svātma paryavasāyi tve nīla buddheḥ tad vaśena svātma aṃśa grāhi tā na siddhyet 
SA_GSP28_sastrdiu-1056	āhaca- caitrādipratyayānāṃ ca nirālambanatā yadi /	caitra ādi pratyayānām ca nirālambana tā yadi 
SA_GSP28_sastrdiu-1057	dharmabhūtā na gṛhyeta sādhanotthitayā dhiyā //	dharma bhūtā na gṛhyeta sādhana utthitayā dhiyā 
SA_GSP28_sastrdiu-1058	tato viṣayanānātvātpratiyogyanirākṛtā /	tatas viṣaya nānātvāt pratiyogī anirākṛtā 
SA_GSP28_sastrdiu-1059	rūpātsālambanaprāptiḥ satī kena nicāryate iti //*//	rūpāt sa ālambana prāptiḥ satī kena nicāryate iti 
SA_GSP28_sastrdiu-1060	kiñcājñānamityasya jñānasya jñānābhāvo grāhyaḥ,	kiñca ajñānam iti asya jñānasya jñāna abhāvaḥ grāhyaḥ 
SA_GSP28_sastrdiu-1061	na ca jñānābhāvasya jñānātmatā saṃbhavati,	na ca jñāna abhāvasya jñāna ātma tā saṃbhavati 
SA_GSP28_sastrdiu-1062	atyantaviparītatvāt /	atyanta viparīta tvāt 
SA_GSP28_sastrdiu-1063	tathā- tadevegadamiti jñāne pūrvāparakālāvasthāyitvaṃ prakāśate,	tathā tat eva igadam iti jñāne pūrva apara kāla avasthāyi tvam prakāśate 
SA_GSP28_sastrdiu-1064	naca kṣaṇikasya jñānasya sthāyitvamātmā saṃbhavati /	na ca kṣaṇikasya jñānasya sthāyi tvam ātmā saṃbhavati 
SA_GSP28_sastrdiu-1065	tathā- citrabuddhau nānākāraṇāmavabhāsaḥ /	tathā citra buddhau nānā kāraṇām avabhāsaḥ 
SA_GSP28_sastrdiu-1066	nacaikasya jñānasya nānākāratā saṃbhavati //*//	na ca ekasya jñānasya nānā ākāra tā saṃbhavati 
SA_GSP28_sastrdiu-1067	nanvarthasyāpi sthāyitvamekasya ca nānākāraṇatvaṃ na saṃbhavatyeva,	nanu arthasya api sthāyi tvam ekasya ca nānā kāraṇa tvam na saṃbhavati eva 
