segmentnr	original	analyzed
SA_K10_sf75_sc-0	Śaktisūtra	śaktisūtra 
SA_K10_sf75_sc-1	ye śramaṇā vā brāhmaṇā vā stoka stokaṁ muhūrta muhūrtaṁ sarva satva prāṇa bhūteṣu	ye śramaṇāḥ vā brāhmaṇāḥ vā stoka stoka muhūrta muhūrta sarva satva prāṇa bhūteṣu 
SA_K10_sf75_sc-2	maitraṁ cittaṁ bhāvayeyuḥ … teṣāṁ sa cet kaścid upasaṁkramati vyāḍo vā yakṣo vā avatara	maitra citta bhāvayeyuḥ teṣām sa ced kaścid upasakramati vyāḍaḥ vā yakṣaḥ vā avatara 
SA_K10_sf75_sc-3	prekṣī … raṁ na labhate ālaṁbanaṁ anyatra sa vyāḍo vā yakṣo vā amanuṣyo vā naivāsiko vā … syāt /	prekṣī na labhate anyatra sa vyāḍaḥ vā yakṣaḥ vā amanuṣyaḥ vā naivāsikaḥ vā syāt 
SA_K10_sf75_sc-4	tasmāt tarhi bhikṣava stoka stokaṁ muhūrta muhūrttaṁ pūrvavad yāvat godohana mātraṁ maitra-cittaṁ bhāvayitavyam //	tasmāt tarhi bhikṣavaḥ stoka stoka muhūrta muhūrtta pūrvavat yāvat godohana mātra maitracitta bhāvayitavyam 
