segmentnr	original	analyzed
SA_K10_klpdrapu-735	kiyat kālaṃ ca jīveyaṃ kāṣṭhapāṣāṇavat sthitaḥ // KDA_352 //	kiyat kālam ca jīveyam kāṣṭha pāṣāṇa vat sthitaḥ 
SA_K10_klpdrapu-736	kevalaṃ svamanas tuṣṭyai dhyānaṃ saukhyārthasādhanam* /	kevalam sva manaḥ tuṣṭyai dhyānam saukhya artha sādhanam 
SA_K10_klpdrapu-737	sukhaṃ labdhvāpi kiṃ sāraṃ satvānugrahaṇaṃ vinā // KDA_353 //	sukham labdhvā api kim sāram satva anugrahaṇam vinā 
SA_K10_klpdrapu-738	tasmād dhyānāt samutthāya satvānugrahakāraṇāt* /	tasmāt dhyānāt samutthāya satva anugraha kāraṇāt 
SA_K10_klpdrapu-739	ṛddhiṃ pradarśya saṃbodhau sthāpayiṣye mahajjanān* // KDA_354 //	ṛddhim pradarśya saṃbodhau sthāpayiṣye mahat janān 
SA_K10_klpdrapu-740	iti niścitya cittena sa subhūtiḥ samṛddhimān* /	iti niścitya cittena sa subhūtiḥ samṛddhimān 
SA_K10_klpdrapu-741	satvānāṃ vinayārthena prātihāryam adarśayat* // KDA_355 //	satvānām vinaya arthena prātihāryam adarśayat 
SA_K10_klpdrapu-742	tadṛddhinirmitāny eva garuḍānāṃ mahaujasām* /	tad ṛddhi nirmitāni eva garuḍānām mahā ojasām 
SA_K10_klpdrapu-743	pañca kulaśatāny atra prasasrire samantataḥ // KDA_356 //	pañca kula śatāni atra prasasrire samantataḥ 
SA_K10_klpdrapu-744	etāṃś ca garudān dṛṣṭvā nāgāḥ saṃtrasitās tataḥ /	etān ca garudān dṛṣṭvā nāgāḥ saṃtrasitāḥ tatas 
SA_K10_klpdrapu-745	itas tataḥ samudbhrāntāḥ subhūteḥ śaraṇaṃ yayuḥ // KDA_357 //	itas tatas samudbhrāntāḥ subhūteḥ śaraṇam yayuḥ 
SA_K10_klpdrapu-746	atha svarddhibalenaiva samāśvāsya subhūtinā /	atha sva ṛddhi balena eva samāśvāsya subhūtinā 
SA_K10_klpdrapu-747	sarve nāgāḥ suparṇebhyaḥ paritrātāś ca sarvataḥ // KDA_358 //	sarve nāgāḥ suparṇebhyaḥ paritrātāḥ ca sarvatas 
SA_K10_klpdrapu-748	-------------------- Vaidya, p. 288 --------------------	vaidya p 
SA_K10_klpdrapu-749	punas tena suparṇānāṃ vinayārthaṃ subhūtinā /	punar tena suparṇānām vinaya artham subhūtinā 
SA_K10_klpdrapu-750	svarddhivalaprabhāveṇa mahān nāgo vinirmitaḥ // KDA_359 //	sva ṛddhi vala prabhāveṇa mahān nāgaḥ vinirmitaḥ 
SA_K10_klpdrapu-751	tenāpy evaṃ suparṇānāṃ pañca kulaśatāni ca /	tena api evam suparṇānām pañca kula śatāni ca 
SA_K10_klpdrapu-752	abhidrutāni nāgena samantata itas tataḥ // KDA_360 //	abhidrutāni nāgena samantataḥ itas tatas 
SA_K10_klpdrapu-753	tenaivābhidrutāḥ sarve garuḍās trāsam āgatāḥ /	tena eva abhidrutāḥ sarve garuḍāḥ trāsam āgatāḥ 
SA_K10_klpdrapu-754	itas tataḥ samudbhrāntāḥ subhūteḥ śaraṇaṃ yayuḥ // KDA_361 //	itas tatas samudbhrāntāḥ subhūteḥ śaraṇam yayuḥ 
SA_K10_klpdrapu-755	subhūtinā tathā caivaṃ sarve te garuḍā api /	subhūtinā tathā ca evam sarve te garuḍāḥ api 
SA_K10_klpdrapu-756	svarddhibalaprabhāveṇa samāśvāsya surakṣitāḥ // KDA_362 //	sva ṛddhi bala prabhāveṇa samāśvāsya su rakṣitāḥ 
SA_K10_klpdrapu-757	evam ṛddhiprabhāvāṇi subhūtes tasya sadyateḥ /	evam ṛddhi prabhāvāṇi subhūteḥ tasya sat yateḥ 
SA_K10_klpdrapu-758	dṛṣṭvā sarve janaughās te saharṣādbhutam āyayuḥ // KDA_363 //	dṛṣṭvā sarve jana oghāḥ te sa harṣa adbhutam āyayuḥ 
SA_K10_klpdrapu-759	dhanyo 'yam ṛddhimān bhikṣur arhan saṃbuddhasevakaḥ /	dhanyaḥ yam ṛddhimān bhikṣuḥ arhan saṃbuddha sevakaḥ 
SA_K10_klpdrapu-760	yenaite rakṣitāḥ sarve nāgāś ca garuḍā api // KDA_364 //	yena ete rakṣitāḥ sarve nāgāḥ ca garuḍāḥ api 
SA_K10_klpdrapu-761	iti so 'rhan subhūtis tān sarvān dṛṣṭvā prasannitān* /	iti saḥ rhan subhūtiḥ tān sarvān dṛṣṭvā prasannitān 
SA_K10_klpdrapu-762	saddharme vinayārthena maitrīdharmam upādiśat* // KDA_365 //	saddharme vinaya arthena maitrī dharmam upādiśat 
SA_K10_klpdrapu-763	śṛṇudhvaṃ madvacaḥ sarve nāgāś ca garuḍās tathā /	śṛṇudhvam mad vacaḥ sarve nāgāḥ ca garuḍāḥ tathā 
SA_K10_klpdrapu-764	yadi me śaraṇaṃ yātha ramadhvaṃ maitramānasāḥ // KDA_366 //	yadi me śaraṇam yātha ramadhvam maitra mānasāḥ 
SA_K10_klpdrapu-765	ye ete sukhino loke sarve te maitracāriṇaḥ /	ye ete sukhinaḥ loke sarve te maitra cāriṇaḥ 
SA_K10_klpdrapu-766	ye ete duḥkhino loke sarve te krodhino narāḥ // KDA_367 //	ye ete duḥkhinaḥ loke sarve te krodhinaḥ narāḥ 
SA_K10_klpdrapu-767	tasmāt krodhaprahāṇāya kriyatāṃ yatnam ādarāt* /	tasmāt krodha prahāṇāya kriyatām yatnam ādarāt 
SA_K10_klpdrapu-768	yāvac citte sthitaṃ krodhaṃ tāvan maitrī na bhāvyate // KDA_368 //	yāvat citte sthitam krodham tāvat maitrī na bhāvyate 
SA_K10_klpdrapu-769	na ca dveṣasamaṃ pāpaṃ na ca maitrīsamaṃ tapaḥ /	na ca dveṣa samam pāpam na ca maitrī samam tapaḥ 
SA_K10_klpdrapu-770	tasmān maitrī prayatnena bhāvanīyā sadādarāt* // KDA_369 //	tasmāt maitrī prayatnena bhāvanīyā sat ādarāt 
SA_K10_klpdrapu-771	manaḥ śamaṃ na gṛhṇāti na prītisukham aśnute /	manaḥ śamam na gṛhṇāti na prīti sukham aśnute 
SA_K10_klpdrapu-772	na nidrāṃ na dhṛtiṃ yāti dveṣaśalye hṛdi sthite // KDA_370 //	na nidrām na dhṛtim yāti dveṣa śalye hṛdi sthite 
SA_K10_klpdrapu-773	na dviṣantaḥ kṣayaṃ yānti yāvajjīvam api ghnataḥ /	na dviṣantaḥ kṣayam yānti yāvajjīvam api ghnataḥ 
SA_K10_klpdrapu-774	krodham ekaṃ tu yo hanyāt tena sarve dviṣo hatāḥ // KDA_371 //	krodham ekam tu yaḥ hanyāt tena sarve dviṣaḥ hatāḥ 
SA_K10_klpdrapu-775	vikalpen dhanadīptena jantuḥ krodhahavir bhujā /	vikalpen dhana dīptena jantuḥ krodha haviḥ bhujā 
SA_K10_klpdrapu-776	dahaty ātmānam evādau parān dhakṣyati vā na vā // KDA_372 //	dahati ātmānam eva ādau parān dhakṣyati vā na vā 
SA_K10_klpdrapu-777	jarā rūpavatāṃ krodhas tamaś cakṣuṣmatām api /	jarā rūpavatām krodhaḥ tamaḥ cakṣuṣmatām api 
SA_K10_klpdrapu-778	bandho dharmārthakāmānāṃ tasmāt krodho nivāryatām* // KDA_373 //	bandhaḥ dharma artha kāmānām tasmāt krodhaḥ nivāryatām 
SA_K10_klpdrapu-779	divyabhogānubhoktā ca prāsāde maṇimaṇḍite /	divya bhoga anubhoktā ca prāsāde maṇi maṇḍite 
SA_K10_klpdrapu-780	supto 'pi na labhen nidrāṃ krodhaparyākulo naraḥ // KDA_374 //	na labhet nidrām krodha paryākulaḥ naraḥ 
SA_K10_klpdrapu-781	-------------------- Vaidya, p. 289 --------------------	vaidya p 
SA_K10_klpdrapu-782	ṛṣibhir yogibhiś cāmbu- phalamūlāditoṣitaiḥ /	ṛṣibhiḥ yogibhiḥ ca ambu phala mūla ādi toṣitaiḥ 
SA_K10_klpdrapu-783	dagdhā janapadāś cāpi krodhāc chāpahutāśanaiḥ // KDA_375 //	dagdhāḥ janapadāḥ ca api krodhāt śāpa hutāśanaiḥ 
SA_K10_klpdrapu-784	yac chāṃkaro mahāraudro nirghṛṇo dṛkprabhānalaiḥ /	yat śāṃkaraḥ mahā raudraḥ nirghṛṇaḥ dṛś prabhā analaiḥ 
SA_K10_klpdrapu-785	dadāha brahmajaṃ kāmaṃ tac ca krodhaprabhāvataḥ // KDA_376 //	dadāha brahma jam kāmam tat ca krodha prabhāvataḥ 
SA_K10_klpdrapu-786	yad rājāno viruddhāś ca yuddhaṃ kṛtvā parasparam* /	yat rājānaḥ viruddhāḥ ca yuddham kṛtvā parasparam 
SA_K10_klpdrapu-787	mṛtyuṃ yānti janaiḥ sārdhaṃ tac cāpi krodhabhāvataḥ // KDA_377 //	mṛtyum yānti janaiḥ sārdham tat ca api krodha bhāvataḥ 
SA_K10_klpdrapu-788	suhṛdo yat sahāyāṃś ca snehaviśrambhacāriṇaḥ /	suhṛdaḥ yat sahāyān ca sneha viśrambha cāriṇaḥ 
SA_K10_klpdrapu-789	satyadharmāv anādṛtya ghnanti krodhād anāryakāḥ // KDA_378 //	satya dharmau an ādṛtya ghnanti krodhāt anāryakāḥ 
SA_K10_klpdrapu-790	sādhavo ye mahātmānaḥ saṃvṛttidharmacāriṇaḥ /	sādhavaḥ ye mahātmānaḥ saṃvṛtti dharma cāriṇaḥ 
SA_K10_klpdrapu-791	tān api saṃmukhaṃ ghnanti durvāgbāṇai ruṣā khalāḥ // KDA_379 //	tān api saṃmukham ghnanti durvāc bāṇaiḥ ruṣā khalāḥ 
SA_K10_klpdrapu-792	mātaraṃ janmadātrīṃ ca dhātrīr vā snehapālinīḥ /	mātaram janma dātrīm ca dhātrīḥ vā sneha pālinīḥ 
SA_K10_klpdrapu-793	svātmajān nirdayā ghnanti tac ca krodhaprabhāvataḥ // KDA_380 //	sva ātmajān nirdayāḥ ghnanti tat ca krodha prabhāvataḥ 
SA_K10_klpdrapu-794	svātmajāḥ pitaraṃ yac ca snehasatkārapālakam* /	sva ātmajāḥ pitaram yat ca sneha satkāra pālakam 
SA_K10_klpdrapu-795	avigaṇayya pāpāni ghnanti krodhaprabhāvataḥ // KDA_381 //	a vigaṇayya pāpāni ghnanti krodha prabhāvataḥ 
SA_K10_klpdrapu-796	gurūn saddharmaśāstṝṃś ca kalyāṇādhvāvatārakān* /	gurūn saddharma śāstṝn ca kalyāṇa adhva avatārakān 
SA_K10_klpdrapu-797	anādṛtya bhayaṃ pāpā ghnanti krodhoddhatā narāḥ // KDA_382 //	an ādṛtya bhayam pāpāḥ ghnanti krodha uddhatāḥ narāḥ 
SA_K10_klpdrapu-798	yat pitā svātmajaṃ putraṃ putrīṃ vā bālakām api /	yat pitā sva ātmajam putram putrīm vā bālakām api 
SA_K10_klpdrapu-799	nirdayas tāḍayan hanti tasmāt krodho mahāripuḥ // KDA_383 //	nirdayaḥ tāḍayan hanti tasmāt krodhaḥ mahā ripuḥ 
SA_K10_klpdrapu-800	bhrātaraḥ sahajāś cāpi roṣitā bheditāśayāḥ /	bhrātaraḥ sahajāḥ ca api roṣitāḥ bhedita āśayāḥ 
SA_K10_klpdrapu-801	vigṛhṇanti mahākruddhās tasmāt krodho mahāripuḥ // KDA_384 //	vigṛhṇanti mahā kruddhāḥ tasmāt krodhaḥ mahā ripuḥ 
SA_K10_klpdrapu-802	yat svayaṃ pariṇītāpi bhāryā dharmānucāriṇī /	yat svayam pariṇītā api bhāryā dharma anucāriṇī 
SA_K10_klpdrapu-803	tāḍitā tyajyate bhartrā krodhāt tato mahad bhayaṃ* // KDA_385 //	tāḍitā tyajyate bhartrā krodhāt tatas mahat bhayam 
SA_K10_klpdrapu-804	pramadāpi ca bhartāraṃ svāminaṃ snehakāriṇam* /	pramadā api ca bhartāram svāminam sneha kāriṇam 
SA_K10_klpdrapu-805	kuladharmam anādṛtya jahāti krodhatas tathā // KDA_386 //	kula dharmam an ādṛtya jahāti krodhataḥ tathā 
SA_K10_klpdrapu-806	ye śāntā yatayo dhīrāś caturbrahmavihāriṇaḥ /	ye śāntāḥ yatayaḥ dhīrāḥ catur brahma vihāriṇaḥ 
SA_K10_klpdrapu-807	tān api saṃmukhaṃ duṣṭās tāḍayanti ruṣānvitāḥ // KDA_387 //	tān api saṃmukham duṣṭāḥ tāḍayanti ruṣā anvitāḥ 
SA_K10_klpdrapu-808	śāntātmā hitakṛdyogī kṣāntivādī vane vasan* /	śānta ātmā hita kṛt yogī kṣānti vādī vane vasan 
SA_K10_klpdrapu-809	so 'pi śakalito rājñā svayam evāsinā ruṣā // KDA_388 //	saḥ pi śakalitaḥ rājñā svayam eva asinā ruṣā 
SA_K10_klpdrapu-810	dānavā ghnanti devāṃś ca devāś ca ghnanti dānavān* /	dānavāḥ ghnanti devān ca devāḥ ca ghnanti dānavān 
SA_K10_klpdrapu-811	anyonyaṃ vigrahaṃ kṛtvā pramathnanti ruṣākulāḥ // KDA_389 //	anyonyam vigraham kṛtvā pramathnanti ruṣā ākulāḥ 
SA_K10_klpdrapu-812	-------------------- Vaidya, p. 290 --------------------	vaidya p 
SA_K10_klpdrapu-813	ātmānam ātmanā hatvā viṣaśastrānalādibhiḥ /	ātmānam ātmanā hatvā viṣa śastra anala ādibhiḥ 
SA_K10_klpdrapu-814	vasanti narake ghore te 'pi sarve ruṣānvitāḥ // KDA_390 //	vasanti narake ghore te sarve ruṣā anvitāḥ 
SA_K10_klpdrapu-815	ye ye duṣṭāśayāḥ krūrāḥ svaparārthābhighātakāḥ /	ye ye duṣṭa āśayāḥ krūrāḥ sva para artha abhighātakāḥ 
SA_K10_klpdrapu-816	patanti narake ghore te 'pi sarve ruṣāśrayāt* // KDA_391 //	patanti narake ghore te sarve ruṣā āśrayāt 
SA_K10_klpdrapu-817	krodhena bhidyate lokaḥ krodhena paribhāṣyate /	krodhena bhidyate lokaḥ krodhena paribhāṣyate 
SA_K10_klpdrapu-818	krodhena hiṃsyate jantus tasmāt krodho mahāripuḥ // KDA_392 //	krodhena hiṃsyate jantuḥ tasmāt krodhaḥ mahā ripuḥ 
SA_K10_klpdrapu-819	krodhenaiva mahārudraś cic cheda brahmaṇaḥ śiraḥ /	krodhena eva mahā rudraḥ cit cheda brahmaṇaḥ śiraḥ 
SA_K10_klpdrapu-820	tenaiva pātakenaiva bhrāntacitto 'bhavac chivaḥ // KDA_393 //	tena eva pātakena eva bhrānta cittaḥ bhavat śivaḥ 
SA_K10_klpdrapu-821	krodhenaiva tathā rudraḥ surajyeṣṭhātmajasya ca /	krodhena eva tathā rudraḥ surajyeṣṭha ātmajasya ca 
SA_K10_klpdrapu-822	śvaśurasyāpi dakṣasya cchedayāmāsa mastakam* /	śvaśurasya api dakṣasya chedayāmāsa mastakam 
SA_K10_klpdrapu-823	tatpāpakarmaṇā hy eva śivo 'py abhūd digambaraḥ // KDA_394 //	tad pāpa karmaṇā hi eva śivaḥ pi abhūt digambaraḥ 
SA_K10_klpdrapu-824	krodhena dhvaṃsyate dharmaḥ krodhena vilayaṃ gataḥ /	krodhena dhvaṃsyate dharmaḥ krodhena vilayam gataḥ 
SA_K10_klpdrapu-825	krodhena tyajyate satyaṃ tasmāt krodho mahāripuḥ // KDA_395 //	krodhena tyajyate satyam tasmāt krodhaḥ mahā ripuḥ 
SA_K10_klpdrapu-826	yāni mahānti pāpāni mahāduḥkhabhayāni ca /	yāni mahānti pāpāni mahā duḥkha bhayāni ca 
SA_K10_klpdrapu-827	tāni sarvāṇi duṣṭāni krodhacittodbhavāni ca // KDA_396 //	tāni sarvāṇi duṣṭāni krodha citta udbhavāni ca 
SA_K10_klpdrapu-828	tatkrodhād aparo vairaḥ pātako 'nyo na vidyate /	tad krodhāt aparaḥ vairaḥ pātakaḥ nyaḥ na vidyate 
SA_K10_klpdrapu-829	tasmāt krodhavināśāya prayatadhvaṃ samāhitāḥ // KDA_397 //	tasmāt krodha vināśāya prayatadhvam samāhitāḥ 
SA_K10_klpdrapu-830	yena krodho jito vairo jñānavajreṇa sādhunā /	yena krodhaḥ jitaḥ vairaḥ jñāna vajreṇa sādhunā 
SA_K10_klpdrapu-831	tena sarve jitā duṣṭā śatravo duḥkhadāyakāḥ // KDA_398 //	tena sarve jitāḥ duṣṭā śatravaḥ duḥkha dāyakāḥ 
SA_K10_klpdrapu-832	yasya citte dayā nāsti krodhānalavidāhini /	yasya citte dayā nā asti krodha anala vidāhini 
SA_K10_klpdrapu-833	sa sādhupuruṣaś cāpi naiva viśvasyate janaiḥ // KDA_399 //	sa sādhu puruṣaḥ ca api nā eva viśvasyate janaiḥ 
SA_K10_klpdrapu-834	krodhakalaṅkito yo hi sadguṇālaṃkṛto yadi /	krodha kalaṅkitaḥ yaḥ hi sat guṇa alaṃkṛtaḥ yadi 
SA_K10_klpdrapu-835	sa vidvān api nāsevyo yathā vṛkṣo 'hiveṣṭitaḥ // KDA_400 //	sa vidvān api na āsevyaḥ yathā vṛkṣaḥ hi veṣṭitaḥ 
SA_K10_klpdrapu-836	dānaśīlādisaddharma- vṛttaiś ca yadi bhūṣitaḥ /	dāna śīla ādi sat dharma vṛttaiḥ ca yadi bhūṣitaḥ 
SA_K10_klpdrapu-837	krodhavān na vibhāty eva ahipūrṇo yathā hradaḥ // KDA_401 //	krodhavān na vibhāti eva ahi pūrṇaḥ yathā hradaḥ 
SA_K10_klpdrapu-838	sarvavidyākalājño 'pi samṛddhaḥ śilpavān api /	sarva vidyā kalā jñaḥ samṛddhaḥ śilpavān api 
SA_K10_klpdrapu-839	astramantrādyabhijño 'pi krodhavān naiva sevyatām* // KDA_402 //	astra mantra ādi abhijñaḥ krodhavān nā eva sevyatām 
SA_K10_klpdrapu-840	krodhavān hasyate lokaiḥ krodhavān vadhyate janaiḥ /	krodhavān hasyate lokaiḥ krodhavān vadhyate janaiḥ 
SA_K10_klpdrapu-841	krodhavān hīyate mitraiḥ krodhavān paribhūyate // KDA_403 //	krodhavān hīyate mitraiḥ krodhavān paribhūyate 
SA_K10_klpdrapu-842	krodho dharmaviruddhatvāc caturvargavināśakṛt* /	krodhaḥ dharma viruddha tvāt caturvarga vināśa kṛt 
SA_K10_klpdrapu-843	tasmāt krodhavināśāya prayatadhvaṃ samāhitāḥ // KDA_404 //	tasmāt krodha vināśāya prayatadhvam samāhitāḥ 
SA_K10_klpdrapu-844	-------------------- Vaidya, p. 291 --------------------	vaidya p 
SA_K10_klpdrapu-845	krodhena bhidyate cittaṃ bhinnacitto vikīryate /	krodhena bhidyate cittam bhinna cittaḥ vikīryate 
SA_K10_klpdrapu-846	vikīrṇaḥ kliśyate māraiḥ kleśito 'dhairyatāṃ vrajet // KDA_405 //	vikīrṇaḥ kliśyate māraiḥ kleśitaḥ dhairya tām vrajet 
SA_K10_klpdrapu-847	adhairyatvād bhaven mūḍho mūḍho duṣṭavaśaṃ vrajet* /	adhairya tvāt bhavet mūḍhaḥ mūḍhaḥ duṣṭa vaśam vrajet 
SA_K10_klpdrapu-848	duṣṭamitropadeśena kupathe carate kudhīḥ // KDA_406 //	duṣṭa mitra upadeśena kupathe carate kudhīḥ 
SA_K10_klpdrapu-849	asan mārgo samārūḍho viparītaṃ samācaret* /	asat samārūḍhaḥ viparītam samācaret 
SA_K10_klpdrapu-850	viparītānubodhena bhaved āryāpavādakaḥ // KDA_407 //	viparīta anubodhena bhavet ārya apavādakaḥ 
SA_K10_klpdrapu-851	saddharmādīn pratikṣipya pratimādīn vighātayet* /	saddharma ādīn pratikṣipya pratimā ādīn vighātayet 
SA_K10_klpdrapu-852	ityādipātakaṃ kṛtvā pañcānantaryam āpnuyāt* // KDA_408 //	ityādi pātakam kṛtvā pañca ānantaryam āpnuyāt 
SA_K10_klpdrapu-853	tataś ca narakān yāyād rauravādīn samantataḥ /	tatas ca narakān yāyāt raurava ādīn samantataḥ 
SA_K10_klpdrapu-854	narakān narakaṃ gatvā mahāduḥkham avāpnuyāt* // KDA_409 //	narakāt narakam gatvā mahā duḥkham avāpnuyāt 
SA_K10_klpdrapu-855	itthaṃ duḥkhānuvedī sa narakeṣu sadā vaset* /	ittham duḥkha anuvedī sa narakeṣu sadā vaset 
SA_K10_klpdrapu-856	narakebhyas tam uddhartuṃ jino 'pi naiva śaknuyāt* // KDA_410 //	narakebhyaḥ tam uddhartum na eva śaknuyāt 
SA_K10_klpdrapu-857	yāvanti pāpaduḥkhāni durvṛttiprabhavāni hi /	yāvanti pāpa duḥkhāni durvṛtti prabhavāni hi 
SA_K10_klpdrapu-858	tāni sarvāṇi jānīdhvaṃ krodhacittodbhavāni hi // KDA_411 //	tāni sarvāṇi jānīdhvam krodha citta udbhavāni hi 
SA_K10_klpdrapu-859	sarveṣāṃ pātakānāṃ tat krodhaṃ mūlaṃ jagur jināḥ /	sarveṣām pātakānām tat krodham mūlam jaguḥ jināḥ 
SA_K10_klpdrapu-860	dharmāṇāṃ tu kṣamā mūlaṃ yataḥ saukhyaṃ pravartate // KDA_412 //	dharmāṇām tu kṣamā mūlam yatas saukhyam pravartate 
SA_K10_klpdrapu-861	iti krodhaṃ vinirjitya kṣamaiva sādhyatāṃ sadā /	iti krodham vinirjitya kṣamā eva sādhyatām sadā 
SA_K10_klpdrapu-862	maitrīcittaṃ samālambya viharadhvaṃ yathāsukhaṃ // KDA_413 //	maitrī cittam samālambya viharadhvam yathāsukham 
SA_K10_klpdrapu-863	ātmanīva dayā syāc cet svajane vā yathā jane /	ātmani iva dayā syāt ced sva jane vā yathā jane 
SA_K10_klpdrapu-864	kasya nāma bhavec cittam adharmapraṇayāśivam* // KDA_414 //	kasya nāma bhavet cittam adharma praṇaya aśivam 
SA_K10_klpdrapu-865	dayāviyogato lokaḥ paramāmeti vikriyām* /	dayā viyogataḥ lokaḥ paramām eti vikriyām 
SA_K10_klpdrapu-866	manovākkāyavispandaiḥ svajane 'pi yathā jane // KDA_415 //	manaḥ vāc kāya vispandaiḥ sva jane yathā jane 
SA_K10_klpdrapu-867	dharmārthī na tyajed asmād dayām iṣṭaphalodayām* /	dharma arthī na tyajet asmāt dayām iṣṭa phala udayām 
SA_K10_klpdrapu-868	suvṛṣṭir iva śasyāni guṇān sā hi prasūyate // KDA_416 //	su vṛṣṭiḥ iva śasyāni guṇān sā hi prasūyate 
SA_K10_klpdrapu-869	dayākrāntaṃ cittaṃ na bhavati paradroharabhasaṃ śucau tasmin vāṇī vrajati vikṛtaṃ naiva ca tanuḥ /	dayā ākrāntam cittam na bhavati para droha rabhasam śucau tasmin vāṇī vrajati vikṛtam nā eva ca tanuḥ 
SA_K10_klpdrapu-870	vivṛddhā tasyaivaṃ parahitarucir maitryanugatā pradānakṣāntyādīñ janayati guṇān kīrtyanusṛtān* // KDA_417 //	vivṛddhā tasya evam para hita ruciḥ maitrī anugatā pradāna kṣānti ādīm janayati guṇān kīrti anusṛtān 
SA_K10_klpdrapu-871	dayālur nodvegaṃ janayati pareṣām upaśamād dayālur viśvāsyo bhavati jagatāṃ bāndhava iva /	dayāluḥ nā udvegam janayati pareṣām upaśamāt dayāluḥ viśvāsyaḥ bhavati jagatām bāndhavaḥ iva 
SA_K10_klpdrapu-872	na saṃrambhakṣobhaḥ prabhavati dayādhīr ahṛdaye na kopāgniś citte jvalayati hi dayātoyaśiśire // KDA_418 //	na saṃrambha kṣobhaḥ prabhavati dayā dhīḥ ahṛdaye na kopa agniḥ citte jvalayati hi dayā toya śiśire 
SA_K10_klpdrapu-873	-------------------- Vaidya, p. 292 --------------------	vaidya p 
SA_K10_klpdrapu-874	saṃkṣepeṇa dayāmataḥ sthiratayā paśyanti dharmaṃ budhāḥ ko nāmāsti guṇaḥ sa sādhudayito yo nānuyāto dayām* /	saṃkṣepeṇa dayām atas sthira tayā paśyanti dharmam budhāḥ kaḥ nāma asti guṇaḥ sa sādhu dayitaḥ yaḥ na anuyātaḥ dayām 
SA_K10_klpdrapu-875	tasmāt putra ivātmanīva ca dayāṃ nītvā prakarṣaṃ jane sanmaitryā viharanta eva muditāṃ prodbhāvayadhvaṃ sadā // KDA_419 //	tasmāt putraḥ iva ātmani iva ca dayām nītvā prakarṣam jane sat maitryā viharantaḥ eva muditām prodbhāvayadhvam sadā 
SA_K10_klpdrapu-876	dayālor hṛdaye jātā maitrī saddharmasādhanī /	dayāloḥ hṛdaye jātā maitrī saddharma sādhanī 
SA_K10_klpdrapu-877	tasmād dayāṃ hṛdi sthāpya maitrī loke prasāryatām* // KDA_420 //	tasmāt dayām hṛdi sthāpya maitrī loke prasāryatām 
SA_K10_klpdrapu-878	maitrīmān puruṣaḥ sādhur devair api praśasyate /	maitrīmān puruṣaḥ sādhuḥ devaiḥ api praśasyate 
SA_K10_klpdrapu-879	viśvasyate sadā sadbhir bāndhavaiḥ svajanair janaiḥ // KDA_421 //	viśvasyate sadā sadbhiḥ bāndhavaiḥ sva janaiḥ janaiḥ 
SA_K10_klpdrapu-880	maitrīmān sajjano loke nirguṇo 'pi praśobhate /	maitrīmān sat janaḥ loke nirguṇaḥ pi praśobhate 
SA_K10_klpdrapu-881	maitrīmān sanmatir bandhur lokānāṃ jagatām api // KDA_422 //	maitrīmān sat matiḥ bandhuḥ lokānām jagatām api 
SA_K10_klpdrapu-882	maitrīmāñ jagatām iṣṭo maitrīmāñ jagatāṃ suhṛt* /	maitrī imām jagatām iṣṭaḥ maitrī imām jagatām suhṛd 
SA_K10_klpdrapu-883	maitrīmāñ jagatāṃ mitro maitrīmāñ jagatāṃ sakhā // KDA_423 //	maitrī imām jagatām mitraḥ maitrī imām jagatām sakhā 
SA_K10_klpdrapu-884	maitrīmān puruṣaḥ śrīmān yatra yatra pragacchati /	maitrīmān puruṣaḥ śrīmān yatra yatra pragacchati 
SA_K10_klpdrapu-885	tatra tatraiva sarvatra pūjyate svajanair yathā // KDA_424 //	tatra tatra eva sarvatra pūjyate sva janaiḥ yathā 
SA_K10_klpdrapu-886	buddho hi jagatāṃ bandhus trailokyādhipanāyakaḥ /	buddhaḥ hi jagatām bandhuḥ trailokya adhipa nāyakaḥ 
SA_K10_klpdrapu-887	so 'pi śāstā vibhāty evaṃ maitryā saṃskārayañ jagat* // KDA_425 //	saḥ u pi śāstā vibhāti evam maitryā jagat 
SA_K10_klpdrapu-888	ye ye satvā mahābhijñāḥ sarvalokānukampakāḥ /	ye ye satvāḥ mahā abhijñāḥ sarva loka anukampakāḥ 
SA_K10_klpdrapu-889	pūjyante satvalokaiś ca te 'pi maitryāḥ prabhāvataḥ // KDA_426 //	pūjyante satva lokaiḥ ca te pi maitryāḥ prabhāvataḥ 
SA_K10_klpdrapu-890	bodhisatvā mahāsatvā bodhisaṃbhārasādhakāḥ /	bodhisatvāḥ mahāsatvāḥ bodhi saṃbhāra sādhakāḥ 
SA_K10_klpdrapu-891	sarvasatvahitārthasthās te 'pi maitrīpracāriṇaḥ // KDA_427 //	sarva satva hita artha sthāḥ te pi maitrī pracāriṇaḥ 
SA_K10_klpdrapu-892	yan mātā duḥkhitāpy evam ā garbhād bālakaṃ sutam* /	yat mātā duḥkhitā api evam ā garbhāt bālakam sutam 
SA_K10_klpdrapu-893	pāti snehopacāreṇa tac ca maitrīprabhāvataḥ // KDA_428 //	pāti sneha upacāreṇa tat ca maitrī prabhāvataḥ 
SA_K10_klpdrapu-894	yat pitā bālakaṃ putram abhuñjānaḥ svayaṃ sukham* /	yat pitā bālakam putram a bhuñjānaḥ svayam sukham 
SA_K10_klpdrapu-895	pāti snehopacāreṇa tac ca maitrīprabhāvataḥ // KDA_429 //	pāti sneha upacāreṇa tat ca maitrī prabhāvataḥ 
SA_K10_klpdrapu-896	yac ca rājā prajāḥ pāti svayaṃ vīravrataṃ dadhat* /	yat ca rājā prajāḥ pāti svayam vīravratam dadhat 
SA_K10_klpdrapu-897	durjanān mardayan sarvān tac ca maitrīprabhāvataḥ // KDA_430 //	durjanān mardayan sarvān tat ca maitrī prabhāvataḥ 
SA_K10_klpdrapu-898	yac ca vidvān guruḥ śiṣyān saddharmārthopadarśayan* /	yat ca vidvān guruḥ śiṣyān saddharma artha upadarśayan 
SA_K10_klpdrapu-899	prabodhya bālakāñ chāsti tac ca maitrīprabhāvataḥ // KDA_431 //	prabodhya tat ca maitrī prabhāvataḥ 
SA_K10_klpdrapu-900	yac ca vīrā raṇe sthitvā sahantyarīn prahāriṇaḥ /	yat ca vīrāḥ raṇe sthitvā sahanti arīn prahāriṇaḥ 
SA_K10_klpdrapu-901	prarakṣanti svapakṣāṃś ca tac ca maitrīprabhāvataḥ // KDA_432 //	prarakṣanti sva pakṣān ca tat ca maitrī prabhāvataḥ 
SA_K10_klpdrapu-902	-------------------- Vaidya, p. 293 --------------------	vaidya p 
SA_K10_klpdrapu-903	sārthavāho 'mbudhiṃ gatvā yatnai ratnāni sādhayan* /	sārthavāhaḥ mbudhim gatvā yatnaiḥ ratnāni sādhayan 
SA_K10_klpdrapu-904	satvān pāti dadad dānaṃ tac ca maitrīprabhāvataḥ // KDA_433 //	satvān pāti dadat dānam tat ca maitrī prabhāvataḥ 
SA_K10_klpdrapu-905	yac ca bhāryānuyāty eva mṛtena svāminā saha /	yat ca bhāryā anuyāti eva mṛtena svāminā saha 
SA_K10_klpdrapu-906	anapekṣya svajīve 'pi tac ca maitrīprabhāvataḥ // KDA_434 //	an apekṣya sva jīve tat ca maitrī prabhāvataḥ 
SA_K10_klpdrapu-907	pitṛbhyo mṛtakebhyo 'pi dadāti piṇḍam ādarāt* /	pitṛbhyaḥ mṛtakebhyaḥ pi dadāti piṇḍam ādarāt 
SA_K10_klpdrapu-908	anuśocan muhuś cāpi tac ca maitrīprabhāvataḥ // KDA_435 //	anuśocan muhur ca api tat ca maitrī prabhāvataḥ 
SA_K10_klpdrapu-909	tiryagyonyudbhavāś cāpi paśavaḥ krūramānasāḥ /	tiryagyoni udbhavāḥ ca api paśavaḥ krūra mānasāḥ 
SA_K10_klpdrapu-910	svasutān snehataḥ pānti tac ca maitrīprabhāvataḥ // KDA_436 //	sva sutān snehataḥ pānti tat ca maitrī prabhāvataḥ 
SA_K10_klpdrapu-911	kṛmyādhikīṭayaś cāpi krūrā gṛdhrādipakṣiṇaḥ /	kṛmi ādhi kīṭayaḥ ca api krūrāḥ gṛdhra ādi pakṣiṇaḥ 
SA_K10_klpdrapu-912	svabandhūn snehataḥ pānti tad dhi maitrīprabhāvataḥ // KDA_437 //	sva bandhūn snehataḥ pānti tat hi maitrī prabhāvataḥ 
