segmentnr	original	analyzed
SA_K10_klpdrapu-0	Kalpadrumāvadānamālāyāṃ	        
SA_K10_klpdrapu-1	10 subhūtyavadānam* //	subhūti avadānam 
SA_K10_klpdrapu-2	athāśoko mahārājaḥ sarvaśokavinoditaḥ /	atha aśokaḥ mahā rājaḥ sarva śoka vinoditaḥ 
SA_K10_klpdrapu-3	upaguptaṃ guruṃ natvā kṛtāñjalipuṭo 'vadat* // KDA_1 //	upaguptam gurum natvā kṛta añjali puṭaḥ vadat 
SA_K10_klpdrapu-4	bhadanta śrotum icchāmi punar anyat subhāṣitam* /	bhadanta śrotum icchāmi punar anyat subhāṣitam 
SA_K10_klpdrapu-5	yad uktaṃ śākyasiṃhena tan me gaditum arhasi // KDA_2 //	yat uktam śākyasiṃhena tat me gaditum arhasi 
SA_K10_klpdrapu-6	iti pṛṣṭo nṛpeṇāsāv upagupto yatīśvaraḥ /	iti pṛṣṭaḥ nṛpeṇa asau upaguptaḥ yati īśvaraḥ 
SA_K10_klpdrapu-7	parṣadaṃ ca samālokya saṃbabhāṣa subhāṣitam* // KDA_3 //	parṣadam ca samālokya saṃbabhāṣa subhāṣitam 
SA_K10_klpdrapu-8	śṛṇu rājan mahābāho sarvalokahitārthataḥ /	śṛṇu rājan mahā bāho sarva loka hita arthataḥ 
SA_K10_klpdrapu-9	subhūter avadānaṃ yat tat pravakṣye yathāśrutam* // KDA_4 //	subhūteḥ avadānam yat tat pravakṣye yathāśrutam 
SA_K10_klpdrapu-10	purā śrībhagavān buddho dharmarājas tathāgataḥ /	purā śrī bhagavān buddhaḥ dharmarājaḥ tathāgataḥ 
SA_K10_klpdrapu-11	vidyācaraṇasaṃpannaḥ sugato lokavijjinaḥ // KDA_5 //	vidyā caraṇa saṃpannaḥ sugataḥ loka vid jinaḥ 
SA_K10_klpdrapu-12	śāstā devamanuṣyāṇāṃ samyaksaṃbodhideśakaḥ /	śāstā deva manuṣyāṇām samyaksaṃbodhi deśakaḥ 
SA_K10_klpdrapu-13	satkṛto mānitaḥ satvair gurukṛtaś ca pūjitaḥ // KDA_6 //	satkṛtaḥ mānitaḥ satvaiḥ gurukṛtaḥ ca pūjitaḥ 
SA_K10_klpdrapu-14	rājabhī rājamātraiś ca dhanibhiḥ puravāsibhiḥ /	rājabhiḥ rājamātraiḥ ca dhanibhiḥ pura vāsibhiḥ 
SA_K10_klpdrapu-15	śreṣṭhibhiḥ sārthavāhaiś ca nānādeśasamāgataiḥ // KDA_7 //	śreṣṭhibhiḥ sārthavāhaiḥ ca nānā deśa samāgataiḥ 
SA_K10_klpdrapu-16	devāsuramahānāgair yakṣagandharvakinnaraiḥ /	deva asura mahā nāgaiḥ yakṣa gandharva kinnaraiḥ 
SA_K10_klpdrapu-17	guruḍaiś ca mahāsarpais tathānyasatvajātikaiḥ // KDA_8 //	guruḍaiḥ ca mahā sarpaiḥ tathā anya satva jātikaiḥ 
SA_K10_klpdrapu-18	susaṃjñāto mahāpuṇyo lābhī cīvaravāsasām* /	su saṃjñātaḥ mahā puṇyaḥ lābhī cīvara vāsasām 
SA_K10_klpdrapu-19	piṇḍapātāsanādīnāṃ śayyādīnāṃ tathaiva ca // KDA_9 //	piṇḍapāta āsana ādīnām śayyā ādīnām tathā eva ca 
SA_K10_klpdrapu-20	auṣadhādipariṣkāra- vastūnāṃ sarvataḥ sadā /	auṣadha ādi pariṣkāra vastūnām sarvatas sadā 
SA_K10_klpdrapu-21	sārdhaṃ saśrāvakaiḥ saṃghair bhikṣubhiś ca jitendriyaiḥ // KDA_10 //	sārdham sa śrāvakaiḥ saṃghaiḥ bhikṣubhiḥ ca jita indriyaiḥ 
SA_K10_klpdrapu-22	bhikṣuṇyupāsikābhiś ca celakopāsakais tathā /	bhikṣuṇī upāsikābhiḥ ca celaka upāsakaiḥ tathā 
SA_K10_klpdrapu-23	bodhisatvamahāsatvaiḥ satvārthabodhivāñchibhiḥ // KDA_11 //	bodhisatva mahāsatvaiḥ satva artha bodhi vāñchibhiḥ 
SA_K10_klpdrapu-24	śrāvastyāṃ rājadhānyāṃ vai jetavane manorame /	śrāvastyām rājadhānyām vai jetavane manorame 
SA_K10_klpdrapu-25	vihāre vyaharad dharmaṃ deśayañ chubhayas sadā // KDA_12 //	vihāre vyaharat dharmam deśayam sadā 
SA_K10_klpdrapu-26	tadā bhagavatā satva- vinayānugrahārthinā /	tadā bhagavatā satva vinaya anugraha arthinā 
SA_K10_klpdrapu-27	āmantrya bhikṣavaḥ sarve samyagājñāpitā iti // KDA_13 //	āmantrya bhikṣavaḥ sarve samyak ājñāpitāḥ iti 
SA_K10_klpdrapu-28	gacchata bhikṣavo yūyaṃ satvānāṃ vinayārthataḥ /	gacchata bhikṣavaḥ yūyam satvānām vinaya arthataḥ 
SA_K10_klpdrapu-29	deśān pratyabhigacchantaḥ prakāśayata saṃvṛtim* // KDA_14 //	deśān pratyabhigacchantaḥ prakāśayata saṃvṛtim 
SA_K10_klpdrapu-30	-------------------- Vaidya, p. 266 --------------------	vaidya p 
SA_K10_klpdrapu-31	tathety eva pratiśrutya śāstuḥ pādau praṇamya ca /	tathā iti eva pratiśrutya śāstuḥ pādau praṇamya ca 
SA_K10_klpdrapu-32	śrāvakā bhikṣavaś caiva pratasthus te niyoginaḥ // KDA_15 //	śrāvakāḥ bhikṣavaḥ ca eva pratasthuḥ te niyoginaḥ 
SA_K10_klpdrapu-33	guro ājñāṃ vahantas te kecit prācīṃ diśaṃ gatāḥ /	guro ājñām vahantaḥ te kecid prācīm diśam gatāḥ 
SA_K10_klpdrapu-34	deśayanti sma saddharmaṃ pratideśānupāsthitāḥ // KDA_16 //	deśayanti sma saddharmam pratideśa an upāsthitāḥ 
SA_K10_klpdrapu-35	dakṣiṇasyāṃ tathā kecit kecic ca paścimāṃ diśam* /	dakṣiṇasyām tathā kecid kecid ca paścimām diśam 
SA_K10_klpdrapu-36	tathottarāṃ diśaṃ gatvā vidikṣu cāpi sarvataḥ // KDA_17 //	tathā uttarām diśam gatvā vidikṣu ca api sarvatas 
SA_K10_klpdrapu-37	teṣāṃ dhyānaratā ye vai te viviktasukhaiṣiṇaḥ /	teṣām dhyāna ratāḥ ye vai te vivikta sukha eṣiṇaḥ 
SA_K10_klpdrapu-38	meror upariṣaṇḍāyām adhyūṣur dhyānatatparāḥ // KDA_18 //	meroḥ upariṣaṇḍāyām adhyūṣuḥ dhyāna tatparāḥ 
SA_K10_klpdrapu-39	tadābdher garuḍenaiko nāgapotaḥ samuddhṛtaḥ /	tadā abdheḥ garuḍena ekaḥ nāga potaḥ samuddhṛtaḥ 
SA_K10_klpdrapu-40	tam āśramam upānīya bhakṣitum upacakrame // KDA_19 //	tam āśramam upānīya bhakṣitum upacakrame 
SA_K10_klpdrapu-41	tatrasthās tena nāgena bhikṣavo dhyānasaṃratāḥ /	tatrasthāḥ tena nāgena bhikṣavaḥ dhyāna saṃratāḥ 
SA_K10_klpdrapu-42	dṛṣṭvaiva suprasannena manasā praṇidhir dadhe // KDA_20 //	dṛṣṭvā eva su prasannena manasā praṇidhiḥ dadhe 
SA_K10_klpdrapu-43	dhanyās te bhikṣavo hy ete saddharmasukhacāriṇaḥ /	dhanyāḥ te bhikṣavaḥ hi ete saddharma sukha cāriṇaḥ 
SA_K10_klpdrapu-44	aham api ca bhūyāsaṃ tādṛgdharmasamāhitaḥ // KDA_21 //	aham api ca bhūyāsam tādṛś dharma samāhitaḥ 
SA_K10_klpdrapu-45	iti praṇidhiṃ kurvāṇo jīvitād vyavaropitaḥ /	iti praṇidhim kurvāṇaḥ jīvitāt vyavaropitaḥ 
SA_K10_klpdrapu-46	tatraiva garuḍenaivaṃ bhakṣito 'bhūt sa nāgakaḥ // KDA_22 //	tatra eva garuḍena evam bhakṣitaḥ bhūt sa nāgakaḥ 
SA_K10_klpdrapu-47	tataḥ kālagatas tatra śrāvastyāṃ puri + + + /	tatas kālagataḥ tatra śrāvastyām puri 
SA_K10_klpdrapu-48	bhūtināmnā dvijasyāsau bhāryāyā garbham āviśat* // KDA_23 //	bhūti nāmnā dvijasya asau bhāryāyāḥ garbham āviśat 
SA_K10_klpdrapu-49	tataś ca kramatas tasyā garbhaḥ samanuvardhitaḥ /	tatas ca kramatas tasyāḥ garbhaḥ samanuvardhitaḥ 
SA_K10_klpdrapu-50	tatas tatsamaye prāpte dārakaḥ samajāyata // KDA_24 //	tatas tad samaye prāpte dārakaḥ samajāyata 
SA_K10_klpdrapu-51	tataḥ pitā ca taṃ dṛṣṭā dārakaṃ saṃprasādikam* /	tatas pitā ca tam dṛṣṭā dārakam saṃprasādikam 
SA_K10_klpdrapu-52	darśanīyaṃ subhadrāṅgaṃ muhuḥ paśyann ananda saḥ // KDA_25 //	darśanīyam su bhadra aṅgam muhur paśyan ananda saḥ 
SA_K10_klpdrapu-53	tato jātimahaṃ kṛtvā jñānīnāhūya cādarāt* /	tatas jāti maham kṛtvā jñānīn āhūya ca ādarāt 
SA_K10_klpdrapu-54	bhavanto 'sya nu kiṃ nāma kriyatām iti so 'bravīt* // KDA_26 //	bhavantaḥ sya nu kim nāma kriyatām iti saḥ bravīt 
SA_K10_klpdrapu-55	jñātayo 'pi tathā śrutvā dṛṣṭvā cainaṃ ca bālakam* /	jñātayaḥ tathā śrutvā dṛṣṭvā ca enam ca bālakam 
SA_K10_klpdrapu-56	sarve harṣasamāpannā bhūtiṃ tam abruvaṃs tathā // KDA_27 //	sarve harṣa samāpannāḥ bhūtim tam abruvan tathā 
SA_K10_klpdrapu-57	yasmād bhūter ayaṃ putraṃ sujāto lakṣaṇānvitaḥ /	yasmāt bhūteḥ ayam putram sujātaḥ lakṣaṇa anvitaḥ 
SA_K10_klpdrapu-58	tasmāt subhūtir ity eva nāmnā bhavatu viśrutaḥ // KDA_28 //	tasmāt subhūtiḥ iti eva nāmnā bhavatu viśrutaḥ 
SA_K10_klpdrapu-59	tathā kramād vivṛddho 'sau subhūtir bālasundaraḥ /	tathā kramāt vivṛddhaḥ sau subhūtiḥ bāla sundaraḥ 
SA_K10_klpdrapu-60	kumāratvaṃ kramāt prāpto rarāma sa vayonvitaḥ // KDA_29 //	kumāra tvam kramāt prāptaḥ rarāma sa vayonvitaḥ 
SA_K10_klpdrapu-61	-------------------- Vaidya, p. 267 --------------------	vaidya p 
SA_K10_klpdrapu-62	pūrvakarmabalādhānāt krodhanaḥ krūrabhāṣaṇaḥ /	pūrva karma bala ādhānāt krodhanaḥ krūra bhāṣaṇaḥ 
SA_K10_klpdrapu-63	kiṃcin nimittasaṃruṣṭo vigrahe nirato 'bhavat // KDA_30 //	kiṃcid nimitta saṃruṣṭaḥ vigrahe nirataḥ bhavat 
SA_K10_klpdrapu-64	paruṣībhūtacittatvān na tasya ko 'py abhūt suhṛt* /	paruṣībhūta citta tvāt na tasya kaḥ pi abhūt suhṛd 
SA_K10_klpdrapu-65	sarvajñātiviruddhatvāt pitṛbhyām apy upekṣitaḥ // KDA_31 //	sarva jñāti viruddha tvāt pitṛbhyām api upekṣitaḥ 
SA_K10_klpdrapu-66	bandhubhiś ca parityakto naiva kasyāpy abhūt priyaḥ /	bandhubhiḥ ca parityaktaḥ nā eva kasya api abhūt priyaḥ 
SA_K10_klpdrapu-67	viśrambhapraṇayaṃ tasmin naiva kaścid abhāṣata // KDA_32 //	viśrambha praṇayam tasmin na eva kaścid abhāṣata 
SA_K10_klpdrapu-68	sthātuṃ gantuṃ tathā bhoktuṃ śayituṃ vābhilāpitum* /	sthātum gantum tathā bhoktum śayitum vā abhilāpitum 
SA_K10_klpdrapu-69	tenaiva krodhinā sārdhaṃ samutsehur na kecana // KDA_33 //	tena eva krodhinā sārdham samutsehuḥ na kecana 
SA_K10_klpdrapu-70	tadā pitrā niyukto 'sau lipiśālām upāgamat* /	tadā pitrā niyuktaḥ sau lipi śālām upāgamat 
SA_K10_klpdrapu-71	subhūtiś ca guruṃ natvā lipim anvagrahīt kramāt* // KDA_34 //	subhūtiḥ ca gurum natvā lipim anvagrahīt kramāt 
SA_K10_klpdrapu-72	tato vyākaraṇādīni sarvaśāstrāṇy anukramāt* /	tatas vyākaraṇa ādīni sarva śāstrāṇi anukramāt 
SA_K10_klpdrapu-73	so 'dhītyaiṣāṃ suśīghreṇa pāraṃ prāpa subuddhimān* // KDA_35 //	saḥ dhītya eṣām su śīghreṇa pāram prāpa su buddhimān 
SA_K10_klpdrapu-74	tathā vedān adhītyaivaṃ sāṅgopāṅgān yathākramam* /	tathā vedān adhītya evam sa aṅga upāṅgān yathākramam 
SA_K10_klpdrapu-75	atharvam apy adhītuṃ sa prārabhat tīkṣṇamānasaḥ // KDA_36 //	atharvam api adhītum sa prārabhat tīkṣṇa mānasaḥ 
SA_K10_klpdrapu-76	tatra pitā dvijo bhūtir atharvādhītasaṃratam* /	tatra pitā dvijaḥ bhūtiḥ atharva adhīta saṃratam 
SA_K10_klpdrapu-77	subhūtiṃ svātmajaṃ putraṃ dṛṣṭvaivaṃ samacintayat* // KDA_37 //	subhūtim sva ātmajam putram dṛṣṭvā evam samacintayat 
SA_K10_klpdrapu-78	subhūtir mama putro 'yam agnikalpaḥ sutīkṣṇadhīḥ /	subhūtiḥ mama putraḥ yam agni kalpaḥ su tīkṣṇa dhīḥ 
SA_K10_klpdrapu-79	kadācit kupito roṣāl loke 'narthaṃ kariṣyati // KDA_38 //	kadācid kupitaḥ roṣāt loke nartham kariṣyati 
SA_K10_klpdrapu-80	tad anvāharitavyo 'yam ātharvaṇāt prayatnataḥ /	tat anvāharitavyaḥ yam ātharvaṇāt prayatnataḥ 
SA_K10_klpdrapu-81	ṛṣiṣu preṣayitvainaṃ yojayiṣye ca saṃyame // KDA_39 //	ṛṣiṣu preṣayitvā enam yojayiṣye ca saṃyame 
SA_K10_klpdrapu-82	iti matvā pitā bhūtiḥ subhūtiṃ svātmajaṃ tathā /	iti matvā pitā bhūtiḥ subhūtim sva ātmajam tathā 
SA_K10_klpdrapu-83	ātharvaṇād vinirhṛtya prabodhayaṃs tam abravīt* // KDA_40 //	ātharvaṇāt vinirhṛtya prabodhayan tam abravīt 
SA_K10_klpdrapu-84	śṛṇu putra mayā proktaṃ hitārthaṃ tava saṃmatam* /	śṛṇu putra mayā proktam hita artham tava saṃmatam 
SA_K10_klpdrapu-85	tvaṃ hi vidvān mahāvijñaḥ sarvaśāstrāṅgapāragaḥ // KDA_41 //	tvam hi vidvān mahā vijñaḥ sarva śāstra aṅga pāragaḥ 
SA_K10_klpdrapu-86	kiṃ tavātharvavedena māyākleśārthasādhinā /	kim tava atharvavedena māyā kleśa artha sādhinā 
SA_K10_klpdrapu-87	viramya tadadhiṣṭhānād ṛṣicaryāṃ samācara // KDA_42 //	viramya tad adhiṣṭhānāt ṛṣi caryām samācara 
SA_K10_klpdrapu-88	munīnām upadeśāni pratilabhya jitendriyaḥ /	munīnām upadeśāni pratilabhya jita indriyaḥ 
SA_K10_klpdrapu-89	śāntātmā sukham āsthāya carasva vratam uttamam* // KDA_43 //	śānta ātmā sukham āsthāya carasva vratam uttamam 
SA_K10_klpdrapu-90	dhanyās te vītarāgā ye gurubhaktāś ca nirmadāḥ /	dhanyāḥ te vīta rāgāḥ ye guru bhaktāḥ ca nirmadāḥ 
SA_K10_klpdrapu-91	viviktāraṇyavāseṣu vasanti dhyāyinaḥ sadā // KDA_44 //	vivikta araṇya vāseṣu vasanti dhyāyinaḥ sadā 
SA_K10_klpdrapu-92	-------------------- Vaidya, p. 268 --------------------	vaidya p 
SA_K10_klpdrapu-93	ye 'pi parigrahāṃs tyaktvā bhavanti brahmacāriṇaḥ /	ye pi parigrahān tyaktvā bhavanti brahmacāriṇaḥ 
SA_K10_klpdrapu-94	devānām api te mānyā vandanīyāḥ sadā khalu // KDA_45 //	devānām api te mānyāḥ vandanīyāḥ sadā khalu 
SA_K10_klpdrapu-95	ye pravrajyāṃ samāgṛhya śāntātmāno jitendriyāḥ /	ye pravrajyām samāgṛhya śānta ātmānaḥ jita indriyāḥ 
SA_K10_klpdrapu-96	avasanti puṇyatīrtheṣu te 'pi hi paramarṣayaḥ // KDA_46 //	avasanti puṇya tīrtheṣu te pi hi parama ṛṣayaḥ 
SA_K10_klpdrapu-97	kāmabhogyāni ye hitvā sādhayante tapovane /	kāma bhogyāni ye hitvā sādhayante tapaḥ vane 
SA_K10_klpdrapu-98	phalamūlodakais tuṣṭās te 'pi dhanyā dvijottamāḥ // KDA_47 //	phala mūla udakaiḥ tuṣṭāḥ te dhanyāḥ dvijottamāḥ 
SA_K10_klpdrapu-99	ye 'pi kleśān vinirjitya caturbrahmavihāriṇaḥ /	ye pi kleśān vinirjitya catur brahmavihāriṇaḥ 
SA_K10_klpdrapu-100	bhikṣāśinaḥ samādhisthās te hi brahmavidāṃ varāḥ // KDA_48 //	bhikṣā āśinaḥ samādhi sthāḥ te hi brahma vidām varāḥ 
SA_K10_klpdrapu-101	ye cāparigrahītāro nirlobhāḥ satyavādinaḥ /	ye ca a parigrahītāraḥ nirlobhāḥ satya vādinaḥ 
SA_K10_klpdrapu-102	nirmadā nirahaṃkārās ta eva brāhmaṇottamāḥ // KDA_49 //	nirmadāḥ nirahaṃkārāḥ te eva brāhmaṇa uttamāḥ 
SA_K10_klpdrapu-103	yasya dātuṃ mano nāsti matsarākrāntacetasaḥ /	yasya dātum manaḥ nā asti matsara ākrānta cetasaḥ 
SA_K10_klpdrapu-104	vedaśāstrāgamais tasya kim eva svātmapoṣiṇaḥ // KDA_50 //	veda śāstra āgamaiḥ tasya kim eva sva ātma poṣiṇaḥ 
SA_K10_klpdrapu-105	yasya cittaṃ hy aviśuddhaṃ śīlasaṃvaravarjitam* /	yasya cittam hi a viśuddham śīla saṃvara varjitam 
SA_K10_klpdrapu-106	kiṃ bhāti muniveṣeṇa sa naṭarṣir ivonmadaḥ // KDA_51 //	kim bhāti muni veṣeṇa sa naṭa ṛṣiḥ iva unmadaḥ 
SA_K10_klpdrapu-107	yasya loke dayā nāsti bālavṛddhādiduḥkhite /	yasya loke dayā nā asti bāla vṛddha ādi duḥkhite 
SA_K10_klpdrapu-108	kiṃ tasya brahmavṛttena citte{na} parimohite // KDA_52 //	kim tasya brahma vṛttena cittena parimohite 
SA_K10_klpdrapu-109	yasya na kuśalotsāhaṃ citte lokārthaṃ sādhitum* /	yasya na kuśala utsāham citte loka artham sādhitum 
SA_K10_klpdrapu-110	tasya kiṃ tapasā siddhe kevalaṃ pāpahetubhiḥ // KDA_53 //	tasya kim tapasā siddhe kevalam pāpa hetubhiḥ 
SA_K10_klpdrapu-111	yasya cittaṃ pravikṣiptaṃ kleśād yair asamāhitam* /	yasya cittam pravikṣiptam kleśāt yaiḥ asamāhitam 
SA_K10_klpdrapu-112	sa kiṃ guhāniviṣṭo 'pi na sādhur duṣṭajantuvat* // KDA_54 //	sa kim guhā niviṣṭaḥ na sādhuḥ duṣṭa jantu vat 
SA_K10_klpdrapu-113	yasya prajñā viśuddhā na saddharmaguṇasādhane /	yasya prajñā viśuddhā na saddharma guṇa sādhane 
SA_K10_klpdrapu-114	tasya kiṃ brahmacaryeṇa kevalaṃ duḥkhahetunā // KDA_55 //	tasya kim brahmacaryeṇa kevalam duḥkha hetunā 
SA_K10_klpdrapu-115	yaś ca dātā viśuddhātmā sarvasatvān upālakaḥ /	yaḥ ca dātā viśuddha ātmā sarva satvān upālakaḥ 
SA_K10_klpdrapu-116	nīco 'pi sa dvijakalpo yato dātā prajāpatiḥ // KDA_56 //	nīcaḥ sa dvija kalpaḥ yatas dātā prajāpatiḥ 
SA_K10_klpdrapu-117	yena saṃrakṣitaṃ nityaṃ śīlaṃ saṃyamasaṃvṛttam* /	yena saṃrakṣitam nityam śīlam saṃyama saṃvṛttam 
SA_K10_klpdrapu-118	sa eva brāhmaṇaḥ śuddhaḥ śrotriyo vedanān yatiḥ // KDA_57 //	saḥ eva brāhmaṇaḥ śuddhaḥ śrotriyaḥ vedanān yatiḥ 
SA_K10_klpdrapu-119	yasya cittaṃ dayāśūlaṃ sarvasatvahiteṣitam* /	yasya cittam dayā śūlam sarva satva hita iṣitam 
SA_K10_klpdrapu-120	caṇḍālo 'pi sa vipraḥ syāl lokeśo hi kṣamākaraḥ // KDA_58 //	caṇḍālaḥ pi sa vipraḥ syāt loka īśaḥ hi kṣamā karaḥ 
SA_K10_klpdrapu-121	yenaiva duṣkaraṃ karma sādhitaṃ satvahetunā /	yena eva duṣkaram karma sādhitam satva hetunā 
SA_K10_klpdrapu-122	sa eva brāhmaṇo dhīro viśvakarmā yato vidhiḥ // KDA_59 //	saḥ eva brāhmaṇaḥ dhīraḥ viśva karmā yatas vidhiḥ 
SA_K10_klpdrapu-123	-------------------- Vaidya, p. 269 --------------------	vaidya p 
SA_K10_klpdrapu-124	yasya cittaṃ sadā satva- hitārtheṣu samādhitam* /	yasya cittam sadā satva hita artheṣu 
SA_K10_klpdrapu-125	sa hi vipro mahābhijño brahmā jñānarato yataḥ (Speyer:	sa hi vipraḥ mahā abhijñaḥ brahmā jñāna rataḥ yatas speyeḥ 
SA_K10_klpdrapu-126	dhyānarato) // KDA_60 //	dhyāna rataḥ 
SA_K10_klpdrapu-127	yasya prajñā jagalloka- hitānuśāsanojjvalā /	yasya prajñā jagalloka hita anuśāsana ujjvalā 
SA_K10_klpdrapu-128	saiva dvijavaro vijño vedadharmāsthito dvijaḥ // KDA_61 //	saḥ eva dvijavaraḥ vijñaḥ veda dharma āsthitaḥ dvijaḥ 
SA_K10_klpdrapu-129	yenaiva nirjitāḥ kleśāś caturbrahmavihāriṇā /	yena eva nirjitāḥ kleśāḥ catur brahmavihāriṇā 
SA_K10_klpdrapu-130	svacitte bhāvitaṃ brahma sa eva brāhmaṇottamaḥ // KDA_62 //	sva citte bhāvitam brahma saḥ eva brāhmaṇa uttamaḥ 
SA_K10_klpdrapu-131	tasmāt putra mayā proktaṃ śrutvā lokahitotsukaḥ /	tasmāt putra mayā proktam śrutvā loka hita utsukaḥ 
SA_K10_klpdrapu-132	sarvakleśān vinirjitya saddharmābhirato bhava // KDA_63 //	sarva kleśān vinirjitya saddharma abhirataḥ bhava 
SA_K10_klpdrapu-133	iti pitur vacaḥ śrutvā subhūtiḥ so 'numoditaḥ /	iti pituḥ vacaḥ śrutvā subhūtiḥ saḥ numoditaḥ 
SA_K10_klpdrapu-134	kṛtāñjalis tathā natvā pitaram ity abhāṣata // KDA_64 //	kṛtāñjaliḥ tathā natvā pitaram iti abhāṣata 
SA_K10_klpdrapu-135	tathā satyaṃ manas tāta rocate tapase mama /	tathā satyam manaḥ tāta rocate tapase mama 
SA_K10_klpdrapu-136	tad ājñāṃ dehi me tāta cariṣye brahmasadvratam* // KDA_65 //	tat ājñām dehi me tāta cariṣye brahma sat vratam 
SA_K10_klpdrapu-137	tenaivaṃ prārthyamāno 'sau subhūtinā pitā tataḥ /	tena evam prārthyamānaḥ sau subhūtinā pitā tatas 
SA_K10_klpdrapu-138	pariṣvajyātmajaṃ putraṃ punar apy abravīn mudā // KDA_66 //	pariṣvajya ātmajam putram punar api abravīt mudā 
SA_K10_klpdrapu-139	evaṃ cet tava vāñchāsti putra brahmasusādhanaiḥ /	evam ced tava vāñchā asti putra brahma su sādhanaiḥ 
SA_K10_klpdrapu-140	cara brahmavrataṃ samyag- dhīracittasamāhitaḥ // KDA_67 //	cara brahmavratam samyak dhīra citta samāhitaḥ 
SA_K10_klpdrapu-141	ādau krodharipuṃ jitvā duṣṭabhārān vinirjaya (Speyer:	ādau krodha ripum jitvā duṣṭa bhārān vinirjaya speyeḥ 
SA_K10_klpdrapu-142	duṣṭamārān) /	duṣṭa mārān 
SA_K10_klpdrapu-143	yāvat krodham anirjitya duṣṭāñjetuṃ na śaknuyāḥ // KDA_68 //	yāvat krodham a nirjitya duṣṭān jetum na śaknuyāḥ 
SA_K10_klpdrapu-144	yāvad duṣṭān anirjitya dharme sthātuṃ na śaknuyāḥ /	yāvat duṣṭān a nirjitya dharme sthātum na śaknuyāḥ 
SA_K10_klpdrapu-145	asusaṃsthitadharmāṇaṃ hanyur mārā hi sarvathā // KDA_69 //	asu saṃsthita dharmāṇam hanyuḥ mārāḥ hi sarvathā 
SA_K10_klpdrapu-146	tasmād vāñchati yo brahma tenādau cittakoṭarāt* /	tasmāt vāñchati yaḥ brahma tena ādau citta koṭarāt 
SA_K10_klpdrapu-147	viniḥkṛṣya prayatnena hantavyaḥ krodhapannagaḥ // KDA_70 //	viniḥkṛṣya prayatnena hantavyaḥ krodha pannagaḥ 
SA_K10_klpdrapu-148	krodho hi vasate yasya citte mānamadākule /	krodhaḥ hi vasate yasya citte māna mada ākule 
SA_K10_klpdrapu-149	tāvat sadguṇayukto 'pi sevyate naiva sajjanaiḥ // KDA_71 //	tāvat sat guṇa sevyate nā eva sat janaiḥ 
SA_K10_klpdrapu-150	tasmāt sarvaprayatnena krodhajiṣṇuḥ samāhitaḥ /	tasmāt sarva prayatnena krodha jiṣṇuḥ samāhitaḥ 
SA_K10_klpdrapu-151	pravrajyāṃ samupāsiśritya cara brāhmaṇyam ādarāt* // KDA_72 //	pravrajyām samupāsiśritya cara brāhmaṇyam ādarāt 
SA_K10_klpdrapu-152	tathety asau pratiśrutya subhūtiḥ saṃpramoditaḥ /	tathā iti asau pratiśrutya subhūtiḥ saṃpramoditaḥ 
SA_K10_klpdrapu-153	sahasā pitarau natvā munīnām āśramaṃ yayau // KDA_73 //	sahasā pitarau natvā munīnām āśramam yayau 
SA_K10_klpdrapu-154	tatra prāpto munīn natvā kṛtāñjalipuṭo mudā /	tatra prāptaḥ munīn natvā kṛta añjali puṭaḥ mudā 
SA_K10_klpdrapu-155	brāhmaṇyasaṃvaraṃ prāptuṃ pravrajyāṃ samayācata // KDA_74 //	brāhmaṇya saṃvaram prāptum pravrajyām samayācata 
SA_K10_klpdrapu-156	-------------------- Vaidya, p. 270 --------------------	vaidya p 
SA_K10_klpdrapu-157	guro brahmavidāṃ śreṣṭha kalyāṇavartmadeśaka /	guro brahma vidām śreṣṭha kalyāṇa vartma deśaka 
SA_K10_klpdrapu-158	pravrajyāṃ dehi me satyaṃ careyaṃ bhavamuktaye // KDA_75 //	pravrajyām dehi me satyam careyam bhava muktaye 
SA_K10_klpdrapu-159	iti tasya vacaḥ śrutvā gurur brahmavidāṃ varaḥ /	iti tasya vacaḥ śrutvā guruḥ brahma vidām varaḥ 
SA_K10_klpdrapu-160	ehi vatsa cara brahma- caryaṃ jitvā ṣaḍ indriyam* // KDA_76 //	ehi vatsa cara brahma caryam jitvā ṣaṣ indriyam 
SA_K10_klpdrapu-161	ity ukto guruṇā so 'bhūt subhūtir muniveṣabhṛt* /	iti uktaḥ guruṇā saḥ bhūt subhūtiḥ muni veṣa bhṛt 
SA_K10_klpdrapu-162	brahmavihārasaṃpanno vinītaḥ śraddhayānvitaḥ // KDA_77 //	brahmavihāra saṃpannaḥ vinītaḥ śraddhayā anvitaḥ 
SA_K10_klpdrapu-163	tathāpi daivasāmarthyāt krodhasaṃraktamānasaḥ /	tathā api daiva sāmarthyāt krodha saṃrakta mānasaḥ 
SA_K10_klpdrapu-164	kiṃcin nimittamātre 'pi vigrahavān asaṃyataḥ // KDA_78 //	kiṃcid nimitta mātre pi vigrahavān a saṃyataḥ 
SA_K10_klpdrapu-165	vedasiddhāntaśāstreṣu vivādī krodhabāhulaḥ /	veda siddhānta śāstreṣu vivādī krodha bāhulaḥ 
SA_K10_klpdrapu-166	atīva roṣasaṃkruṣṭo vicikṣepa yatīn api // KDA_79 //	atīva roṣa saṃkruṣṭaḥ vicikṣepa yatīn api 
SA_K10_klpdrapu-167	dharmārthakāmamokṣeṣu nirapekṣaḥ sutīkṣṇavāk* /	dharma artha kāma mokṣeṣu nirapekṣaḥ su tīkṣṇa vāc 
SA_K10_klpdrapu-168	sarvatra munibhiś cāpi vijagrāhāsamāhitaḥ // KDA_80 //	sarvatra munibhiḥ ca api vijagrāha asamāhitaḥ 
SA_K10_klpdrapu-169	ity enaṃ krodhasaṃraktaṃ vedasiddhāntamāninam* /	iti enam krodha saṃraktam veda siddhānta māninam 
SA_K10_klpdrapu-170	subhūtiṃ brāhmaṇaṃ dṛṣṭvā guruś caivam acintayat* // KDA_81 //	subhūtim brāhmaṇam dṛṣṭvā guruḥ ca evam acintayat 
SA_K10_klpdrapu-171	aho daivabalādhānāt subhūtir brāhmaṇo 'py ayam* /	aho daiva bala ādhānāt subhūtiḥ brāhmaṇaḥ pi ayam 
SA_K10_klpdrapu-172	svasiddhāntasamāno 'dya krūravāgvigrahotsukaḥ // KDA_82 //	sva siddhānta samānaḥ krūra vāc vigraha utsukaḥ 
SA_K10_klpdrapu-173	agnikalpo mahātīkṣṇaḥ sarvaśāstrārthakovidaḥ /	agni kalpaḥ mahā tīkṣṇaḥ sarva śāstra artha kovidaḥ 
SA_K10_klpdrapu-174	viśārado mahābhijño dharmasaṃyamatatparaḥ // KDA_83 //	viśāradaḥ mahā abhijñaḥ dharma saṃyama tatparaḥ 
SA_K10_klpdrapu-175	tapaś caraṇasaṃraktas tīkṣṇabuddhiḥ kṛtodyamaḥ /	tapaḥ caraṇa saṃraktaḥ tīkṣṇa buddhiḥ kṛta udyamaḥ 
SA_K10_klpdrapu-176	mahotsāho mahāvīraḥ siddhavidyo mahotkaṭaḥ // KDA_84 //	             
SA_K10_klpdrapu-177	sarvaśāstrakalābhijño mantrasiddhiprayogavit* /	                
SA_K10_klpdrapu-178	vedasiddhāntayogānāṃ pāragaś ca mahāsudhīḥ // KDA_85 //	veda siddhānta yogānām pāragaḥ ca mahā sudhīḥ 
SA_K10_klpdrapu-179	kiṃ tu krodhāviśuddhātmā vigrahī vādasaṃrataḥ /	kim tu krodha aviśuddha ātmā vigrahī vāda saṃrataḥ 
SA_K10_klpdrapu-180	kiṃcin nimittamātre 'pi vikruṣṭo 'tha ruṣāśayaḥ // KDA_86 //	kiṃcid nimitta mātre ruṣā āśayaḥ 
SA_K10_klpdrapu-181	kadācit kupito ruṣṭeḥ saṃkleśādhīracetanaḥ /	kadācid kupitaḥ ruṣṭeḥ saṃkleśa adhīra cetanaḥ 
SA_K10_klpdrapu-182	śāpāśaniprahāreṇa loke 'narthaṃ kariṣyati // KDA_87 //	śāpa aśani prahāreṇa loke nartham kariṣyati 
SA_K10_klpdrapu-183	tad ahaṃ saṃprabodhyainaṃ subhūtiṃ dvijasattamam* /	tat aham saṃprabodhya enam subhūtim dvijasattamam 
SA_K10_klpdrapu-184	samādhidhyānavaryāsu yojayeyaṃ sa sarvathā // KDA_88 //	samādhi dhyāna varyāsu yojayeyam sa sarvathā 
SA_K10_klpdrapu-185	iti matvā guruś cainaṃ subhūtiṃ samabodhayat* /	iti matvā guruḥ ca enam subhūtim samabodhayat 
SA_K10_klpdrapu-186	śṛṇu vatsa hitaṃ vakṣye tatra bhava samāhitaḥ // KDA_89 //	śṛṇu vatsa hitam vakṣye tatra bhava samāhitaḥ 
SA_K10_klpdrapu-187	-------------------- Vaidya, p. 271 --------------------	vaidya p 
SA_K10_klpdrapu-188	sarvavarṇāgrajo vipraḥ sarvajātivarottamaḥ /	               
