segmentnr	original	analyzed
SA_K10_klpdrapu-370	ye ca kṣetrāṇi karṣanti dhānyādivrīhisādhakāḥ /	ye ca kṣetrāṇi karṣanti dhānya ādi vrīhi sādhakāḥ 
SA_K10_klpdrapu-371	kṛṣikās te narā dhānyaiḥ satvajīvānupoṣakāḥ // KDA_178 //	kṛṣikāḥ te narāḥ dhānyaiḥ satva jīva an upoṣakāḥ 
SA_K10_klpdrapu-372	sādhayanti mahatkāryaṃ dhanādivastusaṃgrahaiḥ /	sādhayanti mahat kāryam dhana ādi vastu saṃgrahaiḥ 
SA_K10_klpdrapu-373	vaṇikkarmābhisaṃyuktā vaṇijas te mahodyamāḥ // KDA_179 //	vaṇij karma abhisaṃyuktāḥ vaṇijaḥ te mahā udyamāḥ 
SA_K10_klpdrapu-374	ye ca sārthān samāhṛtya ratnākarasamāgatāḥ /	ye ca sārthān samāhṛtya ratnākara samāgatāḥ 
SA_K10_klpdrapu-375	sādhayanti ca ratnāni sārthavāhāś ca te narāḥ // KDA_180 //	sādhayanti ca ratnāni sārthavāhāḥ ca te narāḥ 
SA_K10_klpdrapu-376	tathānye śilpavidyādīn ye ca kurvanti mānavāḥ /	tathā anye śilpa vidyā ādīn ye ca kurvanti mānavāḥ 
SA_K10_klpdrapu-377	śilpinas te tathānye 'pi svarṇakārādayo narāḥ // KDA_181 //	śilpinaḥ te tathā anye svarṇakāra ādayaḥ narāḥ 
SA_K10_klpdrapu-378	jyotir vidyāvido ye ca gaṇayanti divāniśam* /	jyotiḥ vidyā vidaḥ ye ca gaṇayanti divāniśam 
SA_K10_klpdrapu-379	yugāntakālavijñātā gaṇakās te 'pi mānavāḥ // KDA_182 //	yuga anta kāla vijñātāḥ gaṇakāḥ te mānavāḥ 
SA_K10_klpdrapu-380	dhātudoṣāny abhijñāya lokānāṃ paricārakāḥ /	dhātu doṣāni abhijñāya lokānām paricārakāḥ 
SA_K10_klpdrapu-381	bhaiṣajyaṃ ye dadanty eva bhiṣajas te hi vaidyakāḥ // KDA_183 //	bhaiṣajyam ye dadanti eva bhiṣajaḥ te hi vaidyakāḥ 
SA_K10_klpdrapu-382	-------------------- Vaidya, p. 277 --------------------	vaidya p 
SA_K10_klpdrapu-383	bhūtadoṣāṇy abhijñāya balipūjāvidhānataḥ /	bhūta doṣāṇi abhijñāya bali pūjā vidhānataḥ 
SA_K10_klpdrapu-384	śamayanti ca ye bhūtān bhautikās te 'pi mānavāḥ // KDA_184 //	śamayanti ca ye bhūtān bhautikāḥ te pi mānavāḥ 
SA_K10_klpdrapu-385	evaṃ cānye 'pi ye satvā yad yat karmānucāriṇaḥ /	evam ca anye ye satvāḥ yat yat karma anucāriṇaḥ 
SA_K10_klpdrapu-386	tat tat karmānuśīlena jātidharmapravṛttikāḥ // KDA_185 //	tat tat karma anuśīlena jāti dharma pravṛttikāḥ 
SA_K10_klpdrapu-387	tato ye mānavāḥ krūrā nirdayāḥ satvahiṃsakāḥ /	tatas ye mānavāḥ krūrāḥ nirdayāḥ satva hiṃsakāḥ 
SA_K10_klpdrapu-388	caṇḍavṛttipracārāś ca caṇḍālā iti te smṛtāḥ // KDA_186 //	caṇḍa vṛtti pracārāḥ ca caṇḍālāḥ iti te smṛtāḥ 
SA_K10_klpdrapu-389	ye bhajanti śivaṃ nityaṃ śivabhaktiparāyaṇāḥ /	ye bhajanti śivam nityam śiva bhakti parāyaṇāḥ 
SA_K10_klpdrapu-390	te śaivā manujā jñeyāḥ śivadharmānucārataḥ // KDA_187 //	te śaivāḥ manujāḥ jñeyāḥ śiva dharma anucārataḥ 
SA_K10_klpdrapu-391	ye bhajanti viṣṇuṃ nityaṃ viṣṇubhaktiparāyaṇāḥ /	ye bhajanti viṣṇum nityam viṣṇu bhakti parāyaṇāḥ 
SA_K10_klpdrapu-392	viṣṇudharmasamācārād vaiṣṇavās te 'pi mānavāḥ // KDA_188 //	viṣṇu dharma samācārāt vaiṣṇavāḥ te mānavāḥ 
SA_K10_klpdrapu-393	brahmāṇaṃ ye bhajayanty eva brahmabhaktiparāyaṇāḥ /	brahmāṇam ye bhajayanti eva brahma bhakti parāyaṇāḥ 
SA_K10_klpdrapu-394	brahmadharmasamācārād brāhmaṇās te 'pi mānavāḥ // KDA_189 //	brahma dharma samācārāt brāhmaṇāḥ te mānavāḥ 
SA_K10_klpdrapu-395	ye bhajanti mahāraudraṃ bhairavabhaktimānasāḥ /	ye bhajanti mahāraudram bhairava bhakti mānasāḥ 
SA_K10_klpdrapu-396	mahāraudrāś ca te khyātā bhairavikāś ca mānavāḥ // KDA_190 //	mahā raudrāḥ ca te khyātāḥ bhairavikāḥ ca mānavāḥ 
SA_K10_klpdrapu-397	ye ca māheśvarīṃ devīṃ bhajanti kuladharmiṇaḥ /	ye ca māheśvarīm devīm bhajanti kula dharmiṇaḥ 
SA_K10_klpdrapu-398	māheśvarīvratādhārāḥ kālikās te 'pi mānavāḥ // KDA_191 //	māheśvarī vrata ādhārāḥ kālikāḥ te mānavāḥ 
SA_K10_klpdrapu-399	yee bhajanti sadā buddhaṃ bauddhadharmaparāyaṇāḥ /	ye e bhajanti sadā buddham bauddha dharma parāyaṇāḥ 
SA_K10_klpdrapu-400	te 'pi ca mānavā bauddhāḥ saṃbodhipadasādhinaḥ // KDA_192 //	te ca mānavāḥ bauddhāḥ saṃbodhi pada sādhinaḥ 
SA_K10_klpdrapu-401	ye bhajanti jinaṃ caiva jainadharmaparāyaṇāḥ /	ye bhajanti jinam ca eva jaina dharma parāyaṇāḥ 
SA_K10_klpdrapu-402	te 'pi ca manujā jainā jainadharmānucāraṇāt* // KDA_193 //	te pi ca manujāḥ jaināḥ jaina dharma anucāraṇāt 
SA_K10_klpdrapu-403	evaṃ cānye 'pi ye satvā vratacaryānuliṅginaḥ /	evam ca anye pi ye satvāḥ vrata caryā anuliṅginaḥ 
SA_K10_klpdrapu-404	te 'pi ca mānavāḥ sarve dharmacaryānuvarṇinaḥ // KDA_194 //	te pi ca mānavāḥ sarve dharma caryā anuvarṇinaḥ 
SA_K10_klpdrapu-405	yādṛśaṃ sādhyate karma tādṛśī jātitā bhavet* /	yādṛśam sādhyate karma tādṛśī jāti tā bhavet 
SA_K10_klpdrapu-406	prajāpatir hi caikatve nirviśeṣo 'bhavad yataḥ // KDA_195 //	prajāpatiḥ hi ca ekatve nirviśeṣaḥ bhavat yatas 
SA_K10_klpdrapu-407	na cendriyeṣu nānātvaṃ kriyāvādena dṛśyate /	na ca indriyeṣu nānātvam kriyā vādena dṛśyate 
SA_K10_klpdrapu-408	brāhmaṇe cānyajātau vā naiṣāṃ kiṃcid viśiṣyate // KDA_196 //	brāhmaṇe ca anya jātau vā na eṣām kiṃcid viśiṣyate 
SA_K10_klpdrapu-409	na hy ātmanaḥ samutkarṣāc chreṣṭhatvam iha yujyate /	na hi ātmanaḥ samutkarṣāt śreṣṭha tvam iha yujyate 
SA_K10_klpdrapu-410	śukraśoṇitasaṃbhūtaṃ yonijaṃ sarvam eva hi // KDA_197 //	śukra śoṇita saṃbhūtam yoni jam sarvam eva hi 
SA_K10_klpdrapu-411	cāturvarṇyam idaṃ lokam iti tīrthyair vikalpitam* /	cāturvarṇyam idam lokam iti tīrthyaiḥ vikalpitam 
SA_K10_klpdrapu-412	brahmajā brāhmaṇā naivaṃ dharmasaṃskārajāḥ khalu // KDA_198 //	brahma jāḥ brāhmaṇāḥ na evam dharma saṃskāra jāḥ khalu 
SA_K10_klpdrapu-413	yadi vā brahmajā viprā brāhmaṇī kutra saṃbhavā /	yadi vā brahma jāḥ viprāḥ brāhmaṇī kutra 
SA_K10_klpdrapu-414	brāhmaṇy api tathā caiva brahmajā yadi sāṃpratam* // KDA_199 //	brāhmaṇī api tathā ca eva brahma jā yadi sāṃpratam 
SA_K10_klpdrapu-415	-------------------- Vaidya, p. 278 --------------------	vaidya p 
SA_K10_klpdrapu-416	brāhmaṇasya ca sā bhāryā syāc caivedaṃ na yuktitaḥ /	brāhmaṇasya ca sā bhāryā syāt ca evā idam na yuktitaḥ 
SA_K10_klpdrapu-417	na bhāryā bhaginī yuktā brahmaṇāṃ brahmajā yadi // KDA_200 //	na bhāryā bhaginī yuktā brahmaṇām brahma jā yadi 
SA_K10_klpdrapu-418	na satvā brahmaṇo jātāḥ karmasaṃskārajās tvamī /	na satvāḥ brahmaṇaḥ jātāḥ karma saṃskāra jāḥ tu amī 
SA_K10_klpdrapu-419	nihīnotkṛṣṭamadhyāś ca satvā nānāśrayāḥ pṛthak* // KDA_201 //	nihīna utkṛṣṭa madhyāḥ ca satvāḥ nānā āśrayāḥ pṛthak 
SA_K10_klpdrapu-420	teṣāṃ hi jātisāmānyād brāhmaṇe kṣatriye tathā /	teṣām hi jāti sāmānyāt brāhmaṇe kṣatriye tathā 
SA_K10_klpdrapu-421	vaiśyaśūdre tathānyeṣu samaṃ jñānaṃ pravartate // KDA_202 //	vaiśya śūdre tathā anyeṣu samam jñānam pravartate 
SA_K10_klpdrapu-422	śīlaṃ pradhānaṃ na kulaṃ pradhānaṃ kulena kiṃ śīlavivarjitena /	śīlam pradhānam na kulam pradhānam kulena kim śīla vivarjitena 
SA_K10_klpdrapu-423	bahavo narā nīcakulaprasūtāḥ svargaṃ gatāḥ śīlam upetya dhīrāḥ // KDA_203 //	bahavaḥ narāḥ nīca kula prasūtāḥ svargam gatāḥ śīlam upetya dhīrāḥ 
SA_K10_klpdrapu-424	na jātir dṛśyate devaiḥ śīlaḥ kalyāṇakārakaḥ /	na jātiḥ dṛśyate devaiḥ śīlaḥ kalyāṇa kārakaḥ 
SA_K10_klpdrapu-425	caṇḍālo 'pi hi śīlasthas taṃ devā brāhmaṇaṃ viduḥ // KDA_204 //	caṇḍālaḥ u pi hi śīla sthaḥ tam devāḥ brāhmaṇam viduḥ 
SA_K10_klpdrapu-426	satyaṃ brahma tapo brahma śīlaś cendriyasaṃyamaḥ /	satyam brahma tapaḥ brahma śīlaḥ ca indriya saṃyamaḥ 
SA_K10_klpdrapu-427	sarvabhūtadayā brahma etad brāhmaṇalakṣaṇam* // KDA_205 //	sarva bhūta dayā brahma etat brāhmaṇa lakṣaṇam 
SA_K10_klpdrapu-428	satyaṃ nāsti tapo nāsti nāsti cendriyasaṃyamaḥ /	satyam nā asti tapaḥ nā asti nā asti ca indriya saṃyamaḥ 
SA_K10_klpdrapu-429	sarvabhūtadayā nāsti etac caṇḍālalakṣaṇam* // KDA_206 //	sarva bhūta dayā na asti etat caṇḍāla lakṣaṇam 
SA_K10_klpdrapu-430	devamanuṣyanārīṇāṃ tiryagyonigateṣv api /	deva manuṣya nārīṇām tiryagyoni gateṣu api 
SA_K10_klpdrapu-431	maithunaṃ nādhigacchanti te narā brāhmaṇāḥ khalu // KDA_207 //	maithunam na adhigacchanti te narāḥ brāhmaṇāḥ khalu 
SA_K10_klpdrapu-432	śūdrīhastena yo bhuṅkte māsam ekaṃ nirantaram* /	śūdrī hastena yaḥ bhuṅkte māsam ekam nirantaram 
SA_K10_klpdrapu-433	jīvamāno bhavec chūdro mṛtaḥ sa śvā prajāyate // KDA_207 //	jīvamānaḥ bhavet śūdraḥ mṛtaḥ sa śvā prajāyate 
SA_K10_klpdrapu-434	śūdrīparivṛto vipraḥ śūdrī ca gṛhamedhinī /	śūdrī parivṛtaḥ vipraḥ śūdrī ca gṛhamedhinī 
SA_K10_klpdrapu-435	varjitaḥ pitṛdevaiś ca rauravaṃ so 'dhigacchati // KDA_208 //	varjitaḥ pitṛ devaiḥ ca rauravam saḥ dhigacchati 
SA_K10_klpdrapu-436	tasmād dharmatapaḥśīla- saṃyamajñānato dvijaḥ /	tasmāt dharma tapaḥ śīla saṃyama jñānataḥ dvijaḥ 
SA_K10_klpdrapu-437	na tv etair hi vinā vipraḥ kiṃ syāt saṃskāramātrataḥ // KDA_210 //	na tu etaiḥ hi vinā vipraḥ kim syāt saṃskāra mātrataḥ 
SA_K10_klpdrapu-438	tan na śarīrasaṃskāra- mātreṇa brāhmaṇo bhavet* /	tat na śarīra saṃskāra mātreṇa brāhmaṇaḥ bhavet 
SA_K10_klpdrapu-439	saṃskṛtena dvijo vā cec chūdro 'pi saṃskṛto dvijaḥ // KDA_211 //	saṃskṛtena dvijaḥ vā ced śūdraḥ api saṃskṛtaḥ dvijaḥ 
SA_K10_klpdrapu-440	yadi vipraḥ śarīraḥ syāt pāvako brahmahā bhavet* /	yadi vipraḥ śarīraḥ syāt pāvakaḥ brahma hā bhavet 
SA_K10_klpdrapu-441	brahmahatyā ca bandhūnāṃ śarīradahanād bhavet* // KDA_212 //	brahmahatyā ca bandhūnām śarīra dahanāt bhavet 
SA_K10_klpdrapu-442	brāhmaṇabījasaṃbhūtaḥ śūdro 'pi na kathaṃ dvijaḥ /	brāhmaṇa bīja saṃbhūtaḥ śūdraḥ api na katham dvijaḥ 
SA_K10_klpdrapu-443	tasmād dhi brāhmaṇo naiva dehasaṃskāramātrataḥ // KDA_123 //	tasmāt hi brāhmaṇaḥ na eva deha saṃskāra mātrataḥ 
SA_K10_klpdrapu-444	sadyaḥ patati māṃsena dhātvannakṣiravikrayī /	sadyas patati māṃsena dhātu anna kṣira vikrayī 
SA_K10_klpdrapu-445	brāhmaṇo 'pi bhavec chūdraḥ surayā lavaṇena ca // KDA_214 //	brāhmaṇaḥ pi bhavet śūdraḥ surayā lavaṇena ca 
SA_K10_klpdrapu-446	ākāśagāmino priyāḥ patitā māṃsabhakṣaṇāt* /	ākāśa gāminaḥ priyāḥ patitāḥ māṃsa bhakṣaṇāt 
SA_K10_klpdrapu-447	viprāṇāṃ patanaṃ dṛṣṭvā tato māṃsāni varjayet // KDA_215 //	viprāṇām patanam dṛṣṭvā tatas māṃsāni varjayet 
SA_K10_klpdrapu-448	-------------------- Vaidya, p. 279 --------------------	vaidya p 
SA_K10_klpdrapu-449	bhakṣyante yena māṃsāni bhakṣyate tena kiṃ na hi /	bhakṣyante yena māṃsāni bhakṣyate tena kim na hi 
SA_K10_klpdrapu-450	abhakṣyabhakṣaṇāc caiva brāhmaṇaḥ patito bhavet* // KDA_216 //	abhakṣya bhakṣaṇāt ca eva brāhmaṇaḥ patitaḥ bhavet 
SA_K10_klpdrapu-451	patito brāhmaṇaś caivaṃ saṃskāraṃ nārhati punaḥ /	patitaḥ brāhmaṇaḥ ca evam saṃskāram na arhati punar 
SA_K10_klpdrapu-452	tasmāj jñānaṃ vinā naiva śarīro brāhmaṇo bhavet* // KDA_217 //	tasmāt jñānam vinā nā eva śarīraḥ brāhmaṇaḥ bhavet 
SA_K10_klpdrapu-453	jñānavān hi bhavet pūjyo brāhmaṇā api mānavāḥ /	jñānavān hi bhavet pūjyaḥ brāhmaṇāḥ api mānavāḥ 
SA_K10_klpdrapu-454	samāneṣu ca deheṣu kutrāpy asti viśeṣatā // KDA_218 //	samāneṣu ca deheṣu kutra api asti viśeṣa tā 
SA_K10_klpdrapu-455	tasmāj jñānapramāṇena na śarīrapramāṇatā /	tasmāt jñāna pramāṇena na śarīra pramāṇa tā 
SA_K10_klpdrapu-456	yathā karoti bhāṇdāni mṛttikayaiva bhārgavaḥ // KDA_219 //	yathā karoti mṛttikayā eva bhārgavaḥ 
SA_K10_klpdrapu-457	mṛttikāyā na bhedo 'sti tatkṛtabhājaneṣv api /	mṛttikāyāḥ na bhedaḥ sti tad kṛta bhājaneṣu api 
SA_K10_klpdrapu-458	kiṃ tu prakṣiptavastūnāṃ saṃjñayākhyāyate khalu // KDA_220 //	kim tu prakṣipta vastūnām saṃjñayā ākhyāyate khalu 
SA_K10_klpdrapu-459	prakṣiptaṃ yatra yad dravyaṃ tad bhāṇḍaṃ tena lakṣyate /	prakṣiptam yatra yat dravyam tat bhāṇḍam tena lakṣyate 
SA_K10_klpdrapu-460	jñānadharmaguṇācārair lakṣyate mānavas tathā // KDA_221 //	jñāna dharma guṇa ācāraiḥ lakṣyate mānavaḥ tathā 
SA_K10_klpdrapu-461	jñānadharmaguṇācārair vihīno mānavaḥ paśuḥ /	jñāna dharma guṇa ācāraiḥ vihīnaḥ mānavaḥ paśuḥ 
SA_K10_klpdrapu-462	jñānavijñānabhedena vartate guṇabhedatā // KDA_222 //	jñāna vijñāna bhedena vartate guṇa bheda tā 
SA_K10_klpdrapu-463	guṇabhedād bhaved dharma- bhedā ca saṃprajāyate /	guṇa bhedāt bhavet ca saṃprajāyate 
SA_K10_klpdrapu-464	dharmabhedāt tataḥ karma- bhedatā saṃpravartate // KDA_223 //	dharma bhedāt tatas karma bheda tā saṃpravartate 
SA_K10_klpdrapu-465	karmabhedāt tathācāra- bhedatā ca pravartate /	karma bhedāt tathā ācāra bheda tā ca pravartate 
SA_K10_klpdrapu-466	tathācāraviśeṣeṇa jātibhedāḥ pravartitāḥ // KDA_224 //	tathā ācāra viśeṣeṇa jāti bhedāḥ pravartitāḥ 
SA_K10_klpdrapu-467	mahābhūtasamudbhūta- skandheṣv āyataneṣu ca /	skandheṣu āyataneṣu ca 
SA_K10_klpdrapu-468	sarvajantuśarīreṣu sameṣu kā viśeṣatā // KDA_225 //	sarva jantu śarīreṣu sameṣu kā viśeṣa tā 
SA_K10_klpdrapu-469	jñānavijñānamātreṇa bhidyante khalu mānavāḥ /	jñāna vijñāna mātreṇa bhidyante khalu mānavāḥ 
SA_K10_klpdrapu-470	jñānavijñānapātratvāt pūjyante nīcajā api // KDA_226 //	jñāna vijñāna pātra tvāt pūjyante nīca jāḥ api 
SA_K10_klpdrapu-471	jñānavijñānahīnatvān mānavo 'pi na pūjyate /	jñāna vijñāna hīna tvāt mānavaḥ pi na pūjyate 
SA_K10_klpdrapu-472	paśuvatsa narākāraḥ tataḥ pūjā na cākṛteḥ // KDA_227 //	paśu vat sa nara ākāraḥ tatas pūjā na ca ākṛteḥ 
SA_K10_klpdrapu-473	jñānenāpi dvijo naiva karmācārapramāṇataḥ /	jñānena api dvijaḥ nā eva karma ācāra pramāṇataḥ 
SA_K10_klpdrapu-474	jñānena yadi vā vipraḥ śūdro 'pi brāhmaṇo bhavet* // KDA_228 //	jñānena yadi vā vipraḥ brāhmaṇaḥ bhavet 
SA_K10_klpdrapu-475	anye 'pi bahavaḥ santi sakaivartādinīcajāḥ /	anye pi bahavaḥ santi sa kaivarta ādi nīca jāḥ 
SA_K10_klpdrapu-476	jñānavantaś ca ye dhīrās te 'pi syur brāhmaṇāḥ khalu // KDA_229 //	jñānavantaḥ ca ye dhīrāḥ te pi syuḥ brāhmaṇāḥ khalu 
SA_K10_klpdrapu-477	tamāc ca jñānamātreṇa brāhmaṇo na bhavet khalu /	ca jñāna mātreṇa brāhmaṇaḥ na bhavet khalu 
SA_K10_klpdrapu-478	karmācārapramāṇena na jñānasya pramāṇatā // KDA_230 //	karma ācāra pramāṇena na jñānasya pramāṇa tā 
SA_K10_klpdrapu-479	karmaṇāpi dvijo naiva śuddhācārapramāṇataḥ /	karmaṇā api dvijaḥ nā eva śuddha ācāra pramāṇataḥ 
SA_K10_klpdrapu-480	karmaṇā vai dvijāś caivaṃ sarve syur brāhmaṇāḥ khalu // KDA_231 //	karmaṇā vai dvijāḥ ca evam sarve syuḥ brāhmaṇāḥ khalu 
SA_K10_klpdrapu-481	-------------------- Vaidya, p. 280 --------------------	vaidya p 
SA_K10_klpdrapu-482	santi hi bahavo loke mahāyajñādikarmiṇaḥ /	santi hi bahavaḥ loke mahāyajña ādi karmiṇaḥ 
SA_K10_klpdrapu-483	kṣatriyavaiśyaśūdrāś ca kathaṃ na brāhmaṇā nu te // KDA_232 //	kṣatriya vaiśya śūdrāḥ ca katham na brāhmaṇāḥ nu te 
SA_K10_klpdrapu-484	tasmān na karmamātreṇa brāhmaṇāḥ syur narāḥ khalu /	tasmāt na karma mātreṇa brāhmaṇāḥ syuḥ narāḥ khalu 
SA_K10_klpdrapu-485	nāpi svācāramātreṇa brāhmaṇāḥ syus tathā narāḥ // KDA_233 //	na api sva ācāra mātreṇa brāhmaṇāḥ syuḥ tathā narāḥ 
SA_K10_klpdrapu-486	yadi svācārato vipraḥ sarve syur brāhmaṇāḥ khalu /	yadi su ācārataḥ vipraḥ sarve syuḥ brāhmaṇāḥ khalu 
SA_K10_klpdrapu-487	ye ye svācāravantaś ca te te syur brāhmaṇāḥ kila // KDA_234 //	ye ye su ācāravantaḥ ca te te syuḥ brāhmaṇāḥ kila 
SA_K10_klpdrapu-488	santi ca bahavaḥ śūdrāḥ śuddhācārasamanvitāḥ /	santi ca bahavaḥ śūdrāḥ śuddha ācāra samanvitāḥ 
SA_K10_klpdrapu-489	vratopavāsadharmiṣṭā nīcajā api santi ca // KDA_235 //	vrata upavāsa dharmiṣṭāḥ nīca jāḥ api santi ca 
SA_K10_klpdrapu-490	te 'pi syur brāhmaṇāś caivaṃ yady ācārapramāṇatā /	te syuḥ brāhmaṇāḥ ca evam yadi ācāra pramāṇa tā 
SA_K10_klpdrapu-491	tasmād ācāramātreṇa brāhmaṇā naiva mānuṣāḥ // KDA_236 //	tasmāt ācāra mātreṇa brāhmaṇāḥ na eva mānuṣāḥ 
SA_K10_klpdrapu-492	vedenāpi tathā naiva brāhmaṇāḥ syur narottamāḥ /	vedena api tathā nā eva brāhmaṇāḥ syuḥ nara uttamāḥ 
SA_K10_klpdrapu-493	yadi vedair bhaved vipro rākṣaso 'pi dvijaḥ khalu // KDA_237 //	yadi vedaiḥ bhavet vipraḥ dvijaḥ khalu 
SA_K10_klpdrapu-494	tathābhūd rāvaṇo nāma rākṣaso vedapāragaḥ /	rāvaṇaḥ nāma rākṣasaḥ vedapāragaḥ 
SA_K10_klpdrapu-495	sarve 'pi rākṣasāś caivaṃ vedakarmānucārakāḥ // KDA_238 //	sarve rākṣasāḥ ca evam veda karma anucārakāḥ 
SA_K10_klpdrapu-496	kathaṃ te brāhmaṇā naiva yadi vedād dvijo bhavet* /	katham te brāhmaṇāḥ nā eva yadi vedāt dvijaḥ bhavet 
SA_K10_klpdrapu-497	tasmāc ca vedamātreṇa naiva syur brāhmaṇāḥ khalu // KDA_230 //	tasmāt ca veda mātreṇa na eva syuḥ brāhmaṇāḥ khalu 
SA_K10_klpdrapu-498	satyadharmapramāṇena sarvam ekaṃ jagad dhruvam* /	satya dharma pramāṇena sarvam ekam jagat dhruvam 
SA_K10_klpdrapu-499	cāturvarṇyam idaṃ lokaṃ tīrthikair iti kalpitam* // KDA_240 //	cāturvarṇyam idam lokam tīrthikaiḥ iti kalpitam 
SA_K10_klpdrapu-500	tathā ca kalpyate loka- bodhārtham iti tīrthikaiḥ /	tathā ca kalpyate loka bodha artham iti tīrthikaiḥ 
SA_K10_klpdrapu-501	svayaṃbhūdehasaṃbhūtaṃ cāturvarṇyam idaṃ khalu // KDA_241 //	svayaṃbhū deha saṃbhūtam cāturvarṇyam idam khalu 
SA_K10_klpdrapu-502	mukhato brāhmaṇo jāto bāhubhyāṃ kṣatriyaḥ smṛtaḥ /	mukhataḥ brāhmaṇaḥ jātaḥ bāhubhyām kṣatriyaḥ smṛtaḥ 
SA_K10_klpdrapu-503	ūrubhyāṃ saṃbhavo vaiśyaḥ padbhyāṃ śūdraḥ samudbhavaḥ // KDA_242 //	ūrubhyām saṃbhavaḥ vaiśyaḥ padbhyām śūdraḥ samudbhavaḥ 
SA_K10_klpdrapu-504	tathā ced dhi bhaved doṣo dharmeṣu varṇavādinām* /	tathā ced hi bhavet doṣaḥ dharmeṣu varṇa vādinām 
SA_K10_klpdrapu-505	agamyagamanāc caivaṃ kathaṃ dharmaviśuddhitā // KDA_243 //	agamya gamanāt ca evam katham dharma viśuddhi tā 
SA_K10_klpdrapu-506	yadi vipro mukhāj jāto brāhmaṇī kutra saṃbhavā /	yadi vipraḥ mukhāt jātaḥ brāhmaṇī kutra 
SA_K10_klpdrapu-507	brāhmaṇy api mukhāj jātā svasā bhāryā kathaṃ nanu // KDA_244 //	brāhmaṇī api mukhāt jātā svasā bhāryā katham nanu 
SA_K10_klpdrapu-508	tathā ca kṣatriyā jātā bāhubhyām eva cet tathā /	tathā ca kṣatriyā jātā bāhubhyām eva ced tathā 
SA_K10_klpdrapu-509	kṣatriyasya bhaved bhāryā kṣatriyā bhaginī khalu // KDA_245 //	kṣatriyasya bhavet bhāryā kṣatriyā bhaginī khalu 
SA_K10_klpdrapu-510	vaiśyāpi hi tathā caivam ūrubhyām eva saṃbhavā /	vaiśyā api hi tathā ca evam ūrubhyām eva saṃbhavā 
SA_K10_klpdrapu-511	vaiśyasyāpi bhaved bhāryā vaiśyā tu bhaginī viśaḥ // KDA_246 //	vaiśyasya api bhavet bhāryā vaiśyā tu bhaginī viśaḥ 
SA_K10_klpdrapu-512	padbhyāṃ jāto yathā śūdraḥ śūdrī cāpi tathodbhavā /	padbhyām jātaḥ yathā śūdraḥ śūdrī ca api tathā udbhavā 
SA_K10_klpdrapu-513	śūdrasyāpi bhaved bhāryā śūdrī hi bhaginī khalu // KDA_247 //	śūdrasya api bhavet bhāryā śūdrī hi bhaginī khalu 
SA_K10_klpdrapu-514	-------------------- Vaidya, p. 281 --------------------	vaidya p 
SA_K10_klpdrapu-515	na yuktā bhaginī bhāryā tathā dharmaḥ kathaṃ bhavet* /	na yuktā bhaginī bhāryā tathā dharmaḥ katham bhavet 
SA_K10_klpdrapu-516	agamyagamanāc caivam adharma eva saṃbhavet* // KDA_248 //	agamya gamanāt ca evam adharmaḥ eva saṃbhavet 
SA_K10_klpdrapu-517	tato 'tyantaviruddhaṃ syād brahmajā brāhmaṇā yadi /	tyanta viruddham syāt brahma jāḥ brāhmaṇāḥ yadi 
SA_K10_klpdrapu-518	dharmakriyāviśeṣāt tu varṇāvasthāḥ pratiṣṭhitāḥ // KDA_249 //	dharma kriyā viśeṣāt tu varṇa avasthāḥ pratiṣṭhitāḥ 
SA_K10_klpdrapu-519	bhārate 'pi tathā caivaṃ dharmarājo yudhiṣṭhiraḥ /	bhārate tathā ca evam dharmarājaḥ yudhiṣṭhiraḥ 
SA_K10_klpdrapu-520	vaiśampāyanam āgamya prāñjaliḥ paryapṛcchata // KDA_250 //	vaiśampāyanam āgamya prāñjaliḥ paryapṛcchata 
SA_K10_klpdrapu-521	ke te ye brāhmaṇāḥ proktāḥ kiṃ vā brāhmaṇalakṣaṇam* /	ke te ye brāhmaṇāḥ proktāḥ kim vā brāhmaṇa lakṣaṇam 
SA_K10_klpdrapu-522	etad icchāmi bho jñātuṃ tadbhavān vyākarotu me // KDA_251 //	etat icchāmi bho jñātum tat bhavān vyākarotu me 
SA_K10_klpdrapu-523	iti śrutvā mahāvijño vaiśampāyana ādarāt* /	iti śrutvā mahā vijñaḥ vaiśampāyanaḥ ādarāt 
SA_K10_klpdrapu-524	pratyuvāceti kaunteya śṛṇu tat kathyate mayā // KDA_252 //	pratyuvāca iti kaunteya śṛṇu tat kathyate mayā 
SA_K10_klpdrapu-525	kṣāntyādibhir guṇair yuktas tyaktadaṇḍo nirāmiṣaḥ /	kṣānti ādibhiḥ guṇaiḥ yuktaḥ tyakta daṇḍaḥ nirāmiṣaḥ 
SA_K10_klpdrapu-526	na hanti sarvabhūtāni prathamaṃ brāhmalakṣaṇam* // KDA_253 //	na hanti sarva bhūtāni prathamam brāhma lakṣaṇam 
SA_K10_klpdrapu-527	yadā sarvaparadravyaṃ pathi vā yadi vā gṛhe /	yadā sarva para dravyam pathi vā yadi vā gṛhe 
SA_K10_klpdrapu-528	adattaṃ naiva gṛhṇāti dvitīyaṃ brāhmalakṣaṇam* // KDA_254 //	a dattam na eva gṛhṇāti dvitīyam brāhma lakṣaṇam 
SA_K10_klpdrapu-529	tyaktakrūrasvabhāvas tu nirmamo niḥparigrahaḥ /	tyakta krūra svabhāvaḥ tu nirmamaḥ niḥparigrahaḥ 
SA_K10_klpdrapu-530	muktaś carati yo nityaṃ tṛtīyaṃ brāhmalakṣaṇam* // KDA_255 //	muktaḥ carati yaḥ nityam tṛtīyam brāhma lakṣaṇam 
SA_K10_klpdrapu-531	devamanuṣyanārīṇāṃ tiryagyonigateṣv api /	deva manuṣya nārīṇām tiryagyoni gateṣu api 
SA_K10_klpdrapu-532	maithunaṃ hi sadā tyaktaṃ caturthaṃ brāhmalakṣaṇam* // KDA_256 //	maithunam hi sadā tyaktam caturtham brāhma lakṣaṇam 
SA_K10_klpdrapu-533	satyaṃ śaucaṃ dayā śaucaṃ śaucam indriyanigrahaḥ /	satyam śaucam dayā śaucam śaucam indriya nigrahaḥ 
SA_K10_klpdrapu-534	sarvabhūtadayā śaucaṃ tapaḥ śaucaṃ ca pañcamam* // KDA_257 //	sarva bhūta dayā śaucam tapaḥ śaucam ca pañcamam 
SA_K10_klpdrapu-535	pañcalakṣaṇasaṃpanna īdṛśo yo bhaved dvijaḥ /	pañca lakṣaṇa saṃpannaḥ īdṛśaḥ yaḥ bhavet dvijaḥ 
SA_K10_klpdrapu-536	tam ahaṃ brāhmaṇaṃ brūyāṃ śeṣāḥ śudrā yudhiṣṭhira // KDA_258 //	tam aham brāhmaṇam brūyām śeṣāḥ śudrāḥ yudhiṣṭhira 
SA_K10_klpdrapu-537	na kulena na jātyā ca kriyābhir brāhmaṇo na ca /	na kulena na jātyā ca kriyābhiḥ brāhmaṇaḥ na ca 
SA_K10_klpdrapu-538	cāṇḍālo 'pi hi vṛttastho brāhmaṇaḥ sa yudhiṣṭhira // KDA_259 //	cāṇḍālaḥ pi hi vṛtta sthaḥ brāhmaṇaḥ sa yudhiṣṭhira 
SA_K10_klpdrapu-539	ahiṃsā brahmacaryaṃ ca viśuddhātmāparigrahaḥ /	ahiṃsā brahmacaryam ca viśuddha ātma aparigrahaḥ 
SA_K10_klpdrapu-540	phaleṣv anabhilipsātha brāhmaṇaḥ syād yudhiṣṭhira // KDA_260 //	phaleṣu an abhilipsā atha brāhmaṇaḥ syāt yudhiṣṭhira 
SA_K10_klpdrapu-541	ekavarṇam idaṃ viśvaṃ pūrvam āsīd yudhiṣṭhira /	eka varṇam idam viśvam pūrvam āsīt yudhiṣṭhira 
SA_K10_klpdrapu-542	karmakriyāviśeṣeṇa cāturvarṇyaṃ pratiṣṭhitam* // KDA_261 //	karma kriyā viśeṣeṇa cāturvarṇyam pratiṣṭhitam 
SA_K10_klpdrapu-543	sarve vai yonijā martyāḥ sarve mūtrapurīṣiṇaḥ /	sarve vai yoni jāḥ martyāḥ sarve mūtra purīṣiṇaḥ 
SA_K10_klpdrapu-544	ekendriyakriyārthāś ca tasmāc chīlaguṇair dvijāḥ // KDA_262 //	eka indriya kriyā arthāḥ ca tasmāt śīla guṇaiḥ dvijāḥ 
SA_K10_klpdrapu-545	śūdro 'pi śīlasaṃpanno guṇavān brāhmaṇo bhavet* /	śūdraḥ pi śīla saṃpannaḥ guṇavān brāhmaṇaḥ bhavet 
SA_K10_klpdrapu-546	brāhmaṇo 'pi kriyāhīnaḥ śūdrāt pratyavaro bhavet* // KDA_263 //	brāhmaṇaḥ pi kriyā hīnaḥ śūdrāt pratyavaraḥ bhavet 
SA_K10_klpdrapu-547	-------------------- Vaidya, p. 282 --------------------	vaidya p 
SA_K10_klpdrapu-548	pañcendriyārṇavaṃ ghoraṃ yadi śūdro 'pi tīrṇavān* /	pañca indriya arṇavam ghoram yadi tīrṇavān 
