segmentnr	original	analyzed
SA_MB_somasambhupaddhativyakhyaHK-2977	māyā saṃvaddhyate paścāt sukhaduḥkhaikakāraṇam |	māyā saṃvaddhyate paścāt sukha duḥkha eka kāraṇam 
SA_MB_somasambhupaddhativyakhyaHK-2978	p.180)	Ro
SA_MB_somasambhupaddhativyakhyaHK-2979	karmasambandhamāyāti māyī yaśca kalādikam |	karma sambandham āyāti māyī yaḥ ca kalā ādikam 
SA_MB_somasambhupaddhativyakhyaHK-2980	sakāryakāraṇatvena bhogajñānāya badhyate ||	sa kārya kāraṇa tvena bhoga jñānāya badhyate 
SA_MB_somasambhupaddhativyakhyaHK-2981	trayāvasthātmakā jīvāssarve kālakrameṇa vai |	traya avasthā ātmakāḥ jīvāḥ sarve kāla krameṇa vai 
SA_MB_somasambhupaddhativyakhyaHK-2982	māyorddhaṃ prāgavasthāyāṃ māyāyāntu dvi * yaṃ ||	māyā ūrddham prāc avasthāyām māyāyāntu dvi 
SA_MB_somasambhupaddhativyakhyaHK-2983	tṛtīyā kalādau tu sthitireṣāṃ prakīrtitāḥ ||	tṛtīyā kalā ādau tu sthitiḥ eṣām prakīrtitāḥ 
SA_MB_somasambhupaddhativyakhyaHK-2984	iti |	iti 
SA_MB_somasambhupaddhativyakhyaHK-2985	ayaṃ dīkṣānirūpaṇāyāha - nirādhārādi teṣāṃ nirūpaṇāyāha -	ayam dīkṣā nirūpaṇāya āha nirādhāra ādi teṣām nirūpaṇāya āha 
SA_MB_somasambhupaddhativyakhyaHK-2986	nirādhāretyādi | teṣāṃ trayāṇāṃ madhye dvayoḥ vijñāna -	nirādhāra ityādi teṣām trayāṇām madhye dvayoḥ 
SA_MB_somasambhupaddhativyakhyaHK-2987	kalāpralayākalayorniradhikaraṇe śivena tīvraśaktinipātena kriyate | yā sā	kalā pralaya akalayoḥ niradhikaraṇe śivena tīvra śakti nipātena kriyate yā sā 
SA_MB_somasambhupaddhativyakhyaHK-2988	nirādhārā bhavati | tathā dīkṣitāśca sadyaḥ śivā vā vidyeśvarā	nirādhārā bhavati tathā dīkṣitāḥ ca sadyas śivā vā vidyeśvarā 
SA_MB_somasambhupaddhativyakhyaHK-2989	mantreśvarā bhavanti | tathā coktaṃ -	mantreśvarāḥ bhavanti tathā ca uktam 
SA_MB_somasambhupaddhativyakhyaHK-2990	yānvimocayati svāpe śivāssadyo bhavanti te |	yān vimocayati svāpe śivāḥ sadyas bhavanti te 
SA_MB_somasambhupaddhativyakhyaHK-2991	saṃhṛtau vā samudbhūtā vāṇavaḥ patayo'thavā ||	saṃhṛtau vā samudbhūtāḥ vāṇavaḥ 
SA_MB_somasambhupaddhativyakhyaHK-2992	iti |	iti 
SA_MB_somasambhupaddhativyakhyaHK-2993	asyāpyayamarthaḥ | śivasvāpe mohakāle yato	asya api ayam arthaḥ śiva svāpe moha kāle yatas 
SA_MB_somasambhupaddhativyakhyaHK-2994	vijñānakalapralayākalāvasthāyāmātmano jñānaśunyā	vijñānakala pralaya akala avasthāyām ātmanaḥ jñāna śunyā 
SA_MB_somasambhupaddhativyakhyaHK-2995	avasthāmatassyādityarthaḥ |	avasthāmataḥ syāt iti arthaḥ 
SA_MB_somasambhupaddhativyakhyaHK-2996	p.181)	Ro
SA_MB_somasambhupaddhativyakhyaHK-2997	tadā yān anugṛhṇāti te sadyaḥ tatkṣaṇameva śivā bhavanti | tatassaṃhṛtau	tadā yān anugṛhṇāti te sadyas tad kṣaṇam eva śivāḥ bhavanti tatas saṃhṛtau 
SA_MB_somasambhupaddhativyakhyaHK-2998	sakalānāṃ saṃhāre vā samudbhūtau pralayākalānāṃ sṛṣṭikāle	sakalānām saṃhāre vā samudbhūtau pralayākalānām sṛṣṭi kāle 
SA_MB_somasambhupaddhativyakhyaHK-2999	kalādyanubandhanakāle vā yatastadeva teṣāṃ sṛṣṭhiratastadā yānanugṛhṇāti |	kalā ādi anubandhana kāle vā yatas tat eva teṣām sṛṣṭhiḥ atas tadā yān anugṛhṇāti 
SA_MB_somasambhupaddhativyakhyaHK-3000	te hyaṇavo mantreśvarā patayo vidyeśvarā vā bhavantītyarthaḥ |	te hi aṇavaḥ mantra īśvarāḥ patayaḥ vidyā īśvarāḥ vā bhavanti iti arthaḥ 
SA_MB_somasambhupaddhativyakhyaHK-3001	athācāryamūrtimāsthāya śambhumaheśvaraśaktyā kathaṃ bhūtayā	atha ācārya mūrtim āsthāya śambhu maheśvara śaktyā katham bhūtayā 
SA_MB_somasambhupaddhativyakhyaHK-3002	atitīvradīptibhedayā mandamandataratīvratīvratarayā sakalasya yā dīkṣā kurute	ati tīvra dīpti bhedayā manda mandatara tīvra tīvra tarayā sakalasya yā dīkṣā kurute 
SA_MB_somasambhupaddhativyakhyaHK-3003	sā sādhikaraṇocyate | yogānusārān mandādiśaktiṃ svecchākhyāṃ nipatyāya	sā sā adhikaraṇā ucyate yoga anusārāt manda ādi śaktim sva icchā ākhyām 
SA_MB_somasambhupaddhativyakhyaHK-3004	tadabhivyaktaye dīkṣāṃ karotīti bhāvaḥ | tathā coktaṃ -	tad abhivyaktaye dīkṣām karoti iti bhāvaḥ tathā ca uktam 
SA_MB_somasambhupaddhativyakhyaHK-3005	tataḥ prabhṛti mukto'sau yadāhṛtaśivecchayā |	tatas prabhṛti muktaḥ asau yad āhṛta śiva icchayā 
SA_MB_somasambhupaddhativyakhyaHK-3006	kintu dīkṣādibhirliṅgaiḥ na vinājñāyate tu saḥ ||	kintu dīkṣā ādibhiḥ liṅgaiḥ na vinā jñāyate tu saḥ 
SA_MB_somasambhupaddhativyakhyaHK-3007	yeṣāṃ śarīriṇāṃ śaktiḥ patatyapi nivṛttaye |	yeṣām śarīriṇām śaktiḥ patati api nivṛttaye 
SA_MB_somasambhupaddhativyakhyaHK-3008	teṣāṃ talliṅgamautsukyaṃ muktau dveṣo bhavāsthitau ||	teṣām tad liṅgam autsukyam muktau dveṣaḥ bhava āsthitau 
SA_MB_somasambhupaddhativyakhyaHK-3009	bhaktiñca śivabhakteṣu śraddhā tacchāśake vidhau |	bhaktiṃ ca śiva bhakteṣu śraddhā tad śāśake vidhau 
SA_MB_somasambhupaddhativyakhyaHK-3010	anenānumitāśśiṣṭo heto sthūladhiyāmapi ||	anena anumitāḥ śiṣṭaḥ hetoḥ sthūladhiyām api 
SA_MB_somasambhupaddhativyakhyaHK-3011	p.182)	Ro
SA_MB_somasambhupaddhativyakhyaHK-3012	īṣadardhaṃnivṛtte tu rodhakatve tamaḥ pateḥ |	īṣat ardham nivṛtte tu rodhaka tve tamaḥ pateḥ 
SA_MB_somasambhupaddhativyakhyaHK-3013	bhavantyetāniliṅgāni kiñcicchiṣṭe ca dehinām |	bhavanti etāni liṅgāni kiñcid śiṣṭe ca dehinām 
SA_MB_somasambhupaddhativyakhyaHK-3014	catūrthaśaktipātena tulyenaiva phalaṃ prati ||	catūrtha śaktipātena tulyena eva phalam prati 
SA_MB_somasambhupaddhativyakhyaHK-3015	sadyo mūrtā mūrchayā vā kampādromāñcatastathā ||	sadyas mūrtāḥ mūrchayā vā kampāt romāñcataḥ tathā 
SA_MB_somasambhupaddhativyakhyaHK-3016	iti |	iti 
SA_MB_somasambhupaddhativyakhyaHK-3017	asyāpyayamarthaḥ | asau sakalāśśive dayāyādāghrātastataḥ prabhṛti	asya api ayam arthaḥ asau sakalāḥ śive dayāyāt āghrātaḥ tatas prabhṛti 
SA_MB_somasambhupaddhativyakhyaHK-3018	tatkālamārabhya muktaḥ | kuntu sa mukta iti dīkṣādi liṅgairvinā jñāyate tathā	tad kālam ārabhya muktaḥ sa muktaḥ iti dīkṣā ādi liṅgaiḥ vinā jñāyate tathā 
SA_MB_somasambhupaddhativyakhyaHK-3019	tadarthamāha - yeṣāṃ tāvadaśarīriṇāṃ vijñānakalapralayākalānāṃ	tad artham āha yeṣām tāvat aśarīriṇām vijñāna kala pralaya akalānām 
SA_MB_somasambhupaddhativyakhyaHK-3020	śaktipātasya gurubhiralakṣyatvāt | yeṣāṃ śarīriṇāṃ sakalānāṃ śaktiḥ	śaktipātasya gurubhiḥ alakṣya tvāt yeṣām śarīriṇām sakalānām śaktiḥ 
SA_MB_somasambhupaddhativyakhyaHK-3021	parameśvarī patati avinivṛttaye | na - punarāvirbhāvāya patati teṣaṃ	parameśvarī patati avinivṛttaye na punar āvirbhāvāya patati 
SA_MB_somasambhupaddhativyakhyaHK-3022	tatpātitamuktāvautsukyaṃ | utkaṇṭhatā bhavatsthitau | saṃsāradveṣaḥ	tad pātita muktau autsukyam utkaṇṭha tā bhavat sthitau saṃsāra dveṣaḥ 
SA_MB_somasambhupaddhativyakhyaHK-3023	śivabhakteṣu bhaktiḥ tacchāśake vidhau śivaśāstrārthe śraddhā cetyetat	śiva bhakteṣu bhaktiḥ tad śāśake vidhau śiva śāstra arthe śraddhā ca iti etat 
SA_MB_somasambhupaddhativyakhyaHK-3024	liṅgacihnama anena cihnena viśiṣṭasya saṃskārāsthitiḥ hetoḥ	liṅga cihnam anena cihnena viśiṣṭasya saṃskāra asthitiḥ hetoḥ 
SA_MB_somasambhupaddhativyakhyaHK-3025	p.183)	Ro
SA_MB_somasambhupaddhativyakhyaHK-3026	pāśajālasya sthūladhiyā mandabuddhīnāmapi anumitiri anumānaṃ	pāśajālasya sthūla dhiyāḥ manda buddhīnām api anumānam 
SA_MB_somasambhupaddhativyakhyaHK-3027	pūrvoktānāṃ cihnānāṃ udakatve sati anoḥ pāśaśaithilyaprakarṣatāñca	pūrva uktānām cihnānām udaka tve sati anoḥ pāśa śaithilya prakarṣa tām ca 
SA_MB_somasambhupaddhativyakhyaHK-3028	teṣāṃ cihnānāṃ mandatve sati aṇoḥ pāśaśaithilyāntañca	teṣām cihnānām manda tve sati aṇoḥ pāśa śaithilya antaḥ ca 
SA_MB_somasambhupaddhativyakhyaHK-3029	mandata(mata)yopyanuminyantīti bhāvaḥ |	mandatama tayā upi anuminyanti iti bhāvaḥ 
SA_MB_somasambhupaddhativyakhyaHK-3030	atha tadaitāni liṅgāni sphurantītyatrāha - tamaḥ paterityādi | tamaḥ patervā	atha tadā etāni liṅgāni sphuranti iti atra āha tamaḥ pateḥ ityādi tamaḥ pateḥ vā 
SA_MB_somasambhupaddhativyakhyaHK-3031	devanāthasya śreyo bṛndaniroddhuḥ yadrodhakatvaṃ tasmin kiñcinnivṛtte	devanāthasya śreyaḥ bṛnda niroddhuḥ yat rodhaka tvam tasmin kiñcid nivṛtte 
SA_MB_somasambhupaddhativyakhyaHK-3032	arddhanivṛtte vā kiñcicchede kiñcidavaśiṣṭe phalaṃ prati tulyenaiva caturtha	arddha nivṛtte vā kiñcid chede kiñcid avaśiṣṭe phalam prati tulyena eva 
SA_MB_somasambhupaddhativyakhyaHK-3033	śaktipātena dehināmetāni liṅgāni bhavanti | atha kaṃ viśiṣṭo'yaṃ	śaktipātena dehinām etāni liṅgāni bhavanti atha kam viśiṣṭaḥ ayam 
SA_MB_somasambhupaddhativyakhyaHK-3034	caturthaśaktipātaḥ | atha tasya saphalaṃ prati liṅgamityatrāha - tīvratā ityāha |	caturtha śaktipātaḥ atha tasya saphalam prati liṅgam iti atra āha tīvra tā iti āha 
SA_MB_somasambhupaddhativyakhyaHK-3035	tatra tīvratareṇa sadyomūrtiḥ tīvreṇa mūrcchāmandena kampaḥ | mandatareṇa	tatra tīvratareṇa sadyas mūrtiḥ tīvreṇa mūrcchā mandena kampaḥ mandatareṇa 
SA_MB_somasambhupaddhativyakhyaHK-3036	romāñcakamityetat cihnatāratamyaṃ bhavantītyarthaḥ |	romāñcakam iti etat cihna tāratamyam bhavanti iti arthaḥ 
SA_MB_somasambhupaddhativyakhyaHK-3037	sthitāvetacchaktipātācchaktipātatāratamyato deśikamūrtimāsthāya yadi śivo	sthitau etad śaktipātāt śaktipāta tāratamyataḥ deśika mūrtim āsthāya yadi śivo 
SA_MB_somasambhupaddhativyakhyaHK-3038	yānanugṛhṇāti te rudrāṇāṃ mantreśvarāṇāṃ śivasya ca bhajantīti kvacit	yān anugṛhṇāti te rudrāṇām mantreśvarāṇām śivasya ca bhajanti iti kvacid 
SA_MB_somasambhupaddhativyakhyaHK-3039	sādhikārā	sā adhikārā 
SA_MB_somasambhupaddhativyakhyaHK-3040	p.184)	Ro
SA_MB_somasambhupaddhativyakhyaHK-3041	niradhikārā ceti | tathā coktaṃ	niradhikārā ca iti tathā ca uktam 
SA_MB_somasambhupaddhativyakhyaHK-3042	rudramantrapatīśānapadabhājo bhavanti te |	rudra mantra pati īśāna pada bhājaḥ bhavanti te 
SA_MB_somasambhupaddhativyakhyaHK-3043	sthitau yānanugṛhṇāti gurumāsthāya cidvada ||	sthitau yān anugṛhṇāti gurum āsthāya cit vada 
SA_MB_somasambhupaddhativyakhyaHK-3044	iti |	iti 
SA_MB_somasambhupaddhativyakhyaHK-3045	punaḥ pīyasā yā dīkṣaiva sa bījā nirbījā sādhikārā niradhikārā ceti	punar pīyasā yā dīkṣā eva sa bījā nirbījā sa adhikārā niradhikārā ca iti 
SA_MB_somasambhupaddhativyakhyaHK-3046	caturvidhā proktā | tatra tāvatsamayācārasaṃyuktā yā sā sa bījā | sā ca	caturvidhā proktā tatra tāvat samaya ācāra saṃyuktā yā sā sa bījā sā ca 
SA_MB_somasambhupaddhativyakhyaHK-3047	dvividhā śivadharmiṇī lokadharmiṇī ca | tatra tāvacchiva dharmiṇī	dvividhā śiva dharmiṇī loka dharmiṇī ca tatra tāvat śiva dharmiṇī 
SA_MB_somasambhupaddhativyakhyaHK-3048	śikhāyācchedasahitā | sā ca dvividhā naiṣṭhikī bhautikī ceti | tāvannaiṣṭhikī	śikhāyāḥ āccheda sahitā sā ca dvividhā naiṣṭhikī bhautikī ca iti tāvat naiṣṭhikī 
SA_MB_somasambhupaddhativyakhyaHK-3049	niravadhiḥ | dvitīyā katipayadinavrataparipālanānantaraṃ gṛhapadadāyinī  | tathā	niravadhiḥ dvitīyā katipaya dina vrata paripālana anantaram gṛha pada dāyinī tathā 
SA_MB_somasambhupaddhativyakhyaHK-3050	coktaṃ -	ca uktam 
SA_MB_somasambhupaddhativyakhyaHK-3051	naiṣṭhikī dehapātāntā bhautikī vratamokṣadā |	             
SA_MB_somasambhupaddhativyakhyaHK-3052	iti |	iti 
SA_MB_somasambhupaddhativyakhyaHK-3053	athānyā lokadharmiṇī śikhāccheanarahitā | sā ca dvividhā bhuvanā	athā anyā loka dharmiṇī sā ca dvividhā 
SA_MB_somasambhupaddhativyakhyaHK-3054	tatpadaprāptinimittā ceti | tathācoktaṃ -	tad pada prāpti nimittā ca iti 
SA_MB_somasambhupaddhativyakhyaHK-3055	sa bījā caiva śāktānāṃ samayācārasaṃyutā |	sa bījā ca eva śāktānām samaya ācāra saṃyutā 
SA_MB_somasambhupaddhativyakhyaHK-3056	p.185)	Ro
SA_MB_somasambhupaddhativyakhyaHK-3057	śikhācchedasamāyuktā dīkṣā sā śivadharmiṇī ||	śikhā cheda samāyuktā dīkṣā sā śiva dharmiṇī 
SA_MB_somasambhupaddhativyakhyaHK-3058	śikhācchedaṃ vinā yatra jñeyā sālokadharmiṇī |	śikhā ācchedam vinā yatra jñeyā sā āloka dharmiṇī 
SA_MB_somasambhupaddhativyakhyaHK-3059	śivadharmiṇamāśodhya yojayetparame pade ||	śiva dharmiṇam āśodhya yojayet parame pade 
SA_MB_somasambhupaddhativyakhyaHK-3060	dehapātena mokṣassyāt samayācārapālanāt |	dehapātena mokṣaḥ syāt samaya ācāra pālanāt 
SA_MB_somasambhupaddhativyakhyaHK-3061	iti |	iti 
SA_MB_somasambhupaddhativyakhyaHK-3062	lokadharmiṇāropya pade bhuvanakartarikta dharma sādhanaṃ kuryācchive vā	loka dharmiṇā āropya pade bhuvana kartṛ rikta dharma sādhanam kuryāt śive vā 
SA_MB_somasambhupaddhativyakhyaHK-3063	muktikāṅkṣiṇaṃ | tatte sadāśivabhoge layaste parame pada iti |	mukti kāṅkṣiṇam tat te sadāśiva bhoge layaḥ te parame pade iti 
SA_MB_somasambhupaddhativyakhyaHK-3064	athāsamarthālambanādīnāṃ samayācāravarjitā yā sā nirbījadīkṣā | sā ca	atha asamartha ālambana ādīnām samayācāra varjitā yā sā nirbīja dīkṣā sā ca 
SA_MB_somasambhupaddhativyakhyaHK-3065	dvividhā | sadyo nirvāṇā asadyo nirvāṇā ceti | tatra tāvat sadyo nirvāṇā	dvividhā sadyas nirvāṇā asadyas nirvāṇā ca iti tatra tāvat sadyas nirvāṇā 
SA_MB_somasambhupaddhativyakhyaHK-3066	saṃsāradviṣāṃ vṛddhānāṃ vyādhitātmanāṃ	saṃsāra dviṣām vṛddhānām vyādhita ātmanām 
SA_MB_somasambhupaddhativyakhyaHK-3067	dehārambhakakarmādipāśaśodhinī | dvitīyā dehapātānantaramokṣapradā |	                                                                   
SA_MB_somasambhupaddhativyakhyaHK-3068	tathā coktaṃ -	tathā ca uktam 
SA_MB_somasambhupaddhativyakhyaHK-3069	nirbījātvasamarthānāṃ bālādivyādhitātmanām |	nirbīja tva samarthānām bāla ādi vyādhita ātmanām 
SA_MB_somasambhupaddhativyakhyaHK-3070	sadyo nirvāṇakī proktā dehapātena tatkṣaṇāt ||	sadyas nirvāṇakī proktā dehapātena tad kṣaṇāt 
SA_MB_somasambhupaddhativyakhyaHK-3071	dehārambhakakarmādīn bhuktvā śaivaṃ padaṃ nayet ||	            nayet 
SA_MB_somasambhupaddhativyakhyaHK-3072	p.186)	Ro
SA_MB_somasambhupaddhativyakhyaHK-3073	bālādīnāñca nirbījasamayācāravarjitānāñca teṣāṃ niyamaiḥ kāryañca	bāla ādīnām ca nirbīja samayācāra varjitānām ca teṣām niyamaiḥ kāryam ca 
SA_MB_somasambhupaddhativyakhyaHK-3074	(na ca) śārīrayantraṇaiḥ | na tīrthakṣetragamanai yāvajjīvaṃ śivaṃ yajediti |	na ca śārīra yantraṇaiḥ na tīrtha kṣetra gamanaiḥ yāvajjīvam śivam yajet iti 
SA_MB_somasambhupaddhativyakhyaHK-3075	yato yasmātkāraṇāt yasya sadyo naimittike kāmye cādhikāritā syāt | ato hetoḥ	yatas yasmāt kāraṇāt yasya sadyas naimittike kāmye ca adhikāri tā syāt atas hetoḥ 
SA_MB_somasambhupaddhativyakhyaHK-3076	sādhikāradīkṣā sādhakācāryayoreva bhavet | anyāni bījadīkṣānāntu tathā	sādhikāra dīkṣā sādhaka ācāryayoḥ eva bhavet anyāni bīja dīkṣā nān tu tathā 
SA_MB_somasambhupaddhativyakhyaHK-3077	sabījadīkṣādīkṣitānāṃ madhye samayī putrayośca	sa bīja dīkṣā dīkṣitānām madhye samayī putrayoḥ ca 
SA_MB_somasambhupaddhativyakhyaHK-3078	nityamātrādhikāritvānnirādhikārā bhavet | itthaṃ sabījanirbījayorapi	nitya mātra adhikāri tvāt nirādhikārā bhavet ittham sa bīja nirbījayoḥ api 
SA_MB_somasambhupaddhativyakhyaHK-3079	sādhikāraniradhikārayorantarbhūtatvāt | iyaṃ dīkṣā	sādhikāra niradhikārayoḥ antarbhūta tvāt iyam dīkṣā 
SA_MB_somasambhupaddhativyakhyaHK-3080	sādhikāraniradhikārabhedena dvirūpaṃ pratyekaṃ dvividhaṃ jāyate |	sādhikāra niradhikāra bhedena dvirūpam pratyekam dvividham jāyate 
SA_MB_somasambhupaddhativyakhyaHK-3081	sādhikārāpi kriyāvatī jñānavatī ceti dvividhā syāt | tathā ca parā	sādhikārā api kriyāvatī jñānavatī ca iti dvividhā syāt tathā ca parā 
SA_MB_somasambhupaddhativyakhyaHK-3082	bhavedityarthaḥ | atha spaṣṭam |	bhavet iti arthaḥ atha spaṣṭam 
SA_MB_somasambhupaddhativyakhyaHK-3083	atha guruśiṣyapratipādanāyāha - ityamiti | ityamuktanayena guroḥ	atha guru śiṣya pratipādanāya āha iti amukta nayena guroḥ 
SA_MB_somasambhupaddhativyakhyaHK-3084	sakāśāllubdhādhikāreṇācāryeṇa dīkṣā sādhyate | sa jātyācāryaśca	sakāśāt lubdha adhikāreṇa ācāryeṇa dīkṣā sādhyate sa jāti ācāryaḥ ca 
SA_MB_somasambhupaddhativyakhyaHK-3085	saddeśasambhūtaḥ | sa ca -	sat deśa sambhūtaḥ sa ca 
SA_MB_somasambhupaddhativyakhyaHK-3086	p.187)	Ro
SA_MB_somasambhupaddhativyakhyaHK-3087	kṛṣṇasāramṛgo yatra svācārādvicaredbhuvi |	kṛṣṇa sāra mṛgaḥ yatra sva ācārāt vicaret bhuvi 
SA_MB_somasambhupaddhativyakhyaHK-3088	santi devāḥ tathā vedāḥ āryāvartaṃ vidurbhudhāḥ ||	santi devāḥ tathā vedāḥ āryāvartam viduḥ bhudhāḥ 
SA_MB_somasambhupaddhativyakhyaHK-3089	taddeśakulasambhutaḥ  ācārya śāstrasaṃmataḥ |	tad deśa kula sambhutaḥ ācārya śāstra saṃmataḥ 
SA_MB_somasambhupaddhativyakhyaHK-3090	iti |	iti 
SA_MB_somasambhupaddhativyakhyaHK-3091	svamūrtiḥ śobhanā prasannā danturādidoṣarahitā mūrtiryasyāsau sa mūrtiḥ  |	sva mūrtiḥ śobhanā prasannā dantura ādi doṣa rahitā mūrtiḥ yasya asau sa mūrtiḥ 
SA_MB_somasambhupaddhativyakhyaHK-3092	tathā coktaṃ -	tathā ca uktam 
SA_MB_somasambhupaddhativyakhyaHK-3093	kārukṛtodariḥ kujo hīnāṅgo vā'dhikāṅgavān |	kāru kṛta udariḥ kujaḥ hīna aṅgaḥ vā adhika aṅgavān 
SA_MB_somasambhupaddhativyakhyaHK-3094	kṛṣṇāśmaśruhīno vā kunakhī danturastathā ||	kṛṣṇā śmaśru hīnaḥ vā kunakhī danturaḥ tathā 
SA_MB_somasambhupaddhativyakhyaHK-3095	kekaraḥ kṣayarogī ca barbarasthūladehavān |	kekaraḥ kṣaya rogī ca barbara sthūla dehavān 
SA_MB_somasambhupaddhativyakhyaHK-3096	piṅgākṣo lambakukṣiśca vaktranāso .. bhāhumāna ||	piṅga akṣaḥ lamba kukṣiḥ ca vaktra nāsaḥ 
SA_MB_somasambhupaddhativyakhyaHK-3097	etaistu lakṣaṇairhīnaḥ pūrṇāṅgo mūrtimān  * * |	etaiḥ tu lakṣaṇaiḥ hīnaḥ pūrṇa aṅgaḥ mūrtimān    
SA_MB_somasambhupaddhativyakhyaHK-3098	iti |	iti 
SA_MB_somasambhupaddhativyakhyaHK-3099	śīlavānatra śrutamāgamaśravaṇaṃ | na paśuśāstrāvagamaḥ | tathā coktaṃ -	śīlavān atra śrutam āgama śravaṇam na paśu śāstra avagamaḥ tathā ca uktam 
SA_MB_somasambhupaddhativyakhyaHK-3100	śaivasidhāntasārajñaḥ paśuśāstraparāṅmukhaḥ |	              
SA_MB_somasambhupaddhativyakhyaHK-3101	sarvabhūtānukampī ca śuṣkatarka vivarjitaḥ ||	sarva bhūta anukampī ca śuṣka tarka vivarjitaḥ 
SA_MB_somasambhupaddhativyakhyaHK-3102	iti |	iti 
SA_MB_somasambhupaddhativyakhyaHK-3103	p.188)	Ro
SA_MB_somasambhupaddhativyakhyaHK-3104	śīlamatra balānvayānurañjako guṇaḥ | phalabhāvavivarjitaḥ	śīlam atra bala anvaya anurañjakaḥ guṇaḥ phala bhāva vivarjitaḥ 
SA_MB_somasambhupaddhativyakhyaHK-3105	śaṭhaḥ krūro vimohī ca piśuno matsarī khalaḥ |	śaṭhaḥ krūraḥ vimohī ca piśunaḥ matsarī khalaḥ 
SA_MB_somasambhupaddhativyakhyaHK-3106	khalābhāvavinirmuktaḥ paracittānurañjakaḥ ||	           
SA_MB_somasambhupaddhativyakhyaHK-3107	śīlavāneṣa jānīyādanukampāparo bhṛśam |	śīlavān eṣa jānīyāt anukampā paraḥ bhṛśam 
SA_MB_somasambhupaddhativyakhyaHK-3108	iti vacanāt | nanvatra śrutopapannasya śīlatvaṃ svata eva syāt | kutaśśīlavāniti	iti vacanāt nanu atra śruta upapannasya śīla tvam svatas eva syāt kutas śīlavān iti 
SA_MB_somasambhupaddhativyakhyaHK-3109	viśeṣaṇam vyarthamiti cet -	viśeṣaṇam vyartham iti ced 
SA_MB_somasambhupaddhativyakhyaHK-3110	jñānena hṛdayasthena khalo na syātsuśīlavān |	jñānena hṛdaya sthena khalaḥ na syāt su śīlavān 
SA_MB_somasambhupaddhativyakhyaHK-3111	madhunā koṭarasthena nimbaḥ kiṃ madhurāyate ||	madhunā koṭara sthena nimbaḥ kim madhurāyate 
SA_MB_somasambhupaddhativyakhyaHK-3112	jñānamabhyāsato vetti śīlaṃ svābhāviko guṇaḥ |	jñānam abhyāsataḥ vetti śīlam svābhāvikaḥ guṇaḥ 
SA_MB_somasambhupaddhativyakhyaHK-3113	iti vacanāt |	iti vacanāt 
SA_MB_somasambhupaddhativyakhyaHK-3114	atha jñānācāraguṇopetaḥ tatra jñānañca tatvavijñānaṃ	atha jñāna ācāra guṇa upetaḥ tatra jñānam ca tatva vijñānam 
SA_MB_somasambhupaddhativyakhyaHK-3115	ṣaṭtriṃśatsaṃkhyayānvitaḥ | ācāraḥ pratyahaṃ snānādikamācaratītyācāraḥ	ṣaṭtriṃśat saṃkhyayā anvitaḥ ācāraḥ pratyaham snāna ādikam ācarati iti ācāraḥ 
SA_MB_somasambhupaddhativyakhyaHK-3116	| athaḥ guṇaḥ sāttvikassārvajñānam |	athaḥ guṇaḥ sāttvikaḥ sārvajñānam 
SA_MB_somasambhupaddhativyakhyaHK-3117	satyaṃ dayā dhairyaṃ vinayaṃ sthairyameva ca |	satyam dayā dhairyam vinayam sthairyam eva ca 
SA_MB_somasambhupaddhativyakhyaHK-3118	sāttvikasya guṇaṃ proktaḥ saṅgāt sañjāyate tu saḥ ||	sāttvikasya guṇam proktaḥ saṅgāt sañjāyate tu saḥ 
SA_MB_somasambhupaddhativyakhyaHK-3119	śuddhāśayastu hṛdaye yasyā'sau śuddhāśayaḥ |	śuddha āśayaḥ tu hṛdaye yasya asau śuddha āśayaḥ 
SA_MB_somasambhupaddhativyakhyaHK-3120	p.189)	Ro
SA_MB_somasambhupaddhativyakhyaHK-3121	tatra tāvadbijātīṇāṃ caturṇāṃ pravṛttikriyāṇāṃ kṣatriyamadvayoḥ	tatra tāvat bijātīṇām caturṇām pravṛtti kriyāṇām kṣatriyam advayoḥ 
SA_MB_somasambhupaddhativyakhyaHK-3122	vaiśyaśūdrāṇāṃ madyapaḥ | tathā ca garuḍaḥ -	vaiśya śūdrāṇām madyapaḥ tathā ca garuḍaḥ 
SA_MB_somasambhupaddhativyakhyaHK-3123	madhye varṇacatuṣkasya gurutvaṃ kasya tatvataḥ |	madhye varṇa catuṣkasya guru tvam kasya 
SA_MB_somasambhupaddhativyakhyaHK-3124	sa ca prokto ca rātrānte śivavatsarvamocakaḥ ||	sa ca ca rātra ante śiva vat sarva mocakaḥ 
SA_MB_somasambhupaddhativyakhyaHK-3125	bhāryā bhrāṣādiko bandhuḥ upapanno yadā bhavet |	bhāryā bhrāṣā ādikaḥ bandhuḥ upapannaḥ yadā bhavet 
SA_MB_somasambhupaddhativyakhyaHK-3126	tathā teṣāṃ bhaveddikṣā tadā sā putratā na kim ||	tathā teṣām bhavet dikṣā tadā sā putra tā na kim 
SA_MB_somasambhupaddhativyakhyaHK-3127	anyajaścopasanno'yaṃ sa cāspṛśya kathaṃ punaḥ |	anyajaḥ ca upasannaḥ iyam sa ca a spṛśya katham punar 
SA_MB_somasambhupaddhativyakhyaHK-3128	tathā tasyā dīkṣā syānnagurussarvamocakaḥ ||	tathā tasyāḥ dīkṣā syāt na guruḥ sarva mocakaḥ 
SA_MB_somasambhupaddhativyakhyaHK-3129	iti |	iti 
SA_MB_somasambhupaddhativyakhyaHK-3130	īśvaraḥ -	īśvaraḥ 
SA_MB_somasambhupaddhativyakhyaHK-3131	caturṇāmapi varṇānāṃ ācāryatvamihoditam |	caturṇām api varṇānām ācārya tvam iha uditam 
SA_MB_somasambhupaddhativyakhyaHK-3132	brāhmaṇādicatuṣkasya dvijo'nugrahakṛnmataḥ ||	brāhmaṇa ādi catuṣkasya dvijaḥ anugraha kṛt mataḥ 
SA_MB_somasambhupaddhativyakhyaHK-3133	trayāṇāṃ kṣatriyo dvābhyāṃ vaiśyaśūdrassayonije |	trayāṇām kṣatriyaḥ dvābhyām vaiśya śūdraḥ sa yoni je 
SA_MB_somasambhupaddhativyakhyaHK-3134	anugrahastu bhāryādau yo'yā kintu bhāvataḥ ||	anugrahaḥ tu bhāryā ādau kintu bhāvataḥ 
SA_MB_somasambhupaddhativyakhyaHK-3135	nirapekṣāyato mantrā yathā tadbhāvato tathā |	mantrāḥ yathā tathā 
SA_MB_somasambhupaddhativyakhyaHK-3136	yathā'sya tena bhāvena mantrāḥ kurvantyanugraham ||	yathā asya tena bhāvena mantrāḥ kurvanti anugraham 
SA_MB_somasambhupaddhativyakhyaHK-3137	p.190)	Ro
SA_MB_somasambhupaddhativyakhyaHK-3138	yastenāntyajasyāpi kintu dīkṣā nu mānasī |	yaḥ tena antyajasya api kintu dīkṣā nu mānasī 
SA_MB_somasambhupaddhativyakhyaHK-3139	kārukāṇāntvasaṃsparśāt na hautiḥ parikalpyet ||	kāru kāṇā antva saṃsparśāt na hautiḥ parikalpyet 
SA_MB_somasambhupaddhativyakhyaHK-3140	jñātvā teṣāṃ parā bhaktiḥ lobhācca doṣamānpuyāt |	jñātvā teṣām parā bhaktiḥ lobhāt ca 
SA_MB_somasambhupaddhativyakhyaHK-3141	iti |	iti 
SA_MB_somasambhupaddhativyakhyaHK-3142	itthaṃ bhūto paraḥ śreṣtha ucyate | nānyate | svāyaṃbhuvādau naṣṭavratāśca -	ittham paraḥ śreṣthaḥ ucyate na anyate svāyaṃbhuva ādau naṣṭa vratāḥ ca 
SA_MB_somasambhupaddhativyakhyaHK-3143	uktañca svayamālocya vayamācāryasattamāḥ |	uktam ca svayam ālocya vayam ācārya sattamāḥ 
SA_MB_somasambhupaddhativyakhyaHK-3144	ityevañcaiva vidantyajya kṛtyājyāste svayaṃbhuvaḥ ||	iti evam ca eva vidan tyajya kṛtyā ājyāḥ te svayaṃbhuvaḥ 
SA_MB_somasambhupaddhativyakhyaHK-3145	anyaliṅgaṃ parityajya yo liṅgaṃ śaivamāśrayet |	anya liṅgam parityajya yaḥ liṅgam śaivam āśrayet 
