segmentnr	original	analyzed
SA_MB_gitarthasamgrahaHK-2800	nopajāyante pralaye na vyathanti ca || 14-2 ||	na upajāyante pralaye na vyathanti ca 
SA_MB_gitarthasamgrahaHK-2801	vyathantīti-cchāndasatvāttiṅpratyayaḥ | evamanyatrāpi	vyathanti iti chāndasa tvāt tiṅ pratyayaḥ evam anyatra api 
SA_MB_gitarthasamgrahaHK-2802	suptiṅpratyaye vācyam || 2 ||	sup tiṅ pratyaye vācyam  /
SA_MB_gitarthasamgrahaHK-2803	tatrādau saṃsṛtau kramamāha-	tatra ādau saṃsṛtau kramam āha 
SA_MB_gitarthasamgrahaHK-2804	mama yonirmahadbrahma tasmingarbhaṃ dadāmyaham | sambhavaḥ	mama yoniḥ mahat brahma tasmin garbham dadāmi aham sambhavaḥ 
SA_MB_gitarthasamgrahaHK-2805	sarvabhūtānāṃ tato bhavati bhārata || 14-3 ||	sarva bhūtānām tatas bhavati bhārata 
SA_MB_gitarthasamgrahaHK-2806	hātavye jñāte tatkāraṇe ca sukaraṃ hi hānam |	hātavye jñāte tad kāraṇe ca sukaram hi hānam 
SA_MB_gitarthasamgrahaHK-2807	mama-tāvadavyapadeśyaparamānandarūpasya	             
SA_MB_gitarthasamgrahaHK-2808	mahadbramha-vṛṃhakātmīyaśaktirūpaṃ brahma | ātmīyāmeva hi	                                                      
SA_MB_gitarthasamgrahaHK-2809	vimarśaśaktimālambyāhamanādīnātmāṇūn anugrahārthaṃ	vimarśa śaktim ālambya ahamana ādīn ātma aṇūn anugraha artham 
SA_MB_gitarthasamgrahaHK-2810	saṃsārayāmi || 3 ||	saṃsārayāmi 
SA_MB_gitarthasamgrahaHK-2811	ata eva-	atas eva 
SA_MB_gitarthasamgrahaHK-2812	sarvayoniṣu kaunteya mūrtayaḥ sambhavanti yāḥ | tāsāṃ brahma	sarva yoniṣu kaunteya mūrtayaḥ sambhavanti yāḥ tāsām brahma 
SA_MB_gitarthasamgrahaHK-2813	mahadyonirahaṃ bījapradaḥ pitā || 14-4 ||	mahat yoniḥ aham bīja pradaḥ pitā 
SA_MB_gitarthasamgrahaHK-2814	sarvāsu yoniṣu ādikāraṇatayā bṛṃhikā	sarvāsu yoniṣu ādikāraṇatayā bṛṃhikā 
SA_MB_gitarthasamgrahaHK-2815	bhagavacchāktiḥ-sakalasaṃsāravamanasvabhāvā mātā | pitā	                           
SA_MB_gitarthasamgrahaHK-2816	tvahaṃ-śaktimānavyapadeśyaḥ || 4 ||	tu aham śaktimān avyapadeśyaḥ 
SA_MB_gitarthasamgrahaHK-2817	sattvaṃ rajastama iti guṇāḥ prakṛtisambhavāḥ | nibadhnanti	sattvam rajaḥ tamaḥ iti guṇāḥ prakṛti sambhavāḥ nibadhnanti 
SA_MB_gitarthasamgrahaHK-2818	mahābāho dehe dehinamavyayam || 14-5 ||	mahā bāho dehe dehinam avyayam 
SA_MB_gitarthasamgrahaHK-2819	dehī cāyamātmatayā sattvarajastamobhirdharmairapavargaparyantāya	dehī ca ayam ātma tayā sattva rajaḥ tamobhiḥ dharmaiḥ apavarga paryantāya 
SA_MB_gitarthasamgrahaHK-2820	bhogāya nibadhyeta || 5 ||	bhogāya nibadhyeta  /
SA_MB_gitarthasamgrahaHK-2821	tatra sattvaṃ nirmalatvātprakāśakamanāmayam | sukhasaṅgena	tatra sattvam nirmala tvāt prakāśakam anāmayam sukha saṅgena 
SA_MB_gitarthasamgrahaHK-2822	badhnāti jñānasaṅgena cānagha || 14-6 ||	badhnāti jñāna saṅgena ca anagha 
SA_MB_gitarthasamgrahaHK-2823	rajo rāgātmakaṃ viddhi tṛṣṇāsaṅgasamudbhavam | tannibadhnāti	rajaḥ rāga ātmakam viddhi tṛṣṇā saṅga samudbhavam tat nibadhnāti 
SA_MB_gitarthasamgrahaHK-2824	kaunteya karmasaṅgena dehinam || 14-7 ||	kaunteya karma saṅgena dehinam 
SA_MB_gitarthasamgrahaHK-2825	krameṇaiṣāṃ rūpamucyate | sattvaṃ-nirmalam | tṛṣṇā saṅgasya	krameṇa eṣām rūpam ucyate sattvam nirmalam tṛṣṇā saṅgasya 
SA_MB_gitarthasamgrahaHK-2826	samudbhavo yataḥ || 7 ||	samudbhavaḥ yatas 
SA_MB_gitarthasamgrahaHK-2827	tamastvajñānajaṃ viddhi mohanaṃ sarvadehinām |	tamaḥ tu ajñāna jam viddhi mohanam sarva dehinām 
SA_MB_gitarthasamgrahaHK-2828	pramādālasyanidrābhistannibadhnāni bhārata || 14-8 ||	pramāda ālasya nidrābhiḥ tat nibadhnāni bhārata 
SA_MB_gitarthasamgrahaHK-2829	durlabhasyāpi	durlabhasya api 
SA_MB_gitarthasamgrahaHK-2830	ciratarasañcitapuṇyaśatalabdhasyāpavargaprāptāvekakāraṇasya	ciratara sañcita puṇya śata labdhasya apavarga prāptau eka kāraṇasya 
SA_MB_gitarthasamgrahaHK-2831	mānuṣyakasya vṛthātivāhanaṃ-pramādaḥ | tathāhyuktaṃ-	mānuṣyakasya vṛthā ati vāhanam pramādaḥ tathā hi uktam 
SA_MB_gitarthasamgrahaHK-2832	āyuṣaḥ kṣaṇa eko'pi sarvaratnairna labhyate | sa vṛthā nīyate	āyuṣaḥ kṣaṇaḥ ekaḥ api sarva ratnaiḥ na labhyate sa vṛthā nīyate 
SA_MB_gitarthasamgrahaHK-2833	yena sa pramādī narādhamaḥ ||	yena sa pramādī nara adhamaḥ 
SA_MB_gitarthasamgrahaHK-2834	iti | ālasyaṃ-śubhakaraṇīyeṣu | niḥśeṣeṇa drāṇam kutsitā	iti ālasya śubha karaṇīyeṣu niḥśeṣeṇa kutsitā 
SA_MB_gitarthasamgrahaHK-2835	gatiḥ-nidrā || 8 ||	gatiḥ nidrā 
SA_MB_gitarthasamgrahaHK-2836	sattvaṃ sukhe sañjayati rajaḥ karmaṇi bhārata | jñānamāvṛtya tu	sattvam sukhe sañjayati rajaḥ karmaṇi bhārata jñānam āvṛtya tu 
SA_MB_gitarthasamgrahaHK-2837	tamaḥ pramāde sañjayatyuta || 14-9 ||	tamaḥ pramāde sañjayati uta 
SA_MB_gitarthasamgrahaHK-2838	sañjayati-yojayati || 9 ||	sañjayati yojayati  /
SA_MB_gitarthasamgrahaHK-2839	rajastamaścābhibhūya sattvaṃ bhavati bhārata | rajaḥ sattvaṃ	rajaḥ tamaḥ ca abhibhūya sattvam bhavati bhārata rajaḥ sattvam 
SA_MB_gitarthasamgrahaHK-2840	tamaścaiva tamaḥ sattvaṃ rajastathā || 14-10 ||	tamaḥ ca eva tamaḥ sattvam rajaḥ tathā 
SA_MB_gitarthasamgrahaHK-2841	rajastamasī abhibhūya sattvaṃ vardhate | rajastu sattvatamasī |	rajaḥ tamasī abhibhūya sattvam vardhate rajaḥ tu sattva tamasī 
SA_MB_gitarthasamgrahaHK-2842	tamaḥ sattvarajasī | uktaṃ hi anyonyābhibhavena guṇavṛddhiḥ |	tamaḥ sattva rajasī uktam hi anyonya abhibhavena guṇa vṛddhiḥ 
SA_MB_gitarthasamgrahaHK-2843	iti || 10 ||	iti 
SA_MB_gitarthasamgrahaHK-2844	p. 288)	p 
SA_MB_gitarthasamgrahaHK-2845	sarvadvāreṣu dehe'sminprakāśamupajāyate | jñānaṃ yadā tadā	sarva dvāreṣu dehe ismin prakāśam upajāyate jñānam yadā tadā 
SA_MB_gitarthasamgrahaHK-2846	vidyādvivṛddhaṃ sattvamityuta || 14-11 ||	vidyāt vivṛddham sattvam iti uta 
SA_MB_gitarthasamgrahaHK-2847	lobhaḥ pravṛttirārambhaḥ karmaṇāmaśamaśca tṛṭ | rajasyetāni	lobhaḥ pravṛttiḥ ārambhaḥ karmaṇām aśamaḥ ca tṛṣ rajasi etāni 
SA_MB_gitarthasamgrahaHK-2848	jāyante vivṛddhe bharatarṣabha || 14-12 ||	jāyante vivṛddhe bharata ṛṣabha 
SA_MB_gitarthasamgrahaHK-2849	aprakāśo'pravṛttiśca pramādo moha eva ca | tamasyetāni jāyante	aprakāśaḥ upravṛttiḥ ca pramādaḥ mohaḥ eva ca tamasi etāni jāyante 
SA_MB_gitarthasamgrahaHK-2850	vivṛddhe kurunandana || 14-13 ||	vivṛddhe kuru nandana 
SA_MB_gitarthasamgrahaHK-2851	sarvadvāreṣu-sarvendriyeṣu | lobhādayaḥ krameṇaiva	sarva dvāreṣu sarva indriyeṣu lobha ādayaḥ krameṇa eva 
SA_MB_gitarthasamgrahaHK-2852	rajasyudricyamāne jāyante | evamaprakāśādayaḥ krameṇaiva	rajasi udricyamāne jāyante evam aprakāśa ādayaḥ krameṇa eva 
SA_MB_gitarthasamgrahaHK-2853	tamovivṛddhāvāvirbhavanti || 13 ||	tamaḥ vivṛddhau āvirbhavanti 
SA_MB_gitarthasamgrahaHK-2854	yadā sattve pravṛddhe tu pralayaṃ yāti dehabhṛt | tadottamavidāṃ	yadā sattve pravṛddhe tu pralayam yāti dehabhṛt tadā uttama vidām 
SA_MB_gitarthasamgrahaHK-2855	lokānamalānpratipadyate || 14-14 ||	lokān amalān pratipadyate 
SA_MB_gitarthasamgrahaHK-2856	yadā samagreṇaiva janmanānavaratasāttvikavyāpārābhyāsātsattvaṃ	yadā samagreṇa eva janmanā anavarata sāttvika vyāpāra abhyāsāt sattvam 
SA_MB_gitarthasamgrahaHK-2857	vivṛddhaṃ bhavati tadā prāptapralayasya śubhalokāvāptiḥ || 14 ||	vivṛddham bhavati tadā prāpta pralayasya śubha loka avāptiḥ 
SA_MB_gitarthasamgrahaHK-2858	rajasi pralayaṃ gatvā karmasaṅgiṣu jāyate | tathā pralīnastamasi	rajasi pralayam gatvā karma saṅgiṣu jāyate tathā pralīnaḥ tamasi 
SA_MB_gitarthasamgrahaHK-2859	mūḍhayoniṣu jāyate || 14-15 ||	mūḍha yoniṣu jāyate 
SA_MB_gitarthasamgrahaHK-2860	evaṃ janmābhyastarājasakarmaṇaḥ prayāṇāt vimiśropabhogāya	evam janma abhyasta rājasa karmaṇaḥ prayāṇāt vimiśra upabhogāya 
SA_MB_gitarthasamgrahaHK-2861	mānupyāvāptiḥ | tathā-tenaiva krameṇa yadā samagreṇa janmanā	mānupya avāptiḥ tathā a tena eva krameṇa yadā samagreṇa janmanā 
SA_MB_gitarthasamgrahaHK-2862	tāmasameva karmābhyasyate tadā narakatiryagvṛkṣādideheṣūtpadyate	tāmasam eva karma abhyasyate tadā naraka tiryagvṛkṣa ādi deheṣu utpadyate 
SA_MB_gitarthasamgrahaHK-2863	| ye tu vyācakṣate-maraṇakāla eva sattvādau vivṛddhe etāni	ye tu vyācakṣate maraṇa kāle eva sattva ādau vivṛddhe etāni 
SA_MB_gitarthasamgrahaHK-2864	phalāni-iti | te na samyakśārīre'nubhave praviṣṭāḥ | yataḥ	phalāni iti te na samyak śārīra inubhave praviṣṭāḥ yatas 
SA_MB_gitarthasamgrahaHK-2865	sarvasyaiva sarvathāntye kṣaṇe moha evopajāyate |	sarvasya eva sarvathā antye kṣaṇe mohaḥ evā upajāyate 
SA_MB_gitarthasamgrahaHK-2866	asmadvyākhyāyāṃ ca saṃvādīnīmāni ślokāntarāṇi || 15 ||	asmad vyākhyāyām ca saṃvādīni imāni śloka antarāṇi 
SA_MB_gitarthasamgrahaHK-2867	karmaṇaḥ sukṛtasyāhuḥ sāttvikaṃ nirmalaṃ phalam | rajasastu	karmaṇaḥ su kṛtasya āhuḥ sāttvikam nirmalam phalam rajasaḥ tu 
SA_MB_gitarthasamgrahaHK-2868	phalaṃ duḥkhamajñānaṃ tamasaḥ phalam || 14-16 ||	phalam duḥkham ajñānam tamasaḥ phalam 
SA_MB_gitarthasamgrahaHK-2869	sattvātsañjāyate jñānaṃ rajaso lobha eva ca | pramādamohau	sattvāt sañjāyate jñānam rajasaḥ lobhaḥ eva ca pramāda mohau 
SA_MB_gitarthasamgrahaHK-2870	jāyete tamaso'jñānameva ca || 14-17 ||	jāyete tamasaḥ jñānam eva ca 
SA_MB_gitarthasamgrahaHK-2871	ūrdhvaṃ gacchanti sattvasthā madhye tiṣṭhanti rājasāḥ |	ūrdhvam gacchanti sattva sthāḥ madhye tiṣṭhanti rājasāḥ 
SA_MB_gitarthasamgrahaHK-2872	jaghanyaguṇavṛttisthā adho gachanti tāmasāḥ || 14-18 ||	jaghanya guṇa vṛtti sthāḥ adhas gacchanti tāmasāḥ 
SA_MB_gitarthasamgrahaHK-2873	nānyaṃ guṇebhyaḥ kartāraṃ yadā draṣṭā'nupaśyati |	na anyam guṇebhyaḥ kartāram yadā draṣṭā anupaśyati 
SA_MB_gitarthasamgrahaHK-2874	guṇebhyaśca paraṃ vetti madbhāvaṃ so'dhigacchati || 14-19 ||	guṇebhyaḥ ca param vetti mad bhāvam saḥ adhigacchati 
SA_MB_gitarthasamgrahaHK-2875	guṇānetānatītya trīndehī dehasamudbhavān |	guṇān etān atītya trīn dehī deha samudbhavān 
SA_MB_gitarthasamgrahaHK-2876	janmamṛtyujarāduḥkhairvimukto'mṛtamaśnute || 14-20 ||	janma mṛtyu jarā duḥkhaiḥ vimuktaḥ amṛtam aśnute 
SA_MB_gitarthasamgrahaHK-2877	atra kecidasaṃbaddhāḥ ślokāḥ kalpitāḥ punaruktatvātte tjājyā	atra kecid asaṃbaddhāḥ ślokāḥ kalpitāḥ punarukta tvāt te 
SA_MB_gitarthasamgrahaHK-2878	eva | etadguṇātītavṛttistu mokṣāyaiva kalpate || 20 ||	eva etad guṇa atīta vṛttiḥ tu mokṣāya eva kalpate   
SA_MB_gitarthasamgrahaHK-2879	nanu yadi ayaṃ dehī tatkathaṃ guṇātīto bhavati | sarvathaiva hi	nanu yadi ayam dehī tat katham guṇa atītaḥ bhavati sarvathā eva hi 
SA_MB_gitarthasamgrahaHK-2880	kayāciccittavṛttyā vartate sā ca traiguṇyādanyatamā avaśyaṃ	kayācid cittavṛttyā vartate sā ca traiguṇyāt anyatamā avaśyam 
SA_MB_gitarthasamgrahaHK-2881	bhavati ?-anenābhiprāyeṇa pṛcchati arjunaḥ	bhavati anena abhiprāyeṇa pṛcchati arjunaḥ 
SA_MB_gitarthasamgrahaHK-2882	arjuna uvāca	arjunaḥ uvāca 
SA_MB_gitarthasamgrahaHK-2883	kairliṅgaistrīnguṇānetānatīto bhavati prabho | kimācāraḥ	kaiḥ liṅgaiḥ trīn guṇān etān atītaḥ bhavati prabho kimācāraḥ 
SA_MB_gitarthasamgrahaHK-2884	kathaṃ caitāṃstrīnguṇānativartate || 14-21 ||	katham ca etān trīn guṇān ativartate 
SA_MB_gitarthasamgrahaHK-2885	atrottaraṃ-	atra uttaram 
SA_MB_gitarthasamgrahaHK-2886	śībhagavānuvāca	śī bhagavān uvāca 
SA_MB_gitarthasamgrahaHK-2887	prakāśaṃ ca pravṛttiṃ ca mohameva ca pāṇḍava | na dveṣṭi	prakāśam ca pravṛttim ca moham eva ca pāṇḍava na dveṣṭi 
SA_MB_gitarthasamgrahaHK-2888	sampravṛttāni na nivṛttāni kāṅkṣati || 14-22 ||	sampravṛttāni na nivṛttāni kāṅkṣati 
SA_MB_gitarthasamgrahaHK-2889	yadyapi prakāśādikāḥ sarveṣu dharmeṣu vartante tathāpi	yadi api prakāśa ādikāḥ sarveṣu dharmeṣu vartante tathā api 
SA_MB_gitarthasamgrahaHK-2890	yoginasteṣu prakāśādiṣu na rajyante nāpi dveṣavanto bhavanti |	yoginaḥ teṣu prakāśa ādiṣu na rajyante na api dveṣavantaḥ bhavanti 
SA_MB_gitarthasamgrahaHK-2891	apitu kevalapiṇḍadharmatayaite sthitāḥ na māṃ kṣobhayitumalam-iti	apitu kevala piṇḍa dharma tayā ete sthitāḥ na mām kṣobhayitum alam iti 
SA_MB_gitarthasamgrahaHK-2892	manvānā guṇātītā bhavanti || 22 ||	manvānāḥ guṇa atītāḥ bhavanti 
SA_MB_gitarthasamgrahaHK-2893	ata evāha-	atas eva āha 
SA_MB_gitarthasamgrahaHK-2894	udāsīnavadāsīno guṇairyo na vicālyate | guṇā vartante ityeva	udāsīna vat āsīnaḥ guṇaiḥ yaḥ na vicālyate guṇāḥ vartante iti eva 
SA_MB_gitarthasamgrahaHK-2895	yo'jñastiṣṭhati neṅgate || 14-23 ||	yojñaḥ tiṣṭhati na iṅgate  /
SA_MB_gitarthasamgrahaHK-2896	samaduḥkhasukhaḥsvapnaḥ samaloṣṭāśmakāñcanaḥ |	sama duḥkha sukhaḥ svapnaḥ sama loṣṭa aśma kāñcanaḥ 
SA_MB_gitarthasamgrahaHK-2897	tulyapriyāpriyo dhīrastulyanindātmasaṃstutiḥ || 14-24 ||	tulya priya apriyaḥ dhīraḥ tulya nindā ātma saṃstutiḥ 
SA_MB_gitarthasamgrahaHK-2898	mānāvamānayostulyastulyo mitrāparipakṣayoḥ |	māna avamānayoḥ tulyaḥ tulyaḥ mitra a paripakṣayoḥ 
SA_MB_gitarthasamgrahaHK-2899	sarvārambhaphalatyāgī guṇātītaḥ sa ucyate || 14-25 ||	sarva ārambha phala tyāgī guṇa atītaḥ saḥ ucyate 
SA_MB_gitarthasamgrahaHK-2900	yaḥ ajño nirvivekastiṣṭhati sa eva jñaḥ-samyagjñānāt | tathā	yaḥ ajñaḥ nirvivekaḥ tiṣṭhati saḥ eva jñaḥ samyak jñānāt tathā 
SA_MB_gitarthasamgrahaHK-2901	hi | neṅgate-na svarūpāccyavate | atra	hi na iṅgatena svarūpāt cyavate atra 
SA_MB_gitarthasamgrahaHK-2902	copāyaḥ-śarīrendriyādisvabhāva eṣa yatpravartanam natu phalaṃ	ca upāyaḥ śarīra indriya ādi svabhāvaḥ eṣa yat pravartanam na tu phalam 
SA_MB_gitarthasamgrahaHK-2903	kiṃcidahamabhisandadha iti sthirā buddhiḥ || 25 ||	kiṃcid aham abhisandadhe iti sthirā buddhiḥ 
SA_MB_gitarthasamgrahaHK-2904	māṃ ca yo'vyabhicāreṇa bhaktiyogena sevate | sa	mām ca yaḥ vyabhicāreṇa bhakti yogena sevate sa 
SA_MB_gitarthasamgrahaHK-2905	guṇānsamatītyaitānbrahmabhūyāya kalpate || 14-26 ||	guṇān samatītya etān brahma bhūyāya kalpate 
SA_MB_gitarthasamgrahaHK-2906	anena mūlabhūtamupāyamupadiśati māṃ ceti | caśabdo'vadhāraṇe	anena mūla bhūtam upāyam upadiśati mām ca iti caśabdaḥ uvadhāraṇe 
SA_MB_gitarthasamgrahaHK-2907	yo māmeva sevate | anena-phalādisākāṅkṣo māmaṅgatvenā śrayati	yaḥ mām eva sevate mām aṅga tvena ā śrayati 
SA_MB_gitarthasamgrahaHK-2908	phalaṃ pradhānatayā-iti nirantaḥ | ata eva nāsyāvyabhicāriṇī	phalam pradhāna tayā iti nirantaḥ atas eva na asya avyabhicāriṇī 
SA_MB_gitarthasamgrahaHK-2909	maktiḥ-phalaṃ prati hyasāvāsthāvāniti | yastu phalaṃ	maktiḥ phalam prati hi asau āsthāvān iti yaḥ tu phalam 
SA_MB_gitarthasamgrahaHK-2910	kiṃcidapyanabhilaṣyan kimetadalīkamanutiṣṭhasi-iti	kiṃcid api an abhilaṣyan kim etat alīkam anutiṣṭhasi iti 
SA_MB_gitarthasamgrahaHK-2911	paryanuyujyamāno'pi	paryanuyujyamānaḥ api 
SA_MB_gitarthasamgrahaHK-2912	nirantarabhagavadbhaktivedhavidrutāntaḥkaraṇatayā	                                              
SA_MB_gitarthasamgrahaHK-2913	kaṇṭakitaromavān	kaṇṭakita romavān 
SA_MB_gitarthasamgrahaHK-2914	vepamānatanurvisphāritanayanayugalaparivartamānasalilasaṃpātaḥ	vepamāna tanuḥ visphārita nayana yugala parivartamāna salila saṃpātaḥ 
SA_MB_gitarthasamgrahaHK-2915	tūṣṇīṃbhāvenaivottaraṃ prayacchati | sa evāvyabhicāriṇyā	tūṣṇīṃbhāvena eva uttaram prayacchati saḥ eva avyabhicāriṇyā 
SA_MB_gitarthasamgrahaHK-2916	bhagavato maheśvarasyāgraśaktyā bhaktyā pavitrīkṛto nānya iti	bhagavataḥ maheśvarasya agra śaktyā bhaktyā pavitrīkṛtaḥ na anyaḥ iti 
SA_MB_gitarthasamgrahaHK-2917	jñeyam || 26 ||	jñeyam  /
SA_MB_gitarthasamgrahaHK-2918	brahmaṇo hi pratiṣṭhāhamamṛtasyāvyayasya ca | śāśvatasya ca	brahmaṇaḥ hi pratiṣṭhā aham amṛtasya avyayasya ca śāśvatasya ca 
SA_MB_gitarthasamgrahaHK-2919	dharmasya sukhasyaikāntikasya ca || 14-27 ||	dharmasya sukhasya aikāntikasya ca 
SA_MB_gitarthasamgrahaHK-2920	ahameva hi brahmaṇaḥ pratiṣṭhā | mayi sevyamāne brahma bhavati	aham eva hi brahmaṇaḥ pratiṣṭhā mayi sevyamāne brahma bhavati 
SA_MB_gitarthasamgrahaHK-2921	anyathā jaḍarūpatayā brahma upāsyamānaṃ mokṣamapi	anyathā jaḍa rūpa tayā brahma upāsyamānam mokṣam api 
SA_MB_gitarthasamgrahaHK-2922	sauṣuptādaviśiṣṭameva prāpayediti śivam || 27 ||	sauṣuptāt aviśiṣṭam eva prāpayet iti śivam 
SA_MB_gitarthasamgrahaHK-2923	atra saṃgrahaślokaḥ	atra saṃgraha ślokaḥ 
SA_MB_gitarthasamgrahaHK-2924	lasadbhaktirasāveśahīnāhaṃkāravibhramaḥ | sthite'pi	lasat bhakti rasa āveśa hīna ahaṃkāra vibhramaḥ sthite pi 
SA_MB_gitarthasamgrahaHK-2925	guṇasaṃmarde guṇātītaḥ samo yatiḥ || 14 ||	guṇa saṃmarde guṇa atītaḥ samaḥ yatiḥ 
SA_MB_gitarthasamgrahaHK-2926	iti śrīmahāmaheśvarācāryavaryarājānakābhinavaguptapādaviracite	iti śrī mahā maheśvara ācārya varya rājānaka abhinavagupta pāda viracite 
SA_MB_gitarthasamgrahaHK-2927	śrīmadbhagavadgītārthasaṃgrahe caturdaśo'dhyāyaḥ || 14 ||	śrīmat bhagavadgītā artha saṃgrahe caturdaśaḥ adhyāyaḥ 
SA_MB_gitarthasamgrahaHK-2928	atha pañcadaśo'dhyāyaḥ	atha pañcadaśaḥ udhyāyaḥ 
SA_MB_gitarthasamgrahaHK-2929	śrībhagavānuvāca	śrī bhagavān uvāca 
SA_MB_gitarthasamgrahaHK-2930	ūrdhvamūlamadhaḥ śākhamaśvatthaṃ prāhuravyayam | chandāṃsi	ūrdhva mūlam adhas śākham aśvattham prāhuḥ avyayam chandāṃsi 
SA_MB_gitarthasamgrahaHK-2931	yasya parṇāni yastaṃ veda sa vedavit || 15-1 ||	yasya parṇāni yaḥ tam veda sa veda vid  /
SA_MB_gitarthasamgrahaHK-2932	anena śāstrāntareṣu yaducyate-aśvatthaḥ sarvaṃ sa	anena śāstra antareṣu yat ucyate aśvatthaḥ sarvam sa 
SA_MB_gitarthasamgrahaHK-2933	evopāsanīyaḥ-ityādi tasya bhagavadbhahyopāsā tātparyamityucyate |	eva upāsanīyaḥ ityādi tasya tātparyam iti ucyate 
SA_MB_gitarthasamgrahaHK-2934	mūlaṃpraśāntaṃ rūpam | tat ūrdhvaṃ-sarvato hi nivṛttasya	mūlam praśāntam rūpam tat ūrdhvam sarvatas hi nivṛttasya 
SA_MB_gitarthasamgrahaHK-2935	tadāptiḥ | chandāṃsi parṇānīti-yathā vṛkṣasya	tad āptiḥ chandāṃsi parṇāni iti yathā vṛkṣasya 
SA_MB_gitarthasamgrahaHK-2936	mānatvaphalavattvasarasatādayaḥ parṇaiḥ sūcyante evaṃ	māna tva phalavat tva sarasa tā ādayaḥ parṇaiḥ sūcyante evam 
SA_MB_gitarthasamgrahaHK-2937	brahmatattvasya vedopalakṣitaśāstradvārikā pratītirityākhyāyate	brahma tattvasya veda upalakṣita śāstra dvārikā pratītiḥ iti ākhyāyate 
SA_MB_gitarthasamgrahaHK-2938	adhaścordhvaṃ prasṛtā yasya śākhā guṇapravṛddhā	adhas ca ūrdhvam prasṛtā yasya śākhā guṇa pravṛddhā 
SA_MB_gitarthasamgrahaHK-2939	viṣayapravālāḥ | adhaśca mūlānyanusantatāni karmānubandhīni	viṣaya pravālāḥ adhas ca mūlāni anusantatāni karma anubandhīni 
SA_MB_gitarthasamgrahaHK-2940	manuṣyaloke || 15-2 ||	manuṣya loke 
SA_MB_gitarthasamgrahaHK-2941	na rūpamasyeha tathopalabhyate nānto na cādirna ca sampratiṣṭhā |	na rūpam asya iha tathā upalabhyate na antaḥ na ca ādiḥ na ca sampratiṣṭhā 
SA_MB_gitarthasamgrahaHK-2942	aśvatthamenaṃ suvirūḍhamūla- masaṅgaśastreṇa śitena cchittvā	aśvattham enam su virūḍha mūla masaṅga śastreṇa śitena chittvā 
SA_MB_gitarthasamgrahaHK-2943	tataḥ padaṃ tatparimārgitavyaṃ yasmingato na nivarteta bhūyaḥ |	tatas padam tat parimārgitavyam yasmin gataḥ na nivarteta bhūyas 
SA_MB_gitarthasamgrahaHK-2944	tameva cādyaṃ puruṣaṃ prapadye- dyataḥ pravṛttiḥ prasṛtā	tam eva ca ādyam puruṣam prapadye dyataḥ pravṛttiḥ prasṛtā 
SA_MB_gitarthasamgrahaHK-2945	purāṇī || 15-4 ||	purāṇī 
SA_MB_gitarthasamgrahaHK-2946	nirmānamohā jitasaṅgadoṣā adhyātmanityā vinivṛttakāmāḥ |	nirmāna mohāḥ jita saṅga doṣāḥ adhyātma nityāḥ vinivṛtta kāmāḥ 
SA_MB_gitarthasamgrahaHK-2947	dvandvairvimuktāḥ sukhaduḥkhasaṃjñai- rgacchantyamūḍhāḥ	dvandvaiḥ vimuktāḥ sukha duḥkha saṃjñaiḥ gacchanti amūḍhāḥ 
SA_MB_gitarthasamgrahaHK-2948	padamavyayaṃ tat || 15-5 ||	padam avyayam tat 
SA_MB_gitarthasamgrahaHK-2949	guṇaiḥ-sattvādibhiḥ | pravṛddhāḥ-devādisthāvarāntatayā |	guṇaiḥ sattva ādibhiḥ pravṛddhāḥ deva ādi sthāvara anta tayā 
SA_MB_gitarthasamgrahaHK-2950	tasya ca śubhāśubhātmakāni karmāṇi aghastanamūlāni | taṃ	tasya ca śubha aśubha ātmakāni karmāṇi agha stana mūlāni tam 
SA_MB_gitarthasamgrahaHK-2951	chittveti-viśeṣye kriyābhidhīyamānā sāmarthyādatra	chittvā iti viśeṣye kriyā abhidhīyamānā sāmarthyāt atra 
SA_MB_gitarthasamgrahaHK-2952	viśeṣaṇapadamupādatte daṇḍī praiṣyānanubrūyāt-iti vidhivat |	viśeṣaṇa padam upādatte daṇḍī praiṣyān anubrūyāt iti vidhivat 
SA_MB_gitarthasamgrahaHK-2953	tenādhorūḍhāni mūlānyasya cchindyāditi | tat-padaṃ-praśāntam	tena adhas rūḍhāni mūlāni asya chindyāt iti tat padam praśāntam 
SA_MB_gitarthasamgrahaHK-2954	avyayaṃ padaṃ tadeva || 5 ||	avyayam padam tat eva 
SA_MB_gitarthasamgrahaHK-2955	na tadbhāsayate sūryo na śaśāṅko na pāvakaḥ | yadgatvā na	na tat bhāsayate sūryaḥ na śaśāṅkaḥ na pāvakaḥ yat gatvā na 
SA_MB_gitarthasamgrahaHK-2956	nivartante taddhāma paramaṃ mama || 15-6 ||	nivartante tat dhāma paramam mama  /
SA_MB_gitarthasamgrahaHK-2957	sūryādīnāṃ tatrānavakāśaḥ | teṣāṃ kālādyavacchedāt	sūrya ādīnām tatra anavakāśaḥ teṣām kāla ādi avacchedāt 
SA_MB_gitarthasamgrahaHK-2958	vedyatvāt karaṇopakārakatvāt | tasya tu dikkālādyanavacchedāt	vedya tvāt karaṇa upakāraka tvāt tasya tu diś kāla ādi anavacchedāt 
SA_MB_gitarthasamgrahaHK-2959	vedakatvāt karaṇapravartakatvāt-tadatītatvāt || 6 ||	vedaka tvāt karaṇa pravartaka tvāt tad atīta tvāt 
SA_MB_gitarthasamgrahaHK-2960	mamaivāṃśo jīvaloke jīvabhūtaḥ sanātanaḥ | manaḥ	mama eva aṃśaḥ jīva loke jīva bhūtaḥ sanātanaḥ manaḥ 
SA_MB_gitarthasamgrahaHK-2961	ṣaṣṭhānīndriyāṇi prakṛtisthāni karṣati || 15-7 ||	ṣaṣṭhāni indriyāṇi prakṛti sthāni karṣati 
SA_MB_gitarthasamgrahaHK-2962	brahmaṇa evāyamaṃśa iti | ajñānadharmatayā	brahmaṇaḥ eva ayam aṃśaḥ iti ajñāna dharma tayā 
SA_MB_gitarthasamgrahaHK-2963	paripūrṇasyāsaṃvedanāñcetanatānivṛtteścāṃśatvamupacaritaṃ	paripūrṇasya asaṃvedanāt cetana tā nivṛtteḥ ca aṃśa tvam upacaritam 
SA_MB_gitarthasamgrahaHK-2964	na punarvastuto'ṃśavattopapadyate-	na punar vastutas ṛṃśavat tā upapadyate 
SA_MB_gitarthasamgrahaHK-2965	pradeśo'pi brahmaṇaḥ sārvarūpyamanatikrāntaḥ | (avikalpyaśca)	pradeśaḥ api brahmaṇaḥ sārvarūpyam an atikrāntaḥ a vikalpyaḥ ca 
SA_MB_gitarthasamgrahaHK-2966	iti hi śrutiḥ | eṣaiva caupacārikatā yathāvasaraṃ yojanīyeti na	iti hi śrutiḥ eṣā eva ca aupacārika tā yathāvasaram yojanīyā iti na 
SA_MB_gitarthasamgrahaHK-2967	vipratipattavyam || 7 ||	vipratipattavyam 
SA_MB_gitarthasamgrahaHK-2968	śarīraṃ yadavāpnoti yaccāpyutkrāmatīśvaraḥ | gṛhītvaitāni	śarīram yat avāpnoti yat ca api utkrāmati īśvaraḥ gṛhītvā etāni 
SA_MB_gitarthasamgrahaHK-2969	saṃyati vāyurgandhānivāśayāt || 15-8 ||	saṃyati vāyuḥ gandhān iva āśayāt 
SA_MB_gitarthasamgrahaHK-2970	avāpnoti-gṛhṇāti | utkrāmati-tyajati | etaiḥ saha | yathā vāyuḥ	avāpnoti gṛhṇāti utkrāmati tyajati etaiḥ saha yathā vāyuḥ 
SA_MB_gitarthasamgrahaHK-2971	sarvagato viśrāntidhāma pārthivaṃ prāpya tato gandhamānīya	sarva gataḥ viśrānti dhāma pārthivam prāpya tatas gandham ānīya 
SA_MB_gitarthasamgrahaHK-2972	sthānāntare tatsahita eva saṃkrāmati evaṃ jīvaḥ puryaṣṭakena	sthāna antare tad sahitaḥ eva saṃkrāmati evam jīvaḥ puryaṣṭakena 
SA_MB_gitarthasamgrahaHK-2973	saha | evaṃ sṛṣṭau saṃhāre caitaiḥ sāhityamasyoktvā sthitāvapi	saha evam sṛṣṭau saṃhāre ca etaiḥ sāhityam asya uktvā sthitau api 
SA_MB_gitarthasamgrahaHK-2974	sthānāsanamananādirūpāyāṃ viṣayagrahaṇātmikāyāṃ	sthāna āsana manana ādi rūpāyām viṣaya grahaṇa ātmikāyām 
SA_MB_gitarthasamgrahaHK-2975	tatsahitasyaivāsya vyāpāra iti niścīyate || 8 ||	tad sahitasya eva asya vyāpāraḥ iti niścīyate 
SA_MB_gitarthasamgrahaHK-2976	śrotraṃ cakṣuḥ sparśanaṃ ca rasanaṃ ghrāṇameva ca |	śrotram cakṣuḥ sparśanam ca rasanam ghrāṇam eva ca 
SA_MB_gitarthasamgrahaHK-2977	adhiṣṭhāya manaścāyaṃ viṣayānupasevate || 15-9 ||	adhiṣṭhāya manaḥ ca ayam viṣayān upasevate 
SA_MB_gitarthasamgrahaHK-2978	tiṣṭhantamutkrāmantaṃ vā bhuñjānaṃ vā guṇānvitam | vimūḍhā	tiṣṭhantam utkrāmantam vā bhuñjānam vā guṇa anvitam vimūḍhā 
