segmentnr	original	analyzed
SA_MB_sivadharma_nandiproktaHK-372	bhavaśaraṇamitīrayanti ye'smin	bhava śaraṇam iti īrayanti ye ismin 
SA_MB_sivadharma_nandiproktaHK-373	bhavajaladhau na patanti te manuṣyāḥ || 4-1 ||	bhava jaladhau na patanti te manuṣyāḥ 
SA_MB_sivadharma_nandiproktaHK-374	śaive | oṃ namo nīlakaṇṭhāya iti puṇyākṣarāṣṭakam	śaive om namaḥ nīlakaṇṭhāya iti puṇya akṣara aṣṭakam 
SA_MB_sivadharma_nandiproktaHK-375	mantramāhasakṛdvā yamapātakaistu pramucyate || 4-2 ||	mantram āha sakṛt vā yama pātakaiḥ tu pramucyate 
SA_MB_sivadharma_nandiproktaHK-376	navāṃbunidhisanta * * na pātrandṛdīkṛtam |	na 
SA_MB_sivadharma_nandiproktaHK-377	svargārohaṇaniśreṇī mahādeveti kīrtanam || 4-3 ||	         
SA_MB_sivadharma_nandiproktaHK-378	vimocanaṃ hi bandhānāmandhānānnadhanauṣadham |	vimocanam hi 
SA_MB_sivadharma_nandiproktaHK-379	dīnānāmāśrayasthānaṃ mahādeveti kīrtanam || 4-4 ||	dīnānām āśraya sthānam mahādeva iti kīrtanam 
SA_MB_sivadharma_nandiproktaHK-380	mahādeveti vāgvallī caturakṣarapallavā |	mahādeva iti vāgvallī catur akṣara pallavā 
SA_MB_sivadharma_nandiproktaHK-381	bhaktisiktāphalatyekā caturvargaphalānyaho || 4-5 ||	caturvarga phalāni aho 
SA_MB_sivadharma_nandiproktaHK-382	mahādeva mahādeva mahādevetyayaṃ dhvaniḥ |	mahādeva mahādeva mahādeva iti ayam dhvaniḥ 
SA_MB_sivadharma_nandiproktaHK-383	sudhiyo muktikāntāyāḥ pāṇigrahaṇaḍiṇḍimaḥ || 4-6 ||	        
SA_MB_sivadharma_nandiproktaHK-384	koṭayo brahmahatyānāmagamyāgamakoṭayaḥ |	koṭayaḥ brahmahatyānām agamyā āgama koṭayaḥ 
SA_MB_sivadharma_nandiproktaHK-385	sadyaḥ pralayamāyānti mahādevetikārtanāt || 4-7 ||	sadyas pralayam āyānti mahādeva iti kārtanāt 
SA_MB_sivadharma_nandiproktaHK-386	p. 21)	p 
SA_MB_sivadharma_nandiproktaHK-387	śiveti maṅgalannāma yasya vāci pravartate |	śiva iti yasya vāci pravartate 
SA_MB_sivadharma_nandiproktaHK-388	bhasmībhavanti tasyāśu mahāpātakakoṭayaḥ || 4-8 ||	bhasmībhavanti tasya āśu mahāpātaka koṭayaḥ 
SA_MB_sivadharma_nandiproktaHK-389	prāṇaprayāṇapātheyaṃ saṃsāravyādhibheṣajam |	             
SA_MB_sivadharma_nandiproktaHK-390	anantaduḥkhaśamanaṃ śiva ityakṣaradvayam || 4-9 ||	ananta duḥkha śamanam śivaḥ iti akṣara dvayam 
SA_MB_sivadharma_nandiproktaHK-391	śiva ityeṣa śabdo'sti vāgasti vaśavartinī |	śivaḥ iti eṣa śabdaḥ asti vāc asti vaśa vartinī 
SA_MB_sivadharma_nandiproktaHK-392	tathāpi narake martyaḥ patantītyatisāhasam || 4-10 ||	tathā api narake martyaḥ patanti iti ati sāhasam 
SA_MB_sivadharma_nandiproktaHK-393	śive trivācaṃ yo nityaṃ caṇḍālo'pi vadenmudā |	śive tri vācam yaḥ nityam caṇḍālaḥ api vadet mudā 
SA_MB_sivadharma_nandiproktaHK-394	sahateva vadedvācaṃ saha tena vaset sadā || 4-11 ||	sahatā iva vadet vācam saha tena vaset sadā 
SA_MB_sivadharma_nandiproktaHK-395	prasaṃṅgāt kautukāllobhāt bhayādajñānato'pi vā |	prasaṃṅgāt kautukāt lobhāt bhayāt ajñānataḥ api vā 
SA_MB_sivadharma_nandiproktaHK-396	hara ityuccaranmartyaḥ sarvapāpaiḥ pramucyate || 4-2 ||	haraḥ iti uccaran martyaḥ sarva pāpaiḥ pramucyate  /
SA_MB_sivadharma_nandiproktaHK-397	āhara praharasaṃhareti ca vyāharan sakṛdaghaiḥ pramucyate |	āhara prahara saṃhara iti ca vyāharan sakṛt aghaiḥ pramucyate 
SA_MB_sivadharma_nandiproktaHK-398	mocayet prakṛtikāmakarmato nāmakīrtanamumāpatessadā || 4-13 ||	mocayet prakṛti kāma karmataḥ nāma kīrtanam umāpateḥ sadā 
SA_MB_sivadharma_nandiproktaHK-399	ādau namaḥ prayoktavyaṃ śivāyetyakṣaratrayam |	ādau namaḥ prayoktavyam śivāya iti akṣara trayam 
SA_MB_sivadharma_nandiproktaHK-400	jihvāyāṃ vartate yasya saphalantasya jīvitam || 4-14 ||	jihvāyām vartate yasya jīvitam 
SA_MB_sivadharma_nandiproktaHK-401	kintasya bahubhirmantraiḥ śastrairvā bahuvistaraiḥ |	kintasya bahubhiḥ mantraiḥ śastraiḥ vā bahu vistaraiḥ 
SA_MB_sivadharma_nandiproktaHK-402	yasyonnamaśśivāyeti mantroyaṃ hṛdi vartate || 4-15 ||	yasya unnamaḥ śivāya iti mantraḥ yam hṛdi vartate 
SA_MB_sivadharma_nandiproktaHK-403	tenādhītaṃ śrutaṃ sarvaṃ tena sarvamanuṣṭhitam |	tena adhītam śrutam sarvam tena sarvam anuṣṭhitam 
SA_MB_sivadharma_nandiproktaHK-404	yasyonnamaśśivāyeti mantrābhyāsasthirīkṛtaḥ || 4-16 ||	yasya unnamaḥ śivāya iti mantra abhyāsa sthirīkṛtaḥ 
SA_MB_sivadharma_nandiproktaHK-405	yaḥ prātaḥ devadeveśaṃ śivaliṅgasvarūpiṇam |	yaḥ prātar devadeveśam śiva liṅga svarūpiṇam 
SA_MB_sivadharma_nandiproktaHK-406	paśyet sayāti sarvasmādadhikāṃ gatimuttamām || 4-17 ||	paśyet sa yāti sarvasmāt adhikām gatim uttamām 
SA_MB_sivadharma_nandiproktaHK-407	p. 22) madhyāhne ca mahādevaṃ dṛṣṭvā yajñaphalaṃ labhet |	madhyāhne ca mahādevam dṛṣṭvā yajña phalam labhet 
SA_MB_sivadharma_nandiproktaHK-408	sāyāhne sarvayajñānāṃ phalamāpya vimucyate || 4-18 ||	sāyāhne sarva yajñānām phalam āpya vimucyate  /
SA_MB_sivadharma_nandiproktaHK-409	na pradoṣe hariṃ paśyet trayodaśyāṃ viśeṣataḥ |	na pradoṣe harim paśyet trayodaśyām viśeṣataḥ 
SA_MB_sivadharma_nandiproktaHK-410	yadi pramādāt paśyedvā dvādaśābdavṛṣakṣayaḥ || 4-19 ||	yadi pramādāt paśyet vā dvādaśa abda vṛṣa kṣayaḥ 
SA_MB_sivadharma_nandiproktaHK-411	trayodaśyāntathā rātrau sopahāraṃ trilocanam |	trayodaśyām tathā rātrau sa upahāram trilocanam 
SA_MB_sivadharma_nandiproktaHK-412	dṛṣṭvāśvamedhamāpnoti mucyate sarvapātakaiḥ || 4-20 ||	dṛṣṭvā aśvamedham āpnoti mucyate sarva pātakaiḥ 
SA_MB_sivadharma_nandiproktaHK-413	gaṅgāpuṣkarakedāranaimiśādīnyanekaśaḥ |	gaṅgā puṣkara kedāra naimiśa ādīni anekaśas 
SA_MB_sivadharma_nandiproktaHK-414	tīrthasnānena yatpuṇyaṃ śivandṛṣṭvaiva tallabhet || 4-21 ||	tīrtha snānena yat puṇyam śivan dṛṣṭvā eva tat labhet  /
SA_MB_sivadharma_nandiproktaHK-415	apavitraḥ pavitro vā sarvāvasthāṃ gato'pi vā |	apavitraḥ pavitraḥ vā sarva avasthām gataḥ api vā 
SA_MB_sivadharma_nandiproktaHK-416	yassmaret sadā rudraṃ śuddha eva na saṃśayaḥ || 4-22 ||	yaḥ smaret sadā rudram śuddhaḥ eva na saṃśayaḥ 
SA_MB_sivadharma_nandiproktaHK-417	ye vāñchanti mahābhogān rājyañca tridaśālayam |	ye vāñchanti mahā bhogān rājyañca tridaśālayam 
SA_MB_sivadharma_nandiproktaHK-418	arcayantu sadā bhaktyā harasya caraṇāṃbujam || 4-23 ||	arcayantu sadā bhaktyā harasya caraṇa aṃbujam 
SA_MB_sivadharma_nandiproktaHK-419	brahmaṇassṛṣṭikartṛtvaṃ viṣṇordānavamardanam |	brahmaṇaḥ sṛṣṭi kartṛ tvam viṣṇoḥ dānava mardanam 
SA_MB_sivadharma_nandiproktaHK-420	svargādhipatyamindrasya śivapūjāvidheḥ phalam || 4-24 ||	svarga ādhipatyam indrasya śiva pūjā vidheḥ phalam 
SA_MB_sivadharma_nandiproktaHK-421	saubhāgyaṃ kāntimadrūpaṃ satyantyāgaḥ pravaktṛtā |	saubhāgyam kāntimat rūpam pravaktṛ tā 
SA_MB_sivadharma_nandiproktaHK-422	śoryañca jagati khyātiḥ śivapūjāvidheḥ phalam || 4-25 ||	jagati khyātiḥ śiva pūjā vidheḥ phalam 
SA_MB_sivadharma_nandiproktaHK-423	yaddvāre mattamātaṅgāḥ vāyuvegāsturaṃgamāḥ |	yad dvāre matta mātaṅgāḥ vāyu vegāḥ turaṃgamāḥ 
SA_MB_sivadharma_nandiproktaHK-424	pūrṇenduvadanānāryaḥ śiva * * * * phalam || 4-26 ||	           
SA_MB_sivadharma_nandiproktaHK-425	bhavanāni manojñāni vidyā jñānaṃ śive ratiḥ |	bhavanāni manojñāni vidyā jñānam śive ratiḥ 
SA_MB_sivadharma_nandiproktaHK-426	dhanañcādṛṣṭaparyantaṃ śiva * * * * phalam || 4-27 ||	dhanam ca adṛṣṭa paryantam śiva      
SA_MB_sivadharma_nandiproktaHK-427	p. 23)	p 
SA_MB_sivadharma_nandiproktaHK-428	āyurārogyamaiśvaryaṃ satputrāḥ sukhasaṃpadaḥ |	āyuḥ ārogyam aiśvaryam sat putrāḥ sukha saṃpadaḥ 
SA_MB_sivadharma_nandiproktaHK-429	svargāpavargau dharmaśca śiva * * * * phalam || 4-28 ||	svarga apavargau dharmaḥ ca śiva       
SA_MB_sivadharma_nandiproktaHK-430	liṅgārcanarato nityaṃ mahāpātakasaṃbhavaiḥ |	liṅga arcana rataḥ nityam mahāpātaka saṃbhavaiḥ 
SA_MB_sivadharma_nandiproktaHK-431	doṣaiḥ kṛtairnalipyeta padmapatramivāṃbhasā || 4-29 ||	doṣaiḥ kṛtaiḥ na lipyeta padma patram iva ambhasā 
SA_MB_sivadharma_nandiproktaHK-432	merumandaratulyāni pāpāni subahūnyapi |	meru mandara tulyāni pāpāni su bahūni api 
SA_MB_sivadharma_nandiproktaHK-433	īśvaraṃ vaidyamāsādya naśyante duṣṭarogavat || 4-30 ||	īśvaram vaidyam āsādya naśyante duṣṭa roga vat 
SA_MB_sivadharma_nandiproktaHK-434	kāyāssanti hi sāpāyāḥ saṃpadaḥ padamāpadām |	kāyāḥ santi hi sa apāyāḥ saṃpadaḥ padam āpadām 
SA_MB_sivadharma_nandiproktaHK-435	samāgamāssāpagamāḥ sarvamutpātabhaṅguram || 4-31 ||	samāgamāḥ sa apagamāḥ sarvam utpāta bhaṅguram 
SA_MB_sivadharma_nandiproktaHK-436	punarjanma punarmṛtyuḥ punaḥ kleśaparaṃparā |	punar janma punar mṛtyuḥ punar kleśa paraṃparā 
SA_MB_sivadharma_nandiproktaHK-437	agharaṭṭaghaṭanyāyo na kadācidanīdṛśam || 4-32 ||	agha raṭṭa ghaṭa nyāyaḥ na kadācid anīdṛśam 
SA_MB_sivadharma_nandiproktaHK-438	merupṛṣṭhe prayāge ca gaṅgāsāgaranaimiśe |	meru pṛṣṭhe prayāge ca gaṅgāsāgara naimiśe 
SA_MB_sivadharma_nandiproktaHK-439	himavante tapastaptaṃ tatphalaṃ liṅgapūjane || 4-33 ||	himavante tapaḥ taptam tad phalam liṅga pūjane 
SA_MB_sivadharma_nandiproktaHK-440	kimatra grandhamālābhiḥ saṃkṣepādupadiśyate |	kim atra grandha mālābhiḥ saṃkṣepāt upadiśyate 
SA_MB_sivadharma_nandiproktaHK-441	vimuktasarvavyāpārāḥ janāḥ pūjayateśvaram || 4-34 ||	vimukta sarva vyāpārāḥ janāḥ pūjayata īśvaram 
SA_MB_sivadharma_nandiproktaHK-442	kiṃ vidyairakhilaiśśāstraiḥ dāna yajñavratādibhiḥ |	kim vidyaiḥ akhilaiḥ śāstraiḥ dāna yajña vrata ādibhiḥ 
SA_MB_sivadharma_nandiproktaHK-443	śivassaṃpūjyatānnityamupadeśoyamuttamam || 4-35 ||	śivaḥ saṃpūjyatām nityam upadeśaḥ yam uttamam 
SA_MB_sivadharma_nandiproktaHK-444	ayameva paro dharmaḥ pūjyate ca sadāśivaḥ |	ayam eva paraḥ dharmaḥ pūjyate ca sadāśivaḥ 
SA_MB_sivadharma_nandiproktaHK-445	etāvaddhi śivajñānaṃ etāvaddhiparaṃ padam || 4-36 ||	etāvat hi śiva jñānam etāvat hi param padam 
SA_MB_sivadharma_nandiproktaHK-446	īśvaraḥ | bhasmaviddhi paraṃbrahmasatyaṃ bodhasukhādvayam |	īśvaraḥ bhasma vid hi param brahma satyam bodha sukha advayam 
SA_MB_sivadharma_nandiproktaHK-447	bhatsanātsarvapāpānāṃ pāśānāñca mahāmune || 4-37 ||	bhatsanāt sarva pāpānām pāśānām ca mahā mune 
SA_MB_sivadharma_nandiproktaHK-448	p. 24)	p 
SA_MB_sivadharma_nandiproktaHK-449	bhayebhyo rakṣaṇādrakṣā bhāsanādbhasitaṃ tathā |	bhayebhyaḥ rakṣaṇāt rakṣā bhāsanāt bhasitam tathā 
SA_MB_sivadharma_nandiproktaHK-450	kṣārayatyakhilaṃ doṣaṃ tataḥ kṣāramudāhṛtam || 4-38 ||	kṣārayati akhilam doṣam tatas kṣāram udāhṛtam 
SA_MB_sivadharma_nandiproktaHK-451	gauṇannānāvidhaṃ viddhi brahman brahmavidāṃvara |	gauṇat nānāvidham viddhi brahman brahma vidām vara 
SA_MB_sivadharma_nandiproktaHK-452	agnihotrāgnijantadvat virajāhomajaṃ mune || 4-39 ||	agnihotra agni jan tadvat virajā homa jam mune 
SA_MB_sivadharma_nandiproktaHK-453	aupāsanasamutpannaṃ grahasthānāṃ vidhīyate |	aupāsana samutpannam grahasthānām vidhīyate 
SA_MB_sivadharma_nandiproktaHK-454	samidagnisamutpannaṃ dhāryaṃ vai brahmacāriṇām || 4-40 ||	samidh agni samutpannam dhāryam vai brahmacāriṇām 
SA_MB_sivadharma_nandiproktaHK-455	śūdrāṇāṃ śrotriyāgāre pacanāgnisamudbhavam |	śūdrāṇām śrotriya āgāre pacana agni samudbhavam 
SA_MB_sivadharma_nandiproktaHK-456	anyeṣāmapi sarveṣāṃ dhāryandāvānalodbhavam || 4-41 ||	anyeṣām api sarveṣām 
SA_MB_sivadharma_nandiproktaHK-457	pañcākṣareṇa mantreṇa praṇavena yutena ca |	pañca akṣareṇa mantreṇa praṇavena yutena ca 
SA_MB_sivadharma_nandiproktaHK-458	lalāṭe hṛdaye caiva do * ye ca mahāmune || 4-42 ||	lalāṭe hṛdaye ca eva daḥ ye ca mahā mune 
SA_MB_sivadharma_nandiproktaHK-459	tripuṇḍraṃ dhārayennityaṃ grahasthaśca vanāśramī |	tripuṇḍram dhārayet nityam graha sthaḥ ca vana āśramī 
SA_MB_sivadharma_nandiproktaHK-460	anyeṣāmapi sarveṣāṃ vināmantreṇa suvrata || 4-43 ||	anyeṣām api sarveṣām vinā amantreṇa suvrata 
SA_MB_sivadharma_nandiproktaHK-461	uddhūlanaṃ tripuṇḍraṃ ca kartavyam bhaktito mune |	uddhūlanam tripuṇḍram ca kartavyam bhaktitaḥ mune 
SA_MB_sivadharma_nandiproktaHK-462	iti śivadharme pañcamodhyāyaḥ ||	iti śiva dharme pañcamaḥ adhyāyaḥ 
SA_MB_sivadharma_nandiproktaHK-463	MUKTABODHA INDOLOGICAL RESEARCH INSTITUTE©2011 Muktabodha Indological Research Institute  All Rights Reserved.E-texts may be viewed only online or downloaded for private study.E-texts may not, under any circumstances, be copied, republished,reproduced, distributed or sold, either in original or altered form, withoutthe express permission of Muktabodha Indological Research Institute in writing.Data-entered by the staff of Muktabodha under the direction of Mark S. G. Dyczkowski.	muktabodha indological research muktabodha indological research institute all rights reserved texts may be viewed only online or downloaded for private studye texts may not under any circumstances be copied republished reproduced distributed or sold either in original or altered form withoutthe express permission of muktabodha indological research institute in writing data entered by the staff of muktabodha under the direction of mark s g dyczkowski 
