segmentnr	original	analyzed
SA_MB_varahopanisatHK-711	manaḥkalpitabhedajātaṃ grāhyaṃ tadgrāhakaṃ mānasaṃ tadubhayaṃ mā	manaḥ kalpita bheda jātam grāhyam tad grāhakam mānasam tat ubhayam mā 
SA_MB_varahopanisatHK-712	bhavetyarthaḥ || 19 || antaḥśūnya ityādi kevalaṃ bhaja ityantaṃ	bhava iti arthaḥ    antar śūnyaḥ ityādi kevalam bhaja iti antam 
SA_MB_varahopanisatHK-713	maitreyopaniṣadi vyākhyātam || 20 ||	maitreya upaniṣadi vyākhyātam 
SA_MB_varahopanisatHK-714	jīvanmuktalakṣaṇam	jīvanmukta lakṣaṇam 
SA_MB_varahopanisatHK-715	yathāsthitamidaṃ yasya vyavahāravato'pi ca |	yathāsthitam idam yasya vyavahāravataḥ api ca 
SA_MB_varahopanisatHK-716	astaṃgataṃ sthitaṃ vyoma sa jīvanmukta ucyate || 21 ||	sthitam vyoma sa jīvanmuktaḥ ucyate 
SA_MB_varahopanisatHK-717	p. 497) nodeti nāstamāyāti sukhe duḥkhe manaḥprabhā |	na udeti na astam āyāti sukhe duḥkhe manaḥ prabhā 
SA_MB_varahopanisatHK-718	yathāprāptasthitiryasya sa jīvanmukta ucyate || 22 ||	yathā prāpta sthitiḥ yasya sa jīvanmuktaḥ ucyate  /
SA_MB_varahopanisatHK-719	yo jāgarti suṣuptistho yasya jāgranna vidyate |	yaḥ jāgarti suṣupti sthaḥ yasya jāgrat na vidyate 
SA_MB_varahopanisatHK-720	yasya nirvāsano bodhaḥ sa jīvanmukta ucyate || 23 ||	yasya nirvāsanaḥ bodhaḥ sa jīvanmuktaḥ ucyate  /
SA_MB_varahopanisatHK-721	rāgadveṣabhayādīnāmanurūpaṃ carannapi |	rāga dveṣa bhaya ādīnām anurūpam caran api 
SA_MB_varahopanisatHK-722	yo'ntarvyomavadatyacchaḥ sa jīvanmukta ucyate || 24 ||	yaḥ antar vyoma vat ati acchaḥ sa jīvanmuktaḥ ucyate 
SA_MB_varahopanisatHK-723	yasya nāhaṃkṛto bhāvo buddhiryasya na lipyate |	yasya na ahaṃkṛtaḥ bhāvaḥ buddhiḥ yasya na lipyate 
SA_MB_varahopanisatHK-724	kurvato'kurvato vāpi sa jīvanmukta ucyate || 25 ||	kurvataḥ kurvataḥ vā api sa jīvanmuktaḥ ucyate 
SA_MB_varahopanisatHK-725	yasmānnodvijate loko lokānnodvijate ca yaḥ |	yasmāt na udvijate lokaḥ lokāt na udvijate ca yaḥ 
SA_MB_varahopanisatHK-726	harṣāmarṣabhayonmuktaḥ sa jīvanmukta ucyate || 26 ||	harṣa amarṣa bhaya unmuktaḥ sa jīvanmuktaḥ ucyate 
SA_MB_varahopanisatHK-727	yaḥ samastārthajāleṣu vyavahāryapi śītalaḥ |	yaḥ samasta artha jāleṣu vyavahārī api śītalaḥ 
SA_MB_varahopanisatHK-728	parārtheṣviva pūrṇātmā sa jīvanmukta ucyate || 27 ||	parārtheṣu iva pūrṇa ātmā sa jīvanmuktaḥ ucyate 
SA_MB_varahopanisatHK-729	prajahāti yadā kāmān sarvāṃścittagatān mune |	prajahāti yadā kāmān sarvān citta gatān mune 
SA_MB_varahopanisatHK-730	mayi sarvātmake tuṣṭaḥ sa jīvanmukta ucyate || 28 ||	mayi sarvātmake tuṣṭaḥ sa jīvanmuktaḥ ucyate  /
SA_MB_varahopanisatHK-731	caityavarjitacinmātre pade paramapāvane |	caitya varjita cit mātre pade parama pāvane 
SA_MB_varahopanisatHK-732	akṣubdhacitto viśrāntaḥ sa jīvanmukta ucyate || 29 ||	akṣubdha cittaḥ viśrāntaḥ sa jīvanmuktaḥ ucyate 
SA_MB_varahopanisatHK-733	idaṃ jagadahaṃ so'yaṃ dṛśyajātamavāstavam |	idam jagat aham saḥ uyam dṛśya jātam avāstavam 
SA_MB_varahopanisatHK-734	yasya citte na sphurati sa jīvanmukta ucyate || 30 ||	yasya citte na sphurati sa jīvanmuktaḥ ucyate  /
SA_MB_varahopanisatHK-735	jīvanmuktāḥ catvāraḥ ityuktam | teṣāṃ lakṣaṇamāha- yathetyādi	jīvanmuktāḥ catvāraḥ iti uktam teṣām lakṣaṇam āha yathā ityādi 
SA_MB_varahopanisatHK-736	| yathā ghaṭaśarāvādisattvāsattvābhyāṃ vyoma yathāsthitaṃ vyomaiva	yathā ghaṭa śarāva ādi sattva asattvābhyām vyoma yathā sthitam vyoma eva 
SA_MB_varahopanisatHK-737	bhavati tathā yasya	bhavati tathā yasya 
SA_MB_varahopanisatHK-738	p. 498) tūṣṇīṃbhūtasya vyavahāravato'pi ca svāpādyavasthātraye	tūṣṇīṃbhūtasya vyavahāravataḥ api ca svāpa ādi avasthā traye 
SA_MB_varahopanisatHK-739	mano'staṃ gataṃ sthitaṃ vāpi brahmamātragocaraṃ bhavati sa jīvanmukta	manoḥ tam gatam sthitam vā api brahma mātra gocaram bhavati sa jīvanmukta 
SA_MB_varahopanisatHK-740	ucyate iti || 21 || kiṃca- nodetīti || 22 || kiṃca- yo jāgartīti || 23-26	ucyate iti     kiṃca na udeti iti    kiṃca yaḥ jāgarti iti 
SA_MB_varahopanisatHK-741	|| śītalaḥ antastāpavairalyāt || 27-30 ||	śītalaḥ antar tāpa vairalyāt 
SA_MB_varahopanisatHK-742	bhūmabrahmaniṣṭhāvidhiḥ	          
SA_MB_varahopanisatHK-743	sadbrahmaṇi sthire sphāre pūrṇe viṣayavarjite |	sat brahmaṇi sthire sphāre pūrṇe viṣaya varjite 
SA_MB_varahopanisatHK-744	ācāryaśāstramārgeṇa praviśyāśu sthiro bhava || 31 ||	ācārya śāstra mārgeṇa praviśya āśu sthiraḥ bhava  /
SA_MB_varahopanisatHK-745	śivo guruḥ śivo vedaḥ śivo devaḥ śivaḥ prabhuḥ |	śivaḥ guruḥ śivaḥ vedaḥ śivaḥ devaḥ śivaḥ prabhuḥ 
SA_MB_varahopanisatHK-746	śivo'smyahaṃ śivaḥ sarvaṃ śivādanyanna kiṃcana || 32 ||	śivaḥ asmi aham śivaḥ sarvam śivāt anyat na kiṃcana 
SA_MB_varahopanisatHK-747	tameva dhīro vijñāya prajñāṃ kurvīta brāhmaṇaḥ |	tam eva dhīraḥ vijñāya prajñām kurvīta brāhmaṇaḥ 
SA_MB_varahopanisatHK-748	nānudhyāyād bahūñchabdān vāco viglāpanaṃ hi tat || 33 ||	na anudhyāyāt bahūn śabdān vācaḥ viglāpanam hi tat 
SA_MB_varahopanisatHK-749	tvamapi sadbrahmaṇi | he nidāgha sanmātre bhūmabrahmaṇi	tvam api sat brahmaṇi he nidāgha sat mātre bhūmabrahmaṇi 
SA_MB_varahopanisatHK-750	śrutyācāryopadeśena praviśya jhaṭiti sthiro bhava | tanmātrapadavīṃ	śruti ācārya upadeśena praviśya jhaṭiti sthiraḥ bhava tanmātra padavīm 
SA_MB_varahopanisatHK-751	bhajasvetyarthaḥ || 31 || sphārānandātmā kīdṛśa ityata āha- śiva iti ||	bhajasva iti arthaḥ    sphāra ānanda ātmā kīdṛśaḥ iti atas āha śivaḥ iti 
SA_MB_varahopanisatHK-752	32 || yaḥ svātiriktāśivaṃ grasitvā svamātramavaśiṣyate tameva | etat	yaḥ sva atirikta aśivam grasitvā sva mātram avaśiṣyate tam eva etat 
SA_MB_varahopanisatHK-753	bṛhadāraṇyake vyākhyātam || 33 ||	bṛhadāraṇyake vyākhyātam 
SA_MB_varahopanisatHK-754	vihaṃgamapipīlikāmārgavivekaḥ	vihaṃgama pipīlikā mārga vivekaḥ 
SA_MB_varahopanisatHK-755	śuko mukto vāmadevo'pi mukta-	śukaḥ muktaḥ vāmadevaḥ api mukta 
SA_MB_varahopanisatHK-756	stābhyāṃ vinā muktibhājo na santi |	stābhyām vinā mukti bhājaḥ na santi 
SA_MB_varahopanisatHK-757	śukaṃ mārgaṃ ye'nusaranti dhīrāḥ	śukam mārgam yena anusaranti dhīrāḥ 
SA_MB_varahopanisatHK-758	sadyomuktāste bhavantīha loke || 34 ||	sadyas muktāḥ te bhavanti iha loke 
SA_MB_varahopanisatHK-759	p. 499) vāmadevaṃ ye'nusaranti nityaṃ	vāmadevam yena anusaranti nityam 
SA_MB_varahopanisatHK-760	mṛtvā janitvā ca punaḥpunastat |	mṛtvā janitvā ca punar punar tat 
SA_MB_varahopanisatHK-761	te vai loke kramamuktā bhavanti	te vai loke krama muktāḥ bhavanti 
SA_MB_varahopanisatHK-762	yogaiḥ sāṃkhyaiḥ karmabhirbhaktiyuktaiḥ || 35 ||	yogaiḥ sāṃkhyaiḥ karmabhiḥ bhakti yuktaiḥ 
SA_MB_varahopanisatHK-763	śukaśca vāmadevaśca dve sṛtī devanirmite |	śukaḥ ca vāmadevaḥ ca dve sṛtī deva nirmite 
SA_MB_varahopanisatHK-764	śuko vihaṅgamaḥ prokto vāmadevaḥ pipīlikā || 36 ||	          
SA_MB_varahopanisatHK-765	atadvyāvṛttirūpeṇa sākṣādvidhimukhena vā |	a tad vyāvṛtti rūpeṇa sākṣāt vidhi mukhena vā 
SA_MB_varahopanisatHK-766	mahāvākyavicāreṇa sāṃkhyayogasamādhinā || 37 ||	          
SA_MB_varahopanisatHK-767	viditvā svātmano rūpamasaṃprajñāsamādhitaḥ |	viditvā sva ātmanaḥ rūpam asaṃprajñā samādhitaḥ 
SA_MB_varahopanisatHK-768	śukamārgeṇa virajāḥ prayānti paramaṃ padam || 38 ||	śuka mārgeṇa virajāḥ prayānti paramam padam 
SA_MB_varahopanisatHK-769	yamādyāsanajāyāsahaṭhābhyāsāt punaḥpunaḥ |	yama ādi āsana ja āyāsa haṭha abhyāsāt punar punar 
SA_MB_varahopanisatHK-770	saṃjātavighnabāhulyaḥ aṇimādivaśādiha || 39 ||	saṃjāta vighna bāhulyaḥ aṇima ādi vaśāt iha 
SA_MB_varahopanisatHK-771	alabdhvāpi phalaṃ samyak punarbhūtvā mahākule |	a labdhvā api phalam samyak punar bhūtvā mahā kule 
SA_MB_varahopanisatHK-772	pūrvavāsanayaivāyaṃ yogābhyāsaṃ punaścaran || 40 ||	pūrva vāsanayā eva ayam yoga abhyāsam punar caran 
SA_MB_varahopanisatHK-773	anekajanmābhyāsena vāmadevena vai pathā |	aneka janma abhyāsena vāmadevena vai pathā 
SA_MB_varahopanisatHK-774	so'pi muktiṃ samāpnoti tadviṣṇoḥ paramaṃ padam || 41 ||	saḥ api muktim samāpnoti tat viṣṇoḥ paramam padam 
SA_MB_varahopanisatHK-775	dvāvimāvapi panthānau brahmaprāptikarau śivau |	dvau imau api panthānau brahma prāpti karau śivau 
SA_MB_varahopanisatHK-776	sadyomuktipradaścaikaḥ kramamuktipradaḥ paraḥ || 42 ||	sadyas mukti pradaḥ ca ekaḥ krama mukti pradaḥ paraḥ 
SA_MB_varahopanisatHK-777	p. 500) nanu śuko mukto vāmadevo'pi muktaḥ ityanena dvāveva muktau	nanu śukaḥ muktaḥ vāmadevaḥ api muktaḥ iti anena dvau eva muktau 
SA_MB_varahopanisatHK-778	bhavataḥ | na hi tābhyāṃ tṛtīyo muktatvena parigaṇito bhavitumarhati | tathā	bhavataḥ na hi tābhyām tṛtīyaḥ mukta tvena parigaṇitaḥ bhavitum arhati tathā 
SA_MB_varahopanisatHK-779	sati kimarthaṃ loke nityādikarmacittaśuddhisādhanacatuṣṭayasaṃnyāsa##-	sati kimartham loke 
SA_MB_varahopanisatHK-780	yatante | tadyatno na hi phalavān bhavitumarhatīti cenna ; śuko mukto	yatante tad yatnaḥ na hi phalavān bhavitum arhati iti ced na 
SA_MB_varahopanisatHK-781	vāmadevo'pi muktaḥ iti śruteḥ anyārthatvena	vāmadevaḥ api muktaḥ iti śruteḥ anyārtha tvena 
SA_MB_varahopanisatHK-782	vihaṃgamapipīlikāmārgaparatvāt | ato jñānasādhanapravṛttiḥ phalavatī	vihaṃgama pipīlikā mārga paratvāt atas jñāna sādhana pravṛttiḥ phalavatī 
SA_MB_varahopanisatHK-783	bhavatītyāha- śuka iti | śuko vihaṃgamamārgānusārī sadyomukto	bhavati iti āha śukaḥ iti śukaḥ vihaṃgama mārga anusārī sadyas muktaḥ 
SA_MB_varahopanisatHK-784	bhavati | vāmadevaḥ pipīlikāmārgānusāryapi kramamukto bhavati | tābhyāṃ	bhavati vāmadevaḥ pipīlikā mārga anusārī api krama muktaḥ bhavati tābhyām 
SA_MB_varahopanisatHK-785	tau mārgāvatikramya na hi ke'pi muktibhājaḥ santi | ityetadarthaṃ vispaṣṭaṃ	tau mārgau atikramya na hi ke pi mukti bhājaḥ santi iti etad artham vispaṣṭam 
SA_MB_varahopanisatHK-786	śrutireva prakāśayati- śukamiti || 34-36 ||	śrutiḥ eva prakāśayati śukam iti 
SA_MB_varahopanisatHK-787	śukamārgasādhanamāha- ataditi | neti neti na hyetasmāt ityādi	śuka mārga sādhanam āha a tat iti na iti na iti na hi etasmāt ityādi 
SA_MB_varahopanisatHK-788	atadvyāvṛttirūpeṇa svātiriktakalanāsaṃbhavasiddhaṃ brahma	                                                
SA_MB_varahopanisatHK-789	niṣpratiyogikasvamātramiti sākṣādvidhimukhena vā || 37-38 ||	niṣpratiyogika sva mātram iti sākṣāt vidhi mukhena vā 
SA_MB_varahopanisatHK-790	vāmadevamārgasvarūpamāha- yameti || 39-40 || so'pi muktiṃ	vāmadeva mārga svarūpam āha yama iti     saḥ api muktim 
SA_MB_varahopanisatHK-791	krameṇa samāpnoti || 41 || phalitārthamāha- dvāviti || 42 ||	krameṇa samāpnoti        
SA_MB_varahopanisatHK-792	brahmaviddṛṣṭiprasarasya pāvanatvam	             
SA_MB_varahopanisatHK-793	tatra ko mohaḥ kaḥ śoka ekatvamanupaśyataḥ |	tatra kaḥ mohaḥ kaḥ śokaḥ eka tvam anupaśyataḥ 
SA_MB_varahopanisatHK-794	yasyānubhavaparyantā buddhistattve pravartate || 43 ||	yasya anubhava paryantā buddhiḥ tattve pravartate 
SA_MB_varahopanisatHK-795	taddṛṣṭigocarāḥ sarve mucyante sarvapātakaiḥ |	tad dṛṣṭi gocarāḥ sarve mucyante sarva pātakaiḥ 
SA_MB_varahopanisatHK-796	khecarā bhūcarāḥ sarve brahmaviddṛṣṭigocarāḥ || 44 ||	khecarāḥ bhū carāḥ sarve brahma vid dṛṣṭi gocarāḥ 
SA_MB_varahopanisatHK-797	sadya eva vimucyante koṭijanmārjitairaghaiḥ ||	sadyas eva vimucyante koṭi janma arjitaiḥ aghaiḥ 
SA_MB_varahopanisatHK-798	iti ||	iti 
SA_MB_varahopanisatHK-799	yat sāṃkhyaiḥ prāpyate sthānaṃ tadyogairapi gamyate |	yat sāṃkhyaiḥ prāpyate sthānam tat yogaiḥ api gamyate 
SA_MB_varahopanisatHK-800	ekaṃ sāṃkhyaṃ ca yogaṃ ca yaḥ paśyati sa paśyati ||	ekam sāṃkhyam ca yogam ca yaḥ paśyati sa paśyati 
SA_MB_varahopanisatHK-801	p. 501) iti smṛtyanurodhena mārgadvayaprāpyaphalayoḥ paryavasāna	iti smṛti anurodhena mārga dvaya prāpya phalayoḥ paryavasāna 
SA_MB_varahopanisatHK-802	ekatvamityarthe- tatreti | itthaṃbhūtajñānidṛṣṭipūto'pyaśubhāt	ekatvam iti arthe tatra iti itthaṃbhūta jñāni dṛṣṭi pūtaḥ upi aśubhāt 
SA_MB_varahopanisatHK-803	mucyata ityāha- yasyeti | brahmavit svātiriktaṃ yadyat paśyati	mucyate iti āha yasya iti brahma vid sva atiriktam yat yat paśyati 
SA_MB_varahopanisatHK-804	tattadbrahmātiriktaṃ na paśyati || 43 || tatpuṇyaprabhāvena taddṛṣṭipūtāḥ	tat tat brahma atiriktam na paśyati tad puṇya prabhāvena tad dṛṣṭi pūtāḥ 
SA_MB_varahopanisatHK-805	kṛtakṛtyā bhavantītyarthaḥ || 44 || itiśabdaḥ adhyāyaparisamāptyarthaḥ ||	kṛtakṛtyāḥ bhavanti iti arthaḥ    iti śabdaḥ adhyāya parisamāpti arthaḥ 
SA_MB_varahopanisatHK-806	iti caturtho'dhyāyaḥ	iti caturthaḥ udhyāyaḥ 
SA_MB_varahopanisatHK-807	pañcamo'dhyāyaḥ	pañcamaḥ adhyāyaḥ 
SA_MB_varahopanisatHK-808	yogecchoḥ dehajñānamāvaśyakam	yoga icchoḥ deha jñānam āvaśyakam 
SA_MB_varahopanisatHK-809	atha hainam ṛbhuṃ bhagavantaṃ nidāghaḥ papraccha	atha ha enam ṛbhum bhagavantam nidāghaḥ papraccha 
SA_MB_varahopanisatHK-810	yogābhyāsavidhimanubrūhīti | tatheti sa hovāca |	yoga abhyāsa vidhim anubrūhi iti tathā iti sa ha uvāca 
SA_MB_varahopanisatHK-811	pañcabhūtātmako dehaḥ pañcamaṇḍalapūritaḥ |	pañcabhūta ātmakaḥ dehaḥ pañca maṇḍala pūritaḥ 
SA_MB_varahopanisatHK-812	kāṭhinyaṃ pṛthivīmekāṃ[hyeṣā]pānīyaṃ taddravākṛti || 1 ||	kāṭhinyam pṛthivīm ekām hi eṣā apānīyam tat drava ākṛti 
SA_MB_varahopanisatHK-813	dīpanaṃ ca bhavet tejaḥ pracāro vāyulakṣaṇam |	dīpanam ca bhavet tejaḥ pracāraḥ vāyu lakṣaṇam 
SA_MB_varahopanisatHK-814	ākāśaḥ sattvataḥ sarvaṃ jñātavyaṃ yogamicchatā || 2 ||	ākāśaḥ sattvataḥ sarvam jñātavyam yogam icchatā  /
SA_MB_varahopanisatHK-815	deśikamukhāt nidāgho jīvanmuktilakṣaṇaṃ yathāvadavagamya	deśika mukhāt nidāghaḥ jīvanmukti lakṣaṇam yathāvat avagamya 
SA_MB_varahopanisatHK-816	jīvanmuktihetunirviśeṣabrahmajñānopāyabhūtayogābhyāsalakṣaṇa##-	                         
SA_MB_varahopanisatHK-817	? yogeti | nidāghapraśnamaṅgīkṛtya tatheti sa hovāca |	yoga iti nidāgha praśnam aṅgīkṛtya tathā iti sa ha uvāca 
SA_MB_varahopanisatHK-818	yogābhyāsasya dehanirvartyatvādityādau deheyattāmāha- pañceti |	yoga abhyāsasya deha nirvartya tvāt ityādau deheyattām āha pañca iti 
SA_MB_varahopanisatHK-819	dehasya pañcabhūtātmakatā kathamityata āha- kāṭhinyamiti || 1-2 ||	dehasya pañcabhūta ātmaka tā katham iti atas āha kāṭhinyam iti 
SA_MB_varahopanisatHK-820	"p. 502) 				śvāsasaṃkhyā"	śvāsa saṃkhyā 
SA_MB_varahopanisatHK-821	ṣaṭchatānyadhikānyatra sahasrāṇyekaviṃśatiḥ |	ṣaṣ śatāni adhikāni atra sahasrāṇi ekaviṃśatiḥ 
SA_MB_varahopanisatHK-822	ahorātravahaiḥ śvāsairvāyumaṇḍalaghātakaḥ || 3 ||	           
SA_MB_varahopanisatHK-823	yāvadahorātranirvartyaśvāsasaṃkhyā kā ityatrāha- ṣaḍiti || 3 ||	yāvat ahar rātra nirvartya śvāsa saṃkhyā kā iti atra āha ṣaṣ iti 
SA_MB_varahopanisatHK-824	dehakṣayanivāraṇāya bhūtadhāraṇavidhiḥ	                
SA_MB_varahopanisatHK-825	tatpṛthvīmaṇḍale kṣīṇe valirāyāti dehinām |	tad pṛthvī maṇḍale kṣīṇe valiḥ āyāti dehinām 
SA_MB_varahopanisatHK-826	tadvadāpogaṇāpāye keśāḥ syuḥ pāṇḍarāḥ kramāt || 4 ||	tadvat āpogaṇa apāye keśāḥ syuḥ pāṇḍarāḥ kramāt 
SA_MB_varahopanisatHK-827	tejaḥkṣaye kṣudhā kāntirnaśyate mārutakṣaye |	tejaḥ kṣaye kṣudhā kāntiḥ naśyate māruta kṣaye 
SA_MB_varahopanisatHK-828	vepathuḥ saṃbhavennityaṃ nābhase naiva jīvati || 5 ||	vepathuḥ saṃbhavet nityam nābhase nā eva jīvati  /
SA_MB_varahopanisatHK-829	itthaṃbhūtakṣayānnityaṃ jīvitaṃ bhūtadhāraṇam |	itthaṃbhūta kṣayāt nityam jīvitam bhūta dhāraṇam 
SA_MB_varahopanisatHK-830	dehapravibhaktapañcabhūtāṃśāḥ yāvanna kṣīyante tāvadavikalo	deha pravibhakta pañcabhūta aṃśāḥ yāvat na kṣīyante tāvat avikalaḥ 
SA_MB_varahopanisatHK-831	deho bhavati | tatkṣaye tu vikṛtimetītyāha- taditi || 4 || nābhase kṣīṇe || 5	dehaḥ bhavati tad kṣaye tu vikṛtim eti iti āha tat iti    nābhase kṣīṇe 
SA_MB_varahopanisatHK-832	|| yato bhūtakṣayato dehaḥ kṣīyate ato nityaṃ dehasya jīvitaṃ prati	yatas bhūta kṣayataḥ dehaḥ kṣīyate atas nityam dehasya jīvitam prati 
SA_MB_varahopanisatHK-833	tattadbhūtadhāraṇaṃ kartavyamityarthaḥ ||	tad tad bhūta dhāraṇam kartavyam iti arthaḥ 
SA_MB_varahopanisatHK-834	bhūtadhāraṇāya uḍyāṇabandhābhyāsaḥ	bhūta dhāraṇāya uḍyāṇa bandha abhyāsaḥ 
SA_MB_varahopanisatHK-835	uḍyāṇaṃ kurute yasmādaviśrāntaṃ mahākhagaḥ || 6 ||	uḍyāṇam kurute yasmāt aviśrāntam mahākhagaḥ 
SA_MB_varahopanisatHK-836	uḍyiyāṇaṃ tadeva syāt tatra bandho'bhidhīyate |	uḍyiyāṇam tat eva syāt tatra bandhaḥ abhidhīyate 
SA_MB_varahopanisatHK-837	uḍḍiyāṇo hyasau bandho mṛtyumātaṅgakesarī || 7 ||	uḍḍiyānaḥ hi asau bandhaḥ mṛtyu mātaṅga kesarī  /
SA_MB_varahopanisatHK-838	p. 503) tasya bhuktistanoḥ kāyāt tasya bandho hi duṣkaraḥ |	tasya bhuktiḥ tanoḥ kāyāt tasya bandhaḥ hi duṣkaraḥ 
SA_MB_varahopanisatHK-839	agnau tu calite kukṣau vedanā jāyate bhṛśam || 8 ||	agnau tu calite kukṣau vedanā jāyate bhṛśam 
SA_MB_varahopanisatHK-840	na kāryā kṣudhitenāpi nāpi vuṇmūtraveginā |	na kāryā kṣudhitena api nā api vuṣ mūtra veginā 
SA_MB_varahopanisatHK-841	hitaṃ mitaṃ ca bhoktavyaṃ stokaṃstokamanekadhā || 9 ||	hitam mitam ca bhoktavyam stokam stokam anekadhā 
SA_MB_varahopanisatHK-842	bhūtadhāraṇānukūloḍyāṇabandhamāha- uḍyāṇamiti || 6-7	bhūta dhāraṇa anukūla uḍyāṇa bandham āha uḍyāṇam iti 
SA_MB_varahopanisatHK-843	|| tasyoḍyāṇabandhasya muktiḥ kāyāt kāyadārḍhyāt bhavati | tasya	tasya uḍyāṇa bandhasya muktiḥ kāyāt kāya dārḍhyāt bhavati tasya 
SA_MB_varahopanisatHK-844	sadā kartumaśakyatvāt tasya duṣkaratvam | sadākaraṇe kā	sadā kartum aśakya tvāt tasya duṣkara tvam sadā karaṇe kā 
SA_MB_varahopanisatHK-845	hānirityatrāha- agnāviti || 8 || kṣucchāntaye hitaṃ mitaṃ ca	hāniḥ iti atra āha agnau iti kṣudh śāntaye hitam mitam ca 
SA_MB_varahopanisatHK-846	bhoktavyam || 9 ||	bhoktavyam 
SA_MB_varahopanisatHK-847	layamantrahaṭhākhyāstrayo yogāḥ	laya mantra haṭha ākhyāḥ trayaḥ yogāḥ 
SA_MB_varahopanisatHK-848	mṛdumadhyamamantreṣu kramānmantraṃ layaṃ haṭham |	mṛdu madhyama mantreṣu kramāt mantram layam haṭham 
SA_MB_varahopanisatHK-849	layamantrahaṭhā yogā yogo hyaṣṭāṅgasaṃyutaḥ || 10 ||	laya mantra haṭhāḥ yogāḥ yogaḥ hi aṣṭa aṅga saṃyutaḥ 
SA_MB_varahopanisatHK-850	evaṃ kṣucchāntiṃ kṛtvā yogābhyāsaḥ kartavyaḥ ityāha-	evam kṣucchāntim kṛtvā yoga abhyāsaḥ kartavyaḥ iti āha 
SA_MB_varahopanisatHK-851	mṛdviti | mṛduḥ layaḥ, madhyamo haṭhaḥ, mantro	mṛdu iti mṛduḥ layaḥ madhyamaḥ haṭhaḥ 
SA_MB_varahopanisatHK-852	nādānusaṃdhānaṃ, nādasya sarvamantramūlatvāt | teṣu	nāda anusaṃdhānam nādasya sarva mantra mūla tvāt teṣu 
SA_MB_varahopanisatHK-853	mṛdumadhyamamantreṣu kramānmantraṃ nādānusaṃdhānaṃ, tato	mṛdu madhyama mantreṣu kramāt mantram nāda anusaṃdhānam 
SA_MB_varahopanisatHK-854	layaṃ, tatsādhanaṃ haṭhaṃ viddhi | tatra layahetuḥ mantraḥ,	       viddhi           
SA_MB_varahopanisatHK-855	taddhetuḥ haṭhaḥ | evaṃ yogāḥ triprakārā bhavanti | tatra ādyahaṭhayogastu	tad hetuḥ haṭhaḥ evam yogāḥ tri prakārāḥ bhavanti tatra ādya haṭha yogaḥ tu 
SA_MB_varahopanisatHK-856	yamādyaṣṭāṅgasaṃyuto bhavatītyarthaḥ || 10 ||	yama ādi aṣṭa aṅga saṃyutaḥ bhavati iti arthaḥ 
SA_MB_varahopanisatHK-857	yogāṣṭāṅgāni	yoga aṣṭāṅgāni 
SA_MB_varahopanisatHK-858	yamaśca niyamaścaiva tathā cāsanameva ca |	yamaḥ ca niyamaḥ ca eva tathā ca āsanam eva ca 
SA_MB_varahopanisatHK-859	prāṇāyāmastathā paścāt pratyāhārastathā param || 11 ||	prāṇāyāmaḥ tathā paścāt pratyāhāraḥ tathā param 
SA_MB_varahopanisatHK-860	dhāraṇā ca tathā dhyānaṃ samādhiścāṣṭamo bhavet |	dhāraṇā ca tathā dhyānam samādhiḥ ca aṣṭamaḥ bhavet 
SA_MB_varahopanisatHK-861	p. 504) kāni yogāṣṭāṅgāni ityata āha- yamaśceti || 11 ||	kāni yoga aṣṭāṅgāni iti atas āha yamaḥ ca iti  /
SA_MB_varahopanisatHK-862	yamaniyamabhedāḥ	yama niyama bhedāḥ 
SA_MB_varahopanisatHK-863	ahiṃsā satyamasteyaṃ brahmacaryaṃ dayārjavam || 12 ||	ahiṃsā satyam asteyam brahmacaryam dayā ārjavam 
SA_MB_varahopanisatHK-864	kṣamā dhṛtirmitāhāraḥ śaucaṃ ceti yamā daśa |	kṣamā dhṛtiḥ mita āhāraḥ śaucam ca iti yamāḥ daśa 
SA_MB_varahopanisatHK-865	tapaḥ saṃtoṣamāstikyaṃ dānamīśvarapūjanam || 13 ||	tapaḥ saṃtoṣam āstikyam dānam īśvara pūjanam 
SA_MB_varahopanisatHK-866	siddhāntaśravaṇaṃ caiva hrīrmatiśca japo vratam |	siddhānta śravaṇam ca eva hrīḥ matiḥ ca japaḥ vratam 
SA_MB_varahopanisatHK-867	ete hi niyamāḥ proktā daśadhaivaṃ mahāmate || 14 ||	ete hi niyamāḥ proktāḥ daśadhā evam mahāmate 
SA_MB_varahopanisatHK-868	saṃkṣepato yamādyaṣṭāṅganāmāni nirdiśati- ahiṃseti || 12-16 ||	saṃkṣepataḥ yama ādi aṣṭa aṅga nāmāni nirdiśati ahiṃsā iti 
SA_MB_varahopanisatHK-869	ekādaśāsanāni	ekādaśa āsanāni 
SA_MB_varahopanisatHK-870	ekādaśāsanāni syuścakrādyā munisattama |	ekādaśa āsanāni syuḥ cakra ādyāḥ muni sattama 
SA_MB_varahopanisatHK-871	cakraṃ padmāsanaṃ kūrmaṃ mayūraṃ kukkuṭaṃ tathā || 15 ||	cakram padmāsanam kūrmam mayūram kukkuṭam tathā 
SA_MB_varahopanisatHK-872	vīrāsanaṃ svastikaṃ ca bhadraṃ siṃhāsanaṃ tathā |	vīrāsanam svastikam ca bhadram siṃhāsanam tathā 
SA_MB_varahopanisatHK-873	muktāsanaṃ gomukhaṃ ca kīrtitaṃ yogavittamaiḥ || 16 ||	muktāsanam gomukham ca kīrtitam yoga vittamaiḥ 
SA_MB_varahopanisatHK-874	cakrasanalakṣaṇam	cakrasana lakṣaṇam 
SA_MB_varahopanisatHK-875	savyoru dakṣiṇe gulphe dakṣiṇaṃ dakṣiṇetare |	savya ūru dakṣiṇe gulphe dakṣiṇam dakṣiṇetare 
SA_MB_varahopanisatHK-876	nidadhyādṛjukāyastu cakrāsanamidaṃ matam || 17 ||	nidadhyāt ṛju kāyaḥ tu cakrāsanam idam matam 
SA_MB_varahopanisatHK-877	tatra cakrāsanalakṣaṇamāha- savyeti || 17 ||	tatra cakra āsana lakṣaṇam āha savya iti 
SA_MB_varahopanisatHK-878	"p. 505) 				prāṇāyāmaḥ"	prāṇāyāmaḥ 
SA_MB_varahopanisatHK-879	pūrakaḥ kumbhakastadvadrecakaḥ pūrakaḥ punaḥ |	pūrakaḥ kumbhakaḥ tadvat recakaḥ pūrakaḥ punar 
SA_MB_varahopanisatHK-880	prāṇāyāmāḥ svanāḍībhistasmānnāḍīḥ pracakṣate || 18 ||	prāṇāyāmāḥ sva nāḍībhiḥ tasmāt nāḍīḥ pracakṣate 
SA_MB_varahopanisatHK-881	yamādipravibhaktāhiṃsādīni darśanādyupaniṣadrītyā yojanīyāni |	yama ādi pravibhakta ahiṃsā ādīni darśana ādi upaniṣad rītyā yojanīyāni 
SA_MB_varahopanisatHK-882	atha prāṇāyāmamāha- pūraka iti || 18 ||	atha prāṇāyāmam āha pūrakaḥ iti 
SA_MB_varahopanisatHK-883	dehatadavayavamānāni	deha tad avayava mānāni 
SA_MB_varahopanisatHK-884	śarīraṃ sarvajantūnāṃ ṣaṇṇavatyaṅgulātmakam |	śarīram sarva jantūnām ṣaṇṇavati aṅgula ātmakam 
SA_MB_varahopanisatHK-885	tanmadhye pāyudeśāttu dvyaṅgulāt parataḥ param || 19 ||	tad madhye pāyu deśāt tu dvi aṅgulāt paratas param 
SA_MB_varahopanisatHK-886	meḍhradeśādadhastāttu dvyaṅgulānmadhyamucyate |	meḍhra deśāt adhastāt tu dvi aṅgulāt madhyam ucyate 
SA_MB_varahopanisatHK-887	meḍhrānnavāṅgulādūrdhvaṃ nāḍīnāṃ kandamucyate || 20 ||	meḍhrāt nava aṅgulāt ūrdhvam nāḍīnām kandam ucyate  /
SA_MB_varahopanisatHK-888	caturaṅgulamutsedhaṃ caturaṅgulamāyatam |	catur aṅgulam utsedham catur aṅgulam āyatam 
SA_MB_varahopanisatHK-889	aṇḍākāraṃ parivṛtaṃ medomajjāsthiśoṇitaiḥ || 21 ||	aṇḍa ākāram parivṛtam medaḥ majja asthi śoṇitaiḥ 
SA_MB_varahopanisatHK-890	atha dehamānaprakāśanapūrvakaṃ nāḍīcakraṃ vivecayati- śarīramiti ||	atha deha māna prakāśana pūrvakam nāḍī cakram vivecayati śarīram iti 
SA_MB_varahopanisatHK-891	nāḍīcakram	nāḍī cakram 
SA_MB_varahopanisatHK-892	tatraiva nāḍīcakraṃ tu dvādaśāraṃ pratiṣṭhitam |	tatra eva nāḍī cakram tu dvādaśa aram pratiṣṭhitam 
SA_MB_varahopanisatHK-893	śarīraṃ dhriyate yena vartate tatra kuṇḍalī || 22 ||	śarīram dhriyate yena vartate tatra kuṇḍalī 
