segmentnr	original	analyzed
SA_MB_gurustutiratnavaliHK-167	śṛṇuṣvaikenamanasā bhakti pūrveṇa pārvati santi nānāvidhairmantrairā	śṛṇuṣva ekena manasā pūrveṇa pārvati santi nānāvidhaiḥ mantraiḥ ā 
SA_MB_gurustutiratnavaliHK-168	gamoktaissavījakaiḥ ||	gama uktaiḥ sa vījakaiḥ 
SA_MB_gurustutiratnavaliHK-169	tantrāṇi vividhānyatra sahitāni || maheśvari  || 9 ||	tantrāṇi vividhāni atra sahitāni maheśvari 
SA_MB_gurustutiratnavaliHK-170	te mantrāniṣkalā jātānkalauvīrya vivarjitāḥ	te mantra a niṣkalāḥ jātān kalau vīrya vivarjitāḥ 
SA_MB_gurustutiratnavaliHK-171	strīśuddhirahitāddravyādbhūmyantaśśuddhikāraṇāt ||	strī śuddhi rahitāt dravyāt bhūmi antar śuddhi kāraṇāt 
SA_MB_gurustutiratnavaliHK-172	anṛtānmatsarāddabhātpai śunyāddravya lolupāt ||	anṛtāt matsarāt dabhāt pai śunyāt dravya lolupāt 
SA_MB_gurustutiratnavaliHK-173	siddhyanti varārohe sarveniṣphalatāṃgatāḥ ||	siddhi anti varārohe sarve niṣphala tām gatāḥ 
SA_MB_gurustutiratnavaliHK-174	satyāgamānāśāstraṃ tu pratijñā siddhameva ca ||	satya āgama anāśāstram tu pratijñā siddham eva ca 
SA_MB_gurustutiratnavaliHK-175	anādareṇa tadduṣṭaṃ gurubhaktiṃ vinā tathā tanmadhye sārabhūtaṃ tu	anādareṇa tat duṣṭam guru bhaktim vinā tathā tad madhye sāra bhūtam tu 
SA_MB_gurustutiratnavaliHK-176	pratyakṣa phaladāyakam ||	pratyakṣa phala dāyakam 
SA_MB_gurustutiratnavaliHK-177	rudrayāmalatantraṃ ca catuṣṣaṣṭyātmakaṃ parama ||	rudrayāmala tantram ca catuṣṣaṣṭi ātmakam parama 
SA_MB_gurustutiratnavaliHK-178	nānāvidhaiḥ śubhairmantrairyuktaṃ samaya pūjanaiḥ ||	nānāvidhaiḥ śubhaiḥ mantraiḥ yuktam samaya pūjanaiḥ 
SA_MB_gurustutiratnavaliHK-179	vinā samayadīkṣādyairmantrardīkṣāpi niṣphalā ||	vinā samaya dīkṣā ādyaiḥ mantrar dīkṣā api niṣphalā 
SA_MB_gurustutiratnavaliHK-180	samayo hi śive brahmā samayo viṣṇureva hi samayaśśiva evasyātsamayo	samayaḥ hi śive brahmā samayaḥ viṣṇuḥ eva hi samayaḥ śive eva syāt samayaḥ 
SA_MB_gurustutiratnavaliHK-181	mṛtyureva ca || 15 ||	mṛtyuḥ eva ca 
SA_MB_gurustutiratnavaliHK-182	siddhyanti sadā devi vaṃ rārohe nityapūjājapādayaḥ ||	siddhi anti sadā devi vaṃ rārohe nitya pūjā japa ādayaḥ 
SA_MB_gurustutiratnavaliHK-183	yajñā hemādayo devi vinā samaya pūja vā kālesaṃ pūja	yajñāḥ hema ādayaḥ devi vinā vā 
SA_MB_gurustutiratnavaliHK-184	MUKTABODHA INDOLOGICAL RESEARCH INSTITUTE©2011 Muktabodha Indological Research Institute  All Rights Reserved.E-texts may be viewed only online or downloaded for private study.E-texts may not, under any circumstances, be copied, republished,reproduced, distributed or sold, either in original or altered form, withoutthe express permission of Muktabodha Indological Research Institute in writing.Data-entered by the staff of Muktabodha under the direction of Mark S. G. Dyczkowski.	muktabodha indological research muktabodha indological research institute all rights reserved texts may be viewed only online or downloaded for private studye texts may not under any circumstances be copied republished reproduced distributed or sold either in original or altered form withoutthe express permission of muktabodha indological research institute in writing data entered by the staff of muktabodha under the direction of mark s g dyczkowski 
