segmentnr	original	analyzed
SA_MBK_alasamkarsinitippaniHK-488	dvādaśamāsā | atha dvādaśakalā atha dhātu muni saṃkhyā ca | punaḥ ṣagaraṃ	dvādaśa māsāḥ atha dvādaśa kalāḥ atha dhātu muni saṃkhyā ca punar ṣagaram 
SA_MBK_alasamkarsinitippaniHK-489	pūjate pūjayet parameśvarī |	pūjate pūjayet parameśvarī 
SA_MBK_alasamkarsinitippaniHK-490	kṛṣṇāsubhīṣaṇā raudrī ataśragdāma śobhitā |	raudrī śobhitā 
SA_MBK_alasamkarsinitippaniHK-491	ekavaktrā trinetrā ca muṇḍamālā caturbhujā ||	eka vaktrā tri netrā ca muṇḍa mālā catur bhujā 
SA_MBK_alasamkarsinitippaniHK-492	muṇḍaṃ padmaṃ sanādīptā pāśāṃkusa dhāriṇī |	muṇḍam padmam sanādīptā pāśāṃkusa dhāriṇī 
SA_MBK_alasamkarsinitippaniHK-493	athavā khaḍgacchurikā ṣaḍete dhyāna mu * * * * taṃ ||	athavā khaḍga churikā ṣaṭ ete 
SA_MBK_alasamkarsinitippaniHK-494	punastatraiva pūjyante samayā pūjayet tataḥ |	punar tatra eva pūjyante samayā pūjayet tatas 
SA_MBK_alasamkarsinitippaniHK-495	pañcavakrā daśa bhujā trinetrā saṃvyavasthitā ||	pañca vakrā daśa bhujā tri netrā saṃvyavasthitā 
SA_MBK_alasamkarsinitippaniHK-496	pretapadmāsanā dīptā candramaṇḍalamadhyamā |	               
SA_MBK_alasamkarsinitippaniHK-497	nanāyuṣa karā devyo yatheṣṭaṃ phalasādhakaḥ ||	karāḥ devyaḥ yathā iṣṭam phala sādhakaḥ 
SA_MBK_alasamkarsinitippaniHK-498	śaṃkhinīti śivādūtī vāmadakṣiṇa pūjayet |	śaṃkhinī iti pūjayet 
SA_MBK_alasamkarsinitippaniHK-499	etat sarva prapūjye te pūjayet parameśvarī ||	etat sarva prapūjye te pūjayet parameśvarī 
SA_MBK_alasamkarsinitippaniHK-500	22a)	Ro
SA_MBK_alasamkarsinitippaniHK-501	iti śrīkālasaṅkarṣaṇīmate caturviṃsatisāhasre pūjanavidhiṭippaṇakaṃ tṛtīyaḥ	iti śrī kālasaṅkarṣaṇīmate caturviṃsati sāhasre pūjana vidhi ṭippaṇakam tṛtīyaḥ 
SA_MBK_alasamkarsinitippaniHK-502	paṭala ||	paṭala 
SA_MBK_alasamkarsinitippaniHK-503	śrīdevyuvāca ||	śrī devī uvāca 
SA_MBK_alasamkarsinitippaniHK-504	carukaṃ saṃpradāyañca mukhāṃmukha kathaṃ bhavet |	carukam katham bhavet 
SA_MBK_alasamkarsinitippaniHK-505	kā katha antaḥ kathaṃ * *? va *? kathaṃ sthānopapadyate ||	kā katha antar katham katham sthānā upapadyate 
SA_MBK_alasamkarsinitippaniHK-506	kathaṃ sthānāṃ tu deveśa vadaśca mama he prabho |	katham tu deveśa vadaḥ ca mama he prabho 
SA_MBK_alasamkarsinitippaniHK-507	etacca ||	etat ca 
SA_MBK_alasamkarsinitippaniHK-508	īśvara uvāca ||	īśvaraḥ uvāca 
SA_MBK_alasamkarsinitippaniHK-509	śṛṇu devi pravakṣāmi rahasyaṃ mama durlabhaṃ |	śṛṇu devi pravakṣāmi rahasyam mama durlabham 
SA_MBK_alasamkarsinitippaniHK-510	yoginīnāṃ paramprāṇa ākhyatanna kadācana ||	yoginīnām paramprāṇaḥ ākhyatat na kadācana 
SA_MBK_alasamkarsinitippaniHK-511	uttamādhamamadhyañca palāḍulasunaṃ tathā |	uttama adhama madhyam ca tathā 
SA_MBK_alasamkarsinitippaniHK-512	gaṃjanam viśvakṣārañca harāmbu bhadrameva ca ||	gaṃjanam viśvakṣāram ca harāmbu bhadram eva ca 
SA_MBK_alasamkarsinitippaniHK-513	nālājyaṃ yonipuṣpañca mīnaprākāśikacaruṃ |	nāla ājyam yoni puṣpam ca mīnaprākāśika carum 
SA_MBK_alasamkarsinitippaniHK-514	hālāhala suraśreṣṭaṃ śoḍaśaite prakīrtitā || 16 ||	hālāhala suraśreṣṭam śoḍaśā ete prakīrtitā 
SA_MBK_alasamkarsinitippaniHK-515	pradhānaṃ trayodaśa caruṃ | manaḥ śroḍaścakṣu jihvā nāsā buddhīrahaṃkāro	pradhānam trayodaśa carum manaḥ śroḍaḥ cakṣu jihvā nāsā buddhīḥ ahaṃkāraḥ 
SA_MBK_alasamkarsinitippaniHK-516	manonmanatā |	manaḥ unmana tā 
SA_MBK_alasamkarsinitippaniHK-517	22b)	Ro
SA_MBK_alasamkarsinitippaniHK-518	ghṛṇiśaṃkābhayaṃ lajjā vijñā guptyā?kulaśīlaṃ || 16 ||	ghṛṇi śaṃkā bhayam lajjā vijñā gupti ākula śīlam 
SA_MBK_alasamkarsinitippaniHK-519	anye ca snānaṃ | java(?) | kandanābhiḥ hṛdayaṃ kūrma	anye ca snānam java kandanābhiḥ hṛdayam kūrma 
SA_MBK_alasamkarsinitippaniHK-520	nāḍīsūkṣma madhyādurddhacandraṃ | nirodhīnāṅmanādāntaṃ nirālambaṃ ||	nāḍī sūkṣma madhyāt urddhacandram nirodhi nāṅmanāda antam nirālambam 
SA_MBK_alasamkarsinitippaniHK-521	evaṃ || 13 ||	evam 
SA_MBK_alasamkarsinitippaniHK-522	pradhānasthānāni |	pradhāna sthānāni 
SA_MBK_alasamkarsinitippaniHK-523	amāvāsyā tu pūjyante yāvat pratipadā sthitā(?) |	amāvāsyā tu pūjyante yāvat pratipadā sthitā 
SA_MBK_alasamkarsinitippaniHK-524	pratipadā pañcadaśamī pūjayedanalo ṣantaṃ(?) ||	pratipadā pañcadaśamī pūjayet analaḥ santam 
SA_MBK_alasamkarsinitippaniHK-525	amāvāśyā pratipadāntaṃ yāvat *? rukaṃ |	amāvāśyā pratipadā antam yāvat 
SA_MBK_alasamkarsinitippaniHK-526	evaṃ pūjyaṃ pūrṇimā amāvāsyā yāva prati anulomaṃ ||	evam pūjyam pūrṇimā amāvāsyā prati anulomam 
SA_MBK_alasamkarsinitippaniHK-527	pūjye kṛṣṇapūrṇā bhujaṃ(?) yogī sā(?) | eka	pūjye kṛṣṇa pūrṇā bhujam yogī sā 
SA_MBK_alasamkarsinitippaniHK-528	śṛṇu |	śṛṇu 
SA_MBK_alasamkarsinitippaniHK-529	ataḥ paraṃ pravakṣāmi vidhānaṃ adhunā śṛṇu |	atas param pravakṣāmi vidhānam adhunā śṛṇu 
SA_MBK_alasamkarsinitippaniHK-530	23a)	Ro
SA_MBK_alasamkarsinitippaniHK-531	taraṇḍadaṇḍadravitaṃ yā kācit kalā *? citā |	taraṇḍa daṇḍa dravitam yā kācid kalā citā 
SA_MBK_alasamkarsinitippaniHK-532	manañca mārayet tatra na mahāmansa bhakṣaye ||	manaṃca mārayet tatra na mahāmansa bhakṣaye 
SA_MBK_alasamkarsinitippaniHK-533	taraṇḍamiti taraṇḍāṃmiti daṇḍaṃ | vāmamārgai vātaśca rūpe | takārā taraṇḍa	taraṇḍam iti taraṇḍām iti daṇḍam vāma mārgaiḥ vātaḥ ca rūpe 
SA_MBK_alasamkarsinitippaniHK-534	varṇa | dakṣiṇamārge vahni svarūpaṃ | rakāra rūpaṃ daṇḍāmadhye ata kaṃ?	varṇa dakṣiṇamārge vahni svarūpam rakāra rūpam ata kaṃ 
SA_MBK_alasamkarsinitippaniHK-535	kalārūpaṃ drāvitaṃ | tat sthāne manamārayet | mahāmāṃsa bhakṣayet | anye ca || 1	kalā rūpam drāvitam tat sthāne mahāmāṃsa bhakṣayet anye ca 
SA_MBK_alasamkarsinitippaniHK-536	śrotratva kukṣaṣī jihvā | sodvāmā advaya varjitaṃ | kalāpavanamaśuñca na tu	śrotra tva kukṣaṣī jihvā na tu 
SA_MBK_alasamkarsinitippaniHK-537	gomānsa bhakṣayet | śabdaṃ na śṛṇute | rūpantu paśyati | rasanī khādayati |	gomān sa bhakṣayet śabdam na śṛṇute rūpam tu paśyati rasanī khādayati 
SA_MBK_alasamkarsinitippaniHK-538	hṛdayet grāhayati | advayā dvaya rahite | etat samastaṃ tyajati |	grāhayati advayā dvaya rahite etat samastam tyajati 
SA_MBK_alasamkarsinitippaniHK-539	yogāsāmaraṃvikārasaṃ | prati dinaṃ dine | aśvati |	prati dinam dine 
SA_MBK_alasamkarsinitippaniHK-540	23b)	Ro
SA_MBK_alasamkarsinitippaniHK-541	bhakṣate | ajarāmaratvaṃ bhavati | gomānsaḥ || 2 || kandādhāre *?	bhakṣate ajara amara tvam bhavati gomānsaḥ kanda ādhāre 
SA_MBK_alasamkarsinitippaniHK-542	ullāsāṃ(?) vāda bhuyaṃ(?) vadvāśikāṃ(##?	ullāsām 
SA_MBK_alasamkarsinitippaniHK-543	| kandādhārañca yāvat | lambikā sā * *? mamṛtaṃ | lambikā	kanda ādhāram ca yāvat lambikā sā lambikā 
SA_MBK_alasamkarsinitippaniHK-544	pāyate kuryāt *? varjayet | * *?  lambikaṃ | raśamu *##?	kuryāt varjayet 
SA_MBK_alasamkarsinitippaniHK-545	ca bhakṣayet | palasya aṇḍamiti palā *? lambikā rama * * *	ca bhakṣayet palasya aṇḍam iti palā lambikā rama 
SA_MBK_alasamkarsinitippaniHK-546	śanaiḥ kandādhāra dvādaśāntaṃ yāvat athavā ajarāmaro bhavati | *	śanais kanda ādhāra dvādaśāntam yāvat athavā ajara amaraḥ bhavati 
SA_MBK_alasamkarsinitippaniHK-547	śanantathā | tena mānaśmānmattalaśunaṃ(?) *? hare |	tena hare 
SA_MBK_alasamkarsinitippaniHK-548	ghṛrṇijighrā tu jāgra * *?	tu jāgra 
SA_MBK_alasamkarsinitippaniHK-549	24a)	Ro
SA_MBK_alasamkarsinitippaniHK-550	kutaḥ gūṃjanamāharet | 6 | viśvañca carukaṃ yat vāḍavānalasaṃsthitaṃ |	kutas gūṃjanam āharet 
SA_MBK_alasamkarsinitippaniHK-551	somasūryagrāso yatra purīṣaṃ āharetyarthaḥ | viśva agni caru | somasūryagrasanaṃ	soma sūrya grāsaḥ yatra purīṣam āhara iti arthaḥ viśva agni caru soma sūrya grasanam 
SA_MBK_alasamkarsinitippaniHK-552	kinnimittaṃ | vāmamārge tuṇḍalanī pūrakena vātasparśana u * *? yet	kinnimittam vāma mārge pūrakena vāta sparśane 
SA_MBK_alasamkarsinitippaniHK-553	| tathā somasūryagrāsī kṛtaṃ tatra vaḍavānale purīśaṃ āharet || 7 ||	tathā soma sūrya grāsī kṛtam tatra vaḍavānale purīśam āharet 
SA_MBK_alasamkarsinitippaniHK-554	naḍīyantraśca sadyadyakāka(?) somasya drāvitaṃ |	naḍīyantraḥ ca sat yat yakāka somasya drāvitam 
SA_MBK_alasamkarsinitippaniHK-555	laṃbikāra samuṣṭrañca śivāmvuṃ āharet kutaḥ ||	āharet kutas 
SA_MBK_alasamkarsinitippaniHK-556	kuṇḍalinī srāvitā nāḍī yantrasadyā * *? tuṣkośaṃ tatra mrarcate || 8	kuṇḍalinī srāvitā nāḍī yantra sadyā    tuṣkośam tatra mrarcate 
SA_MBK_alasamkarsinitippaniHK-557	yājyāni puṣpena āharet | raktaṃ ravi śukraṃ śaśi golaka vātaḥ | śivaṃ puruṣaḥ	yājyāni puṣpena āharet raktam ravi śukram śaśi golaka vātaḥ śivam puruṣaḥ 
SA_MBK_alasamkarsinitippaniHK-558	śaktistrī	śakti strī 
SA_MBK_alasamkarsinitippaniHK-559	24b)	Ro
SA_MBK_alasamkarsinitippaniHK-560	rūpaṃ śivaśakti bhramāgārddhayati | svarūpa labhyate | yoni puṣpaṃ | kṛtvā |	rūpam śiva śakti svarūpa labhyate 
SA_MBK_alasamkarsinitippaniHK-561	hutaṃ karaṇaṃ datvā mala traya * *? hute | amṛtankāvakuṣe calatu	hutam karaṇam calatu 
SA_MBK_alasamkarsinitippaniHK-562	śleśmantu āharet | anya * *? prāyaḥ ūrddha sthitā	śleśmantu āharet anya    prāyaḥ ūrddha sthitā 
SA_MBK_alasamkarsinitippaniHK-563	candrakalāsuśāntā pūrṇā amṛtānandarasena deva *? tayo *?	candra kalā su śāntā pūrṇā amṛta ānanda rasena deva 
SA_MBK_alasamkarsinitippaniHK-564	yāva *? viśeṣayāgāttarja ca candra * *? nañca yasmā	yāva viśeṣa yāgāt tarja ca candra    ca yasmā 
SA_MBK_alasamkarsinitippaniHK-565	rūpayasmānsa *? kāśān prabhu * * *? dvipaṅkaviśrā	kāśān 
SA_MBK_alasamkarsinitippaniHK-566	samasta vṛrti galitaṃ kā *? ṇaṃ * *? mardayet | paiśunya	mardayet paiśunya 
SA_MBK_alasamkarsinitippaniHK-567	| * * *? tyeva ṣaṭtriṃśadaṅgulaṃ daṇḍa * *?	ṣaṭtriṃśat aṅgulam 
SA_MBK_alasamkarsinitippaniHK-568	bhūtaṃ * *? sthita * * mātā * * naśranāta tu	bhūtam sthita mātā tu 
SA_MBK_alasamkarsinitippaniHK-569	25a)	Ro
SA_MBK_alasamkarsinitippaniHK-570	taṃ *? laṃ prāṇadaṇḍaṃ ṣaṭtriṃśatatvā ca ta prāṇa kuṇḍa | *##?	taṃ laṃ prāṇa daṇḍam ca 
SA_MBK_alasamkarsinitippaniHK-571	dvau netrau bhrumadhye hansate ca na | tatrābhyāsaratā yogī na tu prākāsika	dvau netrau bhru madhye ca na tatra abhyāsa ratā yogī na tu prākāsika 
SA_MBK_alasamkarsinitippaniHK-572	caru(?) ityarthaḥ || 13 ||	caru iti arthaḥ 
SA_MBK_alasamkarsinitippaniHK-573	gaganaṃ kambaraṃ yatra nirālambaṃ ca yat sthitaṃ |	gaganam kambaram yatra nirālambam ca yat sthitam 
SA_MBK_alasamkarsinitippaniHK-574	tatrā svāsaratā yogī na tu hālāhalaṃ caru ||	yogī na tu hālāhalam caru 
SA_MBK_alasamkarsinitippaniHK-575	hālāhalañcaruṃ gaganaṃ | ākāśantathā dvādaśāntaṃ nirālambaṃ dhyāyate |	hālāhalam carum gaganam ākāśam tathā dvādaśāntam nirālambam dhyāyate 
SA_MBK_alasamkarsinitippaniHK-576	manaḥ atyasate yogī *? | 14 ||	manaḥ atyasate yogī    
SA_MBK_alasamkarsinitippaniHK-577	vāmanāḍyāda *? śanāḍyā vasanti ca surāsurā |	vāma nāḍyā āda śanāḍyā vasanti ca sura asurā 
SA_MBK_alasamkarsinitippaniHK-578	sā surāyī yate yatra na tu anyāpi ve * *? ||	sā surāyī yate yatra na tu anyā api  /
SA_MBK_alasamkarsinitippaniHK-579	vāme devaḥ * kṣiṇe asuraḥ * * * *? bhāvaṃ karoti |	vāme devaḥ kṣiṇe asuraḥ     bhāvam karoti 
SA_MBK_alasamkarsinitippaniHK-580	tala? nanda *? rūpaṃ labhyate | gurupraśādāṃ | śaktitā madhyamā	tala nanda rūpam labhyate guru praśādām śakti tā madhyamā 
SA_MBK_alasamkarsinitippaniHK-581	nāḍī bharitā bhairave teja | tantu madyantu maśnīyānnatu * *?	nāḍī bharitā bhairave 
SA_MBK_alasamkarsinitippaniHK-582	25b)	Ro
SA_MBK_alasamkarsinitippaniHK-583	| tena pātarasaṃ pī *? na * drākṣu kṣusambhavaṃ | 16 | icchañca	tena pāta rasam na        icchan ca 
SA_MBK_alasamkarsinitippaniHK-584	pacaranna prayogena tṛkoṇaṃ śaktimūlakaṃ | vaṃ rasaṃṣīyate malaṃ dravyate ca	prayogena śakti mūlakam malam dravyate ca 
SA_MBK_alasamkarsinitippaniHK-585	kṛṣodarī | ma | * * * *? nābhā * * *? tā	kṛṣā udarī ma      nābhā    tā 
SA_MBK_alasamkarsinitippaniHK-586	athavā *? stripānaiśyā samayakālena gupsānaṃ śavivarjayet | gopanāṃ	athavā samaya kālena gupsānam 
SA_MBK_alasamkarsinitippaniHK-587	mindi micchanti kānyathā patanam bhavet ||	mindi micchanti kānyathā patanam bhavet 
SA_MBK_alasamkarsinitippaniHK-588	iti śrīkālasaṅkarṣaṇīmate caturviṃsati sāhasre * *? carukasapradāyo	iti śrī kālasaṅkarṣaṇīmate caturviṃsati sāhasre 
SA_MBK_alasamkarsinitippaniHK-589	kāmaṭippaṇanta caturthaḥ * * * *? ||	caturthaḥ     
SA_MBK_alasamkarsinitippaniHK-590	śrībhairava uvāca ||	śrī bhairavaḥ uvāca 
SA_MBK_alasamkarsinitippaniHK-591	śṛṇu devi pravakṣyāmi yadu *? punareva ca |	śṛṇu devi pravakṣyāmi yadu punar eva ca 
SA_MBK_alasamkarsinitippaniHK-592	26a)	Ro
SA_MBK_alasamkarsinitippaniHK-593	gayā ca prathamā nāḍī gayāṃ suṣumnā kuṇḍalinī |	gayā ca prathamā nāḍī gayām suṣumnā kuṇḍalinī 
SA_MBK_alasamkarsinitippaniHK-594	kalāvararasaṃ bhavetā tasya dvādaśaṣṭalāni dvādaśadhā hṛdayā ṣaḍmeva ca |	tasya dvādaśa ṣṭalāni dvādaśadhā 
SA_MBK_alasamkarsinitippaniHK-595	ṣaṭ || 6 ||	ṣaṭ 
SA_MBK_alasamkarsinitippaniHK-596	uparitasyaiva pitṛpāke sa ucyate | ṣaṭa pitṛ pāte | devamāne ṣaḍbhiḥ | devayāne	upari tasya eva pitṛpāke saḥ ucyate ṣaṭa pitṛ pāte devamāne ṣaḍbhiḥ devayāne 
SA_MBK_alasamkarsinitippaniHK-597	ṣaḍbhi *? devayānai || 6 ||	ṣaḍbhiḥ devayānaiḥ 
SA_MBK_alasamkarsinitippaniHK-598	daśa aṣṭā prakīrtitā | eva || 18 ||	daśa aṣṭā prakīrtitā eva 
SA_MBK_alasamkarsinitippaniHK-599	tālarandhra śata(?) ṣaṭbhi mataṃ ṣaḍbhiḥ sūryasya ucyate |	tālarandhra śata ṣaṭbhi matam ṣaḍbhiḥ sūryasya ucyate 
SA_MBK_alasamkarsinitippaniHK-600	ṣaṭbhirmu * * * *? bhyāṃ ma * *? ṣumnā ca	ṣaṭbhiḥ mu      bhyām ma   ṣum nā ca 
SA_MBK_alasamkarsinitippaniHK-601	tṛtīyakā | tadaṣṭā *? rataujogī na bhūyojjanmatā vrajet | ityeva | puna	tṛtīyakā na bhūyojjanmatā vrajet iti eva 
SA_MBK_alasamkarsinitippaniHK-602	sūtramātaḥ japajayankriyate | pañcaraṅga pañcaratna śāli * *? ndra	sūtram ātar japa jayan kriyate 
SA_MBK_alasamkarsinitippaniHK-603	kārayet | śālicūrṇaṃ tu yoniṃ | cūrṇamardayet |	kārayet śāli cūrṇam tu yonim cūrṇam ardayet 
SA_MBK_alasamkarsinitippaniHK-604	26b)	Ro
SA_MBK_alasamkarsinitippaniHK-605	ṣāṭkoṇaṃmatra kartavyaṃ | ṣāṭkoṇaṃ hṛdayaṃ | tatraṃ svarūpo labhyate |	ṣāṭkoṇam atra kartavyam ṣāṭkoṇam hṛdayam tatram sva rūpaḥ labhyate 
SA_MBK_alasamkarsinitippaniHK-606	madhye yoniñca dīyate | yoni sūryavimbaṃ tadvāhye caturaśrakaṃ | caturaśraṃ	madhye yoniḥ ca dīyate sūrya vimbam tad vāhye caturaśrakam caturaśram 
SA_MBK_alasamkarsinitippaniHK-607	ojāpukā | vāmadakṣiṇa dvibhiḥ rekhoḥ prāṇopāno dvau | * *? dvau	vāma dakṣiṇa dvibhiḥ rekhoḥ prāṇa upānaḥ dvau      
SA_MBK_alasamkarsinitippaniHK-608	ca dvau ca dīyate | śivaśakti urddhe vartulaṃ sa yojya vatulaṃ tadartha māyā rūpaṃ	ca dvau ca dīyate 
SA_MBK_alasamkarsinitippaniHK-609	| karmakuryād vicakṣaṇaḥ patākā toraṇayutaṃ | toraṇaṃ | taraṇḍadaṇḍa patākā	vicakṣaṇaḥ patākā toraṇa yutam toraṇam patākā 
SA_MBK_alasamkarsinitippaniHK-610	dvādaśāntaṃ | anyajādolālayaṃ * *? māsvā ca pañcadhā	ca pañcadhā 
SA_MBK_alasamkarsinitippaniHK-611	kuṇḍalinī | pañcadhā | dhvajā abdalāyāṃ eta dṛṣṭāntaṃ | patākā pañca	kuṇḍalinī pañcadhā dhvajāḥ patākā pañca 
SA_MBK_alasamkarsinitippaniHK-612	kāraṇaṃ | kuṇḍalanī pañcadhā | pūrakena pātena | svarūpalabhyate | ṣaṭkone	kāraṇam pañcadhā pūrakena pātena ṣaṭka ūne 
SA_MBK_alasamkarsinitippaniHK-613	dvādaśādityo devyā || 12 ||	dvādaśa ādityaḥ devyā  /
SA_MBK_alasamkarsinitippaniHK-614	śivādyā madhye caiva kṛṣodarī | prāṇaśaktiḥ caturaśrakaṃ tu tanmadhyo vāma	śiva ādyā madhye ca eva kṛṣodarī prāṇaśaktiḥ caturaśrakam tu tad madhyaḥ vāma 
SA_MBK_alasamkarsinitippaniHK-615	dakṣiṇa pūjayet | devyā || 6 || śakhi *? tu śivādūtī adhye dvau dvau	dakṣiṇa pūjayet devyā tu śivādūtī dvau dvau 
SA_MBK_alasamkarsinitippaniHK-616	prapūjayet kṛpā pūrṇāhū	prapūjayet kṛpā pūrṇāhū 
SA_MBK_alasamkarsinitippaniHK-617	27a)	Ro
SA_MBK_alasamkarsinitippaniHK-618	iti śrīkālasaṃkarṣaṇīmate kuṇḍamuṇḍalā? * *? ṭippaṇaḥ	iti śrī kālasaṃkarṣaṇīmate kuṇḍamuṇḍalā ṭippaṇaḥ 
SA_MBK_alasamkarsinitippaniHK-619	pañcamaḥ paṭalaḥ ||	pañcamaḥ paṭalaḥ 
SA_MBK_alasamkarsinitippaniHK-620	śrībhairava uvāca ||	śrī bhairavaḥ uvāca 
SA_MBK_alasamkarsinitippaniHK-621	śṛṇu devi pravakṣāmi * * * * * * * *? |	śṛṇu devi pravakṣāmi 
SA_MBK_alasamkarsinitippaniHK-622	kuṇḍaṃ brahmavilaṃ | dvā triṃśavī *? devatāṃ |	kuṇḍam brahmavilam devatām 
SA_MBK_alasamkarsinitippaniHK-623	atha varṇādi kakārādi kṣakārānta mekhalā tritayaṃ ||	atha varṇa ādi kakāra ādi kṣakāra anta mekhalā tritayam 
SA_MBK_alasamkarsinitippaniHK-624	kṛtvā somasūryāgniḥ | brahmaviṣṇumaheśvaraṃ | aṅgulya *? ekā	kṛtvā soma sūrya agniḥ brahma viṣṇu maheśvaram aṅgulyaḥ ekā 
SA_MBK_alasamkarsinitippaniHK-625	dvau trīṇi catu | evāṃ viṣṇu(?) dvau rudra tṛtīya brahmā iti mekhalā	dvau trīṇi catu viṣṇu dvau rudra tṛtīya brahmā iti mekhalā 
SA_MBK_alasamkarsinitippaniHK-626	27b)	Ro
SA_MBK_alasamkarsinitippaniHK-627	kuṇḍasusobhanaṃ kṛtvā yathāva kathayāmi te |	kuṇḍa su sobhanam kṛtvā kathayāmi te 
SA_MBK_alasamkarsinitippaniHK-628	home * *? mṛtai naiva śrīphala saha saṃyutaṃ ||	home 
SA_MBK_alasamkarsinitippaniHK-629	bhogyārthena varārohe kāraye tu vicakṣaṇaḥ || 3 ||	bhogya arthena varārohe kāraye tu vicakṣaṇaḥ 
SA_MBK_alasamkarsinitippaniHK-630	raktakadakārapuṣpaṃ *? sa raktena *? yutaṃ |	raktaka dakāra puṣpam sa raktena yutam 
SA_MBK_alasamkarsinitippaniHK-631	vasyārthe labhyate siddhi *? svāha bhagavāśivaḥ || 4 ||	svāhā bhagavāśivaḥ 
SA_MBK_alasamkarsinitippaniHK-632	mahābhaya samutpanne vṛhate viṣṭavigrahe | kusamaṃ vrahmavṛkṣeṇa gu	samutpanne vṛhate viṣṭa vigrahe kusamam vrahmavṛkṣeṇa gu 
SA_MBK_alasamkarsinitippaniHK-633	unclear	unclear 
SA_MBK_alasamkarsinitippaniHK-634	28a)	Ro
SA_MBK_alasamkarsinitippaniHK-635	māraṇaṃ adhunā śṛṇu |	māraṇam adhunā śṛṇu 
SA_MBK_alasamkarsinitippaniHK-636	rātrau homaṃmprakartavyaṃ śmaśāne rasaḥ yatho? ||	rātrau homaṃprakartavyam śmaśāne rasaḥ 
SA_MBK_alasamkarsinitippaniHK-637	ekavṛkṣa nadī *? hā * * *? ca na māgatrā	ekavṛkṣa nadī hā     ca na māgatrā 
SA_MBK_alasamkarsinitippaniHK-638	sājakāmastu *? rṇa tu mākṣintaḥ sahasaṃyutaṃ |	tu 
SA_MBK_alasamkarsinitippaniHK-639	mahātalena sahita samidhā vaṭikāṣṭakaṃ |	mahātalena sahita samidhā vaṭikā aṣṭakam 
SA_MBK_alasamkarsinitippaniHK-640	aṣṭoturaśataṃ kṛtvā māgma tritaśānyapi |	aṣṭoturaśatam kṛtvā mā agma tritaśāni api 
SA_MBK_alasamkarsinitippaniHK-641	dvitīyañca pravakṣyāmi agnikarma samārabhet ||	dvitīyañca pravakṣyāmi agnikarma samārabhet 
SA_MBK_alasamkarsinitippaniHK-642	saptāviṃśa palakṣāraṃ puṭalikā kṛtvā |	pala kṣāram puṭalikā kṛtvā 
SA_MBK_alasamkarsinitippaniHK-643	pratidinaṃ arddhamarddha? hotavyaṃ kārayed vudhaḥ |	pratidinam hotavyam kārayet vudhaḥ 
SA_MBK_alasamkarsinitippaniHK-644	pūrvamudrā pradātavyaṃ * *? ye tridaśānyapi || 2 ||	pūrva mudrā pradātavyam ye tridaśāni api 
SA_MBK_alasamkarsinitippaniHK-645	eka syāt kathitaṃ devi agnikarmasya titaya(?) |	kathitam devi agnikarmasya 
SA_MBK_alasamkarsinitippaniHK-646	ityeva | atha cihna lakṣaṇaṃ |	iti eva atha cihna lakṣaṇam 
SA_MBK_alasamkarsinitippaniHK-647	dhūmitaṃ nīla pūrṇantu kathitvaṃ visphuliṅgikaṃ |	dhūmitam nīla visphuliṅgikam 
SA_MBK_alasamkarsinitippaniHK-648	jvālā tejasmatī caiva * * * * * * * *? ||	jvālā tejasmatī ca eva 
SA_MBK_alasamkarsinitippaniHK-649	28b)	Ro
SA_MBK_alasamkarsinitippaniHK-650	unclear	unclear 
SA_MBK_alasamkarsinitippaniHK-651	mā * *? mohanaṃ hriyate sadā |	mā          
SA_MBK_alasamkarsinitippaniHK-652	aṃguṣṭaṃ nāmikā kṛtvā vaśīkaraṇaṃmuttamaṃ |	aṃguṣṭam nāmikā kṛtvā vaśīkaraṇam uttamam 
SA_MBK_alasamkarsinitippaniHK-653	aṃguṣṭaṃ kanīyasaṃ kṛtvā ucāṭane kṛtambhavet ||	aṃguṣṭam kanīyasam kṛtvā ucāṭane kṛtam bhavet 
SA_MBK_alasamkarsinitippaniHK-654	pañcāguli prayogena sarvakāma * *? sahati |	pañcāguli prayogena sarvakāma 
SA_MBK_alasamkarsinitippaniHK-655	itye tallakṣaṇaṃmvakṣe kathanīyamya canat ||	itye kathanīyamya canat 
SA_MBK_alasamkarsinitippaniHK-656	punaraṇya pravakṣāmi * * * * * * * * *##?	punaraṇya pravakṣāmi 
SA_MBK_alasamkarsinitippaniHK-657	yoginī *? paraprāṇa * *? tapte ca niścitaṃ ||	          
SA_MBK_alasamkarsinitippaniHK-658	jyeṣṭāśanai vāhanasthā pūjyakāmānavāpnuyāt |	jyeṣṭa aśanaiḥ pūjya kāmān avāpnuyāt 
SA_MBK_alasamkarsinitippaniHK-659	yā * ? cintayate devi vāhanaṃ * *? kāmuri ||	yā   cintayate devi vāhanam   kāmuri 
SA_MBK_alasamkarsinitippaniHK-660	jyeṣṭā *? dakṣiṇadiśā bhāgaṃ tadvītama *? rāpaṃ |	jyeṣṭā dakṣiṇa diśā bhāgam 
SA_MBK_alasamkarsinitippaniHK-661	vāhataṃdika * * tasya dakṣiṇaṃ pūjyapādārāpyaṃ | atha khalvasya śulva	tasya dakṣiṇam atha khalvasya śulva 
SA_MBK_alasamkarsinitippaniHK-662	candratāmrasā jalaṃ | tṛtīyaṃ lohā * * * * * * *	          
SA_MBK_alasamkarsinitippaniHK-663	pīṭhikā natvā | tatpṛṣṭe dvakaṃ	pīṭhikāḥ natvā tad pṛṣṭe dvakam 
SA_MBK_alasamkarsinitippaniHK-664	29b)	Ro
SA_MBK_alasamkarsinitippaniHK-665	pūrvasmitkathikā | tatra dakṣiṇadiśāṃ a *? ṣoḍasa pūjya | yasya	tatra yasya 
SA_MBK_alasamkarsinitippaniHK-666	vāhatasya * *? gamayate rātrau * *? ṣṭamyā atha cartu	vāhatasya   gamayate rātrau   ṣṭamyāḥ atha cartu 
SA_MBK_alasamkarsinitippaniHK-667	| *? tā * *	ro 
SA_MBK_alasamkarsinitippaniHK-668	unclear	unclear 
SA_MBK_alasamkarsinitippaniHK-669	30a)	Ro
SA_MBK_alasamkarsinitippaniHK-670	vada me svāmī bhavati | iti puruṣasiddhi ||	vada me svāmī bhavati iti puruṣa siddhi 
SA_MBK_alasamkarsinitippaniHK-671	iti śrīkālasaṅkarṣaṇīmate agnikramāyajano nāma ṭippaṇaka ṣaṣṭaḥ paṭala ||	iti śrī kālasaṅkarṣaṇīmate agnikramāyajanaḥ nāma ṭippaṇaka ṣaṣṭaḥ paṭala 
SA_MBK_alasamkarsinitippaniHK-672	śrībhairava uvāca ||	śrī bhairavaḥ uvāca 
SA_MBK_alasamkarsinitippaniHK-673	tilakaṃ sampravakṣāmi tathāstapa ca sādhanaṃ |	tilakam sampravakṣāmi ca sādhanam 
SA_MBK_alasamkarsinitippaniHK-674	añjanaṃ guṭikādīnāṃ vaśyāvardhanameva ca ||	añjanam guṭikā ādīnām vaśyā vardhanam eva ca 
SA_MBK_alasamkarsinitippaniHK-675	pātālabhajanaṃ devi tannāsti yanna sādhayet |	pātāla bhajanam devi tat nā asti yat na sādhayet 
SA_MBK_alasamkarsinitippaniHK-676	hekā karṇā te | pūyaṃ gurocanaṃ rodhraṃ pippilonthasanaḥ śilā || candanaṃ	hekā karṇā te pūyam gu rocanam rodhram śilā candanam 
SA_MBK_alasamkarsinitippaniHK-677	śvetavarṇañca tathaiva sūkṣmacūrṇamiti kṛtvā rakṣarete *? bhāyute |	śveta varṇam ca tathā eva sūkṣma cūrṇam iti kṛtvā rakṣarete 
SA_MBK_alasamkarsinitippaniHK-678	saptābhimantritaṅkṛtvā tila *? na vaśaṃ jagat | raṇairājakale *	na vaśam jagat 
SA_MBK_alasamkarsinitippaniHK-679	30b)	Ro
SA_MBK_alasamkarsinitippaniHK-680	acintitānityarthāni sadā tasmā bhavanti hi |	a cintita anitya arthāni sadā tasmai bhavanti hi 
SA_MBK_alasamkarsinitippaniHK-681	annaruṇye pravakṣāmi vartate sahirudhi kramaṃ ||	annaruṇye pravakṣāmi vartate sahi rudhi kramam 
SA_MBK_alasamkarsinitippaniHK-682	etatsamasta *? yāśikāraya vicakṣaṇaḥ ||	vicakṣaṇaḥ 
SA_MBK_alasamkarsinitippaniHK-683	atra vanyākhyāsyāmaḥ gosārane prasiddhaṃ kuṃkume prasiddhaṃ candra śabdena	atra vanya ākhyāsyāmaḥ gosārane prasiddham kuṃkume prasiddham candra śabdena 
SA_MBK_alasamkarsinitippaniHK-684	kapūrammalayastataḥ | malayaccandanaṃ | su * nnānihitaṃ vakṣosi *?	kapūram malayaḥ tatas malaya candanam 
SA_MBK_alasamkarsinitippaniHK-685	rasa | mṛganābhikasturikamakuṇḍagolako śivaśaktisaṃyogāt | svayaṃbhu	śiva śakti saṃyogāt 
