segmentnr	original	analyzed
SA_MB_gitarthasamgrahaHK-875	paro'haṃkāraḥ-sarvamaham-ityabhedātmā sa khalu paramo'bhedaḥ |	paraḥ uhaṃkāraḥ sarvam aham iti abheda ātmā sa khalu paramaḥ bhedaḥ 
SA_MB_gitarthasamgrahaHK-876	ata eva ca paripūrṇasya khaṇḍanābhāvānna krodhādaya udayante |	atas eva ca paripūrṇasya khaṇḍana abhāvāt na krodha ādayaḥ udayante 
SA_MB_gitarthasamgrahaHK-877	ataḥ paramahaṃkāraṃ-parotsāhasaṃvidātmakaṃ gṛhītvā krodham	atas param ahaṃkāram parā utsāha saṃvid ātmakam gṛhītvā krodham 
SA_MB_gitarthasamgrahaHK-878	avidyātmānaṃ śatruṃ jahīti śivam || 48 ||	avidyā ātmānam śatrum jahi iti śivam 
SA_MB_gitarthasamgrahaHK-879	atra saṃgrahaślokaḥ	atra saṃgraha ślokaḥ 
SA_MB_gitarthasamgrahaHK-880	ghanāni dārāndehaṃ ca yo'nyatvenādhigacchati | kiṃ nāma tasya	ghanāni dārān deham ca yoni atvena adhigacchati kim nāma tasya 
SA_MB_gitarthasamgrahaHK-881	kurvanti krodhādyāścittavibhramāḥ || 3 ||	kurvanti krodha ādyāḥ citta vibhramāḥ 
SA_MB_gitarthasamgrahaHK-882	iti	iti 
SA_MB_gitarthasamgrahaHK-883	śrīmahāmāheśvarācāryavaryarājānakābhinavaguptapādaviracite	śrī mahā māheśvara ācārya varya rājānaka abhinavagupta pāda viracite 
SA_MB_gitarthasamgrahaHK-884	śrīmadbhagavadgītārthasaṃgrahe tṛtīyo'dhyāyaḥ || 3 ||	śrīmat bhagavadgītā artha saṃgrahe tṛtīyaḥ adhyāyaḥ 
SA_MB_gitarthasamgrahaHK-885	atha caturtho'dhyāyaḥ	atha caturthaḥ udhyāyaḥ 
SA_MB_gitarthasamgrahaHK-886	śrībhagavānuvāca	śrī bhagavān uvāca 
SA_MB_gitarthasamgrahaHK-887	evaṃ vivasvate yogaṃ proktavānahamavyayam | vivasvānmanave prāha	evam vivasvate yogam proktavān aham avyayam vivasvān manave prāha 
SA_MB_gitarthasamgrahaHK-888	manurikṣvākave'bravīt || 4-1 ||	manuḥ ikṣvākave bravīt 
SA_MB_gitarthasamgrahaHK-889	evaṃ paramparāprāptamimaṃ rājarṣayo viduḥ | sa kāleneha mahatā	evam paramparā prāptam imam rājarṣayaḥ viduḥ sa kālena iha mahatā 
SA_MB_gitarthasamgrahaHK-890	yogo naṣṭaḥ parantapa || 4-2 ||	yogaḥ naṣṭaḥ parantapa 
SA_MB_gitarthasamgrahaHK-891	etacca guruparamparayā prāptamapi adyatve naṣṭam ityanena	etat ca guru paramparayā prāptam api adyatve naṣṭam iti anena 
SA_MB_gitarthasamgrahaHK-892	bhagavānasya jñānasya durlabhatāṃ gauravaṃ ca pradarśayati || 2	bhagavān asya jñānasya durlabha tām gauravam ca pradarśayati 
SA_MB_gitarthasamgrahaHK-893	sa evāyaṃ mayā te'dya yogaḥ proktaḥ purātanaḥ | bhakto'si me	saḥ eva ayam mayā tedya yogaḥ proktaḥ purātanaḥ bhaktaḥ asi me 
SA_MB_gitarthasamgrahaHK-894	sakhā ceti rahasyaṃ hyetaduttamam || 4-3 ||	sakhā ca iti rahasyam hi etat uttamam 
SA_MB_gitarthasamgrahaHK-895	bhakto'si me sakhā ceti tvaṃ bhakto matparamaḥ sakhā ca |	bhaktaḥ asi me sakhā ca iti tvam bhaktaḥ mad paramaḥ sakhā ca 
SA_MB_gitarthasamgrahaHK-896	caśabdenānvācaya ucyate | tena yathā bhikṣāṭane bhikṣāṇāṃ	caśabdena anvācayaḥ ucyate tena yathā bhikṣāṭane bhikṣāṇām 
SA_MB_gitarthasamgrahaHK-897	prādhānyaṃ gavānayane tvaprādhānyam | evaṃ bhaktiratra guruṃ	prādhānyam gavānayane tu aprādhānyam evam bhaktiḥ atra gurum 
SA_MB_gitarthasamgrahaHK-898	pradhānaṃ na sakhitvamapīti tātparyārthaḥ || 3 ||	pradhānam na sakhitvam api iti tātparyārthaḥ 
SA_MB_gitarthasamgrahaHK-899	arjuno bhagavatsvarūpaṃ jānannapi loke sphuṭīkartuṃ pṛcchati-	arjunaḥ bhagavat svarūpam jānan api loke sphuṭīkartum pṛcchati 
SA_MB_gitarthasamgrahaHK-900	arjuna uvāca	arjunaḥ uvāca 
SA_MB_gitarthasamgrahaHK-901	aparaṃ bhavato janma paraṃ janma vivasvataḥ | kathametadvijānīyāṃ	aparam bhavataḥ janma param janma vivasvataḥ katham etat vijānīyām 
SA_MB_gitarthasamgrahaHK-902	tvamādau proktavāniti || 4-4 ||	tvam ādau proktavān iti 
SA_MB_gitarthasamgrahaHK-903	śrībhagavānuvāca	śrī bhagavān uvāca 
SA_MB_gitarthasamgrahaHK-904	bahūni me vyatītāni janmāni tava cārjuna | tānyahaṃ veda	bahūni me vyatītāni janmāni tava ca arjuna tāni aham veda 
SA_MB_gitarthasamgrahaHK-905	sarvāṇi na tvaṃ vettha parantapa || 4-5 ||	sarvāṇi na tvam vettha parantapa 
SA_MB_gitarthasamgrahaHK-906	ajo'pi sannavyayātmā bhūtānāmīśvaro'pi san | prakṛtiṃ	ajaḥ api san avyaya ātmā bhūtānām īśvaraḥ api san prakṛtim 
SA_MB_gitarthasamgrahaHK-907	svāmadhiṣṭhāya sambhavāmyātmamāyayā || 4-6 ||	svām adhiṣṭhāya sambhavāmi ātma māyayā 
SA_MB_gitarthasamgrahaHK-908	yadā yadā hi dharmasya glānirbhavati bhārata |	yadā yadā hi dharmasya glāniḥ bhavati bhārata 
SA_MB_gitarthasamgrahaHK-909	abhyutthānamadharmasya tadātmāṃśaṃ sṛjāmyaham || 4-7 ||	abhyutthānam adharmasya tadā ātma aṃśam sṛjāmi aham 
SA_MB_gitarthasamgrahaHK-910	śrībhagavānkila	śrī bhagavān kila 
SA_MB_gitarthasamgrahaHK-911	pūrṇaṣāḍguṇyatvāccharīrasaṃparkamātrarahito'pi	pūrṇa ṣāḍguṇya tvāt śarīra saṃparka mātra rahitaḥ api 
SA_MB_gitarthasamgrahaHK-912	sthitikāritvātkāruṇikatayā ātmāṃśaṃ sṛjati |	sthiti kāri tvāt kāruṇika tayā ātma aṃśam sṛjati 
SA_MB_gitarthasamgrahaHK-913	ātmā-pūrṇaṣāḍguṇyaḥ aṃśaḥ-upakārakatvenāpradhānabhūto	ātma a pūrṇa ṣāḍguṇyaḥ aṃśaḥ 
SA_MB_gitarthasamgrahaHK-914	yatra tadātmāṃśaṃ-śarīraṃ gṛhṇātītyarthaḥ || 7 ||	yatra tadā ātma aṃśam śarīram gṛhṇāti iti arthaḥ   
SA_MB_gitarthasamgrahaHK-915	paritrāṇāya sādhūnāṃ vināśāya ca duṣkṛtām |	paritrāṇāya sādhūnām vināśāya ca duṣkṛtām 
SA_MB_gitarthasamgrahaHK-916	dharmasaṃsthāpanārthāya sambhavāmi yuge yuge || 4-8 ||	dharma saṃsthāpana arthāya sambhavāmi yuge yuge 
SA_MB_gitarthasamgrahaHK-917	janma karma ca me divyamevaṃ yo vetti tattvataḥ | tyaktvā dehaṃ	janma karma ca me divyam evam yaḥ vetti tattvataḥ tyaktvā deham 
SA_MB_gitarthasamgrahaHK-918	punarjanma naiti māmeti so'rjuna || 4-9 ||	punarjanma na eti mām eti sa urjuna 
SA_MB_gitarthasamgrahaHK-919	ata evāsya janma divyaṃ yata ātmamāyayā yogaprajñayā	atas eva asya janma divyam yatas ātma māyayā yoga prajñayā 
SA_MB_gitarthasamgrahaHK-920	svasvātantryaśaktyā ārabdhaṃ na karmabhiḥ | karmāpi	sva svātantrya śaktyā ārabdham na karmabhiḥ karma api 
SA_MB_gitarthasamgrahaHK-921	divyaṃ-phaladānāsamarthatvāt | yaścaivametattatvaṃ	divyam phala dāna asamartha tvāt 
SA_MB_gitarthasamgrahaHK-922	vetti-ātmanyapyevameva manyate so'vaśyaṃ bhagavadvāsudevatattvaṃ	vetti ātmani api evam eva manyate sa uvaśyam bhagavat vāsudeva tattvam 
SA_MB_gitarthasamgrahaHK-923	jānāti || 9 ||	jānāti 
SA_MB_gitarthasamgrahaHK-924	vītarāgabhayakrodhā manmayā madvyapāśrayāḥ | bahavo	vīta rāga bhaya krodhāḥ mad mayāḥ mad vyapāśrayāḥ bahavaḥ 
SA_MB_gitarthasamgrahaHK-925	jñānatapasā pūtā madbhāvamāgatāḥ || 4-10 ||	jñāna tapasā pūtāḥ mad bhāvam āgatāḥ 
SA_MB_gitarthasamgrahaHK-926	tathā caiva vidantaḥ manmayatvātparipūrṇecchatvāt krodhādirahitā	tathā ca eva vidantaḥ mad maya tvāt paripūrṇa iccha tvāt krodha ādi rahitā 
SA_MB_gitarthasamgrahaHK-927	niṣphalaṃ karma karaṇīyaṃ kurvāṇā bahavo matsvarūpamavāptāḥ	niṣphalam karma karaṇīyam kurvāṇāḥ bahavaḥ mad sva rūpam avāptāḥ 
SA_MB_gitarthasamgrahaHK-928	yataḥ-	yatas 
SA_MB_gitarthasamgrahaHK-929	ye yathā māṃ prapadyante tāṃstathaiva bhajāmyaham | mama	ye yathā mām prapadyante tān tathā eva bhajāmi aham mama 
SA_MB_gitarthasamgrahaHK-930	vartmānuvartante manuṣyāḥ pārtha sarvaśaḥ || 4-11 ||	vartma anuvartante manuṣyāḥ pārtha sarvaśas 
SA_MB_gitarthasamgrahaHK-931	p. 111)	p 
SA_MB_gitarthasamgrahaHK-932	ye yayaiva buddhyā māmāśrayante tānprati tadeva svarūpaṃ	ye yayā eva buddhyā mām āśrayante tān prati tat eva sva rūpam 
SA_MB_gitarthasamgrahaHK-933	gṛhṇaṃstānanugṛhṇāmi | evameva madīyaṃ mārgaṃ manmayā	gṛhṇan tān anugṛhṇāmi evam eva madīyam mārgam mad mayā 
SA_MB_gitarthasamgrahaHK-934	amanmayāśca sarve evānuvartante nahi jyotiṣṭomādiranyo mārgaḥ	a mad mayāḥ ca sarve eva anuvartante na hi jyotiṣṭoma ādiḥ anyaḥ mārgaḥ 
SA_MB_gitarthasamgrahaHK-935	madīyaiva sā tathecchā | vakṣyate hi cāturvarṇya mayā sṛṣṭam	madīyā eva sā tathā icchā vakṣyate hi cāturvarṇya mayā sṛṣṭam 
SA_MB_gitarthasamgrahaHK-936	iti | anyastvāha-liṅarthe laṭ | yathā atirātre ṣoḍaśinaṃ	iti 
SA_MB_gitarthasamgrahaHK-937	gṛhṇanti-gṛhṇīyurityarthaḥ | evamihāpi	gṛhṇanti gṛhṇīyuḥ iti arthaḥ evam iha api 
SA_MB_gitarthasamgrahaHK-938	anuvartante-anuvarteranniti || 11 ||	anuvartante anuvarteran iti 
SA_MB_gitarthasamgrahaHK-939	kāṅkṣantaḥ karmaṇāṃ siddhiṃ yajanta iha devatāḥ | kṣipraṃ hi	kāṅkṣantaḥ karmaṇām siddhim yajantaḥ iha devatāḥ kṣipram hi 
SA_MB_gitarthasamgrahaHK-940	mānuṣe loke siddhirbhavati karmajā || 4-12 ||	mānuṣe loke siddhiḥ bhavati karma jā 
SA_MB_gitarthasamgrahaHK-941	mānuṣa eva loke bhogāpavargalakṣaṇā siddhirnānyatra iti || 12 ||	mānuṣe eva loke bhoga apavarga lakṣaṇā siddhiḥ na anyatra iti 
SA_MB_gitarthasamgrahaHK-942	cāturvarṇyaṃ mayā sṛṣṭaṃ guṇakarmavibhāgaśaḥ | tasya	cāturvarṇyam mayā sṛṣṭam guṇa karma vibhāgaśaḥ tasya 
SA_MB_gitarthasamgrahaHK-943	kartāramapi māṃ viddhyakartāramavyayam || 4-13 ||	kartāram api mām viddhi akartāram avyayam 
SA_MB_gitarthasamgrahaHK-944	na māṃ karmāṇi limpanti na me kāmaḥ phaleṣvapi | iti māṃ	na mām karmāṇi limpanti na me kāmaḥ phaleṣu api iti mām 
SA_MB_gitarthasamgrahaHK-945	yo'bhijānāti karmabhirna sa badhyate || 4-14 ||	yaḥ abhijānāti karmabhiḥ na sa badhyate 
SA_MB_gitarthasamgrahaHK-946	mama kila kathamākāśakalpasya karmabhirlepaḥ | ākāśapratimatvaṃ	mama kila katham ākāśa kalpasya karmabhiḥ lepaḥ ākāśa pratima tvam 
SA_MB_gitarthasamgrahaHK-947	kāmanābhāvāt | ityanena jñānaprakāreṇa yo	kāmanā bhāvāt iti anena jñāna prakāreṇa yaḥ 
SA_MB_gitarthasamgrahaHK-948	bhagavantamevāśrayate sarvatra sarvadā ānandaghanaṃ	bhagavantam eva āśrayate sarvatra sarvadā ānanda ghanam 
SA_MB_gitarthasamgrahaHK-949	parameśvarameva na vāsudevātparamasti kiṃcit iti nītyā vimṛśati	parameśvaram eva na vāsudevāt param asti kiṃcid iti nītyā vimṛśati 
SA_MB_gitarthasamgrahaHK-950	tasya kiṃ karmabhirbandhaḥ || 14 ||	tasya kim karmabhiḥ bandhaḥ 
SA_MB_gitarthasamgrahaHK-951	evaṃ jñātvā kṛtaṃ karma pūrvairapi mumukṣubhiḥ | kuru karmaiva	evam jñātvā kṛtam karma pūrvaiḥ api mumukṣubhiḥ kuru karma eva 
SA_MB_gitarthasamgrahaHK-952	tasmāttvaṃ pūrvaiḥ pūrvataraṃ kṛtam || 4-15 ||	tasmāt tvam pūrvaiḥ pūrvataram kṛtam 
SA_MB_gitarthasamgrahaHK-953	tasmādanayā buddhyā pavitrīkṛtastvamapi	tasmāt anayā buddhyā pavitrīkṛtaḥ tvam api 
SA_MB_gitarthasamgrahaHK-954	karmāṇi-avaśyakartavyāni kuru || 15 ||	karmāṇi avaśya kartavyāni kuru  /
SA_MB_gitarthasamgrahaHK-955	athocyate akaraṇādeva siddhiḥ - iti | tanna yataḥ	atha ucyate akaraṇāt eva siddhiḥ iti tat na yatas 
SA_MB_gitarthasamgrahaHK-956	kiṃ karma kimakarmeti kavayo'pyatra mohitāḥ | tatte karma	kim karma kim akarma iti kavayaḥ api atra mohitāḥ tat te karma 
SA_MB_gitarthasamgrahaHK-957	pravakṣyāmi yajjñātvā mokṣyase'śubhāt || 4-16 ||	pravakṣyāmi yat jñātvā mokṣyase śubhāt 
SA_MB_gitarthasamgrahaHK-958	karmaṇo hyapi boddhavyaṃ boddhavyaṃ ca vikarmaṇaḥ | akarmaṇaśca	karmaṇaḥ hi api boddhavyam boddhavyam ca vikarmaṇaḥ akarmaṇaḥ ca 
SA_MB_gitarthasamgrahaHK-959	boddhavyaṃ gahanā karmaṇo gatiḥ || 4-17 ||	boddhavyam gahanā karmaṇaḥ gatiḥ 
SA_MB_gitarthasamgrahaHK-960	karmākarmaṇorvibhāgo duṣparijñānaḥ | tathā ca-vihitakarmaṇyapi	karma akarmaṇoḥ vibhāgaḥ duṣparijñānaḥ tathā ca vihita karmaṇi api 
SA_MB_gitarthasamgrahaHK-961	madhye duṣṭaṃ karmāsti-agniṣṭoma iva paśuvadhaḥ | viruddhe'pi	madhye duṣṭam karma asti agniṣṭome iva paśu vadhaḥ viruddhe api 
SA_MB_gitarthasamgrahaHK-962	ca karmaṇi śubhamasti karma | tathāhi hiṃsraprāṇivadhe	ca karmaṇi śubham asti karma tathā hi hiṃsra prāṇi vadhe 
SA_MB_gitarthasamgrahaHK-963	prajopatāpābhāvaḥ | akaraṇe'pi ca śubhāśubhaṃ	prajā upatāpa abhāvaḥ a karaṇe api ca śubha aśubham 
SA_MB_gitarthasamgrahaHK-964	karmāsti-vāṅmanasakṛtānāṃ karmaṇāmavaśyaṃbhāvāt teṣāṃ	karma asti vāc manasa kṛtānām karmaṇām avaśyaṃbhāvāt teṣām 
SA_MB_gitarthasamgrahaHK-965	jñānamantareṇa duṣpariharatvāt | ataḥ kuśalairapi	jñānam antareṇa duṣparihara tvāt atas kuśalaiḥ api 
SA_MB_gitarthasamgrahaHK-966	gahanatvātkarma na jñāyate anena śubhakarmaṇā śubhamasmākaṃ	gahana tvāt karma na jñāyate anena śubha karmaṇā śubham asmākam 
SA_MB_gitarthasamgrahaHK-967	bhaviṣyati anena ca karmaṇāmanārambheṇa mokṣo na bhaviṣyati-iti |	bhaviṣyati anena ca karmaṇām anārambheṇa mokṣaḥ na bhaviṣyati iti 
SA_MB_gitarthasamgrahaHK-968	tasmādvakṣyamāṇo vijñānavahnirevāvaśyaṃ	tasmāt vakṣyamāṇaḥ vijñāna vahniḥ eva avaśyam 
SA_MB_gitarthasamgrahaHK-969	sakalaśubhāśubhakarmendhanaploṣasamarthaḥ śaraṇatvenānveṣya-iti	sakala śubha aśubha karma indhana ploṣa samarthaḥ śaraṇa tvena anveṣya eti 
SA_MB_gitarthasamgrahaHK-970	bhagavato'bhiprāyaḥ || 17 ||	bhagavataḥ abhiprāyaḥ 
SA_MB_gitarthasamgrahaHK-971	tamevodbodhayitumāha-	tam eva udbodhayitum āha 
SA_MB_gitarthasamgrahaHK-972	karmaṇyakarma yaḥ paśyatyakarmaṇi ca karma yaḥ | sa buddhimān	karmaṇi akarma yaḥ paśyati akarmaṇi ca karma yaḥ sa buddhimān 
SA_MB_gitarthasamgrahaHK-973	manuṣyeṣu sa coktaḥ kṛtsnakarmakṛt || 4-18 ||	manuṣyeṣu sa ca uktaḥ kṛtsna karma kṛt 
SA_MB_gitarthasamgrahaHK-974	karmaṇīti-ātmīyeṣu karmasu yaḥ akartṛtvādakarmatvaṃ paśyati	karmaṇi iti ātmīyeṣu karmasu yaḥ akartṛ tvāt akarma tvam paśyati 
SA_MB_gitarthasamgrahaHK-975	praśāntatayā | akarmasu ca-parakṛteṣu ātmakṛtatvaṃ jānāti	praśānta tayā akarmasu ca para kṛteṣu ātma kṛta tvam jānāti 
SA_MB_gitarthasamgrahaHK-976	paripūrṇoditasvarūpatvena | sa eva sarvasva madhye buddhimān	paripūrṇa udita sva rūpa tvena saḥ eva madhye buddhimān 
SA_MB_gitarthasamgrahaHK-977	kārtsnyena-sākalyenāsau karma karoti | ato'sya kena karmaṇā	kārtsnyena sākalyena asau karma karoti atas asya kena karmaṇā 
SA_MB_gitarthasamgrahaHK-978	phalaṃ dīyatām ityuditadaśāyām | praśāntatve tu kṛtsnāni	phalam dīyatām iti udita daśāyām praśānta tve tu kṛtsnāni 
SA_MB_gitarthasamgrahaHK-979	karmāṇi kṛntati cchinatti | ataḥ sarvameva karoti na kiṃcidvā	karmāṇi kṛntati chinatti atas sarvam eva karoti na kiṃcid vā 
SA_MB_gitarthasamgrahaHK-980	karoti-ityupaniṣat || 18 ||	karoti iti upaniṣad 
SA_MB_gitarthasamgrahaHK-981	yasya sarve samārambhāḥ kāmasaṅkalpavarjitāḥ |	yasya sarve samārambhāḥ kāma saṅkalpa varjitāḥ 
SA_MB_gitarthasamgrahaHK-982	jñānāgnidagdhakarmāṇaṃ tamāhuḥ paṇḍitaṃ budhāḥ || 4-19 ||	jñāna agni dagdha karmāṇam tam āhuḥ paṇḍitam budhāḥ 
SA_MB_gitarthasamgrahaHK-983	ata eva kāmeṣu-kāmyamāneṣu phaleṣu saṅkalpaṃ vihāya	atas eva kāmeṣu kāmyamāneṣu phaleṣu saṅkalpam vihāya 
SA_MB_gitarthasamgrahaHK-984	kriyamāṇāni karmāṇi kathitakathayiṣyamāṇasvarūpe	kriyamāṇāni karmāṇi kathita kathayiṣyamāṇa svarūpe 
SA_MB_gitarthasamgrahaHK-985	jñānāgnāvanupraviśya dahyante || 19 ||	jñāna agnau anupraviśya dahyante 
SA_MB_gitarthasamgrahaHK-986	tyaktvā karmaphalāsaṅgaṃ nityatṛpto nirāśrayaḥ |	tyaktvā karma phala āsaṅgam nitya tṛptaḥ nirāśrayaḥ 
SA_MB_gitarthasamgrahaHK-987	karmaṇyabhipravṛtto'pi naiva kiñcitkaroti saḥ || 4-20 ||	karmaṇi abhipravṛttaḥ api nā eva kiñcid karoti saḥ 
SA_MB_gitarthasamgrahaHK-988	abhipravṛtto'pi-ābhimukhyena pravṛtto'pi || 20 ||	abhipravṛttaḥ api ābhimukhyena pravṛttaḥ api 
SA_MB_gitarthasamgrahaHK-989	nirāśīryatacittātmā tyaktasarvaparigrahaḥ | śārīraṃ kevalaṃ	nirāśīḥ yata citta ātmā tyakta sarva parigrahaḥ śārīram kevalam 
SA_MB_gitarthasamgrahaHK-990	karma kurvannāpnoti kilbiṣam || 4-21 ||	karma kurvan āpnoti kilbiṣam 
SA_MB_gitarthasamgrahaHK-991	śarīropayogi indriyavyāpārātmakaṃ karma śārīraṃ	śarīra upayogi indriya vyāpāra ātmakam karma śārīram 
SA_MB_gitarthasamgrahaHK-992	yanmanobuddhibhyāṃ na tathānurañjitam || 21 ||	yat manaḥ buddhibhyām na tathā anurañjitam 
SA_MB_gitarthasamgrahaHK-993	yadṛcchālābhasantuṣṭo dvandvātīto vimatsaraḥ | samaḥ	yadṛcchā lābha santuṣṭaḥ dvandva atītaḥ vimatsaraḥ samaḥ 
SA_MB_gitarthasamgrahaHK-994	siddhāvasiddhau ca kṛtvā'pi na nibadhyate || 4-22 ||	siddhau asiddhau ca kṛtvā api na nibadhyate 
SA_MB_gitarthasamgrahaHK-995	karmakartari prayogaḥ svayameva hyātmā ātmānaṃ badhnāti	karma kartari prayogaḥ svayam eva hi ātmā ātmānam badhnāti 
SA_MB_gitarthasamgrahaHK-996	phalavāsanākāluṣyamupādadāna ityarthaḥ | anyathā jaḍānāṃ	phala vāsanā kāluṣyam upādadānaḥ iti arthaḥ anyathā jaḍānām 
SA_MB_gitarthasamgrahaHK-997	karmaṇāṃ bandhane svātantryaṃ na tathā hṛdayaṃgamam || 22 ||	karmaṇām bandhane svātantryam na tathā hṛdayaṃgamam 
SA_MB_gitarthasamgrahaHK-998	gatasaṅgasya muktasya jñānāvasthitacetasaḥ | yajñāyārabhataḥ	gata saṅgasya muktasya jñāna avasthita cetasaḥ yajñāya ārabhataḥ 
SA_MB_gitarthasamgrahaHK-999	karma samagraṃ pravilīyate || 4-23 ||	karma samagram pravilīyate 
SA_MB_gitarthasamgrahaHK-1000	yajñāyeti-jātāvekavacanam | yajñāḥ-vakṣyamāṇalakṣaṇāḥ ||	yajñāya iti jātau ekavacanam yajñāḥ vakṣyamāṇa lakṣaṇāḥ 
SA_MB_gitarthasamgrahaHK-1001	yajñāyetyuktam-tatsvarūpaṃ sāmānyaṃ tāvadāha	yajñāya iti uktam tad svarūpam sāmānyam tāvat āha 
SA_MB_gitarthasamgrahaHK-1002	brahmārpaṇaṃ brahmahavirbrahmāgnau brahmaṇā hutam | brahmaiva tena	brahma arpaṇam brahma haviḥ brahma agnau brahmaṇā hutam brahma eva tena 
SA_MB_gitarthasamgrahaHK-1003	gantavyaṃ brahmakarmasamādhinā || 4-24 ||	gantavyam brahma karma samādhinā 
SA_MB_gitarthasamgrahaHK-1004	brahmaṇyarpaṇaṃ-tata eva pravṛttasya punastatraivānupraveśanaṃ	brahmaṇi arpaṇam tatas eva pravṛttasya punar tatra eva anupraveśanam 
SA_MB_gitarthasamgrahaHK-1005	yasya tat | brahma-samagraṃ viśvātmakaṃ yadetat havistat |	yasya tat brahma samagram viśva ātmakam yat etat haviḥ tat 
SA_MB_gitarthasamgrahaHK-1006	brahmaṇi-paramabodhe praśānte'gnau | brahmaṇā-yenakenacitkarmaṇā	brahmaṇi parama bodhe praśānte agnau brahmaṇā yena kenacid karmaṇā 
SA_MB_gitarthasamgrahaHK-1007	hutaṃ-taddīptyabhivṛddhaye samarpitam itīdṛśaṃ brahmakarmaiva	hutam tat dīpti abhivṛddhaye samarpitam iti īdṛśam brahma karma eva 
SA_MB_gitarthasamgrahaHK-1008	samādhiryasya yoginastena brahmaiva gantavyaṃ jñeyaṃ	samādhiḥ yasya yoginaḥ tena brahma eva gantavyam jñeyam 
SA_MB_gitarthasamgrahaHK-1009	nānyatkiṃcidanyābhāvāt | yadivā tadarthena	na anyat kiṃcid anya abhāvāt yat iva tad arthena 
SA_MB_gitarthasamgrahaHK-1010	yadarthākṣepādevaṃsaṃbandhaḥ-yatkhalu brahmasvarūpeṇa	yad artha ākṣepāt evam saṃbandhaḥ yat khalu brahma svarūpeṇa 
SA_MB_gitarthasamgrahaHK-1011	yajamānena brahmāgnau brahmahavirhutaṃ brahmaṇi	yajamānena brahma agnau brahma haviḥ hutam brahmaṇi 
SA_MB_gitarthasamgrahaHK-1012	brahmasvabhāvadevatoddeśenārpaṇaṃ yasya tadevaṃ bhūtaṃ	brahma svabhāva devatā uddeśena arpaṇam yasya tat evam bhūtam 
SA_MB_gitarthasamgrahaHK-1013	yadbrahmakarma tadeva samādhirātmasvarūpalābhopāyatvāt	yat brahma karma tat eva samādhiḥ ātma svarūpa lābha upāya tvāt 
SA_MB_gitarthasamgrahaHK-1014	tena-brahmakarmasamādhinā nānyatphalamavāpyate apitu brahmaiveti ye	tena brahma karma samādhinā na anyat phalam avāpyate apitu brahmā eva iti ye 
SA_MB_gitarthasamgrahaHK-1015	yathā māṃ prapadyante-iti hi nirvāhitam |	yathā mām prapadyante iti hi nirvāhitam 
SA_MB_gitarthasamgrahaHK-1016	mitasvarūpī-kṛtamadātmakayajñasvabhāvā iti	mita svarūpīkṛta mada ātmaka yajña svabhāvāḥ iti 
SA_MB_gitarthasamgrahaHK-1017	tādṛśaphalabhāginaḥ-ityuktam |	tādṛśa phala bhāginaḥ iti uktam 
SA_MB_gitarthasamgrahaHK-1018	aparimitaparipūrṇamadātmakayajñasvarūpavedinastu kathaṃ	aparimita paripūrṇa mada ātmaka yajña sva rūpa vedinaḥ tu katham 
SA_MB_gitarthasamgrahaHK-1019	parimitaphalalavalāmpaṭyabhāgino bhaveyuriti tātparyam | ityanena |	parimita phala lava lāmpaṭya bhāginaḥ bhaveyuḥ iti tātparyam iti anena 
SA_MB_gitarthasamgrahaHK-1020	ślokena vakṣyamāṇaiśca ślokeḥ paramarahasyamupanibaddham |	ślokena vakṣyamāṇaiḥ ca ślokeḥ parama rahasyam upanibaddham 
SA_MB_gitarthasamgrahaHK-1021	taccāsmābhirmitabuddhibhirapi yathābuddhi yathāgurvāmnāyaṃ ca	tat ca asmābhiḥ mita buddhibhiḥ api yathābuddhi yathāguru āmnāyam ca 
SA_MB_gitarthasamgrahaHK-1022	vivṛtam | mukhasaṃpradāyakramamantareṇa naitat nabhaścitramiva	vivṛtam mukha saṃpradāya kramam antareṇa na etat nabhaḥ citram iva 
SA_MB_gitarthasamgrahaHK-1023	cittamupārohatīti na vayamupālambhanīyāḥ | atra haviṣo'gneḥ	cittam upārohati iti na vayam upālambhanīyāḥ atra haviṣā agneḥ 
SA_MB_gitarthasamgrahaHK-1024	karaṇānāṃ ca srugādīnāṃ kriyāyāśca brahmaviśeṣaṇatvamiti	karaṇānām ca sruc ādīnām kriyāyāḥ ca brahma viśeṣaṇa tvam iti 
SA_MB_gitarthasamgrahaHK-1025	kaiściduktaṃ tadupekṣyameva-teṣāṃ	kaiścid uktam tat upekṣyam eva teṣām 
SA_MB_gitarthasamgrahaHK-1026	rahasyasaṃpradāyakrame'kṣuṇatvāt || 24 ||	rahasya saṃpradāya krama ikṣuṇa tvāt 
SA_MB_gitarthasamgrahaHK-1027	daivamevāpare yajñaṃ yoginaḥ paryupāsate | brahmāgnāvapare	daivam eva apare yajñam yoginaḥ paryupāsate brahma agnau apare 
SA_MB_gitarthasamgrahaHK-1028	yajñaṃ yajñenaivopajuhvati || 4-25 ||	yajñam yajñena eva upajuhvati 
SA_MB_gitarthasamgrahaHK-1029	apare devāni-krīḍāśīlāni indriyāṇi āśritya yaḥ sthito	apare indriyāṇi āśritya yaḥ 
SA_MB_gitarthasamgrahaHK-1030	yajño-nijanijaviṣayagṛhaṇalakṣaṇaḥ tameva parita	yajñaḥ nija nija viṣaya gṛhaṇa lakṣaṇaḥ tam eva 
SA_MB_gitarthasamgrahaHK-1031	upāsate-āmūlādvimṛśanta svātmalābhaṃ labhante | ata eva te	upāsate ā mūlāt vimṛśanta sva ātma lābham labhante atas eva te 
SA_MB_gitarthasamgrahaHK-1032	yoginaḥ-sarvāvasthāsu satatameva yogayuktatvāt | nityayoge	yoginaḥ sarva avasthāsu satatam eva yoga yukta tvāt nityayoge 
SA_MB_gitarthasamgrahaHK-1033	hyayamatra matvarthīyaḥ | enameva ca viṣayagṛhaṇātmakaṃ yajñaṃ	hi ayam atra matu arthīyaḥ enam eva ca viṣaya gṛhaṇa ātmakam yajñam 
SA_MB_gitarthasamgrahaHK-1034	yajñenaiva-tenaiva lakṣaṇena apare-pūrayitumaśakye brahmāgnau	yajñena eva tena eva lakṣaṇena a parepūrayitum aśakye brahma agnau 
SA_MB_gitarthasamgrahaHK-1035	juhvati-iti kaiścidyākhyātam | munestu	juhvati iti muneḥ tu 
SA_MB_gitarthasamgrahaHK-1036	paurvāparyāviruddhatvādyo'rtho hṛdi sthitastaṃ	paurvāparya aviruddha tvāt yaḥ arthaḥ hṛdi sthitaḥ tam 
SA_MB_gitarthasamgrahaHK-1037	prakāśayāmaḥ-kecidyogayuktā santo	prakāśayāmaḥ 
SA_MB_gitarthasamgrahaHK-1038	daivaṃ-nānārūpendrādidevatoddeśenaiva bāhyadravyamayaṃ	daivam nānā rūpa indra ādi devatā uddeśena eva bāhya dravya mayam 
SA_MB_gitarthasamgrahaHK-1039	yajñamupācaranti | taṃ ca kriyamāṇameva yajñaṃ	yajñam upācaranti tam ca kriyamāṇam eva yajñam 
SA_MB_gitarthasamgrahaHK-1040	kartavyamidamityeva buddhā phalānapekṣayā apare-duṣpūre	kartavyam idam iti eva buddhā phala anapekṣayā apareduṣpūre 
SA_MB_gitarthasamgrahaHK-1041	brahmāgnāvarpayanti-iti dravyayajñā api paraṃ brahma yānti | yato	brahma agnau arpayanti iti dravya yajñāḥ api param brahma yānti yatas 
SA_MB_gitarthasamgrahaHK-1042	vakṣyate sarve'pyete yajñavidaḥ-iti | śrutirapi yajñena	vakṣyate sarve api ete yajña vidaḥ iti śrutiḥ api yajñena 
SA_MB_gitarthasamgrahaHK-1043	yajñamayajanta devāḥ-iti || 25 ||	yajñam ayajanta devāḥ iti 
SA_MB_gitarthasamgrahaHK-1044	śrotrādīnīndriyāṇyanye saṃyamāgniṣu juhvati |	śrotra ādīni indriyāṇi anye saṃyama agniṣu juhvati 
SA_MB_gitarthasamgrahaHK-1045	śabdādīnviṣayānanya indriyāgniṣu juhvati || 4-26 ||	śabda ādīn viṣayān anye indriya agniṣu juhvati 
SA_MB_gitarthasamgrahaHK-1046	anye tu saṃyamāgniṣvindriyāṇīti | saṃyamaḥ-manaḥ tasya	anye tu saṃyama agniṣu indriyāṇi iti saṃyamaḥ manaḥ tasya 
SA_MB_gitarthasamgrahaHK-1047	ye'gnayaḥ-pratipannabhāvabhāvanārūpā abhilāṣaploṣakā	abhilāṣa ploṣakā 
SA_MB_gitarthasamgrahaHK-1048	visphuliṅgāḥ teṣu indriyāṇyarpayanti | ata eva te tapoyajñāḥ |	visphuliṅgāḥ teṣu indriyāṇi arpayanti atas eva te tapaḥ yajñāḥ 
SA_MB_gitarthasamgrahaHK-1049	itare jñānapradīpiteṣu phaladāhakeṣvindriyāgniṣu	itare jñāna pradīpiteṣu phala dāhakeṣu indriya agniṣu 
