segmentnr	original	analyzed
SA_MB_somasambhupaddhativyakhyaHK-1009	āgneyaṃ hemaratnādi dīpamābharaṇādikam |	āgneyam hema ratna ādi dīpam ābharaṇa ādikam 
SA_MB_somasambhupaddhativyakhyaHK-1010	pādyaṃ cāmaraṃ dhūpaṃ vyajanaṃ vātakāraṇam ||	pādyam cāmaram dhūpam vyajanam vāta kāraṇam 
SA_MB_somasambhupaddhativyakhyaHK-1011	nādasaṅgeyavādyādyaṃ ghaṇṭānādasvanādikam |	                 
SA_MB_somasambhupaddhativyakhyaHK-1012	ete pañcopacārāstu kathitā śāstravedibhiḥ ||	ete pañca upacārāḥ tu kathitā śāstra vedibhiḥ 
SA_MB_somasambhupaddhativyakhyaHK-1013	iti |	iti 
SA_MB_somasambhupaddhativyakhyaHK-1014	atha snānaṃ |	atha snānam 
SA_MB_somasambhupaddhativyakhyaHK-1015	p. 56)	p 
SA_MB_somasambhupaddhativyakhyaHK-1016	abhyajyeti | pañcabhirājikā sarṣapaḥ | ato na bandhamuktaye mudrayāmiti |	abhyajya iti pañcabhiḥ rājikā sarṣapaḥ atas na bandha muktaye mudrayām iti 
SA_MB_somasambhupaddhativyakhyaHK-1017	stanadvayādadho mudrāṃ na bandhayet | taduktaṃ -	stana dvayāt adhas mudrām na bandhayet tat uktam 
SA_MB_somasambhupaddhativyakhyaHK-1018	stanadvayādadhaḥ kṛtvā karamudrāṃ na bandhayet |	stana dvayāt adhas kṛtvā karamudrām na bandhayet 
SA_MB_somasambhupaddhativyakhyaHK-1019	mudrādāne tataśśambhoḥ hṛddeśe tannivedayet ||	mudrā dāne tatas śambhoḥ hṛd deśe tat nivedayet 
SA_MB_somasambhupaddhativyakhyaHK-1020	iti |	iti 
SA_MB_somasambhupaddhativyakhyaHK-1021	tathārghyadānādāvapi devasyopari karaṃ na bhrāmayet |	tathā arghya dāna ādau api devasya upari karam na bhrāmayet 
SA_MB_somasambhupaddhativyakhyaHK-1022	taduktaṃ -	tat uktam 
SA_MB_somasambhupaddhativyakhyaHK-1023	arghyaṃ savyāpasavyena dadyātpañcasu mūrdhasu |	arghyam savya apasavyena dadyāt pañcasu mūrdhasu 
SA_MB_somasambhupaddhativyakhyaHK-1024	iti |	iti 
SA_MB_somasambhupaddhativyakhyaHK-1025	atha snapanānantarakaraṇīyānvidhatte - candreti | tribhiḥ candraśabdaṃ karpūraḥ	atha snapana anantara karaṇīyān vidhatte candra iti tribhiḥ candra śabdam karpūraḥ 
SA_MB_somasambhupaddhativyakhyaHK-1026	kāśmīravacanaṃ kuṅkumavāci | ārātrikoktaprakāreṇānvite veditavyaḥ |	kāśmīra vacanam kuṅkuma vāci ārātrika ukta prakāreṇa anvite veditavyaḥ 
SA_MB_somasambhupaddhativyakhyaHK-1027	athoktaṃ -	atha uktam 
SA_MB_somasambhupaddhativyakhyaHK-1028	ārādikajjaloddīpairnavapañcāṣṭabhiryutaṃ |	āra ādi kajjala uddīpaiḥ nava pañca aṣṭabhiḥ yutam 
SA_MB_somasambhupaddhativyakhyaHK-1029	sauvarṇaṃ rājataṃ vā'pi dadhidūrvākṣatārcitaṃ ||	sauvarṇam rājatam vā api dadhi dūrvā akṣata arcitam 
SA_MB_somasambhupaddhativyakhyaHK-1030	p. 57 )	p 
SA_MB_somasambhupaddhativyakhyaHK-1031	ata ūrdhvakrameṇeśasannidhau tāṃ śanaiśśanaiḥ |	atas ūrdhva krameṇa īśa sannidhau tām śanais śanais 
SA_MB_somasambhupaddhativyakhyaHK-1032	trivāraṃ tamanubhrāmya śītāmbuculukatrayaṃ ||	tri vāram tam anubhrāmya śīta ambu culuka trayam 
SA_MB_somasambhupaddhativyakhyaHK-1033	iti |	iti 
SA_MB_somasambhupaddhativyakhyaHK-1034	atha pūjāṅgavidhiḥ |	atha pūjā aṅga vidhiḥ 
SA_MB_somasambhupaddhativyakhyaHK-1035	praṇamyetyādi nivedyetyantaṃ daṃṣṭrākarālaṃ daṃṣṭrābhayaṅkaraṃ |	praṇamya ityādi nivedya iti antam daṃṣṭrā karālam daṃṣṭrā bhayaṅkaram 
SA_MB_somasambhupaddhativyakhyaHK-1036	pādyācamanārghyañceti cakārāt āvāhanādi saṃskārāntānapi sūcayati |	pādya ācamana arghyam ca iti cakārāt āvāhana ādi saṃskāra antān api sūcayati 
SA_MB_somasambhupaddhativyakhyaHK-1037	taduktaṃ brahmaśambhupādaiḥ -	            
SA_MB_somasambhupaddhativyakhyaHK-1038	āvāhanādinaitāni svamantraiḥ kramaśo'rcayet |	āvāhana ādinā etāni sva mantraiḥ kramaśas urcayet 
SA_MB_somasambhupaddhativyakhyaHK-1039	nāvakuṇṭhanameteṣāṃ amṛtīkaraṇaṃ tathā ||	na avakuṇṭhanam eteṣām amṛtīkaraṇam tathā 
SA_MB_somasambhupaddhativyakhyaHK-1040	saṃskārāṣṭakamevaiṣāṃ pratyekaṃ vihitaṃ budhaiḥ |	saṃskāra aṣṭakam eva eṣām pratyekam vihitam budhaiḥ 
SA_MB_somasambhupaddhativyakhyaHK-1041	snapanaṃ dīpapakvañca na pṛthak cāṅgabhāvataḥ ||	snapanam dīpa pakvam ca na pṛthak ca aṅga bhāvataḥ 
SA_MB_somasambhupaddhativyakhyaHK-1042	bhojanantu prabhoḥ pārśve teṣāṃ tasya ca kīrtitaṃ |	bhojanam tu prabhoḥ pārśve teṣām tasya ca kīrtitam 
SA_MB_somasambhupaddhativyakhyaHK-1043	iti |	iti 
SA_MB_somasambhupaddhativyakhyaHK-1044	p.58)	Ro
SA_MB_somasambhupaddhativyakhyaHK-1045	athāvaraṇapūjānantaraṃ karaṇīyānāha - dhūpeti | saṃsārddhena parivārāyeti	atha āvaraṇa pūjā anantaram karaṇīyān āha dhūpa iti saṃsa arddhena parivārāya iti 
SA_MB_somasambhupaddhativyakhyaHK-1046	| parivārā hṛdādyaissaṃhitāyā ekapātre sāṅgāya śivāya nivedayet |	parivārāḥ hṛd ādyaiḥ saṃhitāyāḥ eka pātre sa aṅgāya śivāya nivedayet 
SA_MB_somasambhupaddhativyakhyaHK-1047	tathoktaṃ brahmaśambhupādaiḥ -	tathā uktam brahma śambhu pādaiḥ 
SA_MB_somasambhupaddhativyakhyaHK-1048	tadardhasya naivedyaṃ pṛthak pātreṣu saṃbhavet |	tad ardhasya naivedyam pṛthak pātreṣu saṃbhavet 
SA_MB_somasambhupaddhativyakhyaHK-1049	pūjiteṣvitarandekasmin	pūjiteṣu itaran ekasmin 
SA_MB_somasambhupaddhativyakhyaHK-1050	iti | tantrastnāvalyāmapi -	iti tantrastnāvalyām api 
SA_MB_somasambhupaddhativyakhyaHK-1051	bhogāṅgānāṃ pṛthagdeyamabhāvādekato bhavet  |	bhogāṅgānām pṛthak deyam abhāvāt ekatas bhavet 
SA_MB_somasambhupaddhativyakhyaHK-1052	iti |	iti 
SA_MB_somasambhupaddhativyakhyaHK-1053	atha pavitrāropaṇaṃ śirasītyekena | etadakaraṇe pūjāyāstāmasatvamityukaṃ	atha pavitra āropaṇam śirasi iti ekena etat akaraṇe pūjāyāḥ tāmasa tvam iti ukam 
SA_MB_somasambhupaddhativyakhyaHK-1054	mohaśūrottare -	mohaśūra uttare 
SA_MB_somasambhupaddhativyakhyaHK-1055	pavitreṇa vinā pūjā tāmasī parikīrtitā |	pavitreṇa vinā pūjā tāmasī parikīrtitā 
SA_MB_somasambhupaddhativyakhyaHK-1056	iti |	iti 
SA_MB_somasambhupaddhativyakhyaHK-1057	atha japataddānayorvidhiḥ |	atha japa tad dānayoḥ vidhiḥ 
SA_MB_somasambhupaddhativyakhyaHK-1058	mānasetyādi nivedya cetyantena mānasādilakṣaṇamuktaṃ |	mānasa ityādi nivedya ca iti antena mānasa ādi lakṣaṇam uktam 
SA_MB_somasambhupaddhativyakhyaHK-1059	p. 59)	p 
SA_MB_somasambhupaddhativyakhyaHK-1060	anyatra yathā -	anyatra yathā 
SA_MB_somasambhupaddhativyakhyaHK-1061	mānasaṃ manasā kāryaṃ prāṇapratinirodhitaḥ |	mānasam manasā kāryam prāṇa pratinirodhitaḥ 
SA_MB_somasambhupaddhativyakhyaHK-1062	oṣṭhaspandanamātreṇa upāṃśuḥ parikīrtitaḥ |	oṣṭha spandana mātreṇa upāṃśuḥ parikīrtitaḥ 
SA_MB_somasambhupaddhativyakhyaHK-1063	pareṣāṃ śṛṇvatāṃ bhāṣyo yaśśabdajanakasmṛtaḥ ||	pareṣām śṛṇvatām bhāṣyaḥ yaḥ śabda janaka smṛtaḥ 
SA_MB_somasambhupaddhativyakhyaHK-1064	mānasaṃ sātvikaṃ vidyāt rājasañca dvitīyakaṃ |	mānasam sātvikam vidyāt rājasam ca dvitīyakam 
SA_MB_somasambhupaddhativyakhyaHK-1065	vispaṣṭaḥ tamasaḥ proktaḥ tāmasaḥ krūrakarmaṇi ||	vispaṣṭaḥ tamasaḥ proktaḥ tāmasaḥ krūrakarmaṇi 
SA_MB_somasambhupaddhativyakhyaHK-1066	rājasaṃ puṣṭivaśyādau sātvikaṃ divyaśuddhaye |	rājasam puṣṭi vaśyā ādau sātvikam divya śuddhaye 
SA_MB_somasambhupaddhativyakhyaHK-1067	saptaviṃśatibhiścākṣaiḥ pañcavaktaiḥ sa karṇakai ||	saptaviṃśatibhiḥ ca akṣaiḥ pañca vaktaiḥ sa 
SA_MB_somasambhupaddhativyakhyaHK-1068	meru ūrdhvamukhaḥ kāryaḥ pratyakṣaṃ nāgapāśakaṃ |	meruḥ ūrdhva mukhaḥ kāryaḥ pratyakṣam nāgapāśakam 
SA_MB_somasambhupaddhativyakhyaHK-1069	aṅguṣṭhadarśanībhyāntu madhyamāyāṃ vyavasthitaṃ ||	aṅguṣṭha darśanībhyām tu madhyamāyām vyavasthitam 
SA_MB_somasambhupaddhativyakhyaHK-1070	mantramuccārayannakṣamekaikaṃ karṣayecchanaiḥ |	mantram uccārayan akṣam ekaikam karṣayet śanais 
SA_MB_somasambhupaddhativyakhyaHK-1071	tato mervāsanantu nagendraṃ parivarjayet ||	tatas meru āsanam tu naga indram parivarjayet 
SA_MB_somasambhupaddhativyakhyaHK-1072	śatamaṣṭottaraṃ japyaṃ sahasraṃ vā'rddhameva vā |	śatam aṣṭa uttaram japyam sahasram vā arddham eva vā 
SA_MB_somasambhupaddhativyakhyaHK-1073	na saṃkhyanna paribhrāntaṃ na drutaṃ na vilambitaṃ ||	na saṃkhyan na paribhrāntam na drutam na vilambitam 
SA_MB_somasambhupaddhativyakhyaHK-1074	guhyeti | guhyādīni śudhavidyādīni |	               
SA_MB_somasambhupaddhativyakhyaHK-1075	p. 60)	p 
SA_MB_somasambhupaddhativyakhyaHK-1076	teṣāṃ goptāttvameva | ataḥ sarvagoṇtṛtvādasmatkṛtaṃ japaṃ gṛhāṇa | yena	teṣām goptā tvam eva atas sarva goṇtṛ tvāt asmad kṛtam japam gṛhāṇa yena 
SA_MB_somasambhupaddhativyakhyaHK-1077	yasmādasminjape tvayyeva vyavasthite sati tvatprasādādasmākaṃ	yasmāt asmin jape tvayi eva vyavasthite sati tvad prasādāt asmākam 
SA_MB_somasambhupaddhativyakhyaHK-1078	bhuktimuktilakṣaṇasiddhirbhavati | nānyathā tasmādgṛhāṇeti | bhogī	bhukti mukti lakṣaṇa siddhiḥ bhavati na anyathā tasmāt gṛhāṇa iti bhogī 
SA_MB_somasambhupaddhativyakhyaHK-1079	bhautikadīkṣayā dīkṣitaḥ svabhogānantaraṃ mokṣabhāk | taduktaṃ	bhautika dīkṣayā dīkṣitaḥ sva bhoga anantaram mokṣa bhāj tat uktam 
SA_MB_somasambhupaddhativyakhyaHK-1080	śrīmadraurave -	śrīmat raurave 
SA_MB_somasambhupaddhativyakhyaHK-1081	dīkṣā pūtā gaṇapati gurormaṇḍale janmavantaḥ	dīkṣā pūtāḥ gaṇapati guroḥ maṇḍale janmavantaḥ 
SA_MB_somasambhupaddhativyakhyaHK-1082	siddhā mantraistaruṇadinakṛnmaṇḍalodbhāsi dehāḥ |	siddhāḥ mantraiḥ taruṇa dinakṛt maṇḍala udbhāsi dehāḥ 
SA_MB_somasambhupaddhativyakhyaHK-1083	bhuktvā bhogān sucira mama .... strīnikāyairūpetā ?	bhuktvā bhogān su cira mama strī nikāyaiḥ ūpetā 
SA_MB_somasambhupaddhativyakhyaHK-1084	srastotkaṇṭhāśśivapadaparaiśvaryabhājo bhavanti ||	srasta utkaṇṭhāḥ śivapada para aiśvarya bhājaḥ bhavanti 
SA_MB_somasambhupaddhativyakhyaHK-1085	he deva sukṛtaduṣkṛtaṃ yāvat kiñcinme karmāsti śivapadasthasya	he deva sukṛta duṣkṛtam yāvat kiñcid me karma asti śiva pada sthasya 
SA_MB_somasambhupaddhativyakhyaHK-1086	śivasyāvasāyena sthitasya padaṃ vyavasyati | tṛṇāvasthānalakṣmāṅghrivastuṣu	                                                   
SA_MB_somasambhupaddhativyakhyaHK-1087	ityamaraḥ |	iti amaraḥ 
SA_MB_somasambhupaddhativyakhyaHK-1088	tatkarma bhuṅkṣve mokṣāntarāyāpaharaṇāya sukṛtarūpaṃ pālaya |	tat karma bhuṅkṣve mokṣa antarāya apaharaṇāya sukṛta rūpam pālaya 
SA_MB_somasambhupaddhativyakhyaHK-1089	apālanavṛtterapi bhujerātmapara eva parameśvara tvāt soḍhavyam |	a pālana vṛtteḥ api bhujeḥ ātma paraḥ eva soḍhavyam 
SA_MB_somasambhupaddhativyakhyaHK-1090	duṣkṛtarūpaṃ kṣapaya nāśaya |	duṣkṛta rūpam kṣapaya nāśaya 
SA_MB_somasambhupaddhativyakhyaHK-1091	p. 61)	p 
SA_MB_somasambhupaddhativyakhyaHK-1092	atra bhuṅkṣva iti pāṭhāntaraṃ tattu karmadvayanāśakaṃ | bījadvayarūpaṃ	atra bhuṅkṣva iti pāṭha antaram tat tu karma dvaya nāśakam bīja dvaya rūpam 
SA_MB_somasambhupaddhativyakhyaHK-1093	mantrāntaraṃ |	mantra antaram 
SA_MB_somasambhupaddhativyakhyaHK-1094	śivo dātā śodhayitā śivo bhoktā pālayitā śivassarvamidaṃ jagat īṣṭa iti	śivaḥ dātā śodhayitā śivaḥ bhoktā pālayitā śivaḥ sarvam idam jagat īṣṭe iti 
SA_MB_somasambhupaddhativyakhyaHK-1095	śeṣaḥ | adhitiṣṭhati vā | yaddīkṣayā śiva'sśuddho bhutvā sarvatra	śeṣaḥ adhitiṣṭhati vā yad dīkṣayā śiva sūddhaḥ bhutvā sarvatra 
SA_MB_somasambhupaddhativyakhyaHK-1096	deśeṣvadhikaraṇeṣu yajati | śodhayitṛtvādiviśiṣṭaṃ paramaśivaṃ pūjayati |	deśeṣu adhikaraṇeṣu yajati śodhayitṛ tva ādi viśiṣṭam paramaśivam pūjayati 
SA_MB_somasambhupaddhativyakhyaHK-1097	ārādhakaśśivo'hameva tvañca ārādhyaśśiva iti | ityanena pūjyapūjakayoḥ	ārādhakaḥ śivaḥ uham eva tvañca ārādhyaḥ śivaḥ iti iti anena pūjya pūjakayoḥ 
SA_MB_somasambhupaddhativyakhyaHK-1098	jagannātha tavāsmiti yat svīkāropadarśanamiti prāguktaṃ |	jagannātha tava asmi iti yat svīkāra upadarśanam iti prāguktam 
SA_MB_somasambhupaddhativyakhyaHK-1099	svasvāmisaṃbandhapradarśanamupapādayati |	sva svāmi saṃbandha pradarśanam upapādayati 
SA_MB_somasambhupaddhativyakhyaHK-1100	ata evaitadātmanivedanamiti | brahmaśambhubhiruktaṃ	atas eva etat ātma nivedanam iti brahma śambhubhiḥ uktam 
SA_MB_somasambhupaddhativyakhyaHK-1101	nivedyaivaṃ sadātmānaṃ japaṃ pūjāñca bhaktitaḥ |	nivedya evam sat ātmānam japam pūjām ca bhaktitaḥ 
SA_MB_somasambhupaddhativyakhyaHK-1102	iti | japanivedanānantaraṃ karaṇīyānvidhatte arghyeti sārddhena |	iti japa nivedana anantaram karaṇīyān vidhatte arghya iti sārddhena 
SA_MB_somasambhupaddhativyakhyaHK-1103	athopasaṃhāraḥ samādhineti dvayena | atra samādhiḥ dhyātṛddhyānāvabhāsā	atha upasaṃhāraḥ samādhinā iti dvayena atra samādhiḥ dhyātṛ dhyāna avabhāsā 
SA_MB_somasambhupaddhativyakhyaHK-1104	vidhuraṃ dhyāpaikanirbhāsalakṣaṇañca caramayogāṅgam | taduktaṃ -	vidhuram dhyāpa eka nirbhāsa lakṣaṇam ca carama yoga aṅgam tat uktam 
SA_MB_somasambhupaddhativyakhyaHK-1105	p. 62)	p 
SA_MB_somasambhupaddhativyakhyaHK-1106	tadarthamātranirbhāsaṃ svarūpaṃ śūnyamiva samādhiriti	tad artha mātra nirbhāsam sva rūpam śūnyam iva samādhiḥ iti 
SA_MB_somasambhupaddhativyakhyaHK-1107	prāṇāyāmastapastattva tri prāṇāyāmaḥ parantapa	prāṇāyāmaḥ tapaḥ tattva prāṇāyāmaḥ parantapa 
SA_MB_somasambhupaddhativyakhyaHK-1108	iti śruteḥ |	iti śruteḥ 
SA_MB_somasambhupaddhativyakhyaHK-1109	pratyāhārasyāpi indriyanigrāhakatvaṃ taporūpamiti kecit | ddhyānaṃ	pratyāhārasya api indriya nigrāhaka tvam tapaḥ rūpam iti kecid 
SA_MB_somasambhupaddhativyakhyaHK-1110	pratyaikatānatā lakṣaṇaṃ | uktañca - tatra pratyekatānatā dhyānamiti	pratyaikatāna tā lakṣaṇam uktam ca tatra pratyeka tāna tā dhyānam iti 
SA_MB_somasambhupaddhativyakhyaHK-1111	dhāraṇahṛdādideśacittasambandhanaṃ | taduktaṃ -	dhāraṇa hṛd ādi deśa citta sambandhanam tat uktam 
SA_MB_somasambhupaddhativyakhyaHK-1112	deśabandhasya cittasya dhāraṇā	deśa bandhasya cittasya dhāraṇā 
SA_MB_somasambhupaddhativyakhyaHK-1113	iti | bhāvanā mānaso vyāpāraḥ japastu dhyeyasammukhīkaraṇārthaṃ	iti bhāvanā mānasaḥ vyāpāraḥ japaḥ tu dhyeya sammukhīkaraṇa artham 
SA_MB_somasambhupaddhativyakhyaHK-1114	tadvācakamantrabhāṣaṇaṃ | taduktaṃ śrīmanmṛgendre -	tad vācaka mantra bhāṣaṇam tat uktam śrīmat mṛgendre 
SA_MB_somasambhupaddhativyakhyaHK-1115	japastadbhāṣaṇadhyeyasaṃmukhīkaraṇam	japaḥ tad bhāṣaṇa dhyeya saṃmukhīkaraṇam 
SA_MB_somasambhupaddhativyakhyaHK-1116	iti | tathā anyatrāpi -	iti tathā anyatra api 
SA_MB_somasambhupaddhativyakhyaHK-1117	japena devatā nityasūryamānā prasīdati |	japena devatā nitya sūryamānā prasīdati 
SA_MB_somasambhupaddhativyakhyaHK-1118	prasannā vipulān bhogān dadyānmūrtiñca śāśvatīm ||	prasannā vipulān bhogān dadyāt mūrtiñca śāśvatīm 
SA_MB_somasambhupaddhativyakhyaHK-1119	iti |	iti 
SA_MB_somasambhupaddhativyakhyaHK-1120	p. 63)	p 
SA_MB_somasambhupaddhativyakhyaHK-1121	etaissādhanabhutairvakṣyamāṇādhikaraṇabhedena bahudhā yajanaṃ	etaiḥ sādhana bhutaiḥ vakṣyamāṇa adhikaraṇa bhedena bahudhā yajanam 
SA_MB_somasambhupaddhativyakhyaHK-1122	yathābhiṣṭamudāhṛtamityanvayaḥ |	yathā abhiṣṭam udāhṛtam iti anvayaḥ 
SA_MB_somasambhupaddhativyakhyaHK-1123	atra prāṇāyāmapratyāhāra dhāraṇānāṃ bhūtaśuddhyādāprayogaṃ	atra prāṇāyāma pratyāhāra dhāraṇānām 
SA_MB_somasambhupaddhativyakhyaHK-1124	dhyānasamādhyorantaryāge bahiryāge ca japasyāpi ubhayatra bhāvanayātmanaḥ	dhyāna samādhyoḥ antaryāge bahis yāge ca japasya api ubhayatra bhāvanayā ātmanaḥ 
SA_MB_somasambhupaddhativyakhyaHK-1125	śivabhāvanāya puṣpādi dravyāṇāṃ	śiva bhāvanāya puṣpa ādi dravyāṇām 
SA_MB_somasambhupaddhativyakhyaHK-1126	śaktimatāpādane citrādyākāreṇānucitānāṃ copacārāṇāṃ karaṇe ca	śaktimat āpādane citra ādi ākāreṇa anucitānām ca upacārāṇām karaṇe ca 
SA_MB_somasambhupaddhativyakhyaHK-1127	upayoga spaṣṭa eva pustake vidyāpīṭhe |	upayogaḥ spaṣṭaḥ eva pustake vidyāpīṭhe 
SA_MB_somasambhupaddhativyakhyaHK-1128	taduktaṃ -	tat uktam 
SA_MB_somasambhupaddhativyakhyaHK-1129	vidyāpīṭhe vimatvevaṃ ekoccāreṇa pūjayet |	vidyāpīṭhe eka uccāreṇa pūjayet 
SA_MB_somasambhupaddhativyakhyaHK-1130	iti |	iti 
SA_MB_somasambhupaddhativyakhyaHK-1131	vidyāpīṭhaṃ koṭimātraṃ pūjyedvāsya saṃhitāṃ |	vidyāpīṭham koṭi mātram pūjyet vā asya saṃhitām 
SA_MB_somasambhupaddhativyakhyaHK-1132	iti |	iti 
SA_MB_somasambhupaddhativyakhyaHK-1133	salile kuṃbhasye arghyapātrasthe cālane śivāgnau citrādau ārdragrahaṇāllipye	salile kuṃbha sye arghya pātra sthe cālane śiva agnau citra ādau ārdra grahaṇāt lipye 
SA_MB_somasambhupaddhativyakhyaHK-1134	anantavijayādimaṇḍale calaliṅge atyantamuttamaṃ | taduktaṃ ṣaṭ sahasrikāyāṃ	ananta vijaya ādi maṇḍale cala liṅge atyantam uttamam tat uktam ṣaṣ sahasrikāyām 
SA_MB_somasambhupaddhativyakhyaHK-1135	sarvatra saṃsthitaḥ pūjyaḥ sarvathā sarvadā * * |	sarvatra saṃsthitaḥ pūjyaḥ sarvathā sarvadā 
SA_MB_somasambhupaddhativyakhyaHK-1136	p. 64)	p 
SA_MB_somasambhupaddhativyakhyaHK-1137	tatrāpi liṅge bhagavān pūjāgrān gṛhnāti dhūrjaṭiḥ |	tatra api liṅge bhagavān pūjā agrān gṛhnāti dhūrjaṭiḥ 
SA_MB_somasambhupaddhativyakhyaHK-1138	asaṃpūrṇā kṛtā pūjā mantradravyaprayogataḥ ||	asaṃpūrṇā kṛtā pūjā mantra dravya prayogataḥ 
SA_MB_somasambhupaddhativyakhyaHK-1139	tathāpi liṅgapūrṇā tu pūjā bhavati ṣaṇmukha |	tathā api liṅga pūrṇā tu pūjā bhavati ṣaṇmukha 
SA_MB_somasambhupaddhativyakhyaHK-1140	na ca nyūnādhikā karyā pūjā vai sthaṇḍile suta ||	na ca nyūna adhikā karyā pūjā vai sthaṇḍile suta 
SA_MB_somasambhupaddhativyakhyaHK-1141	nyūnādhikā tu yā pūjā phalahīnā prakīrtitā |	nyūna adhikā tu yā pūjā phala hīnā prakīrtitā 
SA_MB_somasambhupaddhativyakhyaHK-1142	etasmātkāraṇādvatsa liṅgārādhanamārabhet ||	etasmāt kāraṇāt vatsa liṅga ārādhanam ārabhet 
SA_MB_somasambhupaddhativyakhyaHK-1143	iti	iti 
SA_MB_somasambhupaddhativyakhyaHK-1144	atra nijamūrtyādyanalāntātpañcādhikaraṇapūjā liṅgāt adhikaraṇapūjāyā	atra nija mūrti ādi anala antāt pañca adhikaraṇa pūjā liṅgāt adhikaraṇa pūjāyāḥ 
SA_MB_somasambhupaddhativyakhyaHK-1145	aṅgabhūtāḥ kvacit | pradhānastu tā vicitrādyadhikaraṇapūjā pradhānabhūto	aṅga bhūtāḥ kvacid tāḥ vicitra ādi adhikaraṇa pūjā 
SA_MB_somasambhupaddhativyakhyaHK-1146	vaikalpyeti | kecidvibhāgaḥ | evamuktāyāḥ śivapūjāyāḥ	vaikalpya iti kecid vibhāgaḥ evam uktāyāḥ śiva pūjāyāḥ 
SA_MB_somasambhupaddhativyakhyaHK-1147	visarjanavidhānavidhau agnikāryādhikāriṇā tatsamāptyanantarameva kāryamiti	visarjana vidhāna vidhau agni kārya adhikāriṇā tad samāpti anantaram eva kāryam iti 
SA_MB_somasambhupaddhativyakhyaHK-1148	jñāpanāyātheti | athāgnikāryārthaṃ tatsthānagamanavidhiḥ |	jñāpanāya atha iti atha agni kārya artham tad sthāna gamana vidhiḥ 
SA_MB_somasambhupaddhativyakhyaHK-1149	atheti dvayena atrādhikāriṇo vakṣyati | evaṃ samayadīkṣāyāṃ viśiṣṭāyāṃ	atha iti dvayena atra adhikāriṇaḥ vakṣyati evam samaya dīkṣāyām viśiṣṭāyām 
SA_MB_somasambhupaddhativyakhyaHK-1150	viśeṣaḥ -	viśeṣaḥ 
SA_MB_somasambhupaddhativyakhyaHK-1151	vahnihomāgamajñānayogyassañjāyate śiśuḥ |	vahni homa āgama jñāna yogyaḥ sañjāyate śiśuḥ 
SA_MB_somasambhupaddhativyakhyaHK-1152	p. 65)	p 
SA_MB_somasambhupaddhativyakhyaHK-1153	agniketanaṃ kuṇḍaṃ āgneyyāṃ diśyavasthitaṃ ||	agni ketanam kuṇḍam āgneyyām diśi avasthitam 
SA_MB_somasambhupaddhativyakhyaHK-1154	iti |	iti 
SA_MB_somasambhupaddhativyakhyaHK-1155	tadā layamiti kecit | taduktaṃ brahmaśambhupādaiḥ - prārthayedanalāśrayaṃ	tadā layam iti kecid tat uktam brahma śambhu pādaiḥ prārthayet anala āśrayam 
SA_MB_somasambhupaddhativyakhyaHK-1156	prāsādamānamāgneyyā..........ṭi dūre -	prāsāda mānam āgneyyā āṭi dūre 
SA_MB_somasambhupaddhativyakhyaHK-1157	maṇṭapāntare vāsarandhrakaiścidiṣyate ?	maṇṭapa antare vāsarandhrakaiḥ cit iṣyate 
SA_MB_somasambhupaddhativyakhyaHK-1158	iti | saṃ saṃbhāraṃ sopakaraṇaṃ kriyā viśeṣaṇametat | yogopakaraṇaṃ	iti sam saṃbhāram sa upakaraṇam kriyā viśeṣaṇam etat yoga upakaraṇam 
SA_MB_somasambhupaddhativyakhyaHK-1159	vāmasavyabhāgayo sthitaṃ | yadvakṣyati -	vāma savya bhāgayoḥ sthitam yat vakṣyati 
SA_MB_somasambhupaddhativyakhyaHK-1160	niviṣṭo vidhinā tasmin navyagandhaghṛtādikaṃ |	niviṣṭaḥ vidhinā tasmin navya gandha ghṛta ādikam 
SA_MB_somasambhupaddhativyakhyaHK-1161	vāme savye tu vinyasya samadarbhatilādikaṃ ||	vāme savye tu vinyasya sama darbha tila ādikam 
SA_MB_somasambhupaddhativyakhyaHK-1162	iti |	iti 
SA_MB_somasambhupaddhativyakhyaHK-1163	atha kuṇḍasaṃskāravidhiḥ ||	atha kuṇḍa saṃskāra vidhiḥ 
SA_MB_somasambhupaddhativyakhyaHK-1164	nirīkṣaṇamiti sārddhaiścaturbhiḥ | nirīkṣaṇantu divyadṛṣṭi nipātenetyuktaṃ |	nirīkṣaṇam iti sārddhaiḥ caturbhiḥ nirīkṣaṇam tu divya dṛṣṭi nipātena iti uktam 
SA_MB_somasambhupaddhativyakhyaHK-1165	pate ca cakṣuṣā sa prasādeneti prokṣaṇaṃ | sārghyajalenottānapādena	pate ca cakṣuṣā sa prasādena iti prokṣaṇam sa arghya jalena uttāna pādena 
SA_MB_somasambhupaddhativyakhyaHK-1166	patākākāreṇa hastatalena	patākā ākāreṇa hasta talena 
SA_MB_somasambhupaddhativyakhyaHK-1167	p. 66)	p 
SA_MB_somasambhupaddhativyakhyaHK-1168	abhyukṣaṇaṃ adhomukhena tena kuśairapi prokṣaṇābhyukṣaṇayorapi	abhyukṣaṇam adhomukhena tena kuśaiḥ api prokṣaṇa abhyukṣaṇayoḥ api 
SA_MB_somasambhupaddhativyakhyaHK-1169	sambandhanīyaṃ | pūraṇaṃ samatāmapītyapi śabdena khaḍgena kecittu	sambandhanīyam pūraṇam samatām api iti api śabdena khaḍgena kecid tu 
SA_MB_somasambhupaddhativyakhyaHK-1170	sarvātmanā samādāya punastenaiva pūrayediti snānaprakaraṇabaddhṛdayeneti |	sarva ātmanā samādāya punar tena eva pūrayet iti snāna prakaraṇa baddhṛdayena iti 
SA_MB_somasambhupaddhativyakhyaHK-1171	taduktaṃ jñānaratnāvalyāṃ -	tat uktam jñānaratnāvalyām 
SA_MB_somasambhupaddhativyakhyaHK-1172	huṃphaḍantāstreṇa khananoddhāraṇe hṛdayena pūraṇe samīkaraṇe | iti	huṃ phaṭ anta astreṇa khanana uddhāraṇe hṛdayena pūraṇe samīkaraṇe iti 
SA_MB_somasambhupaddhativyakhyaHK-1173	trisūtrīparidhānañca paridhānañca varmaṇetyatra	tri sūtrī paridhānam ca paridhānam ca varmaṇā iti atra 
SA_MB_somasambhupaddhativyakhyaHK-1174	cakārassaṃmārjanasamālepane samuccinoti | tathoktamatra kavacena	cakāraḥ saṃmārjana samālepane samuccinoti tathā uktam atra kavacena 
SA_MB_somasambhupaddhativyakhyaHK-1175	saṃmārjanopalepaneti | kalārūpaprakalpanantu samākhyābalaṃ nivṛtyādibhiriti	saṃmārjana upalepana iti kalā rūpa prakalpanam tu samākhyā balam nivṛti ādibhiḥ iti 
SA_MB_somasambhupaddhativyakhyaHK-1176	siddhaṃ | tāsāṃ viparyayaḥ tāsāṃ rekhāṇāṃ viparyāsaḥ prāṅmukhāḥ	siddham tāsām viparyayaḥ tāsām rekhāṇām viparyāsaḥ prāc mukhāḥ 
SA_MB_somasambhupaddhativyakhyaHK-1177	tisro rekhāḥ uttarānana caiketi yāvat | etatpūrvānana - kuṇḍaviṣaya iti kecit |	tisraḥ rekhāḥ uttarānana ca ekā iti yāvat etat pūrvānana kuṇḍa viṣayaḥ iti kecid 
SA_MB_somasambhupaddhativyakhyaHK-1178	vajrīkaraṇamastreṇa hṛdā darbhaiścatuṣpathamiti | atra vajrīkaraṇamubhayatra	vajrīkaraṇam astreṇa hṛdā darbhaiḥ catuṣpatham iti atra vajrīkaraṇam ubhayatra 
SA_MB_somasambhupaddhativyakhyaHK-1179	triśūlā - kṛtinā darbhatrayeṇa | catuṣpathantu pūrvottarāgrāvasthita	kṛtinā darbha trayeṇa 
SA_MB_somasambhupaddhativyakhyaHK-1180	darbhadvayena vidaddhyāt iti guravaḥ | evaṃ saṃskṛte kuṇḍe	darbha dvayena vidaddhyāt iti guravaḥ evam saṃskṛte kuṇḍe 
SA_MB_somasambhupaddhativyakhyaHK-1181	akṣapāṭanavinyāsapūrvaṃ vāgīśvarītyāvāhanaṃ vidadhāti |	akṣapāṭana vinyāsa pūrvam vāgīśvarī iti āvāhanam vidadhāti 
SA_MB_somasambhupaddhativyakhyaHK-1182	p. 67)	p 
SA_MB_somasambhupaddhativyakhyaHK-1183	akṣapāṭanamiti sārddhena akṣapāṭastiraskaraṇī | sā tatrāpi darbhairityanuvartate |	akṣapāṭanam iti sārddhena akṣapāṭaḥ tiraskaraṇī sā tatra api darbhaiḥ iti anuvartate 
SA_MB_somasambhupaddhativyakhyaHK-1184	akṣapāṭaṃ kuśaiḥ kaṇṭha iti | viṣṭaraṃ āsaṃ darbhakḷptaṃ | atha	akṣapāṭam kuśaiḥ kaṇṭhaḥ iti viṣṭaram āsam darbha kḷptam atha 
