segmentnr	original	analyzed
SA_T02_n691u-974	pañcānāmamṛtānāṃ samāhāraḥ pañcāmṛtam |	pañcānām amṛtānām samāhāraḥ pañcāmṛtam 
SA_T02_n691u-975	devatāyogena vicikitsārahitatvenāmṛtāsvādavidhinā cāsvādya sarvamannapānādikamamṛtaṃ bhavediti samudāyārthaḥ |	devatā yogena vicikitsā rahita tvena amṛta āsvāda vidhinā ca āsvādya sarvam anna pāna ādikam amṛtam bhavet iti samudāya arthaḥ 
SA_T02_n691u-976	kathametacchāśvatasiddhyāvāhakamityāha - sarvetyādi |	katham etat śāśvata siddhi āvāhakam iti āha sarva ityādi 
SA_T02_n691u-977	sarvalaukikalokottarāḥ siddhīḥ pravartayatīti tattathā || 13 ||	sarva laukika lokottarāḥ siddhīḥ pravartayati iti tat tathā 
SA_T02_n691u-978	catuṣpūjā tathā vīrā manasepsitayoginyaḥ |	catuṣpūjā tathā vīrāḥ manasā īpsita yoginyaḥ 
SA_T02_n691u-979	vīrādvayasamāpatti samāpannaṃ ca tattvadhṛk || 14 ||	vīrā dvaya samāpatti samāpannam ca 
SA_T02_n691u-980	uddeśanirdeśa piṇḍārthamāha - caturityādi |	uddeśa nirdeśa piṇḍa artham āha catur ityādi 
SA_T02_n691u-981	catastraḥ pūjāścatuṣpūjā ityasyārthaḥ,	catastraḥ pūjāḥ catuṣpūjāḥ iti asya arthaḥ 
SA_T02_n691u-982	bāhyaguhyamanomauasākṣādbhāvabhedena tā uktāḥ |	bāhya guhya manaḥ maua sākṣāt bhāva bhedena tāḥ uktāḥ 
SA_T02_n691u-983	ata āha - tatheti |	atas āha tathā iti 
SA_T02_n691u-984	“ madhyam “ ityādinā prakāreṇa nirdiṣṭā ityarthaḥ |	            
SA_T02_n691u-985	yoginya iti ḍākinyādayaścatastraḥ kākāsyādayo'ṣṭau ca |	yoginyaḥ iti ḍākinī ādayaḥ catastraḥ kākāsya ādayaḥ uṣṭau ca 
SA_T02_n691u-986	vīrairadvayena rupeṇa samāpattiryāsāṃ tā vīrādvayasamāpattiśabdārthaḥ,	vīraiḥ advayena rupeṇa samāpattiḥ yāsām tāḥ vīra advaya samāpatti śabda arthaḥ 
SA_T02_n691u-987	vibhaktilopāt |	vibhakti lopāt 
SA_T02_n691u-988	samāpannaṃ yathā bhavati tathā |	samāpannam yathā bhavati tathā 
SA_T02_n691u-989	tattvaṃ vajravārāhyabhinnaṃ svabhāvaṃ dhārayatīti tattvadhṛk |	tattvam vajra vārāhī abhinnam svabhāvam dhārayati iti tattva dhṛk 
SA_T02_n691u-990	tukastakāreṇa kakāre caṇaḥ |	tukaḥ takāreṇa kakāre ca ṇaḥ 
SA_T02_n691u-991	śrīherukasaṃyoga iti sa uddiṣṭaḥ || 14 ||	śrīheruka saṃyogaḥ iti saḥ uddiṣṭaḥ 
SA_T02_n691u-992	divyamānuṣyatāsaukhyaṃ piṇḍīkṛtya tadeva ca |	divya mānuṣya tā saukhyam piṇḍīkṛtya tat eva ca 
SA_T02_n691u-993	tadeva vajrakaṇikayā kalāṃ nārghanti ṣoḍaśīm || 15 ||	tat eva vajra kaṇikayā kalām ṣoḍaśīm 
SA_T02_n691u-994	divi bhavaṃ divyam ,	divi bhavam divyam 
SA_T02_n691u-995	tacca sukham ,	tat ca sukham 
SA_T02_n691u-996	mānuṣyamasyāstīti prakṛtirmānuṣyatā,	mānuṣyam asya asti iti prakṛtiḥ mānuṣya tā 
SA_T02_n691u-997	sā ca sukhasvabhāve'dvaye sati siddhā |	sā ca sukha svabhāve dvaye sati siddhā 
SA_T02_n691u-998	kathaṃ sukhaṃ labhyata ityāha - saukhyamiti |	katham sukham labhyate iti āha saukhyam iti 
SA_T02_n691u-999	sukhaṃ cetasaḥ sausthityaṃ tadeva saukhyam ,	sukham cetasaḥ sausthityam tat eva saukhyam 
SA_T02_n691u-1000	tacca narakapretatiryaggatigānāṃ sāmānyam |	tat ca naraka preta tiryaggati gānām sāmānyam 
SA_T02_n691u-1001	piṇḍamabhinnam |	piṇḍam abhinnam 
SA_T02_n691u-1002	vajraṃ nirmalā buddhiḥ,	vajram nirmalā buddhiḥ 
SA_T02_n691u-1003	tadeva kaṇikā sūkṣmatvāt |	tat eva kaṇikā sūkṣma tvāt 
SA_T02_n691u-1004	vajraṃ ca kaṇikā ceti vajrakaṇikā,	vajram ca kaṇikā ca iti vajrakaṇikā 
SA_T02_n691u-1005	sahajaṃ jñānamityarthaḥ |	sahajam jñānam iti arthaḥ 
SA_T02_n691u-1006	divyaṃ mānuṣyatāṃ saukhyaṃ cābhinnīkṛtya sthitayā karaṇabhūtayā vajrakaṇikayā ṣoḍaśīṃ kalāmapi nārghanti na pūjayanti ,	divyam mānuṣya tām saukhyam ca a bhinnīkṛtya sthitayā karaṇa bhūtayā vajra kaṇikayā ṣoḍaśīm kalām api na arghanti na pūjayanti 
SA_T02_n691u-1007	kleśā iti śeṣaḥ |	kleśāḥ iti śeṣaḥ 
SA_T02_n691u-1008	asyopāyasya kleśavijayasādhyatvād yathā tathetyuddiṣṭasya piṇḍatvena nirdeśaḥ || 15 ||	asya upāyasya kleśa vijaya sādhya tvāt yathā tathā iti uddiṣṭasya piṇḍa tvena nirdeśaḥ 
SA_T02_n691u-1009	girigahvarakuiñjeṣu mahodadhitaṭeṣu vā |	giri gahvara kuiñjeṣu mahā udadhi taṭeṣu vā 
SA_T02_n691u-1010	ādisiddhe śmaśāne ca tat maṇḍalamālikhet || 16 ||	ādi siddhe śmaśāne ca tat maṇḍalam ālikhet 
SA_T02_n691u-1011	iti herukābhidhāne maṇḍalāvatāra[ vidhi ]paṭalaḥ prathamaḥ || 1 ||	iti heruka abhidhāne maṇḍalāvatāra vidhi paṭalaḥ prathamaḥ  /
SA_T02_n691u-1012	abhiṣekamantareṇa na siddhiḥ |	abhiṣekam antareṇa na siddhiḥ 
SA_T02_n691u-1013	sa ca maṇḍalapraveśaṃ vinā nāstītyāha - girītyādi |	sa ca maṇḍala praveśam vinā na asti iti āha giri ityādi 
SA_T02_n691u-1014	giriḥ parvataḥ |	giriḥ parvataḥ 
SA_T02_n691u-1015	gahvaraśabdena tadbhittidvayāntaram |	gahvara śabdena tad bhitti dvaya antaram 
SA_T02_n691u-1016	kuñjaśabdena latādipihitaḥ pradeśaḥ |	kuñja śabdena latā ādi pihitaḥ pradeśaḥ 
SA_T02_n691u-1017	mahodadhitaṭā dvīpāḥ |	mahā udadhi taṭāḥ dvīpāḥ 
SA_T02_n691u-1018	ādisiddha iti |	ādi siddhaḥ iti 
SA_T02_n691u-1019	ādau siddhā yatra pradeśe sa tathā |	ādau siddhāḥ yatra pradeśe sa tathā 
SA_T02_n691u-1020	śmaśānaṃ śavanilayaḥ |	śmaśānam śava nilayaḥ 
SA_T02_n691u-1021	tatreti nimittasaptamīyam |	tatra iti nimitta saptamīyam 
SA_T02_n691u-1022	abhiṣekārthaṃ maṇḍalamālikhediti || 16 ||	abhiṣeka artham maṇḍalam ālikhet iti 
SA_T02_n691u-1023	itiśabdaḥ paṭalārthasamāptau |	iti śabdaḥ paṭala artha samāptau 
SA_T02_n691u-1024	śrīherukasya sāṅgopāṅgasyābhidhīyate'nenetyabhidhānaṃ tantraṃ śabdaśarīram |	śrīherukasya sa aṅga upāṅgasya abhidhīyate enena iti abhidhānam tantram śabda śarīram 
SA_T02_n691u-1025	tatra maṇḍalāvatāravidhipaṭalaḥ |	tatra maṇḍala avatāra vidhi paṭalaḥ 
SA_T02_n691u-1026	avataratyanenetyavatāraḥ,	avatarati anena iti avatāraḥ 
SA_T02_n691u-1027	sa eva vidhīyata iti vidhiḥ śrīherukādimaṇḍalāvatāravidhiḥ,	saḥ eva vidhīyate iti vidhiḥ śrīheruka ādi maṇḍala avatāra vidhiḥ 
SA_T02_n691u-1028	tadabhidhāyakaḥ paṭalo granthaparicchedaḥ prathama ekaḥ |	tad abhidhāyakaḥ paṭalaḥ grantha paricchedaḥ prathamaḥ ekaḥ 
SA_T02_n691u-1029	iti śrīcakrasaṃvaravivṛtau prathamaḥ paṭalaḥ || 1 ||	iti śrī cakrasaṃvara vivṛtau prathamaḥ paṭalaḥ 
SA_T02_n691u-1030	cakrapūjāvidhipaṭalo dvitīyaḥ	cakra pūjā vidhi paṭalaḥ dvitīyaḥ 
SA_T02_n691u-1031	tatrāpātagomayena maṇḍalabhūmiṃ pralepayet |	tatra āpāta gomayena maṇḍala bhūmim pralepayet 
SA_T02_n691u-1032	śmaśānabhasmanā yuktaṃ pañcāmṛtasamanvitam || 1 ||	śmaśāna bhasmanā yuktam pañcāmṛta samanvitam 
SA_T02_n691u-1033	maṇḍalamāha - tatretyādi |	maṇḍalam āha tatra ityādi 
SA_T02_n691u-1034	yasmin karmaṇi vidyante na karmavidhayaḥ svakāḥ |	yasmin karmaṇi vidyante na karma vidhayaḥ svakāḥ 
SA_T02_n691u-1035	tatra sāmānyatantrokto vidhirāśrīyate budhaiḥ ||	tatra sāmānya tantra uktaḥ vidhiḥ āśrīyate budhaiḥ 
SA_T02_n691u-1036	iti sāmānyatantrokto nyāyaḥ |	iti sāmānya tantra uktaḥ nyāyaḥ 
SA_T02_n691u-1037	iha tu kaścit sādhāraṇo vidhirukta iti,	iha tu kaścid sādhāraṇaḥ vidhiḥ uktaḥ iti 
SA_T02_n691u-1038	tatretyādināha - tatreti |	tatra ityādinā āha tatra iti 
SA_T02_n691u-1039	maṇḍalavartanārthamapātagomayena vairocanena girigahvarādiṣu maṇḍalārthaṃ bhūmiṃ maṇḍalabhūmiṃ sthānamupalepayet ,	maṇḍala vartana artham apāta gomayena vairocanena giri gahvara ādiṣu maṇḍala artham bhūmim maṇḍala bhūmim sthānam upalepayet 
SA_T02_n691u-1040	śiṣyeṇācāryaḥ |	śiṣyeṇa ācāryaḥ 
SA_T02_n691u-1041	punastadupari śmaśānabhasmādinā lepayedityāha - śmaśānabhasmanā yuktaṃ pañcāmṛtasamanvitaṃ ca yathā syāt tathā || 1 ||	punar tad upari śmaśāna bhasma ādinā lepayet iti āha śmaśāna bhasmanā yuktam pañcāmṛta samanvitam ca yathā syāt tathā 
SA_T02_n691u-1042	upalipya tato bhūmiṃ tatra maṇḍalamārabhet |	upalipya tatas bhūmim tatra maṇḍalam ārabhet 
SA_T02_n691u-1043	[ tatastadbhāvanāṃ kṛtvā ] śmaśānaṃ tu samācaret || 2 ||	tatas tad bhāvanām kṛtvā śmaśānam tu samācaret 
SA_T02_n691u-1044	apātagomayalepānantaraṃ bhūmimupalipya maṇḍalamārabheditisambandhaḥ |	apāta gomaya lepa anantaram bhūmim upalipya maṇḍalam ārabhet iti sambandhaḥ 
SA_T02_n691u-1045	apātagomayalepānantaraṃ śmaśānabhasmādilepaḥ |	apāta gomaya lepa anantaram śmaśāna bhasma ādi lepaḥ 
SA_T02_n691u-1046	tathāpi kuto'nantaraṃ maṇḍalārambha ityāha - tata iti |	tathā api kutas unantaram maṇḍala ārambhaḥ iti āha tatas iti 
SA_T02_n691u-1047	rakṣācakrādyanantaram |	rakṣā cakra ādi anantaram 
SA_T02_n691u-1048	śmaśānaṃ tu samācarediti |	śmaśānam tu samācaret iti 
SA_T02_n691u-1049	śmaśānāderanyatra yadi maṇḍalavartanaṃ tadā tatra śmaśānaṃ bhāvayediti bhāvaḥ || 2 ||	śmaśāna ādeḥ anyatra yadi maṇḍala vartanam tadā tatra śmaśānam bhāvayet iti bhāvaḥ  /
SA_T02_n691u-1050	cityaṅgāracūrṇena śmaśāneṣṭakasaṃyutam |	            
SA_T02_n691u-1051	ālikhenmaṇḍalaṃ divyamācāryaḥ sarvalakṣaṇam || 3 ||	ālikhet maṇḍalam divyam ācāryaḥ sarva lakṣaṇam 
SA_T02_n691u-1052	raja āha- cityaṅgāretyādi |	rajaḥ āha citi aṅgāra ityādi 
SA_T02_n691u-1053	śmaśāneṣṭakamiti |	śmaśāneṣṭakam iti 
SA_T02_n691u-1054	citiḥ mṛttikā śmaśāneṣṭakābhāvanayāpi tatsampādanam |	                    
SA_T02_n691u-1055	cityaṅgāraśmaśāneṣṭakarajasā śmaśānamārabhediti kecit |	citi aṅgāra śmaśāna iṣṭaka rajasā śmaśānam ārabhet iti kecid 
SA_T02_n691u-1056	iṣṭakāyāṃ hrasvatvam |	iṣṭakāyām hrasva tvam 
SA_T02_n691u-1057	kṛṣṇaṃ pītañca rajodvayam |	kṛṣṇam pītam ca rajaḥ dvayam 
SA_T02_n691u-1058	asarvajanagocaratvāddivyam | ācārya iti -	a sarva jana gocara tvāt divyam ācāryaḥ iti 
SA_T02_n691u-1059	saddharmādhyāpako yaśca vyākhyātā copadeśadaḥ |	saddharma adhyāpakaḥ yaḥ ca vyākhyātā ca upadeśa daḥ 
SA_T02_n691u-1060	abhiṣektā karmakartā cānyaḥ( cācāryaḥ )	abhiṣektā karma kartā ca anyaḥ ca ācāryaḥ 
SA_T02_n691u-1061	sadudāhṛtaḥ ||	sat udāhṛtaḥ 
SA_T02_n691u-1062	ityuktalakṣaṇaḥ |	iti ukta lakṣaṇaḥ 
SA_T02_n691u-1063	viśeṣeṇa gurureva |	viśeṣeṇa guruḥ eva 
SA_T02_n691u-1064	“ gururācāryaśabdena paṇḍitaiḥ parigadyate “ iti yāvat |	guruḥ ācārya śabdena paṇḍitaiḥ parigadyate iti yāvat 
SA_T02_n691u-1065	idaṃ cābhiṣekārthaṃ puṇyatvaṃ vā |	idam ca abhiṣeka artham puṇya tvam vā 
SA_T02_n691u-1066	yadi maṇḍalavartanaṃ siddhyarthaṃ cedālikhed yogī |	yadi maṇḍala vartanam siddhi artham ced ālikhet yogī 
SA_T02_n691u-1067	sa ca suṣṭhu sarvalakṣaṇam || 3 ||	sa ca suṣṭhu sarva lakṣaṇam 
SA_T02_n691u-1068	samyagjñāna tantrajñaḥ śrīheruka guhyamantravit |	           
SA_T02_n691u-1069	akrodhaśca śucirdakṣo yogajño jñānapāragaḥ || 4 ||	akrodhaḥ ca śuciḥ dakṣaḥ yoga jñaḥ jñāna pāragaḥ 
SA_T02_n691u-1070	viśeṣaṇadvāreṇa lakṣaṇamāha - samyagityādi |	viśeṣaṇa dvāreṇa lakṣaṇam āha samyak ityādi 
SA_T02_n691u-1071	samyagaviparītaṃ grāhyādirahitaṃ jñānamasyeti samyagjñānaḥ |	samyak aviparītam grāhya ādi rahitam jñānam asya iti samyagjñānaḥ 
SA_T02_n691u-1072	sa cāsau saṃvarāditantrajñaśceti samyagjñānatantrajñaḥ |	sa ca asau saṃvara ādi tantra jñaḥ ca iti samyak jñāna tantra jñaḥ 
SA_T02_n691u-1073	śrīherukamantrajña iti |	śrīheruka mantra jñaḥ iti 
SA_T02_n691u-1074	śrīherukaścāṣṭapadādayo mantrāśca,	śrīherukaḥ ca aṣṭa pada ādayaḥ mantrāḥ ca 
SA_T02_n691u-1075	tān yathopadeśaṃ jānātīti sa, tathā |	tān yathopadeśam jānāti iti sa tathā 
SA_T02_n691u-1076	śrīherukasya satatamantrajāpī vā |	śrī herukasya satata mantra jāpī vā 
SA_T02_n691u-1077	vartamānamapakāramārgasya cetasa ādhyātaḥ krodhaḥ,	vartamānam apakāra mārgasya cetasaḥ ādhyātaḥ krodhaḥ 
SA_T02_n691u-1078	tadabhāvādakrodhaḥ |	tad abhāvāt akrodhaḥ 
SA_T02_n691u-1079	śuciriti kaukṛtyamalarahitaḥ |	śuciḥ iti kaukṛtya mala rahitaḥ 
SA_T02_n691u-1080	dakṣaḥ kuśalotsāhī |	dakṣaḥ kuśala utsāhī 
SA_T02_n691u-1081	yogaḥ śāntikādistasya pāraḥ paryantastadgatavāniti yogapāragaḥ || 4 ||	yogaḥ śāntika ādiḥ tasya pāraḥ paryantaḥ tat gatavān iti yogapāragaḥ 
SA_T02_n691u-1082	kapālakṛtamūrdhajo [ bhasmānuliptāṅgakaḥ ] sambhavān mātrairvibhūṣitagātraḥ,	kapāla kṛta mūrdhajaḥ bhasma anulipta aṅgakaḥ sambhavāt mātraiḥ vibhūṣita gātraḥ 
SA_T02_n691u-1083	asthi malāsthisaṃsthitaśca ekakhaṇḍīkṛtamūrdhajaḥ || 5 ||	asthi mala asthi saṃsthitaḥ ca eka khaṇḍīkṛta mūrdhajaḥ 
SA_T02_n691u-1084	kapālaiḥ pañcabhiḥ kṛtaṃ śekharaṃ yena sa kapālakṛtamūrdhajaḥ |	kapālaiḥ pañcabhiḥ kṛtam śekharam yena sa kapāla kṛta mūrdhajaḥ 
SA_T02_n691u-1085	bhasmanā śmaśānikena cānubandhikenāniliptamaṅgaṃ yena sa bhasmānuliptāṅgaḥ |	bhasmanā śmaśānikena ca anubandhikena a niliptam aṅgam yena sa bhasma anulipta aṅgaḥ 
SA_T02_n691u-1086	saṃbhavānmātrairvibhūṣitagātrasthitiḥ |	saṃbhavāt mātraiḥ vibhūṣita gātra sthitiḥ 
SA_T02_n691u-1087	vidyamānatvānniraṃśukaiḥ viśeṣeṇa bhūṣitaṃ gātraṃ yena sa tathā |	vidyamāna tvāt niraṃśukaiḥ viśeṣeṇa bhūṣitam gātram yena sa tathā 
SA_T02_n691u-1088	asthīti malanta iti asthimalāḥ sattvāḥ,	asthi iti malantaḥ iti asthi malāḥ sattvāḥ 
SA_T02_n691u-1089	teṣāmasthīti teṣu saṃsthita upaviṣṭaḥ |	teṣām asthi iti teṣu saṃsthitaḥ upaviṣṭaḥ 
SA_T02_n691u-1090	kiñca sambhavānmātraśabdena ratnasambhavamiśro'mitābha ucyate,	kiñca sambhavāt mātra śabdena ratna sambhava miśra umita ābhaḥ ucyate 
SA_T02_n691u-1091	tena kṛtāṅgarāga iti kecit |	tena kṛta aṅgarāgaḥ iti kecid 
SA_T02_n691u-1092	tatrāsthītyādinā ābharaṇamevocyate |	tatra asthi ityādinā ābharaṇam eva ucyate 
SA_T02_n691u-1093	ekakhaṇḍīkṛtamūrdhaja iti |	eka khaṇḍīkṛta mūrdhajaḥ iti 
SA_T02_n691u-1094	khaṇḍaḥ pradeśaḥ |	khaṇḍaḥ pradeśaḥ 
SA_T02_n691u-1095	ekaḥ khaṇḍo yeṣāṃ te tathā |	ekaḥ khaṇḍaḥ yeṣām te tathā 
SA_T02_n691u-1096	ekakhaṇḍīkṛtā mūrdhajā yena sa tathā |	eka khaṇḍīkṛtāḥ mūrdhajāḥ yena sa tathā 
SA_T02_n691u-1097	anyakeśakṛtamukuṭa ityarthaḥ || 5 ||	anya keśa kṛta mukuṭaḥ iti arthaḥ 
SA_T02_n691u-1098	asthimālāvalambī ca khaṭvāṅgakarasaṃsthitaḥ |	asthi mālā avalambī ca khaṭvāṅga kara saṃsthitaḥ 
SA_T02_n691u-1099	ātmānaṃ śrīherukaṃ dhyātvā śrīherukaṃ tataḥ smaret || 6 ||	ātmānam śrīherukam dhyātvā śrīherukam tatas smaret  /
SA_T02_n691u-1100	asthimālāyā avalambo yajñopavītaṃ so'syāstītyasthimālāvalambī |	asthi mālāyāḥ avalambaḥ yajñopavītam saḥ usya asti iti asthi mālā avalambī 
SA_T02_n691u-1101	cakāraḥ samuccaye |	cakāraḥ samuccaye 
SA_T02_n691u-1102	khaṭvāṅgadhāriṇā vāmena kareṇa samyak sthita iti khaṭvāṅgakarasaṃsthitaḥ |	khaṭvāṅga dhāriṇā vāmena kareṇa samyak sthitaḥ iti khaṭvāṅga kara saṃsthitaḥ 
SA_T02_n691u-1103	ityābharaṇādidvāreṇa viśeṣeṇa jātam |	iti ābharaṇa ādi dvāreṇa viśeṣeṇa jātam 
SA_T02_n691u-1104	evaṃbhūto yathopadeśaṃ samāṇḍaleyadaivata śrīherukamātmānaṃ dhyātvā śrīherukaṃ smaret || 6 ||	evaṃbhūtaḥ yathopadeśam śrīherukam ātmānam dhyātvā śrīherukam smaret  /
SA_T02_n691u-1105	[ evaṃ pradarśya samayaṃ ] cakramasya hṛdi nyasey |	evam pradarśya samayam cakram asya hṛdi nyaset 
SA_T02_n691u-1106	evaṃ sannahyamātmānaṃ prākāraṃ dikṣu bhāvayet || 7 ||	evam san ahyam ātmānam prākāram dikṣu bhāvayet 
SA_T02_n691u-1107	evamiti | samāṇḍaleyadaivataṃ śrīherukaṃ jñānātmakaṃ tādṛśaṃ samayaṃ śrīheruke pradarśayet |	evam iti samāṇḍaleya daivatam śrīherukam jñāna ātmakam tādṛśam samayam śrīheruke pradarśayet 
SA_T02_n691u-1108	cakramasya hṛdi nyasediti |	cakram asya hṛdi nyaset iti 
SA_T02_n691u-1109	asyeti herukībhūtasyātmanaḥ |	asya iti herukībhūtasya ātmanaḥ 
SA_T02_n691u-1110	hṛdi kāye |	hṛdi kāye 
SA_T02_n691u-1111	tato'yamarthaḥ- pracaṇḍādidevīḥ khaṇḍakapālādīṃśca vīrān svakāye pullīramalayādaunakhadantādau ca nyasediti |	tatas yam arthaḥ pracaṇḍa ādi devīḥ khaṇḍa kapāla ādīn ca vīrān sva kāye pullīḥ amalaya ādau nakha danta ādau ca nyaset iti 
SA_T02_n691u-1112	asatirgatyartho bhauvādikaḥ |	asatiḥ gati arthaḥ bhauvādikaḥ 
SA_T02_n691u-1113	evaṃ saṃnehyeti |	evam saṃnehya iti 
SA_T02_n691u-1114	ātmānaṃ śrīherukaṃ kṛtvā vartitavyasya rajomaṇḍalasya bahiḥ prāgeva prākāraṃ dikṣu bhāvayet |	ātmānam śrīherukam kṛtvā vartitavyasya rajaḥ maṇḍalasya bahis prāk eva prākāram dikṣu bhāvayet 
SA_T02_n691u-1115	manute jñānamātrībhavatītiu niruktavidhinā makāro hal |	manute jñāna mātrībhavati iti u nirukta vidhinā makāraḥ ha l 
SA_T02_n691u-1116	etadātmano viśeṣaṇam |	etat ātmanaḥ viśeṣaṇam 
SA_T02_n691u-1117	jñānamātramātmānaṃ śrīherukīkṛtyetyarthaḥ |	jñānamātram ātmānam śrīherukīkṛtya iti arthaḥ 
SA_T02_n691u-1118	paramārthato jñānamātramevedamiti bhāvaḥ || 7 ||	paramārthataḥ jñāna mātram eva idam iti bhāvaḥ 
SA_T02_n691u-1119	evaṃ sannahyamātmānamadho hyastraṃ viniveśayet |	evam san ahyam ātmānam adhas hi astram viniveśayet 
SA_T02_n691u-1120	cakrasya samamātmānamūrdhvaṃ tu śarajālakam || 8 ||	cakrasya samam ātmānam ūrdhvam tu śara jālakam 
SA_T02_n691u-1121	śrīherukameva kathaṃ bhāvayedityāha - evaṃ saṃnahyamātmānamiti |	śrīherukam eva katham bhāvayet iti āha evam saṃnahyam ātmānam iti 
SA_T02_n691u-1122	makāraḥ pūrvavam |	makāraḥ pūrvavam 
SA_T02_n691u-1123	skandhādiśuddhyādinā''tmānaṃ labdhārambhaṃ kṛtvā śrīherukam ,	skandha ādi śuddhi ādinā ātmānam labdha ārambham kṛtvā śrīherukam 
SA_T02_n691u-1124	viniveśayediti kriyā |	viniveśayet iti kriyā 
SA_T02_n691u-1125	adho hyastramiti |	adhas hi astram iti 
SA_T02_n691u-1126	adho hyastramapi viniveśayet |	adhas hi astram api viniveśayet 
SA_T02_n691u-1127	ūrdhvaṃ śarajālakaṃ cakrasya |	ūrdhvam śara jālakam cakrasya 
SA_T02_n691u-1128	tataḥ samāṇḍaleyadevatāṃ śrīherukaṃ niveśayet || 8 ||	tatas sa māṇḍaleya devatām śrīherukam niveśayet  /
SA_T02_n691u-1129	ātmanaḥ khecaraṃ pañjaraṃ kṛtvā''tmānaṃ susamāhitaḥ |	ātmanaḥ khecaram pañjaram kṛtvā ātmānam su samāhitaḥ 
SA_T02_n691u-1130	evaṃ sannahya sakavacamabhedyastridaśairapi || 9 ||	evam san ahya sa kavacam abhedyaḥ tridaśaiḥ api 
SA_T02_n691u-1131	ātmana upari khecaraṃ vajraṃ tanmayaṃ pañjaraṃ ca kṛtvā śrīherukaṃ niveśayediti sambandhaḥ |	ātmanaḥ upari khecaram vajram tad mayam pañjaram ca kṛtvā śrīherukam niveśayet iti sambandhaḥ 
SA_T02_n691u-1132	sakavacatvaṃ ca śrīherukaniṣpattau ṣaḍvīrādimantrakavacavidhiḥ || 9 ||	sa kavaca tvam ca śrī heruka niṣpattau ṣaḍvīra ādi mantra kavaca vidhiḥ 
SA_T02_n691u-1133	evaṃ surakṣātmānaṃ mudrāmantrairalaṅkṛtam |	evam su rakṣā ātmānam mudrā mantraiḥ alaṅkṛtam 
SA_T02_n691u-1134	ālikhenmaṇḍalaṃ ghoraṃ mahāsiddhipradāyakam || 10 ||	ālikhet maṇḍalam ghoram mahā siddhi pradāyakam 
SA_T02_n691u-1135	evaṃ surakṣamātmānamiti |	evam su rakṣam ātmānam iti 
SA_T02_n691u-1136	nairukto makāraḥ |	nairuktaḥ makāraḥ 
SA_T02_n691u-1137	pūrvavat |	pūrvavat 
SA_T02_n691u-1138	mudrā vajravārāhī |	mudrā vajravārāhī 
SA_T02_n691u-1139	mantrā mūlamantrādayaḥ |	mantrāḥ mūlamantra ādayaḥ 
SA_T02_n691u-1140	athavā mudrā cihnamudrā |	athavā mudrā cihna mudrā 
SA_T02_n691u-1141	mantrāḥ karakarādimantrasya om kara - kara hū hū phaṭ phaḍityādayo vibhaktāvayavāḥ |	mantrāḥ kara kara ādi mantrasya om kara kara hū hū phaṭ phaṭ ityādayaḥ vibhakta avayavāḥ 
SA_T02_n691u-1142	evamātmānaṃ surakṣāmaṇḍalamālikhediti sambandhaḥ |	evam ātmānam su rakṣā maṇḍalam ālikhet iti sambandhaḥ 
SA_T02_n691u-1143	śrutismṛtyādivyavahāravimukhatvād ghoram |	śruti smṛti ādi vyavahāra vimukha tvāt ghoram 
SA_T02_n691u-1144	mahetyādinā siddhyarthamapi maṇḍalaṃ vartayediti darśayati |	mahā ityādinā siddhi artham api maṇḍalam vartayet iti darśayati 
SA_T02_n691u-1145	pūrvoktena vidhinā sādaranirantarabhāvanāparyantena maṇḍalapūrvakamahorātreṇa jāpādinā siddhiṃ sādhayediti bhāvaḥ || 10 ||	pūrva uktena vidhinā sādara nirantara bhāvanā paryantena maṇḍala pūrvakam ahorātreṇa jāpa ādinā siddhim sādhayet iti bhāvaḥ  /
SA_T02_n691u-1146	tato mṛtakasūtreṇa mahārudhi rārcitena vā |	tatas mṛtaka sūtreṇa mahārudhi ra arcitena vā 
SA_T02_n691u-1147	sūtrayenmaṇḍalaṃ ghoraṃ herukasya paraṃ puram || 11 ||	sūtrayet maṇḍalam ghoram herukasya param puram 
SA_T02_n691u-1148	ekahastaṃ caturaṣṭaṃ caturastraṃ samantataḥ |	eka hastam catur aṣṭam catur astram samantataḥ 
SA_T02_n691u-1149	caturdvārasamākīrṇaṃ catustoraṇabhūṣitam || 12 ||	catur dvāra samākīrṇam catur toraṇa bhūṣitam 
SA_T02_n691u-1150	ghoratvanimittamāha - tata ityādi |	ghora tva nimittam āha tatas ityādi 
SA_T02_n691u-1151	pāna( apāta )gomayalepavajrapañjarādyanantaram |	gomaya lepa vajra pañjara ādi anantaram 
SA_T02_n691u-1152	mahārudhirārcitena veti |	mahārudhira arcitena vā iti 
SA_T02_n691u-1153	mṛtakakhaṭvāṅgaveṣṭitasvabhāvatvāt |	mṛtaka khaṭvāṅga veṣṭita svabhāva tvāt 
SA_T02_n691u-1154	ghoramiti |	ghoram iti 
SA_T02_n691u-1155	śmaśānaparivṛtatvāt |	śmaśāna parivṛta tvāt 
SA_T02_n691u-1156	śrīherukaśabdārthavivṛtyā maṇḍalanairātmyadarśanādbālānāṃ bhayajanakatvād vā |	śrīheruka śabda artha vivṛtyā maṇḍala nairātmya darśanāt bālānām bhaya janaka tvāt vā 
SA_T02_n691u-1157	pāṃ puramiti |	pām puram iti 
SA_T02_n691u-1158	śrīherukasya nijatvāt |	śrīherukasya nija tvāt 
SA_T02_n691u-1159	caturaṣṭaṃ ceti |	catuḥ aṣṭam ca iti 
SA_T02_n691u-1160	catvāro'ṣtau vā hastāḥ parimāṇamasyeti tattathā |	catvāraḥ ūṣtau vā hastāḥ parimāṇam asya iti tat tathā 
SA_T02_n691u-1161	śeṣaṃ sugamam || 11-12 ||	śeṣam sugamam 
SA_T02_n691u-1162	vicared dviguṇaṃ mantrī pūjayed ḍākinījālasaṃvaram |	vicaret dviguṇam mantrī pūjayet ḍākinī jāla saṃvaram 
SA_T02_n691u-1163	tasya madhye padyaṃ pratiṣṭhāpya sapatraṃ karṇikojjvalam ||	tasya madhye padyam pratiṣṭhāpya sa patram karṇikā ujjvalam 
SA_T02_n691u-1164	puṣkaraiśca kesarānvitam || 13 ||	puṣkaraiḥ ca kesara anvitam 
SA_T02_n691u-1165	vicared dviguṇamiti |	vicaret dviguṇam iti 
SA_T02_n691u-1166	dvihastamaṣṭahastaṃ ṣoḍaśahastaṃ ceti |	dvi hastam aṣṭa hastam ṣoḍaśa hastam ca iti 
SA_T02_n691u-1167	sutrasya viśeṣaṇamidam |	sutrasya viśeṣaṇam idam 
SA_T02_n691u-1168	cakradviguṇatvaṃ sūtrasyeti pratipāditam |	cakra dviguṇa tvam sūtrasya iti pratipāditam 
SA_T02_n691u-1169	mantrīti japtavidyaḥ |	mantrī iti japta vidyaḥ 
SA_T02_n691u-1170	tasya maṇdalasya madhye ḍākinījālasaṃvaraṃ pūjayedityarthaḥ |	tasya maṇdalasya madhye ḍākinī jāla saṃvaram pūjayet iti arthaḥ 
SA_T02_n691u-1171	kiṃ kṛtvetyāha - pratiṣṭhāpyetyādi |	kim kṛtvā iti āha pratiṣṭhāpya ityādi 
SA_T02_n691u-1172	saha viśvavarṇaiḥ patrairvartata iti sapatram |	saha viśva varṇaiḥ patraiḥ vartate iti sa patram 
SA_T02_n691u-1173	kiṃ tadityāha - karṇikojjvalamiti |	kim tat iti āha karṇikā ujjvalam iti 
SA_T02_n691u-1174	iyaṃ viśvapadyasya saṃjñā |	iyam viśvapadyasya saṃjñā 
SA_T02_n691u-1175	puṣkarairbījakośairlakṣitam |	puṣkaraiḥ bīja kośaiḥ lakṣitam 
SA_T02_n691u-1176	bahuvacanaṃ spharaṇena bahutvāt |	bahuvacanam spharaṇena bahu tvāt 
SA_T02_n691u-1177	cakārāt suvikasitatvādi |	        
SA_T02_n691u-1178	kesaraṃ kiñjalkam ,	kesaram kiñjalkam 
SA_T02_n691u-1179	tenānurupaveṣṭanaṃ tenedaṃ prāptam |	tena anuḥ upaveṣṭanam tena idam prāptam 
SA_T02_n691u-1180	paripūrṇakesaramiti bhāvaḥ |	paripūrṇa kesaram iti bhāvaḥ 
SA_T02_n691u-1181	śeṣaṃ subodham || 13 ||	śeṣam su bodham 
SA_T02_n691u-1182	karṇikāyāṃ nyasedvīraṃ mahābhairavabhīṣaṇam |	karṇikāyām nyaset vīram mahā bhairava bhīṣaṇam 
SA_T02_n691u-1183	tejaskaṃ tu sudīptāṅgamaṭṭahāsamahāravam || 14 ||	tejaskam tu su dīpta aṅgam aṭṭahāsa mahā ravam 
