segmentnr	original	analyzed
SA_T02_n691u-2070	omkārādīnāha - om namaḥ svāhā vauṣaṭ hū hū phaṭkāreti prathamā bahuvacanalope |	omkāra ādīn āha om namaḥ svāhā vauṣaṭ hū hū phaṭkāra iti prathamā bahuvacana lope 
SA_T02_n691u-2071	saṃyuktaṃ yathā bhavati tathā |	saṃyuktam yathā bhavati tathā 
SA_T02_n691u-2072	jñeyam jñeyāni hṛdayāni ṣaṇṇāṃ vīrāṇāmiti |	jñeyam jñeyāni hṛdayāni ṣaṇṇām vīrāṇām iti 
SA_T02_n691u-2073	tu-śabdāt kena jñeyānītyāha - sādhaka iti |	tuśabdāt kena jñeyāni iti āha sādhakaḥ iti 
SA_T02_n691u-2074	tṛtīyārthe prathamā || 3 ||	tṛtīyā arthe prathamā  
SA_T02_n691u-2075	prathamaṃ tu hṛdayaṃ caiva dvitīyaṃ tu śiraḥsmṛtam |	prathamam tu hṛdayam ca eva dvitīyam tu śiraḥ smṛtam 
SA_T02_n691u-2076	tṛtīyaṃ tu śikhāṃ dadyāccaturthaṃ kavacaṃ bhavet |	tṛtīyam tu śikhām dadyāt caturtham kavacam bhavet 
SA_T02_n691u-2077	pañcamaṃ tu bhavennetraṃ ṣaṣṭhasyāstramucyate || 4 ||	pañcamam tu bhavet netram ṣaṣṭhasya astram ucyate  /
SA_T02_n691u-2078	iti śrīherukābhidhāne ṣaḍvīrakavacoddhāravidhipaṭalaḥ ṣaṣṭhaḥ || 6 ||	iti śrī heruka abhidhāne ṣaḍvīra kavaca uddhāra vidhi paṭalaḥ ṣaṣṭhaḥ 
SA_T02_n691u-2079	prathamaṃ tu hṛdayañcaiveti |	prathamam tu hṛdayam ca eva iti 
SA_T02_n691u-2080	tu-śabdaḥ svadevatāṃ samuccinoti |	tuśabdaḥ sva devatām samuccinoti 
SA_T02_n691u-2081	evamuttaratrāpi |	evam uttaratra api 
SA_T02_n691u-2082	om ha hṛdayam |	om ha hṛdayam 
SA_T02_n691u-2083	vajrasattvaḥ prathamaḥ |	vajra sattvaḥ prathamaḥ 
SA_T02_n691u-2084	hṛdayamiti saptamyarthe prathamā |	hṛdayam iti saptamī arthe prathamā 
SA_T02_n691u-2085	dvitīyantu śiraḥ smṛtimiti |	dvitīyam tu śiraḥ smṛtim iti 
SA_T02_n691u-2086	namaḥ hi vairocanaḥ śirasi |	namaḥ hi vairocanaḥ śirasi 
SA_T02_n691u-2087	smṛtaṃ cintita ityarthaḥ |	smṛtam cintitaḥ iti arthaḥ 
SA_T02_n691u-2088	tṛtīyantu śikhāṃ dadyāditi |	tṛtīyam tu śikhām dadyāt iti 
SA_T02_n691u-2089	svāhā hū padyanarteśvaraḥ |	svāhā hū padya narta īśvaraḥ 
SA_T02_n691u-2090	caturthaṃ kavacaṃ bhavediti |	caturtham kavacam bhavet iti 
SA_T02_n691u-2091	tu-śabdo'nuvartane |	tuśabdaḥ anuvartane 
SA_T02_n691u-2092	vauṣaṭ he |	vauṣaṭ he 
SA_T02_n691u-2093	kavacaṃ śrīherukaḥ skandhadvaya ityupadeśato jñeyam |	kavacam śrīherukaḥ skandha dvaye iti upadeśataḥ jñeyam 
SA_T02_n691u-2094	pañcamaṃ tu bhavennetramiti |	pañcamam tu bhavet netram iti 
SA_T02_n691u-2095	hū hū ho vajrasūryaścakṣurdvaye |	hū hū ho vajra sūryaḥ cakṣuḥ dvaye 
SA_T02_n691u-2096	ṣaṣṭhasyāstramucyateti |	ṣaṣṭhasya astram ucyata iti 
SA_T02_n691u-2097	phaṭ haṃ hayagrīvaḥ |	phaṭ haṃ hayagrīvaḥ 
SA_T02_n691u-2098	sarveṣvaṅgeṣvastram |	sarveṣu aṅgeṣu astram 
SA_T02_n691u-2099	ṣaṣṭhasyeti prathamāyāṃ ṣaṣṭhī |	ṣaṣṭhasya iti prathamāyām ṣaṣṭhī 
SA_T02_n691u-2100	hṛdayādiṣu saptamyarthe prathamāyā dvitīyā |	hṛdaya ādiṣu saptamī arthe prathamāyāḥ dvitīyā 
SA_T02_n691u-2101	sarvatraiva hṛdayānīti hṛdayānuvartanam || 4 ||	sarvatra eva hṛdayāni iti hṛdaya anuvartanam 
SA_T02_n691u-2102	ete mantrā etanniṣpannā vā vīrā eṣu sthāneṣu |	ete mantrāḥ etad niṣpannāḥ vā vīrāḥ eṣu sthāneṣu 
SA_T02_n691u-2103	ṣaḍvīrakavacam |	ṣaḍvīrakavacam 
SA_T02_n691u-2104	mārairdurbhedyatvāt |	māraiḥ durbhedya tvāt 
SA_T02_n691u-2105	tasyoddhāraḥ,	tasya uddhāraḥ 
SA_T02_n691u-2106	tadabhidhāyakaḥ paṭalaḥ ṣaṣṭhaḥ |	tad abhidhāyakaḥ paṭalaḥ ṣaṣṭhaḥ 
SA_T02_n691u-2107	ṣaṣṭhamapāṭhe svārthe makāraḥ |	ṣaṣṭhama pāṭhe svārthe makāraḥ 
SA_T02_n691u-2108	iti śrīcakrasaṃvaravivṛtau ṣaṣṭhaḥ paṭalaḥ || 6 ||	iti śrī cakrasaṃvara vivṛtau ṣaṣṭhaḥ paṭalaḥ 
SA_T02_n691u-2109	mantroddhāravidhipaṭalaḥ saptamaḥ	mantroddhāravidhi paṭalaḥ saptamaḥ 
SA_T02_n691u-2110	tataḥ-	tatas 
SA_T02_n691u-2111	svarāṇāṃ trayodaśenaiva dvitīyākṣarayojitam |	svarāṇām trayodaśena eva dvitīya akṣara yojitam 
SA_T02_n691u-2112	ekādaśasvarasaṃyuktaṃ ṣaṣṭhamākṣarabhūṣitam || 1 ||	ekādaśa svara saṃyuktam ṣaṣṭhama akṣara bhūṣitam 
SA_T02_n691u-2113	pūrvamaṣṭapadamantrākṣaroddhāraḥ kṛtaḥ |	pūrvam aṣṭa pada mantra akṣara uddhāraḥ kṛtaḥ 
SA_T02_n691u-2114	idānīṃ tānyakṣarāṇi svarairyojayituṃ prakramamāṇa āha- svarāṇāmityādi |	idānīm tāni akṣarāṇi svaraiḥ yojayitum prakramamāṇaḥ āha svarāṇām ityādi 
SA_T02_n691u-2115	tatraivetyakākṣaroddhārāvadhāraṇe ṣaṣṭhī |	tatra eva iti aka akṣara uddhāra avadhāraṇe ṣaṣṭhī 
SA_T02_n691u-2116	trayodaśamokāram |	trayodaśamā ukāram 
SA_T02_n691u-2117	cakāro'rthaviśeṣe |	cakāraḥ artha viśeṣe 
SA_T02_n691u-2118	sūryaprabhaḥ sahastrakiraṇojjvalaḥ mūrddhalalāṭahṛdayeṣu dhyāto vaśaṃkarotītyevakāra etamarthamavadhārayati |	sūrya prabhaḥ sahastra kiraṇa ujjvalaḥ mūrddha lalāṭa hṛdayeṣu dhyātaḥ vaśaṃkaroti iti eva kāraḥ etam artham avadhārayati 
SA_T02_n691u-2119	dvitīyākṣarayojitamiti |	dvitīya akṣara yojitam iti 
SA_T02_n691u-2120	dvitīyamakṣaraṃ nakārāt paro makārastena yojita okārastaṃ viduḥ |	dvitīyam akṣaram nakārāt paraḥ makāraḥ tena yojitaḥ okāraḥ tam viduḥ 
SA_T02_n691u-2121	tato mo-rupaṃ syāt |	tatas morupam syāt 
SA_T02_n691u-2122	evamaṣṭa( ṣaṣṭha )	evam aṣṭa 
SA_T02_n691u-2123	mādi hi prathamānnakārādeva |	mādi hi prathama annakārāt eva 
SA_T02_n691u-2124	ekādaśasvara ekāraḥ |	ekādaśa svaraḥ ekāraḥ 
SA_T02_n691u-2125	sa cāsau saṃyuktaśceti sa tathā |	sa ca asau saṃyuktaḥ ca iti sa tathā 
SA_T02_n691u-2126	ataḥ ṣaṣṭhamenākṣareṇa takāreṇa bhūṣitaḥ |	atas ṣaṣṭhamena akṣareṇa takāreṇa bhūṣitaḥ 
SA_T02_n691u-2127	tataḥ te rupaṃ syāt || 1 ||	tatas te rupam syāt  /
SA_T02_n691u-2128	svarāṇāṃ caturthenaiva saṃyuktaṃ saptamākṣaram |	svarāṇām caturthena eva saṃyuktam saptama akṣaram 
SA_T02_n691u-2129	ekādaśasvarasaṃyuktamaṣṭamaṃ cākṣaraṃ viduḥ || 2 ||	ekādaśa svara saṃyuktam aṣṭamam ca akṣaram viduḥ 
SA_T02_n691u-2130	svarāṇāṃ caturtha īkāraḥ |	svarāṇām caturthaḥ īkāraḥ 
SA_T02_n691u-2131	evakāro hrasvaniṣedhe |	eva kāraḥ hrasva niṣedhe 
SA_T02_n691u-2132	tena lakṣitaṃ saptamamakṣaraṃ vakāram |	tena lakṣitam saptamam akṣaram vakāram 
SA_T02_n691u-2133	tena vī-rupaṃ syāt |	tena vīrupam syāt 
SA_T02_n691u-2134	aṣṭamākṣaraṃ rephamekādaśasvarasaṃyuktaṃ viduḥ |	aṣṭama akṣaram repham ekādaśa svara saṃyuktam viduḥ 
SA_T02_n691u-2135	tena rerupaṃ syāt |	tena rerupam syāt 
SA_T02_n691u-2136	kriyeyaṃ sarvatra || 2 ||	kriyā iyam sarvatra 
SA_T02_n691u-2137	navamaṃ tato gṛhyākṣaraṃ dvitīyasvarasaṃyuktam |	navamam tatas gṛhya akṣaram dvitīya svara saṃyuktam 
SA_T02_n691u-2138	svarāṇāṃ dvitīyenaiva saṃyuktaṃ dvādaśākṣaram || 3 ||	svarāṇām dvitīyena eva saṃyuktam dvādaśa akṣaram 
SA_T02_n691u-2139	navamaṃ tato gṛhyeti |	navamam tatas gṛhya iti 
SA_T02_n691u-2140	śakāram |	śakāram 
SA_T02_n691u-2141	tata iti uddhṛtāt prathamānnakārāt |	tatas iti uddhṛtāt prathama annakārāt 
SA_T02_n691u-2142	dvitīyasvara ākāraḥ |	dvitīya svaraḥ ākāraḥ 
SA_T02_n691u-2143	tena śā-rupaṃ syāt |	tena śārupam syāt 
SA_T02_n691u-2144	dvādaśākṣaraṃ hakāram |	dvādaśa akṣaram hakāram 
SA_T02_n691u-2145	dvitīyasvarasaṃyuktaṃ viduḥ |	dvitīya svara saṃyuktam viduḥ 
SA_T02_n691u-2146	tena hā-rupaṃ syāt || 3 ||	tena ha arupam syāt  /
SA_T02_n691u-2147	ekaviṃśa ttato gṛhya dvitīyasvarasaṃyuktam |	ekaviṃśam t tatas gṛhya dvitīya svara saṃyuktam 
SA_T02_n691u-2148	caturdaśākṣaraṃ mataṃ viṃśatyakṣarasamāyuktam || 4 ||	caturdaśa akṣaram matam viṃśati akṣara samāyuktam 
SA_T02_n691u-2149	pañcadaśākṣaraṃ gṛhya tṛtīyasvarayojitam |	pañcadaśa akṣaram gṛhya tṛtīya svara yojitam 
SA_T02_n691u-2150	svarāṇāṃ pañcadaśaṃ caiva śobhanaṃ ṣoḍaśākṣaram || 5 ||	svarāṇām pañcadaśam ca eva śobhanam ṣoḍaśa akṣaram 
SA_T02_n691u-2151	ekaviṃśattato gṛhyeti |	ekaviṃśat tatas gṛhya iti 
SA_T02_n691u-2152	ekaviṃśatitamamakṣaraṃ pakāram |	ekaviṃśatitamam akṣaram pakāram 
SA_T02_n691u-2153	dvitīyasvarasaṃyuktaṃ gṛhītvā tena yuktaṃ caturdaśākṣaraṃ lakāraṃ viduḥ |	dvitīya svara saṃyuktam gṛhītvā tena yuktam caturdaśa akṣaram lakāram viduḥ 
SA_T02_n691u-2154	tato lpā-rupaṃ syāt |	tatas lpa arupam syāt 
SA_T02_n691u-2155	viṃśatyakṣaramiti |	viṃśati akṣaram iti 
SA_T02_n691u-2156	viṃśatitamamakṣaraṃ nakāraḥ |	viṃśatitamam akṣaram nakāraḥ 
SA_T02_n691u-2157	tenādhaḥ saṃyuktaṃ pañcadaśākṣaraṃ gakāram |	tena adhas saṃyuktam pañcadaśa akṣaram gakāram 
SA_T02_n691u-2158	svarāṇāṃ tṛtīyaḥ svara ikāraḥ ,	svarāṇām tṛtīyaḥ svaraḥ ikāraḥ 
SA_T02_n691u-2159	tena lakṣitaṃ viduḥ |	tena lakṣitam viduḥ 
SA_T02_n691u-2160	tena gni-rupaṃ syāt |	tena gni rupam syāt 
SA_T02_n691u-2161	evakāro dīrghaniṣedhe |	evakāraḥ dīrgha niṣedhe 
SA_T02_n691u-2162	pañcadaśasvaro'nusvāraḥ |	pañcadaśa svaraḥ anusvāraḥ 
SA_T02_n691u-2163	tenārcitaṃ ṣoḍaśamakṣaraṃ sakāraṃ viduḥ |	tena arcitam ṣoḍaśam akṣaram sakāram viduḥ 
SA_T02_n691u-2164	tena saṃ-rupaṃ syāt || 4-5 ||	tena saṃrupam syāt 
SA_T02_n691u-2165	tṛtīyasvarasaṃyuktaṃ saptadaśamākṣaram |	tṛtīya svara saṃyuktam saptadaśama akṣaram 
SA_T02_n691u-2166	svarāṇāṃ dvitīyenaiva aṣṭādaśākṣarasaṃyuktam || 6 ||	svarāṇām dvitīyena eva aṣṭādaśa akṣara saṃyuktam 
SA_T02_n691u-2167	saptadaśaṃ nakāraṃ tṛtīyasvarasaṃyuktaṃ viduḥ |	saptadaśam nakāram tṛtīya svara saṃyuktam viduḥ 
SA_T02_n691u-2168	paramamṃ hitamiti |	paramam hitam iti 
SA_T02_n691u-2169	gurubuddhādyapakāriṇāmuccāṭanakāritvāt tasya |	guru buddha ādi apakāriṇām uccāṭana kāri tvāt tasya 
SA_T02_n691u-2170	yathā vāyumaṇḍalāruḍhaḥ dhūmapuñjopamaṃ sādhyasya hṛtkaṇṭhanābhipādadvayabhāvitaṃ tacca [ ta ]muccāṭayati nakārākṣaramiti |	yathā vāyu maṇḍala āruḍhaḥ dhūma puñja upamam sādhyasya hṛd kaṇṭha nābhi pāda dvaya bhāvitam tat ca tam uccāṭayati nakāra akṣaram iti 
SA_T02_n691u-2171	tena ni-rupaṃ syāt |	tena nirupam syāt 
SA_T02_n691u-2172	aṣṭādaśākṣaraṃ punarbhakāram |	aṣṭādaśa akṣaram punar bhakāram 
SA_T02_n691u-2173	dvitīyāsvarasaṃyuktaṃ viduḥ || 6 ||	dvitīyā svara saṃyuktam viduḥ 
SA_T02_n691u-2174	ākārasvarasaṃyuktamekaviṃśatimākṣaram |	ākāra svara saṃyuktam ekaviṃśatima akṣaram 
SA_T02_n691u-2175	mātṛkāpañcamena saṃyuktaṃ trayoviṃśatyakṣaram || 7 ||	mātṛkā pañcamena saṃyuktam trayoviṃśati akṣaram 
SA_T02_n691u-2176	ākārasvarasaṃyuktamiti |	ākāra svara saṃyuktam iti 
SA_T02_n691u-2177	ekaviṃśatimam |	ekaviṃśatimam 
SA_T02_n691u-2178	ekaviṃśatitamaṃ ṭakāraṃ viduḥ |	ekaviṃśatitamam ṭakāram viduḥ 
SA_T02_n691u-2179	mātṛkāpañcama ukāraḥ |	mātṛkā pañcamaḥ ukāraḥ 
SA_T02_n691u-2180	tena saṃyuktaṃ trayoviṃśatyakṣaraṃ kakāraṃ viduḥ || 7 ||	tena saṃyuktam trayoviṃśati akṣaram kakāram viduḥ 
SA_T02_n691u-2181	svarāṇāṃ trayodaśamaṃ tena saṃyuktaṃ caturviṃśatyakṣaram |	svarāṇām trayodaśamam tena saṃyuktam caturviṃśati akṣaram 
SA_T02_n691u-2182	prathamasya prathamaṃ gṛhya saṃyogākṣaraṃ pañcaviṃśatyakṣarasaṃyuktam || 8 ||	prathamasya prathamam gṛhya saṃyoga akṣaram pañcaviṃśati akṣara saṃyuktam 
SA_T02_n691u-2183	svarāṇāṃ trayodaśamaṃ trayodaśamamokāramādāya tena saṃyuktaṃ caturviṃśatyakṣaraṃ ṭakāraṃ viduḥ |	svarāṇām trayodaśamam trayodaśamam okāram ādāya tena saṃyuktam caturviṃśati akṣaram ṭakāram viduḥ 
SA_T02_n691u-2184	prathamasya prathamaṃ kakāraṃ viduḥ |	prathamasya prathamam kakāram viduḥ 
SA_T02_n691u-2185	cakāro'nuktasamuccaye |	cakāraḥ unukta samuccaye 
SA_T02_n691u-2186	sūryasamaprabho binduyuktaḥ sādhyasya hṛnnābhimūrdhasu nyastastaṃ kakāro vaśīkuruta iti |	sūrya sama prabhaḥ bindu yuktaḥ sādhyasya hṛd nābhi mūrdhasu nyastaḥ tam kakāraḥ vaśīkurute iti 
SA_T02_n691u-2187	evakāraḥ samuccitārthāvadhāraṇe |	eva kāraḥ samuccita artha avadhāraṇe 
SA_T02_n691u-2188	kiṃ bhūtaṃ taṃ vidurityāha - pañcaviṃśatyakṣarasaṃyuktamiti |	kim bhūtam tam viduḥ iti āha pañcaviṃśati akṣara saṃyuktam iti 
SA_T02_n691u-2189	pañcāvaśatīti pañcaviṃśatitamamakṣaraṃ takāraḥ |	pañcāvaśatī iti pañcaviṃśatitamam akṣaram takāraḥ 
SA_T02_n691u-2190	tenopari saṃyuktam |	tena upari saṃyuktam 
SA_T02_n691u-2191	tena tka-rupaṃ syāt || 8 ||	tena tkarupam syāt 
SA_T02_n691u-2192	tṛtīyasya prathamaṃ tu dvitīyasvarasaṃyuktaṃ ṣaḍviṃśatyakṣaraṃ bhavet |	tṛtīyasya prathamam tu dvitīya svara saṃyuktam ṣaḍviṃśati akṣaram bhavet 
SA_T02_n691u-2193	aṣṭāviṃśatimaṃ caiva pañcadaśenārcitam || 9 ||	aṣṭāviṃśatimam ca eva pañcadaśena arcitam 
SA_T02_n691u-2194	tṛtīyasya prathamaṃ tviti ṭakāraṃ viduḥ |	tṛtīyasya prathamam tu iti ṭakāram viduḥ 
SA_T02_n691u-2195	indrāyudhasamaprabhaṣṭakāraḥ sādhyasya lalāṭahṛṭkaṇṭhe nyasto vaśīkuruta iti tu-śabdārthaḥ |	sādhyasya lalāṭa hṛṣ kaṇṭhe nyastaḥ vaśīkurute iti tuśabda arthaḥ 
SA_T02_n691u-2196	dvitīyasvarasaṃyuktamiti |	dvitīya svara saṃyuktam iti 
SA_T02_n691u-2197	ṭakārākṣaraṃ dvitīyasvarasaṃyuktaṃ yattat ṣaḍviṃśatyakṣaraṃ bhavet |	ṭakāra akṣaram dvitīya svara saṃyuktam yat tat ṣaḍviṃśati akṣaram bhavet 
SA_T02_n691u-2198	ṭā-rupamityarthaḥ |	ṭārupam iti arthaḥ 
SA_T02_n691u-2199	tṛtīyasya prathamaṃ tu dvitīyasya sā bhavediti pāṭhāntare |	tṛtīyasya prathamam tu dvitīyasya sā bhavet iti pāṭha antare 
SA_T02_n691u-2200	dvitīyasya tu dvitīyaiva mātrā sā |	dvitīyasya tu dvitīyā eva mātrā sā 
SA_T02_n691u-2201	saṃyogena ṭārupameva |	saṃyogena ṭārupam eva 
SA_T02_n691u-2202	aṣṭāviṃśatimaṃ caiveti |	aṣṭāviṃśatimam ca eva iti 
SA_T02_n691u-2203	dakāraṃ viduḥ |	dakāram viduḥ 
SA_T02_n691u-2204	cakāro'nuktasamuccaye |	cakāraḥ unukta samuccaye 
SA_T02_n691u-2205	dakāro meghasamaprabhaḥ sādhyaśirasi cintitaḥ stabhnāti |	dakāraḥ megha sama prabhaḥ sādhya śirasi cintitaḥ stabhnāti 
SA_T02_n691u-2206	evāvadhāraṇe |	eva avadhāraṇe 
SA_T02_n691u-2207	pañcadaśasvaro'nusvāraḥ |	pañcadaśa svaraḥ anusvāraḥ 
SA_T02_n691u-2208	tenārcitaṃ viduḥ |	tena arcitam viduḥ 
SA_T02_n691u-2209	tena daṃ-rupaṃ syāt || 9 ||	tena daṃrupam syāt 
SA_T02_n691u-2210	tṛtīyasya prathamena saṃyuktamadhobhāgena vahnisaṃyuktam |	tṛtīyasya prathamena saṃyuktam adhobhāgena vahni saṃyuktam 
SA_T02_n691u-2211	tathaiva ca dvitīyasvarayojitamekonatriṃśatimaṃ cākṣaraṃ bhavet || 10 ||	tathā eva ca dvitīya svara yojitam ekonatriṃśatimam ca akṣaram bhavet 
SA_T02_n691u-2212	tṛtīyasya prathamena ṭakāreṇādhobhāge saṃyuktam |	tṛtīyasya prathamena ṭakāreṇa adhobhāge saṃyuktam 
SA_T02_n691u-2213	tadadho vahninā repheṇa saṃyuktam |	tad adhas vahninā repheṇa saṃyuktam 
SA_T02_n691u-2214	tathaiva ca-śabdāt dvitīyasvareṇa ca yojitamekonatriṃśattamañcākṣaraṃ bhavet |	tathā eva caśabdāt dvitīya svareṇa ca yojitam ekonatriṃśattamam ca akṣaram bhavet 
SA_T02_n691u-2215	tena ṣṭrārupaṃ syāt |	tena ṣṭrārupam syāt 
SA_T02_n691u-2216	cakāraḥ saṃyogasamuccaye || 10 ||	cakāraḥ saṃyoga samuccaye   
SA_T02_n691u-2217	ekatriṃśattamamakṣaraṃ dvitīyasvarayojitam |	ekatriṃśattamam akṣaram dvitīya svara yojitam 
SA_T02_n691u-2218	dvātriṃśatyakṣaraṃ trayodaśasvarayojitam || 11 ||	dvātriṃśati akṣaram trayodaśa svara yojitam 
SA_T02_n691u-2219	ekatriṃśattamamakṣaraṃ rephaḥ |	ekatriṃśattamam akṣaram rephaḥ 
SA_T02_n691u-2220	dvitīyasvarayojitaṃ bhavet tena rā-rupaṃ syāt |	dvitīya svara yojitam bhavet tena rā rupam syāt 
SA_T02_n691u-2221	dvātriṃśattamamakṣaraṃ lakāraḥ |	dvātriṃśattamam akṣaram lakāraḥ 
SA_T02_n691u-2222	trayodaśasvarayojitaṃ lo - rupaṃ syāt || 11 ||	trayodaśa svara yojitam laḥ rupam syāt 
SA_T02_n691u-2223	bhāskareṇa samāyuktaṃ trayastriṃśatyakṣaraṃ bhavet |	bhāskareṇa samāyuktam trayastriṃśati akṣaram bhavet 
SA_T02_n691u-2224	mātṛkācaturthenaiva catustriṃśat samāyuktam ||12 ||	mātṛkā caturthena eva catustriṃśat samāyuktam 
SA_T02_n691u-2225	bhāskareṇa samāyuktaṃ trayastriṃśadakṣaraṃ bhavediti |	bhāskareṇa samāyuktam trayastriṃśat akṣaram bhavet iti 
SA_T02_n691u-2226	bhāskaro rephaḥ |	bhāskaraḥ rephaḥ 
SA_T02_n691u-2227	trayastriṃśattamamakṣaraṃ gakāraṃ saṃyoge gra - rupaṃ syāt |	trayastriṃśattamam akṣaram gakāram saṃyoge gra rupam syāt 
SA_T02_n691u-2228	mātṛkā caturtha īkāraḥ |	mātṛkā caturthaḥ īkāraḥ 
SA_T02_n691u-2229	evakāro hrasvaniṣedhe |	eva kāraḥ hrasva niṣedhe 
SA_T02_n691u-2230	catustriṃśati( diti ) |	catustriṃśati diti 
SA_T02_n691u-2231	catustriṃśattamamakṣaraṃ bhakāraḥ |	catustriṃśattamam akṣaram bhakāraḥ 
SA_T02_n691u-2232	tena bhī-rupaṃ syāt || 12 ||	tena bhīrupam syāt  /
SA_T02_n691u-2233	sarvakāmārthasādhakaṃ mātṛkāpañcamenaiva |	sarva kāma artha sādhakam mātṛkā pañcamena eva 
SA_T02_n691u-2234	saptatriṃśat samāyuktaṃ sādhanaṃ ḍākinīsmṛtam || 13 ||	saptatriṃśat samāyuktam sādhanam ḍākinī smṛtam 
SA_T02_n691u-2235	mātṛkāpañcama ukāraḥ |	mātṛkā pañcamaḥ ukāraḥ 
SA_T02_n691u-2236	evakāro dīrghaniṣedhe |	evakāraḥ dīrgha niṣedhe 
SA_T02_n691u-2237	saptatriṃśaditi |	saptatriṃśat iti 
SA_T02_n691u-2238	saptatriṃśattamamakṣaraṃ makāraḥ |	saptatriṃśattamam akṣaram makāraḥ 
SA_T02_n691u-2239	saṃyoge mu - rupaṃ syāt |	saṃyoge mu rupam syāt 
SA_T02_n691u-2240	sādhanaṃ ḍākinīti |	sādhanam ḍākinī iti 
SA_T02_n691u-2241	ḍākinīnāṃ sādhanaṃ samagro mantraḥ |	ḍākinīnām sādhanam samagraḥ mantraḥ 
SA_T02_n691u-2242	athavā saptatriṃśanmakāraḥ kevalaśca samyagarkasaṃkāśaḥ sādhyaśirasi dhyāto yakṣādīn vasa( śaya )	athavā saptatriṃśat makāraḥ kevalaḥ ca samyak arka saṃkāśaḥ sādhya śirasi dhyātaḥ yakṣa ādīn vasa śaya 
SA_T02_n691u-2243	tīti sādhanaṃ ḍākinīsmṛtam |	ti iti sādhanam ḍākinī smṛtam 
SA_T02_n691u-2244	ḍākinīsammatam || 13 ||	     
SA_T02_n691u-2245	aṣṭatriṃśatimaṃ caiva dvitīyasvarayojitam |	aṣṭatriṃśatimam ca eva dvitīya svara yojitam 
SA_T02_n691u-2246	sādhanaṃ sarvadevānāmevameva na saṃśayaḥ || 14 ||	sādhanam sarva devānām evam eva na saṃśayaḥ 
SA_T02_n691u-2247	aṣṭatriṃśatimaṃ caiveti |	aṣṭatriṃśatimam ca eva iti 
SA_T02_n691u-2248	aṣṭatriṃśattamamakṣaraṃ khakāraḥ |	aṣṭatriṃśattamam akṣaram khakāraḥ 
SA_T02_n691u-2249	tasya dvitīyasvarayoge khārupaṃ syāt |	tasya dvitīya svara yoge khārupam syāt 
SA_T02_n691u-2250	iha ca sarvatra prathamā |	iha ca sarvatra prathamā 
SA_T02_n691u-2251	bhavediti kriyāyoge |	bhavet iti kriyā yoge 
SA_T02_n691u-2252	sādhanaṃ khakārākṣaraṃ bhavedvidurvā |	sādhanam khakāra akṣaram bhavet viduḥ vā 
SA_T02_n691u-2253	evamanyatrāpi |	evam anyatra api 
SA_T02_n691u-2254	indragopasamaprabhaḥ sādhyamūrddhādau cintito vaśayati sarvadevādīn kha iti |	indragopa sama prabhaḥ sādhya mūrddha ādau cintitaḥ vaśayati sarva deva ādīn khe iti 
SA_T02_n691u-2255	cakāraṃ samuccitamevakāro'vadhārayati |	cakāram samuccitam eva kāraḥ uvadhārayati 
SA_T02_n691u-2256	ata āha - sādhanamityādi || 14 ||	atas āha sādhanam ityādi 
SA_T02_n691u-2257	dvācālīśatimaṃ caiva dahanena tu saṃyuktam |	ca eva dahanena tu saṃyuktam 
SA_T02_n691u-2258	adhobhāgena sādhakaḥ trayaścālīśatimakṣaram || 15 ||	adhobhāgena sādhakaḥ trayaḥ ca ālīśatim akṣaram 
SA_T02_n691u-2259	dvācālīśatimamiti dvācatvāriṃśattamamakṣaraṃ sakāraḥ |	dvācālīśatimam iti dvācatvāriṃśattamam akṣaram sakāraḥ 
SA_T02_n691u-2260	pūrvoktārthāvadhāraṇe caivaśabdaḥ |	pūrva ukta artha avadhāraṇe ca eva śabdaḥ 
SA_T02_n691u-2261	dahano rephaḥ |	dahanaḥ rephaḥ 
SA_T02_n691u-2262	tu-śabdo'vadhāraṇe |	tuśabdaḥ avadhāraṇe 
SA_T02_n691u-2263	sa cādhobhāgo'syetyadhobhāgaḥ |	sa ca adhobhāgaḥ usya iti adhobhāgaḥ 
SA_T02_n691u-2264	tena yuktaṃ dvācatvāriṃśatimamakṣaraṃ tena stra - rupaṃ syāt |	tena yuktam dvācatvāriṃśatimam akṣaram tena stra rupam syāt 
SA_T02_n691u-2265	tacca sādhako jānīyādīti kriyādhyāhāraḥ |	tat ca sādhakaḥ jānīyādi iti kriyā adhyāhāraḥ 
SA_T02_n691u-2266	trayaścālīśatimamiti trayaścatvāriṃśattamamakṣaraṃ bhakāra || 15 ||	trayaḥ ca āli īśatimam iti trayaścatvāriṃśattamam akṣaram bhakāra 
SA_T02_n691u-2267	svarāṇāṃ pañcamenaiva yojitaṃ pañcacālīśatimaṃ caiva |	svarāṇām pañcamena eva yojitam ca eva 
SA_T02_n691u-2268	dvitīyasvarayojitam || 16 ||	dvitīya svara yojitam  /
SA_T02_n691u-2269	tatsvarāṇāṃ pañcamena yojitam |	tat svarāṇām pañcamena yojitam 
SA_T02_n691u-2270	tena tu bhu - rupaṃ syāt |	tena tu bhu rupam syāt 
SA_T02_n691u-2271	evakāro dīrghaniṣedhe |	evakāraḥ dīrgha niṣedhe 
SA_T02_n691u-2272	pañcacālīśatimam |	pañcacālīśatimam 
SA_T02_n691u-2273	pañcacatvāriṃśattamam |	pañcacatvāriṃśattamam 
SA_T02_n691u-2274	bhakārākṣaram |	bhakāra akṣaram 
SA_T02_n691u-2275	caiva - śabdaḥ pūrvoktasamuccitārthāvadhāraṇe |	ca eva śabdaḥ pūrva ukta samuccita artha avadhāraṇe 
SA_T02_n691u-2276	dvitīyasvarayojitaṃ bhā- rupaṃ syāt || 16 ||	dvitīya svara yojitam bhā rupam syāt 
SA_T02_n691u-2277	svarāṇāṃ pañcamenaiva ṣaṭcālīśasamāyuktaṃ sarvavīrāprapūjitam |	svarāṇām pañcamena eva ṣaṣ cālīśa samāyuktam sarva vīrā prapūjitam 
SA_T02_n691u-2278	saptacālīśatimaṃ caiva dvitīyasvarayojitam || 17 ||	ca eva dvitīya svara yojitam  /
SA_T02_n691u-2279	svarāṇāṃ pañcamenaiveti pūrvavat |	svarāṇām pañcamena eva iti pūrvavat 
SA_T02_n691u-2280	ṣaṭcālīśasamāyuktamiti |	ṣaṣ cālīśa samāyuktam iti 
SA_T02_n691u-2281	ṣaṭcatvāriṃśattamaṃ sakā rākṣaramukārasaṃyuktaṃ su-rupaṃ syāt |	ṣaṭcatvāriṃśattamam sakā ra akṣaram ukāra saṃyuktam surupam syāt 
SA_T02_n691u-2282	saptacālīśatimaṃ caiveti saptacatvāriṃśattamaṃ rephākṣaram |	ca eva iti saptacatvāriṃśattamam repha akṣaram 
SA_T02_n691u-2283	caivaśabdaḥ pūrvoktārthasamuccitāvadhāraṇe |	ca eva śabdaḥ pūrva ukta artha samuccita avadhāraṇe 
SA_T02_n691u-2284	dvitīyasvarayoge rā-rupaṃ syāt || 17 ||	dvitīya svara yoge rā rupam syāt 
SA_T02_n691u-2285	vajrasattvaḥ paramaṃ hi tadekapañcāśakaṃ tathā caiva |	vajra sattvaḥ paramam hi tad eka pañcāśakam tathā ca eva 
SA_T02_n691u-2286	svarāṇāṃ pañcamena tu śobhanaṃ paramaṃ matam || 18 ||	svarāṇām pañcamena tu śobhanam paramam matam 
SA_T02_n691u-2287	vajrasattvaḥ paramaṃ hi taditi |	vajra sattvaḥ paramam hi tat iti 
SA_T02_n691u-2288	tadeva rephākṣaraṃ vajrasattvaḥ |	tat eva repha akṣaram vajra sattvaḥ 
SA_T02_n691u-2289	ekapañcāśa ekapañcāśattamaḥ śakāraḥ |	ekapañcāśaḥ ekapañcāśattamaḥ śakāraḥ 
SA_T02_n691u-2290	tathā caiveti pūrvoktārthatvamasya sūcayati |	tathā ca eva iti pūrva ukta artha tvam asya sūcayati 
SA_T02_n691u-2291	pañcamena tviti |	pañcamena tu iti 
SA_T02_n691u-2292	tu-śabdo viśeṣe |	tuśabdaḥ viśeṣe 
SA_T02_n691u-2293	indrāyudhasamaprabhaḥ sādhyagale dhyāta ukārastaṃ vaśayatīti |	indrāyudha sama prabhaḥ sādhya gale dhyātaḥ ukāraḥ tam vaśayati iti 
SA_T02_n691u-2294	tataśca śu - rupaṃ syāt |	tatas ca śu rupam syāt 
SA_T02_n691u-2295	śobhanaṃ paramaṃ matamiti || 18 ||	śobhanam paramam matam iti 
SA_T02_n691u-2296	dvāpañcāśatimaṃ caiva dvitīyasvarayojitam |	dvāpañcāśatimam ca eva dvitīya svara yojitam 
SA_T02_n691u-2297	sādhanaṃ sarvadevānāmevameva na saṃśayaḥ || 19 ||	sādhanam sarva devānām evam eva na saṃśayaḥ 
SA_T02_n691u-2298	dvāpañcāśatimaṃ caiveti |	dvāpañcāśatimam ca eva iti 
SA_T02_n691u-2299	dvāpañcāśattamamakṣaraṃ pakāram |	dvāpañcāśattamam akṣaram pakāram 
SA_T02_n691u-2300	caivakāro'nuktārthasamuccayāvadhāraṇe |	ca eva kāraḥ unukta artha samuccaya avadhāraṇe 
