segmentnr	original	analyzed
SA_T07_vabhdilu-593	pradhānyādapavargāya taduktaṃ sarvadarśinā // [256] //	pradhānyāt apavargāya tat uktam sarvadarśinā 
SA_T07_vabhdilu-594	puṇyanirvāṇabhāgīyaṃ nirvedhānuguṇaṃ tathā /	puṇya nirvāṇa bhāgīyam nirvedha anuguṇam tathā 
SA_T07_vabhdilu-595	śāsane 'sminsamāsena śubhamūlaṃ tridheṣyate // [257] //	śāsane smin samāsena śubha mūlam tridhā iṣyate 
SA_T07_vabhdilu-596	lipimudrātha gaṇanā kāyavākkarmalakṣaṇā /	             
SA_T07_vabhdilu-597	saṃkhyā khalvapi vijñeyā manaskarmasvabhāvikā // [258] //	saṃkhyā khalu api vijñeyā manaḥ karma svabhāvikā 
SA_T07_vabhdilu-598	abhidharmadīpe vibhāṣāprabhāyāṃ vṛttau caturthādhyāyassamāptaḥ //	abhidharmadīpe vibhāṣā prabhāyām vṛttau caturtha adhyāyaḥ samāptaḥ 
SA_T07_vabhdilu-599	pañcamo 'dhyāyaḥ /	pañcamaḥ dhyāyaḥ 
SA_T07_vabhdilu-600	prathamaḥ pādaḥ	prathamaḥ pādaḥ 
SA_T07_vabhdilu-601	akāryapravaṇo loko duḥkhabhāgī ca yadvaśāt /	akārya pravaṇaḥ lokaḥ duḥkha bhāgī ca yad vaśāt 
SA_T07_vabhdilu-602	rāgādīn bhavasaṃbandhānkleśānvakṣyāmi tānaham // [259] //	rāga ādīn bhava saṃbandhān kleśān vakṣyāmi tān aham 
SA_T07_vabhdilu-603	svaśaktijakriyodbhūtairviśeṣaiste tu nāmabhiḥ /	sva śakti ja kriyā udbhūtaiḥ viśeṣaiḥ te tu nāmabhiḥ 
SA_T07_vabhdilu-604	āttasāmānyasaṃjñākāścodyante 'nuśayādibhi[:] // [260] //	ātta sāmānya saṃjñākāḥ codyante nu śaya ādibhiḥ 
SA_T07_vabhdilu-605	rāgapratighasaṃmohamānakāṅkṣākudṛṣṭayaḥ /	rāga pratigha saṃmoha māna kāṅkṣā kudṛṣṭayaḥ 
SA_T07_vabhdilu-606	ṣaḍete 'nuśayāḥ proktāḥ śreyodvāravibandhinaḥ // [261] //	ṣaṭ ete nuśayāḥ proktāḥ śreyaḥ dvāra vibandhinaḥ 
SA_T07_vabhdilu-607	rāgadvedhāt matāḥ sapta dṛṣṭibhedāddaśa smṛtāḥ /	rāga dvedhāt matāḥ sapta dṛṣṭi bhedāt daśa smṛtāḥ 
SA_T07_vabhdilu-608	bhūyo 'ṣṭānavatirjñeyā dhātvākārādibhedataḥ // [262] //	bhūyas ṣṭānavatiḥ jñeyā dhātu ākāra ādi bhedataḥ 
SA_T07_vabhdilu-609	kāmarāgo bhavākhyaśca dvidhāḥ rāgaḥ prabhidyate /	kāma rāgaḥ bhava ākhyaḥ ca dvidhāḥ rāgaḥ prabhidyate 
SA_T07_vabhdilu-610	prāyo bahiṣpravṛttatvādantarvattyādibhedataḥ // [263] //	prāyas bahiṣpravṛtta tvāt antarvatti ādi bhedataḥ 
SA_T07_vabhdilu-611	satkāyāntadvayagrāhau mithyādarśaṇa(na)meva ca /	sat kāya anta dvaya grāhau mithyā darśaṇanam eva ca 
SA_T07_vabhdilu-612	dṛṣṭiśīlavratāmarśāvityetāḥ pañca dṛṣṭayaḥ // [264] //	dṛṣṭi śīla vrata āmarśau iti etāḥ pañca dṛṣṭayaḥ 
SA_T07_vabhdilu-613	daśeha duḥkhadṛggheyāḥ sapta hetvīkṣaṇakṣayāḥ /	daśā iha duḥkha dṛś heyāḥ sapta hetu īkṣaṇa kṣayāḥ 
SA_T07_vabhdilu-614	saptāpavargadṛggheyāḥ aṣṭau mārgekṣaṇakṣayāḥ // [265] //	sapta apavarga dṛś heyāḥ aṣṭau mārga īkṣaṇa kṣayāḥ 
SA_T07_vabhdilu-615	dṛṣṭiheyāvalambitvātsadākāraparigrahāt /	dṛṣṭi heya avalambi tvāt sat ākāra parigrahāt 
SA_T07_vabhdilu-616	rāgādayastu catvāro jñeyā mārgadvayakṣayāḥ // [266] //	rāga ādayaḥ tu catvāraḥ jñeyāḥ mārga dvaya kṣayāḥ 
SA_T07_vabhdilu-617	pratikalpavaśotpatterdṛṣṭikāṅkṣetu dṛkkṣaye /	pratikalpa vaśa utpatteḥ dṛṣṭi kāṅkṣetu dṛkkṣaye 
SA_T07_vabhdilu-618	rūpepyevaṃ tathārūpye pratighānuśayādṛte // [267] //	rūpe ipi evam tathā ārūpye pratigha anuśayāt ṛte 
SA_T07_vabhdilu-619	bhavāgre kṣāntiheyā ye dṛggheyā eva te matāḥ /	bhava agre kṣānti heyāḥ ye dṛś heyāḥ eva te matāḥ 
SA_T07_vabhdilu-620	jñānavadhyāstu ye tasminnabhyāsenaiva tatkṣayaḥ // [268] //	jñāna vadhyāḥ tu ye tasmin abhyāsena eva tad kṣayaḥ 
SA_T07_vabhdilu-621	ahaṃ mameti yā dṛṣṭirasau satkāyadṛk smṛtā /	aham mama iti yā dṛṣṭiḥ asau sat kāya dṛś smṛtā 
SA_T07_vabhdilu-622	taducchedadhruvagrāhau yau sāntargrāhadṛṅmatā // [269] //	tad uccheda dhruva grāhau yau sā antar grāha dṛś matā 
SA_T07_vabhdilu-623	phalahetvapavādo yaḥ sā mithyādṛṣṭirucyate /	phala hetu apavādaḥ yaḥ sā mithyādṛṣṭiḥ ucyate 
SA_T07_vabhdilu-624	jñeyo dṛṣṭiparāmarśaḥ hīnavastūttamagrahaḥ // [270] //	jñeyaḥ dṛṣṭi parāmarśaḥ hīna vastu uttama grahaḥ 
SA_T07_vabhdilu-625	ahetāvapathe caiva taddhi śīlavratāvhayaḥ /	ahetau apathe ca eva tat hi śīla vrata avhayaḥ 
SA_T07_vabhdilu-626	duḥkhabhrāntyapathādānāttaduṣṭyutsārya eva saṃ // [271] //	duḥkha bhrānti apatha ādānāt tad duṣṭi utsāryaḥ eva 
SA_T07_vabhdilu-627	satkāyadṛṣṭyavacchedo dharmamātrekṣaṇādyataḥ /	sat kāya dṛṣṭi avacchedaḥ dharma mātra īkṣaṇa ādi atas 
SA_T07_vabhdilu-628	duḥkhābhisamaye tacca taddṛggheyaiva so 'pyataḥ // [272] //	duḥkha abhisamaye tat ca tad dṛś heyā eva saḥ u pi atas 
SA_T07_vabhdilu-629	dvayaṃ dṛṣṭiparāmārśādekaḥ satkāyadṛṣṭitaḥ /	dvayam dṛṣṭi parāmārśāt ekaḥ satkāyadṛṣṭitaḥ 
SA_T07_vabhdilu-630	antargrāhārdhamanyastu viparyāsaḥ prakalpyate // [273] //	antar grāha ardham anyaḥ tu viparyāsaḥ prakalpyate 
SA_T07_vabhdilu-631	nitīraṇasamāropaviparītapravṛttitaḥ /	nitīraṇa samāropa viparīta pravṛttitaḥ 
SA_T07_vabhdilu-632	viparyāsoktireṣveva dṛgvaṣā(śāt)	viparyāsa uktiḥ eṣu eva dṛś vaṣa āśāt 
SA_T07_vabhdilu-633	cittasaṃjñayoḥ // [274] //	citta saṃjñayoḥ 
SA_T07_vabhdilu-634	sapta mānavidhāstribhyo nava mānavidhāstridhā /	sapta māna vidhāḥ tribhyaḥ nava māna vidhāḥ tridhā 
SA_T07_vabhdilu-635	tridhātyunnamanādibhyaḥ svotkarṣādyasti nāstitā // [275] //	tridhā ati unnamana ādibhyaḥ sva utkarṣa ādi asti na astitā 
SA_T07_vabhdilu-636	va dhādiparyavasthānaṃ kaukṛtyamaśubhaṃ vidhāḥ /	va dha ādi paryavasthānam kaukṛtyam aśubham vidhāḥ 
SA_T07_vabhdilu-637	vibhavecchā ca nāryasya jāyante hetvabhāvataḥ // [276] //	vibhava icchā ca na aryasya jāyante hetu abhāvataḥ 
SA_T07_vabhdilu-638	duḥkhātsamudayāccaiva sarvagānāṃ vyavasthitiḥ /	duḥkhāt samudayāt ca eva sarvagānām vyavasthitiḥ 
SA_T07_vabhdilu-639	taddṛṣṭiheyajātināṃ sarvāsāṃ dvipadasthiteḥ // [277] //	tad dṛṣṭi heya jātinām sarvāsām dvipada sthiteḥ 
SA_T07_vabhdilu-640	kāṅkṣā pañca dṛśo 'vidyā tadvyāmiśrātha kevalāḥ /	kāṅkṣā pañca dṛśaḥ vidyā tad vyāmiśrā atha kevalāḥ 
SA_T07_vabhdilu-641	sapta sarvatragā duḥkhaddhenorebhyaścatuṣṭayam // [278] //	sapta sarvatragāḥ 
SA_T07_vabhdilu-642	dravyato daśa caikaśca nāmnā sapta tu te matāḥ /	dravyataḥ daśa ca ekaḥ ca nāmnā sapta tu te matāḥ 
SA_T07_vabhdilu-643	rāgapratighamānāstu paricchedapravartiṇaḥ (naḥ) // [279] //	rāga pratigha mānāḥ tu pariccheda pravartiṇaḥ naḥ 
SA_T07_vabhdilu-644	prakārāntaravartitvātsakṛtsarvasvabhūgatiḥ /	prakāra antara varti tvāt sakṛt sarva sva bhū gatiḥ 
SA_T07_vabhdilu-645	dhātvantarāvalambitvātpūrvoktā eva sarvagāḥ // [280] //	dhātu antara avalambi tvāt pūrva uktāḥ eva sarva gāḥ 
SA_T07_vabhdilu-646	navordhvadhātukāsteṣāmādyā dṛṣṭidvayādṛte /	nava ūrdhvadhātukāḥ teṣām ādyāḥ dṛṣṭi dvayāt ṛte 
SA_T07_vabhdilu-647	teṣāṃ sahabhuvo dharmāḥ prāptivarjyāśca sarvagāḥ // [281] //	teṣām saha bhuvaḥ dharmāḥ prāpti varjyāḥ ca sarva gāḥ 
SA_T07_vabhdilu-648	kāṅkṣāmithyādṛgābhyāṃ ca miśrāvidyātha kevalā /	kāṅkṣā mithyā dṛgābhyām ca miśrā avidyā atha kevalā 
SA_T07_vabhdilu-649	nirodhamārgadṛggheyāḥ ṣaḍete nirmalekṣiṇaḥ // [282] //	nirodha mārga dṛś heyāḥ ṣaṭ ete nirmala īkṣiṇaḥ   
SA_T07_vabhdilu-650	svabhūmereva nirvāṇaṃ mārgastha (rgaḥ ṣa)	sva bhūmeḥ eva nirvāṇam mārga stha rgaḥ ṣa 
SA_T07_vabhdilu-651	nna(ṇṇa)	nna ṇ ṇa 
SA_T07_vabhdilu-652	vabhūmikaḥ /	vabhūmikaḥ 
SA_T07_vabhdilu-653	taddṛśyaviśa(ṣa)	tad dṛśya viśa ṣa 
SA_T07_vabhdilu-654	yo 'nyo 'nyo hetutvāddhetubhāvataḥ // [283] //	yaḥ nyaḥ nyaḥ hetu tvāt hetu bhāvataḥ 
SA_T07_vabhdilu-655	na rāgaḥ śaktyahetutvānna dveṣo[ ']naparādhataḥ /	na rāgaḥ śakti ahetu tvāt na dveṣaḥ na aparādhataḥ 
SA_T07_vabhdilu-656	namāno 'tipraśāntatvānna bhāvatvād dṛśo 'parāḥ // [284] //	ti praśānta tvāt na bhāva tvāt parāḥ 
SA_T07_vabhdilu-657	sarvago 'nuśayaḥ kṛtsnāmanuśete svadhātugaḥ /	sarvagaḥ nuśayaḥ kṛtsnām anuśete sva dhātu gaḥ 
SA_T07_vabhdilu-658	svāmālambanato bhūmiṃ svanikāyaṃ tvasarvagaḥ // [285] //	svām ālambanataḥ bhūmim sva nikāyam tu asarvagaḥ 
SA_T07_vabhdilu-659	asvīkārādvipakṣatvānnordhvabhūmārgagocaraḥ /	asvīkārāt vipakṣa tvāt na ūrdhva bhū mārga gocaraḥ 
SA_T07_vabhdilu-660	saṃprayogini(ṇi)	saṃprayoginiṇi 
SA_T07_vabhdilu-661	tu svasminnahīne saṃprayogataḥ // [286] //	tu svasmin ahīne saṃprayogataḥ  
SA_T07_vabhdilu-662	dhātrīvastramalanyāyaiḥ khacarāmbucarakramaiḥ /	                        
SA_T07_vabhdilu-663	ete 'nuśerate yasmāttasmādanuśayāḥ smṛtāḥ // [287] //	ete nuśerate yasmāt tasmāt anuśayāḥ smṛtāḥ 
SA_T07_vabhdilu-664	svairiṣṭādibhinā (rā)	svaiḥ iṣṭa ādibhinā rā 
SA_T07_vabhdilu-665	kāraiḥ paramāṇukṣaṇeṣvapi /	kāraiḥ paramāṇu kṣaṇeṣu api 
SA_T07_vabhdilu-666	yato 'nuśerate caiti(te)	yatas nuśerate 
SA_T07_vabhdilu-667	tataścānuśayā matāḥ // [288] //	tatas ca anuśayāḥ matāḥ 
SA_T07_vabhdilu-668	abhidharmadīpe vibhāṣāprabhāyāṃ vṛttau pañcamasyādhyāyasya prathamaḥ pādaḥ //	abhidharmadīpe vibhāṣā prabhāyām vṛttau pañcamasya adhyāyasya prathamaḥ pādaḥ 
SA_T07_vabhdilu-669	pañcamādhyāye dvitīyapādaḥ /	pañcama adhyāye dvitīya pādaḥ 
SA_T07_vabhdilu-670	ādyaṃ dṛṣṭidvayaṃ kāme nivṛtāvyākṛtaṃ matam /	ādyam dṛṣṭi dvayam kāme nivṛta avyākṛtam matam 
SA_T07_vabhdilu-671	dhātudvaye tu sarve 'pi nivṛtāvyākṛtā malāḥ // [289] //	dhātu dvaye tu sarve nivṛta avyākṛtāḥ malāḥ 
SA_T07_vabhdilu-672	kāmeṣvakuśalāḥ śeṣāḥ rāgadveṣatamāṃsyataḥ /	kāmeṣu akuśalāḥ śeṣāḥ rāga dveṣa tamāṃsi atas 
SA_T07_vabhdilu-673	trīṇyevāśubhamūlāni pañcakāraṇayogataḥ // [290] //	trīṇi eva aśubha mūlāni pañca kāraṇa yogataḥ 
SA_T07_vabhdilu-674	avyākṛtadvayasyāpi trīṇi mūlāni tatsamāḥ /	avyākṛta dvayasya api trīṇi mūlāni tad samāḥ 
SA_T07_vabhdilu-675	avidyā dhīśca tṛṣṇā ca na kāṅkṣāmānadṛṣṭayaḥ // [291] //	avidyā dhīḥ ca tṛṣṇā ca na kāṅkṣā māna dṛṣṭayaḥ 
SA_T07_vabhdilu-676	calatvādūrdhvavṛttitvādavyāpitvādyathākramam /	cala tvāt ūrdhva vṛtti tvāt avyāpi tvāt yathākramam 
SA_T07_vabhdilu-677	sūtrasyārthāparijñānādaheturdhyāyivodanāt // [292] //	sūtrasya artha aparijñānāt ahetuḥ dhyāyi vodanāt 
SA_T07_vabhdilu-678	praśnavyākaraṇānyākhyaccatvāri vadatāṃ varaḥ /	praśna vyākaraṇāni ākhyat catvāri vadatām varaḥ 
SA_T07_vabhdilu-679	śiṣyānāṃ(ṇāṃ)	śiṣya anāṃṇām 
SA_T07_vabhdilu-680	vādaśikṣārtha sthitīnāṃ ca catuṣṭayīm // [293] //	vāda śikṣā artha sthitīnām ca catuṣṭayīm 
SA_T07_vabhdilu-681	ekāṃśākhyaṃ vibhajyākhyaṃ pṛcchākhyaṃ sthāpyameva ca /	eka aṃśa ākhyam vibhajya ākhyam pṛccha ākhyam sthāpyam eva ca 
SA_T07_vabhdilu-682	maraṇaprasavotkarṣajīvadravyānyatādivat // [294] //	maraṇa prasava utkarṣa jīva dravya anya tā ādi vat 
SA_T07_vabhdilu-683	sthānavāditvasaṃjñaikā parikalpāvhayā parā /	sthānavādi tva saṃjñā ekā parikalpa avhayā parā 
SA_T07_vabhdilu-684	anyā pratipadākhyānyā jñānavāditvasaṃjñitā // [295] //	anyā pratipad ākhyā anyā jñāna vādi tva saṃjñitā 
SA_T07_vabhdilu-685	mānapratighasaṃrāgairvartamāno 'jjhitakriyaiḥ /	māna pratigha saṃrāgaiḥ vartamānaḥ jjhita kriyaiḥ 
SA_T07_vabhdilu-686	jātā yatrāprahīṇāśca saṃyuktastatra vastuni // [296] //	jātāḥ yatra aprahīṇāḥ ca saṃyuktaḥ tatra vastuni 
SA_T07_vabhdilu-687	ajātairmāṇa(na)	ajātaiḥ māṇana 
SA_T07_vabhdilu-688	sairetaiḥ sarvatrānyaiḥ svakādhvikaiḥ /	saiḥ etaiḥ sarvatra anyaiḥ svaka ādhvikaiḥ 
SA_T07_vabhdilu-689	sarvatrājaistathā śeṣaiḥ saṃyuktā skandhasantatiḥ // [297] //	sarvatra ajaiḥ tathā śeṣaiḥ saṃyuktā skandha santatiḥ 
SA_T07_vabhdilu-690	dvayamevātra niṣpannaṃ tṛtīyaṃ tūpacārataḥ /	dvayam eva atra niṣpannam tṛtīyam tu upacārataḥ 
SA_T07_vabhdilu-691	sadasaddhetuno(tā)	sat asat hetunā utā 
SA_T07_vabhdilu-692	yasmānmadhyasthaiśca parigrahāt // [298] //	yasmāt madhyasthaiḥ ca parigrahāt 
SA_T07_vabhdilu-693	sarvamasti pradeśo 'sti sarvaṃ nāstīti cāparaḥ /	sarvam asti pradeśaḥ sti sarvam na asti iti ca aparaḥ 
SA_T07_vabhdilu-694	avyākṛtāstivādīti catvāro vādinaḥ smṛtāḥ // [299] //	avyākṛta astivādī iti catvāraḥ vādinaḥ smṛtāḥ 
SA_T07_vabhdilu-695	ebhyo yaḥ prathamo vādī bhajate sādhutāmalau /	ebhyaḥ yaḥ prathamaḥ vādī bhajate sādhu tā malau 
SA_T07_vabhdilu-696	tarkābhimāninastvanye yuktyāgamabahiṣkṛtāḥ // [300] //	tarka abhimāninaḥ tu anye yukti āgama bahiṣkṛtāḥ 
SA_T07_vabhdilu-697	icchatyadhvatrayaṃ yasmā[t] kṛtyataśca dhruvatrayam /	icchati adhva trayam yasmāt kṛtyataḥ ca dhruva trayam 
SA_T07_vabhdilu-698	sarvāstivāda ityuktastasmādādyaścaturvidhaḥ // [301] //	sarvāstivādaḥ iti uktaḥ tasmāt ādyaḥ caturvidhaḥ 
SA_T07_vabhdilu-699	bhā[vāṅkā]nyathikākhyau dvāva[va]sthānyathiko paraḥ /	bhāva aṅka anyathika ākhyau paraḥ 
SA_T07_vabhdilu-700	anyathānyathikaścānyaḥ tṛtīyo yuktivādyataḥ // [302] //	anyathā anyathikaḥ ca anyaḥ tṛtīyaḥ yuktivādyataḥ 
SA_T07_vabhdilu-701	kāritreṇādhvanāmepa vyavasthāmabhivāñchati /	kāritreṇa adhvanām epa vyavasthām abhivāñchati 
SA_T07_vabhdilu-702	tatkurvanvartamāno 'dhvā kṛte 'tīto 'kṛte paraḥ // [303] //	tat kurvan vartamānaḥ kṛte kṛte paraḥ   
SA_T07_vabhdilu-703	buddhyā yasyekṣyate cinhaṃ tatsaṃjñeyaṃ caturvidham /	buddhyā yasya īkṣyate cinham tat saṃjñā iyam caturvidham 
SA_T07_vabhdilu-704	paramārthena saṃvṛttyā dvayenāpekṣayāpi ca // [304] //	paramārthena saṃvṛttyā dvayena apekṣayā api ca 
SA_T07_vabhdilu-705	sadatītāsamutpannaṃ buddhoktervartamānavat /	sat atīta asamutpannam buddha ukteḥ vartamāna vat 
SA_T07_vabhdilu-706	dhīnāmagocaratvacca tatsattvaṃ vartamānabat // [305] //	dhīnām agocara tvat ca tat sattvam vartamāna bat 
SA_T07_vabhdilu-707	nāsadālambanā buddhirāgamādupapattitaḥ /	na asat ālambanā buddhiḥ āgamāt upapattitaḥ 
SA_T07_vabhdilu-708	anyāpekṣye 'tha saṃbandhapratiṣedho 'śvaśṛṅgayoḥ // [306] //	anya apekṣye tha saṃbandha pratiṣedhaḥ śva śṛṅgayoḥ 
SA_T07_vabhdilu-709	rūpādau vastuni kṣīṇe satyevotpadyate matiḥ /	rūpa ādau vastuni kṣīṇe sati eva utpadyate matiḥ 
SA_T07_vabhdilu-710	sā jñānasyāsanākārā śāstustathānyacittavat // [307] //	sā jñānasya āsana ākārā śāstuḥ tathā anya citta vat 
SA_T07_vabhdilu-711	harṣotpādabhayodvegasmṛtyutpatya(ttya)	harṣa utpāda bhaya udvega smṛti utpati attya 
SA_T07_vabhdilu-712	ṅgabhāvataḥ /	ṅga bhāvataḥ 
SA_T07_vabhdilu-713	sāṅgasya śaktyabhivyakteḥ sadīpaghaṭarūpavat // [308] //	sa aṅgasya śakti abhivyakteḥ sa dīpa ghaṭa rūpa vat 
SA_T07_vabhdilu-714	janīhākartu sādhvatvātpañcabhāvavikāravat /	sādhu atvāt pañca bhāva vikāravat 
SA_T07_vabhdilu-715	sataḥ kṛ(kri)	sataḥ kṛ kri 
SA_T07_vabhdilu-716	yāṅgatādṛṣṭervikārya prāpyakarmavat // [309] //	yā aṅga tā dṛṣṭeḥ vikārya prāpya karma vat 
SA_T07_vabhdilu-717	dvitīyaṃ janma jātasya vastuno nopapadyate //	dvitīyam janma jātasya vastunaḥ na upapadyate 
SA_T07_vabhdilu-718	mukhyasattā guṇābhāvādgaunī(ṇī)	mukhya sattā guṇa abhāvāt gaunīṇī 
SA_T07_vabhdilu-719	sattā na vidyate // [310] //	sattā na vidyate 
SA_T07_vabhdilu-720	sādharmye sati tadvṛttervyāhāraṃ madhuroktivat /	sādharmye sati tad vṛtteḥ vyāhāram madhura ukti vat 
SA_T07_vabhdilu-721	āviṣṭaliṅgamukhyasya janmeṣṭaṃ dārakādivat / [311] //	āviṣṭa liṅga mukhyasya janma iṣṭam dāraka ādi vat 
SA_T07_vabhdilu-722	syātkhapuṣpaiḥ khamutphullaṃ syāñjaṭālaśca darduraḥ /	syāt khapuṣpaiḥ kham utphullam syāt jaṭālaḥ ca darduraḥ 
SA_T07_vabhdilu-723	svabhāvo yadi bhāvanāṃ prāgabhūtvā samudbhavet // [312] //	svabhāvaḥ yadi bhāvanām prāk a bhūtvā samudbhavet 
SA_T07_vabhdilu-724	sthitiśaktiparityaktāndharmānnāśānvitodayān /	sthiti śakti parityaktān dharmān nāśa anvita udayān 
SA_T07_vabhdilu-725	vada somya kathaṃ yāti pratītyā vastu vastutām // [313] //	vada somya katham yāti pratītyā vastu vastu tām 
SA_T07_vabhdilu-726	loke dṛṣṭaḥ satoreva parasparamanugrahaḥ /	loke dṛṣṭaḥ satoḥ eva parasparam anugrahaḥ 
SA_T07_vabhdilu-727	tadvadevopaghāto 'pi nāśvaśṛṅgāhivā(pā)dayoḥ // [314] //	tadvat eva upaghātaḥ 
SA_T07_vabhdilu-728	yatpratītyasamutpannaṃ tatsvabhāvānna vidyate /	yat pratītyasamutpannam tad svabhāvāt na vidyate 
SA_T07_vabhdilu-729	na vidyate svabhāvādyadvidyate tattato 'nyathā // [315] //	na vidyate svabhāvāt yat vidyate tat tatas nyathā 
SA_T07_vabhdilu-730	prakurvanti daśāmātraṃ hetavo vastunaḥ sataḥ /	prakurvanti daśā mātram hetavaḥ vastunaḥ sataḥ 
SA_T07_vabhdilu-731	rājatvaṃ rājaputrasya sātmakasyaiva mantriṇaḥ // [316] //	rāja tvam rāja putrasya sātmakasya eva mantriṇaḥ 
SA_T07_vabhdilu-732	dharmāṇāṃ sati sāmagrye sāmarthyamupajāyate /	dharmāṇām sati sāmagrye sāmarthyam upajāyate 
SA_T07_vabhdilu-733	citānāṃ paramānū(ṇū)	citānām parama an ūṇū 
SA_T07_vabhdilu-734	nāṃ yadvadātmopalambhane // [317] //	nām yadvat ātma upalambhane 
SA_T07_vabhdilu-735	karmātītamasadyasya phalaṃ bhāvi karotyasat /	karma atītam asat yasya phalam bhāvi karoti asat 
SA_T07_vabhdilu-736	vyaktaṃ vandhyāsutastasya jāyate vyantarātmajāt // [318] //	vyaktam vandhyā sutaḥ tasya jāyate vyantara ātmajāt 
SA_T07_vabhdilu-737	nāmasallakṣaṇābhāvād dravyasatyāṅkasiddhitaḥ /	nāma sat lakṣaṇa abhāvāt dravya satya aṅka siddhitaḥ 
SA_T07_vabhdilu-738	anāgatābhyatītasya nāsti prajñaptisatyatā // [319] //	anāgata abhyatītasya na asti prajñapti satya tā 
SA_T07_vabhdilu-739	ko vighnaḥ aṅgavaikalyam na tatsarvāstitā sadā /	kaḥ vighnaḥ aṅga vaikalyam na tad sarva astitā sadā 
SA_T07_vabhdilu-740	tatkathaṃ śrūyatāṃ sadbhyaḥ durbodhā khalu dharmatā // [320] //	tat katham śrūyatām sadbhyaḥ durbodhā khalu dharmatā 
SA_T07_vabhdilu-741	vartamānādhvasaṃpātāt sāmagryāṅgaparigrahāt /	vartamāna adhva saṃpātāt sāmagrya aṅga parigrahāt 
SA_T07_vabhdilu-742	labdhaśakteḥ phalākṣepaḥ kāritramabhidhīyate // [321] //	labdha śakteḥ phala ākṣepaḥ kāritram abhidhīyate 
SA_T07_vabhdilu-743	na vartamānatā rūpamatītājāna(ta)tā na ca /	na vartamāna tā rūpam atīta a jānata tā na ca 
SA_T07_vabhdilu-744	yato 'to nādhvasaṃcārād rūpātmānyathateṣyate // [322] //	na adhva saṃcārāt rūpa ātma anyathatā iṣyate 
SA_T07_vabhdilu-745	avasthā jāyate kācidvidyamānasya vastunaḥ /	avasthā jāyate kācid vidyamānasya vastunaḥ 
SA_T07_vabhdilu-746	tathā śaktistathā velā tathā sattā tathā kriyā // [323] //	tathā śaktiḥ tathā velā tathā sattā tathā kriyā 
SA_T07_vabhdilu-747	parikalpairjagadvyāptaṃ mūrkhacittānurañjibhiḥ /	parikalpaiḥ jagat vyāptam mūrkha citta anurañjibhiḥ 
SA_T07_vabhdilu-748	yastu dvidvanmanogrāhī parikalpaḥ sa durlabhaḥ // [324] //	yaḥ tu dvidvas manaḥ grāhī parikalpaḥ sa durlabhaḥ 
SA_T07_vabhdilu-749	anyasarvatragairbaddhaḥ prahīṇe duḥkhadṛkkṣaye /	anya sarvatragaiḥ baddhaḥ prahīṇe duḥkha dṛś kṣaye 
SA_T07_vabhdilu-750	prahīṇe prākprakāre 'pi śeṣaistadavalambibhiḥ // [325] //	prahīṇe prāc prakāre śeṣaiḥ tad avalambibhiḥ 
SA_T07_vabhdilu-751	ṣoḍāṣa(śa) vijñeyāḥ pratyekaṃ tribhavātmakāḥ /	ṣoḍāṣaśa vijñeyāḥ pratyekam tri bhava ātmakāḥ 
SA_T07_vabhdilu-752	dharmāḥ pañcadhā nirmalāścaiva vijñānāni tathaiva ca // [326] //	dharmāḥ pañcadhā nirmalāḥ ca eva vijñānāni tathā eva ca 
SA_T07_vabhdilu-753	dhātvāyatanasatyeṣu prakāreṣu ca lakṣayet /	dhātu āyatana satyeṣu prakāreṣu ca lakṣayet 
SA_T07_vabhdilu-754	dharmasaṃgrahavijñānajñānānuśayacoditaḥ // [327] //	           
SA_T07_vabhdilu-755	saduḥkhahetudṛggheyāḥ kāmāptā bhāvanākṣayāḥ /	sa duḥkha hetu dṛś heyāḥ kāma āptāḥ bhāvanā kṣayāḥ 
SA_T07_vabhdilu-756	svakatrayaikarūpāptivirajāścittagocarāḥ // [328] //	svaka traya eka rūpa āpti virajāḥ citta gocarāḥ 
SA_T07_vabhdilu-757	atmīyādhastrayaikordhvanirmalānāṃ tu rūpajāḥ /	tu rūpa jāḥ 
SA_T07_vabhdilu-758	ārūpyāptāstridhātvāptatrikanirmalagocarāḥ // [329] //	ārūpya āptāḥ tri dhātu āpta trika nirmala gocarāḥ 
SA_T07_vabhdilu-759	sarve svādhikavijñeyāḥ samaniryāṇadṛkkṣayāḥ /	sarve sva adhika vijñeyāḥ sama niryāṇa dṛkkṣayāḥ 
SA_T07_vabhdilu-760	nikleśāstribhavāptāntyatrayanirmalagocarāḥ // [330] //	nikleśāḥ tri bhava āpta antya traya nirmala gocarāḥ 
SA_T07_vabhdilu-761	kāmāpta(ptaṃ)	kāma āpta ptam 
SA_T07_vabhdilu-762	pañcaviṣayo rūpāptaṃ tvaṣṭagocaraḥ /	pañca viṣayaḥ rūpāptam tu aṣṭa gocaraḥ 
SA_T07_vabhdilu-763	ārupyāptaṃ daśānāṃ tu daśānāmeva cāmalam // [331] //	ārupya āptam daśānām tu daśānām eva ca amalam 
SA_T07_vabhdilu-764	kāmāptamūrdhvadharmārthe vijñāne svabhuvastrayaḥ /	kāma āptam ūrdhva dharma arthe vijñāne sva bhuvaḥ trayaḥ 
SA_T07_vabhdilu-765	rūpāptā bhāvanāheyāḥ sarvagāścānuśerate // [332] //	rūpa āptāḥ bhāvanā heyāḥ sarva gāḥ ca anuśerate  /
SA_T07_vabhdilu-766	catvāraḥ parivṛtte sve rūpāptāḥ khalvapi trayaḥ /	catvāraḥ parivṛtte sve rūpa āptāḥ khalu api trayaḥ 
SA_T07_vabhdilu-767	ārūpyāvacarāḥ sārdhaṃ sarvagairbhāvanākṣayāḥ // [333] //	ārūpyāvacarāḥ sārdham sarvagaiḥ bhāvanā kṣayāḥ 
SA_T07_vabhdilu-768	tadvadeva dvitīye 'pi pañcame 'pi tathaiva ca /	tadvat eva dvitīye pi pañcame pi tathā eva ca 
SA_T07_vabhdilu-769	sāsravālambanāḥ sve ca tṛtīye 'pyanuśerate // [334] //	sa āsrava ālambanāḥ sve ca tṛtīye pi anuśerate 
SA_T07_vabhdilu-770	parivṛtte tu kāmāptāḥ saṃskṛtārthāvalambinaḥ /	parivṛtte tu kāma āptāḥ saṃskṛta artha avalambinaḥ 
SA_T07_vabhdilu-771	śeṣaṃ pūrvavadākhyeyam caturthe 'pi tṛtīyavat // [335] //	śeṣam pūrva vat ākhyeyam caturthe pi tṛtīya vat 
SA_T07_vabhdilu-772	parivṛtte tu kāmāptāścatvāro 'nyatra pūrvavat /	parivṛtte tu kāma āptāḥ catvāraḥ nyatra pūrvavat 
SA_T07_vabhdilu-773	rūpāpte prathame 'dhastāt trayaḥ sve khalvapi trayaḥ // [336] //	rūpa āpte prathame trayaḥ sve khalu api trayaḥ  /
SA_T07_vabhdilu-774	ārūpyāḥ sarvagāḥ sārdhaṃ bhāvanāpathasaṃkṣayai[:]	ārūpyāḥ sarvagāḥ sārdham bhāvanāpatha saṃkṣayai 
SA_T07_vabhdilu-775	parivṛtte trayo 'dhastāt catvāraśca svadhātutaḥ // [337] //	parivṛtte trayaḥ dhastāt catvāraḥ ca sva dhātutaḥ 
SA_T07_vabhdilu-776	ārūpyāptāśca catvāro ṇi(ni)	ārūpya āptāḥ ca catvāraḥ ṇini 
SA_T07_vabhdilu-777	kāyā anuśerate /	kāyāḥ anuśerate 
SA_T07_vabhdilu-778	tadvadeva dvitīye 'pi pañcame 'pi tathaiva ca // [338] //	tadvat eva dvitīye pi pañcame pi tathā eva ca 
SA_T07_vabhdilu-779	sāsravālambanāḥ sve ca tṛtīye 'pyanu[śera]te /	sa āsrava ālambanāḥ sve ca tṛtīye pi anuśerate 
SA_T07_vabhdilu-780	parivṛte tu rūpāptāḥ saṃskṛtārthāvalambinaḥ // [339] //	parivṛte tu rūpa āptāḥ saṃskṛta artha avalambinaḥ 
SA_T07_vabhdilu-781	anyattu pūrvavajjñeyaṃ caturthe 'pi tṛtīyavat /	anyat tu pūrva vat jñeyam caturthe tṛtīya vat 
SA_T07_vabhdilu-782	tṛtīyavatparāvṛtte ārūpyādye nibodhaye[t] // [340] //	tṛtīya vat parāvṛtte ārūpya ādye nibodhayet 
SA_T07_vabhdilu-783	sve trayaḥ kāmadhātvāptā rūpāptāśca trayastrayaḥ /	sve trayaḥ kāmadhātu āptāḥ rūpa āptāḥ ca trayaḥ trayaḥ 
SA_T07_vabhdilu-784	rūpāptavatparāvṛtte dvītīye pañcame tathā // [341] //	rūpa āpta vat parāvṛtte dvītīye pañcame tathā 
SA_T07_vabhdilu-785	tṛtīye khalvapi sve ca sāsravārthāvalambinaḥ /	tṛtīye khalu api sve ca sa āsrava artha avalambinaḥ 
SA_T07_vabhdilu-786	parāvṛtte svadhātvāptāḥ saṃskṛtārthāvalambinaḥ // [342] //	parāvṛtte sva dhātu āptāḥ saṃskṛta artha avalambinaḥ 
SA_T07_vabhdilu-787	anyattvādyavadākhyeyaṃ caturthe 'pi tṛtīyavat /	anyat tu ādyavat ākhyeyam caturthe tṛtīya vat 
