segmentnr	original	analyzed
SA_T07_vabhdilu-399	patanīyarapītyeke tannetyanye tvayogataḥ // [168] //	tat na iti anye tu ayogataḥ 
SA_T07_vabhdilu-400	ayogā(go) nāṃśuvidhvaṃsātpaṭadravyaṃ vinaśyati /	ayoga āgaḥ na aṃśu vidhvaṃsāt paṭa dravyam vinaśyati 
SA_T07_vabhdilu-401	sūtre dhvaṃsoktiranyārthā yatherṣyāśaṭhanādiṣu // [169] //	sūtre dhvaṃsa uktiḥ anya arthā yathā īrṣyā śaṭhana ādiṣu 
SA_T07_vabhdilu-402	saddharmāntarddhito 'nye 'nye nāpūrvāpratilambhataḥ /	saddharma antarddhitaḥ nye nye na apūrva apratilambhataḥ 
SA_T07_vabhdilu-403	bhūsaṃcāreṇa hānyā ca tyajyate dhyānajaṃ śubham // [170] //	bhū saṃcāreṇa hānyā ca tyajyate dhyāna jam śubham 
SA_T07_vabhdilu-404	tathārūpyāptamāryantu phalāptyakṣavihānibhiḥ /	phala āpti akṣa vihānibhiḥ 
SA_T07_vabhdilu-405	asaṃvaro damaprāptirjīvitotsarjaṇā(nā) dibhiḥ // [171] //	asaṃvaraḥ dama prāptiḥ jīvita utsarjaṇa anā ā dibhiḥ 
SA_T07_vabhdilu-406	cittavegādivicchedairavijñaptistu madhyamā /	citta vega ādi vicchedaiḥ avijñaptiḥ tu madhyamā 
SA_T07_vabhdilu-407	kāmāptaṃ kuśalaṃ nāma tribhirmūlacchidādibhiḥ // [172] //	kāmāptam kuśalam nāma tribhiḥ mūlacchid ādibhiḥ 
SA_T07_vabhdilu-408	pratipakṣodayātkliṣṭaṃ tridhātvāptaṃ vihīyate /	pratipakṣa udayāt kliṣṭam tridhātu āptam vihīyate 
SA_T07_vabhdilu-409	sarve kāmeṣu rūpe dvādhe(ve)	sarve kāmeṣu rūpe dvādheve 
SA_T07_vabhdilu-410	ko 'rūpiṣu lābhataḥ // [173] //	kaḥ rūpiṣu lābhataḥ 
SA_T07_vabhdilu-411	yadiṣṭaphaladaṃ karma kuśalaṃ tadudāhṛtam /	yat iṣṭa phala dam karma kuśalam tat udāhṛtam 
SA_T07_vabhdilu-412	viparyayeṇākuśalamavyākṛtamato 'nyathā // [174] //	viparyayeṇa akuśalam avyākṛtam atas nyathā 
SA_T07_vabhdilu-413	kāmāptaṃ prathamaṃ puṇyamapuṇyamaśubhātmakam /	kāma āptam prathamam puṇyam apuṇyam aśubha ātmakam 
SA_T07_vabhdilu-414	ūrdhvabhūmikamānejyaṃ vipākaṃ pratyanejanāt // [175] //	ūrdhvabhūmikam ānejyam vipākam pratyanejanāt 
SA_T07_vabhdilu-415	sukhavedyaṃ śubha(bhaṃ)	sukha vedyam 
SA_T07_vabhdilu-416	karma dhyānādarvākturīyakāt /	karma dhyānāt arvāk turīyakāt 
SA_T07_vabhdilu-417	upekṣāvedyamanyatra duḥkhavedyantu pāpakam // [176] //	upekṣā vedyam anyatra duḥkha vedyam tu pāpakam 
SA_T07_vabhdilu-418	adho 'pi madhyamaṃ karma dhyānenā ntyepi nirvṛteḥ /	madhyamam karma dhyānena nirvṛteḥ 
SA_T07_vabhdilu-419	yugapattrivipākeṣṭerdhyānāntaravipākataḥ // [177] //	yugapad tri vipāka iṣṭeḥ dhyāna antara vipākataḥ 
SA_T07_vabhdilu-420	punaścaturvidhaṃ karma dṛṣṭavedyādibhedataḥ /	punar caturvidham karma dṛṣṭa vedya ādi bhedataḥ 
SA_T07_vabhdilu-421	janmanastribhirākṣepo dṛṣṭadharmāhvayādṛte // [178] //	janmanaḥ tribhiḥ ākṣepaḥ dṛṣṭa dharma āhvayāt ṛte 
SA_T07_vabhdilu-422	caturṇāmapi cākṣepaḥ sarvatra narakādṛte /	caturṇām api ca ākṣepaḥ sarvatra narakāt ṛte 
SA_T07_vabhdilu-423	na tatreṣṭaphalābhāvācchubhaṃ yasmādvipacyate // [179] //	na tatra iṣṭa phala abhāvāt śubham yasmāt vipacyate 
SA_T07_vabhdilu-424	notpadyavedyakṛttatra yadviraktaḥ pṛthagjanaḥ /	na utpadya vedya kṛt tatra yat viraktaḥ pṛthagjanaḥ 
SA_T07_vabhdilu-425	sthiro nāparakṛccāryaścalo 'pi bhavamūlayoḥ // [180] //	sthiraḥ bhava mūlayoḥ 
SA_T07_vabhdilu-426	yadārtraraudracittena karmābhīkṣṇaṃ niṣevyate /	yadā ārtra raudra cittena karma abhīkṣṇam niṣevyate 
SA_T07_vabhdilu-427	satkṣetre kriyate yacca phalaṃ tasya niyamyate // [181] //	sat kṣetre kriyate yat ca phalam tasya niyamyate 
SA_T07_vabhdilu-428	kṣetrāśayaviśeṣācca phalaṃ sadyo vipacyate /	kṣetra āśaya viśeṣāt ca phalam sadyas vipacyate 
SA_T07_vabhdilu-429	nirodhavyutthitādau ca sadyaḥ kālaphalakriyā // [182] //	nirodha vyutthita ādau ca sadyas kāla phala kriyā 
SA_T07_vabhdilu-430	tadbhūmyapunarutpatteḥ vipākaniyataṃ ca yat /	tad bhūmi apunarutpatteḥ vipāka niyatam ca yat 
SA_T07_vabhdilu-431	tacca dṛṣṭaphalaṃ vidyāt karmādaḥ paripūrakam // [183] //	tat ca dṛṣṭa phalam vidyāt karma adaḥ paripūrakam 
SA_T07_vabhdilu-432	kuśalasyāvicārasya caitasikyeva vedanā /	kuśalasya avicārasya caitasikī eva vedanā 
SA_T07_vabhdilu-433	vipākaḥ kāyikī tviṣṭā duḥkhavedyasya karmaṇaḥ // [184] //	vipākaḥ kāyikī tu iṣṭā duḥkha vedyasya karmaṇaḥ 
SA_T07_vabhdilu-434	sapākamaśubhaṃ kṛṣṇaṃ sapākaṃ rūpajaṃ sitam /	sa pākam aśubham kṛṣṇam sa pākam rūpa jam sitam 
SA_T07_vabhdilu-435	śubhāśubhaṃ dvidhā kāye(me)	śubha aśubham dvidhā kāya ime 
SA_T07_vabhdilu-436	nirmalaṃ tatprahāṇakṛt // [185] //	nirmalam tat prahāṇa kṛt 
SA_T07_vabhdilu-437	casasro dṛkpathā dṛṣṭau cetanābhāvanāpathāt /	ca sasraḥ dṛkpathāḥ dṛṣṭau cetanā bhāvanā pathāt 
SA_T07_vabhdilu-438	ānantaryapathāḥ kāme karmaitatkṛṣṇanāśakṛt // [186] //	ānantarya pathāḥ kāme karma etat kṛṣṇa nāśa kṛt 
SA_T07_vabhdilu-439	navame cetanā yā tu sā kṛṣṇākṛṣṇayā [ghā]tinī /	navame cetanā yā tu sā kṛṣṇa akṛṣṇayā ghātinī 
SA_T07_vabhdilu-440	antānantaryamārgasthā dhyāne dhyāne sitasya tu // [187] //	anta ānantarya mārga sthāḥ dhyāne dhyāne sitasya tu 
SA_T07_vabhdilu-441	kāyādyakuśalaṃ karma sarvaṃ duścaritaṃ matam /	kāya ādi akuśalam karma sarvam duścaritam matam 
SA_T07_vabhdilu-442	abhidhyādīnyapi trīṇi manoduścaritatrayam // [188] //	abhidhyā ādīni api trīṇi manaḥ duścarita trayam 
SA_T07_vabhdilu-443	śubhaṃ tatsānabhidhyādi proktaṃ sucaritatrayam /	śubham tat sa anabhidhyā ādi proktam su carita trayam 
SA_T07_vabhdilu-444	dvayaṃmaulamadaḥ karma mārgā daśa śubhāśubhāḥ // [189] //	dvayam maula madaḥ karma mārgāḥ daśa śubha aśubhāḥ 
SA_T07_vabhdilu-445	[abhidharmadīpe vibhāṣāprabhāyāṃ [vṛttau] caturthādhyāyasya dvitīyaḥ pādaḥ /	abhidharmadīpe vibhāṣā prabhāyām vṛttau caturtha adhyāyasya dvitīyaḥ pādaḥ 
SA_T07_vabhdilu-446	caturthādhyāye tṛtīyapādaḥ /	caturtha adhyāye tṛtīya pādaḥ 
SA_T07_vabhdilu-447	kāritāḥ ṣaḍavijñaptidvaryātmaikaste 'pi ṣaṭ kṛtāḥ /	kāritāḥ ṣaṭ avijñapti dvarya ātmā ekaḥ te pi ṣaṭ kṛtāḥ 
SA_T07_vabhdilu-448	śubhāḥ sapta dvidhā jñeyā ekavai(dhai)	śubhāḥ sapta dvidhā jñeyāḥ 
SA_T07_vabhdilu-449	te samāhitāḥ // [190] //	te samāhitāḥ 
SA_T07_vabhdilu-450	yā sāmanteṣvavijñaptiḥ pṛṣṭheṣu tu viparyayaḥ /	yā sāmanteṣu avijñaptiḥ pṛṣṭheṣu tu viparyayaḥ 
SA_T07_vabhdilu-451	prayogastu trimūlotthaḥ [abhidhyādyāstrimūlajāḥ] // [191] //	prayogaḥ tu tri mūla utthaḥ abhidhyā ādyāḥ tri mūla jāḥ 
SA_T07_vabhdilu-452	[kuśalāḥ prayogapṛṣṭhāśca kuśalatrayamūlajāḥ] /	kuśalāḥ prayoga pṛṣṭhāḥ ca kuśala traya mūla jāḥ 
SA_T07_vabhdilu-453	dveṣeṇa vadhapāruṣyavyāpattīnāṃ samāpanam // [192] //	dveṣeṇa vadha pāruṣya vyāpattīnām samāpanam 
SA_T07_vabhdilu-454	steyasyānyāṅganāyāterabhidhyāyāśca lobhataḥ /	steyasya anya aṅganā āyāteḥ abhidhyāyāḥ ca lobhataḥ 
SA_T07_vabhdilu-455	mithyādṛśastu mohena tadanyeṣāṃ tribhirmatam // [193] //	mithyādṛśaḥ tu mohena tad anyeṣām tribhiḥ matam 
SA_T07_vabhdilu-456	caturṇāmapyadhiṣṭhānaṃ jñeyameṣāṃ yathākramam /	caturṇām api adhiṣṭhānam jñeyam eṣām yathākramam 
SA_T07_vabhdilu-457	prāṇinaścātha bhogāśca nāmarūpaṃ ca nāma ca // [194] //	prāṇinaḥ ca atha bhogāḥ ca nāma rūpam ca nāma ca 
SA_T07_vabhdilu-458	prāṇātipāto dhīpūrvamabhrāntyā paramāraṇam /	prāṇa atipātaḥ dhī pūrvam abhrāntyā para māraṇam 
SA_T07_vabhdilu-459	atyaktānyadhanādānamadattādānamucyate // [195] //	atyakta anya dhana ādānam adatta ādānam ucyate 
SA_T07_vabhdilu-460	parastrīgamanaṃ kāmamithyācāro vikalpavān /	para strī gamanam kāma mithyā ācāraḥ vikalpavān 
SA_T07_vabhdilu-461	arthajñāyānyathāvādo drohabuddhyā mṛṣāvacaḥ // [196] //	artha jñāya anyathāvādaḥ droha buddhyā mṛṣāvacaḥ  
SA_T07_vabhdilu-462	dṛṣṭyā śrutyādibhiścākṣairmaṇa(na)	dṛṣṭyā śruti ādibhiḥ ca akṣaiḥ maṇana 
SA_T07_vabhdilu-463	sā yacca gṛhyate /	sā yat ca gṛhyate 
SA_T07_vabhdilu-464	dṛṣṭaṃ śrutaṃ mataṃ jñātamityuktaṃ tadyathākramam // [197] //	dṛṣṭam śrutam matam jñātam iti uktam tat yathākramam 
SA_T07_vabhdilu-465	paiśunyaṃ bhedakṛdvākyaṃ pāruṣyaṃ tu yadapriyam /	paiśunyam bheda kṛt vākyam pāruṣyam tu yat apriyam 
SA_T07_vabhdilu-466	kliṣṭaṃ saṃbhinnalāpitvamanye gītakathādivat // [198] //	kliṣṭam saṃbhinna lāpi tvam anye gīta kathā ādi vat 
SA_T07_vabhdilu-467	parasvāsatspṛhābhidhyā vyāpā[daḥ] sattvagocaraḥ /	para sva asat spṛhā abhidhyā vyāpādaḥ sattva gocaraḥ 
SA_T07_vabhdilu-468	vidveṣānānantadṛṣṭistu mithyādṛṣṭi [rahetukā] // [199] //	vidveṣa anānanta dṛṣṭiḥ tu mithyādṛṣṭiḥ ra hetukā 
SA_T07_vabhdilu-469	cetanā na kriyāmārgastaistu sattā pravartate /	cetanā na kriyā mārgaḥ taiḥ tu sattā pravartate 
SA_T07_vabhdilu-470	yugapadyāva[daṣṭā] bhiraśubhaiścetanaiḥ saha // [200] //	yugapad yāvat daṣṭābhiḥ aśubhaiḥ cetanaiḥ saha 
SA_T07_vabhdilu-471	[śubhaistu] daśabhiryāvatsārvaṃ(rdhaṃ)	śubhaiḥ tu daśabhiḥ yāvat sārvaṃrdham 
SA_T07_vabhdilu-472	naikāṣṭapañcabhiḥ /	na eka aṣṭa pañcabhiḥ 
SA_T07_vabhdilu-473	vilāpadveṣapāruṣyāṇyu(ṇi)	vilāpa dveṣa pāruṣyāṇi uṇi 
SA_T07_vabhdilu-474	ṣa (sa)	ṣa sa 
SA_T07_vabhdilu-475	nti narake dvidhā // [201] //	narake dvidhā 
SA_T07_vabhdilu-476	tadvadeva matābhidhyā mithyādṛṣṭistathaiva ca /	tadvat eva mata abhidhyā mithyādṛṣṭiḥ tathā eva ca 
SA_T07_vabhdilu-477	abhidhyāditrayaṃ tadvatkurau pralapanaṃ dvidhā // [202] //	abhidhyā ādi trayam tadvat kurau pralapanam dvidhā 
SA_T07_vabhdilu-478	aśubhāstu daśānyatra sarvatra kuśalāstrayaḥ /	aśubhāḥ tu daśa anyatra sarvatra kuśalāḥ trayaḥ 
SA_T07_vabhdilu-479	ārūpyāryāsaṃjñināṃ ca rūpiṇaḥ sapta lābhataḥ // [203] //	ārūpya ārya asaṃjñinām ca rūpiṇaḥ sapta lābhataḥ 
SA_T07_vabhdilu-480	kurūnsanarakānhitvā sarvatrānyatra te dvidhā /	kurūn sa narakān hitvā sarvatra anyatra te dvidhā 
SA_T07_vabhdilu-481	sarve vipākaniṣyandādhipatyaphaladā daśa // [204] //	sarve vipāka nisyanda ādhipatya phala dāḥ daśa 
SA_T07_vabhdilu-482	duḥkhopasaṃhṛterduḥkhamalpāyuṣṭvantu māraṇāt /	duḥkha upasaṃhṛteḥ duḥkham alpa āyuḥ tvam tu māraṇāt 
SA_T07_vabhdilu-483	tejonāśātkṛśaujastvamidaṃ tattrividhaṃ phalam // [205] //	tejaḥ nāśāt kṛśa ojaḥ tvam idam tat trividham phalam 
SA_T07_vabhdilu-484	ānantaryapathe karma phalavatpañcabhiḥ phalaiḥ /	ānantarya pathe karma phalavat pañcabhiḥ phalaiḥ 
SA_T07_vabhdilu-485	caturbhistvamalenāryaṃ tadvadanyacchabhāśubham // [206] //	caturbhiḥ tu amalena āryam tadvat anyat śabhāśubham 
SA_T07_vabhdilu-486	tato 'nyannirmalaṃ jñeyaṃ tribhiravyākṛtaṃ tathā /	tatas jñeyam tribhiḥ avyākṛtam tathā 
SA_T07_vabhdilu-487	phalaṃ śubhasya catvāri dvetrīṇi ca śubhādayaḥ // [207] //	phalam śubhasya catvāri dve trīṇi ca śubha ādayaḥ 
SA_T07_vabhdilu-488	śubhādyāstvaśubhasya dve trīṇi catvāri ca kramāt /	śubha ādyāḥ tu aśubhasya dve trīṇi catvāri ca kramāt 
SA_T07_vabhdilu-489	avyākṛtasya te tu dve trīṇi trīṇi śubhādayaḥ // [208] //	avyākṛtasya te tu dve trīṇi trīṇi śubha ādayaḥ 
SA_T07_vabhdilu-490	sarve catvāryatītasya madhyamasya ca bhāvinaḥ /	sarve catvāri atītasya madhyamasya ca bhāvinaḥ 
SA_T07_vabhdilu-491	madhyamā dve svakasyaiva trīṇyanāgāmijanmanaḥ // [209] //	madhyamā dve svakasya eva trīṇi anāgāmi janmanaḥ 
SA_T07_vabhdilu-492	catvāryekabhuvo dve vā trīṇi cāparabhūmikāḥ /	catvāri eka bhuvaḥ dve vā trīṇi ca apara bhūmikāḥ 
SA_T07_vabhdilu-493	śaikṣādyāstrīṇi śaikṣasya ta evāśaikṣakarmaṇaḥ // [210] //	śaikṣa ādyāḥ trīṇi śaikṣasya te eva aśaikṣa karmaṇaḥ 
SA_T07_vabhdilu-494	ekaṃ trīṇi dvayaṃ caiva śaikṣādyāḥ paścimasya tu /	ekam trīṇi dvayam ca eva śaikṣa ādyāḥ paścimasya tu 
SA_T07_vabhdilu-495	dve dve pañca yathāsaṃkhyaṃ dṛggheyasya tu karmaṇaḥ // [211] //	dve dve pañca yathāsaṃkhyam dṛś heyasya tu karmaṇaḥ 
SA_T07_vabhdilu-496	trīṇi catvāri caikaṃ ca dṛṣṭiheyādayaḥ smṛtāḥ /	trīṇi catvāri ca ekam ca dṛṣṭi heya ādayaḥ smṛtāḥ 
SA_T07_vabhdilu-497	te tvabhyāsapraheyasya dve catvāri tridhā matāḥ // [212] //	te tu abhyāsa praheyasya dve catvāri tridhā matāḥ 
SA_T07_vabhdilu-498	kramādekadvicatvāri te tvaheyasya karmaṇaḥ /	kramāt eka dvi catvāri te tu aheyasya karmaṇaḥ 
SA_T07_vabhdilu-499	ekenākṣipyate[janma] bhūribhiḥ paripūryate // [213] //	ekena ākṣipyate janma bhūribhiḥ paripūryate 
SA_T07_vabhdilu-500	kuśalaṃ vāthavā pāpaṃ yadatītaṃ dadatphalam /	kuśalam vā athavā pāpam yat atītam dadat phalam 
SA_T07_vabhdilu-501	svaṃ kāyavāṅmanaskarma sā karmasvakatā matā // [214] //	svam kāya vāc manaḥ karma sā karma svaka tā matā 
SA_T07_vabhdilu-502	saṃvṛtyā skandhasantāne tatkriyāphaladarśaṇā(nā)t /	saṃvṛtyā skandha santāne tad kriyā phala darśa nānāt 
SA_T07_vabhdilu-503	karttṛtā bhoktṛtā coktā niṣiddhā śāśvatasya tu // [215] //	karttṛ tā bhoktṛ tā ca uktā niṣiddhā śāśvatasya tu 
SA_T07_vabhdilu-504	syātkarmasvakatā nāsti tasya ceti catuṣkikā /	syāt karma svaka tā na asti tasya ca iti catuṣkikā 
SA_T07_vabhdilu-505	prathamā tatphalasthasya vihāṇā(nā)	prathamā tad phala sthasya 
SA_T07_vabhdilu-506	ttasya karmaṇaḥ // [216] //	t tasya karmaṇaḥ 
SA_T07_vabhdilu-507	dvitīyā tatphalasthasya karmaṇā tena cānvayāt /	dvitīyā tad phala sthasya karmaṇā tena ca anvayāt 
SA_T07_vabhdilu-508	tṛtīyobhayayuktasya caturthyanubhayasya tu // [217] //	tṛtīyā ubhaya yuktasya caturthī anubhayasya tu 
SA_T07_vabhdilu-509	syātkarmasvakatā nāpi tatphalaṃ vedayiṣyati /	syāt karma svaka tā nā api tad phalam vedayiṣyati 
SA_T07_vabhdilu-510	tatphalāvasthitasyādyā jñeyā taccarame phale // [218] //	tad phala avasthitasya ādyā jñeyā tad carame phale 
SA_T07_vabhdilu-511	dvitīyā dhruvapākasya tadvipākānavasthite /	dvitīyā dhruva pākasya tad vipāka anavasthite 
SA_T07_vabhdilu-512	tṛtīyā dvayasadbhāvā caturthī tūbhayaṃ vinā // [219] //	tṛtīyā dvaya sadbhāvā caturthī tu ubhayam vinā 
SA_T07_vabhdilu-513	syātkarmaṇānvitaścaiva no ca tatphalavedanam /	syāt karmaṇā anvitaḥ ca eva no ca tad phala vedanam 
SA_T07_vabhdilu-514	ādyā dattavipākena niruddhānāgatādinā // [220] //	ādyāḥ datta vipākena niruddha anāgata ādinā 
SA_T07_vabhdilu-515	dvitīyā tu vihīṇe(ne)	dvitīyā tu vihīṇene 
SA_T07_vabhdilu-516	na dhruvapākena karmaṇā /	na dhruva pākena karmaṇā 
SA_T07_vabhdilu-517	tṛtīyā dvayamuktasya caturthī tu dvayādṛte // [221] //	tṛtīyā dvaya muktasya caturthī tu dvayāt ṛte 
SA_T07_vabhdilu-518	ayuktavihitaṃ karma kleśopakleśadūṣitam /	ayukta vihitam karma kleśa upakleśa dūṣitam 
SA_T07_vabhdilu-519	śikṣāliṅgādyapetaṃ ca kecidāhurvipaścitaḥ // [222] //	śikṣā liṅga ādi apetam ca kecid āhuḥ vipaścitaḥ 
SA_T07_vabhdilu-520	abhidharmadīpe vibhāṣāprabhāyāṃ vṛttau caturthasyādhyāyasya tṛtīyaḥ pādaḥ //	abhidharmadīpe vibhāṣā prabhāyām vṛttau caturthasya adhyāyasya tṛtīyaḥ pādaḥ 
SA_T07_vabhdilu-521	caturthādhyāye caturthapādaḥ /	caturtha adhyāye caturtha pādaḥ 
SA_T07_vabhdilu-522	bodhisattvaḥ kuto yāvadavivartyamanā yataḥ /	bodhisattvaḥ kutas yāvat a vivartya manāḥ yatas 
SA_T07_vabhdilu-523	baghnāti bodhisannāhamaṅgīkṛtvā jagaddhitam // [223] //	baghnāti bodhi sannāham aṅgīkṛtvā jagat hitam 
SA_T07_vabhdilu-524	yadā lākṣaṇikaṃ karma prakarotyanapāyagaḥ /	yadā lākṣaṇikam karma prakaroti anapāya gaḥ 
SA_T07_vabhdilu-525	mahākulaḥ samagrākṣaḥ svaparṣatsaṃgrahe rataḥ // [224] //	mahā kulaḥ samagra akṣaḥ sva parṣad saṃgrahe rataḥ 
SA_T07_vabhdilu-526	pumāñjātismaro vāgmī prajñāvīryakriyānvitaḥ /	pumān jātismaraḥ vāgmī prajñā vīrya kriyā anvitaḥ 
SA_T07_vabhdilu-527	tadā devamanuṣyāṇāmabhivyaktiṃ nigacchati // [225] //	tadā deva manuṣyāṇām abhivyaktim nigacchati 
SA_T07_vabhdilu-528	sa hi tribhirasaṃkhyeyairdharmakāyaguṇārṇavam /	sa hi tribhiḥ asaṃkhyeyaiḥ dharmakāya guṇa arṇavam 
SA_T07_vabhdilu-529	pracinoti tadādhāraṃ kāyaṃ kalpaśatena tu // [226] //	pracinoti tad ādhāram kāyam kalpa śatena tu 
SA_T07_vabhdilu-530	dvātriṃśallakṣaṇopetamaśītivyañja nojjvalam /	dvātriṃśat lakṣaṇa upetam aśīti vyañja na ujjvalam 
SA_T07_vabhdilu-531	dviṣatāmapi yaṃ dṛṣṭvā manaḥ sadyaḥ prasīdati // [227] //	dviṣatām api yam dṛṣṭvā manaḥ sadyas prasīdati 
SA_T07_vabhdilu-532	yugāntavāyuṇā(nā)	yuga anta vāyu ṇa anā 
SA_T07_vabhdilu-533	meruḥ vahniṇā(nā)	meruḥ vahniṇānā 
SA_T07_vabhdilu-534	varuṇālayaḥ /	varuṇālayaḥ 
SA_T07_vabhdilu-535	vajreṇa dhvasyate vajramavikāri tu tanmanaḥ // [228] //	vajreṇa dhvasyate vajram avikāri tu tat manaḥ 
SA_T07_vabhdilu-536	kāmāptaṃ ṣaṣṭhajaṃ tredhā kṛpāśraddhāparamparam /	kāma āptam ṣaṣṭha jam tredhā kṛpā śraddhā paramparam 
SA_T07_vabhdilu-537	buddhotpāde naraḥ strī vā tadādyaṃ cittamaśnute // [229] //	buddha utpāde naraḥ strī vā tad ādyam cittam aśnute 
SA_T07_vabhdilu-538	sarvebhyaḥ sarvadā sarvaṃ vadato dānapūraṇam /	sarvebhyaḥ sarvadā sarvam vadataḥ dāna pūraṇam 
SA_T07_vabhdilu-539	maraṇe 'pi damātyāgaḥ śīlasyotkṛṣṭirucyate // [230] //	maraṇe dama atyāgaḥ śīlasya utkṛṣṭiḥ ucyate 
SA_T07_vabhdilu-540	vīryasya tiṣyasaṃstutyā dhiyo vajropamātparam /	vīryasya tiṣya saṃstutyā dhiyaḥ vajra upamāt param 
SA_T07_vabhdilu-541	`sarvāsāṃ tu kṣayajñāne paripūrirvidhīyate' // [231] //	sarvāsām tu kṣaya jñāne paripūriḥ vidhīyate 
SA_T07_vabhdilu-542	tripuṇyakṛtivastvādyāstallābhopāyadeśanāḥ /	tri puṇya kṛti vastu ādyāḥ tad lābha upāya deśanāḥ 
SA_T07_vabhdilu-543	tathā caturadhiṣṭhānaṃ saptasaddharmaśāsanam // [232] //	tathā catur adhiṣṭhānam sapta saddharma śāsanam 
SA_T07_vabhdilu-544	saptayogāstrayaḥskandhā striśikṣādyāśca deśitāḥ /	sapta yogāḥ trayaḥ skandhāḥ tri śikṣā ādyāḥ ca deśitāḥ 
SA_T07_vabhdilu-545	tathā pāramitāścāpi catasro vinayoditāḥ // [233] //	tathā pāramitāḥ ca api catasraḥ vinaya uditāḥ 
SA_T07_vabhdilu-546	bodhipakṣyāśca kaṇṭhoktāḥ saptatriṃśatsvayaṃbhuvā /	bodhi pakṣyāḥ ca kaṇṭha uktāḥ saptatriṃśat svayaṃbhuvā 
SA_T07_vabhdilu-547	hetavaḥ sarvabodhināṃ trividhā mṛdutādibhiḥ // [234] //	hetavaḥ sarva bodhinām trividhāḥ mṛdu tā ādibhiḥ 
SA_T07_vabhdilu-548	tasmānna bodhimārgo 'nyaḥ sūtrādipiṭakatrayāt /	tasmāt na bodhi mārgaḥ nyaḥ sūtra ādi piṭaka trayāt 
SA_T07_vabhdilu-549	ato 'vyamiha yo brūyātsa bhavenmārabhāṣitaḥ // [235] //	atas yaḥ brūyāt sa bhavet māra bhāṣitaḥ 
SA_T07_vabhdilu-550	kalpānāṃ mahatāmetadasaṃkhyeyatrayaṃ matam /	kalpānām mahatām etat asaṃkhyeya trayam matam 
SA_T07_vabhdilu-551	sthānāntaramasaṃkhyākhyamadaḥsaṃkhyopari sthitam // [236] //	sthāna antaram asaṃkhya ākhyam adaḥ saṃkhyā upari sthitam 
SA_T07_vabhdilu-552	apakarṣe jinotpattiryāvacchatasamāyuṣaḥ /	apakarṣe jina utpattiḥ yāvat śata sama āyuṣaḥ 
SA_T07_vabhdilu-553	dvayoḥ pratyekabuddhānāmutkarṣe cakravarti ṇā(nā)m // [237] //	dvayoḥ pratyekabuddhānām utkarṣe cakravarti ṇānām 
SA_T07_vabhdilu-554	nādho 'śītisahastrāsau (yo)	na adho śīti sahastrā asau 
SA_T07_vabhdilu-555	statsamutpattiriṣyate /	s tad samutpattiḥ iṣyate 
SA_T07_vabhdilu-556	te hemarūpyatāmrāyaścakrāḥ puṇyaprabhāvataḥ // [238] //	te hema rūpya tāmra ayaḥ cakrāḥ puṇya prabhāvataḥ 
SA_T07_vabhdilu-557	tulye 'pi sādhanopāye tadbhedo 'kṣādibhedataḥ /	tulye sādhana upāye kṣā ādi bhedataḥ 
SA_T07_vabhdilu-558	bhavamokṣārthinormātroḥ pradānaphalabhedavat // [239] //	bhava mokṣa arthinoḥ mātroḥ pradāna phala bheda vat 
SA_T07_vabhdilu-559	karuṇābhāvanodrekātsvasaṃviccittayostathā /	karuṇā bhāvanā udrekāt sva saṃvid cittayoḥ tathā 
SA_T07_vabhdilu-560	parasaṃvidgurostadvattadviśeṣo vidhīyate // [240] //	para saṃvid guroḥ tadvat tad viśeṣaḥ vidhīyate 
SA_T07_vabhdilu-561	hetutattvaphalodbhūtaṃ mahattvaṃ śāsitustridhā /	hetu tattva phala udbhūtam mahattvam śāsituḥ tridhā 
SA_T07_vabhdilu-562	vimuktāvapi tulyāyāṃ trayāṇāṃ bodhi lambhanāt // [241] //	vimuktau api tulyāyām trayāṇām bodhi lambhanāt 
SA_T07_vabhdilu-563	buddhasya saṃmukhīnasya bauddhamākṣipyate vapuḥ /	buddhasya saṃmukhīnasya bauddham ākṣipyate vapuḥ 
SA_T07_vabhdilu-564	saikapuṇyaśatodbhūtamekaikaṃ lakṣaṇaṃ muneḥ // [242] //	sa eka puṇya śata udbhūtam ekaikam lakṣaṇam muneḥ 
SA_T07_vabhdilu-565	yathākarmapathāstadvatpuṇyāditrayamiṣyate /	yathā karma pathāḥ tadvat puṇya ādi trayam iṣyate 
SA_T07_vabhdilu-566	dānaṃ hi dīyate yena svaparārthādyapekṣayā // [243] //	dānam hi dīyate yena sva para artha ādi apekṣayā 
SA_T07_vabhdilu-567	kāyādikarma tattattvamavijñaptiḥ kvacitpunaḥ /	kāya ādi karma tat tattvam avijñaptiḥ kvacid punar 
SA_T07_vabhdilu-568	prādhānyānmuninā proktaṃ mahābhogaphalaṃ hi tat // [244] //	prādhānyāt muninā proktam mahā bhoga phalam hi tat 
SA_T07_vabhdilu-569	svānyobhayārthasiddhyarthaṃ dānaṃ dadati kecana /	sva anya ubhaya artha siddhi artham dānam dadati kecana 
SA_T07_vabhdilu-570	sādhuvṛttyanuvṛtyarthaṃ nobhayārthāya cāpare // [245] //	sādhu vṛtti anuvṛti artham na ubhaya arthāya ca apare 
SA_T07_vabhdilu-571	dātṛvastvādivaiśiṣṭyāttatphalātiśayaḥ smṛtaḥ /	dātṛ vastu ādi vaiśiṣṭyāt tad phala atiśayaḥ smṛtaḥ 
SA_T07_vabhdilu-572	śraddhādibhirguṇairdātā datte 'taḥ satkriyādibhiḥ // [246] //	śraddhā ādibhiḥ guṇaiḥ dātā datte satkriyā ādibhiḥ 
SA_T07_vabhdilu-573	satkārādiguṇopetaṃ phalaṃ tasmādavāpnute /	satkāra ādi guṇa upetam phalam tasmāt avāpnute 
SA_T07_vabhdilu-574	vastu varṇādisaṃpannaṃ saurūpyādi phalapradam // [247] //	vastu varṇa ādi saṃpannam saurūpya ādi phala pradam 
SA_T07_vabhdilu-575	guṇaduḥkhopakārākhyarṃdharmaiḥ kṣetraṃ viśiṣyate /	guṇa duḥkha upakāra ākhya ṛṃ dharmaiḥ kṣetram viśiṣyate 
SA_T07_vabhdilu-576	āśayādi mṛdutvādermṛdutvādīni karmaṇaḥ // [248] //	āśaya ādi mṛdu tva ādeḥ mṛdu tva ādīni karmaṇaḥ 
SA_T07_vabhdilu-577	dharmadātre 'pi bālāya pitre mātre 'tha rogiṇe /	dharma dātre pi bālāya pitre mātre tha rogiṇe 
SA_T07_vabhdilu-578	ameyaṃ bodhisattvāya dānamanyabhavāya ca // [249] //	ameyam bodhisattvāya dānam anya bhavāya ca 
SA_T07_vabhdilu-579	bodhisattvasya yaddānna(na)	bodhisattvasya 
SA_T07_vabhdilu-580	manyasyāpi yadaṣṭamam /	manyasya api yat aṣṭamam 
SA_T07_vabhdilu-581	vipaścidbhistadākhyātaṃ śreṣṭhaṃ yaccārhato 'rhate // [250] //	vipaścidbhiḥ tat ākhyātam śreṣṭham yat ca arhataḥ rhate  /
SA_T07_vabhdilu-582	saṃpradhārya yadākṣiptaṃ pūraṇādidṛḍhīkṛtam /	saṃpradhārya yat ākṣiptam pūraṇa ādi dṛḍhīkṛtam 
SA_T07_vabhdilu-583	vigatapratipakṣaṃ ca tatkarmopacitaṃ matam // [251] //	vigata pratipakṣam ca tat karma upacitam matam 
SA_T07_vabhdilu-584	svasmāttyāgaguṇāpekṣāścaittāścaityārcatādiṣu /	svasmāt tyāga guṇa apekṣāḥ caittāḥ caityārcatā ādiṣu 
SA_T07_vabhdilu-585	vinā pratigṛhītrāpi phalaṃ maitrīvihāravat // [252] //	vinā pratigṛhītrā api phalam maitrī vihāra vat 
SA_T07_vabhdilu-586	dharmadānasvabhāvo vāktattvanāmādigocaraḥ /	              
SA_T07_vabhdilu-587	avyākṛtasvabhāvatvānna nāmādyannadānavat // [253] //	avyākṛta svabhāva tvāt na nāma ādi anna dāna vat 
SA_T07_vabhdilu-588	śīlaṃ śubhamayaṃ rūpaṃ vyākhyātaṃ tatprabhedataḥ /	śīlam śubha mayam rūpam vyākhyātam tad prabhedataḥ 
SA_T07_vabhdilu-589	śāstre tu tappradhā natvātproktaṃ svargopapattaye // [254] //	śāstre tu tad pradhā na tvāt proktam svarga upapattaye 
SA_T07_vabhdilu-590	dauḥśīlyāśubhamūlādyairdoṣairyanna vidūṣitam /	dauḥśīlya aśubha mūla ādyaiḥ doṣaiḥ yat na vidūṣitam 
SA_T07_vabhdilu-591	tadvipakṣaśamāṅgaṃ ca yattacchaddhamihocyate // [255] //	tad vipakṣa śama aṅgam ca yat tat chaddham iha ucyate 
SA_T07_vabhdilu-592	puṇyaṃ samāhitaṃ tvatra bhāvanā cittabhāvanāt /	puṇyam samāhitam tu atra bhāvanā citta bhāvanāt 
