segmentnr	original	analyzed
SA_XX_n2938u-0	ḍākārṇavaḥ I śṛṇu śṛṇu bodhiṁ prapañcagataṁ,	ḍākārṇavaḥ i śṛṇu śṛṇu bodhi prapañcagata 
SA_XX_n2938u-1	na kāmayamānamuttārakaṁ cittaṁ bhavati |	na kāmayamānam uttāraka citta bhavati 
SA_XX_n2938u-2	māyāsvabhāve'si tvaṁ,	māyā svabhāvā isi tva 
SA_XX_n2938u-3	tribhuvanasya sakalasya uttārako yathā |	tribhuvanasya sakalasya uttārakaḥ yathā 
SA_XX_n2938u-4	(p1-2) II iha hi na bhāvo'bhāvo na rāgo virāgaḥ saṁnasyatyatra punārajya |	iha hi na bhāvaḥ bhāvaḥ na rāgaḥ virāgaḥ 
SA_XX_n2938u-5	madhyasthite'tra dharme na rajya rajya vajre'bhinnadharme pramodasva ||	madhya sthita itra dharme na rajya rajya vajrebhinna dharme pramodasva 
SA_XX_n2938u-6	(p3-4) III dharmadharmau yatra astaṁ gatau tatra tvaṁ badhnāsi bodhau manaḥ |	dharmadharmau yatra asta gatau tatra tva badhnāsi bodhau manaḥ 
SA_XX_n2938u-7	siddhaḥ surāsuraḥ sa hi bhavati truṭyatyāyātigatī nijānām ||	siddhaḥ sura asuraḥ sa hi bhavati truṭyati āyāti gatī nijānām 
SA_XX_n2938u-8	(p5-6) IV prathamaṁ vairocano nātho nāṁbhisthito'dhoguṇayuktakaḥ |	vairocanaḥ 
SA_XX_n2938u-9	uttiṣṭhatu śvāso galaparyantaṁ ha tribhuvanadīpopamo yathā ||	uttiṣṭhatu śvāsaḥ gala paryanta ha tribhuvana dīpa upamaḥ yathā 
SA_XX_n2938u-10	anyamantraḥ sa-paro yathā,	anya mantraḥ sa paraḥ yathā 
SA_XX_n2938u-11	yāvat śaśī vāmagrāhaṇaḥ |	yāvat śaśī vāma grāhaṇaḥ 
SA_XX_n2938u-12	binduśobhano hi mantra itaro mantra iti bhaṇa janayati yoginīm ||	bindu śobhanaḥ hi mantraḥ itaraḥ mantraḥ iti bhaṇa janayati yoginīm 
SA_XX_n2938u-13	(p7-9) punardvayaṁ bhanitaṁ bhavati dhyānaṁ māraṇaṁ jīvanaṁ dānaṁ hi |	punardvaya bhanita bhavati dhyāna māraṇa jīvana dāna hi 
SA_XX_n2938u-14	pārśve dvau bindū sthitau,	pārśve dvau bindū sthitau 
SA_XX_n2938u-15	maste'thavā binduḥ (sthitaḥ)	binduḥ sthitaḥ 
SA_XX_n2938u-16	ya-varga-saṁsthitaṁ bījamantam |	bījam antam 
SA_XX_n2938u-17	vāhanaṁ mahābodhimārgasyedaṁ śūkarībījam |	vāhana mahā bodhi mārgasya idam śūkarī bījam 
SA_XX_n2938u-18	ā-kāra-karṇābharaṇaṁ ṣoḍaśakalārddhasthitaravyābharaṇam ||	ākāra karṇa ābharaṇa ṣoḍaśa kalā arddha sthita ravi ābharaṇam 
SA_XX_n2938u-19	(p10-11) ya-varga-prathamaṁ bījaṁ herambabhuvanaguṇayogi,	bīja heramba bhuvana guṇa yogi 
SA_XX_n2938u-20	trayodaśasvarabhūṣaṇaṁ śuklapakṣakakalā khalu |	khalu 
SA_XX_n2938u-21	tilasahitadīpyamānānandaścaturtho hi ||	tila sahita dīpyamāna ānandaḥ caturthaḥ hi 
SA_XX_n2938u-22	(p12-13) ya-sya vargasyāntaṁ hi sukharūpam u-svara-saṁrohaṇa- yuktakaṁ candrabinduḥ (tasya)	yasya sukha rūpam candra binduḥ tasya 
SA_XX_n2938u-23	śīrṣe lagno jvāla- yatu ca divasaṁ hi |	śīrṣe lagnaḥ jvāla yatu ca hi 
SA_XX_n2938u-24	sa-parākṣaram anāho ravyāsanasaṁsthitaṁ caturthasvaragrahaḥ karṇadeśo bhavatu,	sa para akṣaram caturtha svara grahaḥ karṇa deśaḥ bhavatu 
SA_XX_n2938u-25	kalārddhacandrabindunā bhūṣitaṁ mastakaṁ rāgasyāntaḥ svabhāvaḥ |	kalā arddhacandra bindunā bhūṣita mastaka rāgasya antaḥ svabhāvaḥ 
SA_XX_n2938u-26	(p14-15) jñānākṣaraṁ dviguṇitaṁ sambharadaharajātam |	          
SA_XX_n2938u-27	adhordhvasthitaṁ (bījam)	        
SA_XX_n2938u-28	nāthagrahaṇaṁ sambhogo hi |	nātha grahaṇa sambhogaḥ hi 
SA_XX_n2938u-29	dhanavidhinā yuktaṁ santrāṁsanībījam |	dhana vidhinā 
SA_XX_n2938u-30	phaṭ phaṭ antayiti punarapi bhaṇitavyam |	phaṭ phaṭ punar api bhaṇitavyam 
SA_XX_n2938u-31	dyutiṁ hi jvālaya ( sā dyutiḥ)	dyuti hi jvālaya sā dyutiḥ 
SA_XX_n2938u-32	purasya randhre vahatu |	purasya randhre vahatu 
SA_XX_n2938u-33	dyotasva caṇḍāvati pūraya tribhuvanam (tatra)	dyotasva caṇḍāvati pūraya tribhuvanam tatra 
SA_XX_n2938u-34	bodhicittaṁ bhavati |	bodhi citta bhavati 
SA_XX_n2938u-35	(p16-18) V ādisthitirvairocanaḥ svabhāvo dharmadhātuḥ kāryasya rūpaṁ hi |	ādi sthitiḥ vairocanaḥ svabhāvaḥ dharmadhātuḥ kāryasya hi 
SA_XX_n2938u-36	ta-(varga)- saṁsthitaṁ pañcamākṣaraṁ,	ta varga sa sthita pañcama akṣara 
SA_XX_n2938u-37	pañcamavargo nabhaso viśrayo yoginīrūpam |	           
SA_XX_n2938u-38	pa-(varga)- syāntaṁ bījam au-svarayuktakaṁ mohanāśanaṁ hi yoginīvṛndaṁ sphurati ca |	bījam hi yoginī vṛnda sphurati ca 
SA_XX_n2938u-39	tasya punarvargasya bījaṁ caturthaṁ tribhuvanaṁ vyāpnoti yoginīviśrayaḥ ||	tasya punarvargasya bīja caturtha tribhuvana vyāpnoti yoginī viśrayaḥ 
SA_XX_n2938u-40	(p19-21) prathamasya tṛtīyaṁ (bījam)	prathamasya tṛtīya bījam 
SA_XX_n2938u-41	ṣaḍgatinaṣṭakakāraṇaṁ tāyinīcakram |	tāyinīcakram 
SA_XX_n2938u-42	bodhibījaṁ ya-vargasyāntam |	bodhi bīja ya vargasya antam 
SA_XX_n2938u-43	pañcamasya prathamaṁ ( bījam)	pañcamasya prathama bījam 
SA_XX_n2938u-44	tathatāyā bījam i-svaro maste lagati,	tathatāyāḥ bījam isvaraḥ maste lagati 
SA_XX_n2938u-45	jalasyākṣaram sañcitaṁ sarvasya kāraṇabhāvaḥ |	jalasya akṣaram sañcita sarvasya kāraṇa bhāvaḥ 
SA_XX_n2938u-46	ca-vargasya madyasthitaṁ ( bījam)	cavargasya madya sthita bījam 
SA_XX_n2938u-47	gṛhītaṁ ravyāsayuktakaṁ jalitakarmaviśeṣam |	jalita karma viśeṣam 
SA_XX_n2938u-48	(p22-24) vārāhī-bījam a-kāraḥ karṇe lagatu tribhuvana-jñāna-svabhāvaprameyam |	      lagatu           
SA_XX_n2938u-49	agnika-bījaṁ dvitīyasvarayuktakaṁ saṁsārasya karmaṇaḥ svabhāvaḥ |	sa sārasya karmaṇaḥ svabhāvaḥ 
SA_XX_n2938u-50	sa-param (bījam)	saparam bījam 
SA_XX_n2938u-51	i-svarako lagati śīrṣe sadā brahmasvabhāvo dṛśyate |	isvarakaḥ lagati śīrṣe sadā brahma svabhāvaḥ dṛśyate 
SA_XX_n2938u-52	dvitīyasvaro grahitavyaḥ tāyinīrūpaṁ sattvottāraṇaṁ yathā |	dvitīya svaraḥ grahitavyaḥ yathā 
SA_XX_n2938u-53	(p25-26) ya- ( varga ) sthito ra-(kāraḥ)	ya varga sthitaḥ rakāraḥ 
SA_XX_n2938u-54	yuktaka-a-svaraḥ punerava i-(svara-yuktaḥ)	yuktaka a svaraḥ punar iravaḥ i svara yuktaḥ 
SA_XX_n2938u-55	dhātavastrayaḥ, (tena)	dhātavaḥ trayaḥ tena 
SA_XX_n2938u-56	sphurati yoginī |	sphurati yoginī 
SA_XX_n2938u-57	ṣaṣṭhasya vargasya prathamaṁ (bījam)	ṣaṣṭhasya vargasya prathama bījam 
SA_XX_n2938u-58	yoginīmantrasakalasvarūpam |	            
SA_XX_n2938u-59	ra-sthitam (bījam)	rasthitam bījam 
SA_XX_n2938u-60	a-svara-yuktaṁ marasya duṣṭasattvakāraṇaṁ bhavatu |	asvara yukta duṣṭa sattva kāraṇa bhavatu 
SA_XX_n2938u-61	ja-kāraḥ parigṛhya i-svaraṁ māyābhāvasaṁyuktaḥ |	jakāraḥ parigṛhya isvara māyā bhāva sa yuktaḥ 
SA_XX_n2938u-62	(p27-28) dantasya bījam e-svaroha lagati karṇe bhinnam uragamantro'daḥ (bījam) |	dantasya bījam lagati karṇe bhinnam uragamantrodaḥ bījam 
SA_XX_n2938u-63	o-kāraḥ khalu dhātuḥ sarvaḥ,	okāraḥ khalu dhātuḥ sarvaḥ 
SA_XX_n2938u-64	jñānaviśeṣamantraḥ |	jñāna viśeṣa mantraḥ 
SA_XX_n2938u-65	laśca yuktako lokasyādhāro bodheḥ kāraṇadharmaḥ |	laḥ ca yuktakaḥ lokasya ādhāraḥ bodheḥ kāraṇa dharmaḥ 
SA_XX_n2938u-66	ka-pūrvaṁ (bījam)	ka pūrva bījam 
SA_XX_n2938u-67	ya-āsanayuktakaṁ na khalu maraṇasvabhāvābhinnam |	na khalu maraṇa svabhāva abhinnam 
SA_XX_n2938u-68	(p29-31) pa-syā (vargasya)	pasyāḥ vargasya 
SA_XX_n2938u-69	ntaṁ svara-a-saṁsthitaṁ tribhuvana-ma-atisvarūpam |	          
SA_XX_n2938u-70	ta-akṣaram e-kāra-bhūṣitakaṁ sukhāvadhṛtam,	sukha avadhṛtam 
SA_XX_n2938u-71	punaḥ pa-syāntaṁ madhyaṁ sahajasvarūmapramāṇam |	punar 
SA_XX_n2938u-72	sa-param (tatra)	saparam tatra 
SA_XX_n2938u-73	ī-(kāraḥ)	īkāraḥ 
SA_XX_n2938u-74	ca-yuktakaḥ vajrasattvānāśajñānam |	          
SA_XX_n2938u-75	i-svara-yuktakaṁ ya-vargasyāntam (tena)	i svara yuktaka ya vargasya antam tena 
SA_XX_n2938u-76	vinaṣṭakam ajñānasvarūpam |	vinaṣṭakam ajñāna svarūpam 
SA_XX_n2938u-77	(p32-33) tye-mantro dharmasvabhāvo vyāpnoti sakalasvabhāvam |	dharma svabhāvaḥ vyāpnoti sakala svabhāvam 
SA_XX_n2938u-78	sa-kāro vahati randhrāt |	sakāraḥ vahati randhrāt 
SA_XX_n2938u-79	vahana-bījaṁ raviyuktakaṁ makarandasvabhāvamantraḥ |	             
SA_XX_n2938u-80	pa-(varga)- caturthasthitakaṁ (bījam)	       
SA_XX_n2938u-81	svara'ū'-kārāsanaṁ hi bhayasya naṣṭakañca |	hi bhayasya 
SA_XX_n2938u-82	ta-mantro nāśayati śatrum,	tamantraḥ nāśayati śatrum 
SA_XX_n2938u-83	punaḥ pa-(varga)	punar pavarga 
SA_XX_n2938u-84	-sya caturthaṁ (bījam)	sya caturtha bījam 
SA_XX_n2938u-85	mahat ravaravāyate |	mahat ravaravāyate 
SA_XX_n2938u-86	(p34-35) pavanasya bījam ā-kāreṇa saha lagutu,	pavanasya bījam ākāreṇa saha lagutu 
SA_XX_n2938u-87	mantra iva maṇiḥ |	mantraḥ iva maṇiḥ 
SA_XX_n2938u-88	apyaṁ (bījam)	apya bījam 
SA_XX_n2938u-89	karṇe gṛhītaṁ māyārūpam |	karṇe gṛhīta māyā rūpam 
SA_XX_n2938u-90	sa-param e-kāra- yuktakaṁ hetustribhuvanabhrānte |	sa param ekāra yuktaka hetuḥ tribhuvana bhrānte 
SA_XX_n2938u-91	pa-(varga)-syāntaṁ hi (bījam)	pavargasya anta hi bījam 
SA_XX_n2938u-92	majjāsvarūpam,	majjā svarūpam 
SA_XX_n2938u-93	sa-param a-kāra-yuktañca vismitadharmaḥ |	vismita dharmaḥ 
SA_XX_n2938u-94	(p36-37) ya-vargasyāntaṁ hi padmākṣarabījam |	ya vargasya anta hi padma akṣara bījam 
SA_XX_n2938u-95	ca-vargasya madhyabījaṁ ra-(kāra)	cavargasya madhya bīja rakāra 
SA_XX_n2938u-96	-sya mastasthitam e-kārastasya pare lagatu,	sya ma sta sthitam ekāraḥ tasya pare lagatu 
SA_XX_n2938u-97	devasyāsurasya svabhāvaḥ |	devasya asurasya svabhāvaḥ 
SA_XX_n2938u-98	evaṁ mantraṣaṭpadaṁ hi yoginīvṛndañca sarvakarmasvarūpaṁ cakram |	eva hi cakram 
SA_XX_n2938u-99	(p38) VI ya-vargasyāntaṁ hi (bījam)	vi ya vargasya anta hi bījam 
SA_XX_n2938u-100	bodhi-svabhāvaḥ,	bodhi svabhāvaḥ 
SA_XX_n2938u-101	dvijihvārekhāyuktañca ā-svara-patitvaṁ yoginīmantraḥ |	dvi jihvā rekhā yuktaḥ ca yoginī mantraḥ 
SA_XX_n2938u-102	sa-āsthitam (bījam) acalakā |	bījam acalakā 
SA_XX_n2938u-103	na-(kāraḥ) e-(kāraḥ)	nakāraḥ ekāraḥ 
SA_XX_n2938u-104	- yukto hi sattvānyanimittam |	yuktaḥ hi sattvāni animittam 
SA_XX_n2938u-105	ādhisthitaḥ svaraḥ prathamaguṇanāthaḥ,	ādhi sthitaḥ svaraḥ prathama guṇa nāthaḥ 
SA_XX_n2938u-106	dvijihvā i-svaro maste lagatu,	dvi jihvāḥ i svaraḥ maste lagatu 
SA_XX_n2938u-107	tribhuvanadhātusvarūpañca |	tribhuvana dhātu svarūpam ca 
SA_XX_n2938u-108	(p39-40) ta-(kāraḥ) e-(kāreṇa)	takāraḥ ekāreṇa 
SA_XX_n2938u-109	saha yukto hi |	saha yuktaḥ hi 
SA_XX_n2938u-110	pañcamavargaprathamaṁ (bījam)	pañcama varga prathama bījam 
SA_XX_n2938u-111	yoginītattvasvarūpaṁ hi |	hi 
SA_XX_n2938u-112	ya-(varga)-sya caturthasthitabījaṁ sakalasya nārī-svabhāvaḥ |	nārī svabhāvaḥ 
SA_XX_n2938u-113	aṣṭamasya (vargasya)	aṣṭamasya vargasya 
SA_XX_n2938u-114	prathamaṁ (bījam)	prathama bījam 
SA_XX_n2938u-115	śūnyasya bhūṣitañca śukradhātavaśca |	śūnyasya bhūṣitam ca śukra dhātavaḥ ca 
SA_XX_n2938u-116	dvitīyavargasthitaṁ prathamaṁ (bījam)	dvitīya varga sthita prathama bījam 
SA_XX_n2938u-117	kaṅkālabindusthitam |	kaṅkāla bindu sthitam 
SA_XX_n2938u-118	(p41) ya-vargasya dvitīyaṁ bījam i-svara-yuktañca vajrasyāgnisthito nāthaḥ |	bījam isvara yuktam ca vajrasya agni sthitaḥ nāthaḥ 
SA_XX_n2938u-119	ta-syāntam (bījam)	tasya antam bījam 
SA_XX_n2938u-120	e-kārābharaṇaṁ yoni-sumaṇḍitañca |	eka āra ābharaṇa yoni su maṇḍitam ca 
SA_XX_n2938u-121	(p42) ta- (kāraḥ) ravi-yuktaśca jvarasya dhvaṁsarājaḥ |	ta kāraḥ ravi yuktaḥ ca jvarasya dhvasarājaḥ 
SA_XX_n2938u-122	bha-(kāraḥ) raviyuktaśca e-kāra-maṇḍitaśca nābheḥ kuṇḍe sthitaḥ |	bhakāraḥ ravi yuktaḥ ca ekāra maṇḍitaḥ ca nābheḥ kuṇḍe sthitaḥ 
SA_XX_n2938u-123	(p43) pa-syāntaṁ hi (bījam)	hi bījam 
SA_XX_n2938u-124	marmarūpam,	marma rūpam 
SA_XX_n2938u-125	ṭa-syāntaṁ hi (bījam)	ṭasya anta hi bījam 
SA_XX_n2938u-126	karṣaṇabhāvaśca i-maṇḍitañca |	karṣaṇa bhāvaḥ ca imaṇḍitam ca 
SA_XX_n2938u-127	viśoṣaṇīyamantro yathā caturānanda-svarūpaṁ mahānidhi-bījam |	viśoṣaṇīya mantraḥ yathā catur ānanda svarūpa mahā nidhi bījam 
SA_XX_n2938u-128	ravi-(bījam) o-kāra-bhūṣitakaṁ ruṣṭi-nāḍī-svabhāvo hi |	ravi bījam ruṣṭināḍī svabhāvaḥ hi 
SA_XX_n2938u-129	śa-(varga)-sya dvitīyaṁ bījaṁ hṛdayasya rūpam |	śavargasya dvitīya bīja hṛdayasya rūpam 
SA_XX_n2938u-130	(p44-45) ṇi-kāraḥ svarūpeṇa gṛhītaśca yoginītattvasvarūpam |	ṇikāraḥ sva rūpeṇa gṛhītaḥ ca yoginī tattva svarūpam 
SA_XX_n2938u-131	ka-ra-a-saṁyogaṁ hi akṣaraṁ dūranāḍīrasasya bhāvohi |	kara asa yoga hi akṣara dūra nāḍī rasasya 
SA_XX_n2938u-132	ta-(sya) pa- (sya)	tasya pa sya 
SA_XX_n2938u-133	madhyasthitañca (bījam)	madhya sthitam ca bījam 
SA_XX_n2938u-134	gṛhītvā yoginīvṛndakam aṣṭapadaṁ sādhanāyā eva rūpam |	gṛhītvā yoginī vṛndakam aṣṭapada sādhanāyāḥ eva rūpam 
SA_XX_n2938u-135	ta-(varga)- syāntam i-kāra-bhūṣitañca kapālasya madhyanāḍīrūpam |	tavarga sya antam ikāra bhūṣitam ca kapālasya madhyanāḍī rūpam 
SA_XX_n2938u-136	(p46-47) ka-(akṣaram)	ka akṣaram 
SA_XX_n2938u-137	gṛhītañca karma kṣayati tacca |	gṛhītam ca karma kṣayati tat ca 
SA_XX_n2938u-138	ra-(akṣaram) a-kāra-gṛhītaṁ (tena)	ra akṣaram akāra gṛhīta tena 
SA_XX_n2938u-139	śiraso madhyāt mahārāvo mujyaḥ |	śirasaḥ madhyāt mahā rāvaḥ mujyaḥ 
SA_XX_n2938u-140	pārthiva-bījam i-kāra-yuktaṁ hi trikoṇasya madhye (tiṣṭhati) |	pārthiva bījam hi trikoṇasya madhye tiṣṭhati 
SA_XX_n2938u-141	ta-(varga)-syāntaṁ hi (bījam)	tavargasya anta hi bījam 
SA_XX_n2938u-142	nirmāṇādha-ūrddhva (tiṣṭhati)	tiṣṭhati 
SA_XX_n2938u-143	i-(kāra)	ikāra 
SA_XX_n2938u-144	- bhūṣitañca |	bhūṣitañca 
SA_XX_n2938u-145	(p48-49) ta-(akṣara)-ra- (akṣara)	ta akṣara ra akṣara 
SA_XX_n2938u-146	-a-(akṣara)	a akṣara 
SA_XX_n2938u-147	-saṁyogaṁ hi bījaṁ dharmadhātustrikoṇañca tribhuvanotpattiḥ |	dharmadhātuḥ trikoṇam ca tribhuvana utpattiḥ 
SA_XX_n2938u-148	sa-(akṣaram) gṛhītaṁ hi madhyamaṁ sahaśukram |	saakṣaram gṛhīta hi madhyama sahaśukram 
SA_XX_n2938u-149	na-(kāra)-i- (kāra)	nakāraiḥ kāra 
SA_XX_n2938u-150	- yukto hi jñānasya bhāvaḥ |	yuktaḥ hi jñānasya bhāvaḥ 
SA_XX_n2938u-151	pa-(varga)-syāntaṁ hi (bījam)	pavargasya anta hi bījam 
SA_XX_n2938u-152	a-(kāra)	akāra 
SA_XX_n2938u-153	- bhūṣitañca māyānābhīpadmam |	bhūṣitam ca māyā nābhī padmam 
SA_XX_n2938u-154	(p 50) raviḥ ya-sthitaśca karṇa-svabhāvaḥ |	raviḥ karṇa svabhāvaḥ 
SA_XX_n2938u-155	ṭa-(varga)-syāntaṁ bījaṁ i-yuktañca,	ṭavargasya ante bīje i y u ktaḥ ca 
SA_XX_n2938u-156	nikhilābhinnasattvaṁ gṛhṇāti nāthaḥ |	nikhila abhinna sattva gṛhṇāti nāthaḥ 
SA_XX_n2938u-157	evaṁ daśapadamantraḥ caturyugasya pramāthī sarvaḥ |	eva daśa pada mantraḥ caturyugasya pramāthī sarvaḥ 
SA_XX_n2938u-158	(p 51-52) pa-pūrvaṁ hi ravyāsanakaṁ prathamadharmaḥ |	papūrva hi ravyāsanaka prathama dharmaḥ 
SA_XX_n2938u-159	tasya caturthasthitañca (bījam)	tasya caturtha sthitam ca bījam 
SA_XX_n2938u-160	e-kāra-karṇābharaṇaṁ yoginīmantraḥ |	ekāra karṇa ābharaṇa yoginī mantraḥ 
SA_XX_n2938u-161	ta-(varga)- madhyasthitañca (bījam)	bījam 
SA_XX_n2938u-162	, (tena)	tena 
SA_XX_n2938u-163	dayitāmarthaḥ |	dayitām arthaḥ 
SA_XX_n2938u-164	na-(kāraḥ) i-saṁyogo hi nirmāthī viśvasya |	nakāraḥ hi nirmāthī viśvasya 
SA_XX_n2938u-165	(p 53) pa-(kāraḥ) prapañca-sahitaśca ra-kāra i-sahito yoginī-cakravān |	pakāraḥ prapañca sahitaḥ ca rakāraḥ i sahitaḥ yoginīcakravān 
SA_XX_n2938u-166	ca-madhyaṁ (bījam)	camadhya bījam 
SA_XX_n2938u-167	gṛhītañca ja-(akṣaram)	gṛhītam ca ja akṣaram 
SA_XX_n2938u-168	yathārūpam |	yathārūpam 
SA_XX_n2938u-169	pavana-saṁsthitam e-(kāra)	pavanasa sthitam ekāra 
SA_XX_n2938u-170	- saṁyuktam ahaṅkāra-svabhāvaḥ |	sayuktam ahaṅkāra svabhāvaḥ 
SA_XX_n2938u-171	ya-vargasyāntamiti tṛtīyasvareṇa śirasi bhūṣitañca viśvasya mantrasya jñāna-svarūpam |	ya vargasya antam iti tṛtīya svareṇa śirasi bhūṣitam ca viśvasya mantrasya jñāna svarūpam 
SA_XX_n2938u-172	(p 54-55) ja-bījam ujjvalarūpamantraḥ |	            
SA_XX_n2938u-173	ya-varṇaḥ (tatra)	ya varṇaḥ tatra 
SA_XX_n2938u-174	e-(kāra)	ekāra 
SA_XX_n2938u-175	-sya yogaḥ sarvayānasya dṛṣṭāntaḥ |	sya yogaḥ sarva yānasya dṛṣṭāntaḥ 
SA_XX_n2938u-176	ca-vargasya tṛtīyaṁ bījaṁ ja-(akṣaram)	cavargasya tṛtīya bīja ja akṣaram 
SA_XX_n2938u-177	tādṛśayoginīrūpasambodhaḥ |	tādṛśa yoginī rūpa sambodhaḥ 
SA_XX_n2938u-178	pa-(varga)-syāntaṁ (bījam)	pavargasya antaḥ bījam 
SA_XX_n2938u-179	(tasya vargasya)	tasya vargasya 
SA_XX_n2938u-180	caturthasthitāsanaṁ guravaḥ sakalasya (mantrasya) |	guravaḥ sakalasya mantrasya 
SA_XX_n2938u-181	(p 56-57) ta-mantrastṛtīyasvarayogaśca niḥśeṣabodhanarūpam |	              
SA_XX_n2938u-182	uṣmaṇastṛtīyam (akṣaram)	uṣmaṇaḥ tṛtīyam akṣaram 
SA_XX_n2938u-183	ta-āsanaṁ hi tārayati sajaḍalokam |	hi tārayati sa jaḍa lokam 
SA_XX_n2938u-184	sta-(bījam) gṛhītañca bhuvaścaturddaśakarūpam |	gṛhītam ca bhuvaḥ caturddaśaka rūpam 
SA_XX_n2938u-185	ni-mantro yoginīsaṅketakaḥ |	nimantraḥ yoginīsaṅketakaḥ 
SA_XX_n2938u-186	(p 58) pa-(varga)-syāntam (bījam)	p pavargasya antam bījam 
SA_XX_n2938u-187	i-kāro muṇḍe lagatu mokṣarūpam ajñānasya viśvasya |	ikāraḥ muṇḍe lagatu mokṣa rūpam ajñānasya viśvasya 
SA_XX_n2938u-188	sa-paraṁ (bījam)	sapara bījam 
SA_XX_n2938u-189	vajrasattvasvabhāvaśca |	vajra sattva svabhāvaḥ ca 
SA_XX_n2938u-190	(p 59) ni-kāro dharmādharmaniṣedhaśca |	nikāraḥ dharma adharma niṣedhaḥ ca 
SA_XX_n2938u-191	ya-vargasyāntaṁ (bījam)	ya vargasya antaḥ bījam 
SA_XX_n2938u-192	yoginyambararūpam |	yoginī ambara rūpam 
SA_XX_n2938u-193	ja-(kāraḥ) ra-āsanavān udayati śukrasvabhāvaḥ |	jakāraḥ raāsanavān udayati śukra svabhāvaḥ 
SA_XX_n2938u-194	(p 60) punaḥ pavanasyāntaṁ hi a-kāraḥ ojojāto brahmaṇo rūpaṁ padmañca |	punar pavanasya anta hi akāraḥ ojaḥ jātaḥ brahmaṇaḥ 
SA_XX_n2938u-195	raviḥ a-yogohi akṣaya-svabhāvaḥ |	raviḥ ayogohī akṣaya svabhāvaḥ 
SA_XX_n2938u-196	sa-paraṁ (bījam)	sapara bījam 
SA_XX_n2938u-197	tṛtīyasvaraśiraḥsaṁsthitaṁ yoginyāḥ sakalāyā āvahati rūpam |	yoginyāḥ sakalāyāḥ āvahati rūpam 
SA_XX_n2938u-198	ma-kāro hi madhyatattvasya rūpam |	makāraḥ hi madhya tattvasya rūpam 
SA_XX_n2938u-199	sa-param a-kāra-bhaṇitaṁ yoginīrūpamukham uccārayati |	yoginī rūpa mukham uccārayati 
SA_XX_n2938u-200	(p 61-62) pa-varṇa o-(kāra)	p pa varṇaḥ okāra 
SA_XX_n2938u-201	-mukuṭa-maṇḍitaśca sahajarūpakasvabhāvo hi |	mukuṭa maṇḍitaḥ ca sahaja rūpaka svabhāvaḥ hi 
SA_XX_n2938u-202	ka-(varga)-madhya-sthitañca (bījam)	kavarga madhya sthitam ca bījam 
SA_XX_n2938u-203	tṛtīyasvaraḥ (tasya)	tṛtīya svaraḥ tasya 
SA_XX_n2938u-204	śiraso bhūṣitañca tattvaketarasvarūpam |	śirasaḥ bhūṣitam ca tattvaka itara svarūpam 
SA_XX_n2938u-205	gi-kāro niḥsvabhāvasya jñānam |	gikāraḥ niḥsvabhāvasya jñānam 
SA_XX_n2938u-206	dvitīya-varga-prathamam (bījam)	dvitīya varga prathamam bījam 
SA_XX_n2938u-207	a-kāra-dyotitaṁ kāmakadhātuḥ |	akāra dyotita kāmaka dhātuḥ 
SA_XX_n2938u-208	(63-64) pa-vargasyāntaṁ hi e-yuktaṁ sakalasya māyāsvabhāvaḥ |	pavargasya anta hi sakalasya māyā svabhāvaḥ 
SA_XX_n2938u-209	antaḥstha-bījasyāntañca pa-vargasyāntaṁ hi āsanaṁ śukravāyvabhinnam |	antar stha bījasya antaḥ ca śukra vāyu abhinnam 
SA_XX_n2938u-210	pāvakasya bījam i-(kāreṇa)	pāvakasya bījam ikāreṇa 
SA_XX_n2938u-211	jaṭitañca sidhyanmāyāvad rūpañca |	jaṭitam ca sidhyat māyāvat rūpam ca 
SA_XX_n2938u-212	ka-(varga)-dvitīyabījam ākāśayoginī-vimbam |	           
SA_XX_n2938u-213	(65) tasya pārśva-bījam e-kāra-karṇābharaṇaṁ sañcalamekalam |	tasya pārśva bījam ekāra karṇa ābharaṇa sañcalam ekalam 
SA_XX_n2938u-214	evaṁ cakraṁ gagana-svabhāvaḥ |	eva cakra gagana svabhāvaḥ 
SA_XX_n2938u-215	navapadamiti yoginīvṛndasya akṣarakaṁ mantra-svarūpaṁ traidhātukam |	nava padam iti yoginī vṛndasya akṣaraka mantra svarūpa traidhātukam 
SA_XX_n2938u-216	(66) VIII ta-mantro hi dvisaṁyogaḥ pa-sthiti agni-pavana-bījaṁ mahāsukha-rāgaḥ |	hi 
SA_XX_n2938u-217	tasya ( pa-vargasya)	tasya pavargasya 
SA_XX_n2938u-218	dvitīya-bījam akāra-pūritaṁ mahācaturdhātusvarūpakaṁ hi |	dvitīya bījam hi 
SA_XX_n2938u-219	pa-(akṣaram) ra-(akṣaram)	pa akṣaram ra akṣaram 
SA_XX_n2938u-220	o-(akṣaram)	o akṣaram 
SA_XX_n2938u-221	ca yogaṁ hi akṣaraṁ pavana-svabhāvastrīṇi |	ca yoga hi akṣara pavana svabhāva strīṇi 
SA_XX_n2938u-222	(67-68) ta- (akṣaram) ca aṁ-yutaṁ punarvijñānasya bījam |	ta akṣaram ca ayuta punarvijñānasya bījam 
SA_XX_n2938u-223	ka-madhyasthitam (bījam)	kamadhya sthitam bījam 
SA_XX_n2938u-224	e-(kāra)	ekāra 
SA_XX_n2938u-225	- karṇābharaṇaṁ hi yoginī-mudrā-svarūpam |	yoginī mudrā svarūpam 
SA_XX_n2938u-226	punarapi bhaṇitavyaṁ padamiti upāyābhinnam |	punar api padam iti upāya abhinnam 
SA_XX_n2938u-227	(69) sa-paro na mantraḥ punarapi bhaṇitam (padam)	na mantraḥ punar api bhaṇitam padam 
SA_XX_n2938u-228	utpattisaṁhārayoḥ rūpam |	utpatti sahārayoḥ rūpam 
SA_XX_n2938u-229	pa-ra-a-eka-bījaṁ paramārthaḥ |	       
SA_XX_n2938u-230	ṭa-syāntaṁ hi (bījam)	ṭasya anta hi bījam 
SA_XX_n2938u-231	ā-yuktañca ahanakata utpattiḥ |	āyuktaḥ ca ahanakataḥ utpattiḥ 
SA_XX_n2938u-232	(70) ta-syāntaṁ hi (bījam)	hi bījam 
SA_XX_n2938u-233	pramardayati sarvam |	pramardayati sarvam 
SA_XX_n2938u-234	kā-ka-na-sthitaśca tṛtīyasvarastṛtīye bhavati,	kākana sthitaḥ ca tṛtīya svaraḥ tṛtīye bhavati 
SA_XX_n2938u-235	bindukitaḥ,	bindu k itaḥ 
SA_XX_n2938u-236	yoginīsarvasambodhanam |	yoginī sarva sambodhanam 
SA_XX_n2938u-237	tathā kha-kha-(akṣaram)	tathā kha kha akṣaram 
SA_XX_n2938u-238	na-(akṣaram)	na akṣaram 
SA_XX_n2938u-239	tṛtīyasthitañca,	tṛtīya sthitam ca 
SA_XX_n2938u-240	tṛtīyasvarastatra na bhavati,	tṛtīya svaraḥ tatra na bhavati 
SA_XX_n2938u-241	khedot-kṣiptakarūpam |	        
SA_XX_n2938u-242	punaśca mantrapadaṁ dvirbhaṇitavyaṁ sakalavitarkanaṣṭakañca |	punar ca mantra pada dvis bhaṇitavya sakala vitarka naṣṭakam ca 
SA_XX_n2938u-243	(71-72) ya-varṇo mantro hi vajrarandhrasya śobhā |	yavarṇaḥ mantraḥ hi vajra randhrasya śobhā 
SA_XX_n2938u-244	ca-madhyasthitaṁ bījaṁ ravyāsanasaṁsthitaṁ kārayati mohanāśam |	kārayati moha nāśam 
SA_XX_n2938u-245	sa-param (bījam)	saparam bījam 
SA_XX_n2938u-246	anāhatamadhyam |	anāhata madhyam 
SA_XX_n2938u-247	śa-vargasya tṛtīyaṁ (bījam)	śavargasya tṛtīya bījam 
SA_XX_n2938u-248	ha-āsanasthitam e-kāra-karṇābharaṇaṁ ḍākinī-mantraśca avarodhanaṁ sarva iti |	ḍākinī mantraḥ ca iti 
SA_XX_n2938u-249	(73) śoṣaya-mantrapadaṁ dvirbhaṇitavyaṁ jñānyahaṅkāra-naṣṭakañca bodhanābodhana-tattvam |	bodhana abodhana tattvam 
SA_XX_n2938u-250	evaṁ dvādaśapadaṁ hi bhūmeḥ (svarūpam)	eva hi bhūmeḥ svarūpam 
SA_XX_n2938u-251	yogikarmasvarūpam |	         
SA_XX_n2938u-252	IX (74-75) ka-varga-dvitīya-bījaṁ yoginījana-tattvam |	kavarga dvitīya bīja yoginī jana tattvam 
SA_XX_n2938u-253	ṭa-(akṣaram) gṛhītaṁ pa-syāntamāsanam aṁ-svara-mukuṭa-maṇḍitañca,	ṭa akṣaram a svara mukuṭa maṇḍitam ca 
SA_XX_n2938u-254	a-kāreṇa pūrttakaṁ tasya (mantrasya)	akāreṇa tasya mantrasya 
SA_XX_n2938u-255	, ṣaḍgateḥ svabhāvakaśca |	ṣaṣ gateḥ svabhāvakaḥ ca 
SA_XX_n2938u-256	ka-madhyasthitaṁ bījam,	kamadhya sthita bījam 
SA_XX_n2938u-257	(tena bījena)	tena bījena 
SA_XX_n2938u-258	viṣeṇa bhavatyālagno hi antaḥ |	viṣeṇa bhavati ālagnaḥ hi antaḥ 
SA_XX_n2938u-259	ka-bījañca śūnya-svarūpam |	ka bījam ca śūnya svarūpam 
SA_XX_n2938u-260	(76) ra-syāntakam a-kāra-pūrttakañca agnijvāleśānakam |	rasya antakam akāra pūrttakam ca agni jvālā īśānakam 
SA_XX_n2938u-261	dharāyā bījam (tena)	dharāyāḥ bījam tena 
SA_XX_n2938u-262	calati mahāprabhuḥ |	calati mahā prabhuḥ 
SA_XX_n2938u-263	ta-(varga)- caturthasthitañca (bījam)	bījam 
SA_XX_n2938u-264	a-svareṇa bhūṣitañca bhava-rahita-rūpam |	a svareṇa bhūṣitam ca bhava rahita rūpam 
SA_XX_n2938u-265	raviḥ i-saṁyogo hi vetālaḥ |	raviḥ isa yogaḥ hi vetālaḥ 
SA_XX_n2938u-266	ṭa-syāntaṁ hi gṛhītaṁ bījaṁ tṛtīya-svareṇa śirasi bhūṣitañca (tatprabhāveṇa)	śirasi tad prabhāveṇa 
SA_XX_n2938u-267	mriyate tribhuvanaṁ sarvam |	mriyate tribhuvana sarvam 
SA_XX_n2938u-268	(77-78) pa-syāntaṁ hi bījam (tena)	pasyānta hi bījam tena 
SA_XX_n2938u-269	mano nirjñātaṁ kṛtañca sa-param a-kāra-vacoyuktam (tena)	manaḥ akāra vacaḥ yuktam tena 
